id,body,author,created_utc,score,subreddit,parent_id,is_submitter,distinguished
n7ssv6p,">If you're stuck on what to build - thats kinda a warning sign tbh. You should want to build SOMETHING.I don't see why. Been a full time dev for 8 years. Never wrote a single line of code outside of work or education. There has never been a project simple enough that I could do alone in a reasonable time, that hasn't already been done better by other people. Building something useless just to have a portfolio project would have felt like a massive waste of time. Thankfully my first employer just asked for examples of code I wrote in college, and after that it didn't matter.",Dissentient,2025-08-09 16:39:02,6,learnprogramming,t3_1mlmi7k,False,
n7rxjtr,"Languages are just tools meanwhile, beginners treating them like Hogwarts houses. :grinning_squinting_face:",Significant_Loss_541,2025-08-09 13:45:03,6,learnprogramming,t3_1mlmi7k,False,
n7ryzvl,"Very helpful! Been teaching myself to code in my limited spare time ( new little human takes up most of my time) I got caught up for a week on what language to learn and then I just said f*ck it and jumped into Java… wasn’t easy but wasn’t super difficult either I did a Codecademy course which was helpful once I finished that I jumped into Kotlin which has tons of similarities and I’ve been learn that for a few weeks now! I find the more you do it and the more time you can focus on it the easier it gets! I’m no computer wiz, I work on German cars for my day job and always have had a passion for tech so I figured why not try it maybe make a few bucks on the side or even make a career out of it",PossibleProgress3316,2025-08-09 13:53:53,5,learnprogramming,t3_1mlmi7k,False,
n7rapic,Thank you for taking the time to post this. It was really helpful.Something else I need to know is what's your stance on using AI to code? Should I generate code blocks and then edit/debug them? Will this affect my learning?Should I wait till I'm done learning the basics before using AI?,rabeeaman,2025-08-09 10:59:19,8,learnprogramming,t3_1mlmi7k,False,
n7673tt,"Welcome to your career.  90% of a working programmer’s time is spent in already-existing codebases, carefully making changes to code that is already working in production, which is the result of dozens or hundreds of previous changes.You probably thought software engineering was about writing code.  It’s not.  It is about READING code, and then making careful edits.Do it well and some day it will be your turn to design the system of rules and constraints that an intern will be cursing at.",SubstantialListen921,2025-08-06 03:51:24,276,learnprogramming,t3_1miti30,False,
n760taa,When dealing with something new for the first time? Yes. Then the second time you're faster. The third time you figure out that you were doing it completely wrong the first two times and now things make more sense. The fourth time you don't even think about it and it'll be done faster than using HTML and CSS.,jebailey,2025-08-06 03:09:23,366,learnprogramming,t3_1miti30,False,
n760931,Sounds about right or at least its the same shit I go through. Probably someone knows how to deal with this no problem and will show themselves here soon enough.,Fun_Focus2038,2025-08-06 03:05:49,21,learnprogramming,t3_1miti30,False,
n761tj6,"> Honestly, if I could've just coded it in bare HTML/CSS/JS, it probably would've taken 30 minutes at max.How much easier will it be to do similar things *in the future*?How much easier will it be to maintain things if it's *consistent* with the rest of the repo?",binarycow,2025-08-06 03:15:51,19,learnprogramming,t3_1miti30,False,
n760c6h,"Spending half a day doing something is totally fine, especially if you're dealing with a new library and styling you're unfamiliar with. If you're feeling really unsure, ask your boss or your mentor, they should be able to tell you how they feel about the work you've done and if it's adequate",punpun1000,2025-08-06 03:06:23,17,learnprogramming,t3_1miti30,False,
n76fz3u,"Protip from someone high enough in his career to have interns:We give you work to cut your teeth on. It's okay to take your time, learn what you don't know, or even ask for help. I'd expect an intern to take most of the day to solve a problem like you're describing. The point is the learning experience. This is what it's like to work on a corporate system, this is what sort of libraries we use (which you can now put on your resume for yourself), this is what it fees like to see your name in the git repo and to have your fixes in production for other people to use and be happy with. :)",Chaseshaw,2025-08-06 04:56:12,12,learnprogramming,t3_1miti30,False,
n761573,Yes. Welcome to the party pal!,Basic-Tonight6006,2025-08-06 03:11:29,11,learnprogramming,t3_1miti30,False,
n761ofq,"every day is a new adventure. you are an investigator at some crime scene. Unless you work with the team every day and know the project they're working on it will pretty much be like this, and even so.. yah, pretty much like this anyway lol. at least sometimes you can talk to the person that wrote the area of code before so you can ask 'what were you thinking' .",cyrixlord,2025-08-06 03:14:58,9,learnprogramming,t3_1miti30,False,
n7601v6,Leon: Always like this,Deflator_Mouse7,2025-08-06 03:04:32,8,learnprogramming,t3_1miti30,False,
n76bqcv,Half a day is nothing. You can inherit legacy code you have to struggle with for months,Alternative_Driver60,2025-08-06 04:24:03,3,learnprogramming,t3_1miti30,False,
n7qr790,"That “I feel dumb most of the time” part? Congrats, you’re officially a programmer. :grinning_squinting_face:",Significant_Loss_541,2025-08-09 07:41:35,73,learnprogramming,t3_1mljio6,False,
n7qw6px,"Same here. Never wrote a line of code until I was 49!It is just something I’ve always wanted to do so I bit the bullet and started with JavaScript, HTML & CSS as something to do during long winter nights. Even though it is purely a hobby I started Python recently and love it. More than once I’ve punched the air after solving a problem that has had me befuddled for a while.",This_University_547,2025-08-09 08:31:49,23,learnprogramming,t3_1mljio6,False,
n7qz3um,Learning from books is a great way to learn. My only hints would be read and re-read each chapter multiple times and of course type by hand all examples found in those books to see how they run. That is the best way to get the details to stick.,ScholarNo5983,2025-08-09 09:02:11,8,learnprogramming,t3_1mljio6,False,
n7qwco9,"Also, there's a weird vibe on the internet that ""everybody hates JAVA"" I don't quite understand it. From what I have learnt over those 2 months is that JAVA is very portable language and can adapt to new standards. I like it. I wasn't choosing language because of how ""easy"" IT is but because my favorite games are in JAVA. I hear this notion from Python people. Is it true or it's just the interent thing? I like JAVA.",RealAd6237,2025-08-09 08:33:32,3,learnprogramming,t3_1mljio6,True,
n7qqgwj,Awesome! Keep it up :flexed_biceps:,copperfoxtech,2025-08-09 07:34:19,3,learnprogramming,t3_1mljio6,False,
n7qqn4u,"Well yeah, like with any hobby, once you rely on it to take care of paychecks, fun sorts of stops coming for free. Not that it was a hobby really for me, always mainly a careerpath. Envy those who find enjoyment in casually wrestling with code! I am like that with music production instead, which probably actually means I should quit my sad programming job to go program drums or something.",Einareen,2025-08-09 07:36:02,3,learnprogramming,t3_1mljio6,False,
n7sfnba,"I don't want to discourage you but there will be days where you hit a problem or bug that will suck, a lot. On days like these you will feel like crap and like you are the dumbest programmer around and ask yourself if this stuff is even for you. I think often people give up on days like these. If you can overcome all of that and continue when things aren't fun and also ignore the many many posts on Reddit how AI will replace all programmers, then doors could open in future that you cannot see now as a beginner. As many say consistency is more important than motivation because you will have days where you don't want to do it and aren't motivated. On these days it's especially important to do it so you can build a habit.",sandspiegel,2025-08-09 15:28:01,2,learnprogramming,t3_1mljio6,False,
n7todyf,31yo and working in helpdesk and I just want to get out! this is my way out tbh.,mrburnerboy2121,2025-08-09 19:30:42,2,learnprogramming,t3_1mljio6,False,
n7qqnm8,"Coding is like solving puzzles and so it's fun. But when you do it daily in the job, you don't always do coding and also when you do something daily it loses its novelty.But I think if you're building something to solve someone's problem. You feel good.",backend_coder,2025-08-09 07:36:10,1,learnprogramming,t3_1mljio6,False,
n7qqorq,"This , one of the reason i love coding , what you are experiencing right now with java , is what i am having with c++ , it is very challenging most of the times to solve some problems or read somebody's code , but man , the joy you get from it when you crack it , it's just pure joy",yasspoker26,2025-08-09 07:36:29,1,learnprogramming,t3_1mljio6,False,
n78le9s,"You will never learn everything about software development, thats not possible. Every day a new language, a new framework, new libraries are made.You can find a nieche and learn for what you need.",je386,2025-08-06 14:33:51,100,learnprogramming,t3_1mj67sr,False,
n78no44,">everythingThat hasn't been possible since 1981 or so.Before that time you could get a long way by studying the computer architecture you worked on, learned C and Assembler for that architecture, and you'd know 'everything' you needed to know. After 1981, when computers became more commonplace, shit exploded. Especially after 2005 when web development got kinda serious.",Xatraxalian,2025-08-06 14:44:44,26,learnprogramming,t3_1mj67sr,False,
n78m6wz,"You'll never ever ever ever be able to learn everything. This is actually a famous saying by Socrates that ""the more you know, the more you know that you know nothing"". So embrace this and keep learning gradually.Most importantly, don't haste in your learning because that only ends up with the learner forgetting *everything* about what he learned.",Competitive_Aside461,2025-08-06 14:37:42,36,learnprogramming,t3_1mj67sr,False,
n78qq3e,"I don't feel like I am behind, because I am not. There is no such thing as being behind in programming. I have tasks to do and problems to solve. And the tools I can use (languages, IDEs, supports programs, frameworks, etc.) are sufficient right now to solve everything I need to do. And it's not that hard to get to that point! Apart from the underlying programming concepts, there is not that much to learn. Most langauges (inside of the same family) behave more or less the same, and even when switchting between web frameworks for example, there are just so many different ways they can work, while still doing the same. I am also not shy about using documentation all the time, I even make a poiint of downloading all relevant documentation to my laptop so I can work offline, while still looking stuff up. There really is no need to ""keep up"" with new languages, frameworks, patterns etc. They might technically have an advantage to the way I am used to doing things, but I am productive now. If I keep chasing the newest trends, I will spend a few months to years learning the new way of doing things, while not really being as productive as I could be. And when I'm done, there will be a new thing and I might as well start over. The only time I will learn something new is when my current tools have an obvious weakness in dealing with my current problems, or I need to coordinate with a team that is using a specific thing. Because team cohesion is more important than my preferences.",Beregolas,2025-08-06 14:59:08,5,learnprogramming,t3_1mj67sr,False,
n78njhh,"learn the basics. How does an operating system work, which datasturctures are they using, then write your own compiler, after that your own database, after that a graphics engine. When you have a good grasp about all the concepts that are used in these types of software i have the feeling it is way easier to pick up new things. And always look into production code for such things.",Low_Acanthaceae_4697,2025-08-06 14:44:08,4,learnprogramming,t3_1mj67sr,False,
n7b9q47,"Same way you drink the ocean: one glass at a time.Which is to say: you can't.I'm afraid you're going to have to prioritize and make decisions. [Two roads diverged in a yellow wood, And sorry I could not travel both...](https://en.wikipedia.org/wiki/The_Road_Not_Taken)",AlSweigart,2025-08-06 22:10:33,3,learnprogramming,t3_1mj67sr,False,
n7927lc,"Think about other jobs. A surgeon.. should they know how to do heart and brain and cosmetic and GI surgery procedures with every up to date technique for every possible condition and procedure? No, they don't do that: they specialize and become the best they can be in an area. Or an engineer, do they need to know nuclear and mechanical and industrial and electrical and chemical and so on? Software development is split across just as many areas and you can't begin to master them all. You can't even be just past beginner level bad at all of them, there are so many. Specialize in what you need to excel at your job/field, and pick up anything else that interests you as you have time. If you can apply the 'hobby' learning to your main area, great. If not, its still fun and good to play with things.",Independent_Art_6676,2025-08-06 15:53:05,3,learnprogramming,t3_1mj67sr,False,
n79t150,"That’s the best part, you don’t!Before I was in the industry, I assumed that every engineer deeply understood every post on Hacker News, and therefore I wouldn’t be a competent engineer until I, too, deeply understood every post.Now, in the industry 10+ years, I know that virtually everybody has a vague idea what most of those posts are talking about, understands maybe a handful very deeply, and the rest are absolutely clueless. The best engineers I know are the ones most eager to tell you how vast is their ignorance. It’s the bad and mediocre engineers who try to convince you they know everything.",Altruistic-Cattle761,2025-08-06 17:56:56,3,learnprogramming,t3_1mj67sr,False,
n78m80s,"Pick a handful of things, learn those for now.Then learn a few more every year.",Rain-And-Coffee,2025-08-06 14:37:51,1,learnprogramming,t3_1mj67sr,False,
n78ny2l,"ofc you can't know everything about programming, it's so vast now. from low level to high level, from assembly to python, from tasteless binary strings to AI/ML. there are many areas of studying (similar to math, ig) and you gotta focus on one area only. btw, as other users pointed out, there's literally thousands of products made everyday to serve small - big purposes. so obv you can't learn anything, just pick smth that is important for you",Pleasant-Confusion30,2025-08-06 14:46:01,1,learnprogramming,t3_1mj67sr,False,
n6up4ji,"I can give you a million reason : \-you don't have to read from cover to cover and this apply to tutorials too, but bear in mind that books usually cover every detail possible so you are more likely to find what are you looking for. \-books are written by real experts while most tutorials are made by people who already read the books you intended to but you preferred tutorials over them. \-Ideal for long term knowledge and can be used as reference. and the list goes on, and you have to choose wisely what to read that doesn't mean that every book is a good book.",RyfexMines,2025-08-04 11:23:57,110,learnprogramming,t3_1mhallx,False,
n6usw6l,"Many tech books designed to introduce readers to a subject are written with an overall plan, a narrative arc, in mind. Authors and their editors think through the sequence of the concepts they present, so later chapters build on earlier ones. And decent books get many months of loving care from the teams making them: authors, designers, editors, indexers, reviewers. That helps ensure they serve readers well.Plus, the economics of book production and sales work well enough to attract really knowledgeable people, genuine experts, as authors.Plus, if it’s your book you can put bookmarks, dogears, and scribbled notes in the margins to help you make a useful reference tool.K&R [The C Programming Language](https://search.worldcat.org/title/The-C-programming-language/oclc/318301687) is the archetype of this kind of tech book.",Aggressive_Ad_5454,2025-08-04 11:50:42,48,learnprogramming,t3_1mhallx,False,
n6v40ph,"**Tutorials**: ""Get on the bike and pedal - don't ask why."" **Documentation**: ""A bike has two wheels, a frame, and pedals. "" **Books**: Here’s how balance, steering, and momentum work on a bike.""Now obviously there are many types of books, tutorials, even documentation, but learning something as deep and broad as C programming, I'd definitely start with books. Edit: typo",OtherwisePush6424,2025-08-04 13:00:41,28,learnprogramming,t3_1mhallx,False,
n6uvn50,"For me, it's that a subject-matter expert (if you buy the right book, of course) has thought about what you need to know and when, and how to convey it to people at the level that the book is targeting, and included it. There's often a lightweight narrative element that makes it easy for beginners but still more than a mere demonstration. It avoids the ""don't know what I don't know"" problem beginners face when they try to google things often.It's long-form content that's generally not shat out quickly for engagement/profit (ask technical book writers how much they made from their work, most will say not much) and generally with technical books the quality of the information will be what determines how well-regarded it becomes. Also, contents, index, bibliography etc. You don't necessarily get those with other media.Physical books? There's generally some effort to make sure it's correct before print, for obvious reasons.A big one for me is just having it on my desk rather than a tab or second monitor feels nicer.Also, I can't copy/paste. I'm going to code it myself. There's no temptation.You could argue *against* any of these. They're not necessarily objective advantages. Just my take. Some would say PDF/kindle version serve just as well. Digital versions are easier to full-text search, but I don't really do that. I look up sections.",HashDefTrueFalse,2025-08-04 12:09:21,6,learnprogramming,t3_1mhallx,False,
n6uqeyl,One is written with the explicit intent to teach another human being the concepts (usually with methods proven over time to be effective) not just document them. Tutorials are normally just not great because things change over time and it's easier to keep documentation up vs a video or random programs meant to tutorialize a concept. (often going over the learner's head in the process by giving them a solution instead of a problem),GrandBIRDLizard,2025-08-04 11:33:14,5,learnprogramming,t3_1mhallx,False,
n6ute18,"Documentation really varies, but it often doesn't really include context on how or when it's used.",grantrules,2025-08-04 11:54:06,3,learnprogramming,t3_1mhallx,False,
n6uonmc,"Is there a reason why spanish uses two ""?"" to indicate a question?",Augit579,2025-08-04 11:20:31,11,learnprogramming,t3_1mhallx,False,
n6urycx,"There are video resources that aren't like tutorials. A tutorial (in my opinion) is a guide to build a project. This is a fairly narrow definition of a tutorial, but I believe the kind that gets people into ""tutorial hell"" where they go from one tutorial to another, but never really learn the material. Such tutorials often show you, step-by-step, how to build something but don't tell you why the steps work.There are courses, such as CS50x (web search: `cs50x edX`) that teach programming as a course as if you were taking an intro programming course in college. That's because, in the case of CS50x, it is a college-level course. While you can't earn college credit for it, it is free to take. You could also try that.The key is to do all the programming exercises (called problem sets). Reading and watching videos is not enough.",CodeTinkerer,2025-08-04 11:44:13,3,learnprogramming,t3_1mhallx,False,
n6v04ew,Someone was paid to write the book. Editors were paid to edit the book. Money was put into quality control and people's reputations are on the line. Can't just delete a bad book that's already published. Tutorials don't have any of that.,vardonir,2025-08-04 12:37:28,3,learnprogramming,t3_1mhallx,False,
n6v4art,"Research and documentation is not written for learners so you need to have some knowledge already. They are great resources if you do, better than books actually.I'm sorry but I hate tutorials. They are superficial, useless and the most misused resource there is. If I need to tie a knot I need step-by-step instructions or I want to know how to cook a specific dish. I won't learn how to become a captain or a cook.And on top of that... What in programming do you need to be shown what to? How to type? How to spell? How to open a text editor?Tutorials are for setting up environment and installing tools. NOT for learning programming.What do you have left? Books and lectures mostly.",serious-catzor,2025-08-04 13:02:21,3,learnprogramming,t3_1mhallx,False,
n7eo2l3,"Fundamentals are important.No language is future proof, you'll need to adapt to new languages, frameworks, technologies, etc frequently. Being able to adapt is really the most important part.As for AI, it kind of sucks and gives me wrong solutions all the time. If I make a mistake and no one catches it, I could cost my company millions. I like using it to speed up work, but I view it as an intern who makes lots of mistakes and needs a bunch of guidance. As a tool to help you it's great, but over reliance on it, especially if you don't understand the code it produces, is a no no. Essentially it's great as a tool, but don't use it as a crutch.For soft skills, basically just good reasoning, problem solving, and being able to work well with others goes a really long way.",Zesher_,2025-08-07 12:29:14,80,learnprogramming,t3_1mjyios,False,
n7eqxeq,"Fundamentals and solid programming skills will never go out of favor.If you're new to programming, focus on learning solid fundamentals first, gain some practical experience through doing *individual* (not tutorial) projects, and then do DSA.AI is a tool, but like for any tool its usefulness is in the hands of the wielder. If you don't know anything, even the best tool in the toolbox is useless. While learning, stay clear of AI for anything other than giving you deeper explanations on things you don't understand, but always double check the explanations of the AI with *proper* sources, e.g. with blogs, with the documentation. AI is known to lie.The technical barriers are not lowering. That's a huge misconception. If anything the barriers for getting a job will rise, not fall. AI has potential to take over large parts of the entry, low skill job market, so the barrier is not going down.As for languages and technologies in demand: only the local job advertisements in your area, preferably from larger, established companies, not from startups, are the only thing that can tell what is in demand.Yet, the traditional languages, like Java, C++, C# will always be in demand and are quite safe bets. Python is on the rise. JavaScript is also heavily in demand.",aqua_regis,2025-08-07 12:46:17,28,learnprogramming,t3_1mjyios,False,
n7et6j1,"1) I'd argue it's even more crucial as before, as AI leaves a ton of junk and useless code, and is prone to ""just make something work"" without worrying about maintainability or computational debt. If you don't have strong fundamentals, you won't understand why something doesn't work and you won't be able to vibe code out of the hole you just dug. Speaking for experience, almost every fundamental thing I had to learn on my own paid massive dividends for spotting shotty code, mistakes, bloat etc. 2) C, Python, Javascript are not going away. Hoping to skirt by with one language or framework is pretty naive IMO in 2025. You're constantly juggling these things for the best outcome in my experience. Like, a project might use python libraries with C under the hood, that gets served to users via javascript frontend. 3) Technical barriers are not lowering, they're rising if anything. Anyway, typical things that help are a positive attitude, being honest about mistakes/not getting something, jokes and being useful, not a burden.4) There are many good cases - you can understand something deeper, ask it to build some exercises for you to deepen understanding etc. The thing to keep in mind - if tomorrow AI disappeared, could you still perform?",Biliunas,2025-08-07 12:58:58,10,learnprogramming,t3_1mjyios,False,
