id,body,author,created_utc,score,subreddit,parent_id,is_submitter,distinguished
n6x4m85,Imphenzia has done this a few times. He does not sit and show you ALL the recording. But they are very long videos where he goes over what he did and when in reasonable detail.Sebastian Lague also makes remarkable high quality programming journeys with code snippets and fine details where it matters.,Old-Addendum-8332,2025-08-04 18:55:57,3,learnprogramming,t3_1mhlq54,False,
n6z7n87,"Look at traversy media, he has a lot of projects which are several hours long and it’s refined from start to finish. Although the keyword is refined. He already went through the planning and debugging phases (mostly). It’s not representative of an actual development/debugging process",Srz2,2025-08-05 01:33:49,1,learnprogramming,t3_1mhlq54,False,
n7sg049,"""Front end is done"". Its most definitely not. You should have talked about this in advance, figured out a plan, diagramed it, built an MVP. And if anything, the backend should almost always be built first for these types of projects.As it stands now, you are completely forced into fulfilling their imagined architecture, which I cannot imagine is good for college students who focused on front-end only.Just want you to make sure you know what you are getting yourself into.\- Regarding the stack, just use what you are comfortable with, anything will work for such a simple project. As a college student you don't wanna relearn everything just because one technology might be slightly better than the other on paper and some reddit user said so. (btw, Python, NodeJS, etc are not framework, just languages) \- Same with db, use what you know \- Get to the algorithms part first, then you can think about recommendations and sorting. You have a few things to build before then \- These are not modules/libraries these are just features you will build into the app. Order requests is a core functionality of your app, YOU need to build it. Payments you probably need to mock, I doubt you need to integrate a real payment processor for a school project. Analytics is 50/50, u can use something, or make it yourself.Good luck!",maqisha,2025-08-09 15:29:55,1,learnprogramming,t3_1mlqh17,False,
n7sgyey,Thank you for your suggestions!!,False-Comfortable-70,2025-08-09 15:35:07,1,learnprogramming,t1_n7sg049,True,
n7r24xo,"Just a heads up, in my experience packt books are very low quality",ConfidentCollege5653,2025-08-09 09:34:32,5,learnprogramming,t3_1mll4lg,False,
n7rha10,I've ordered numerous Packt books in the past. All of them have gone in the trash because of how bad they are.,Dappster98,2025-08-09 11:54:11,1,learnprogramming,t1_n7r24xo,False,
n7rk13f,"If you want to master multithreading and asynchronous programming in C++, you should give Asynchronous Programming with C++ a try. And if you still don’t like it, instead of tossing it in the trash, pass it on to someone who might benefit from the knowledge it contains.",javireguera,2025-08-09 12:15:11,0,learnprogramming,t1_n7rha10,True,
n7qvofa,"Discrete maths is the theoretical foundation for programming. But it doesn't give you too much of an edge as a professional developer.It's like learning automotive engineering when becoming a driver. Absolutely foundational to cars, but it doesn't matter practically when your job is just to drive cars.That said, just like knowing the internals of your car *can* help you in certain situations, and even sometimes make you a better driver, discrete maths helps you as a developer in certain situations. Regular expressions, grammars, state machines are all discrete maths subjects that have practical applications too.",maujood,2025-08-09 08:26:35,15,learnprogramming,t3_1mlhjnb,False,
n7qn7fe,Programming is just asking your computer to do maths. The more maths you know the more stuff you can ask your computer to do. The better you can solve a problem by modeling it with math then the better programs you will be able to write.,towerbooks3192,2025-08-09 07:02:57,7,learnprogramming,t3_1mlhjnb,False,
n7qpj6y,"The more concepts you know, the more concepts you can apply. So try learn many concepts, even domain specific ones.",Comprehensive_Mud803,2025-08-09 07:25:11,2,learnprogramming,t3_1mlhjnb,False,
n7r2ltc,"Linear, discrete, and stat were the 3 big subjects when I was at uni. We also had analysis up to calc 3 which is critical for ML proofs, but I think every engineering degree makes you take calc.Computers are fundamentally linear and discrete. Any calculation the computer is doing that is continuous and/or non-linear is an estimate.",Tell_Me_More__,2025-08-09 09:39:27,2,learnprogramming,t3_1mlhjnb,False,
n7twmo9,"Discrete Mathematics was the most beautiful thing to me. The book I used was H. Rosen and I absorbed it. That was one of the first instances where I was literally coming to class, and able to really take over. The teacher really just let me, on most days just go to the board and do the homework assignments that were the most exciting. I remember getting proofs and this being different from set theory, which was also a proof based class, because these proofs were countable. Is it important? I would say so. We covered things like logic, graph theory, partial orders, total orders, permutations, combinations, sequences, and series. Also, I think it was a good preparation for future courses in CS like data structures and discrete structures. Its not always required, but it can help a lot.",mindaftermath,2025-08-09 20:17:37,2,learnprogramming,t3_1mlhjnb,False,
n7qcvsw,It’s everything,SatanicKanye,2025-08-09 05:27:42,5,learnprogramming,t3_1mlhjnb,False,
n7uzosk,"If you understand average and median, you're okay.",ern0plus4,2025-08-10 00:10:22,1,learnprogramming,t3_1mlhjnb,False,
n7vjmxw,"I dunno, I feel like I’ve used state machines, regular expressions, and grammars in my programming work for decades. It’s one of those things where knowing about a topic means you can use it where it’s applicable, and not knowing means having to reinvent it because the most appropriate solution happens to be a state machine, an application of a grammar, or a regular expression, and because you don’t really understand it means you do so poorly.",No-Let-6057,2025-08-10 02:17:45,2,learnprogramming,t1_n7qvofa,False,
n7vjfzo,Proof by induction? Never used it since class.Set theory? Use it every damn day. Depends on the discrete math topic.,CMFETCU,2025-08-10 02:16:33,1,learnprogramming,t1_n7qvofa,False,
n7r22g4,Programming is just asking your computer to do *discrete* maths.,Tell_Me_More__,2025-08-09 09:33:47,4,learnprogramming,t1_n7qn7fe,False,
n7ojl7i,"When I work with beginners (and even career changers in tech), I often explain “learning by doing” in programming as building something real, but in small, achievable steps. If you’re starting with a new library or tool, don’t wait until you’ve read all the docs; pick a tiny feature you want to implement.* Break it into the smallest step you can try.* Run it, see what happens.* When you get stuck, search for that one problem, fix it, and keep moving.Over time, the small cycles of building, breaking, and fixing lead to genuine mastery.In my experience helping people relaunch their careers in tech, the fastest growth happens when you mix hands-on projects with just-in-time learning. It’s less about “being ready” and more about starting before you feel ready, then adjusting as you go.What’s one mini-project you could try with that library this week? Start from there.",aktibeto,2025-08-08 22:23:25,6,learnprogramming,t3_1ml78tv,False,
n7o8e66,Research and Google what you're passionate about. Google how to make stuff that you want to make as well.,Dappster98,2025-08-08 21:22:39,5,learnprogramming,t3_1ml78tv,False,
n7oba3w,"I'm in my early 50's. Been programming since the early 80's. You try something. Does it work? yes, great, can I improve it? No, why not? figure it out. You will learn a lot this way. It's trial by fire. Programming is both art and science.",GotchUrarse,2025-08-08 21:37:55,4,learnprogramming,t3_1ml78tv,False,
n7occha,"You learn by doing because when you're making a project is when you're exposing how much you know about that tool and by doing so you push yourself to know more. If you're using a library and you come across a weird bug or edge case and fix it, then you learned something. You now recognize that bug and that edge case and you can fix it whenever you see it again. If you're building a project with a tool you don't know a lot about and you're not sure whether this library has support for X, well you go to the documentation or you google it and by doing so, you learned something new.You will learn a lot more through direct exposure with the tool than watching somebody else use it, because that person will only show you how to use the tool, not very often will they teach you the weird bugs and edge cases to watch out for and how to handle those cases.For example, I'm working on a simple project that deals with files. Before this I didn't know anything about working with PDFs and images, but because I started the project and forced myself to do it, then now I'm learning how compression works, how to work with streams and buffers, reading and writing files, converting to other formats etc.. Applying your knowledge and creating things that you know little about is what will help you learn about those things. If you don't know how to create a mobile application, you will never learn how to if you DON'T try to make one.",W_lFF,2025-08-08 21:43:40,3,learnprogramming,t3_1ml78tv,False,
n7ovnxe,"Responding to your edit: yes, that's exactly the right idea. You pick an idea and let that guide your learning.Very broadly:1. As an absolute beginner, start by following a course. Don't try to build a project from zero knowledge. Start with any course that walks you through how to write code.2. When you're ready to begin a project, start with what kind of project you want to build. Be really, really specific and don't try to do everything at once. A good answer would be ""an Android app"" or ""a website"" or ""a bot that responds on BlueSky"". A bad answer would be ""a program that's always watching everything I do on my phone and my laptop"", that's too much to bite off. Start with one thing.3. Follow a tutorial on how to build that type of project. If you want to build an Android app, a tutorial will teach you how to get started, how to make the app, how to put it on your phone to try it out, and where to write your code.4. Once you have an empty application working, start adding things, one at a time. Start small, extremely small. Add one button. Now make that one button do something.5. From time to time, it might make sense to set your project aside, learn to do something (like how to call a specific API), then go back to your project and apply it.As you gain more experience you will get faster at this, but you will never stop learning.Good luck!",dmazzoni,2025-08-08 23:32:18,3,learnprogramming,t3_1ml78tv,False,
n7pqzz4,"Sounds like you've got it! Learn by Doing is the best path towards professional-level development. When I'm learning any new technology, my goal is always to learn the minimum amount possible to start a project, then look stuff up and learn new facets of the technology as I go. doing",Feeling_Photograph_5,2025-08-09 02:43:18,3,learnprogramming,t3_1ml78tv,False,
n7oy1dk,"Thanks for all the questions and quick answers I've received, I think I understand, this was very helpful, thank you!",S0meOne3ls3,2025-08-08 23:45:50,2,learnprogramming,t3_1ml78tv,True,
n7ok17m,"just imagine that you're learning a technology or tool, and then someone comes up behind you with a gun and puts it to your temple. ""USE THIS FUCKING TOOL IN SOME WAY. IT DOESN'T NEED TO BE SUPER COMPLICATED, BUT I WANT TO SEE YOU USE THIS TOOL IN A NON-TRIVIAL WAY!"" they scream!And then you start making something... but you don't remember some syntax or some detail. You say this to them.""OKAY, USE GOOGLE OR LOOK AT THE DOCUMENTATION. BUT DO NOT USE MORE THAN YOU ABSOLUTELY NEED. YOU MUST MAKE STUFF FROM SCRATCH AS MUCH AS POSSIBLE!""so you start chipping away, making small progress because - for Pete's sake! - you've just learned it! you bang your head against the wall trying to figure out small or big errors. but, at the end, you have something that you've made with your own hands with the thing that you just learned.",wannacommissionameme,2025-08-08 22:25:54,2,learnprogramming,t3_1ml78tv,False,
n7mzfbh,"It seems you may have included a screenshot of code in your post ""[What's causing the font on this website to look so odd on high widths?](https://www.reddit.com/r/learnprogramming/comments/1ml1sdf/whats_causing_the_font_on_this_website_to_look_so/)"".If so, note that posting screenshots of code is against /r/learnprogramming's [**Posting Guidelines**](https://www.reddit.com/r/learnprogramming/wiki/index) (section **Formatting Code**): please **edit** your post to use one of the [approved ways of formatting code](https://www.reddit.com/r/learnprogramming/wiki/index#wiki_formatting_code). (Do NOT repost your question! Just edit it.)If your image is not actually a screenshot of code, feel free to ignore this message. Automoderator cannot distinguish between code screenshots and other images.Please, *do not contact the moderators* about this message. Your post is still visible to everyone.*I am a bot, and this action was performed automatically. Please [contact the moderators of this subreddit](/message/compose/?to=/r/learnprogramming) if you have any questions or concerns.*",AutoModerator,2025-08-08 17:40:36,1,learnprogramming,t3_1ml1sdf,False,moderator
n7n38mq,"Looks like a direct font issue. You can see the font definition is ""proxima-nova,system-ui,-apple-system,BlinkMacSystemFont,Segoe UI,Roboto,Ubuntu,Helvetica Neue,Arial,sans-serif,""Apple Color Emoji"",""Segoe UI Emoji"",Segoe UI Symbol""It does correctly resolve to proxima-nova without using fallback fonts (all the other fonts, which would be a stand-in if the previous one failed to load), but that font itself produces weird artifact. It's probably misconfigured in the font source/file itself and/or has poor support for some modern font display technologies, like true type. If you remove proxima-nova from body's font-family definition, the next used font look correct. Not a font expert, but that's my best guess.",voyti,2025-08-08 17:58:28,1,learnprogramming,t3_1ml1sdf,False,
n7ozh0c,"This is a rendering problem that arises when the outlines defining each glyph of the font are misaligned with pixel boundaries:Everything you'd ever want to know about outline fonts is in this dated reference manual. See chapter 3 in particular, pay attention to figure 2:[https://developer.apple.com/fonts/TrueType-Reference-Manual/RM03/Chap3.html](https://developer.apple.com/fonts/TrueType-Reference-Manual/RM03/Chap3.html)These TTF fonts are technically allowed to embed Forth-like (or, I guess, PostScript-like) programs which are supposed to correct these problems. But this tech is dated, pixel densities have long since grown, and I am not sure how many modern font rasterizers (or fonts) implement this feature.",light_switchy,2025-08-08 23:54:05,1,learnprogramming,t3_1ml1sdf,False,
n7kn4la,"Yes, I am in the process of creating a game class in order to outsource the code from the main. There will be just one check if method where the correct player is selected at runtime by reference to the playerbase class.",Old-Bodybuilder-3238,2025-08-08 09:46:46,1,learnprogramming,t1_n7i38ob,True,
n76pajf,"When you're writing code, make sure it's well written. Descriptive naming and comments can help, but other code style things like breaking complicated functions up can make it easier to read. You should be able to look at a block of maybe 10 or 20 lines and know what it does. It's really easy to rush things now and make bad stylistic choices that aren't a problem now, but will be a problem later. There's also going to be a natural ""changeover time"" where you remember how things work between projects. It's unavoidable. My only suggestion there is to work in a way that maximises productive time and minimises changeover time. If you block out a week to work on a pet project you might struggle to remember for the first day, but are then productive for the rest of the week. That's better than changing every day and being constantly unproductive.",RajjSinghh,2025-08-06 06:14:10,3,learnprogramming,t3_1miwj9e,False,
n76r0hv,"Yeah, context switching can lower your productivity; with experience, it becomes somewhat easier. Usually, it becomes easier to remember the big picture of each project, as you learn and use different design patterns (you don't need to reexamine every detail of the code; you may only need to take a quick glance). With time, as you do this repeatedly, more things tend to stick in memory.Personally, context switching is something I regularly talk with my manager about (I mostly prefer working with only one project at a time, but there are usually 2-3 projects active during a week; I try to focus the work on separate days). Getting questions about different projects also requires some context switching and disrupts the ""flow."" I try to keep a ""developer diary"" about what I have been working on each day; it helps me to quickly remember what I was working on previously when I need to switch between projects (it's really helpful to read on Monday mornings and before going to different meetings).",joranstark018,2025-08-06 06:29:34,3,learnprogramming,t3_1miwj9e,False,
n76r8cs,"Use good abstractions in your projects - use function and class-names that quickly makes sense to you when re-reading the code, so you don't have to dive deep into the logic every single time. This is also good practice for writing code for others to read! As they will have even less knowledge of the project than you.Also, use clear separation of concerns, so you don't mix e.g. UI stuff and file-handling - don't stress yourself by having to re-read (re-learn or even remember) everything at the same time. You can often do this by having more modules / classes / packages for your code, so it is more like a collection of small projects, than one big one.And use ""patterns"" - you don't have to learn the ""official"" Design Patterns, most of them probably aren't relevant for your projects - but get used to ""doing things in a similar manner"", e.g. when having a UI module, use a similar architecture in every one of your projects, so you don't have to understand everything every time, but only focus on the differences.Finally, make sure you leave the projects in ""good standing"" - like if you had some real hobby projects in your workshop: clean up around them, put your tools back where they belong, make sure you don't have loose screws lying around, make small notes (TODO) of what you need to do next. Use git to track and document your progress, and make sure that every commit - or at least the last one before leaving the project - is a clean version that you know works, and doesn't have too many loose parts dangling about!",peterlinddk,2025-08-06 06:31:32,2,learnprogramming,t3_1miwj9e,False,
n7701f8,"Contextualization. It’s all about having many contexts in memory and being able to retrieve them from documentation, code and history. Always write code in a way that someone can easily join the project later on, that one being you after 6+ months on another project.",Comprehensive_Mud803,2025-08-06 07:52:53,1,learnprogramming,t3_1miwj9e,False,
n770gyt,">when I return to either of them to make some changes, it always feels like starting from scratch (...) If I spend some time with one language or framework, it inevitably leads to forgetting stuff from other languagesUnavoidable, even if you have been coding for decades. There are only two things you can do: 1.) stick to only one programming language and only one problem domain in order to get to know them in depth and always feel comfortable working with them, and 2.) use object-oriented techniques such as design patterns and thoughtful mapping of the problem domain into the structure of object-oriented entities (i.e., classes/objects) in your code, so that the code is very modular and self-explanatory. It's an art more than a science.",gary-nyc,2025-08-06 07:56:57,1,learnprogramming,t3_1miwj9e,False,
n774o8t,"If I use languages regularly, I don't forget them. I use C#, TypeScript, C and Rust regularly, I have no problem context switching. Languages I haven't used for a few years I'm rusty, languages I've not used for over 10 years or more, I've almost completely forgotten.It'll come with time, the more you use a language, the more it'll become natural to you.",ToThePillory,2025-08-06 08:36:55,1,learnprogramming,t3_1miwj9e,False,
n78riux,I got stuck yesterday cause I forgot that javascript arrays aren't truthy. There's an hour I won't get back.,nousernamesleft199,2025-08-06 15:02:58,1,learnprogramming,t3_1miwj9e,False,
n7bjtt9,There are studies on how context switching kills productivity. Having mid and upper management that understands this is crucial. I've worked for bosses who would context switch us every two hours and ones who mostly follow SCRUM. Guess which ones where the fulling to work for and most productive?,GotchUrarse,2025-08-06 23:05:57,1,learnprogramming,t3_1miwj9e,False,
n7geaq0,"You aren't going to remember everything as in its constantly in your head. It's like remembering the way home from somewhere, you might not remember every single detail about the path but you'll get there. If anything I feel the need to work in multiple languages because it can be refreshing and expose you to different ways of thinking",Yobendev_,2025-08-07 17:39:02,1,learnprogramming,t3_1miwj9e,False,
n7jrnbf,"That's just experience. At this point I write in half a dozen language on a daily basis. But I surely didn't start like that. The cost of context switching will go down with time. At this point, I'd stick with one project at a time in order to build the efficiency you need.",esaule,2025-08-08 04:59:43,1,learnprogramming,t3_1miwj9e,False,
n73dip2,"Marketing isn’t too far from data analysis, I feel you could bridge it.Learn SQL and a visualization tool. Read a few books, ex: I recently read “storytelling with data”.Create a portfolio, look at entry level jobs. Certs are mainly for your own learnings, employers have never cared about them.",Rain-And-Coffee,2025-08-05 18:11:24,3,learnprogramming,t3_1mif7x1,False,
n7syv5o,"As someone who transitioned from marketing to data analysis, I can totally relate! While a bachelor's degree can be helpful, it's not always necessary. What matters most is developing practical skills and building a strong portfolio. I've seen folks without degrees land great data roles by showcasing their projects and certifications.For marketers like us, focusing on marketing analytics and tools like Google Analytics is a great starting point. It leverages our existing knowledge while building new skills. I actually write about these career transitions in my Experimentation Career Blog on Substack, where I share tips for breaking into analytics roles without traditional backgrounds.The key is to start with free resources, then invest strategically in courses that teach job-ready skills. Good luck on your journey! It's an exciting field with lots of opportunities.",experimentcareer,2025-08-09 17:10:42,1,learnprogramming,t3_1mif7x1,False,
n72xsiv,"What you’re describing is basically how most apps handle user‑generated media: upload fast, process async, serve via CDN. The brief window where files are accessible before metadata stripping or malware scanning is pretty normal most companies accept that low risk in exchange for smooth UX.Some common patterns I’ve seen:Single bucket, async processingUser uploads → file is public/private in S3 almost immediatelyLambda/SQS/SNS triggers run in the background:Strip EXIF / metadataResize or generate thumbnailsOptionally scan with ClamAV or an external scanning serviceOnce processed, either overwrite the file or mark it “safe” for servingTwo‑bucket flow while this is safer, it's slower Temporary “quarantine” bucket for raw uploadsProcess + scan → copy to “public” bucket → CDN serves only from that bucketAdds latency but avoids serving unprocessed contentHybridSingle bucket, but the file is uploaded private by defaultProcessing Lambda flips ACL to public or moves it to a processed/ folder only after passing checksThis avoids serving potentially unsafe files without delaying uploads.",itz_charlie01,2025-08-05 16:47:05,2,learnprogramming,t3_1micua4,False,
n72o23k,"I think having the quarantine bucket and not serving user-upload data until sanitized is a very good idea. Go for it just to sleep well, no matter what the other apps are doing behind the scenes.",ConstantEnthusiasm34,2025-08-05 16:00:29,1,learnprogramming,t3_1micua4,False,
n6xvp6l,"If you built something non-trivial that you can talk about, include it.IMO you shouldn't really have a Projects section once you've got some experience. This is usually seen on graduate CVs IME, and is overshadowed by Employment History (or Work Experience if more junior) or similar. Either way, Projects is for personal projects IMO/E, so I'd put it under Work Experience or Employment History.",HashDefTrueFalse,2025-08-04 21:06:21,2,learnprogramming,t3_1mhphk9,False,
n6yoxjy,"That's work I did for my employer. That employer happens to be my LLC/SCorp/""Doing business as"", and we can explain that perfectly reasonable formatting decision if we get to the point where we are talking.",Skusci,2025-08-04 23:43:59,1,learnprogramming,t3_1mhphk9,False,
