id,body,author,created_utc,score,subreddit,parent_id,is_submitter,distinguished
n6v2c70,I've met lots of normal people in FAANG. Many have become friends outside of work.,TonyTheEvil,2025-08-04 12:50:45,15,cscareerquestions,t3_1mh7i1m,False,
n6uoqzm,"Generally if you can't stand any of your colleagues it means you are the odd one. The company is not for you (and vice versa). Also if you are not happy with competent and nice people because they don't have the same extra work activities than you.... You will get a reality check later, when you will experience the same but with bad and nasty colleagues. Even in a terrible place, I have never been in a position where I could stand no one. It's a job not a party, you need to grow up seriously.",bfffca,2025-08-04 11:21:13,61,cscareerquestions,t3_1mh7i1m,False,
n6u4yw6,You can still work in tech at companies that are not dominated by men.I matched a girl on Hinge once that was a SWE and she got a job at a cosmetics company. She mentioned that even as a SWE she wasn't completely surrounded by men.,momo-gee,2025-08-04 08:26:02,28,cscareerquestions,t3_1mh7i1m,False,
n6vrvhe,"Tbh if “nice people and good colleagues” isn’t enough to raise them above “can’t stand them,” it’s not an industry problem. The people aren’t going to be much different anywhere unless you’re working in an industry with a specific culture (I don’t think telecoms has a specific culture).",Lolthelies,2025-08-04 15:06:32,18,cscareerquestions,t3_1mh7i1m,False,
n6udz4j,You can ask in r/womenintech too if you haven’t already.,not_a_kuhlschrank,2025-08-04 09:53:21,24,cscareerquestions,t3_1mh7i1m,False,
n6vhwsk,"The most un-tech bro place I've ever worked was in the public sector. The problem was the pay was not great. It was very low stress, but also a very low productivity environment.",xender19,2025-08-04 14:16:46,9,cscareerquestions,t3_1mh7i1m,False,
n7nbwkp,"Full stack apps cannot be built with one sentence.The best way to deal with your fear of AI is to take it heads on and use it. You’ll quickly be amazed. Then, you’ll quickly become frustrated. And lastly, you’ll gain insight into why it’s not going to replace engineers anytime soon.",BackendSpecialist,2025-08-08 18:40:35,222,cscareerquestions,t3_1ml190k,False,
n7mver9,"They could be, if execs are dumb enough to think that the bottom won't fall off when you don't train juniors to be seniors and have replacements when the seniors retire.",B3ntDownSpoon,2025-08-08 17:21:56,462,cscareerquestions,t3_1ml190k,False,
n7mza6h,"Because they're already burnt. Can't cook what's burnt. Also, AI is not what's destroying tech. It's actually just offshoring. Replace one engineer in California who probably makes 200k, and you can get 4 good offshore engineers from another country, or 20 bad engineers and one or two may turn out to be decent.",Schedule_Left,2025-08-08 17:39:57,144,cscareerquestions,t3_1ml190k,False,
n7mwrsn,"> the advancements in AI these days are insane This is mostly a distraction companies are using to try to deflect criticism of their much more traditional reasons for downsizing.AI is a shiny new toy, but wildly over promised and under delivering in practice. > vs now where full stack apps could be built with one sentence. Trivial full stack apps, sure. If you add any complex requirements or require any sort of balancing between conflicting design goals, it falls apart almost immediately. Ask yourself this: why didn’t low code platforms take over the world? The answer is the same for AI. > but what makes you think that in even half a year all of these issues won't be completely fixed given how fast these advancements have been.Because advancements have slowed down greatly, and the improvements we are seeing largely don’t address the core problems that limit practical use of AI to replace workers. > i feel like AI replacing jobs also implies that AI will be creating thousands of NEW jobsThe AI tools that are actually useful and productive drastically reduce some costs essential to running a business generally. This will make it a lot easier to start new businesses, and likely lead to an overall increase in demand for software work as the price falls.",Due_Satisfaction2167,2025-08-08 17:28:12,97,cscareerquestions,t3_1ml190k,False,
n7n0vim,The real things affecting SWE hiring are section 174 and the interest rate plus Wall Street pressuring companies to be profitable over growth. Section 174 was already repealed/replaced and interest rates will likely go down with the recent jobs report. Also based on those job reports the whole job sector is down not just IT,chunkypenguion1991,2025-08-08 17:47:23,14,cscareerquestions,t3_1ml190k,False,
n7n3yrk,"Sort of. I think a lot of it will be changing focus and moving on to non junior work more quickly.The shitty juniors who can't code their way out of a paperbag are even more screwed than before. Or maybe AI will let them be halfway useful to someone, as they bridge the role more towards PM and req analysis.The regular juniors... the usual experience with interns/juniors is* They just sit there waiting for you to tell them what to do.* They need clear instructions on what to do* They just focus on getting something out that works, not thinking of maintainability, testing, scaling, etc.* Try to sneak in their favorite language, library, framework when you aren't watching* Always push for a rebuild from scratch rather than understanding the code.All of the above is replicated by LLMs. The regular and senior SDEs aren't necessarily better coders, we are just more proactive about what to do, suggesting improvements, watch for the above and know when to do each, ensure things are mantainable, thi k of broader picture etc.None of these are difficult, but is hard to explain and normally something you learn by experience. A junior who quickly learns the above and acts more grown up will do well ""overseeing"" LLM coders. How to upskill people like that is a difficult question. One of the most useful classes in my university ended up being our software engineering class where we went through more ""BS"" type stuff like requirements, project planning, etc and built a big project as a class. Universities might need to dedicate another semester to that type of classes including LLM coding as part of building something large and making changesOf course, the next couple of years are going to be rough as companies try to upskill their current juniors, drying up the need for new juniors. Ideally what would happen is that any efficiency improvements would result in more projects so the labor market would be the same, but we're in this in between where that hasn't materialized, so companies are hedging their bets and holding off hiring until they know if there are efficiency improvements and more projects can be put in their 2026 plans and/or how their HR budgets change.",ZenEngineer,2025-08-08 18:01:56,33,cscareerquestions,t3_1ml190k,False,
n7n95o4,Im pretty early career and I can assure you that AI is not as effective as its marketed or portrayed in the media.,NoInitialRamdisk,2025-08-08 18:27:03,10,cscareerquestions,t3_1ml190k,False,
n7n02yq,"My feeling is that only juniors and execs think AI advancements are insane.Seniors are not that impressed (anymore). So I’d say: Don’t worry, the market is not good because of the general economy, not AI.",InDubioProReus,2025-08-08 17:43:40,23,cscareerquestions,t3_1ml190k,False,
n7mwmjw,this reeks like an AI marketing post,quaker_oats_3_arena,2025-08-08 17:27:32,63,cscareerquestions,t3_1ml190k,False,
n7neyns,"""full stack app with one sentence"" it can build because there are no requirements or constraints it needs to consider and no users it needs to serve. Real world software engineering is much harder than what AI can do now or in the future",willbdb425,2025-08-08 18:55:36,5,cscareerquestions,t3_1ml190k,False,
n737hs8,"I was in the thick of it.Joined a startup right out of college got a ton of options. 6 months later, company got bought by a public company, options converted to options of that company. I was a paper millionaire. YEAH BABY I'M RICH!!! Yeah not so fast, lol.This happened right as the bubble started to deflate. By the time I had vested 1/4 of my options and could sell anything, the stock price fell 35-40%. And it kept on falling and falling and falling. Layoffs started happening, and by the time my number was called, about 7/8 months later, about 60% of employees had been let go. Stock price was in the toilet. But my strike price was really low, so it was still something. From my several millions on paper, I ended up getting about $75K out of it. Not horrible. That would be worth about $150-160K today. Not life changing money, but enough to put a downpayment on a couple of houses. Which in turn appreciated to where it is life changing money. So indirectly I guess I did get those millions.Once I was laid off, I chilled out for about 2 months, I played a lot of golf. I got a pretty good severance package, IIRC 3 months of salary and health insurance for 6 months. Or maybe the other around. It was 20+ years ago I don't remember all the details. I wasn't really worried about money as I had lived fairly frugally and socked away a lot. Plus I had the option money.I ended up moving to a LCOL mid sized city and got a job there. My salary was much lower than what I had been making before. But accounting for the difference in cost of living as well as taxes (I moved from ultra high tax state to ultra low tax state) I was right about even.It was a wild ride and it was exciting. It was a place and time that was special. I loved the experience. Plus I met so many people back then that I am still in touch with today. One of them started a company himself. He asked me to join, I would have bene employee 4 or 5, something like that. I passed thinking, dude no way this will ever become anything, look around you tech is dead. That company was later sold to Microsoft for MUCHO MUCHO money. Oh well, win some lose some.",Early-Surround7413,2025-08-05 17:38:06,183,cscareerquestions,t3_1miektc,False,
n737gvk,"I'm a millenial, was like 15 or something when 2008 bubble happened. My mom got laid off as a QA analyst, went back to take night classes while working as a church secretary, and became a paralegal. She is much happier now has her house paid off, and is about to retire.",bluegrassclimber,2025-08-05 17:37:58,81,cscareerquestions,t3_1miektc,False,
n7493z3,"I don’t wanna be a Debbie downer here….But my dad never got back into tech, and ended up doing shit jobs for the rest of my childhood. Now he works a so so blue collar job. It was a major source of trauma as a child because of all of the stress it caused between my parents. And I never intended to follow him into it lol.Aside from the personal trauma though, giving up on his tech career was clearly a stupid financial decision. Imagine if he had gotten back into tech, and been a senior in the mid 2000’s working in tech for 20 years? He’d probably have been retired for a few years by now. That’s probably the real lesson TBH—you’d can’t really predict the future. All you can do is work your ass off. People thought tech was dead for good.",Slggyqo,2025-08-05 21:08:49,71,cscareerquestions,t3_1miektc,False,
n73wtwx,"Your network is extremely valuable. It does not guarantee that you will get a job, but it may guarantee an interview. The amount of resumes folks get now is nuts, knowing someone at the company typically can get you into the interview pipeline",Whiskey4Wisdom,2025-08-05 20:03:41,27,cscareerquestions,t3_1miektc,False,
n730778,">if there are any takeaways from the last major bubble and burst in tech. yes, people pivoted to different careers, some never to be heard from ever again there's people being forced to sell stocks from retirement accounts just to put food on the table >The tech market is pretty bad right now this is still nowhere close vs. 2000 and 2008 from what I've heard though, 2000 and 2008 - companies simply went kaput - affected all sectors - nobody's hiring vs. nowadays 2025: - companies are making record profits, SPY just made all time high like last week - non-tech sectors are doing great - companies, including tech, are still actively hiring",NewChameleon,2025-08-05 16:59:54,55,cscareerquestions,t3_1miektc,False,
n74lthl,"My mom's cousin was one of those learn to code guys during the late 90s dot com bubble, he was make $130k/yr which was absurd in 1999-2001. He was on top of the world, got married, bough 2 nice properties, had nice cars, etc.Then the bubble burst and his salary got cut to $75k/yr which was still alright for that time. His ego was too big and he rage quit. He couldn't find another job for years, his savings ran out, then the investments he tapped into ran out and he resorted to the import/export business. He fucked up something, went to prison for years. Wife convinced him to sign over the homes to her before his conviction. She fell in love with some other guy and took everything he had while is was doing his bid.His life completely got ruined 25 years ago and he never dug his way back out. He's been living a quiet life in central america now.",XL_Jockstrap,2025-08-05 22:17:25,22,cscareerquestions,t3_1miektc,False,
n733db5,"I started my first job during the boom, kept that job over the full course of the bust, then was laid off 2-3 years after the worst of the bust. Was out of work for four months, then found something.",Ok_Experience_5151,2025-08-05 17:16:49,8,cscareerquestions,t3_1miektc,False,
n74lzbm,"I worked at a consulting-ish company. Left to follow a manager I really liked. Became part of an internal dev team. We all hated the company, but the market sucked (sound familiar?).It took about four years for the market to improve. The biggest indicator the market was getting better was every month, another person from our team was leaving. No one knows when things will get better. It might make sense to hunker down for some folks. But there are jobs out there. Assume things will get better eventually. Sometimes you are just caught in current events.",Chili-Lime-Chihuahua,2025-08-05 22:18:18,7,cscareerquestions,t3_1miektc,False,
n745qte,I went through both. My wife and I did. Had lots of friends in tech and at start ups. Some people went months looking for jobs but it was waaay easier then. First there were hardly any H1Bs. No offshore to speak of. Tech skills were still in high demand. 2008 was tougher from a banking and financial point of view. Stock market was crap for a really long time. But jobs. Not that hard.,grapegeek,2025-08-05 20:51:00,12,cscareerquestions,t3_1miektc,False,
n74w6hy,It was nowhere near as bad as this for the labor market. Most didn’t lose their jobs and those that did found new jobs. I do t know anyone who lost a job then. There was growing demand with new companies that quickly replaced the big companies that were hit hard. This current market wont recover for Americans unless the visa workers are sent home and we pause bringing any more in for at least 10 years.,Nofanta,2025-08-05 23:14:51,6,cscareerquestions,t3_1miektc,False,
n75edni,"If you’re in a SWE/devops role it’ll be a big deal. Lots of shops these days require their devs to both create and deploy and manage their products and services so this is fairly common.That said, does anyone really “know k8s”? Everything I’ve seen is that it’s a complicated mess.",inchoa,2025-08-06 00:57:24,229,cscareerquestions,t3_1miqd0l,False,
n75k7sh,"If the job needs Kubernetes, then it's important.I've been an SWE for 25 years, in many different roles, and never used it.",Slow-Bodybuilder-972,2025-08-06 01:30:48,77,cscareerquestions,t3_1miqd0l,False,
n75bde1,I find having the basic skills to navigate it very useful for understanding what’s going on with the infrastructure. I’ve never really had anyone ask about it for a non-DevOps position though. We don’t ask devs anything about it in interviews.,nsxwolf,2025-08-06 00:40:14,75,cscareerquestions,t3_1miqd0l,False,
n75btqm,It depends but having k8s experience will give you more opportunities.,debugprince,2025-08-06 00:42:51,34,cscareerquestions,t3_1miqd0l,False,
n763yj5,"I work at a kinda startup (we’ve grown to ~50 ppl but still a startup by age technically). We have me and one or two other devs who know the orchestrators, but we support all the major providers - swarm, k8s, oc, etc. it’s a useful skill to know your way around kubectl flags to view or exec into containers by name, navigate the namespaces, etc. It’s not an expectation to know them but it’s a definite plus that not a lot of people have.",claythearc,2025-08-06 03:29:55,6,cscareerquestions,t3_1miqd0l,False,
n75f123,100% depends where you work and what you do.Not all software is devopsy Web stuff.,Pale_Height_1251,2025-08-06 01:01:06,17,cscareerquestions,t3_1miqd0l,False,
n761mxk,I'd recommend using something like minikube to learn how to interact with the cluster locally.,Snoo_90057,2025-08-06 03:14:41,4,cscareerquestions,t3_1miqd0l,False,
n771zbv,"Bigger companies have dedicated devops / cloud teams to handle deployment and management for software engineers. at a small company, you probably need to know some level of kubernetes / cloud deployment to do it yourself.",yossarian-the-boy,2025-08-06 08:11:16,2,cscareerquestions,t3_1miqd0l,False,
n779ueg,It's the operating system of the cloud when working with large scale software,Historical_Flow4296,2025-08-06 09:25:26,2,cscareerquestions,t3_1miqd0l,False,
n79ngfq,supremely important in startups that rely on it. if layoffs start happening and you’re the only one who knows how to keep deployments alive guess who gets to stay on. even better if you know the application logic on top in the case of an acquisition where they dump the devops-only folks,StackOwOFlow,2025-08-06 17:31:37,2,cscareerquestions,t3_1miqd0l,False,
n7m5a6e,"That’s a good attitude to have. Your first job isn’t your last job. Always good to get a different perspective of how ways are done. Also a good idea to build up confidence in a cushy role. When you have some experience, you can find something more modern. I am guessing you mean Visual Basic VB",Successful_Leg_707,2025-08-08 15:18:22,76,cscareerquestions,t3_1mkxqxi,False,
n7mk6h3,A job is a job. Now you have work experience and you're a professional software developer. It is infinitely easier to get your next job with experience now.,DapperCam,2025-08-08 16:28:51,20,cscareerquestions,t3_1mkxqxi,False,
n7m57qp,"Any job right out of school is a good job, honestly if I saw someone immediately go to a BASIC job I think my only thought would be that I was impressed you'd throw yourself into some you knew nothing about.",Windlas54,2025-08-08 15:18:02,33,cscareerquestions,t3_1mkxqxi,False,
n7m8zq3,"I was in this exact same situation. The work was fine and the people were fine. Due to everyone  being there for 10+ years and the corporate rules of the company there wasn't  lot of chances for upwards mobility. I have since left that job, but I don't regret my time there.",NotABalloonPerson,2025-08-08 15:36:02,11,cscareerquestions,t3_1mkxqxi,False,
n7m5aod,Awesome advice! This type of broad base of exposure and and dealing with clients on jobsites is going to give you great exposure for moving into management if you choose to do so.The whole FAANG or bust mentality has been so toxic for so many people.,CoconutMonkey,2025-08-08 15:18:26,7,cscareerquestions,t3_1mkxqxi,False,
n7m8tdn,Congratulations. But be careful. One random morning they will announce the contract didn't get renewed and the company is shutting down.,pl487,2025-08-08 15:35:13,10,cscareerquestions,t3_1mkxqxi,False,
n7mdduf,"My first (and still current actually) job was a similar boat. Not basic necesssrily but a large part other dead languages - Ada, Borland Turbo C, etc at a <10 employee shop. I’ve worn a ton of hats since then, in many languages and tbh it really helped. It’s really pretty rare for a dev to have knowledge in like - pipelines and orchestration and software and hardware side etc. small / startup shops give you that. You gain almost nothing transferable from the language itself but realistically how much does that matter? We’re quickly*** leaving languages with foot guns behind so particular language knowledge becomes less valued while DRY, common patterns, etc remain",claythearc,2025-08-08 15:56:31,4,cscareerquestions,t3_1mkxqxi,False,
n7mpfk1,Whats the job title? And where did u find it?,Ok-Perception-717,2025-08-08 16:54:01,1,cscareerquestions,t3_1mkxqxi,False,
n7ns99s,"I bet your job security will be really good considering your co workers will probably retire in 5-15 years. Maybe you can help them try and modernize the stack slowly in parts and then eventually altogether. Honestly all I want in a job is something that is rewarding, has great wlb, and pays me enough that I can retire on time and afford my life, it doesn't have to be $300k+ TC faang BS... that just sounds stressful and depressing",SlightCapacitance,2025-08-08 20:01:43,1,cscareerquestions,t3_1mkxqxi,False,
n7o1zwe,"People focus way too much on languages. Anyone can learn a new language. That's the easy part.Every job on the other hand has transferable skills to the next job. Problem solving is language independent. As is dealing with customers, learning how to test properly, etc. That's the hard part that not everyone figures out.OP, this job sounds perfect for a first job, you're learning a ton about how everything works and you get to do a bit of everything. If I were hiring I'd be a lot more impressed by that than what language you used.",Early-Surround7413,2025-08-08 20:49:47,1,cscareerquestions,t3_1mkxqxi,False,
n7kjlcq,"was in almost the same spot, 4 yrs stuck on a legacy CRM no one else wanted to touch. i felt my skills were dying. i followed courses, watched every video on sd i found on youtube and messed around with this site, mysmartcareer or something like that, it isn’t magic but made me look at my skills differently not just “old tech,” but things like system troubleshooting, stakeholder comms, and process redesign. that helped me aim for platform migration roles, which got me out.",luv-cinamoroll,2025-08-08 09:13:35,65,cscareerquestions,t3_1mkq4c0,False,
n7kkpxu,Legacy code is gold. You're THE expert now in that legacy code. Ask for raises every year.,import_awesome,2025-08-08 09:24:16,95,cscareerquestions,t3_1mkq4c0,False,
n7lk7zn,"These “learn on your own time” comments are idiotic. Learn on the job and pad your estimates to give yourself more time if you have to. Don’t ask, just do it. If you are the legacy expert, they can’t outsource you to India or with dogshit AI. Stick up for yourself and make some time for your future.",SteelyDanPeggedMe,2025-08-08 13:34:34,32,cscareerquestions,t3_1mkq4c0,False,
n7kxccf,"Yes it is a trap. Your manager doesn't want you to grow your skills. Once you have the image of being the legacy stuff guy, it's difficult to shed it as recruiters will tend to offer you the same kind of job you did before.If growing professionally is a priority for you then you need to switch teams or company. Do not let companies decide your fate or projects you land on. Companies do not have your best interests in mind. Developing social connections can help immensely.",BeatTheMarket30,2025-08-08 11:12:40,14,cscareerquestions,t3_1mkq4c0,False,
n7m0u76,"You're the expert on the legacy code, so you're the best one to know how to replace it. Start working on the replacement, or the one being replaced will be you.",heresyforfunnprofit,2025-08-08 14:57:19,6,cscareerquestions,t3_1mkq4c0,False,
n7l23l6,Look at it from the business perspective. Calculate the cost of maintaining legacy code versus upgrading. Would product rather pay more for maintenance which will cost more over the long-term or upgrade and pay less for maintenance?,age_of_empires,2025-08-08 11:46:53,3,cscareerquestions,t3_1mkq4c0,False,
n7m8nhu,"Maintenance is an important part of the software lifecycle, and there's a lot of good engineering work you can do while a project is in the sustaining phase: add/improve test suites, make error handling better to reduce the cost of support, and incremental improvements to help standardize the codebase. That said, that company is never going to take you off this legacy project. You're a victim of your own success, where switching you to another project means more expenses and risk getting someone else up to speed. Ideally, you can find a project to contribute to where you're impact is greater than that cost, but that's not always easy if you are not a part of the org level decision making. Instead, I'd tell your boss how unhappy you are, and recruit them to the project of finding more interesting and/or different work. If they don't take the line, fine, but the project will have to continue without them. 3 years on the same project/org is enough time learn everything you can. If you want to continue growing, it's going to require a new project, one way or another.",justUseAnSvm,2025-08-08 15:34:26,2,cscareerquestions,t3_1mkq4c0,False,
n7mg4wu,Push for new projects. If they dont then teach yourself new stuff and try to rewrite the legacy stuff. If they dont let you rewrite it just lie and say you did when looking for a new job.,quantummufasa,2025-08-08 16:09:34,2,cscareerquestions,t3_1mkq4c0,False,
n7lc66j,Your boss is taking you for a ride.,high_throughput,2025-08-08 12:50:06,1,cscareerquestions,t3_1mkq4c0,False,
