id,body,author,created_utc,score,subreddit,parent_id,is_submitter,distinguished
n7jngyl,"You can find a list of community-submitted learning resources here: https://dataengineering.wiki/Learning+Resources*I am a bot, and this action was performed automatically. Please [contact the moderators of this subreddit](/message/compose/?to=/r/dataengineering) if you have any questions or concerns.*",AutoModerator,2025-08-08 04:27:30,1,dataengineering,t3_1mklq1i,False,moderator
n7js6dh,I'm in the Yann LeCun boat. LLMs are dumber than animals but have good recall. Could be a useful tool but only when used competently.,kaumaron,2025-08-08 05:03:56,549,dataengineering,t3_1mklq1i,False,
n7kkq2k,The way I see it. My job is more at risk from the AI speculative bubble popping than AI itself.,TwistedPepperCan,2025-08-08 09:24:18,218,dataengineering,t3_1mklq1i,False,
n7jxvyy,I recently migrated a calender data model from SQL to spark. I got half done pipeline. The debugging took more time than writing code.,rishiarora,2025-08-08 05:51:52,44,dataengineering,t3_1mklq1i,False,
n7jsmxz,"What’s the alternative? I can’t imagine this role being completely replaced. Just DEs becoming super intertwined with AI, prompting and literally using the tools as a copilot. I truly don’t know, but there’s just no way a business is going to ask people with 0 data/engineering experience to build fully functional and nuanced data pipelines with an AI chatbot. Sounds like a disaster",pl0nt_lvr,2025-08-08 05:07:40,103,dataengineering,t3_1mklq1i,False,
n7kh6op,"Altman ALWAYS says it's ""close to AGI"". It's just marketing.",schubidubiduba,2025-08-08 08:50:34,31,dataengineering,t3_1mklq1i,False,
n7kl936,"It has been like this for a while. I have half jokingly, half seriously said we might have already experienced peak generative AI and with the introduction of synthetic data flooding the internet, we might have plateau'd.",MikeDoesEverything,2025-08-08 09:29:17,16,dataengineering,t3_1mklq1i,False,
n7k3lrp,"I use cursor for my day-to-day mostly with Claude models. I agree one shotting a whole DAG that runs perfect with no bugs is unlikely. But if given enough context (rules, documentations that are truly relevant in markdown format, pre-prompting to define and refine a PRD), it vastly increases my productivity. I’m obviously biased but I think it will be DEs that don’t leverage AI pitched against DEs that do. My company is measuring productivity for these cohorts.",2aminTokyo,2025-08-08 06:42:42,34,dataengineering,t3_1mklq1i,False,
n7lgpji,Nooooo bro I swear we're 3 months away from AGI !! Just another round of VC money please brooo,pantshee,2025-08-08 13:15:33,9,dataengineering,t3_1mklq1i,False,
n7jql1q,It’s nothing big. Just marketing.,Old-Scholar-1812,2025-08-08 04:51:22,22,dataengineering,t3_1mklq1i,False,
n6yy2cf,"You can find a list of community-submitted learning resources here: https://dataengineering.wiki/Learning+Resources*I am a bot, and this action was performed automatically. Please [contact the moderators of this subreddit](/message/compose/?to=/r/dataengineering) if you have any questions or concerns.*",AutoModerator,2025-08-05 00:37:03,1,dataengineering,t3_1mhuuj2,False,moderator
n6zldxy,"Joseph: I follow you on LI and also went through your website, like your content and appreciate your efforts in creating this DE project.As a pure data modeler, sometimes I feel we're consuming more data that we need to which leads to processing more data than we have to and due to that all these fancy DE tools have come out. Yet, none of them really solve the core data issues like nulls, duplicates, redundancy and many more. The simple and old school style of sql, bash scripts and crontab jobs can do much more than fancy tools. It makes feel like we all should go back to roots using pure sql for most part for pipelines processing and maybe little bit of Python here and there. I hate how much noise Databricks makes using the term, ""medallion architecture"", which already been in practice for more than 3 decades even in traditional warehouse environments. They just used fancy marketing tactics to sell their product.",69odysseus,2025-08-05 02:56:33,57,dataengineering,t3_1mhuuj2,False,
n71uaot,As a beginner in this field I can't be more thankful to you for this :),footballityst,2025-08-05 13:34:53,3,dataengineering,t3_1mhuuj2,False,
n70uaq6,Commenting this to save it for later....lets be honest I'll probably forget about this until I get from work,zeni65,2025-08-05 09:17:46,5,dataengineering,t3_1mhuuj2,False,
n70ghvw,"Amazing, thank you so much for your effort",damnthatsadafboi,2025-08-05 07:04:51,4,dataengineering,t3_1mhuuj2,False,
n70h8ka,"Hi Joseph, it's great to see this! I first heard of you thanks to the engineering side of data podcast. Since then I watched and rewatched your YouTube videos so many times! They were one of my favourite resources as I was learning about the DE world for the first time. I will definitely check out your course!",arcadeverds,2025-08-05 07:11:46,2,dataengineering,t3_1mhuuj2,False,
n70x8vk,Will check it out today. Looks really cool!!,Theisnoo,2025-08-05 09:46:15,2,dataengineering,t3_1mhuuj2,False,
n70yffg,"Thanks Joseph, you're doing good things!",taker223,2025-08-05 09:57:03,2,dataengineering,t3_1mhuuj2,False,
n712s9q,I'm wondering if this is source available on GitHub/other?,lucidparadigm,2025-08-05 10:35:20,2,dataengineering,t3_1mhuuj2,False,
n716gb6,"I follow you on LinkedIn if I'm not mistaken (hope I got the right person), just wanted to say keep the good content coming!",tsk93,2025-08-05 11:04:33,2,dataengineering,t3_1mhuuj2,False,
n74z104,So if we kill you AI won’t replace us ? :thinking_face:,Alternative-Boss-787,2025-08-05 23:30:36,73,dataengineering,t3_1mifhgn,False,
n766cxy,My sales team wants to pretend that attaching AI to anything makes it super easy.,DesperateCoffee30,2025-08-06 03:46:10,14,dataengineering,t3_1mifhgn,False,
n7ayex4,"It's 2am, do you know if your data is AI ready?",KeeganDoomFire,2025-08-06 21:13:18,4,dataengineering,t3_1mifhgn,False,
n7ebwak,"I would be surprised if anything over 2% of this sub is actually contributing to AI. In fact, I am pretty sure almost nobody here is.",RustOnTheEdge,2025-08-07 11:20:37,3,dataengineering,t3_1mifhgn,False,
n79jyku,And often get the blame for anything that gets delayed because they don't interface with us. Although that's changing but I prefer the platform side.,SoggyGrayDuck,2025-08-06 17:15:52,1,dataengineering,t3_1mifhgn,False,
n761ogd,*chuckles* I'm in danger,ares623,2025-08-06 03:14:58,39,dataengineering,t1_n74z104,False,
n780bxh,I talked to the rest of the team. We are gonna feed the AI enough so that it becomes sentient and goes on strike.,groversnoopyfozzie,2025-08-06 12:42:51,2,dataengineering,t1_n74z104,False,
n76t3t8,"The other way around, we will always be the curators.",dataenfuego,2025-08-06 06:48:37,1,dataengineering,t1_n74z104,False,
n77kimv,"I think our executive team is finally understanding that programmatically getting data into and out of language models is nontrivial; must be controlled, logged, and audited; requires nonzero efforts at validation; and just generally sucks because it requires people. So, I guess we’re hiring because of AI?",SryUsrNameIsTaken,2025-08-06 10:57:52,12,dataengineering,t1_n766cxy,False,
n7omb33,"It's not because it would take too long, what do you have off the shelf that makes it look like we are ready?",justin107d,2025-08-08 22:38:51,1,dataengineering,t1_n7ayex4,False,
n7ma07y,The machine spirit must be appeased.,Bubbly_Taro,2025-08-08 15:40:47,48,dataengineering,t3_1mkyha2,False,
n7o5yt2,Sisyphus is the patron saint of data engineers.,Nightwyrm,2025-08-08 21:09:53,17,dataengineering,t3_1mkyha2,False,
n7nnl4q,I’m a plumber who exists in the matrix,StarWars_and_SNL,2025-08-08 19:38:29,7,dataengineering,t3_1mkyha2,False,
n7muzq4,[indeed](https://www.youtube.com/watch?v=AbSehcT19u0),MuffinHydra,2025-08-08 17:20:00,6,dataengineering,t3_1mkyha2,False,
n7ogzx8,"Hey, sometimes report writers get bored and decide to change a column type in a 3 year old report that’s had no issues at all",SupaWillis,2025-08-08 22:08:58,2,dataengineering,t3_1mkyha2,False,
n7rblpg,What is the phrase origin?,Timtam32,2025-08-09 11:07:14,1,dataengineering,t3_1mkyha2,False,
n7nawsd,"It's a mix of building data pipelines and dealing with messy data. Scraping is a big part, and I've tried tons of setups. Webodofy has been one of the smoother tools for that.",Glittering-Catch-491,2025-08-08 18:35:40,1,dataengineering,t3_1mkyha2,False,
n7r3qhc,"My friend and I call it ""fixing a lightbulb"", after [this Malcom in the Middle clip](https://www.youtube.com/watch?v=AbSehcT19u0).",NostraDavid,2025-08-09 09:51:00,1,dataengineering,t3_1mkyha2,False,
n7mcet4,Praise be the omnissiah..,Stressed_Student2020,2025-08-08 15:52:00,16,dataengineering,t1_n7ma07y,False,
n7rffa2,"A guy called Carlin Vieri who was at MIT in the 90s coined the term; known in academia for computer architecture work, and most recently display tech, namely OLED, VR/AR etc.He was watching the “Yak Shaving Day” episode of The Ren & Stimpy Show, which inspired the term “Yak Shaving”.",General-Parsnip3138,2025-08-09 11:39:30,1,dataengineering,t1_n7rblpg,True,
n7b3dbz,Data visualization skills demand outpacing supply...*Squints at incomprehensible chart*Yep. Looks about right.,nicolekay,2025-08-06 21:38:05,171,dataengineering,t3_1mjcmy3,False,
n7aid1j,The bubbles are all the same size?,Altiloquent,2025-08-06 19:57:14,127,dataengineering,t3_1mjcmy3,False,
n7apy2z,data analytics and data analysis? seems like someone didn't clean the data before grouping,everv0id,2025-08-06 20:32:44,71,dataengineering,t3_1mjcmy3,False,
n7a5iwa,"Yea, this is my experience job hunting right now. As someone with 7YOE I’m getting call backs and reach out for Senior/Tech Lead roles pretty regularly starting about 3 months ago before that with the layoffs calls sort’ve stopped coming in for a good 18 months or so.I’ve had 5 interview in the last month and signed an offer for a new job last week.The market is hungry for seniors, the problem is unfortunately that companies are not hiring juniors as aggressively. Who are going to be the future seniors if we don’t hire juniors?",MonochromeDinosaur,2025-08-06 18:56:09,87,dataengineering,t3_1mjcmy3,False,
n7azx87,"Just curious, why did you use a logarithmic scale for the axis? Wouldn’t it make more sense for them to be standard and just have the max and min of each axis set to 0 and 100?",the-taco,2025-08-06 21:20:45,26,dataengineering,t3_1mjcmy3,False,
n7b2j1w,"r/dataisuglyAlso, what does a 12x shortfall even mean? There are 12 open positions for every single data engineer? I highly doubt that.",Kukaac,2025-08-06 21:33:48,24,dataengineering,t3_1mjcmy3,False,
n7ce5rp,If you were my intern this would be a 30 minute feedback review,PossibilityRegular21,2025-08-07 01:57:47,12,dataengineering,t3_1mjcmy3,False,
n7bziy2,Shout out to the big gap between “data analytics” and “data analysis” as well as “data quality” coming in the back of the pack.,contrivedgiraffe,2025-08-07 00:33:10,10,dataengineering,t3_1mjcmy3,False,
n7a10pn,"Interesting, thank you! Can you go a bit more in depth about the methodology? Are these NA-Applications? How did you calculate demand?(Why are the tools of DE so far apart from the job itself?)",SommniumSpaceDay,2025-08-06 18:34:45,6,dataengineering,t3_1mjcmy3,False,
n7cw4xu,"OP, can you explain what the heck 10% demand and 10% supply mean and how the heck it's possible to have both at once?",Cosack,2025-08-07 03:52:41,2,dataengineering,t3_1mjcmy3,False,
n7gtl9y,"Interesting, as mentioned before, do you copy data into duckdb? Also how do you determine the query size before deciding which layer is appropriate?",ubiquae,2025-08-07 18:50:36,55,dataengineering,t3_1mk85dn,False,
n7gsqzp,"So, does Smart caching layer mean that you're replicating data from snowflake in duckdb, and your bi tool queries duckdb imstead of snowflake?",kayakdawg,2025-08-07 18:46:34,14,dataengineering,t3_1mk85dn,False,
n7gusbv,"If the majority of your snowflake bill is bi queries and not transformations, then Snowflake is probably not the best tool for you. You are charged on every minute of activity throughout the day, obviously any other open source tool would be better and cheaper.",higeorge13,2025-08-07 18:56:19,17,dataengineering,t3_1mk85dn,False,
n7guzi3,"As others expressed, it’s interesting but we need more details.",CrimsonPilgrim,2025-08-07 18:57:16,8,dataengineering,t3_1mk85dn,False,
n7i71c5,"Sounds like you swapped snowflake costs for complexity and staffing costs. DuckDB, Databricks, Snowflake and you built your own optimizer. Insanity.",lmp515k,2025-08-07 23:01:27,8,dataengineering,t3_1mk85dn,False,
n7ijtt9,This reads like AI spam.,codykonior,2025-08-08 00:14:47,5,dataengineering,t3_1mk85dn,False,
n7gygad,"Since unload and ec2 are a cost, why not just materialize in snflk and import into bi? Looks like a batch workload so query cache and materialization should work well here. Not sure why you need one more layer",SectionNo2323,2025-08-07 19:14:08,5,dataengineering,t3_1mk85dn,False,
n7h9byn,How many queries a day are we talking about?Numbers here are useless without throughput,kthejoker,2025-08-07 20:07:32,3,dataengineering,t3_1mk85dn,False,
n7h0ujs,AI slop.,NeuralHijacker,2025-08-07 19:25:55,8,dataengineering,t3_1mk85dn,False,
n7gtzhd,"If you don't mind me asking, how does this work in your case? Since DuckDB doesn’t run as a server, I’m curious how you made it fit into your use case. Specifically, how are you proxying or redirecting the queries or jobs that were previously targeting Snowflake to DuckDB?",Substantial-Cow-8958,2025-08-07 18:52:29,2,dataengineering,t3_1mk85dn,False,
n6tk5bf,"It's fine to read comments on this sub and not know what the fuck people are even talking about while still being a successful data engineer. Feel like the majority of commenters here are like ""if you're not an expert in literally everything with perfect data quality and perfect pipelines and perfect testing and perfect everything at every step of every process, you're a moron"". Sometimes you've just had the jobs you've had and access to the tools those jobs had and that's all you've had and that's fine.",Mononon,2025-08-04 05:13:18,488,dataengineering,t3_1mh4jx3,False,
n6trn74,most stakeholders are dumb as shit when it comes to data and at least 50% of reports won't ever get the usage that were estimated. people think they can do everything better in excel than the professional data analyst,vikster1,2025-08-04 06:19:01,110,dataengineering,t3_1mh4jx3,False,
n6tkrcv,Old school databases and PL/SQL (or equivalent) are going to solve 90% of the problems faster and cheaper than a new stack that’s going to spin up a bunch of containers or nodes. I’ve seen it over and over where a little preprocessing and just grinding it through a traditional db turns out significantly faster than using whatever new stack of the month is.,Another_mikem,2025-08-04 05:18:29,240,dataengineering,t3_1mh4jx3,False,
n6tklk3,"Mine is connected to yours: mirroring isn't for everyone, just backup your data more often.Also, interpersonal skills are more useful for DE than most technical skills (gathering requirements, managing complex sentences just to get simple yes or no etc.)Also, I like this subreddit, I often learn new things from it (based on some comments, this may be the most controversial one xd)",Maximum_Effort_1,2025-08-04 05:17:06,48,dataengineering,t3_1mh4jx3,False,
n6tlcfk,">*Streaming pipelines are overengineered for most businesses—daily batches are fine*I don't think thats an unpopular opinion at all, even though the batch frequency might be different.",None,2025-08-04 05:23:30,45,dataengineering,t3_1mh4jx3,False,
n6tp936,"Data Engineering is not an entry level role. You must have experience in at least one: database admin, data analyst, software engineer, backend engineer.",aisakee,2025-08-04 05:57:36,97,dataengineering,t3_1mh4jx3,False,
n6tx5nb,"Data engineers working with small data should rename their LinkedIn title to ""datum engineer"". (joke)Those are popular supposedly unpopular opinions on this community:1. Every data tools generation is just trying to reinvent what was already solved by relational databases and Kimball's Data Warehouse Toolkit1. PostgreSQL can solve most use cases1. Spreadsheets can solve most use case1. Streaming architecture is generally an unnecessary hassle",sib_n,2025-08-04 07:10:14,21,dataengineering,t3_1mh4jx3,False,
n6vvlab,People too often reach for Python when they should reach for SQL.,veritas3241,2025-08-04 15:24:27,23,dataengineering,t3_1mh4jx3,False,
n6tli3d,"I am with you. You really do not need to run some queries live each time you open a report.Adding mine: 1. You do not need to collect all data.2. Managers/seniors should test new concepts and queries on 10y amount of data, not one week. Most of the reports and queries will fail on this size and type of databases they imagined or will take a few hours to run.",tiredITguy42,2025-08-04 05:24:51,16,dataengineering,t3_1mh4jx3,False,
n6tuz4f,"Here is mine- Nothing can beat a well tuned and actively maintained SQL Server/Postgres (put any other well established mature on-prem rdbms product) in terms of cost efficiency. Cloud is nice, modern and all, but the pricing explosion fiasco of all major vendors (once they have locked your data and workloads) is completely crazy.",givnv,2025-08-04 06:49:44,32,dataengineering,t3_1mh4jx3,False,
n78ezz7,"Currency and timezones, aka job security. Godspeed friend.",mRWafflesFTW,2025-08-06 14:02:15,199,dataengineering,t3_1mj53aq,False,
n78sbxa,Freshness checks are absolutely paramount to data quality. I ran into a similar issue at some point and realized just because the pipeline is working doesn’t mean it’s performing correctly. Happens to the best of us. What’s your plan for making sure it doesn’t happen again?,poopdood696969,2025-08-06 15:06:51,49,dataengineering,t3_1mj53aq,False,
n7a4xq9,"I went to a meeting yesterday to understand some issues an analyst was reporting with garbage data from one of our datasets. Turns out that a report developer who doesn't know what the hell they're doing wanted to display a date as ""mm/dd/yyyy"" and put in a ticket and one of my idiots *changed the column in the database*.""Hey, my date filter is acting really weird."" You don't say...",deong,2025-08-06 18:53:18,23,dataengineering,t3_1mj53aq,False,
n78h3hs,"As a DE in ForEx, big oof, but big learning experience.",MakeoutPoint,2025-08-06 14:12:44,14,dataengineering,t3_1mj53aq,False,
n78pa33,operations or accounting will have to manually fix it in most cases lol either calculating on next bill deductions/refunds if the company isn't sketchy and keeps any extra profit from over charging / under billing. if your dev team is big enough they may ask you to try to fix it and push out new invoices but the cost most of the time is not worth it unless this happens more than once,AllYourBase64Dev,2025-08-06 14:52:19,4,dataengineering,t3_1mj53aq,False,
n7950n4,Freshness checks on every critical source,geek180,2025-08-06 16:06:10,3,dataengineering,t3_1mj53aq,False,
n7j7870,How are these data freshness checks/alerts not a part of the data pipelines already? This shit is table stakes for mission critical data pipelines (has been since the time of Ralph Kimball)! How are people not putting this basic level of ETL design thought into it while still being called data engineers? Two decades in the industry and I’m increasingly getting a sense that DEs today are over-indexing on latest tools/technologies while de-emphasizing the fundamentals.,DJ_Laaal,2025-08-08 02:35:35,2,dataengineering,t3_1mj53aq,False,
n78yrmw,I should check in my company database. Would earn me a promotion:eyes:,FuzzyCraft68,2025-08-06 15:37:16,1,dataengineering,t3_1mj53aq,False,
n79vw3j,"As I say: ""Assert yourself before you hurt yourself""",jeffvanlaethem,2025-08-06 18:10:24,1,dataengineering,t3_1mj53aq,False,
n7aeexz,Why would automatic exchange rates not be applied to the pipeline? That makes no sense unless it’s an ultra secure system not allowing external api,ironmagnesiumzinc,2025-08-06 19:38:32,1,dataengineering,t3_1mj53aq,False,
n7lwlao,This seems more a data structure question than a small dataset question.,Life_Conversation_11,2025-08-08 14:37:13,169,dataengineering,t3_1mkwns3,False,
n7nj8xv,Interesting takes. I’m successful in my DE role with big data but put me in a live coding session and I will absolutely bomb. It’s that pressure of someone watching. Even in meetings and doing excel can’t stand it when I’m trying to talk and do a stupid pivot table and my mind goes blank. Like listen folks I’ve been using excel and pivot tables for 20 years. I got it.,lowcountrydad,2025-08-08 19:16:43,51,dataengineering,t3_1mkwns3,False,
n7lw85h,"Our coding test is like this as well. It tests basic Python knowledge basics loops, lists, dicts, try except. IMO learning to use a library is easy also not everyone used the same libraries in their day to day. Keeping it basic Python evens the playing field for all candidates and also allows us to evaluate the candidates ability to write clean readable code, not chaining library methods.",MonochromeDinosaur,2025-08-08 14:35:28,67,dataengineering,t3_1mkwns3,False,
n7o5t03,"Am I taking crazy pills here? What exactly is the point of testing a set of python skills you will and especially should *never* use in your job? Now, I use defaultdicts, sets, lists, tuples and normal dictionaries, and manipulate them with comprehensions, while loops and for loops all of the time at work. But never for datasets, those are always handled in a dataframe library that has thought of all of the edge cases and scales gracefully.",ReadyAndSalted,2025-08-08 21:09:03,15,dataengineering,t3_1mkwns3,False,
n7m8t24,"No, you forgot how to code.",robberviet,2025-08-08 15:35:10,86,dataengineering,t3_1mkwns3,False,
n7lvoab,Polars is for small to mid-size data. It really depends what you're doing with the data whether Polars or a dict are fastest.,ProfessorNoPuede,2025-08-08 14:32:48,11,dataengineering,t3_1mkwns3,False,
n7qnz2w,Why do you call polars “big data” this just sounds like you forgot your algorithms & data structures,MyRottingBunghole,2025-08-09 07:10:16,9,dataengineering,t3_1mkwns3,False,
n7mpq5t,That's kind of a weird test because you'd almost certainly be using Polars or similar in production. How small of a dataset are we talking about?,Bach4Ants,2025-08-08 16:55:23,14,dataengineering,t3_1mkwns3,False,
n7nm70k,"God, you’re going to get hammered here.",LoadingALIAS,2025-08-08 19:31:23,6,dataengineering,t3_1mkwns3,False,
n7mdczq,"For python coding tests, you really just need defaultdict and a very good grasp on the map and reduce methods. For sql, duckdb + standard sql skills",sahilthapar,2025-08-08 15:56:24,4,dataengineering,t3_1mkwns3,False,
n7dywxi,"Duckdb is an “in process” database. It has its own scheme for storing data in memory and disk. However, it’s also able to “connect” to other sources besides its own duckdb stored data file. For example it  can access and query parquet and csvs as if they were tables. Even more interestingly since it’s “in process” it has full access to the memory space of the process. What that means is that it can actually connect to a in memory pandas or polars dataframe and run queries on it as if the df was a table and it can write the results back to pandas df. So you can do something like this:```df1 = pd.Dataframe(…)df2 = pd.Dataframe(…)df = duckdb.query('''    select a, sum(x) as x    from df1    inner join df2 on …    group by a''').df()```",HNL2NYC,2025-08-07 09:33:12,142,dataengineering,t3_1mjudxc,False,
n7f0cip,Duckdb - especially with ducklake can be used as a full blown datalake. Where data is stored in object storage like s3 and table/schema metadata is stored in a transactional db like postgres. We use motherduck - which is cloud hosted managed version of duckdb. Our data is 10s of TBs and we do highly interactive queries with sub 100ms latency. We were on snowflake before. MotherDuck is >2x cheaper and 2x faster than snowflake for our query load. Also helps that DuckDB is open source and they continue making it faster and better.,african_cheetah,2025-08-07 13:38:35,33,dataengineering,t3_1mjudxc,False,
n7e2g2l,"Just because nobody's made this distinction yet:DuckDB is an in-memory columnar database that can temporarily spill to disk for datasets that are larger than memory. It's most often accessed via its python API.MotherDuck is the name of both the managed cloud warehouse and the company that sells it that also maintains DuckDB.A lot of the oft-noted limitations of DuckDB (eg, its poor handling of concurrent updates) are more a feature than a bug with that in mind--as badass a tool as it is, at the root, it's a PLG tool for the warehouse that it's fully compatible with.",BarryDamonCabineer,2025-08-07 10:05:18,16,dataengineering,t3_1mjudxc,False,
n7ds28o,"Haha nah man, DuckDB’s way more than just another DataFrame thing. It’s actually a columnar database, kinda like SQLite but for analytics. Most Python tools like Pandas store stuff row by row, but DuckDB stores it column-wise, so it flies when you’re running big joins or crunching Parquet files.",rtalpade,2025-08-07 08:26:54,63,dataengineering,t3_1mjudxc,False,
n7dsqcm,A big thing to remember is that DuckDB is an embedded database and not a traditional RDBMS server. https://embeddedcomputing.com/technology/software-and-os/ides-application-programming/be-sure-thats-what-you-need-differentiating-embedded-database-from-non-embedded-clientserver-database-systems,intellidumb,2025-08-07 08:33:27,11,dataengineering,t3_1mjudxc,False,
