id,body,author,created_utc,score,subreddit,parent_id,is_submitter,distinguished
np341la,Thank you,draezo,2025-11-16 03:05:25,5,dataengineering,t3_1oy9jq4,False,
np4y9ge,This is such a great idea!I'll add a reference to my old timey fave http://www.pythonchallenge.com/ for a side quest.,Intelligent-Sir8144,2025-11-16 12:45:06,3,dataengineering,t3_1oy9jq4,False,
np36y5b,"Nice, I wast just testing it out and for Case Level 2 I was just seeing what would happen with the queries below and both say verified but one is not correct.select name, age from suspects; |name|age||:-|:-||Marcus Rodriguez|34||Sarah Chen|28||Tyler Johnson|17||Emma Williams|16||David Thompson|22||Jessica Martinez|31||Michael Brown|25||Ashley Davis|19||Christopher Wilson|29||Amanda Garcia|23|(10 rows returned)select name and age from suspects; |||||0||0||0||0||0||0||0||0||0||0|(10 rows returned)",foO__Oof,2025-11-16 03:24:13,2,dataengineering,t3_1oy9jq4,False,
np3dikh,"That's really creative, kudos brother!!",Zealousideal-Cod-617,2025-11-16 04:08:12,2,dataengineering,t3_1oy9jq4,False,
np363u3,That's a cool one brother,fitforuser,2025-11-16 03:18:48,1,dataengineering,t3_1oy9jq4,False,
np4u4iy,cool ty :),ab624,2025-11-16 12:10:33,1,dataengineering,t3_1oy9jq4,False,
np5zv9g,very nice approach to teach SQL :),TiredDataDad,2025-11-16 16:31:39,1,dataengineering,t3_1oy9jq4,False,
npicdhm,"So, suspects are a table (entity), not an attribute?I understant, though, the goal is to teach SQL, not proper data modeling",IndependentSpend7434,2025-11-18 15:46:18,1,dataengineering,t3_1oy9jq4,False,
np39fbn,"Thanks for trying it out. You are right, the validator is very basic right now, so it sometimes marks incorrect queries as verified. It is just a small passion project I work on when I get time. I appreciate the feedback and will improve it as I go.",TurbulentCountry5901,2025-11-16 03:40:32,15,dataengineering,t1_np36y5b,True,
nosdmvv,You didn’t really say what you actually ended up using did you?“Found messaging that runs on cheap hardware” is pretty pretty vague dontcha think?My money would be on NATS but who knows…,graphexTwin,2025-11-14 10:36:29,90,dataengineering,t3_1owsh0m,False,
nosif5o,"Rambles about problem and attempts, never discusses solution. Classic chatgpt post",ssenseaholic,2025-11-14 11:20:49,79,dataengineering,t3_1owsh0m,False,
nosoaqk,Still waiting for punchline of solution used...,nodeNO,2025-11-14 12:09:05,19,dataengineering,t3_1owsh0m,False,
nou88y6,i learned nothing from this post,the_mind_goblin1,2025-11-14 17:18:07,15,dataengineering,t3_1owsh0m,False,
noscg4l,Nice sharing! Could you please share more about the final solution you implemented? Did you setup a server at each factory to receive data from sensors and send to your data warehouse? Is it still MQTT capable sensors? What server did you run at each factory? I really want to see an architecture of yours but I know it’s too much to ask for haha.,SeaCompetitive5704,2025-11-14 10:24:48,12,dataengineering,t3_1owsh0m,False,
noshh8c,can you elaborate ?,vossda,2025-11-14 11:12:17,7,dataengineering,t3_1owsh0m,False,
nosi1i8,"Are you sure you use MQTT the correct way? Connect and disaconnect must be handled carefully. I had 2000 machines work perfectly, not a single data-loss and data is retrain 7 days.",Michelangelo-489,2025-11-14 11:17:24,9,dataengineering,t3_1owsh0m,False,
notc8sj,"2 million data points per day is about 25 per second. It's not nothing, but that seems too few to have serious scaling problems given the simplicity of the data points here... At a facility on average about 2 per second, presumably with each site having its own intermediate server should be trivial sending batches every ~1 minute to 10 minutes dependent on how real time real time needs to be. Someone please point out what I'm missing here for why this was so challenging?",TA_poly_sci,2025-11-14 14:37:26,10,dataengineering,t3_1owsh0m,False,
not5x7i,"Not sure what this guy actually did, but if anyone's wondering a good framework to start with would be:https://factoryplus.app.amrc.co.uk/",lablurker27,2025-11-14 14:02:15,6,dataengineering,t3_1owsh0m,False,
noscey3,"Edge resilience > fancy throughput. IoT should survive bad networks first, optimize performance second.",AliAliyev100,2025-11-14 10:24:28,2,dataengineering,t3_1owsh0m,False,
novdrdn,"You can find a list of community-submitted learning resources here: https://dataengineering.wiki/Learning+Resources*I am a bot, and this action was performed automatically. Please [contact the moderators of this subreddit](/message/compose/?to=/r/dataengineering) if you have any questions or concerns.*",AutoModerator,2025-11-14 20:49:34,1,dataengineering,t3_1ox84x9,False,moderator
noviksi,"Lmao, I thought we were working at the same company for a second.",jotunman,2025-11-14 21:14:58,102,dataengineering,t3_1ox84x9,False,
novilhk,"To be honest most organizations are in the same boat and more or less a shitshow. I had very similar experiences, in multiple organizations. This is the corporate world. If the current situation is making things very difficult and frustrating, then keep moving around, one team to another, or one organization to another and look for opportunities where you can make things better. As you go higher up the corporate ladder, the more power and ownership you will have and it will be more feasible for you to do things the right way.But keep at it. It's hard to find people who really try to do things the right way and trust me you will be valuable to any organization.",Particular_Prior8376,2025-11-14 21:15:04,45,dataengineering,t3_1ox84x9,False,
novn1k5,"Sorry but that's normal. Most companies do not invest in DE until the shitshow their early data scientists and BI analysts built becomes unmanageable. Then DE's job is to clean up.Very few companies are doing anything with AI and data. It requires good documentation and metadata, which most shitshows don't have. So you aren't missing a lot.What you can do is try to set an example. Pick a manageable subset of the data. Document it. Tag it. Whatever. Throw an LLM at the docs and ask some basic stuff. See what works and what doesn't. Iterate. As you see success, share improvements and milestones. Companies are desperate for AI use cases and you get good practices under the hood for yourself to boot. Try sharing with teammates and working with them to update other datasets. Learn and teach.",lab-gone-wrong,2025-11-14 21:38:04,36,dataengineering,t3_1ox84x9,False,
novgfeo,"That would be a standard issue shitshow, yes. However I think it means trying to push into a modern de position at that company or another, as DevOps as a specialty seems to be getting absorbed into various software and data engineering roles.",Simple_Journalist_46,2025-11-14 21:03:43,19,dataengineering,t3_1ox84x9,False,
now6ttq,"> This doesn't feel like data engineering, this feels like janitorial code cleanup as a result of poor project planning and no foresight. Welcome to data engineering in corporate. Where you may have the most technical experience/knowledge, but an MBA will own more of the decisions happening in your business, that will ultimately impact more of the end result than anything you can ever do unless you move into a business/management position yourself where you'll still be surrounded by a majority non-technical people with many, many, many opinions. And whether or not you even get that opportunity is a political matter, not a technical one.",Skullclownlol,2025-11-14 23:28:33,12,dataengineering,t3_1ox84x9,False,
novmdnf,"There's a point where you have to make the decision on whether you're working for your resume or just to keep the company trudging along.You can put in the fanciest of tech and the first question you'll get is how can I get this into excel. And in ten years, it'll still be the same question.Once upon a time I worked for a company that was obsessed with chasing the hottest tech, whether it made sense or not. It was a constant clown car fire drill and the data processes suffered greatly as a result. I started plopping down SQL server/ssis everywhere, because I can fix whatever your problem is in a few days and you can take however long it is you need to build out XYZ and you have a control system you can run in parallel with and when you can demonstrate that you can reliability replicate my numbers, we can migrate over. Over time a lot of these initiatives died off because it became harder and harder to justify the man months spent reinventing the wheel and these comically large cloud bills for really simple tasks.I'm sure that's an unpopular opinion, I like cool tech too, but I just want something I can trust to work and move on with my life.",JohnDillermand2,2025-11-14 21:34:35,11,dataengineering,t3_1ox84x9,False,
novezhp,"Sounds pretty much par for the course. But think of all the experience you'll get! You should ask yourself whether you want a next step, and if so, whether it lies more with architecture or management.",nogodsnohasturs,2025-11-14 20:56:02,6,dataengineering,t3_1ox84x9,False,
novn7zp,"A lot of stuff you read about DE is people inflating their own achievements, publishing/posting to help their career hustles, flexing their FAANG ""best practices"", influencers creating content, and above all, vendor-influenced hype intended to get the enterprise-level decision makers (not the people on the tools) on side.I think it's really easy to come away with this idea that you're the last tribe banging rocks together in the flying car era, but the reality of DE isn't the super shiny turnkey cloud deployments that unlock your data's value that is often portrayed. What you're describing sounds typical, maybe even kinda good? Don't expect to find a job where you are free from dipshit architecture and handed up to date documentation of your data assets in day 1, maybe those roles exist somewhere but I haven't seen them.If you think in terms of business value, I'm wondering if your org's move to the cloud was a bright idea. If you're not a fortune 500, a not-terrible on prem warehouse is perfectly adequate, and a better investment in data might have actually been to document what you have and work towards a medallion architecture just within the dwh, which would have given you the opportunity to systematically unpick the sources and transformations, embedding business logic and documenting it as you go. But dipshit architects with a vendor in their ear are far from rare, anywhere you go.It feels universally accepted that if you're on prem you're not a real DE and execs and architects believe it's a fundamental truth that the cloud will unlock value. In your case it sounds like your org had a not-terrible thing going already, and fucked yourselves with a lazy lurch into the cloud that just lifted and shifted your existing problems.Maybe the question to ask is what it is that you like about DE. Today you've got big problems to solve and lots of business value to unlock, a management structure above you that's floundering and will think you're a wizard if you help them by implementing some common sense basics, and a pretty typical set of issues that will be familiar in any role.",fauxmosexual,2025-11-14 21:38:58,5,dataengineering,t3_1ox84x9,False,
novz0pq,"It’s all about the company. Some companies have some extremely basic data needs. And what I love about data engineering/science/the data discipline in general, is that simplicity wins. If you’re at a company with a working warehouse operation, you’re winning.If, however, you’re looking for more excitement, you should traverse into big data. That’s the “flying car” part of the business. If you get into a role at a big data firm (thing firms who do massive real time streaming, like a media company or financial firm), you can work closely with ML engineers and eventually sharpen your skills to become an ML engineer yourself one day. That role will be growing dramatically with this AI boom.",undercoverlife,2025-11-14 22:42:42,3,dataengineering,t3_1ox84x9,False,
noos11l,"Data product: a groomed, filtered, cleaned, documented, probably denormalized dataset that general SQL users can understand and perform their own analysis with. Possibly OLAP-ready. Warts and legacy foibles would hope to be cleaned out. 'What the thing would look like if we designed the schema today knowing what we know now' sort of things that need a lot less explanation. Contract: as close to an end-end source-to-sink documented, constrained schema or schema subsets so that you can talk and reason about and trust with others.",CrackerJackKittyCat,2025-11-13 19:58:30,101,dataengineering,t3_1owaz2q,False,
noov551,"Raw Data=Egg Data Product=Omelette, Scrambled Eggs, French Toast Data Contract=I want eggs everyday, 2 dozen, medium sized from fresh poultry and if there are bad eggs how quickly will fresh poultry fix it so my customers can have their dishes.",Gagan_Ku2905,2025-11-13 20:14:14,68,dataengineering,t3_1owaz2q,False,
nopycsq,"Data product: ""Hey CEO, this is a thing that is created through work of the data team and we can explain directly how it makes money/saves cost""Data contract: ""Hey engineer, if you change anything about this API we ingest again..."" or, if you are especially lucky: ""Hey Gertrud from corporate admin if you delete this column in this spreadsheet again...""",TJaniF,2025-11-13 23:40:14,8,dataengineering,t3_1owaz2q,False,
noq1ox1,"Let me focus on data products. I have a data engineering background, and yes, these terms often get thrown into the buzzword bucket.But I actually like thinking in data products. A little story time: Our team once had a major pipeline outage (fun fact: it was when we upgraded our Hadoop infrastructure to a new major version, what a mess :man_facepalming:). Suddenly, everyone in the company understood our value, because they saw what broke when our tables and processes went down.Up until that point, I often struggled communicating our value to stakeholders. Then, during a sales call with a third-party company, they asked me, ""What are your data products?"", I heard it the first time and thought it was just management speak. But actually, it became quite a useful tool for me.While software engineers ship visible features, data engineers build invisible infrastructure. Our work powers decisions, reports, and systems behind the scenes. That makes it hard to demonstrate value.Technically speaking, I'd define a data product as a composition of assets that, taken together, deliver a result with business relevance(!). Assets can be anything involved in the process: input tables, queries, processes, models, intermediate results, etc. If we're talking Airflow specifically (because this is well known by most), that means tables, Dags, tasks, everything involved in delivering the outcome.From a data engineering perspective, data products are a communication framework to make our work visible. Simple concept, but powerful for explaining what we actually deliver.From a management perspective, a data product is a measurable business asset with clear ROI and accountability. It's something you can point to during budget discussions, assign ownership to, and track performance against defined SLAs.However, not every table, task, or Dag is a data product, but it might be part of one. It's a good exercise to identify them by looking at: Business impact (if this disappeared tomorrow, would executives notice? Would customers be impacted?), orchestration complexity (we had a super Dag triggering lots of other Dags, that was a clear sign for a data product), and high-value consumption (multiple teams depending on it, feeding executive dashboards, etc.).Look at all your data assets, try to group them together as data products, and also learn what value those data products generate (e.g. what are the tables, reports used for? Is there any measurable impact like revenue, cost savings, increase retention times along the chain?). This will help you to communicate the value of your work, be it internally or when applying for a new job and it helps understanding what needs monitoring and observability.**Basically: When they work, they're invisible. When they break, everyone notices.**",prenomenon,2025-11-13 23:59:52,7,dataengineering,t3_1owaz2q,False,
noovj06,"I think software development industry often generates some FOMO with this kind of ""modern revolutionary mindblowing"" conceptsdata product: nothing more than a dataset with a well-defined scope, data governance policies, refined data ready to be analyzeddata contract: dataset documentation (columns and their meaning, data quality policies, SLAs, etc.). It could be great too to track changes (e.g. if a column is added or removed).",FortuneDry5476,2025-11-13 20:16:11,11,dataengineering,t3_1owaz2q,False,
noowcgi,"They are abstract concepts that are common sense, but provide common language that is more formal than, “just look at this spreadsheet that should be up to date”",Wh00ster,2025-11-13 20:20:20,3,dataengineering,t3_1owaz2q,False,
nopgi24,Buzzwords,SasheCZ,2025-11-13 22:01:30,4,dataengineering,t3_1owaz2q,False,
nootomn,"I did a post in this subreddit last week around real-world implementations of data contracts: [https://www.reddit.com/r/dataengineering/comments/1oigp5k/five\_realworld\_implementations\_of\_data\_contracts](https://www.reddit.com/r/dataengineering/comments/1oigp5k/five_realworld_implementations_of_data_contracts)Data Products: Operationalized data or data workflows that are packaged as a service.Data Contracts: A means of change management as code via data assets, a contract spec setting expectations as code, detection of changes of a data asset, and prevention via the CI/CD workflow.",on_the_mark_data,2025-11-13 20:06:51,1,dataengineering,t3_1owaz2q,False,
nopbhp9,"Data contracts are easy to understand with an example.  Here's one:Rather than my warehouse querying your database and its 400 tables we agree that you will send any changes to any of the tables related to ""incidents"" to a kafka topic.  We probably won't have automated tests to confirm this, though we could.And the message you send will have to comply with our shared jsonschema.  This locks down the fields, their types, formats, min/max values, null rules, etc, etc. As the producer you will use this as part of your testing strategy.  As the consumer I will validate every message you send against it.Together we will design the schema, keep it in version control and version it.If we have our pipeline stops, you get alerted, we send tickets your way - and it's on you. For example, unknown schema version, or jsonschema rejects your data.",kenfar,2025-11-13 21:36:32,1,dataengineering,t3_1owaz2q,False,
nope7we,"I think of a data product like a subscription to an app, let's say HBO publishes an app (data product). I request access to it, they approve (after I pay) and then I can access the data product. They can revoke at any time (governance).Contract is more complex. SLA's, Schemas, validation, output port (how I can get access) and promises that what I request is what I actually get. I think contract should be immutable. Need to change it? Make a new product, with a new contract. But there's a lot of options here.",Pr0ducer,2025-11-13 21:50:03,1,dataengineering,t3_1owaz2q,False,
nozce5f,I hate this mod team sometimes. This was a perfectly good post for discussion,PantsMicGee,2025-11-15 14:23:43,56,dataengineering,t3_1oxspqy,False,
np07wg1,"In my school we database class we went over Relational Algebra, dependency theory, normal forms, and our projects were to build a database.And a data managment course that goes over queires, join, sets, indexing, replication, grouping, aggregations using oracle cloud. Projects were more to build a data infrastructure and generating reports.This was for a MSCS but courses were split level so also 4xx level undergrad.",ds_account_,2025-11-15 17:14:49,11,dataengineering,t3_1oxspqy,False,
np05jlu,Fellow Data Engineer here with same experience 15+ Years I work in US GCC Mostly they are taught RDBMS in DBMS subject and bit of BI in MIS But I think they cant get past GROUP BY clause in thier curriculam,Zestyclose_Squash811,2025-11-15 17:02:25,17,dataengineering,t3_1oxspqy,False,
np0j9qp,"Final year student here ,In my third year I took big data elective .they did teach about hdfs,spark,kafka and some theoretical things of Hadoop family.i hate my college for not adding topics like data modelling, airflow and pipeline design patterns I had to self study these .",elmadtitan,2025-11-15 18:14:00,8,dataengineering,t3_1oxspqy,False,
np0l9hm,The year after I left my undergrad in 2023 they added a big data class. But other than that there was a databases class that taught us about how things like b trees work and relational databases. Wouldn’t say it was super helpful but was really interesting,honey1337,2025-11-15 18:24:10,4,dataengineering,t3_1oxspqy,False,
np00g5g,"SQL and Python is taught, but not ETL, data DAGS and movement principles. Cloud Dev Ops side depends on the course I think.",peterxsyd,2025-11-15 16:35:44,4,dataengineering,t3_1oxspqy,False,
np3l1jy,"I don’t think schools should be purely job training centres, they should be teaching the basics of computer science and the employers should be training the new grads in the specific subsection of skills needed for their particular discipline. Unless the degree says Data engineering, you should just expect to have to teach new grads the ropes.",eightbyeight,2025-11-16 05:03:50,2,dataengineering,t3_1oxspqy,False,
np2elvh,"8YOE DE got my CS degree when I already had 5YOE (So 3 years ago) Databases, Advanced Databases, ""BIG data"", distributed systems courses are usually electives. Even then they're taught more OLTP style database management than how to do DE. Every junior DE I've trained has learned most of their skills on the job. Thankfully my current and 2 jobs ago took DE interns and new grads and we could teach them, that said they're super picky about who gets in they have to have some affinity for data related work.",MonochromeDinosaur,2025-11-16 00:30:44,2,dataengineering,t3_1oxspqy,False,
nozam2o,"You can find a list of community-submitted learning resources here: https://dataengineering.wiki/Learning+Resources*I am a bot, and this action was performed automatically. Please [contact the moderators of this subreddit](/message/compose/?to=/r/dataengineering) if you have any questions or concerns.*",AutoModerator,2025-11-15 14:12:57,1,dataengineering,t3_1oxspqy,False,moderator
np4j4e1,In my BE we had optional data warehousing subject in Information Technology specialization.,ManipulativFox,2025-11-16 10:24:09,1,dataengineering,t3_1oxspqy,False,
npf5m95,"Don’t do it this way. Instead, build a semantic layer on to of your models. Then, create an extremely simple agent that translates a user request into Metrics to query and Dimensions to group by. Don’t have an LLM do what you can do programmatically.",McNoxey,2025-11-18 01:44:27,67,dataengineering,t3_1ozmp12,False,
npcz6dw,How does user verify accuracy of the result?I am thinking to do something similar thr it seems like LLM haulicate SQL too much to be trusted,543254447,2025-11-17 18:42:42,22,dataengineering,t3_1ozmp12,False,
npezj72,"If you need to use AI to appease the powers that be, I think this system mostly makes sense. That said, I think that nontechnical people generating code using unreliable tools to gather data that is summarized by unreliable tools is a fundamentally broken approach. It doesn't empower lay people to work with data. It replaces their relationship with trusted data professionals with a fake version of a data professional. Providing the illusion of trustworthiness and soundness.",MrRufsvold,2025-11-18 01:07:24,11,dataengineering,t3_1ozmp12,False,
npdxdiy,"Don't build an MCP to validate the query. Create a role for the service that only allows what you want, let the db handle the rest.",opseudo,2025-11-17 21:34:11,9,dataengineering,t3_1ozmp12,False,
npehc5n,"From my experiments, SQL generation has \~60% success rate and 20% being results that look correct but aren't. I don't think you can fully replace BI people internally, but you can have good success with tool use and a large catalog of pre-prepared queries.",scott_codie,2025-11-17 23:21:04,9,dataengineering,t3_1ozmp12,False,
npde4m2,"What's your wider BI stack look like? Power BI has some not-terrible out of box functionality for letting users direct query a semantic model, which is a much cleaner way of achieving the same thing and leverages the semantic work in the semantic model. I'm sure other vendors are looking at the same thing. Or is this tool for people building semantic models?",fauxmosexual,2025-11-17 19:56:42,9,dataengineering,t3_1ozmp12,False,
nphynau,"Your architecture is solid and you're thinking in the right direction. I've built this exact pipeline 3+ times in production and here's what I learned:\- Your logging strategy is RIGHT. But also log failed queries plus why, user corrections, and execution time plus row counts \- Few-shot retrieval beats fine-tuning \- Schema context matters most \- Add safeguardsMy stack: Llama 3.1 70B + BGE embeddings + SQLGlot validation + Redis cacheRetrieval-augmented prompting gets you 80% there fast. Save fine-tuning until you have 10K+ pairs and proof you need it.",andrew_northbound,2025-11-18 14:35:30,4,dataengineering,t3_1ozmp12,False,
