id,body,author,created_utc,score,subreddit,parent_id,is_submitter,distinguished
mncc71y,"I would start by having a frank discussion with your mentor or manager. Are you doing well? Do they have any feedback for you? What would you need to do in order to receive a full-time offer?IMO it's somewhat unprofessional/odd that you were not given that feedback: part of the job of a manager is to make sure every employee knows if they're meeting expectations/remove uncertainty about where they stand. But that's by-the-by -- I think the important thing here is to get direct info + directly ask for the feedback you're looking for.> I’ve been doing a programming internship at a big, globally known company for a year nowThe length of your internship is pretty unusual. Maybe this is a regional thing, but at least in my corner of the world (US west coast), most internships last ~3-4 months, typically during the student's summer break.In any case, I do think it's reasonable for you to be feeling burnt out. I don't think it's reasonable to expect you to juggle both schooling and work for this amount of time.> When I landed this internship, I had zero technical knowledge and was just starting my degree.I'm a little surprised by this, tbh -- somebody with zero technical background doesn't have the ability to contribute in a meaningful way in a programming role. It's an odd pick for an intern; usually you want somebody with partial experience so the intern mentor doesn't need to spend time covering the basics.Did the company know this when they hired you + ask you to go through some training program? Or was this more of a hybrid internship, where you applied some of your other skills in in addition to programming? What were their expectations?TBH my first instinct here was that the company did not set you up for success by hiring you at such an early stage in your career.> I made mistakes, of course,but no one really explained what I was doing wrong or how I could do better. Any internship program worth its salt should assign you a dedicated mentor. Do you have one? If not, can you ask your manager (or whoever is managing the internship program) to assign you one?> over time, I’ve started to feel like I’m being excluded. Nothing direct or obvious, but there are signs. I try to contribute, show interest, ask questions… but everything I do seems to go unnoticed. [...snip...] Despite being an intern, it often feels like we’re expected to deliver at the level of someone with years of experience.It's hard to tell what's happening here without more specifics.For example, maybe what's happening is that you rose to the occasion and people are treating as you as having roughly the same skill as a junior engineer -- and maybe they're leaving you alone since you seem to be doing fine and are not realizing you're actually struggling to keep up? Or alternatively, maybe they're disengaging because they need to focus on their own work now, or are burnt out themselves with teaching and mentoring? It's a bit hard to say.> Lately, I’ve been thinking that maybe I should try working at a smaller company—somewhere with a slower pace, less pressure, and where I might actually be able to learn and breathe.Usually an internship has a concrete end date; I'd try sticking it out until then. If yours does not, then I'm not quite sure what's going on tbh.Other things to try:- Quit to focus on your schoolwork. Find another internship next summer.- Add your current internship to your resume; use it to help you find an internship at a different but similarly well-regarded company.- Ask if you can transfer to a different team. Maybe the working culture will be different there?- Tell your manager that you're struggling to balance school and work and seeing if they can help adjust your workload. You're a student -- it's reasonable and correct for you to put your education first.",michael0x2a,2025-04-16 02:15:58,6,learnprogramming,t3_1k05k5x,False,
mncfqd8,"I'm a dude in my early 40s, been writing software for pay well over 20 years now and this is just how it feels sometimes, especially when you're just starting out. But you'll also hit periods of this at new jobs, when joining new teams, starting new projects in parts of a product you haven't worked on before, when using new technologies, coming back to old technologies you haven't used in a while that have changed underneath you, on a Tuesday when the stars don't align just the right way...Basically, get ready to feel like a big ole dummy a lot of the time. And it never stops feeling awful when it happens, no matter how good you've become at the things that used to feel so difficult and complex.But I promise: you *will* get better at what you're doing right now. In a few years you're going to look back at what you didn't understand or what you've misunderstood and wonder ""why did that seem so hard? It's so simple, it's so clear to me now!""And you'll also get better *at getting better*. That feeling of *none of this makes sense and it makes me so mad* might only last a few month, or weeks, or days.Now, to improving your current predicament. You mentioned not getting feedback or support. It might be time to start asking for it directly from individuals. Here are some tricks I use:* ""Hey, I did this way and it just feels wrong to me but I don't have enough context to know why or what would be better. Do you hav some time to go over it with me?""* ""I'm about to start . Are there some other places in the code we've done something similar I could base my work off?"" Then see who wrote this and ask them for help too.* ""I could use some help just getting started. Do you have 30 minutes to [pair](https://en.m.wikipedia.org/wiki/Pair_programming) with me to get me going in the right direction?""If you don't feel comfortable asking directly, ask your manager similar question but ask them who would be good to speak to get answers. Then go to these people and say ""I'm doing and said you could help"" or ask your manager to ask them on your behalf.If your teammates and manager won't help, it might be time to start asking in more public forums at the company. There are likely helpful people on other teams or in other parts of the organization. If *nobody* can or will help you your company might be, and this is the technical term, *fucked.*It sounds like your career is already going to benefit from the reflected glory of the company. While money is nice, the most valuable benefit of working somewhere this early in your career is access to people who will help you learn and grow. It could very well be time to start looking around.Finally, once you're past this slump: work to model the behavior you wish you were seeing right now. Maybe someone is going to help unblock you or maybe you're going to power through on your own. Either way, hold that door open for the next person.",thetrek,2025-04-16 02:37:57,2,learnprogramming,t3_1k05k5x,False,
mncqboj,"Hey. I’m a manager of software engineers at a Fortune 500 - if you’d like to have a chat feel free to DM me. It sounds like your company is doing a terrible job of supporting you. There should absolutely be realistic expectations set for what work you can produce which should be lower than graduate level. You should also have someone working as your buddy / supervisor to help you out with learning and figuring out what you’re doing wrong. It sounds to me a bit like this company is trying to use interns as cheap labor. Also remember impostor syndrome is a big thing in this industry. If you feel you’re doing badly don’t be too hard on yourself. Remember you’re still learning and it’s going to take time. The industry is rough at the moment so my advice would be first speak to your manager to see how they view your performance and what you could do to improve / and also find out what support you could get from them. Look around for other jobs at the same time, but realise it might take a while. But while you do that try make sure you’re not burning out and work sustainably.",CodeToManagement,2025-04-16 03:49:20,1,learnprogramming,t3_1k05k5x,False,
mmgdcrn,"I'm probably not the best one to answer, but I'm definitely up there as far as ability to relate. YMMV based on work culture, but don't be afraid to ask those questions. Speed comes with practice, and generally speaking most people are happy to help. Think of it this way - how does it feel when someone asks \*you\* for help with it? It's a nice feeling that someone values your experience enough to ask in the first place. As for the impostor syndrome, I can't really advise there. I did two years of work with a small company doing everything from development to support & implementations, and now three years & counting as an SWE with a larger company, and I \*still\* routinely feel like I'm just making it up as I go along, and everyone around is more competent than I.",florvas,2025-04-10 20:53:42,6,learnprogramming,t3_1jw8es3,False,
mmgubo5,"It will never go away. Software became far too big for one person to know it all a long time ago. And every project has layers of things that are unique to that code base.Your teammates were all in your shoes before, so any of them who start bristling at you for asking questions are hypocrites. Or they're embarassed that you're being victimized by their unmaintanable code and lack of documentation.Just try to do your best and meet the requirements, and keep asking questions when you're stuck or the choices look too broad. And don't feel embarassed to ask the AI or online about things that aren't proprietary.",userhwon,2025-04-10 22:23:30,4,learnprogramming,t3_1jw8es3,False,
mmgdx7g,"I think this is misusing the term imposter. You’re a junior, you should lack confidence. Once you gain experience, and overcome challenges and exceeds expectations, if you still feel inadequate then I’d start reflecting on where your insecurities are stemming from",TheGrind96,2025-04-10 20:56:30,6,learnprogramming,t3_1jw8es3,False,
mmgsj9x,"You’re a junior dev that just started working 2 weeks ago… of course you’re going to feel this way. What else do you expect? That you’re just going to be some genius coder right out the gate?This is all normal. As a junior, I would expect you not really know what you’re doing, but that you have the ability and determination to figure it out. Imposter syndrome goes away as you gain experience. Just keep on. Trust the process.",Maleficent-Order9936,2025-04-10 22:13:29,3,learnprogramming,t3_1jw8es3,False,
mmhqqst,"Hey, welcome to our great trade. Here’s the secret. We’re all imposters. :smiling_face_with_halo: seriously, we all experience this kind of confusion and self-doubt as we learn and come up to speed. One of the benefits of experience in this trade is that we know what to expect from this phase of learning. Think of yourself as a first-time runner in the Boston Marathon. You’ve heard The Wall, the steep Heartbreak Hill after mile 20, is there. Now you’re hitting that wall for the first time, and you’re like, WTF? I have to be crazy. Look at it this way. You made it to the Wall after only a few days on the job. You got this. And next time you’ll be better equipped to power through it.Again, welcome.",Aggressive_Ad_5454,2025-04-11 01:36:36,2,learnprogramming,t3_1jw8es3,False,
mmydbao,"Ask questions. There are no stupid questions just dumb answers. Better to ask then be wrong but don't be afraid to try to figure things out on your own otherwise you will never learn. Once you get a few bigger projects under your belt you will be a lot more confident.I work for a financial institution with a specialized language. I'm the single programmer on the team that covers multiple branches / locations and was hired out of college, only having done a few internships. 5 years later I'm now one of the most essential employees there and am single handily in charge of all programming task and the core system. I've handled the coding for all large projects as well as a merger.You will get there. It takes time. If you feel like you need to program outside of work do that, but don't burn yourself out. Personally, I have a hard time programming outside of work.",Dead-Rizky,2025-04-13 20:36:21,2,learnprogramming,t3_1jw8es3,False,
mmgcsh2,Meth,KahnHatesEverything,2025-04-10 20:50:56,2,learnprogramming,t3_1jw8es3,False,
mmhyk32,"I'm in the same boat. I pick one thing and learn it well. One concept, one definition, one best practice or one resource. Every day i have questions. But i take the first one unless there's something obviously more important that comes along, and when i have time ..i submit to the backlog lol. Every week i know 5-7 more things. Being dumb is excusable... STAYING dumb is where people get the ick. It doesn't always feel like it, but this is how anything is learned. We have knacks and gifts, but most people i meet had to brute-force their coding skills. You can do it. Or not... But you will surely be smarter on the other side. That's a win-win",Glad-Situation703,2025-04-11 02:25:37,1,learnprogramming,t3_1jw8es3,False,
mmizfdl,"Imposter syndrome is normal, and a good sign. It means you recognize you have a lot more to learn. Do the hard things, and ask questions by sharing what you’ve researched and tried yourself so far. Senior devs will respect that, and will be happy to help. Learn to interpret error messages, and read the official documentation of what you’re working with. Over time, you’ll get better and better. At first, it will be very hard and you’ll encounter things you don’t know how to solve often. We’ve all been through it, keep at it!",burntjamb,2025-04-11 07:34:57,1,learnprogramming,t3_1jw8es3,False,
mnche5r,"Do you have a Copilot icon in the bottom right of the window? I turned it off by toggling ""Code Completions"" under from there instead of the settings page. Now ctrl + i still brings up the ""ask copilot"" bar but doesn't turn code completion back on.",EthanolParty,2025-04-16 02:48:20,3,learnprogramming,t3_1k02d7d,False,
mnf1tn3,"I opened vs code again as im home now from work and i found an icon looking like two ppl huggin next to version of my language and seems like it was for copilot and turned off code completion on all files, i did tho find the menu for the language icon next to it a bit confusing tho as it also says completion menu and stuff, its off now tho and thats what matters i guess, thank you for the help :)",atom12354,2025-04-16 14:50:01,1,learnprogramming,t1_mnche5r,True,
mms9531,"MOOC [Python Programming 2025](https://programming-25.mooc.fi) from the University of Helsinki. Free, textual, extremely practice oriented and a proper first semester of ""Introduction to Computer Science"" course.",aqua_regis,2025-04-12 19:49:52,9,learnprogramming,t3_1jxor7l,False,
mms70vb,"It's never a bad idea to upskill, especially never a bad idea to know Python as scripting in Python is extremely easy and powerful. But honestly, cybersecurity is one of fastest growing industries, and the AI advances are only going to increase amount of work for cybersec. In EU job report, Cybersec was at 28% growth YoY and is probably the only ""very safe"" career to pursue in SWE right now outside of AI/ML. If I were you, and had some cybersec expertise already under my belt, I would say: Go all in and don't look back.",Alphazz,2025-04-12 19:38:09,2,learnprogramming,t3_1jxor7l,False,
mms94uf,The Google Career Certificate in Cybersecurity on Coursera is a very good and well structured program. It teaches Python and how to apply it in the cybersecurity field.,Stock-Chemistry-351,2025-04-12 19:49:50,2,learnprogramming,t3_1jxor7l,False,
mmvxyaj,"For Python: ""Complete Python Bootcamp by Jose Portilla"" on Udemy — beginner to advanced.For Software Engineering: ""Clean Code"" by Robert C. Martin (not on Udemy, but worth it).Backup plan smart — Python gives flexibility (automation, scripting, web, ML). Stick with it 6 months.",PartySignature6883,2025-04-13 12:42:31,2,learnprogramming,t3_1jxor7l,False,
mms4xsf,try this one thats 30 bucks right now [https://www.udemy.com/course/complete-python-bootcamp/?couponCode=25BBPMXACCAGE1](https://www.udemy.com/course/complete-python-bootcamp/?couponCode=25BBPMXACCAGE1) . Can you come back to me and let me know how this goes? I'm taking a udemy course from there for javascript because my school didn't have it during undergrad,Major_Fang,2025-04-12 19:26:34,3,learnprogramming,t3_1jxor7l,False,
mms6u5v,"I would do these 3 if you wanna get into the ""python world""[https://www.edx.org/cs50](https://www.edx.org/cs50)[https://pll.harvard.edu/course/cs50s-introduction-programming-python](https://pll.harvard.edu/course/cs50s-introduction-programming-python)[https://pll.harvard.edu/course/cs50s-web-programming-python-and-javascript](https://pll.harvard.edu/course/cs50s-web-programming-python-and-javascript)I would do them in that order as well",boomer1204,2025-04-12 19:37:07,2,learnprogramming,t3_1jxor7l,False,
mmscnmt,"Python is good. But, if you want to do information security work, you would be wise to do enough C or C++ work to understand buffer overrun vulnerabilities from the programmer's point of view.",Aggressive_Ad_5454,2025-04-12 20:09:22,1,learnprogramming,t3_1jxor7l,False,
mms77la,"I can’t even get an entry level IT role at this point, and I have my A+ and Network+. I’m also 27, mind you, so the clock is ticking.",ProAmara,2025-04-12 19:39:12,1,learnprogramming,t1_mms70vb,True,
mmvz8i2,"Why Jose over, say, Angela Yu?",ProAmara,2025-04-13 12:51:38,1,learnprogramming,t1_mmvxyaj,True,
mms8sph,"Relax. I'm 28 and soon 29 in July, and I am switching careers now and starting fresh. You're not behind, and clock is in fact not ticking. Grinding is important, but that kind of mindset will burn you out in the long run. We both have long careers ahead of us and it's only the beginning. As for not being able to get a job... I can't land one either, not even an internship. But in both of our cases, that's the job market situation and not our lack of qualifications. I'm overqualified for Junior positions, but not getting any responses as laid off Mid devs are applying for these too. Job market is quite bad right now, and not just in tech, but especially in tech. In the end though, it's a numbers game, you'll probably take 6-7 months to land a job, but it gets easier from the moment you get your foot into the door.",Alphazz,2025-04-12 19:48:00,2,learnprogramming,t1_mms77la,False,
mngq4gu,">Is it necessary to learn web development before starting iOS development? No.>What should I learn before I begin with iOS development? Nothing, just start.>Is it a good idea to choose iOS development as a career for the next 4-5 years?If you can get a job doing it, why not?> Is my machine (MacBook M3, 16GB RAM, 256GB storage) sufficient for building iOS apps?Yes.",ToThePillory,2025-04-16 19:46:57,4,learnprogramming,t3_1k0mf8o,False,
mnf3iqk,"Your machine is more than capable of doing iOS and MacOS development. This also includes WatchOS, AR, VR, etc.If you wanted to try SwiftUI and then thought, oh, what if I want to try WatchOS? Instead of creating a whole new project, you can use if-blocks! import SwiftUI struct ContentView: View { var body: some View { #if os(iOS) // place iOS specific code here Text(""This is iOS"") #endif #if os(macOS) // place macOS specific code here Text(""This is macOS"") #endif #if os(watchOS) // place watchOS specific code here Text(""This is watchOS"") #endif } }There is a difference between Swift the language, and SwiftUI the framework. I found SwiftUI very intuitive and not hard at all. You may also find that Android has a lot of overlap with SwiftUI in how they handle things.Take a look at [HackingWithSwift 100 Days](https://www.hackingwithswift.com/100/swiftui) It is free and a wonderful way to get a firm grounding on SwiftUI, imo. If you want to get a better Syntax grasp on Swift? Check out [Exercism](https://exercism.org/tracks/swift) which is also free and an amazing way to learn, but note, this is for experienced people who have some background in development, thy do not show you how to code.Plug: I am a contributor to Exercism. So I may be biased.I'll let the more experienced Swift Devs take it from here.",stiky21,2025-04-16 14:58:18,3,learnprogramming,t3_1k0mf8o,False,
mnf543p,I haven’t done much in swift but it’s fairly different from web development.,WorstPapaGamer,2025-04-16 15:06:09,1,learnprogramming,t3_1k0mf8o,False,
mmvn2qk,I create libraries and publish them as packages (usually just locally instead of making them publicly available) or use git submodules,ConfidentCollege5653,2025-04-13 11:15:00,25,learnprogramming,t3_1jy58ha,False,
mmvn5pp,"For work stuff, we have libraries with reusable stuff, for example we have server software that runs in most of our installations, and we have a client library for communicating with the server that's used by multiple different projects that have to communicate with that server. It's reasonably disciplined.For my personal stuff it's often just Ctrl-C, Ctrl-V.",ToThePillory,2025-04-13 11:15:46,8,learnprogramming,t3_1jy58ha,False,
mmvs0vy,"first two times, I copy paste. If it's more than that, I'd extract to a library.As to your point about having difficulty finding your code, think about ways to organise your code such that you split the algorithms into separate files. One file (class) should be responsible for one concern. Remember to name your files / classes / function / components / ... in an intuitive manner!",Rhyze,2025-04-13 11:57:24,4,learnprogramming,t3_1jy58ha,False,
mmw26tx,"Libraries for stuff that really reusable, and i want to work in the same systematic way and will not change a lot.Templates for stuff that's sort of the same but not really.For some code I also accept that it's evolving over time. Downside to using libraries is that you ideally need some sort of testing to make sure it will not break other projects should you decide to change/add code.",keesbeemsterkaas,2025-04-13 13:11:50,3,learnprogramming,t3_1jy58ha,False,
mn1daep,"common folders, assemblies, packages, modules, libs, etc. (you did not specify a language/platform/ecology... each has a mechanism)i try not to think of it as ""re-using code"", and more of a ""deduplication of code""and, to be honest, deduplicating code in a common library, folder, repository, whatever mechanism yer language/framework/platform of choice uses gives you a DIFFERENT set of problems.i support ""if code base A and code base B both have a function that does X"" code being ""commonized"" in principle.however, the wrinkle comes in when code base A and code base B's needs/requirements/purpose changes such that there is drift in the logic for the function that does X.for types of thing that yer common code does, some things are well suited for being commonized, and in many cases, these already exist: file access, making an http request, etc.my TLDR: deduplicating code is a great goal, but don't forget that it has its own maintenance cost.",ShoddyDivide4049,2025-04-14 10:10:45,3,learnprogramming,t3_1jy58ha,False,
mmvxcs4,"As other say, I create libraries too. I keep all code on a remote I can always get at. Nothing wrong with copying source code from one project to another, e.g. when writing native software it's often preferable to lots of different builds etc. I like repos to contain as much of what they need as possible. I try not to use git submodules, preferring monorepos or separate repos, but there's no technical reason for that. The specifics of creating and consuming a ""library"" depend on how the language/environment handles modularity.",HashDefTrueFalse,2025-04-13 12:38:13,2,learnprogramming,t3_1jy58ha,False,
mmypcd8,"I dont tend to formally package up code into reusable libs because generalizing it well takes time.However I definitely will remember “oh yeah I solved this before” ripgrep through the app for the method or whatever, and then copy paste it and adapt it to fit.",armahillo,2025-04-13 21:42:39,2,learnprogramming,t3_1jy58ha,False,
mmim6bt,"I was about to write a long paragraph trying to explain tests, but you've probably read a lot like that.Let's try it interactively instead. How about you tell us about a program you wrote. Ideally something you just finished or are in the middle of working on right now. What does it do? What are some of its features? What makes it interesting or tricky?Give us a few sentences about it. We'll help you figure how to write some tests for it, and why it might be useful for you to do so.",dmazzoni,2025-04-11 05:24:33,6,learnprogramming,t3_1jwhnym,False,
mmiluy5,"I think it is really hard for a lot of people to understand why unit tests are useful, what unit tests you should write, and how to write them until you've been stung by bugs that unit tests would have caught.One can try to pass on that knowledge to beginners who haven't spent hours of their life (while taking years off their lifepsan) tracking down bugs that made it to production because of a lack of tests, but until you've been in the trenches it is really hard to internalize.So - learn how to write them, get used to writing them so they are not scary to you, but trust that as you work on bigger and more complicated projects life will teach you the final lessons on why we write automated tests.",PoMoAnachro,2025-04-11 05:21:46,6,learnprogramming,t3_1jwhnym,False,
