id,body,author,created_utc,score,subreddit,parent_id,is_submitter,distinguished
n85fjfr,"The resume reads:“Eliminated duplicate rows in a billion row dataset and applied indexing/partitioning strategies, improving query performance by 20% and ensuring data integrity.”",ORA-00900,2025-08-11 18:05:30,328,dataengineering,t3_1mnjfdg,False,
n85hxks,"If there was only one duplicate before and now there are none, you removed 100% of the duplication.",unpronouncedable,2025-08-11 18:17:20,220,dataengineering,t3_1mnjfdg,False,
n85p0hu,df443 = ( dfdf442 .dropDuplicates() .select(\*) .dropDuplicates() .filter(col(\*).isNotNull()) .dropDuplicates() .dropDuplicates() .dropDuplicates() ),BadBouncyBear,2025-08-11 18:53:20,108,dataengineering,t3_1mnjfdg,False,
n85nigy,then adding constraints so the duplicates can't be added again later?,ludflu,2025-08-11 18:45:46,49,dataengineering,t3_1mnjfdg,False,
n85avuz,When optimizing (setting up correctly :grinning_face_with_sweat:) the table dependencies in a bigger workflow the execution time decreased by a bit.,Kokufuu,2025-08-11 17:43:02,14,dataengineering,t3_1mnjfdg,False,
n86wzkn,"DEs at my company don't care about quality, only process. Hey, all the data is there, I did my job. Dupes in source? Not my problem! I guess ultimately that's an engineering problem, not a DE one",ntdoyfanboy,2025-08-11 22:38:30,12,dataengineering,t3_1mnjfdg,False,
n86e7u1,DEs life consists of small wins,Cpt_Jauche,2025-08-11 20:58:41,10,dataengineering,t3_1mnjfdg,False,
n87ik5k,And spent all day doing it.,john0201,2025-08-12 00:44:18,4,dataengineering,t3_1mnjfdg,False,
n884nno,The best is when you forget the where and wipe the whole thing,Safe-Study-9085,2025-08-12 02:59:29,4,dataengineering,t3_1mnjfdg,False,
n8876oq,"I’m not in the field, but in what cases do you guys work with a BILLION rows?",CristianMR7,2025-08-12 03:16:12,4,dataengineering,t3_1mnjfdg,False,
n8fqygm,Would you like to join a botnet? No! Are you sure?,mark-haus,2025-08-13 09:04:54,215,dataengineering,t3_1moy7ip,False,
n8fld6a,What game is it thats kinda messed up,Avry_great,2025-08-13 08:08:41,72,dataengineering,t3_1moy7ip,False,
n8futtf,Name of the game is [Pizza Ready](https://apps.apple.com/us/app/pizza-ready/id6450917563),aryan_p_patel,2025-08-13 09:43:12,50,dataengineering,t3_1moy7ip,True,
n8foq00,Could've put a Bitcoin miner there as well. Why not,One-Respect-2733,2025-08-13 08:42:30,36,dataengineering,t3_1moy7ip,False,
n8fxsiu,"So, I have been on the other end of this service. They claim to have access to 1 million + devices. It actually works really well and one of the few services where you can drill down and request a specific city and OS. Like, if I want to test a regional routing setting on my site I can request a crawl from a Android 13 phone in Baytown Texas and in seconds I get a result back and I can even see it on my end to verify. The scary thing about this service is that I can request a crawl and if it is something illegal, that phone is on the hook until they can claim that they were not the ones that requested the site.",txmail,2025-08-13 10:10:27,62,dataengineering,t3_1moy7ip,False,
n8fpcdb,3 purple diamonds don't come cheap.,tomullus,2025-08-13 08:48:45,54,dataengineering,t3_1moy7ip,False,
n8flisr,Fascinating. I had no idea that Bright coopted IP addresses like this for their scrapers.,BaxTheDestroyer,2025-08-13 08:10:13,20,dataengineering,t3_1moy7ip,False,
n8fwazo,Deviously genius.,tolkibert,2025-08-13 09:56:56,9,dataengineering,t3_1moy7ip,False,
n8g0ofn,"Only 3 diamonds? cheeky, they probably could award 300",Jealous-Weekend4674,2025-08-13 10:35:53,9,dataengineering,t3_1moy7ip,False,
n8jby6l,"The really scary thing is that any app could hypothetically do this without an opt-in. Users have no way of preventing it, or even knowing about it. Right? :grimacing_face:",lfiction,2025-08-13 20:59:18,4,dataengineering,t3_1moy7ip,False,
n8aq7cw,"Tell your leadership it costs more for a worse result, and bring proof",One-Salamander9685,2025-08-12 14:50:55,163,dataengineering,t3_1moanf4,False,
n8aqo8v,"Your post seems to summarize everything that you need to relay to management: concrete findings, risks, potential costs, etc.What they need to understand is simple, and it's this: you use the right tool for the job. If your old method is more correct and reliable, you should use it for that job, and not doing so incurs real risks.They want to use LLMs so they can sound ""innovative"" and cutting edge to investors. My advice would be, help them find a separate use case for LLMs in your work stream that makes actual sense.",ntdoyfanboy,2025-08-12 14:53:15,50,dataengineering,t3_1moanf4,False,
n8axhgl,"Our new black box AI: Same input, different output every time. What's the worst that could happen?May God protect us.",Turbulent-Set997,2025-08-12 15:27:17,32,dataengineering,t3_1moanf4,False,
n8bjqjn,"What I’ve found is we always care way more about the quality than the owners/leadership does.I’m often shocked and appalled at what they find acceptable. Basically if it’s not impacting profits they don’t care. Even if it impacts lots of other things negatively. Mostly our sanity. That’s a sacrifice they’re willing to make.I’ve learned to drop my concern, if they don’t care I don’t care. Not 100% of the time but I was definitely stressing myself out for no reason and I was the only one worried about it. I stopped. Nothing bad happened. So I’m like ohh, guess it doesn’t matter then.",DonJuanDoja,2025-08-12 17:16:35,22,dataengineering,t3_1moanf4,False,
n8av29d,Exactly the same as my company. We need our data to be highly accurate. The management just see the potential of automating everything but doesn't see the downside of lower accuracy. I did raise the concern and their reply was “update the prompt if you see any errors then”.,Hot-Hovercraft2676,2025-08-12 15:15:18,19,dataengineering,t3_1moanf4,False,
n8axxjn,"This is where data quality metrics are helpful. For example: * Step 1: assess data quality requirements - how accurate does data need to be? * Step 2: measure before & after accuracy, frequency & severity of issues, etc * Step 3: quantify the labor savings of the LLMs Quantifying data quality impacts can be tough - since much of it depends on how the data is being queried, who is using those results for what, etc, etc. But some anecdotal examples can help get the point across.Then I'd also take a look at other aspects of this problem: * Availability: is your data offline or unavailable/inaccessible while you're fixing these issues? * Affordability: are data quality issues causing an explosion in CDC, which is then causing an explosion in the size of versioned dimension tables? * Engineering Toil & feature velocity: is your team now spending more time doing incident management than before, possibly in the middle of the night, but also putting feature work on hold during this time?Finally, I'd ask, why the hell is a board dictating implementation details?!?",kenfar,2025-08-12 15:29:30,12,dataengineering,t3_1moanf4,False,
n8aq3rs,"I think LLMs make sense for scale. If you need to process a TON of complex data from many different sources it helps, where no current solution exists. I’ve seen this be effective in FAANG environments. It seems dumb to do if you have a solved problem.",Wh00ster,2025-08-12 14:50:24,41,dataengineering,t3_1moanf4,False,
n8izaw6,I've been able to save my team some headache and push back hard on all this ai hype (I got an MS in machine learning). I've been able to redirect the narratives just for my team thoughAnd what I'm seeing outside of my team is really concerning... Lots of blind people leading other blind people... I assume this can only go on for so long until it bursts at the seamsI pray this isn't the new normal,PeopleNose,2025-08-13 20:00:12,4,dataengineering,t3_1moanf4,False,
n8as5qg,"Be clear and transparent about it. Don't lead with LLMs are bad, but show test cases or match metrics and use it as a baseline. Offer to keep testing LLMs along side to see until and how they might perform better.",mintskydata,2025-08-12 15:00:42,5,dataengineering,t3_1moanf4,False,
n8a7ezt,"You need a promotion, not just a raise. - write up a more polished version of this post and send it to your boss, or have the conversation in person. - Add bullet points to explaining the value you're delivering, and that the work you're doing is typically performed by a data engineer. - Explain how much you love your job and your company, and that you'd love to continue doing this work there...but that you need a title and salary commensurate with the value you're delivering.- go on glassdoor or similar and find some job descriptions that match what you're doing, and the compensation that goes along with it. Ask for that.",ludflu,2025-08-12 13:09:55,179,dataengineering,t3_1mo82xz,False,
n8bcv8c,you’re basically running a shadow data engineering org off a desktop and csvs and they’re treating it like “extra help with excel” two tracks here 1 get paid for the role you’re actually doing 2 get the tech stack off your personal machine before it becomes your permanent problemraise strategy document everything you’ve built in business terms not tech “automated x report saved y hours per week worth z salary” line up examples where your work directly saved money or made decisions possible go to your manager with “here’s the value here’s the role i’m actually performing here’s the market rate” be ready with a specific ask and the number you’ll walk away for if they won’t matchtech sustainability move scripts to a server or cloud function replace csv dumps with a basic database even if it’s just a local postgres push for BI tool budget or at least centralize reporting so you’re not the single point of failureif they won’t pay or modernize you’re in prime position to jump to a real data role elsewhere with way more money[The NoFluffWisdom Newsletter](https://NoFluffWisdom.com/Subscribe) has some sharp takes on turning hidden extra work into leverage worth a peek!,Thin_Rip8995,2025-08-12 16:42:56,28,dataengineering,t3_1mo82xz,False,
n8abxry,If you want my advice - start interviewing. That will help you know the market rate. You don’t need to take another job to gather the market rate. Then you can decide how to approach your boss. My 2c - if it’s a 15% salary change you almost always have to go external due to politics of salary changes. That’s the rule of thumb I share with my mentees.,ZorbasGiftCard,2025-08-12 13:35:29,41,dataengineering,t3_1mo82xz,False,
n8aujqf,"I'm in the same boat. Hired as a Data Analyst in an Operations team (5 people) serving 3% of the company, at three months a reorg happened and I am now the Data Analyst for an Ops team (that is only me and my boss) now serving 15% of the company directly (but I am also roped into assisting teams in all departments because my API/Scripting/Pipeline Dev capabilities and orientation in the company make me at a crossroads for a lot of interdepartmental exchange of data). I spend 75% of my time writing 1000 line python scripts that are either complex one-off multisystem data pulls or building custom pipelines for merging data from those systems in a deployable way. 10% of my time is spent providing guidance on data systems, admin on our business applications and dev on functions internal to those. 10% is spent doing huge data cleaning jobs (our data is a complete shitshow). And the remaining 5% is basic analyst stuff like dashboards, live reports, and light analysis. Hell one of my current 6 main projects is building a Data Lakehouse on AWS for serving business data and reporting.The difference for me is we are a global SaaS company, but even one of our data scientists has come to me for pipeline dev and recommendations for data arch for a function in a chatbot they are developing.Fortunately my direct superior is on the same page and helping advocate for a title change (which would get a raise with it per company policy). But what I did was took the job description, broke the tasks in the job description down into 'typical role of task' (ie dashboarding and light analysis is typically a data analyst, building and maintaining pipelines via script and platform engineering is data engineer, but more fleshed out than that), I then added in any tasks I do that are not in my job description. I then gave a percentage of my time spent on each domain to illustrate that 90% of my time goes to tasks that are firmly in the domain of a Data Engineer. Fortunately my boss is chill and an advocate and he took that and actually added supporting examples of tasks I have completed that are outside of my job description and is taking it to the C-Suite person he reports to so we can get me a title that reflects my work. I recommend doing something of that nature with some added answers to what is the value add for the company of each of these tasks.",CorpusculantCortex,2025-08-12 15:12:45,10,dataengineering,t3_1mo82xz,False,
n8ehw33,"I’m probably the outlier here but my advice would be to double/triple down and do more DE work. This could be one of those “one step back two step forward” kind of situations. I’m assuming you want a DE career path; if not shut it down and stopped doing the extra work. Generally speaking DE is not an entry level position. And with this economy even so called junior roles are asking for a lot of experience/skillsets. It sounds like you have a great opportunity to shape your own career and have on the job training/experience without much restrictions. Start offering to make everything you built so far, more efficient, more analytical, more robust, more real time. If they like what you’re saying, then you have free rein to set up traditional DE systems and architecture, giving you experience people would gladly pay for. Once you feel you’ve nailed down the experience and skillset, go and explore the market.",all_wings_report-in,2025-08-13 02:39:25,6,dataengineering,t3_1mo82xz,False,
n8akp1i,"Why CSV files? Put that data on a Linux VM running DuckDB. Excel can connect to it just like MySQL with the ODBC driver. Then users do SQL select or build a query with PowerQuery. Or have them use the free PowerBI. MSSQL is native to Excel and other Microsoft products with OleDB. You could use SQL Express for free, on a Windows server not already running MSSQL, and the limit is 10 gigs per database. So make multiple databases and group data logically, like per department. So you gain some Sys admin and DB knowledge also.",SirGreybush,2025-08-12 14:22:56,8,dataengineering,t3_1mo82xz,False,
n8ar44a,Start interviewing. It's easier to sell your skill to outside companies than to get a raise from internal management. Especially when they don't even know better.,WeebAndNotSoProid,2025-08-12 14:55:29,3,dataengineering,t3_1mo82xz,False,
n8eqhcf,"I agree with all_wings you have the rare opportunity to build something from scratch and learn. Create a proposal to acquire more tools, add a change of title for later career movement and an increase of salary. Focus on the benefits for the company. Not minimizing your experience but I don’t consider DE experience unless you work with Big Data, PySpark/Scala or other robust language. What would you put on your resume? At the end of the day you need to align as much as possible with the stack that other companies are looking for and you have limited experience. If you don’t believe me, try to find profiles that align with your experience and apply. You never know, maybe you will get a new job and the worst case scenario you learn what you are missing.",Independent-Heron-40,2025-08-13 03:37:29,3,dataengineering,t3_1mo82xz,False,
n8fauta,You are in an excellent position to make a jump. As simple as that. It’s time you leverage your newly learnt skills as a base and move out to acquire more skills and build a larger better network. The upside is much larger if you make the jump compared to staying at your existing company.,Delicious_Sherbert86,2025-08-13 06:26:28,3,dataengineering,t3_1mo82xz,False,
n8c1s12,"This is just IT. My IT department builds these kinds of scripts. Ask for a raise and a training program to get you DE certificates. You can also try interviewing and quitting, but I think you’ll find that you need more experience and training to get an entry level DE job. Also if you’re using MSOffice, PowerBI is free. And PyShiny is free as is an html generated from Python and dropped onto a network share.",prepend,2025-08-12 18:43:13,3,dataengineering,t3_1mo82xz,False,
n8m2jkw,Minor tip; try to avoid scrollbars on dashboards unless it contains a long list component. It looks like you could make the charts on the right shorter and remove the need to scroll.,Specific_Mirror_4808,2025-08-14 07:31:21,33,dataengineering,t3_1mpodwp,False,
n8ltk82,Looks cool for sure!,rtalpade,2025-08-14 06:08:12,2,dataengineering,t3_1mpodwp,False,
n8r1hrc,Fabric... ewww,SpiderSaliva,2025-08-15 00:39:28,4,dataengineering,t3_1mpodwp,False,
n8ljkwm,That looks insanely cool!!,dank_coder,2025-08-14 04:43:30,3,dataengineering,t3_1mpodwp,False,
n8nbi8o,Slick af,the-berik,2025-08-14 13:22:32,1,dataengineering,t3_1mpodwp,False,
n8nu8ck,So that visualization was done in Fabric?,LongCalligrapher2544,2025-08-14 14:57:14,1,dataengineering,t3_1mpodwp,False,
n8sqwsv,Wow this looks :fire:,maestro-5838,2025-08-15 08:27:34,1,dataengineering,t3_1mpodwp,False,
n8sromz,no way. is it ms fabrick??,dawn-dot-py,2025-08-15 08:35:14,1,dataengineering,t3_1mpodwp,False,
n8o3lsm,Vibe coded?,Old-Scholar-1812,2025-08-14 15:42:02,1,dataengineering,t3_1mpodwp,False,
n8moftz,"Sounds like a solid setup. If you ever need to scrape data before pulling it into something like OneLake, I've had good experiences using Webodofy for handling proxies without the usual headaches. Just some practical advice if you ever hit that wall.",Hefty_Role2894,2025-08-14 10:55:40,0,dataengineering,t3_1mpodwp,False,
n7rvzh7,"What am I looking at?Left is a query that ends up in a `result` table, I presume?And then on the right you see where each column from `result` comes from by drawing arrows from the original tables used in the query?Did I get that right?",NostraDavid,2025-08-09 13:35:23,20,dataengineering,t3_1mloi5n,False,
n7sel0t,Nice project.  Just a bit of feedback....you can't really see which column goes to which downstream.  I would have the lines directly going from sourced to target so it's obvious.  Also I would have each cte encapsulated in a box with the cte name at the top and the columns underneath with the logic related to each column.  Better if the sql view is reactive and centers on the cte box you click. One other useful thing would be to click a column and the line highlights backward and forward from source to target.  As pipelines get more complex it would get Hader to see what's happening in this view.,Gators1992,2025-08-09 15:22:16,11,dataengineering,t3_1mloi5n,False,
n7ubib5,https://www.datanami.com/this-just-in/collibra-announces-acquisition-of-sqldep/ these guys were doing the same thing,EarthProfessional411,2025-08-09 21:41:56,4,dataengineering,t3_1mloi5n,False,
n7sxqe9,"Sorry, like another said the end result doesn’t provide great understanding of the lineage. Keep at it.",ATL_we_ready,2025-08-09 17:04:47,2,dataengineering,t3_1mloi5n,False,
n7xu7pf,"Did the demo. Dig the concept. Feedback wise, make the code and the graph able to be exported and saved locally to a repository. We use PlantUML a lot at my work simply because the code and graphs can be version controlled with code. Do the same and you will have a winner.P.SAdd options to save the animated data lineage in gif and mp4 formats for presentations too!",Tehfamine,2025-08-10 13:46:41,2,dataengineering,t3_1mloi5n,False,
n7uo9ww,Can it see through a view?Because if it can't then reading the query explains the query.,pinkycatcher,2025-08-09 22:58:59,1,dataengineering,t3_1mloi5n,False,
n7ynpse,"So, building an extension for vs code shouldn’t be that much work right? I feel it might be nice to use it in a dbt repo but copy pasting into the browser is a pain in the ass",Obvious-Phrase-657,2025-08-10 16:27:07,1,dataengineering,t3_1mloi5n,False,
n82wsfy,"Would be great if you add support to oracle db, ms SQL server etc.",Odd_Strength_9566,2025-08-11 09:00:00,1,dataengineering,t3_1mloi5n,False,
n83te6s,Awesome project. Excited to see the future features.,lucaspompeun,2025-08-11 13:14:03,1,dataengineering,t3_1mloi5n,False,
n8troy1,"At the end of the day, query parsing is the real meat here — and IMO, using ANTLR is hands-down the most accurate way to do it. The pain? Writing ANTLR grammars straight from the official docs is soul-crushing. For some reason, devs in China seem to just crank this stuff out like it’s nothing. I’m working on building a query AST for my current project, and stumbled on a solid reference worth checking out: [https://github.com/DTStack/dt-sql-parser](https://github.com/DTStack/dt-sql-parser)",Old-Investigator9217,2025-08-15 13:10:00,1,dataengineering,t3_1mloi5n,False,
n7tpkr3,"You can find a list of community-submitted learning resources here: https://dataengineering.wiki/Learning+Resources*I am a bot, and this action was performed automatically. Please [contact the moderators of this subreddit](/message/compose/?to=/r/dataengineering) if you have any questions or concerns.*",AutoModerator,2025-08-09 19:37:33,1,dataengineering,t3_1mly75l,False,moderator
n7wbw9i,"keep your DE skills sharp because they’re your biggest edge—most ML pipelines die from bad data, not bad models from there:* math refresher: linear algebra, probability, stats* python stack: numpy, pandas, scikit learn, matplotlib* ML foundations: supervised vs unsupervised, model evaluation, overfitting, feature engineering* projects: start with tabular data you already work with, then branch into NLP or CV if interested* scale up: learn MLflow, model serving, and orchestration so you can deploy what you buildcourses: fastai for hands on, [deeplearning.ai](http://deeplearning.ai) specializations for fundamentals books: *Hands On Machine Learning with Scikit Learn, Keras, and TensorFlow* by Géron, *Pattern Recognition and Machine Learning* by Bishop if you want the math heavy sideThe [NoFluffWisdom Newsletter](https://NoFluffWisdom.com/Subscribe) has some sharp takes on moving into new tech fields without wasting months on fluff worth a peek!",Thin_Rip8995,2025-08-10 05:53:58,65,dataengineering,t3_1mly75l,False,
n7ukmdl,Look into ai engineering. Seems like not a big shift from data engineering. Research is a whole nother animal,13ass13ass,2025-08-09 22:36:35,19,dataengineering,t3_1mly75l,False,
n7uk6dh,"If more ""AI engineering"" in the sense of LLMs, Agents, RAG:https://www.oreilly.com/library/view/ai-engineering/9781098166298/Or start with her blog https://huyenchip.com/",met0xff,2025-08-09 22:33:52,30,dataengineering,t3_1mly75l,False,
n7wemyi,DE is more safe I believe future proof wise,pandu201,2025-08-10 06:19:28,12,dataengineering,t3_1mly75l,False,
n7txe44,What do you mean AI/ML? Like do you want to do research? Work in production environment? Are you scared of AI and want job security?,nonamenomonet,2025-08-09 20:21:55,5,dataengineering,t3_1mly75l,False,
n7w4bcr,"If I were you, I think I’d start looking into ML ops engineering.",jar-ryu,2025-08-10 04:47:58,8,dataengineering,t3_1mly75l,False,
n7xghm0,I read through the comments. Asking this question on chatGPT would’ve given you a better answer OP.,TechnoBotHead,2025-08-10 12:16:16,5,dataengineering,t3_1mly75l,False,
n7xyr90,"ML engineering is a better path than actual data science stuff if you're currently a DE. There is a surplus of people getting into data science but not data engineering. However, we will probably start getting tasked with enriching our data with ML Models, so orchestrating that stuff is probably a good skill.",BoringGuy0108,2025-08-10 14:13:09,3,dataengineering,t3_1mly75l,False,
n7u4x7v,RemindMe! 3 day,crijogra,2025-08-09 21:04:24,2,dataengineering,t3_1mly75l,False,
n7yli6p,"You can find a list of community-submitted learning resources here: https://dataengineering.wiki/Learning+Resources*I am a bot, and this action was performed automatically. Please [contact the moderators of this subreddit](/message/compose/?to=/r/dataengineering) if you have any questions or concerns.*",AutoModerator,2025-08-10 16:15:48,1,dataengineering,t3_1mmmn0a,False,moderator
n7yn65l,"1,3,4,5,6 are expected from a data engineer (I will also let people put their opinion), 2-they might have asked you because you were a solution architect! But I hope you get in and be my future reference! Best of luck, bro!",rtalpade,2025-08-10 16:24:20,29,dataengineering,t3_1mmmn0a,False,
n7yrpeo,"I always find it funny when folks say things like how could one engineer be expected to know all these topics. My response is, Yep, that's the job. A lead data engineer should know all of these topics well.",discord-ian,2025-08-10 16:47:47,35,dataengineering,t3_1mmmn0a,False,
n7z8mfs,"Before any tech infatuation that comes prepackaged with ky jelly. Some intergalactic magically concept that most companies don’t have any clue about, which could prevent the data team from running around looking like chickens with no heads….its called defining “requirements”.",soundboyselecta,2025-08-10 18:13:42,3,dataengineering,t3_1mmmn0a,False,
n7yn2jd,would you mind sharing the questions abt DW and Cloud arch and sec?,LebPower95,2025-08-10 16:23:49,9,dataengineering,t3_1mmmn0a,False,
