id,body,author,created_utc,score,subreddit,parent_id,is_submitter,distinguished
n8wcphv,"There's no one answer here, but if I have to condense it to a single sentence, it would be this: It should be mapped in the layer where it is the most convenient.A DTO isn't inherently an API thing. It doesn't have to be bound to a controller. It can be, but a DTO is just that: A data transfer object. It is a box of properties that simply moves data from A to B. It can be used to move data outside of the application, but it can also be used to simplify transferring data from one side of the codebase to the other.However, if we assume that a DTO in this case always correlates with some data being returned in a controller, then you'd most likely want to do the mapping in the controller. Being dogmatic about this can be a little difficult, as you'd quickly end up making DTO objects between the service and the controller layer for situations where you have to join together data from different sources (which can be fine as well).The issue with having the service layer coupled with API DTOs is that other parts of the system might want to use your service without being coupled to the API (which you point out in your post), which can become a problem. However, if that doesn't happen, then there's no issue.My point is that there's no single rule. It depends on the dependencies within the system, as well as how the system will develop over time. My general advice here is to push everything outward from the core of your application until it starts to become annoying. When you've found the sweetspot, then keep it there until other things start making it annoying, then consider pushing it further out (or pull it inwards) depending on how it is annoying. Don't be set in stone; instead, be pragmatic and flexible.",_Atomfinger_,2025-08-15 20:48:32,1,learnprogramming,t3_1mr96w0,False,
n8wibla,"Map at the boundary not in your domain. Let domain and business services take and return models, and only translate to DTOs when you cross into the application or controller layer to talk to the client. If a use case truly needs a DTO for performance or projection then create a dedicated query in the application layer that projects directly to that DTO, but keep domain services free of DTOs so other services can reuse them without losing info",Front-Palpitation362,2025-08-15 21:15:59,1,learnprogramming,t3_1mr96w0,False,
n8wt12f,"At my last job, we separated these concerns by having three different layers in the back-endAPI receiver - As it sounds. Usually very simple call to one coordinator, plus exception handling and proper parsing into the appropriate HTTP response Coordinator - Each receiver would usually call one of these. It would be responsible for coordinating all the various single-action service methods and minor logic required. It would then convert that into the DTO at the end, based upon one or more of the data models Service - Single-action methods, often using DB models from our SQL DB via EntityThat way, if another piece of business logic required the individual actions, they could call their own series of service methods without having to worry about the DTOs of another API",mrwishart,2025-08-15 22:12:47,1,learnprogramming,t3_1mr96w0,False,
n8wrimc,"I think I have to make it more clear what I meant.It makes sense, since the database resides in a database layer. To transfer this to a persistence layer, DTO is used and in the ORM context, they are entities. Without it, we have to do this mapping on our own.Then we can can make a simplified DAO service, which provide CRUD operations we can use in the controller (presentation layer). It's already possible to use the ORM operations directly in the controller, but I prefer a service class to make this cleaner.Somehow, we have to map from entityDTO to presentationDTO. The presentationDTO is used to return a response to the client. I read that this mapping is done in the service layer, the problem:If we map the entityDTO in the service to the presentationDTO, the service will always return a presentationDTO that is expected to be used in a controller or view. For example, in [ASP.NET](http://ASP.NET) core, we do not want to return a response from the entityDTO directly, since they contain navigation properties. We want the JSON output to exclude the navigation props and instead translate type references to foreign key fields. That is why we map to a presentationDTO.But sometimes we want to use service class in another service class and we do not want to already return a presentationDTO from the service. In this case, the service should return an entityDTO so we can use this data in the other services if necessary. Then if we want to map this entityDTO to a presentationDTO, it's best to do this in the controller.Do you know what I mean?",NearbyOriginals,2025-08-15 22:04:20,1,learnprogramming,t1_n8wcaxr,True,
n8wrqal,Precisely the point I meant.,NearbyOriginals,2025-08-15 22:05:32,1,learnprogramming,t1_n8wibla,True,
n8ww9zq,"In a relational database, if we return entityDTO with navigation properties, which are properties with reference types to another class, the JSON will output nested objects. class User { public string Name { get; set; } public string Age { get; set; } } class Room { public string Name { get; set; } public User ReservedFor { get; set; } }This will serialize to JSON output: { ""name"": ""Conference Room A"", ""reservedFor"": { ""name"": ""Alice"", ""age"": ""30"" } }While we want something like: { ""name"": ""Conference Room A"", ""userId"": 1 }That is why I map to presentationDTO.",NearbyOriginals,2025-08-15 22:31:17,1,learnprogramming,t1_n8wrimc,True,
n8wwyoy,"Yes, that is what I told you.Entity (DAOs) are used to map your entire entity to a database table. You do not want to return this from a service. You *can, it's possible,* in the same way anything you want to code is possible. The convention is to not return these in this form. They are mapped the moment they are retrieved from a database, so by definition they are returned from the Data Access Object (or DB layer) and this is unavoidable - so you always start by mapping the data from a persistence driver to a language class instance (or dictionary). While controllers return a *response* that can easily just be whatever the service returns wrapped in whatever response your protocol expects. The response from a service is what is in question here.In spring for example, you will commonly see in a service:example() { var stuff = repo.getStuff(); ...business logic... return stuff.stream().map(StuffToDtoMapper::EntityToDTO}....;)This is done in the service layer because the service doesn't want to return the entire entity model to the controller, assuming it's a service method that is called directly by a controller, often times, the service might not even be receiving the entity itself, but rather an intermittent object still on the database side (e.g. spring projections) which it would still want mapped to a presentation DTO, as you said.When you want to use the entire entity in a different service, which is completely normal, you define a separate method in your service (some even opt for different services, but that's overkill in my opinion) that returns the entity itself, indicating that it is used for inter-service communication and not to be routed back through a controller.All these things are just conventions, you can technically do anything you want, but this communicates intent to other developers who are familiar with the convention.",disposepriority,2025-08-15 22:35:18,1,learnprogramming,t1_n8wrimc,False,
n8x0gms,"Okay, in Java terms, let say we use Hibernate in a Spring Boot application and that returns an entity POJO. You then create a service class, which is just a simplified DAO with CRUD operations and the output of each operation maps to whatever DTO that belongs to the entity.You call the service operation in the controller and the DTO that is returned from this service will be serialized to JSON in the response to the client.So you default the return of each service operation in the CRUD DAO to a DTO and when you want the full entity POJO instead to reuse in whatever class, you use the defined method in your service CRUD DAO. Let's call the method \`getFullServiceEntityDTO\`.This is your approach if I read it correctly.",NearbyOriginals,2025-08-15 22:55:20,1,learnprogramming,t1_n8wwyoy,True,
n8x5mz3,"The DAO is your repository, not your service. Hibernate isn't returning anything, you are defining an Entity class, denoted by an annotation, to either generate your database schema or match it.The reason the entity class is not usable outside the repository class and some select service methods is that you do not want to couple your schema and anything your API returns.Example: You're in the process of migrating your hashing algorithm, this requires users to reset their passwords, you have millions of users - this will take a lot of time. You add a hash\_version field to your user class, so you know which hashing algorithm to use to verify their passwords. This new column in your database has no business being in absolutely any of your controllers, but obviously you want to retrieve the value when getting a user since the service needs to know what to do). This applies to any entity derivatives like projections or manual mappings with native query.Service calls one or more repositories requesting data from the database that it needs, this can be returned as an entity class, projection, manually created class mapped by a jdbc handler, it doesn't matter - this is the class that will store the data you request from the database. This class will change if you ever change your database query. You don't want changes to this class to affect whatever any of your endpoints are using, this is not specific to java.",disposepriority,2025-08-15 23:25:04,1,learnprogramming,t1_n8x0gms,False,
n8qk6sk,"Take it or leave it, but I honestly think there comes a time when you have to wean yourself off of these kinds of guided courses. Have a try at learning react using the react documentation. It's good to get used to doing this. It's a hard skill to fully describe but you eventually get used to skimming documentation like this to very quickly get ""the point"" and the kind of style and thought patterns behind the idea of this library or framework, and then as you start to work with it, you dive in to the relevant details. I feel like people fall into this trap of being a bit \*too\* lead by these kind of guided tours. They can keep you a little too ""on piste"", waiting for the next chapter, and that isn't \*really\* how true learning is done. You have seen the kind of thing react can do now. Think of something you would like to try building and just get on with it. Use the docs, and google and whatever else and bluff your way through it until you aren't bluffing anymore. Happens quicker than you think.",hitanthrope,2025-08-14 22:59:52,4,learnprogramming,t3_1mqfwmx,False,
n8qlcay,"I agree with the other poster, They are good intros to get you comfortable but at some point you really just need to jump to Docs. That being said I would try the pro content for a month and see if it's helpful.",Rain-And-Coffee,2025-08-14 23:07:00,1,learnprogramming,t3_1mqfwmx,False,
n8qt85u,It depends on your use case. I thought their intro to Javascript was good. Their advanced JavaScript was underwhelming. Their typescript content stinks. But I’m doing playwright automation in js/ts. I really liked their code along portions of their videos. It happens in their scrims and it’s easier to just write some code when you can just put it in their environment. However I paid for a year and don’t care about too much more front end stuff or react. I may end up taking it because it’s there and I paid for it. But I’d probably just have paid monthly in reteospect,AncientFudge1984,2025-08-14 23:52:14,1,learnprogramming,t3_1mqfwmx,False,
n8qm6o2,Do you have experience with their PRO JS courses yourself? How did you like them?,skyisred2,2025-08-14 23:12:07,0,learnprogramming,t1_n8qlcay,True,
n8lgi9e,"Contribute if you have something to contribute, or if you are really passionate about the product. What is the point of contributing just to do it?",maqisha,2025-08-14 04:19:59,6,learnprogramming,t3_1mppvt6,False,
n8lluw9,"**Frequently Asked Questions** -> [**How can I contribute to open source projects?**](https://www.reddit.com/r/learnprogramming/wiki/faq#wiki_how_can_i_contribute_to_open_source_projects.3F)In short: you don't contribute to *random* projects. That's not how FOSS works. You contribute to projects you have a use case for, where you are passionate about and where you find a deficiency, or have some idea for improvement that could help.You don't contribute to FOSS to just contribute or maybe that you can put it on your resume. FOSS is not a ""show off"".",aqua_regis,2025-08-14 05:01:44,4,learnprogramming,t3_1mppvt6,False,
n8mjzdj,"I recently got some traffic to my own repository from this site due to ""good first issue"" Github label, it may be worth checking out to see if you find any projects you are interested in: [https://goodfirstissues.com](https://goodfirstissues.com)",EngineerRemy,2025-08-14 10:18:17,1,learnprogramming,t3_1mppvt6,False,
n8moyg5,"Oh, my bad if I came off as negative, I want to start contributing and integrating newer apps and tools into my workflow and help other developers out, that is my motivation for this, so I was asking around for any sources or applications I could find and help out with",No-Illustrator2729,2025-08-14 10:59:41,1,learnprogramming,t1_n8lgi9e,True,
n8mp3nc,"I see. My fault, my intention came off like that, I do want to conrtibute out of a use-case, so I'd like to find something that I can start using and learning to help out and not to show off..",No-Illustrator2729,2025-08-14 11:00:48,1,learnprogramming,t1_n8lluw9,True,
n8mp5hh,I see. Will check it out! Thank you!,No-Illustrator2729,2025-08-14 11:01:11,1,learnprogramming,t1_n8mjzdj,True,
n8musi9,"Even that is impossible to recommend.**You** need to find some FOSS tool that **you** have a use case for and then see if you can contribute something.You are reigning the horse from the wrong end. First you use a program, then you get attached to it, then you see bugs, or things you could improve, and then you contribute.",aqua_regis,2025-08-14 11:41:43,1,learnprogramming,t1_n8mp3nc,False,
n8hojgs,"educative io is pretty much the OG here. I'd try their Grokking course in C++, or this one looks like a good option for you: [educative.io/courses/data-structures-coding-interviews-cpp](http://educative.io/courses/data-structures-coding-interviews-cpp)",vorp_eckstein,2025-08-13 16:15:51,3,learnprogramming,t3_1mp1y2x,False,
n8gbmg0,Try this one - [https://visualgo.net/en](https://visualgo.net/en),Walgalla,2025-08-13 11:57:44,2,learnprogramming,t3_1mp1y2x,False,
n8dt7nh,"Nope. You're doing just fine. You won't ever have ""everything down"". You'll build the muscle memory when you start coding projects on your own. I appreciated check50 but there is no such thing in the real world--you will have to debug and validate outputs on your own later on. But, when things work, it is so satisfying--more so than watching check50 turn all green!I hunkered down and finished CS50x in 4 weeks. CS50p in 1 week. CS50sql in 2 weeks. CS50AI in 2 weeks.I was hooked on ""tutorial hell"" and broke out of it by building a multi-agent AI workflow from scratch. I now see and echo the advice by many others to start working on your own projects. I learned so much more by running into walls, debugging, scouring documentation, and breaking things (like my developing environment).",simon_zzz,2025-08-13 00:08:07,8,learnprogramming,t3_1moozry,False,
n8dqd8r,"It's an introducory course, doesn't mean people with experience shouldn't do it, but I would certainly expect them to be quicker about it.",MathiasBartl,2025-08-12 23:51:06,1,learnprogramming,t3_1moozry,False,
n8g29zi,If you understand. No issue. Try test you’re self to see if your really understand. Everyone learns at a different pace,flow_Guy1,2025-08-13 10:49:19,1,learnprogramming,t3_1moozry,False,
n8dr935,"The one big takeaway I got from cs50 is that it teaches you how to teach yourself. As you know it uses C and python to introduce fundamental concepts about programming, and as you recall it also uses Scratch to introduce ideas such as variables and early syntax. If you are worried about not getting everything down you may as well worry about the fact that you haven't mastered Scratch in it's entirety.Use cs50 as a springboard. Refine and revisit fundamentals as you continue your learning journey as you need them. Dive into other areas of specialisation to build the projects you want to. And it's honestly pointless to compare yourself with others - whether you are really fast or slow. Prof Malan himself mentions something along the lines of it only being useful to compare the knowledge and expertise you've acquired with your previous knowledge and expertise. Some people have prior experience, others none. Some people are interested in particular areas and will deep dive, others will just skim sections they aren't that into. So just focus on what you are getting out of it and whether that fulfils your goals.",plasterdog,2025-08-12 23:56:19,1,learnprogramming,t3_1moozry,False,
n8e6bi7,25 6 hour days? To finish up to pset 9? Fucking hell that's slow,EdwardJMunson,2025-08-13 01:27:34,0,learnprogramming,t3_1moozry,False,
n8dubfh,"Wow, cs50p in 1 week is insane, I do plan to start that after cs50x. Thanks for the comment, what you said is definitely true just getting that instant green output is way more satisfying than testing as many edge cases as you can think of in your own project. Unfortunately that demise still awaits me for my final project lol :)",Head_Bad8630,2025-08-13 00:14:48,2,learnprogramming,t1_n8dt7nh,True,
n8dro02,"While it is an introductory course, there were times I definitely was banging my head against the wall, especially those segmentation faults in C, and the entirety of tideman.",Head_Bad8630,2025-08-12 23:58:50,3,learnprogramming,t1_n8dqd8r,True,
n8drt07,"Thank you, I needed to hear that. I generally do have a tendency of rushing things but I didn't want this to be one of those scenarios, thanks for your opinion!",Head_Bad8630,2025-08-12 23:59:41,1,learnprogramming,t1_n8dr935,True,
n8few7z,To be honest that's the reply I was looking for.,Head_Bad8630,2025-08-13 07:04:36,0,learnprogramming,t1_n8e6bi7,True,
n8duq19,"If you go directly from cs50x to cs50p, you will also complete it in under a week because there is a little bit of overlap in the material covered with the latter half of cs50x. The lectures are also shorter.",simon_zzz,2025-08-13 00:17:15,3,learnprogramming,t1_n8dubfh,False,
n8dfiff,"Focus on the thing you wanna do/work. Otherwise, you can also stick Java, you probably didn't even scratch the surface of Java Itself.",maqisha,2025-08-12 22:49:49,5,learnprogramming,t3_1monl19,False,
n8ep6w7,"Learn what you're currently taking classes for, or whatever classes you're about to take use. Learn more of it than your classes require.",no_regerts_bob,2025-08-13 03:28:22,2,learnprogramming,t3_1monl19,False,
n8eu6dy,If you want to try something just for the hell of it I created a new language for build AI applications. https://learn.convo-lang.ai/,iyioioio,2025-08-13 04:04:38,1,learnprogramming,t3_1monl19,False,
n8gc8sd,"From your position: Scala.It will teach you a lot what is available for SE in CS in a real language running on JVM (and JS and native).JavaScript may be interesting (prototype based vs class based), but too much noise in how it's used. Only learn the basics. If you're interested in how that was intended — Self (son of Smalltalk).C++ has unprecedented noise-to-essence ratio among programming languages. Not what you want as a CS freshman I believe.Also consider: \- Lisp \- Prolog \- SML(OcaML) and/or Haskell \- Forth (concatenative languages) \- Proof assistants (full dependent types) (can jump directly to Lean in 2025, it's Agda done right, incorporating most of what was learned from Coq)",aikipavel,2025-08-13 12:01:49,1,learnprogramming,t3_1monl19,False,
n8di941,"Oh I most definitely haven’t, I’m just a planner lolAren’t the vast majority of technical interviews done in python though?",SyncratMusic,2025-08-12 23:04:45,1,learnprogramming,t1_n8dfiff,True,
n8dl058,They’re almost always in the language you’ll be working in at the job. The only time they’re not is if you’re not proficient in the language so they say you can choose the language,needs-more-code,2025-08-12 23:20:01,5,learnprogramming,t1_n8di941,False,
n8dkmtd,"From what I've heard, technical interviews can be language agnostic (meaning you do things in pseudocode) or the language(s) that you'd be using in your position.",Dappster98,2025-08-12 23:17:55,2,learnprogramming,t1_n8di941,False,
n8c59b4,"I don't know what IDE you are using, but Jetbrains let's you create ""Scratch Files"". Basically quick, temporary environments you can test some code in without needing to switch context or projects.But these files can (if you are happy with what you've wrote) be stored permanently. So what I have are a bunch of these scratch files in a few thematically named folders inside my IDEs ""Scratch files"" section so I can quickly open them and copy paste whatever I need out of them. They stay with the IDE, sync across instances and are project independent, so whatever I open in my IDE I will always have access to those. I can access them Quickly through keyboard shortcuts or the search function. They are clean, searchable and cloud synced. So would tick all boxes for you if you are on Jetbrains.I often store them together with a quick implementation example to help me remember how I intended it to be used.",milan-pilan,2025-08-12 18:59:28,2,learnprogramming,t3_1mogrgc,False,
n8di5f7,"Don’t most IDEs store snippets for you? Xcode does. Anything that’s a function or more should go into a library. Snippets are customizable bits of code that you type over and over, like templates for loops and such. A function doesn’t need to be written more than once to be reused.",iOSCaleb,2025-08-12 23:04:11,1,learnprogramming,t3_1mogrgc,False,
n8q71d2,Create a nuget package called common and use it :),Financial_Archer_242,2025-08-14 21:47:29,1,learnprogramming,t3_1mogrgc,False,
n8c7snl,Correction : I've just checked on my PC and it seems like they are local only. They seem to not be cloud synced to other PCs using the same License by default. Sorry - I was sure they were.[edit] Counter-Correction: I found the Youtrack Issue for this feature and someone built a workaround to the missing cloud sync. Leaving it here in case someone needs it:https://youtrack.jetbrains.com/issue/IJPL-13077/Allow-syncing-scratch-files-with-JetBrains-account-across-IDEs-including-Android-Studio#focus=Comments-27-12019126.0-0,milan-pilan,2025-08-12 19:11:27,1,learnprogramming,t1_n8c59b4,False,
n88eon0,Programming from the Ground Up – Jonathan BartlettThe Art of Assembly Language – Randall HydeAssembly Language Step-by-Step: Programming with Linuxx86-64 Assembly Language Programming with Ubuntu – Ed JorgensenARM Assembly Language: Fundamentals and Techniques – William Hohl & Christopher HindsRISC-V Reader: An Open Architecture Atlas – Patterson & WatermanIntel 64 and IA-32 Architectures Software Developer ManualsARM Architecture Reference ManualAssembler School (Interactive ASM challenges)PC Assembly Language by Paul A. CarterOnline x86 / ARM Emulator - Can find one online.,ShadowRL7666,2025-08-12 04:09:01,5,learnprogramming,t3_1mnykoo,False,
n88dvgq,What architecture are you hoping to use/learn?,Dappster98,2025-08-12 04:03:01,7,learnprogramming,t3_1mnykoo,False,
n88g6k4,The art of computer programming by Donald Knuth,no_regerts_bob,2025-08-12 04:20:04,3,learnprogramming,t3_1mnykoo,False,
n897poq,"Thanks, much appreciated",0_Think_,2025-08-12 08:30:23,2,learnprogramming,t1_n88eon0,True,
n88ofbb,"Don't know why you got downvoted, but this would have been my first question as well.While ""Assembly"" is classified as *programming language*, it actually is more like an entire family of languages that are vastly different and incompatible depending on the CPU architecture and hence, the question in the above comment.",desrtfx,2025-08-12 05:26:51,3,learnprogramming,t1_n88dvgq,False,
n897nu4,"i just want to get started, i don't a particular architecture in mind, though i would like to take your advice on that",0_Think_,2025-08-12 08:29:52,1,learnprogramming,t1_n88dvgq,True,
n88y9pk,"Yeah, there isn't ""one Assembly"".",mackstanc,2025-08-12 06:56:55,1,learnprogramming,t1_n88ofbb,False,
