id,body,author,created_utc,score,subreddit,parent_id,is_submitter,distinguished
n8drdww,"This is my area of work.They have separate legal entities. Microsoft, the parent, will form one company that solely works on gov contracts and a commercial company.They legally have to. My former company got into trouble because the company was seeking commercial work with foreign nationals. What they had to do was spin off a commercial division that was completely separate, both physically and legally, from their government division.Microsoft's services that are provided to the US government are completely separate to their commercial services. Their government portion can use COTS products that Microsoft makes. However, gov contracts require bids to be presented to the government before purchase. This is how you get funny situations like Microsoft providing AWS solutions to the government.",Just_Another_Scott,2025-08-12 23:57:09,11,cscareerquestions,t3_1momise,False,
n8dr8en,None of the government work is done offshore. Microsoft/ Amazon etc have teams specifically for US government. Most of these work requires you to have a security clearance. The outsourced work is other non government work.,Journalist_Gullible,2025-08-12 23:56:13,12,cscareerquestions,t3_1momise,False,
n8dk1w4,"At least for Microsoft, to actually touch compute for the us gov / work on us gov specific stuff you usually need to be a cleared engineer and work in DC. Also, at least in my org the Beijing division was closed and employees were asked to relocate to Canada for security reasons :person_shrugging:",schrodingerspetcat,2025-08-12 23:14:40,3,cscareerquestions,t3_1momise,False,
n8es02s,"Access control and security audit are a thing in all IT orgs. Access to cloud systems hosting govt data and apps is controlled. Software that gets developed is also audited for unsecure code and procedures. Highest risk to US data comes from hacking and breaches, not from the vendor companies.",wonkycal,2025-08-13 03:48:30,3,cscareerquestions,t3_1momise,False,
n8d96vu,They let the offshore companies do the toil/low impact work that are meant for entry level employees here that does little to nothing in the grand scheme of their businesses.,travelwithtbone,2025-08-12 22:15:07,5,cscareerquestions,t3_1momise,False,
n7u2e36,"That's the reality. You feel more productive at first, but then expectations start to catch up. And now you're expected to sustain that level of productivity indefinitely.Many years ago, during the Industrial Revolution, factory workers felt more productive because machines helped them deliver 1000x more in less time. They thought that they would be rewarded with fewer hours of work. But it turns out that capitalists expected them to maintain 40 hour work weeks, reduced the workforce, and lowered pay. It's an illusion that AI is benefiting developers. The only people who are truly benefiting are the capitalists. They make more profit due to the increasing rate of output and hiring fewer workers.",BearPuzzleheaded3817,2025-08-09 20:50:04,321,cscareerquestions,t3_1mlzpzq,False,
n7uw1na,At my company we spend 80% of our time arguing about what to build and 20% building it. Unless AI can help resolve dev ego I’m not sure it will help me.,Trick-Interaction396,2025-08-09 23:47:15,18,cscareerquestions,t3_1mlzpzq,False,
n7uk32f,Few months of programming was done in one week? What kinda bs company are you at lol,Imperial_Eggroll,2025-08-09 22:33:18,67,cscareerquestions,t3_1mlzpzq,False,
n7u8h7h,My manager thinks estimations are nearly zero because of cursor. I always show him it's not the case,Mast3rCylinder,2025-08-09 21:24:33,12,cscareerquestions,t3_1mlzpzq,False,
n7u1r6b,"It makes you more productive if you have a really good understanding of your code, architecture, patterns, abstractions, etc.If you are struggling, AI will not save you.",Few-Artichoke-7593,2025-08-09 20:46:28,58,cscareerquestions,t3_1mlzpzq,False,
n7u8k8c,AI is great for building new code. Not so much for trying to debug existing problems in code.,tkyang99,2025-08-09 21:25:01,28,cscareerquestions,t3_1mlzpzq,False,
n7u2oyc,"At my company, it’s expected to augment our productivity by a factor of at least 3. However, we can’t just vibe code our way to success…one still needs to have a really good understanding of what’s going on, how to integrate properly and deliver well.",CurveOwn9706,2025-08-09 20:51:45,16,cscareerquestions,t3_1mlzpzq,False,
n7u6eg5,"Idk, but it doesn't seem like the exec team got more productive.",babypho,2025-08-09 21:12:46,6,cscareerquestions,t3_1mlzpzq,False,
n7ubp5j,"FAANG SWE here, word on the street is that the following performance cycle will force people to use AI and be more “productive”. This industry is finished.",anonybro101,2025-08-09 21:43:04,13,cscareerquestions,t3_1mlzpzq,False,
n7v03j7,I don’t know how you all do it. I spent three hours on claude and ChatGPT trying to get a 90 line JavaScript code to work with very detailed instructions. It would get it almost there and dud out and sort of go back to the beginning with very broken code.,italianmikey,2025-08-10 00:12:58,6,cscareerquestions,t3_1mlzpzq,False,
n8kvtmm,"I've seen it happen with someone that once joined my team. Left 2 weeks later. No one really thought much about it a few days later. It's just business.Do what is best for you, always. The company wouldn't hesitate to cut you if their circumstances changed.",PersianMG,2025-08-14 02:04:52,278,cscareerquestions,t3_1mpnogn,False,
n8kwcvy,"To be honest, it’s better to quit now than in 12 months when they’ve invested significant resources into onboarding and training you. Say thank you but you got an opportunity you can’t pass up; be humble and gracious, and there shouldn’t be any issue.",thatgirlzhao,2025-08-14 02:08:00,148,cscareerquestions,t3_1mpnogn,False,
n8kxet7,The “bridge” with your current company doesn’t matter in the slightest.,WhipsAndMarkovChains,2025-08-14 02:14:11,63,cscareerquestions,t3_1mpnogn,False,
n8kxqyw,"The company would do it in a heartbeat, don't feel bad about it, it's just business. Do what is best for you.",CriticDanger,2025-08-14 02:16:13,34,cscareerquestions,t3_1mpnogn,False,
n8kwt6o,"I quit like 3 days in during my onboarding, the HHRR lady was kind of mad but nobody else cared",cuervo_gris,2025-08-14 02:10:42,19,cscareerquestions,t3_1mpnogn,False,
n8l1avb,"Wait why did you move to east coast? You obviously were looking for a job there, did you want to move? Why would you want to move back so quickly? How much are you going to lose by breaking a lease? And then you need more money for deposit/moving? And then last question, how much more are they paying that this sounds like a good financial decision??",toridyar,2025-08-14 02:37:30,13,cscareerquestions,t3_1mpnogn,False,
n8kw0ae,"Just tell them. Sure they'll be annoyed/mad/etc., but any decent person would understand at the end of the day",mh_zn,2025-08-14 02:05:57,8,cscareerquestions,t3_1mpnogn,False,
n8kxh5h,Just quit. Say you had a better offer.,Pale_Height_1251,2025-08-14 02:14:34,7,cscareerquestions,t3_1mpnogn,False,
n8ky6kf,They'll get over it very quickly,Euphoric_Raisin_312,2025-08-14 02:18:48,6,cscareerquestions,t3_1mpnogn,False,
n8l0jyg,It’s business unless you steal someone’s lunch from the fridge.,Lost_University9667,2025-08-14 02:33:00,3,cscareerquestions,t3_1mpnogn,False,
n7tbwkj,"I don’t see plumbing, welding or nursing listed",MegaCockInhaler,2025-08-09 18:19:55,22,cscareerquestions,t3_1mlmpth,False,
n7rwjzd,"You kind of know Python by default if you learn any other object-oriented programming language. The point of Python is to be simple and intuitive. A lot of the use cases for Python don’t even take advantage of its object oriented features and treat it like a scripting language.There’s unique features like generators, decorators, and the fact that everything is an object with hidden attributes. But the complexity of using Python is more the domains it’s used for. Writing Python code for machine learning is tricky because of the machine-learning knowledge required, not the Python syntax.",Special_Rice9539,2025-08-09 13:38:55,52,cscareerquestions,t3_1mlmpth,False,
n7su9tx,"I wonder why there is no mention of proper backend language. Everybody and their mom still write backend on Java/C#, I fail to see how it’s not relevant.",Netmould,2025-08-09 16:46:34,4,cscareerquestions,t3_1mlmpth,False,
n7rquga,"2023, all time high, 90k responses, it has fallen and it will keep fall sharp",beanVamGasit,2025-08-09 13:02:45,11,cscareerquestions,t3_1mlmpth,False,
n7t4p6f,"The topic has already been answered, see 2017 Stackoverflow Survey.",kknyyk,2025-08-09 17:41:16,6,cscareerquestions,t3_1mlmpth,False,
n7ukkw3,"I said this elsewhere, but you could distill all of this into one sentence.**What do employers want you to know? Learn that.**That's been the advice for forever. If you try to find insight or meaning behind a Stack Overflow survey you're going to struggle to see the wood through the trees.",EnderMB,2025-08-09 22:36:20,3,cscareerquestions,t3_1mlmpth,False,
n7sflxj,"I got everything, certs on the list as a 5yrs exp developer but still no interviews LOL",boculater,2025-08-09 15:27:48,4,cscareerquestions,t3_1mlmpth,False,
n7riw3e,Python as a first language is extremely bad advice. This is how you learn bad practices and how you become a script kiddie instead of a software engineer.,Bobby-McBobster,2025-08-09 12:06:36,9,cscareerquestions,t3_1mlmpth,False,
n7svcw8,"Rust has the highest income, therefore I'm optimizing by learning that.",csanon212,2025-08-09 16:52:17,1,cscareerquestions,t3_1mlmpth,False,
n7t03qs,People still use StackOverflow?,KingLeoricSword,2025-08-09 17:17:13,-1,cscareerquestions,t3_1mlmpth,False,
n8ig1ja,"They are a startup, they don't even know what they want. If I were you I'd intern at a more stable company if possible",bluegrassclimber,2025-08-13 18:26:24,358,cscareerquestions,t3_1mpc76p,False,
n8ig2xn,Are they first time founders? Wouldn't be the first time some dudes with 'an idea' just need someone to build it and expect full stack experienced dev quality for intern level pay selling the dream where you are supposed to give up all your personal time for this amazing family like awesomeness,Adorable-Emotion4320,2025-08-13 18:26:36,78,cscareerquestions,t3_1mpc76p,False,
n8ihzgk,"if you are the first hire as an intern, then you my friend were nothing but cheap labor in their eyes. Just put it on your resume whatever you can and keep applying. It’s a reflection of them not you.",cuddersrage,2025-08-13 18:35:55,75,cscareerquestions,t3_1mpc76p,False,
n8iu0nz,"In general, pre-seed, seed, and early bootstrapped companies shouldn't hire interns / juniors. What they need is experience to get things off the ground. What this company thought they wanted was cheap labor. This is more a reflection on the company, not on you. When you are inexperienced, you need to surround yourself with high performing, experienced individuals and teams willing to train you.",Excellent_League8475,2025-08-13 19:34:41,30,cscareerquestions,t3_1mpc76p,False,
n8ikscg,"This isn’t a startup. This is an idea. They wanted an intern to implement the idea from scratch lol. The real lack of communication is theirs. It’s their startup not yours. If it makes you feel better this company won’t exist in a year either. Was this your first programming job? While a bad experience and demoralizing, you’ve actually crossed the hardest possible barrier - the no job no experience loop. You now have actual real experience that you can put on a resume. Never tell anyone you were let go. It’s work. Talk about what you worked on etc.",goomyman,2025-08-13 18:49:36,22,cscareerquestions,t3_1mpc76p,False,
n8iym7j,"A similar thing I saw once:Founder has an idea. Needs a dev. Hires an intern, because that’s cheap and “how hard can it be”. It’s hard. Junior dev makes junior mistakes. Founder gets frustrated, admits he needs a more experienced dev. So he replaces the intern. Maybe there is an element like that in this story.But you write “improve the communication part even though it's pretty much useless for my work” - this is not true. Communication is part of engineering work, and maybe something you need to improve on.",LogicRaven_,2025-08-13 19:56:51,19,cscareerquestions,t3_1mpc76p,False,
n8izdb8,"Those founders are 10000% incompetent. Founding engineer is an intern? No pay, no equity? First I was mortified, then I laughed at the absurdity. These kids man.",unlucky_bit_flip,2025-08-13 20:00:31,16,cscareerquestions,t3_1mpc76p,False,
n8iju0m,"Given that wall of text without really much coherence or logical breakup, I’d consider working on your communication",Golden_Age_Fallacy,2025-08-13 18:45:00,29,cscareerquestions,t3_1mpc76p,False,
n8iq1pk,"I've been in the industry for 11 years and have worked at startups in A/B/C series and have also worked at bigger corporations. No one knows what they're doing, I wouldn't take it personally. Keep your head up and keep leveling up",hajimenogio92,2025-08-13 19:15:30,5,cscareerquestions,t3_1mpc76p,False,
n8jfhrt,They probably ran out of money to pay you.,Eric848448,2025-08-13 21:15:59,4,cscareerquestions,t3_1mpc76p,False,
n882kcn,Unfortunately even with a cs degree that isn’t cutting it anymore,lemonshark4,2025-08-12 02:45:58,240,cscareerquestions,t3_1mnx0jd,False,
n88u0zv,You don't need a CS degree of you have fifteen years of professional experience in a five year old technology.,TurtleSandwich0,2025-08-12 06:17:00,50,cscareerquestions,t3_1mnx0jd,False,
n885sle,"My degree is in psychology, but I’ve been working as a dev for 25 years. It’s definitely cost me a gig or two, but most postings now say “or equivalent experience” and the exchange rate is basically 1:1 whenever they spell it out. Several headhunters have told me “oh, that’s not REQUIRED required.”Honestly, things are shitty right now whether you have the right degree or not. Like, worst I’ve ever seen.",RichCorinthian,2025-08-12 03:07:02,52,cscareerquestions,t3_1mnx0jd,False,
n89jk5d,"bro in this subreddit you will probably find just demotivating responses with interviews... Companies usually say ""cs degree required or EQUIVALENT EXPERIENCE"". If this is not the case, go to the next one.",Ok-Lifeguard-9612,2025-08-12 10:24:08,9,cscareerquestions,t3_1mnx0jd,False,
n88cj03,Apply anyway if you have experience.,krazylol,2025-08-12 03:53:21,16,cscareerquestions,t3_1mnx0jd,False,
n888yi7,"Despite what it may say on a job posting, most of the requirements aren’t actually requirements. Job posting requirements are usually a wish list for the perfect candidate and should be treated as such. The person hired almost never meets all the requirements.That said, yeah, if you’re self taught or even a bootcamp grad the market is not going to be a kind place for you right now. Part of a good hiring process is about reducing risk. Generally, for entry level positions, candidates with CS degrees are stronger hires than non-CS degree candidates. There’s still strong candidates in both groups, but their tend to be fewer really terrible candidates who have a CS degree since many of them were flushed out in college.Right now there’s a lot of candidates with CS degrees looking for jobs, so most companies don’t have a ton of incentive to look in that more risky pool of candidates.As someone who broke into the industry over a decade ago with no degree, I really do wish I had something better to tell you, but honestly, that’s just where the market is at right now.The best advice I can give you is:- Dont let the CS degree requirement in a job posting deter you from applying. If you feel like you can do the job and you meet 60%-70% of the requirements, just apply. Realize it’s a long shot and don’t get your hopes up, but it doesn’t hurt to shoot off a resume. You never know.- You need to focus on getting your foot in the door anywhere. Focus on smaller companies that aren’t “tech” companies. You need to get a job on your resume that says “developer”, “software engineer”, or something like that. Remember what I said earlier about risk? If you can show that someone else paid you for a year to be a developer, that tells other companies that, on some level, you can do the job, which reduces risk. Again, I realize you’re probably applying to just about anything you can, but I want to emphasize that if your goal is really to break into the industry then you should prioritize getting experience in the field on your resume above all else.",Drugba,2025-08-12 03:28:09,16,cscareerquestions,t3_1mnx0jd,False,
n89t2oy,"Most places don’t actually require a degree, they’re just forced to put that there according to HR. Most of them are much more interested in your portfolio and projects you’ve completed in the past.",DontDiddyMe,2025-08-12 11:38:41,3,cscareerquestions,t3_1mnx0jd,False,
n8aa8z4,Apply anyway,StretchMoney9089,2025-08-12 13:26:03,3,cscareerquestions,t3_1mnx0jd,False,
n8aghyd,"Folks, job descriptions are made by HR people who don't know a thing about ITMy company fills job descriptions with a lot of things we don't need; I almost always end up hiring people who don't meet all the criteria Apply anyway so you get a tech interview",fig0o,2025-08-12 14:00:20,3,cscareerquestions,t3_1mnx0jd,False,
n88qgmm,If you already are in the field with experience nobody cares what you're degree is in. That's really only a useful indicator for your first job. I hire people and I don't even look at anything to do with their degree or if they even have one because I'm only looking at people with 5+ years experience.,Jswazy,2025-08-12 05:44:58,2,cscareerquestions,t3_1mnx0jd,False,
n7vrmde,"Yeah, I understand your pain. Currently over 300 apps and 15 interviews this year with 3 yrs exp. Funny thing? All 15 of those interviews were not through cold applying. There are simply too many people in this field to cold apply anymore. If you want interviews/results, you are gonna have to get out there and get personal with recruiters/ppl. It is possible, just hang in there man.",Manney200,2025-08-10 03:11:34,53,cscareerquestions,t3_1mm7a5h,False,
n7w6100,In your position but no internships and it’s been a year. Barely get any acknowledgment whatsoever from applications and just got ghosted after my second ever job interview. I am completely lost and barely see a point in living anymore. I regret university so much.,Big_Organization_181,2025-08-10 05:02:16,8,cscareerquestions,t3_1mm7a5h,False,
n7xloi4,"Brother I have 15 years of experience, I was a senior dev and project lead. There are no jobs right now, it isn't just you. You're going to have to keep things in perspective until the market turns around.",paperlevel,2025-08-10 12:52:44,10,cscareerquestions,t3_1mm7a5h,False,
n7vu2rx,Military. Or police. Or be a garbage man.Start exercising and apply.,neosituation_unknown,2025-08-10 03:28:53,19,cscareerquestions,t3_1mm7a5h,False,
n7vrcx1,go back to school. you are only 22? do something in the medical industry. etc.,phonyToughCrayBrave,2025-08-10 03:09:46,17,cscareerquestions,t3_1mm7a5h,False,
n7vq1q6,How many years of experience do you have? Do you have college debt?Something to consider is registering with a temp agency like roberthalf. As a rising senior in college I was unable to secure an internship and I signed up with them. Due to my tech background I was places almost immediately in a position for a corporate company. I was able to pass off the work there as IT related. That job helped me secure my first position in tech.,Feisty-Saturn,2025-08-10 03:00:44,6,cscareerquestions,t3_1mm7a5h,False,
n7vpm4q,post resume,Miseryy,2025-08-10 02:57:44,12,cscareerquestions,t3_1mm7a5h,False,
n7w8mk4,"To be brutally honest, all of your responses to people are nothing but excuses. The job market is tough, but certainly not impossible; my company still hires batches of freshers every spring. The ones who get the job are usually those who put in the extra effort and stand out from the rest. Referrals are always prioritized. There is always time for networking. If you need money in the meantime then do some gig work, flip some burgers or do a temp stint.",LazyCatRocks,2025-08-10 05:24:34,15,cscareerquestions,t3_1mm7a5h,False,
n7vpsj9,What were you doing in college,jcbeans6,2025-08-10 02:58:59,9,cscareerquestions,t3_1mm7a5h,False,
n7w8d7z,SWE is cooked bro.. sorry to say but it’s the truth,rahli-dati,2025-08-10 05:22:18,7,cscareerquestions,t3_1mm7a5h,False,
n7tqn16,Hang in there! It sucks but it will get better. Please don't block out your friends. Find ways to spend time with them that doesn't cost money. Social time and enjoying the other parts of life are what will get you through this!,brad9991,2025-08-09 19:43:42,23,cscareerquestions,t3_1mly7bn,False,
n7u9ye5,"Walk away from the house and the credit card debt. Extending the debt by Airbnb was not the right move, but hindsight is 20/20. The fact that you are considering asking your parents for money to fund an investment property Airbnb that is cashflow negative means you need to take a step back. Don't throw good money after bad. Sometimes you need to cut your losses. The debt you have is not something held over your head. You can walk away. Debt collectors may try to get back some of their money, but there's is basically nothing they can do to you other than decrease your credit score. You just simply don't pay it. You are young and can easily start over.Whether or not you can get a job in CS or another industry is another story obviously. That's going to take more effort on your part than you've been putting in. So you need to either find that effort or find a new pathway to making money.",avaxbear,2025-08-09 21:32:59,14,cscareerquestions,t3_1mly7bn,False,
n7tvyxz,Please talk to your friends and your parents. They love and care about you and don't want you to suffer.,aeroplanessky,2025-08-09 20:13:56,13,cscareerquestions,t3_1mly7bn,False,
n7tzabk,"okay so this feels more like a personal finance issue. are you doing any work right now (literally anything)? have a hard look at your finances. maybe it's time to sell the house if you can't keep up with the payments anymore. how big is your credit card debt? that will quickly snowball, if you don't pay it off in a timely manner. get any kind of job you have and cut all unnecessary expenses immediately.",No_Loquat_183,2025-08-09 20:32:40,6,cscareerquestions,t3_1mly7bn,False,
n7wo6rf,Why didn't you get non-CS job? Of course you wont have the money! You are sitting home and not working.,BagholderForLyfe,2025-08-10 07:51:05,3,cscareerquestions,t3_1mly7bn,False,
n8pligk,"**First: buy time (today)*** Call your **loan servicer’s Loss Mitigation** line and ask about *forbearance extension*, *repayment plan*, or *loan mod*.* Book a **HUD-approved housing counselor** (free, virtual). They’ll help you script the call and options.**Then: get interviews (next 7 days)*** Prioritize **contract roles** (faster response): **TEKsystems, Insight Global, Motion Recruitment, Apex Systems, Robert Half**. Tell them “remote-first, open to contract-to-hire.”* Target titles that fit your background and stay remote: **Estimator / Precon / Project Controls / Scheduler (P6) / VDC-BIM / Implementation or Support Eng (CE)**.* **10-min apply loop:** pull 5–7 must-have skills → add 3–5 *verb + skill + metric* bullets → apply on employer ATS → log & follow up.**Copy-paste scripts****Recruiter DM** Hi — CE background: Estimating, APM, remote consulting. Available immediately for remote contract/CTH in Precon/Project Controls/VDC/Scheduling. Recent wins: cut CP by 14% on DC build; bid $22M pipeline w/ 31% hit rate. Can I send a 1-page and talk 10 min?**Hiring follow-up (after applying)** Hi , I applied for . 8 yrs commercial (APM/estimating, DC/light industrial). I improved bid-hit 22%→31% and built P6 schedules across 3 projects. Could we do a 10-min chat this week?",hola-mundo,2025-08-14 20:02:44,3,cscareerquestions,t3_1mly7bn,False,
n7xm9hq,"This isn’t being dramatic, mortgage pressure, debt, and a stalled job search are a real crisis. You’ve already shown resilience by keeping payments afloat with Airbnb, but now the priority is stabilizing cash flow and cutting time to job-offer.Contact your lender’s loss-mitigation department immediately the earlier you engage, the more options you’ll have for loan modification or reinstatement before foreclosure timelines lock in. In parallel, stop relying solely on online applications. Use targeted recruiter outreach, former colleague referrals, and direct hiring manager contacts to bypass the slow funnel. Your computer engineering background is still marketable, but focus on roles where you can demonstrate immediate ROI that’s what will move the needle fastest in this market.",Superb-Education-992,2025-08-10 12:56:37,2,cscareerquestions,t3_1mly7bn,False,
n7ujen0,"And this kids, is why you should stop going into CS",Frosty_Doubt8318,2025-08-09 22:29:09,1,cscareerquestions,t3_1mly7bn,False,
n7y4aiu,"Thanks for saying this, it just gets kind of hard sometimes but I will reach out to them for sure!",cybergypsy26,2025-08-10 14:44:01,3,cscareerquestions,t1_n7tqn16,True,
n7x3hdn,They might not mean that because you have a cs degree you know all the information required to get your A+. What they are probably saying is that it is much more difficult to get bachelors in CS so info dumping for an A+ cert just memorizing information will be easier. Yes they are different.,wholecan,2025-08-10 10:25:35,128,cscareerquestions,t3_1mmeja9,False,
