id,body,author,created_utc,score,subreddit,parent_id,is_submitter,distinguished
npd450q,"You've got a few options here, the right way to go depends on which tradeoffs you'd like to make and the user experience you want to create for the external people accessing the data.* as mentioned in your post, you can expose API endpoints that make the data available. The upside of this is that it's a common pattern that most of your customers will understand. The downside is that they have to write code (ie do work) to get the data out. The shape of the data is limited to what you serve over the API. It also puts a bunch of extraneous load on your servers and db (we've seen APIs be taken down because they were being scraped aggressively for BI purposes).* you can let your customers download CSVs. Like the first option, this will take work on your side to support and operationalize. The upside is that it's a pretty well understood pattern. The downside is that your customers might get annoyed quickly because this is a manual process: if they want data with any kind of regularity, they'll have to do this over and over again.* you can upload the data to an S3 bucket (or other object storage like R2 / GCS) and let your customers read it there. This is similar to giving them access to a database that you own, but gives you better cost and load protection: they'll be using their own compute to read it so it's less likely they'll blow up your bill by reading the data (though they can rack up big egress fees if your dataset is large).* you can share data directly to your customer's database or data warehouse. The upside is that the data shows up directly where they're ready to consume it, and they have to do zero work in order to get the data. It's also much more secure than letting them access your database directly (for example, they can't take your database down by accident by putting undue load on it). The downside is that it can be more or less cumbersome for your team to implement, depending on whether you build it in house or use existing tools. If you decide to use tools for this, assuming your data exists in places other than that RDS instance, you can leverage some of the native sharing functionality of some data warehouses (eg Databricks' Delta Sharing, or Snowflake's Data Sharing). Alternatively, you can use a vendor like us ([https://prequel.co](https://prequel.co/)) that will let you write data from your database instance directly to your customer's db / warehouse regardless of what stack they run.*Full transparency: we're a software vendor in this space.*",prequel_co,2025-11-17 19:06:53,1,dataengineering,t3_1ozmryz,False,
npd6d5a,[https://delta.io/sharing/](https://delta.io/sharing/) is a possibility,Ok_Tough3104,2025-11-17 19:17:57,1,dataengineering,t3_1ozmryz,False,
nov668x,"What do you mean by your salary keep up in DE field? Did you try for DE roles in the GIS field? For any data roles, SQL is the key to survival followed by few other important skills as well.",69odysseus,2025-11-14 20:09:14,2,dataengineering,t3_1ox5wiq,False,
novwcl8,"Idk I think it just depends. I’m a new DE and my salary is 130,000 per year",Uncle_Snake43,2025-11-14 22:27:54,1,dataengineering,t3_1ox5wiq,False,
novfgzv,Is it commonplace for DEs to get yearly raises or do raises usually come from taking new jobs/roles?,micluc14,2025-11-14 20:58:35,2,dataengineering,t1_nov668x,True,
novg39c,"Yearly raises depends on the company and other factors. From my experience, salary hike gets capped at certain level within the same company unless it's a major jump in the role. Much higher chances for a good hike with new role at different company.",69odysseus,2025-11-14 21:01:54,3,dataengineering,t1_novfgzv,False,
npbpzi7,"Thanks for sharing. The source code has a flag for ducklake, did you test it? If so, how did it compare to plain duckdb?",Money_Beautiful_6732,2025-11-17 14:59:56,1,dataengineering,t3_1owgac5,False,
npc2wqw,Yes I tested it for Ducklake and the timing was about the same than just DuckDB. I have DuckLake on Postgres as the data catalog. Was about a minute slower than on pure DuckDB on 1 hundred tables.,Hofi2010,2025-11-17 16:05:36,1,dataengineering,t1_npbpzi7,True,
nopf1uj,aws glue can connect to mongodb using a custom jdbc connector. you can use aws glue jobs to extract and transform the data. notebooks or scripts can be used depending on your preference.,OppositeShot4115,2025-11-13 21:54:11,3,dataengineering,t3_1owe39q,False,
nopoq82,all of the above,Interesting_Tea6963,2025-11-13 22:45:23,3,dataengineering,t3_1owe39q,False,
npf2gks,You’re a negligible amount of the issue. Don’t worry about it.,Firm_Bit,2025-11-18 01:25:13,9,dataengineering,t3_1ozyj4s,False,
npgl7ug,Shift daily compute jobs that can be a little flexible to a time when the energy is likely renewable in your local data centre.,threeminutemonta,2025-11-18 08:10:47,2,dataengineering,t3_1ozyj4s,False,
npgrgwy,"how about implementing efficient services? Use Rust, use non-distributed systems like duckdb --> this will overall reduce your complexity.",geoheil,2025-11-18 09:16:38,2,dataengineering,t3_1ozyj4s,False,
npf3y05,"Think about it this way: NOAA compute probably has a carbon footprint many, many times larger than your company.",Drew707,2025-11-18 01:34:16,1,dataengineering,t3_1ozyj4s,False,
npfa6td,"Keep an eye on how much your cloud costs, lower it if you can.Lower cloud bills *generally* mean less electricity and whatever other resources used. But also unless you're spending millions on cloud compute it's a drop in the ocean.Edit: Just general things you should do anyway as an engineer will help a tiny bit. Deleting unused data means less hard drive usage. Less network traffic means less fiber lines and network switches needed. Updating to newer infra - more efficient. Updating dependencies - hopefully more secure and more efficient. Using frameworks that aren't memory hungry - fewer sticks of ram needed.",warclaw133,2025-11-18 02:11:36,1,dataengineering,t3_1ozyj4s,False,
npgrice,use SLM not LLM,geoheil,2025-11-18 09:17:02,1,dataengineering,t1_npgrgwy,False,
npff9ij,Which frameworks are considered more efficient? I have found a lot of DE to fall into “that’s how we’ve always done it” and not always the best tool.,kevi15,2025-11-18 02:41:12,1,dataengineering,t1_npfa6td,True,
npfctah,"I'm not sure of your exact infrastructure but the principles remain, In Jupyter lab you can create python environments, in these python environment you can install* custom packages/libraries, -Activate your environment (I use conda)Conda activate PROD_ENV-Cd into your codebase directoryCd project_folderPip install -e . (The period . Makes all new updates apply when you reload the kernel)Now turn your environment offConda deactivateIf the install is successful your codebase (and recent changes ) will now be available to your environment on restart of your kernel.For this to work you need your Jupyter notebook instance to have access to the directory your codebase is saved in. And the machine Jupyter is running on needs python (or conda in case)If you're in a controlled environment you need to have whomever is responsible for your machine configurations to run a bash script when the server starts. A simple bash script is all you need to do this. You will want the environment to be stable and unchanging. The best way to do that with servers that do not have internet access is by packing your environment in a tarball (without your custom libraries installed) and unpack the env and install on the machineAgain all of this, tarball unpacking, install of library are just all a bash script. Thank you for coming to my ted talk.",siddartha08,2025-11-18 02:26:59,2,dataengineering,t3_1ozr74t,False,
npg3cqd,"First thing first don’t use a jupyter notebook.Second, this calls for a unit test. And with unit test you don’t need to have a real dataset. I mean these days, you can literally just tell chatgpt to mock a csv according to your expected schema and tell it to convert to parquet. You can use this parquet to do your unit testing. Or you can simply hardcode define the mock data with pandas and load it as a pyspark dataframe.",CrowdGoesWildWoooo,2025-11-18 05:24:52,2,dataengineering,t3_1ozr74t,False,
npf59vk,"If I understand you correctly, you're trying to test changes to the internal libraries?I'm not sure about out-of-the-box tools that hot-reload libraries, you could stand up your own process to watch for changes to your source code before kicking off logic to reload them on the backend.",murdoc_dimes,2025-11-18 01:42:21,1,dataengineering,t3_1ozr74t,False,
npf7ym5,"Integration testing is a pain sometimes. I do a lot of spark (scala) and my libraries are pretty well unit tested and my pipelines are just stitching things together with configuration. If you're not in a situation where you can iterate quickly on the library you should fix that first, and every time you catch something on integration do what you can to add tests ""upstream"" so you can catch it in those fast unit tests.",Siege089,2025-11-18 01:58:27,1,dataengineering,t3_1ozr74t,False,
npjo0d0,"I usually add pytest unit tests to the repo, use some fixtures to connect to a local Spark instance. Can be a bit of a pain to set this up on Windows and on CI/CD, but it's highest on the priority list whenever I come across pytest code like that.",sleeper_must_awaken,2025-11-18 19:38:21,1,dataengineering,t3_1ozr74t,False,
npaubzf,"Basically, it is that if you don't decommission the legacy system, you're running two platforms and only getting recognition for running one (the new one). Execs will ever acknowledge that legacy has any value, despite the fact that until you move everything off, it's likely to be running things that are super important and nobody knows about, until they break.I've had a career of dealing with this. The shift and lift approach to a more modern tech is definitely viable sometimes. But I found pushing the data from legacy to the new platform, and removing all point-to-point dependencies with the legacy environment was the best way, before rebuilding the things to better standards on the new platform.",HG_Redditington,2025-11-17 11:31:37,9,dataengineering,t3_1ozdem1,False,
npau8na,"You may be interested in this, now classic, story: [https://en.wikipedia.org/wiki/Knight\_Capital\_Group#2012\_stock\_trading\_disruption](https://en.wikipedia.org/wiki/Knight_Capital_Group#2012_stock_trading_disruption)A bit more detals: [https://www.henricodolfing.com/2019/06/project-failure-case-study-knight-capital.html](https://www.henricodolfing.com/2019/06/project-failure-case-study-knight-capital.html)",squadette23,2025-11-17 11:30:48,2,dataengineering,t3_1ozdem1,False,
npca193,"Some regulations are explicit on certain types of data only being used and stored for particular purposes. If you don't decommission then ""storing for an explicit purpose"" may be violated.On a personal note, I've just completed a migration of an old system. Half the battle was finding out how abd where various code libraries and infrastructure were used. There's a school of thought that says don't worry about unused code, just leave it alone.Personally, I'd get rid of anything unused.1. You'll soon find out if it is truly unused.2. All that old stuff makes onboarding people difficult.3. Old unused stuff adds doubt and confusion when confidence and clarity are needed.",LargeSale8354,2025-11-17 16:40:32,2,dataengineering,t3_1ozdem1,False,
npfek92,"Decommissioning is something I've thought a lot about. So many companies (looking at you SAP) where moving off is an existential threat for the company, and it's by design. But any company thinking that way is not invested in new tech , they want to hold onto their money makers. Companies like that will do anything they can to hang on to you and that's the toughest challenge to de-commissioning; the people with their hand on the switch have no interest in giving it up.",TheOverzealousEngie,2025-11-18 02:37:09,2,dataengineering,t3_1ozdem1,False,
npfyi6y,"Following the **legacy system decommissioning** process is important due to its numerous advantages. Here are some of the key benefits that come to my mind:* **Cost savings**: By decommissioning your outdated systems, you can achieve significant cost savings by eliminating all the maintenance-related expenses.* **Compliance**: You can easily comply with the ever-evolving regulatory requirements by retiring old systems and retaining your historical data.* **Data accessibility**: This is one of the best **benefits of the legacy** system **decommissioning** process. Even though your old systems are completely shut off, the legacy data still remains accessible for audit-related requirements.* **Security**: Your obsolete systems are often vulnerable to numerous security threats which can compromise your entire IT infrastructure. By decommissioning legacy systems, you can ensure that your existing infrastructure is secure and protected from any unwanted breach.* **Sustainability goals**: By downsizing your old system, you can significantly reduce the energy consumption required to run the obsolete systems, contributing to your organisation's sustainability targets. Apart from these significant advantages, another important factor to keep in mind is that you can also outsource your **legacy** system **decommissioning** requirements to a professional expert. One such partner that I came across on LinkedIn is TJC Group. You can reach out to their decommissioning experts to address all your system retirement concerns.",NeerajKumarChaurasia,2025-11-18 04:47:07,2,dataengineering,t3_1ozdem1,False,
npat1c2,"Depends. Country , State laws, contacts, and Domain may require a formal demonstrative documentation or other requirements.Healthcare job we had to keep data for 7 yrs but no more for certain datasets. Some states had different time frames, maybe? There was a pipeline process and reports, but I wasn't directly involved.Also client terminate contract rules.",NoleMercy05,2025-11-17 11:19:50,2,dataengineering,t3_1ozdem1,False,
npgteqt,"I agree with the other points. Save time, effort, and confusion about having something legacy running alongside its replacement. Decommissioning ought to be part of a migration or improvement process. In my experience, decommissioning something legacy has probably been the next top activity to get postponed, right after documentation...It's analogous to getting rid of cookware or tools you've replaced. Here's another angle: if your workplace, industry, or experience has gone into Lean processes or thinking, like 5S, this should come up as part of that.",Ulfrauga,2025-11-18 09:37:32,1,dataengineering,t3_1ozdem1,False,
npaxiiq,"Thank you very much, this has given me a lot of clarity.",Upper_Spot4862,2025-11-17 11:58:58,1,dataengineering,t1_npaubzf,True,
npbzucw,Great and simple answer! It’s truly the best advice. Now if only the corporate world follow it more often…,BarfingOnMyFace,2025-11-17 15:50:24,1,dataengineering,t1_npaubzf,False,
npfq06y,"Wow, what a fascinating story. $440 million being just wiped out, receiving investment of $400 million to offset it and also the CEO losing 75% of his equity share is really something. I was checking if they made any movies about it. Looks like they didn't, but there are some documentaries about it.",Upper_Spot4862,2025-11-18 03:47:02,2,dataengineering,t1_npau8na,True,
nozmiu0,"You can find a list of community-submitted learning resources here: https://dataengineering.wiki/Learning+Resources*I am a bot, and this action was performed automatically. Please [contact the moderators of this subreddit](/message/compose/?to=/r/dataengineering) if you have any questions or concerns.*",AutoModerator,2025-11-15 15:22:09,1,dataengineering,t3_1oxubz8,False,moderator
np12p45,"Even if you aren't going into management, taking a leaddev course on software engineering management can help you understand how your bosses are thinking, and higher level ICs generally have some degree of management anywayshttps://events.leaddev.com/together",posting_random_thing,2025-11-15 19:54:47,6,dataengineering,t3_1oxubz8,False,
npgrrbp,Used herman miller chair,BringtheBacon,2025-11-18 09:19:44,1,dataengineering,t3_1oxubz8,False,
np8lee7,Thank I’ll look into this.,MonochromeDinosaur,2025-11-17 00:41:49,1,dataengineering,t1_np12p45,True,
nou17s8,"Are these articles with us in the room right now?Seriously, sending files through Kafka? Who is saying that we should do that? Parquet is efficient for at rest, as storage format. Not wire format.",RustOnTheEdge,2025-11-14 16:42:51,44,dataengineering,t3_1ox1e9h,False,
nou15ah,"These articles are single-mindedly focusing on the fact that Parquet is tiny. If you want to transform in flight, there are other formats you should use and then compress it into Parquet after the fact. Parquet should be used at rest not in motion.",No_Lifeguard_64,2025-11-14 16:42:31,9,dataengineering,t3_1ox1e9h,False,
nou16j3,"Kafka is not designed to pass that type of heavy data, it is designed to pass messages. The data there is usually temporal and with heavy replication. Also, you would lose a lot of the parquet ecosystem like deltaYou usually pass a reference to your data, like the URL of the parquet.I think you misunderstood those articles, Kafka is not designed to share files",Sagarret,2025-11-14 16:42:41,6,dataengineering,t3_1ox1e9h,False,
nounze6,Is this the same group of people who build ETL pipelines in Mulesoft?,WhoIsJohnSalt,2025-11-14 18:36:26,4,dataengineering,t3_1ox1e9h,False,
nou0ydj,"What guides are you talking about, as it makes no sense ?",random_lonewolf,2025-11-14 16:41:35,1,dataengineering,t3_1ox1e9h,False,
nou1fsv,parquet with kafka doesn't optimize much. it's mainly marketing fluff. focus on other optimizations.,OppositeShot4115,2025-11-14 16:43:58,1,dataengineering,t3_1ox1e9h,False,
nou3bsr,Can you share one of the articles?,DenselyRanked,2025-11-14 16:53:20,1,dataengineering,t3_1ox1e9h,False,
noynjn2,Wat,wtfzambo,2025-11-15 11:21:04,1,dataengineering,t3_1ox1e9h,False,
nou53b9,"[Kafka + Parquet: Maximize speed, minimize storage | by Deephaven Data Labs | Medium](https://medium.com/@deephavendatalabs/kafka-parquet-maximize-speed-minimize-storage-7e6337d6b0a1)",yourAvgSE,2025-11-14 17:02:07,3,dataengineering,t1_nou17s8,True,
novfozo,I've seen worse. Someone made a kafka topic where XML files are put. Fucking abomination,pantshee,2025-11-14 20:59:46,1,dataengineering,t1_nou17s8,False,
npkukpt,"What is your tech stack?I mean, orchestration tool. Airflow, Fabric, Prefect, Dagster, Luigi, NiFi, Step Functions, Cloud Composer, Azure Data Factory, Flyte, Argo Workflows, Nextflow ??Better to understand what you have to point to a good solution",ArmInternational6179,2025-11-18 23:18:27,1,dataengineering,t3_1ows3en,False,
np6da4m,"I agree with most of your advice but there's nothing wrong with starting with Python. It may not have been what you needed, but not everyone is the same as you.The problem with more challenging languages is that many people find it so difficult to accomplish anything at all that they give up before they ever see any results. And end up thinking they're not capable of programming.Starting with something easier like Python, or even HTML, can be great for many people to get the idea of coding and get some early wins. Then it's not as daunting to tackle a more challenging language next.For others, like you, it's preferable to start with a language that really exposes you to what's really happening behind the scenes.",dmazzoni,2025-11-16 17:41:35,234,learnprogramming,t3_1oyrne8,False,
np6pvtz,"> without understanding what was actually happening under the hood.By this logic, everybody should start with ASM or NAND gate to Tetris.",AUTeach,2025-11-16 18:44:11,27,learnprogramming,t3_1oyrne8,False,
np6emtm,"I agree with everything except #1. I don’t think there’s a correct trajectory, either from strict to loose or the other way around.If you start with a strict language, it’s more of an uphill battle and it’s likely that you won’t appreciate why that strictness exists. To some people it might feel like expecting them to read classical literature before reading a children’s book (to be clear I’m not saying that Python or similar languages are childish…the analogy only works so far).I started it with JavaScript and I don’t think that going back in time and starting with something like C would have necessarily made me a better programmer. I had a use for JavaScript and not for C. C would’ve made me pull my hair out and I probably wouldn’t have continued along this path.",SamIAre,2025-11-16 17:48:39,21,learnprogramming,t3_1oyrne8,False,
np6fnk8,2-5 aren't bad.,gofl-zimbard-37,2025-11-16 17:53:50,7,learnprogramming,t3_1oyrne8,False,
np6bzqk,"I started with python. It was great.The whole point is you don't need to understand what's happening under the hood.Once you know how to read and write some basic code, then you can go and expand your programming knowledge by going deeper in C, assembly, etc to get a better idea what's going on.",mxldevs,2025-11-16 17:34:50,35,learnprogramming,t3_1oyrne8,False,
np6o6cl,"I would disagree with the python part. When your learning concepts in programming like Data Structures, Functions, loops etc, you can learn that at a pseudocode level, you need to use a language to apply those principles, so in that regard you can use what ever language you want. Learning how to develop software should be detached from learning a language. So in short, when learning concepts use a language that doesnt get in your way. As a person that learned to code with C and C++ I dont see anything wrong with having python as thier first language",Soft-Marionberry-853,2025-11-16 18:35:55,8,learnprogramming,t3_1oyrne8,False,
np6oc2i,"Good tips.I'd add the that the ""embrace being stuck"" point remains true over an entire career Professional development is the cycle of being stuck and feeling like a dumbass. Then figuring it out and feeling really smart!I've been doing this 15 years and am still regularly stuck on some problem or issue.",Quick-Benjamin,2025-11-16 18:36:40,5,learnprogramming,t3_1oyrne8,False,
np6j0uv,Idk. I think your mistake was jumping from Python to Rust honestly. :rolling_on_the_floor_laughing: I was so I’d found an easy that tutorial to try one night. I think I lasted all of 15 minutes.,MrKBC,2025-11-16 18:10:55,11,learnprogramming,t3_1oyrne8,False,
np6vx2c,"I'm a great believer in the idea that the only thing that stops anyone from learning anything is terrible explanations. That, to me, is the real problem, not whether one language, like Python, is the best choice or not when you are starting out.I've begun lots of videos that have promised to teach me, I don't know, Terraform in two hours only to become bored out of my skull in 15 minutes because the teaching is terrible (mainly because IT people generally do not know how to teach, because they don't know how to communicate) and to move on to watching videos of Rottweiler puppies for three hours straight.There's a reason why documentation can be awful. It's because many people who know how to do IT-type stuff are incredibly good at doing those kinds of things. What they are generally terrible at is communication, for example explaining how some library or other works.Good succinct explanations would make even the most difficult technology accessible to all. Think about Amazon Web Services. When I started to look into it a few years ago I became really depressed because I thought I had suddenly become stupid. It was almost impenetrable. Now that I know something about it I find myself asking, ""Would it really hurt AWS to write just a few pages – just two, for crying out aloud – that tells beginners what the hell the whole thing is about?""I have just bought a book on Terraform. It's good but only because I already know about Terraform. Documentation is similar. Too much of it is written by people who think that everyone understands things already. In which case, why do they bother writing the documentation in the first place?",evolutionIsScary,2025-11-16 19:13:30,4,learnprogramming,t3_1oyrne8,False,
npaifu3,Starting with Python can help build confidence by letting beginners focus on problem-solving before diving into lower-level details.,thegangplan,2025-11-17 09:33:10,5,learnprogramming,t3_1oyrne8,False,
nomljg5,"You shouldn't really be wondering why it suddenly works. If you ever don't know exactly why code is working, you should stop what you're doing and find out. That's important because code ""working"" in a particular case doesn't mean it actually works broadly.",carcigenicate,2025-11-13 13:20:02,262,learnprogramming,t3_1ow0ptq,False,
noml4ih,isn't it really bad if you don't know why as you wouldn't be learning anything?,RustCohleCaldera,2025-11-13 13:17:30,57,learnprogramming,t3_1ow0ptq,False,
nomlh44,"Honestly, you need to learn programming.It is not black magic and we don't all just wonder why it works, that dumb meme is made to make juniors feel better.I would suggest that you get better at unit testing. Get in the habit of testing that the function you wrote actually runs and output what you expected it to.",brand_new_potato,2025-11-13 13:19:39,80,learnprogramming,t3_1ow0ptq,False,
nomprqf,The real WTF happens when your code starts working when you add debug statements. I have committed code containing lines like `print (“”);` or `assert (1);` which would crash without them. (Probably some alignment bug in the compiler/interpreter which get avoided by the effective noop).,Abigail-ii,2025-11-13 13:45:14,14,learnprogramming,t3_1ow0ptq,False,
nomq0ra,"I knew a programmer whose sig was ""90% of my time is spent removing bugs, the other 10% is spent writing them.""",JustSomeCarioca,2025-11-13 13:46:40,14,learnprogramming,t3_1ow0ptq,False,
