id,body,author,created_utc,score,subreddit,parent_id,is_submitter,distinguished
mmqcwrk,"If you ask questions related to newer versions of software they are going LLM going to spit out lies and follow up questions make them to go round and round. This happened to me related to nextjs questions.These days I would much prefer something like Stackoverflow than LLMs who spits land mines (sophisticated lies) in their texts for us to figure out. Yes, indeed there is community problem at SO, which could be fixed easily with updates.",nerdy_adventurer,2025-04-12 13:45:12,13,cscareerquestions,t3_1jxczax,False,
mmpofrn,"SO needs to be alive, we need it. But they really have to think of something to become relevant again.And in my opinion they need to remove the downvotes. Posts are getting downvoted because they are ""duplicate"". Duplication shouldn't be an issue.People are making an effort to mark something as duplicate but they don't answer the question. It's such a waste of time.Duplication should be replaced with a ""related to"" functionality.SO feels the same as it did the first time I visited in 2010.",valkon_gr,2025-04-12 10:44:10,23,cscareerquestions,t3_1jxczax,False,
mmpph1g,"SO has been like this for 15 years. It's a good resource, but the community sucks, particularly the top users. I've found friendlier communities for programming help.",myevillaugh,2025-04-12 10:53:56,15,cscareerquestions,t3_1jxczax,False,
mmpuo35,U need to put female pics to avoid getting flamed when asking a potentially duplicate qns,alpha_epsilion,2025-04-12 11:39:28,9,cscareerquestions,t3_1jxczax,False,
mmqjhch,ChatGPT never says “I’m not going to do your homework for you. What have you tried?”,nsxwolf,2025-04-12 14:22:16,8,cscareerquestions,t3_1jxczax,False,
mmhvrko,"Agreed with beastkara that this is totally unreasonable. I have seen interview loops being conducted entirely over chat for hard-of-hearing/deaf candidates. So there’s no reason why they wouldn’t be able to accommodate you. Someone dropped the ball here and it wasn’t you. I’d suggest maybe talking to a few employment lawyers because you might have a case here. At the very least you may be able to scare Amazon enough into giving you a do-over. Also re Discord, fuck that noise. That’s some bullshit. You wouldn’t be too hard to work with in a team. Drop those weirdos and don’t look back.",eeaxoe,2025-04-11 02:07:54,168,cscareerquestions,t3_1jwbfm2,False,
mmjb0s2,> I tried asking about this in a Discord but really only got messages saying that I'd be too difficult to work with in a teamJesus christ I fucking hate people,mailed,2025-04-11 09:39:20,43,cscareerquestions,t3_1jwbfm2,False,
mmlf9dp,"Speak to a lawyer. Them not accommodating a disability, let alone for a veteran, is unconscionable.",EveryQuantityEver,2025-04-11 17:15:51,10,cscareerquestions,t3_1jwbfm2,False,
mmhhvdz,"When you asked the interviewer if they can type the questions in text format, what did they say?It is totally unreasonable if you asked him this and he said no. But your post does not make it clear if you asked this. When he said, he does not see that accommodation, did you explain what you needed? If you explained, and he refused to type the questions, that's discrimination.Also, zoom has a closed captions feature, though Amazon might not use zoom. Was that enabled? There are also are apps you can download that do closed captioning regardless of who is speaking. Ideally, you should get your own app to do CC just in case there is any technical glitch with interviews. Some things like hearing aids are still your responsibility to cover, the company just has to provide anything necessary to support you outside of that. Amazon requires in office work, so you'd be expected to have a working hearing aid.",beastkara,2025-04-11 00:41:31,37,cscareerquestions,t3_1jwbfm2,False,
mmjm573,DIscord is full of losers who are too lazy to do any other job. They want to break you like the interviewer here.,Sparta_19,2025-04-11 11:19:51,14,cscareerquestions,t3_1jwbfm2,False,
mmj2xp3,Have you considered a lawsuit?,FatChunLi,2025-04-11 08:12:29,19,cscareerquestions,t3_1jwbfm2,False,
mmlis5e,I filed a discrimination charge with the EEOC against Amazon too. I think you should do the same.,joseflopez,2025-04-11 17:32:55,9,cscareerquestions,t3_1jwbfm2,False,
mmjd7i9,"Yeah, sucks that someone didn’t do their job, but move on. Hiring a lawyer would be a waste of time, but go ahead if you so wish. Amazon will argue a 100 different ways how lack of time wasn’t the issue here.",obelix_dogmatix,2025-04-11 10:01:11,8,cscareerquestions,t3_1jwbfm2,False,
mmoi2io,"> my interviewer says he does not see that accommodationThe EEOC is very clear on this...prior notification and arrangements are entirely irrelevant. If you show up with a disability and require a reasonable accommodation, they have to provide it to you whether you'd previously disclosed it or not. The only legal ""out"" to an accommodation request would be a claim by the employer that your accommodation was ""unreasonable"". I've certainly seen some unreasonable accommodation requests during my career, but asking for questions to be written and a small amount of extra time to accommodate that request would pass the reasonableness test in any court in the U.S. That interviewer screwed up. You're probably not going to get a job at Amazon, but I'd contact the EEOC to lodge a complaint anyway. Might even be worth talking to a lawyer. Amazon should be training their recruiters better than this, and they won't fix the problem if they aren't called out for it.",codefyre,2025-04-12 03:53:29,3,cscareerquestions,t3_1jwbfm2,False,
mmp343v,"Definitely speak to a lawyer (of course before hiring) or file something. They sometimes have these interviews recorded (especially if on a zoom or leetcode session), so if you asked there is a record of them denying the request… Honestly, as someone who conducts interviews, I would have never said no. Didn’t see a special request? Doesn’t make a difference. I might roll my eyes (likely at the disorganized recruiter) because I would have been more prepared if I had seen the request (i.e. typed out the prompt more, maybe follow up questions, etc to copy paste in to have it go smoothly) … but I would never say no!! Hugely inappropriate… some people just don’t appreciate veterans the same way. If you have any recent experience or projects, I’d recommend also trying to find things to talk about in those, just to handle those types of questions / people. The interviewer was probably just trying to drill down into technical experience, and that’s why they were asking about non service related experiences? That’s my guess, giving the benefit of the doubtSeriously, best of luck! Ignore the haters, we all have our own stuff.",Necessary_Plant_5222,2025-04-12 07:02:41,3,cscareerquestions,t3_1jwbfm2,False,
mmi4cmk,"I’d narrow it down to two offers you want and try to negotiate the offer you want least of the two for more. If you get a counter offer, use that counter as leverage for more with the offer you want most.",funkbass796,2025-04-11 03:03:55,12,cscareerquestions,t3_1jwfugk,False,
mmi477k,"~~That's an unusually high base salary in the Apple offer coupled with an unusually small RSU and bonus package. Weird.~~~~Also, your RSU grant needs to be divided by four (as it's over four years) before adding it to your TC. You didn't do that; you just treated the 4-year grant as an annual grant, so your TC numbers are inflated.~~EDIT: Nevermind, I see the updated post.Anyways, these numbers otherwise look okay so if it were me I wouldn't be basing the decision off just the numbers. I'd be looking at the roles themselves and seeing what I like best, as well as considering where I actually want to live. There's more to the decision than just the pay package, especially when they're all so similar.But to answer your actual question...at this stage negotiation basically just looks like this:""Hey, Mr./Mrs. Recruiter, the offer looks awesome, but I'm wondering if you'd be able to come up to on the salary/RSU/bonus/sign-on, as I have these offers from that are offering me such. What do you think?""And that's basically it. You show what you're getting elsewhere, you ask if they can match it, and it's either a yes or no. There's no secret trick with companies like these and frankly I'm not sure what else you're looking for.Good luck!",kevinossia,2025-04-11 03:02:52,6,cscareerquestions,t3_1jwfugk,False,
mmicoqj,How are you getting these high offers? I received senior offers from Apple and Meta in 2023 and they were way lower than these.Like my Apple offer was about 330k total comp.,Fun_Acanthisitta_206,2025-04-11 04:05:06,4,cscareerquestions,t3_1jwfugk,False,
mmimrtk,"The latest significant layoffs at Apple were in 1997 when Steve came back. I haven't spent 1 second of the last 3 years or whatever worrying about getting laid off, and I also won't spend any time thinking about it going forward. For me, that'd be worth the less money.",messick,2025-04-11 05:29:53,3,cscareerquestions,t3_1jwfugk,False,
mmi3m86,"first of all, your numbers are confusing, is that stock number PER YEAR or over 4 year? if the latter then your numbers aren't ""Total Comp"" you need to divide by 4, and is that 'bonus' annual bonus or one-time signup bonus? for your question, I always just negotiate on my own, by the time you're at written offer stage it means the company already wants you, so that should be your (mutual) goal also tiny details, what you actually means is ""RSU"", because ""stock options"" means something very very very different as ""stock options"" means you don't get ANY stocks unless you pay up (with your own money), it's common in startup world but not so much for publicly-traded big techs",NewChameleon,2025-04-11 02:58:52,5,cscareerquestions,t3_1jwfugk,False,
mmj8nw4,"If i calculate that correctly, meta is below 300k, Amazon is at 328k a year (but they have different vesting schedule for a first year, so i'll be lower for first year and higher in second, etc.) and Apple is at 354k at first year. There's no competition here. I'd go with Apple offer, you can still Ask for more RSU, but they're the best offer by far.",oddlyspecificintern,2025-04-11 09:14:19,2,cscareerquestions,t3_1jwfugk,False,
mmiclgr,"You can pay the leetcode ad people like 600 bucks to help you negotiate. Never did it. Maybe works. Would try it if this much moola was at stake.For negotiating in general, Chris Voss - Never split the difference is essential. Also a derivative book of ""How not to get F*cked by a technical recruiter""",beastwood6,2025-04-11 04:04:26,1,cscareerquestions,t3_1jwfugk,False,
mmlig89,"Id be transparent with all the companies and let them know you have multiple offers. I’d first give the amazon offer to Meta to get them to bump. Then if they match or increase, go to Apple with both offers and ask for more. That way meta only has to get back once, and Apple will also get back to you once (if that’s your top choice). If Apple doesn’t match, then hit up Meta.",Carsonal,2025-04-11 17:31:18,1,cscareerquestions,t3_1jwfugk,False,
mml5b9b,There's multiple things wrong with these offers. The RSUs are not really the issue here. Why are you making up fake offers?,jymacro99,2025-04-11 16:27:02,0,cscareerquestions,t3_1jwfugk,False,
mmi6fvk,Is this ICT4? Super low RSU but base is so high,zninjamonkey,2025-04-11 03:18:39,5,cscareerquestions,t1_mmi477k,False,
mne9uqz,"Become a banker then. If you go to a tech company you may never live to see 25-35 YOE. I’m the guy who went from bank to tech. Got laid off twice in a year and my career has pretty much ended here lol. My former team members who also went to tech have all been fired and on career break now. 1 joined Meta, 2 joined Google. Nobody survived longer than a year. There is no chill",jemaaku,2025-04-16 12:14:16,59,cscareerquestions,t3_1k0hgul,False,
mne68y0,"Then leave I'm not sure what's the point of the thread, just ranting? Banks are like that.",deejeycris,2025-04-16 11:49:28,17,cscareerquestions,t3_1k0hgul,False,
mnee985,\>I just wanna go to tech companies and be chill.uhhh,ScroogeMcDuckFace2,2025-04-16 12:42:43,22,cscareerquestions,t3_1k0hgul,False,
mne37qh,"Totally get it, that kind of environment can drain you fast. If you’re craving real tech, better culture, and actual growth, it’s time to start planning your exit. Polish your GitHub, build something small, prep for interviews, and apply quietly. You don’t have to quit tomorrow, but giving yourself a path out makes everything more bearable.",hokuspokusmaster,2025-04-16 11:27:03,26,cscareerquestions,t3_1k0hgul,False,
mnf5l7a,Stop complaining about having a stable job. Jesus Christ.,BigTex88,2025-04-16 15:08:32,12,cscareerquestions,t3_1k0hgul,False,
mne14ec,"For what it's worth, not all banks are like this. Nothing stops you from applying and interviewing. Definitely don't let go of this role before securing the next one",saintmsent,2025-04-16 11:10:38,10,cscareerquestions,t3_1k0hgul,False,
mneoz6l,At least you have a job.,farfaraway,2025-04-16 13:43:27,7,cscareerquestions,t3_1k0hgul,False,
mnf47po,">and be chill.For what it's worth... government, and banking, are industries that are traditionally ""chill"". For exactly the reasons you're takling about. Slow and inefficient dev processes, waterfall-ish development, old code, lax policies like no code reviews, etc.*That's* what a ""chill"" dev environment is. Slow, low expectations, and safe.Working at a place that has cutting edge tech, fast paced development, dev processes focusing on speed and efficiency, people who are ""passionate"" about code and aren't in it for the money, everyone being a ""family"", etc... are all traits of traditionally very un-chill companies. Fast, high expectations, and unstable.Not an inherent truth or anything, but it fits the stereotype.So take a step back and try and figure out what you want out of your career. Do you really want a chill company? Well, you're already at it.Is modern tech more important to you? Or is being friends with your co-workers / working at a company that is very social outside of work important to you? Start applying and reverse interviewing to find a company that has that.Or take an even bigger step back. Do you even want more out of your career than a paycheck? Why does being bored matter in the first place? Are you bored *outside* of work? Personally that's where I get my fulfillment. For as long as my employer has a good WLB, I'm holding onto that for dear life.",SouredRamen,2025-04-16 15:01:40,6,cscareerquestions,t3_1k0hgul,False,
mnet0ae,>I just wanna go to tech companies and be chill.Are you living under a rock,blackiechan99,2025-04-16 14:05:18,7,cscareerquestions,t3_1k0hgul,False,
mneag14,"I've worked at two Fortune 100 insurance companies which sounds like it would be similar but honestly its very chill workload wise, but I work with smart people and can choose whatever tech stack makes sense(new stuff) and you can wear shorts/tshirts to the office, never even heard the CEOs called ""Mr."" lmao. Point being don't assume just because its not a tech company its shit, basically any F500 company is probably going to be mostly decent, but I'm in the US, not sure how that translates out of the US.",ghdana,2025-04-16 12:18:14,3,cscareerquestions,t3_1k0hgul,False,
mmk4kav,Zero. 12 YOE,Celcius_87,2025-04-11 13:21:51,228,cscareerquestions,t3_1jwohyy,False,
mmjzs2i,I only study system design if I have an interview lined up. Then i study it maybe half an hour a day.,TonyTheEvil,2025-04-11 12:53:31,73,cscareerquestions,t3_1jwohyy,False,
mmkbg6s,"0, I study on company time, unless I'm in a period where I have to grind (e.g. important interviews lined up)",kp0507ch,2025-04-11 13:59:05,114,cscareerquestions,t3_1jwohyy,False,
mmk2ih9,"I'm not actively interviewing so I don't study outside of work. I do watch youtube channels that keep me up to date though like Primeagen, T3 and fireship but that's just entertainment i watch over dinner",YupSuprise,2025-04-11 13:09:59,24,cscareerquestions,t3_1jwohyy,False,
mmjyf9j,5 years experience. Basically zero. But I am looking for new roles now so I do stuff for a few hours every day now.,zombawombacomba,2025-04-11 12:45:06,69,cscareerquestions,t3_1jwohyy,False,
mmkdd9g,Zero lol fuck that,Full_Bank_6172,2025-04-11 14:08:55,81,cscareerquestions,t3_1jwohyy,False,
mml8trl,"0, 8 YOEWhat’s the point of working your ass off to get where you are. If you don’t actually enjoy the ride when you’re there? When I’m off, it’s beer and Netflix time. Maybe some live sporting events. I want to enjoy my time You’re right. The hiring bar has changed. To the point people with your experience level probably need 2 to 6 months. Hundreds of resume applications. Assuming you’re a leet code genius, you’ll probably make it through 3 to 5 interviews before anything happens over that timeThis is not the time to be upending your life just because. Pretty much every major financial institution is predicting a recession this year. As a new hire you’re going to be the first to get laid off.Just enjoy the ride right now.",AccomplishedMeow,2025-04-11 16:44:30,31,cscareerquestions,t3_1jwohyy,False,
mmkej04,"I study on the clock. I used to grind after hours, not anymore. My time is too precious",Pale_Sun8898,2025-04-11 14:14:49,23,cscareerquestions,t3_1jwohyy,False,
mml0ooy,AFTER work?!?! Lmao,musclecard54,2025-04-11 16:03:56,28,cscareerquestions,t3_1jwohyy,False,
mmjvi8r,"I study LC/SD at least 1h per day after work/during commute, and I’m not even looking for a new job.I just do this to be ready when I feel like changing jobs4YOE",skyyper,2025-04-11 12:26:16,10,cscareerquestions,t3_1jwohyy,False,
mn3ftwa,"Yes, and it's going to get worse. A lot of hiring, even for approved headcount, is still frozen. That, combined with layoffs - this gets worse before it gets better.",theB1ackSwan,2025-04-14 17:35:04,102,cscareerquestions,t3_1jz4mn3,False,
mn3femo,It’s been really slow since 2022…,gregvee,2025-04-14 17:33:01,202,cscareerquestions,t3_1jz4mn3,False,
mn3gwuw,Reason for freezes and layoffs may have pivoted from A.I. to government uncertainty.,fedput,2025-04-14 17:40:18,56,cscareerquestions,t3_1jz4mn3,False,
mn3kq59,"At this point, we're definitely in a pause. Where people aren't even sending rejections because they don't want to reject you just in case, but they don't want to bring you on also just in case. Which could produce animal spirits come May/June if 4D chess man lives up to his 4D chess, but I doubt it. /I also doubted he could freak out the Fed enough into handing him de facto control over monetary policy during his first term. So there's that.",poipoipoi_2016,2025-04-14 17:58:26,26,cscareerquestions,t3_1jz4mn3,False,
mn3pqi6,"Trump's tax code change in 2023 was the biggest factor up until his tariff talk. He's fucked us time and time again. I know that he's insanely unpopular in the general development community, but its mind boggling to me that he even has the small amount of support he does have when he's fucked us over at every turn.",fake-bird-123,2025-04-14 18:23:08,62,cscareerquestions,t3_1jz4mn3,False,
mn40zck,My company and nearly all of my friends companies all have unofficial hiring freezes right now. New roles seem to be limited to internal hiring/promotions or for absolute unicorns.My CEO has been bragging about how AI has caused them to hire “thousand of less workers than we originally planned” so they’re probably waiting to see how that plays out.,HeavySigh14,2025-04-14 19:20:03,17,cscareerquestions,t3_1jz4mn3,False,
mn3wbbb,I've noticed a lot fewer job postings and lower salaries since all this tariff craziness started happening. Hard to keep up hope,bman484,2025-04-14 18:56:11,14,cscareerquestions,t3_1jz4mn3,False,
mn3o87c,"I have the exact same YOE and have felt the exact same as you. Probably part of the issue is economic uncertainty. Hiring is also quarterly, as companies do quarterly planning and allocate budget to things like hiring. So things will probably pick up a bit with the start of the next quarter, but hiring in general seems to be suppressed at the moment due to economic conditions",Illustrious-Age7342,2025-04-14 18:15:38,10,cscareerquestions,t3_1jz4mn3,False,
mn5vpwi,"America just declared economic war on the rest of the planet, the rest of the planet that provides 40-60 percent of all American big tech revenues. If you don’t think this is going to result in less demand for American tech products I don’t know what to tell you.",UntdHealthExecRedux,2025-04-15 01:29:49,10,cscareerquestions,t3_1jz4mn3,False,
mn4146f,the market is a mess,ScroogeMcDuckFace2,2025-04-14 19:20:44,8,cscareerquestions,t3_1jz4mn3,False,
mmyjqe3,"$110,000, hybrid in Seattle, healthcare, 5 YOE",Winter_Essay3971,2025-04-13 21:11:20,122,cscareerquestions,t3_1jyhueb,False,
mmyo9ic,"150k tc in Chicago, 5.5 yoe",AniviaKid32,2025-04-13 21:36:37,53,cscareerquestions,t3_1jyhueb,False,
mmyk285,"I was making 144k base salary with 2-3 YOE at some no name company. Now I make 165k base salary at a small tech company with 3.5 YOE. Located in Philly and working remote.Edit: other benefits included in my current role are fully paid insurance, 401k match (not the best), and 150k RSU package disbursed over 4 years w/ a 1 year cliff.",IndoorCloud25,2025-04-13 21:13:10,92,cscareerquestions,t3_1jyhueb,False,
mmyukzs,50k remote. 4 YOE Midwest. Frontend dev for a small startup,Successful_Camel_136,2025-04-13 22:12:14,41,cscareerquestions,t3_1jyhueb,False,
mmz733s,"Everyone who commented should edit their response to include COL, remote/hybrid/rto, and then we can compare in a useful manner.",donmiguel666,2025-04-13 23:26:14,35,cscareerquestions,t3_1jyhueb,False,
mmyklzp,"5yoe 115k base salary fully remote. The “extra” is some stock options in a non-public company plus my insurance benefits and a tiny 401k match. Total comp is probably in neighborhood of 120, 125 if you count insuranceThough I’m getting a raise at the end of the month supposedly",Joey101937,2025-04-13 21:16:15,16,cscareerquestions,t3_1jyhueb,False,
mmyzjyo,"74k, a shitty dev/data integration gov consulting job. I have 3 years of experience I dream of having a normal software engineering job",baneadu,2025-04-13 22:41:05,13,cscareerquestions,t3_1jyhueb,False,
mmz1bx7,"I was making $140k base as tech lead in an edech company hybrid in Kansas. Hated it, dreaded every single day.In 2023 I got a fully remote role as ""SWE3"" (kind of early senior) and been loving it. Started at 160k base. Now I'm at 165k base, 175k with annual bonus. Still living in the Midwest",alleycatbiker,2025-04-13 22:51:38,9,cscareerquestions,t3_1jyhueb,False,
mmyn1uc,"10 YOE MCOL, ~150 remote",chris_nore,2025-04-13 21:29:55,19,cscareerquestions,t3_1jyhueb,False,
mmyllot,7yoe in Defense.$125k base + ~$5k bonus + ~$12.5k 401k match. Fully remote.,ZolaThaGod,2025-04-13 21:21:50,41,cscareerquestions,t3_1jyhueb,False,
mmdhgr2,"You’re doing great man. Low code sucks if you’re a dev and you think in code. But use this position to pad you till you find a job you like. You’re doing everything right. As a Canuck that has seen people been laid off / not get ROs due to the tariffs, I think dev jobs have been mostly safe (as far as dev jobs go in this economy). Plus, if you get the proper dev job the job hunt would be easier in the future if something were to happen. Good luck!",ProfessionalShop9137,2025-04-10 12:02:33,117,cscareerquestions,t3_1jvvzaq,False,
mmdh2ca,"money and remote is great but home can reliable. money and location arent much if the company wont be operating next year. always be looking for the better opportunity though. if anyone asks about a short stint: ""the place was visibly chaotic on day 1""as far as for your career goes, experience with low code and all other forms of chaos can be great for problem solvers who are properly supported and have good communication skills. find the biggest problems, pick one and solve it. if you're inexperienced, well, that's why you're not in a cushy job right now but chaotic environments can be great for rapid personal growth. the difference is whether you play victim or attack problems. the SECOND you become blocked it's time to check in with teammates and work through the blocker together. half an hour of a senior's time may be valuable but they'll be happy you came to them early not after 3 frantic days of spinning your wheels or slacking off.",jackstraw21212,2025-04-10 11:59:48,19,cscareerquestions,t3_1jvvzaq,False,
mmg9oa4,">Every new tasks is a fight to gather information and do tasks.This is almost universally true about every programming job ever.>I'm wondering how bad that job would be for my carreer.Believe it or not, big tech companies love to hear your stories about how you solved problems of this type in interviews (unclear instructions, prioritizing conflicting tasks). This part of the job is counterintuitively GOOD career-wise",Comprehensive-Pin667,2025-04-10 20:35:46,12,cscareerquestions,t3_1jvvzaq,False,
