id,body,author,created_utc,score,subreddit,parent_id,is_submitter,distinguished
npfbj5u,"I feel for everyone who has graduated from 2021 and on. I think many, many people were duped into thinking that the tech job is the holy grail of a perfect life. Hell, I was.But remember, graduating with a CS degree equips you with a tool belt that goes much further than just being able to write some JavaScript. Unfortunately we can’t all be on here posting about how our big name company is giving us 225k a year or whatever. BUT! You are definitely still employable.To my new grads out here losing hope: the outlook may be discouraging but the tough people outlast tough times. There is a lot of crazy stuff happening in the world right now that unfortunately does affect the current parameters of your situation, but these are temporary circumstances. Remember, your degree is literally based on problem solving.My last suggestion is to open your horizons a bit, which I’m sure you’ve done already. There are a lot of companies that aren’t specifically the “big names” we see here, but are big names in their own industry. This is also how you find some neat niches to grow your specialities in. Right now, you should be open to anything. You just want your foot in the door— any door. Except for doors with red flags. Always run from those. GIS is a really cool industry that never gets talked about on the main stage. Do with that information what you will.NEVER GIVE UP!",INeedAYerb,2025-11-18 02:19:26,24,cscareerquestions,t3_1ozvcv0,False,
npeovea,"Yes, you missed that window but a new one will open eventually",darkiya,2025-11-18 00:05:19,50,cscareerquestions,t3_1ozvcv0,False,
npfdbco,"I was unemployed in 2019-2021, and got hired in 2022 for knowing the difference between the stack and the heap (C++11 job).I was unemployed 2023-2024, got hired for a junior C++ position in 2025 just for saying that I ""like to debug low level memory and pointers"".Study stuff you like, as much as you can, and try to develop an interest in skills that companies are looking for. Unemployment apparently isn't a dealbreaker.",abandoned_idol,2025-11-18 02:29:56,11,cscareerquestions,t3_1ozvcv0,False,
npen7bf,same here :( so terrified and worried about my career gap,alicegrcez,2025-11-17 23:55:40,22,cscareerquestions,t3_1ozvcv0,False,
npezgrh,"It took me 3 years after graduation to land a job; 2018-2021. I got super lucky, but you have to continue to try.",chataolauj,2025-11-18 01:07:00,22,cscareerquestions,t3_1ozvcv0,False,
npesiup,"These are my two cents looking at this subreddit not as a CS person but working in cybersecurity but I’ve seen people here REFUSE to look for work outside of the big companies or making at least 70K so my question to you is are you applying only to big companies and or 70K salaries? Also look for companies like Apex or Teksystem that have contract jobs that are 3-6-12 months with the possibility of extension, 85% if the folks I used to work at Amazon came from those companies we didn’t hire them from Likedin",Hot_Client_7485,2025-11-18 00:26:17,39,cscareerquestions,t3_1ozvcv0,False,
nphh6yo,>What happens when the market does turn around? Your mistake is assuming this is gonna turn around. Just go in with the expectation that this market will be the norm for the foreseeable future.,Illustrious-Pound266,2025-11-18 12:59:38,6,cscareerquestions,t3_1ozvcv0,False,
nper0jp,"I'm also a 2024 grad and I'm trying to join the Navy as an officer. I managed to find a basic IT helpdesk position in the meantime, those are much easier to get than SWE jobs.",OperationCautious478,2025-11-18 00:17:34,16,cscareerquestions,t3_1ozvcv0,False,
npet2v4,I think if by May next year you haven’t landed a role you should pivot. It seems you aren’t very talented (by your own words) and you aren’t well connected. Being a teacher is a respectable profession,No-Test6484,2025-11-18 00:29:30,27,cscareerquestions,t3_1ozvcv0,False,
npgh44v,"This is really a stupid measure because ""AI generated"" can mean a lot.Yeah I'd say 60-70% of the code I write is AI generated - because I give it small chunks and detailed instructions almost pseudocode like.If I just prompted ""create a scalable corporate ERP, make no mistakes"" I would be fired from my job for incompetence.",jan04pl,2025-11-18 07:29:04,117,cscareerquestions,t3_1p03oo2,False,
npg5rts,One of my previous CTOs threw his team under the bus and cashed out millions while the company was being sold.I wouldn't trust CTOs anymore than you would normally trust anyone.,polymorphicshade,2025-11-18 05:45:16,205,cscareerquestions,t3_1p03oo2,False,
npg44m6,I think the CTO is just saying that to justify future layoffs.,metalreflectslime,2025-11-18 05:31:19,230,cscareerquestions,t3_1p03oo2,False,
npg4ilp,Why would you need to review code if it is 100% perfect,timmyturnahp21,2025-11-18 05:34:33,100,cscareerquestions,t3_1p03oo2,False,
npgcwtt,"The team that just caused a major security incident went from 0% code coverage to 30%, having AI write all their tests!",serial_crusher,2025-11-18 06:49:00,70,cscareerquestions,t3_1p03oo2,False,
npgplrv,Why start with code? Why not 100% of executive decisions will be made by AI from EOY 2025.,zommerdev,2025-11-18 08:56:45,20,cscareerquestions,t3_1p03oo2,False,
npg75ua,"I think it may come to depend on the field, and the types of systems and tasks.I think it’s fairly obvious that react is extremely repetitive and very boilerplate heavy. Crud apps and all that.At the same time, highly novel systems will benefit less from the copy and paste LLM generation.Of the people saying how crazily successful this stuff is, they really need to be highly specific about what it is they’re working on. Also here’s another weirdness, I am a highly spatial visual thinker. It doesn’t typically save my time to translate my ideas and solutions into English then watch the LLM bang against words. I am much more effective with just going to code.",codemuncher,2025-11-18 05:57:17,17,cscareerquestions,t3_1p03oo2,False,
npg9xgb,"I write most of my code with AI agents. Codex at work and GLM for personal projects. The reality is that if you truly care about the output, you’re not going to see such crazy productivity gains. Some things are faster, other things are slower, and it’s very project dependent. Very green field work will be VERY fast, but with any established codebase it’s not going to be nearly as fast, it can be slower often even. So the only thing that has changed about my job (senior frontend eng) is that I instruct the agent to write the code instead of manually doing it. Other than that, everything else is still more-or-less the same.",lilcode-x,2025-11-18 06:22:02,13,cscareerquestions,t3_1p03oo2,False,
npg4m25,"I doubt your CTO is being honest. 40 people is really small, do you know any of the 8 engineers actually working on this AI project? I tried to get cursor to write some unit tests the other day for a view model and it legit could not do it. I turned on max(this burns through credits) I then picked the ""hardest problems, most complex issues, blah blah blah"" one it was a complete waste and I ended up doing it manually.",loudrogue,2025-11-18 05:35:22,55,cscareerquestions,t3_1p03oo2,False,
npgotue,"EOY 2026 no one will be able to afford generated code anymore.As in, the money that has so far been invested in AI was not meant as a gift. The investors want that money back, with interest, and so far no one has any plan how to actually do that.Tokens would need to cost about thirty times what they do now, with no change in customer behaviour for this to be a viable business.",left_shoulder_demon,2025-11-18 08:48:40,21,cscareerquestions,t3_1p03oo2,False,
npflnmw,"LinkedIn _tells_ you to do this shit. If you apply for a job, it suggests sending DMs to specific people who are at the company but are not in your hiring chain. People you don't know, even in a fake LinkedIn sense. It’s fucking unhinged.",RichCorinthian,2025-11-18 03:19:17,156,cscareerquestions,t3_1ozyr5h,False,
npgr4ra,Why would you give some random person a referral? What if you give a referral to a weirdo? It's going to reflect poorly on you...,dllimport,2025-11-18 09:12:58,56,cscareerquestions,t3_1ozyr5h,False,
npf3n3z,people overcomplicate it. just be direct and ask for what you want. no one has time for fluff.,JollyTheory783,2025-11-18 01:32:25,45,cscareerquestions,t3_1ozyr5h,False,
npfh5r9,"These all sound like reasonable, albeit very shallow ways to open dialogue. You really want 100 people in your inbox asking you directly for a referral and nothing else? Then you’d be complaining about how cold everybody is. Just take the W of having a job and don’t respond to anyone you don’t want to talk to. Simple and to the point",Common-Pitch5136,2025-11-18 02:52:05,72,cscareerquestions,t3_1ozyr5h,False,
npfr8hp,"I think what's going on with a lot of these is people are afraid to directly ask for a favor and have heard seeking an ""informational interview"" is a smart thing to do. But yeah a clear call to action like ""I'm interested in this job; would you be willing to offer a referral?"" is better. Though I probably wouldn't ask a total stranger unless I could think of something we had in common that I could play up when I asked.",Whitchorence,2025-11-18 03:55:14,21,cscareerquestions,t3_1ozyr5h,False,
npg495f,My rule is simpler. If we haven't worked together then I will not refer you and for the most part don't want you to message me on LinkedIn.,ItWasMyWifesIdea,2025-11-18 05:32:22,28,cscareerquestions,t3_1ozyr5h,False,
npfq015,Are these random people you don't know asking for referrals? Or people you already know eg former coworkers?,ImportantSquirrel,2025-11-18 03:47:00,7,cscareerquestions,t3_1ozyr5h,False,
npgr0gt,"I work in maang so I often get hit up by random people on Linkedin. If you are really looking for a referral I agree on being short, sweet and straight to the point, example:""Hi ****, I'm a Java software engineer with 10 years of experience, mainly backend. I'm interested in this role *role link*, would it be possible to get a referral, I've attached a copy of my CV here. Thank you for your time and please feel free to ask me any questions if needed""Keep networking, go to events, meet new people. Even if you have a job. Don't be an assh* (unless someone deserves it) in your current company, people will remember and you'll burn useful bridges.",magicsign,2025-11-18 09:11:42,3,cscareerquestions,t3_1ozyr5h,False,
npfjm5n,"Also, for the love of god do not refer to someone as “Mrs.” If you don’t know their marital status. It can be incredibly rude. I’ve had folks do this on LinkedIn occasionally since I was 24, and barely older than they were. Tbh, I wouldn’t use any honorifics at all, just a first name is by far the most natural",Ok_Idea8059,2025-11-18 03:06:44,10,cscareerquestions,t3_1ozyr5h,False,
nph3bc8,That’s just you man. I love vague people that want to chat on the phone. I don’t want you to write me a book and pitch yourself.,TinyAd8357,2025-11-18 11:16:08,2,cscareerquestions,t3_1ozyr5h,False,
noh92b4,"I know a guy who was a car mechanic, pivoted to software engineering, and later went back to his garage but this time with more tools for the trade (ECU programming, scripting, diagnostics). He said he just couldn’t handle the corporate life.",cacahuatez,2025-11-12 16:30:51,147,cscareerquestions,t3_1ov9me7,False,
nohb5nh,"I studied comp sci a few years ago. My path since then has been honestly pretty hard. Not because of the job market, more because of mental health. I got a diagnosis for something that sucks to have, as many lifelong sentences tend to be, and its been altering my perception of reality ever since and the first line drugs in place for people with that, come at a great expense for the patient, especially if they are in STEM imo. So honestly man, I haven't looked in a while, Idrc about this market. I'm not tied to it. I'll probably go do something else for work and hopefully bring the self-teaching / upskilling motivation with me to learn over there if my treatment allows me to have that. Or i'll just say fuck the doctors and do it anyway lol. Because yeah, this blows!",AdDiligent1688,2025-11-12 16:41:00,53,cscareerquestions,t3_1ov9me7,False,
nohfda6,"Graduated in 2016 with an EE degree and worked in the Utility industry for 6-7 years. Very secure job with okay pay and theoretically lots of PTO. Ended up working multiple 80 hour weeks due to management being bad so I decided to return to school to get a CS degree. The thought was if I'm already working crazy hours, I might as well get paid more. Then my old utility field started blowing up due to electrification of everything and I received multiple offers on linkedIn for 40-50% pay bumps (after a 2 year stint not working while going back to school). Left my CS program with about a year left due to class timings and now I have a great work life balance, much higher pay, fully remote and I can use the programming skills I developed to automate a lot of my current work load. Ended up working out well for me. For those that are curious, the utility industry is a good place to be right now. Whether that's Civil/Electrical/Mechanical or even some CS cyber security degrees. You likely won't get the 250k+ pay packages or stock options, but 100-150k for 3-4 years of experience in the right positions is not unheard of.",Elestra_,2025-11-12 17:01:26,42,cscareerquestions,t3_1ov9me7,False,
nohjkmp,"I did it for 27 years and by the end it was not even remotely like when I started. Anything interesting about it was made hell by agile, outsourcing, leetcode, ridiculous interview processes, and h1b majority orgs.",Nofanta,2025-11-12 17:22:11,93,cscareerquestions,t3_1ov9me7,False,
nohjz36,After a stagnant job of being a SWE; I decided to do masters. Learnt tons of cool stuff and discovered out my passion in math. Now pivoted to a research role in deep learning.,Loud_Palpitation6618,2025-11-12 17:24:10,17,cscareerquestions,t3_1ov9me7,False,
noh8hmh,"Product Management and Technical Sales are the time-honored paths, assuming you don't have the experience to go into management.",RespectablePapaya,2025-11-12 16:28:03,21,cscareerquestions,t3_1ov9me7,False,
noi1xrk,"I met a guy who left the industry and opened up a B&B in the middle of nowhere. (""Gold country, California""--I don't want to dox him by being too specific.) Best wifi coverage and internet for a B&B I think I've ever used. And damn, did he cook a mean breakfast.I'd recommend leaning into your strengths. My strength is in software engineering, and I've been able to keep myself employed and happy. Or at least happy enough.",TimMensch,2025-11-12 18:50:15,8,cscareerquestions,t3_1ov9me7,False,
nojdazw,"Out of college, I got a job at a large tech company. I was assigned a project that really should have been assigned to a different department, and only one guy knew how to do anything in that sector. I'll let you guess how much documentation there was on any of it. I got flak from my team lead when I asked ""too many"" questions, and then flak when I didn't ask enough. I left, and went to grad school to study data science. Currently at a public sector job doing data analysis. It's nice to be in a field where I can actually know I can help make my coworkers' jobs easier rather than making a page load in 9.9 seconds instead of 10.",CallidusNomine,2025-11-12 22:50:30,8,cscareerquestions,t3_1ov9me7,False,
nohq9k2,"Think of industries that mostly consist of old people who are retiring, and industries where old people who are retired will spend a lot of their money on. Specifically industries that require in-person work and can't be outsourced.",Fuehnix,2025-11-12 17:54:37,6,cscareerquestions,t3_1ov9me7,False,
nohxy4w,"I have been in SWE for 25 years and it has been very good for me. I wouldn't say I am the best programmer but I have learned along the way and it has allowed me to be very creative with good job satisfaction.But lately we have replaced a couple of positions with AI tools and I have noticed that those we have hired are very good programmers that are way better than I will ever be. So I am pivoting away b/c i think I only have 1-2 years left before I am given a separation package. I am pivoting to teaching b/c it has good benefits.If you are fantastic at CS definitely stay in. But people are just good or okay programmers, it will be very competitive to acquire jobs and internships.",lumberjack_dad,2025-11-12 18:31:19,9,cscareerquestions,t3_1ov9me7,False,
nphmmyi,Im also a data analyst dont do a lot work. Im considering upskilling to data engineer or scientist but I think everyone is at this point and those jobs are also not safe from automation/outsourcing,mathtech,2025-11-18 13:31:28,30,cscareerquestions,t3_1p0b83p,False,
npj88j4,"Okay I say this with all the good intentions and best will. I am old. Least by Reddit standards. I am 50. I have seen so many different tech, scams, businesses and economies go up and down. I currently have been a developer the last 5 years. I have been in various roles within tech the last 25 years. Everything from customer service, network engineer, QA and even a director. Here are a few nuggets I REALLY hope everyone listens too. They are nuggets I learned from a lifetime of being in tech and it applies no matter what is going on in the world....- Be flexible, willing to adapt and always find enjoyment in learning and don't get attached to any tech, job, title, company- There is no such thing as a secure job, title, or company no matter the state of the world. Downturns just are more in your face about it. - Nothing is permanent. Have a great job? Cool. Enjoy it. It can go away tomorrow. Unemployed? I am so sorry. It sucks. Just keep working on your skills and applying to everything. - Luck is a major factor in literally everything. You could be the best specialist in your field and can't find work. You could not tie your shoes and make $500k a year. Just focus on what is with in your control and not how the dice lands when you roll it. I suppose the other thing is be careful with online reading. Specially this sub. I love it here but also realize negativity and doom get the play here and in the media. We will all get through this one way or another. Just do what you can do and if you got lucky turn around and help another person behind you.",danintexas,2025-11-18 18:21:22,10,cscareerquestions,t3_1p0b83p,False,
nphqo9d,"What you need is a niche. For example, I'm a really good data analyst with Dynamics 365 data for finance because as well as my SQL and Power BI skills, I understand how D365 data is structured and I understand how accounting rules work. Could you try shifting into a niche application data with niche business knowledge? Also work on stakeholder engagement skills. I'm known in my company for being able to talk to difficult stakeholders who don't know what they want. Good luck to AI with being able to make small talk with a Finance Director so you can get him on side and persuade him to change his undeliverable requirements.",Majestic_Plankton921,2025-11-18 13:53:19,15,cscareerquestions,t3_1p0b83p,False,
nphncj6,Your best bet is to move into more of the predictive modeling space. That will be a window to do more strategic work. But yeah if you don't do something there's a good chance you will be in the next round of layoffs.,Ok-Energy-9785,2025-11-18 13:35:25,7,cscareerquestions,t3_1p0b83p,False,
npkcn1k,"i feel this a lot. i'm still in data work and every week it feels like the tools take over more of what made me useful. i tried stacking courses nonstop, python, sql, powerbi, tableau, then various tools, and it just fried me. still not sure i chose the right path.",finchwacky,2025-11-18 21:41:45,6,cscareerquestions,t3_1p0b83p,False,
nphogh2,"Do grunt work for ML if you want to end up in ML. Analytic engineering followed by data engineering. Read a book on application of common ML algorithms, do that in your free time. There is a lot of grunt work needed to prepare data for training, and most places worth their salt are going to be hesitant to trust LLMs with that.",ub3rh4x0rz,2025-11-18 13:41:26,5,cscareerquestions,t3_1p0b83p,False,
npi54yf,">if anyone here’s managed to future-proof themselves in data, what did you focus on?Why would you not focus on AI if you want to future proof yourself in data? Learn AI. Go to r/learnmachinelearning and get started. The future will be open for those who learn how to use Ai effectively, not those who shun AI altogether.",Illustrious-Pound266,2025-11-18 15:09:58,3,cscareerquestions,t3_1p0b83p,False,
npj8nke,I am confused too about ‘learn AI’ like ChatGPT? Or learn how to build AI stuff - also learn DL / ML / etc type stuff? Or should I just focus on learning software apps that have it integrated in them already?,AdDiligent1688,2025-11-18 18:23:22,1,cscareerquestions,t3_1p0b83p,False,
npfmrlt,I’m in a similar situation and am very demoralized. I particularly empathize with the how can I help you get it done after just starting the task. My answer is to start looking for another job knowing it’s probably the same stuff but different pile.,filter-spam,2025-11-18 03:26:15,31,cscareerquestions,t3_1p00x6d,False,
npfnv01,"Oof. I feel this, I’m in the same boat. Stuck at a job that feels pointless and it’s killed my enjoyment for coding. I just don’t care anymore, do I even enjoy programming anymore? It sucks. Hope you find your way out of this hole. I recently found some motivation and spending a lot of my free time getting deep into devops stuff and have been enjoying it.",staticparsley,2025-11-18 03:33:11,15,cscareerquestions,t3_1p00x6d,False,
npfrp3l,"some of what you're describing is unfortunately part of the job (working on boring things, digging through code). your manager sounds toxic though, you should try and switch teams or leave the company",Magikarpical,2025-11-18 03:58:20,12,cscareerquestions,t3_1p00x6d,False,
npfllwi,"sounds like a nightmare. i've been there, and the lack of meaningful work just drains you. maybe consider a different environment, or at least a side project to keep the motivation alive. shrug, just my two cents.",JollyTheory783,2025-11-18 03:18:59,8,cscareerquestions,t3_1p00x6d,False,
npg502i,"If the market wasn't so trash, the obvious answer would be to job hop",BarracudaPersonal449,2025-11-18 05:38:40,8,cscareerquestions,t3_1p00x6d,False,
npggh8k,"You make good money and have decent hours at Amazon. If that's something you can sustain, you're already in the top 95% of engineers by pay and WLB.20k lines of code should be doable for Q or Cursor (unsure if that's something y'all have yet). Let it take care of the grunt work. I won't trust LLMs to write code for me, but it can definitely summarize repos and identify sources of error. Your manager is human too, he's probably dealing with even more pressure, and like birds on a line, where you look up the org chart to see assholes, he looks down to see shitheads. You're in for a rude awakening if you think working at scale means building new stuff. It's always going to be fixing shit that works 99.9% of the time, but that 0.01% of downtime just costs so much more. Building new stuff is for startups and AI engineers. Sometimes making 200k and working 40 hour weeks comes at the cost of dealing with managers. Don't like it? Find a different company, or hit the oil rig.",Randromeda2172,2025-11-18 07:22:42,7,cscareerquestions,t3_1p00x6d,False,
npfl9oh,Sounds like you're going through a really tough time. This sounds like my worst nightmare. Makes my job seem like a dream! I hope you are able to switch to a better role.,BraveSeaworthiness21,2025-11-18 03:16:55,11,cscareerquestions,t3_1p00x6d,False,
npfpdmj,"Thanks brother, I feel a little better knowing there are others like me out there.Hang in there.",Ordano,2025-11-18 03:43:00,3,cscareerquestions,t3_1p00x6d,False,
npfs9l0,"Easy solution, find a different developer position for a better environment even if it means a big paycut.",Shmackback,2025-11-18 04:02:11,3,cscareerquestions,t3_1p00x6d,False,
npfl83j,"For the extra/urgent work. Create a mechanism to accept random work in a queue, and create a task with points allocated if you are on a sprint. Ask the boss to fill in task details then have him/her to ask for volunteers.",caiteha,2025-11-18 03:16:38,3,cscareerquestions,t3_1p00x6d,False,
noel1jl,"Dump it all on someone else, and take on high visibility, high impact new projects.Downvote me all you want, but it’s helped me immensely compensation and advancement wise to NOT get bogged down in thankless work.",WhatNazisAreLike,2025-11-12 04:29:13,151,cscareerquestions,t3_1ouuylk,False,
noei6bk,"Had a professor that would always say the difference between a software engineer and a plumber is a plumber is only sometimes elbow deep in shit. So to answer your question, yes, tech debt is a universal constant and you will learn to live with and work around it as you gain experience. And if you’re lucky you’ll work for a company that will actually allow you to address it.",Dickys_Dev_Shop,2025-11-12 04:08:32,35,cscareerquestions,t3_1ouuylk,False,
noeiehy,"dev team wants to work on tech debt, leadership wants to ship new features… so we negotiate, and decide to ship new features.repeat 3-5x per year until the team burns out and people quit.",octocode,2025-11-12 04:10:09,32,cscareerquestions,t3_1ouuylk,False,
noensej,"I once worked on a file that contained:* HTML* CSS* Javascript* PHP* SQLIt was a couple of incorrectly escaped characters away from putting SQL into the style sheet, or executing CSS against the database.",skibbin,2025-11-12 04:49:59,25,cscareerquestions,t3_1ouuylk,False,
