id,body,author,created_utc,score,subreddit,parent_id,is_submitter,distinguished
mmdn45s,"You can find a list of community-submitted learning resources here: https://dataengineering.wiki/Learning+Resources*I am a bot, and this action was performed automatically. Please [contact the moderators of this subreddit](/message/compose/?to=/r/dataengineering) if you have any questions or concerns.*",AutoModerator,2025-04-10 12:40:02,1,dataengineering,t3_1jvwwcy,False,moderator
mmdnusw,Chatgpt powered pipelines seem more like a nightmare than a dream. You can probably deal with this contacting Microsoft directly.,Demistr,2025-04-10 12:44:37,409,dataengineering,t3_1jvwwcy,False,
mmdo3en,ChatGPT powered pipelines? Yikes...,smartdarts123,2025-04-10 12:46:05,138,dataengineering,t3_1jvwwcy,False,
mmdpt59,That sounds like an inexperienced and rushed implementation. Allowing AI to write your pipelines... Come on. No one believed that story has a happy ending.,El_Guapo_Supreme,2025-04-10 12:56:31,117,dataengineering,t3_1jvwwcy,False,
mmdrb1w,Annual quota? Enterprise Tier? Would love more details because neither of those apply to Fabric.,x_ace_of_spades_x,2025-04-10 13:05:34,59,dataengineering,t3_1jvwwcy,False,
mmdrr9i,Isn't you can only burn the next 24 hours quota at max?We restart the capacity that would reset the excessive usage and add that to the azure bill.,Chou789,2025-04-10 13:08:16,26,dataengineering,t3_1jvwwcy,False,
mmdpvqp,You see that’s your problem. You need to be using Copilot not ChatGPT.,grapegeek,2025-04-10 12:56:57,62,dataengineering,t3_1jvwwcy,False,
mmdr5l4,A lot of people using spark when they shouldn't be (either because it's overkill or they don't know how to use it),DynamicCast,2025-04-10 13:04:39,13,dataengineering,t3_1jvwwcy,False,
mmdw5do,"8K a month sounds like you are running an F64 without a reservation, there is no annual quota, you burned through your 24 hour limit, you can pause and resume your capacity to clear out the burndown table and take the hit as overages. You will also want to look into surge protection to ensure that this cannot happen again. If I was management I would hit the breaks hard on this project until people can get some education and know what they are doing.",SPG2469,2025-04-10 13:33:50,35,dataengineering,t3_1jvwwcy,False,
mmfjb8z,Hey u/embarrassed_war3366 seems like some folks are calling BS on the post. To clarify the situation can you share a screenshot of the front page of the Fabric Capacity Metrics App to show the high-level CU utilization metrics?,Ok-Shop-617,2025-04-10 18:26:48,10,dataengineering,t3_1jvwwcy,False,
mn0wb6f,How dare you take a picture of me without my consent,git0ffmylawnm8,2025-04-14 07:08:53,41,dataengineering,t3_1jyrrh6,False,
mn0rrhh,lol This is all that survived :face_with_tears_of_joy:,LostAssociation5495,2025-04-14 06:22:30,17,dataengineering,t3_1jyrrh6,False,
mn75rz9,"Have witnessed so many organizations hardly caring about data quality. Anyone trying to highlight this in forums is just restricted to a slide presenter.Realized in so many years that Data Quality and Site Reliability improvisations are silent growth killers, if you do so well, there are no incidents and people make a perception that your job is damn easy. YMMV",Mental-Matter-4370,2025-04-15 07:41:51,6,dataengineering,t3_1jyrrh6,False,
mn13fj9,Another poor soul lost to the process...,NAHTHEHNRFS850,2025-04-14 08:25:21,5,dataengineering,t3_1jyrrh6,False,
mn2se80,"Jokes aside, is considered a near impossible task in the industry?",Cultural-Ideal-7924,2025-04-14 15:39:02,3,dataengineering,t3_1jyrrh6,False,
mn50vyz,This was me today. We started using canonical data in delta instead of regular tables. The idea is that they can now just dump a bunch of raw json data in a delta table and improve front end development. Problem being is they think it’s a pipeline to dump data into and my job is to intercept and land…,th3DataArch1t3ct,2025-04-14 22:28:35,3,dataengineering,t3_1jyrrh6,False,
mn0p4rz,Lol :face_with_tears_of_joy::face_with_tears_of_joy::face_with_tears_of_joy:,Berserk_l_,2025-04-14 05:56:34,1,dataengineering,t3_1jyrrh6,False,
mn7grvl,LMAO :rolling_on_the_floor_laughing:,Intelligent-Mind8510,2025-04-15 09:42:26,1,dataengineering,t3_1jyrrh6,False,
mnbvi4w,I'm in literal tears now :pleading_face:,noSugar-lessSalt,2025-04-16 00:35:40,1,dataengineering,t3_1jyrrh6,False,
mnbxyx7,This was a good one!,Less_Juggernaut2950,2025-04-16 00:50:08,1,dataengineering,t3_1jyrrh6,False,
mmmudxs,2/30 is great! My last couple jobs I needed 50 apps for an offer 8 yoe. What are you seeing for tech rounds? More or less leetcode?,boboshoes,2025-04-11 21:36:23,119,dataengineering,t3_1jx0xpa,False,
mmn55bq,"The people doing 100+ apps don't have the experience, which carries especially hard in the industry i feel. Like there are recent grads with skills that'll do laps around mine but I've been working for over a decade and I'll have the leg up, fair or unfair. 2 offers from 30 apps is an excellent rate in any situation though, congratulations",talkingspacecoyote,2025-04-11 22:38:09,62,dataengineering,t3_1jx0xpa,False,
mmnfpo9,"yeah, been applying, i've had 6 final rounds, no offers, probably like 300-500 apps (albeit many were linkedin easy apps), got 2 more final rounds coming up and I consider myself lucky. 5 YOE as a DA at a BB bank4 YOE as a DE, fintech + hedge fundI'm in a HCOL city with a lot of competition. I've had something like at least 40 interviews.",uhndeyha,2025-04-11 23:41:18,23,dataengineering,t3_1jx0xpa,False,
mmokqdg,Only 30 applications?Wow,poonman1234,2025-04-12 04:14:18,9,dataengineering,t3_1jx0xpa,False,
mmng2ah,What questions did you practise on Leetocode for Python? Like DSA?,GulabiGovind,2025-04-11 23:43:24,4,dataengineering,t3_1jx0xpa,False,
mmoymw7,That's a cool use of the Sankey chart. :),RegularLoquat429,2025-04-12 06:18:05,4,dataengineering,t3_1jx0xpa,False,
mmq5rm0,30 apps is all you did? I applied to freaking 500 jobs before finding something below my education level. Had to remove my masters to even get my foot in the door,PowerfulMinimum38,2025-04-12 13:00:40,3,dataengineering,t3_1jx0xpa,False,
mmqsnfj,"100+ app, only 1 interview, seems like im not the only one, i was getting sad already lol6+ yoe",ironwaffle452,2025-04-12 15:12:27,3,dataengineering,t3_1jx0xpa,False,
mmriwcq,How much salary increase ?,Bonamoussadi,2025-04-12 17:28:13,2,dataengineering,t3_1jx0xpa,False,
mmryvb1,Congratulations! What does your resume look like (can you share anonymized resume for others). Which area are you looking at northeast/south etc?,hamzalizafar,2025-04-12 18:52:33,2,dataengineering,t3_1jx0xpa,False,
mnfam6e,Good article. I consult sometimes and CIOs love it when I cut through all the BS software/hardware marketing/sales stuff.,deanremix,2025-04-16 15:33:21,43,dataengineering,t3_1k0mqzh,False,
mnfb7tk,"Really nice article, kudos",sjdevelop,2025-04-16 15:36:17,17,dataengineering,t3_1k0mqzh,False,
mnfjn0y,Pure gold. Thank you,Chandlarr,2025-04-16 16:17:56,8,dataengineering,t3_1k0mqzh,False,
mnfrc28,"No lie I wanna laugh till next Tuesday but for real - when MSFT showed PowerBI pulling data from iceberg/parquet my interest was piqued. Right? But honestly, really good work. Every idea in DE is for sure recycled.",InAnAltUniverse,2025-04-16 16:55:43,8,dataengineering,t3_1k0mqzh,False,
mnflkxs,Liked it! That's my vision too.,FireNunchuks,2025-04-16 16:27:37,5,dataengineering,t3_1k0mqzh,False,
mng2d85,Finally an article that isn’t selling me a bunch of BS and makes sense.,TheCamerlengo,2025-04-16 17:47:47,3,dataengineering,t3_1k0mqzh,False,
mng50ho,"What a banger article, clear, simple, concise, no BS, thanks for sharing!",frankbinette,2025-04-16 18:00:12,3,dataengineering,t3_1k0mqzh,False,
mng5oj2,"Just came back from the AWS Summit in Amsterdam today and my God I was absolutely hit with a lot today! Don’t get me wrong,some of it is good but I definitely felt like I’d have to learn so much more yet again.",lionbabe100,2025-04-16 18:03:27,3,dataengineering,t3_1k0mqzh,False,
mnfrgew,Awesome article!,sois,2025-04-16 16:56:18,2,dataengineering,t3_1k0mqzh,False,
mnfumtl,Ok but with cloud you pay per the shit instead of having to pay up front. You can also scale your shit.,codykonior,2025-04-16 17:11:27,2,dataengineering,t3_1k0mqzh,False,
mn2ng1w,"It is weird to hear people talking about the history of this.  The reason Netflix built iceberg (and experimented with manifest files for our tables) was I never really believed in the ""data lake"" idea (meaning storing unstructured unorganized data).  There were three key thoughts.  One, we had to separate storage and compute.  So we were building on S3 from the beginning.  Two, that we were building a dataware house, so schema and catalogs were important.  And then three, that leads to a need to account for S3 eventual consistency and performance.  Which led to some very smart people building a new table format.But all in all really glad so many tools are adopting it and hope for a lot of progress on optimizing storage over the next 3-4 years.",RingTotal8568,2025-04-14 15:13:57,66,dataengineering,t3_1jz0yr9,False,
mnf0yb7,Great video as always from Tim. I met him a few months ago when I was at Confluent HQ to record a video.,trajik210,2025-04-16 14:45:41,2,dataengineering,t3_1jz0yr9,False,
mn3xsdd,quick and nice summary of iceberg,sjdevelop,2025-04-14 19:03:38,3,dataengineering,t3_1jz0yr9,False,
mn54pqt,What do you mean “I” never believed? Who are you,organichammocks,2025-04-14 22:51:04,25,dataengineering,t1_mn2ng1w,False,
mn35pqw,I'd add that iceberg is optimized for read heavy workloads. Delta also has a similar workload. Hudi was written as a transactional read/write database storage format.,Sea-Calligrapher2542,2025-04-14 16:45:46,19,dataengineering,t1_mn2ng1w,False,
mn3bv01,Mr Smith I guess?,RandomGeordie,2025-04-14 17:15:58,5,dataengineering,t1_mn2ng1w,False,
mn6l5o4,This video is just a confluent ad thats why it sounds so unnecessarily saccharine and hand-wavey,grumpy_youngMan,2025-04-15 04:22:46,2,dataengineering,t1_mn2ng1w,False,
mnclhuy,That’s Rick Iceberg,toobeary,2025-04-16 03:15:15,3,dataengineering,t1_mn54pqt,False,
mnd90uf,Obviously typo for “it” ( Netflix ),crevicepounder3000,2025-04-16 06:26:44,1,dataengineering,t1_mn54pqt,False,
mmisno7,"I bomb leetcode just because I straight up can't solve the questions, lol. There always seems to be some specific trick I can't see.If you manage to get the logic to solve the problem correctly, I'm surpised not getting syntax correct has been such an issue though the field is more competitive these days.For leetcode stuff in python, you usually only need to remember arrays, dicts, if and for loops (maybe while).I have an awful memory and stuggle like hell to remember the same data transformation syntax in SQL, polars, pandas, pyspark.",speedisntfree,2025-04-11 06:25:15,92,dataengineering,t3_1jwi3wf,False,
mmj28mu,"I have a question regarding that:As a data engineer you have to know stuff like orchestrators, ETL, ELT, SQL, Lakehouse, data files structures etc.But you get the same treatment as SWE for interviews even if you don't do SWE work.Why is that?Why do I need to know data structure and algorithm if most of my time is being spend in SQL?",Beneficial_Nose1331,2025-04-11 08:04:58,44,dataengineering,t3_1jwi3wf,False,
mmjsti9,"I feel you on this struggle! Even as a senior who can architect complex data systems, i'd freeze up on those damn coding challenges. The disconnect between real-world engineering and these artificial puzzle questions is frustrating. What helped me was changing my practice approach - instead of trying to solve a ton of problems, I focused on deeply understanding a smaller set of core patterns and writing them from scratch repeatedly until the syntax became muscle memory. I also started narrating my thought process out loud during practice to get comfortable talking through my approach. Have you tried platforms like interview query? They have some DE-specific practice problems that are more relevant than generic LeetCode, plus they offer peer mock interviews where you can practice the communication part. Sometimes just getting comfortable with the interview format is half the battle. Don't beat yourself up - these interviews are rarely representative of the actual job!",tech4throwaway1,2025-04-11 12:08:12,13,dataengineering,t3_1jwi3wf,False,
mmjxcuu,"The only “solution” I’ve come up with over the past several years is just avoiding companies that rely on leetcode. Unfortunately, it’s harder to do under current market conditions.As someone who’s been on both sides of the interview process, I’ve found it far more effective to have conversations about rudimentary database concepts, high level data pipeline design, and *maybe* a coding session where pseudo code is acceptable.For those of us who have written production level code in several languages, memorizing syntax of one language while someone is breathing down your neck is not all that useful imho.",Acceptable-Wasabi429,2025-04-11 12:38:16,9,dataengineering,t3_1jwi3wf,False,
mmiwa7u,> How can I effectively overcome this challenge?By doing what everyone does: grinding Leetcode.,jajatatodobien,2025-04-11 07:02:10,16,dataengineering,t3_1jwi3wf,False,
mmknaof,"I was in your shoes recently. I have around 5 YOE, and they suck but its something I had to come to terms with being able to solve easy leetcode problems and some mediums in python. I definitely had to spend several weeks grinding it out. But don't just grind random leetcode problems. For SQL you should be able to solve most of them no matter what. Basically get really good at linked lists, dictionaries/hash maps, two-pointer, array problems. I haven't seen any other data structures being asked (maybe some chance dynamic programming). A good interviewer will work with you if you get stuck when solving these problems, and on top of that they should understand that you're under pressure and might not be operating at your best. The more rejections you get, the more you learn. Keep your head up and know that all it takes is one yes.P.S. don't forget to focus on behavioral/cultural questions, it's quite easy to tunnel vision on the technical portion and you might get caught off guard.",deal_damage,2025-04-11 14:58:31,6,dataengineering,t3_1jwi3wf,False,
mmip3dn,"Well, I make notes specifically for python syntax and memorize/recall them occasionally, it helps a lot, I also don’t look at the solutions or hints while solving",Severe_Sir_3237,2025-04-11 05:51:06,4,dataengineering,t3_1jwi3wf,False,
mmja87y,"Leetcode doesn’t recognize the world has useful IDE’s to solve having to memorize. However you should know IF and WHILE, assuming Python. Pseudo code and what the pro/con | alternatives within that is sensible. Lazy interviewers won’t buy this, but it should if someone is paying attention",Whipitreelgud,2025-04-11 09:31:00,4,dataengineering,t3_1jwi3wf,False,
mmim4fh,Are there companies in 2025 who are still interviewing with leetcode?,Dangerous-Escape7156,2025-04-11 05:24:06,19,dataengineering,t3_1jwi3wf,False,
mmma2sk,"That’s way too low level in a discussions for a Director role … like yeah it’s good to have a grasp of the tech stack but like common, you aren’t going to be in the trenches configuring anything.",connoza,2025-04-11 19:50:55,80,dataengineering,t3_1jwyf7d,False,
mmm9frf,"From the sounds of it, you have a very good understanding and objective viewpoint on your approach to the architecture and they perhaps didn't have the same. I think it's unfortunately extremely common for people who were entrenched in a poorly architected and/or a poorly understood architecture to be unable to see how it could be done differently. I also think hiring teams, for various reasons, are sometimes not equipped to relate the core concepts of data engineering over their own, so instead they feel more comfortable talking to candidates who have experience in their specific toolset.The skill I'm trying to build right now in my own interviews is assessing, understanding, and directly addressing any concerns a prospective employer might have about my skillset and my suitability to the job. You have to learn to speak the language they speak.In the future I'd try to give more options during interviews to the interviewers on how they want to proceed. If they want to see a project you are familiar with, pull up your notes. If they want to focus on your experience with their tools, follow up with clarifying questions about your scope and then propose a solution -- or even just relate how your experience applies to solving that particular problem.Hope that helps some. It's definitely difficult not having all the context before going into the room.",syphex,2025-04-11 19:47:44,21,dataengineering,t3_1jwyf7d,False,
mmmcm1s,Montecarlo.. haven’t heard that one in awhile,carlsbadcrush,2025-04-11 20:03:23,16,dataengineering,t3_1jwyf7d,False,
mmmhdwy,Sounds like they are not sure what they want.,theimo92,2025-04-11 20:27:29,16,dataengineering,t3_1jwyf7d,False,
mmm9jdi,Probably looking to purchase new things and what someone with crazy experience. Or incompetent hiring team that chatgptd important data engineering concept and answers and literally asked you them all. Also the market is still shit so they may believe they can find a unicorn.....,Aggravating_Sand352,2025-04-11 19:48:13,7,dataengineering,t3_1jwyf7d,False,
mmmvbwf,"Sounds like they want a one-man band—a bit unrealistic. For a director role, you’d be expected to have oversight, not necessarily hands-on expertise in every tech or architecture. Could just be a scattershot hiring approach or a sign that the team lacks direction. Don’t sweat it—move on to a company with clearer priorities. Sometimes, being rejected is a blessing! Good luck on the rest of your search!",kevinkaburu,2025-04-11 21:41:35,5,dataengineering,t3_1jwyf7d,False,
mmoc4a5,"How do other data directors prepare for interviews in this community ? I have usually prepared for the following 1. Technical architectures 2. Core data engineering concepts 3. Stakeholder management 4. Project Management 5. Revenue Management6. A bit of presales questions7. SQL challenges 8. Data Strategy , Data Governance , MDM, etc 9. People ManagementWhat else do you guys prepare in this job market ? What sources do you use to prepare ? I usually search for topics on YouTube and/or google them . It’s usually unstructured for me . Are there proper structured resources out there for director levels?",Hungry_Resolution421,2025-04-12 03:10:09,3,dataengineering,t3_1jwyf7d,True,
mmmglv2,"Sounds fair to me.You should be able to speak at a high level about most of those things. It would help me know what kind of engineers and architects you would plan on hiring, what type of infrastructure you'd invest in, and whether or not you can keep up with the needs of the company.The architectures tell me they want you to know about batch, streaming, and the pros and cons of each.Medallion and Fabric hint that they may be a microsoft shop. They want you to talk about Medallion from a databricks perspective and the maturity or lack of maturity of Fabric, as that's the new branding of Synapse and the internal competitor of databricks.Airflow is an orchestration tool. You'll really want to know how to budget for this because it can be a managed service.Everyone is talking about AI. It's annoying, but you'll need to learn enough to stay competitive with executives for a while.All of these topics tell me a lot about how you'll spend their money.",Lower_Sun_7354,2025-04-11 20:23:32,4,dataengineering,t3_1jwyf7d,False,
mmmnoav,how many years of experience do you have?,Electrical_Regret685,2025-04-11 20:59:53,2,dataengineering,t3_1jwyf7d,False,
mmve5ib,"The company's approach raises some red flags. Either they're unrealistically expecting a unicorn candidate who's mastered every data concept imaginable, or they're using a scattergun interview technique without a clear understanding of what they actually need. Their quick rejection suggests they might not have a well-defined idea of the role's requirements. In any case, it's probably for the best that you didn't move forward with them. A company with more realistic expectations and a clearer vision for the role would likely be a better fit.By the way, I'm on the team that created [online interview AI helper](http://interviews.chat) to prepare for tricky interview situations like this one. It can provide practice with a wide range of data engineering concepts and technologies, which might come in handy for future interviews that cover such a broad spectrum of topics.",akornato,2025-04-13 09:44:03,1,dataengineering,t3_1jwyf7d,False,
mmuom2u,"If they did not provide any scaffolding, then this is overkill. It is a mini workshop.To do it properly will likely take 15-20 hours of effort, mainly on the non-coding parts, though you could probably get something running within a day or less if you are an experienced DE.The pay better be worth it.",ogaat,2025-04-13 05:23:17,163,dataengineering,t3_1jy09o8,False,
mmvns2y,"OP, you MUST reject this. It not only shows they'd be a terrible place to work, but it also shows they don't understand what they're asking you to do, which is worse. Reject this mess. Ghost them. Whatever you need to do. Don't let companies get away with this shit. No job is worth it.",financialthrowaw2020,2025-04-13 11:21:24,62,dataengineering,t3_1jy09o8,False,
mmuosk8,"I don't think that's reasonable, it's building and deploying a full pipeline. if you don't already have the cloud environments configured, that alone will take ages. They should only be asking for a local project example in VS code imo.",HG_Redditington,2025-04-13 05:24:52,105,dataengineering,t3_1jy09o8,False,
mmv81dm,They are getting you to do work for free. I have had multiple data engineering jobs and the longest test was an hour anything longer with projects and big design docs I don't bother with. It's fucking disrespectful to your time.,Bootlegcrunch,2025-04-13 08:36:54,46,dataengineering,t3_1jy09o8,False,
mmvegvz,Fair and square too much work for an interview homework. This says a lot about them valuing your time and likely comes from someone did not consider the infra part properly as they likely get all if the cloud stuff by their “infra team” and consider that zero effort :)Keep in mind: job interviews are a two way street. It’s as much you learning something about them as them learning something about you. Tell them what parts of this you find reasonable to do and describe the rest in a high level DoD. If that’s a red flag for them then you likely dodged a bullet here ;),OberstK,2025-04-13 09:47:31,20,dataengineering,t3_1jy09o8,False,
mmux5lc,"Have I assumed correctly that they are expecting you to deploy this on your own cloud account and expose an API?Design and building a fully working and documented solution with API gateway, API docs, CI/CD pipeline etc. is a crazy ask. If you used the easiest to stand up cloud services I bet they'd bitch about your db choice not being able to scale or something.",speedisntfree,2025-04-13 06:44:16,19,dataengineering,t3_1jy09o8,False,
mmv70ci,It seems that they expect a 10x data engineer. The salary should be 10x of the standard one as well.,baby-wall-e,2025-04-13 08:25:42,15,dataengineering,t3_1jy09o8,False,
mmv5hoy,Not reasonable. Up to point 3 is probably the most. The rest should just be an interview question that by right you should be able to articulate clearly if you are experienced,CrowdGoesWildWoooo,2025-04-13 08:09:31,9,dataengineering,t3_1jy09o8,False,
mmuqai4,"I guess it depends. In my country I would laugh them out of the room and offer to walk them through my work process, without actually doing all this. This is easily a days work, I ain’t working for free. But I have learned from this (and others) sub that take homes are a thing in some places. Out of curiosity, what country are you from/is this company from?",djerro6635381,2025-04-13 05:38:19,28,dataengineering,t3_1jy09o8,False,
mmvm246,"No take-home is reasonable, especially those that expect you to spend your own money on cloud resources.",mailed,2025-04-13 11:05:33,24,dataengineering,t3_1jy09o8,False,
mn8z5n6,"Hi OP, thanks for sharing your job search journey. How was the LC tech screening for Meta? I have one coming soon",Easy_Difference8683,2025-04-15 15:35:09,18,dataengineering,t3_1jztqf6,False,
mnb2fdk,"I got a new role in an unorthodox way. I replied to every single LinkedIn DM that I got. Most of them were crap but a surprising amount of them were good offers but the recruiter just used the out of the box AI spam message so it looked sketchy af. I ended up getting a senior role, fully remote with a 20% bump from a message that looked like it came straight from GPT. The hardest part right now is getting a human to look at your resume, replying to a DM is a surefire way to get in touch with a human.The ones that are obviously crap? Just respond and say no thanks but anything that sounds remotely good, strike up a conversation and get more information and ask if they have any other leads.I got absolutely zero response applying to anything manually, remote, hybrid or on-site",PerformerGeneral2520,2025-04-15 21:50:34,12,dataengineering,t3_1jztqf6,False,
mn9f74t,"It’s crazy that even as a senior DE, you had to do LeetCode style tech screens. How did you feel about the difficulty of those?And kudos for getting Disney that far! It must be reassuring to know you have options even if you didn’t take it.",hola-mundo,2025-04-15 16:54:50,6,dataengineering,t3_1jztqf6,False,
mn933b9,Love this. Do you mind sharing how you prepped for those 2 months? Did you have a study plan?,MissNamii,2025-04-15 15:54:30,3,dataengineering,t3_1jztqf6,False,
