id,body,author,created_utc,score,subreddit,parent_id,is_submitter,distinguished
np5ke41,"The best way to improve problem-solving is to practice breaking problems into smaller steps. Start by writing out the logic in plain English before touching code. Also, revisit your old solutions and try to make them cleaner or faster — that’s where you learn the most. LeetCode/Codewars help, but consistent “thinking out loud” matters more.",Digitalunicon,2025-11-16 15:08:57,3,learnprogramming,t3_1oynnlv,False,
np5mqko,"One of the first steps to intuitively being an effective problem solver is to learn to fully understand logic flow (such as De Morgan’s laws etc). Boolean algebra is a branch of mathematics rather than programming per se, but gaining an understanding of it massively helps your ability to “think like code” across the board.Logic is something people take for granted they understand. In fact, it’s often used informally as an insult if someone *doesn’t* have it, but just like “communication” it’s one of those things everyone thinks is easy that they can “just do”, but actually can’t, because everyone gets it wrong.For example, ask someone in the street that “and” and “or” logic is identical if each argument is negated, and they probably won’t understand the concept:NOT (A AND B) = (NOT A) OR (NOT B)NOT (A OR B) = (NOT A) AND (NOT B)Despite the fact this itself is nothing to do with math or programming - it’s just “a rule of the universe”.If the above statements still confuse you, you will likely find quickly solving all manner of code problems quite challenging.",_TheNoobPolice_,2025-11-16 15:22:02,2,learnprogramming,t3_1oynnlv,False,
np5sndg,"Part of it is just practice, practice, practice.Another part of it is that in programming, ""problem solving"" often means figuring out how to *use* existing tools, or components, or algorithms. You can't use them if you don't know about them. So the more widely you read and learn about those existing building blocks, the more proficient you'll be at recognizing situations where you can use them.(You can't just rely on always being able to search or ask AI for the right tools, because you might not even know what to search for. Having the information in your brain allows you to see the connections and use cases on your own.)So read source code, programming blogs, project writeups, other people's questions, textbooks, GitHub issues, etc. Whatever sparks your interest.",teraflop,2025-11-16 15:53:48,2,learnprogramming,t3_1oynnlv,False,
np5vmrz,"1. Learn more math, especially discrete math.2. Practice solving problems.Between those two, you will develop a mind for it.",vu47,2025-11-16 16:09:24,2,learnprogramming,t3_1oynnlv,False,
np6kni9,"“Exercises for Programmers 57 Challenges to Develop Your Coding Skills by Brian P. Hogan”try this book, it has problems in them which can get pretty challenging at the end, plus is language agnostic.",Only-Percentage4627,2025-11-16 18:18:51,2,learnprogramming,t3_1oynnlv,False,
np5i4jx,Leetcode,JustSomeCarioca,2025-11-16 14:55:50,1,learnprogramming,t3_1oynnlv,False,
np5i5v2,Experience with code de will solve that. Reading and writing.,Henkatoni,2025-11-16 14:56:03,1,learnprogramming,t3_1oynnlv,False,
np5kpbz,solve more problems?honestly it's all about the experience you have when you face a problem lol,DarkDiablo1601,2025-11-16 15:10:44,1,learnprogramming,t3_1oynnlv,False,
np5lay5,"The only way to improve is to solve more problems, more practice. Tutorial after tutorial doesn't help.You need to start before the actual code. When you get a task, sit down with pencil and paper. Ponder about the task. Break it down into smaller and smaller parts. Make sure you fully understand the task because you cannot solve what you don't understand.Once you have full understanding and broken down the task, start solving each part individually, as *you, the person* would. Don't even think about programming it yet.Check your solution. Verify it.Then, once you know it is working, start working on the *implementation*. This should make the implementation much easier.As always with such posts (which are more than regular), some literature:+ ""Think Like A Programmer"" by V. Anton Spraul+ ""The Pragmatic Programmer"" by Andrew Hunt and David Thomas+ ""Structure and Interpretation of Computer Programs"" (SICP) by Ableton, Sussman, Sussman+ ""Code: The Hidden Language of Computer Hardware and Software"" by Charles Petzold",aqua_regis,2025-11-16 15:14:07,1,learnprogramming,t3_1oynnlv,False,
np5r04z,"Most will give you the obvious advice of ""do more problems"". They don't tell you how to solve, only that you need to solve it.One key is to know the solutions to a bunch of problems and look for how those solutions share things in common. It's easy to look at a problem and not consider any other similar problem you've seen before. But often, you solve a problem based on recalling solutions. I don't mean pure memorization. You want to generalize the technique. For example, sorting the values is one idea you can try.Clearly, some problems you can't solve. Also, the choice of problem solving does depend a bit on language. If you have a function without explicit loops (such as many functional programming languages), then you express your solution differently. If the language has certain features like `str ** n` doing `n` concatenations of the string, `str`, then that leads to a simpler solution than if the language did not have such a feature.I liked reading ""How to Solve It"", an old book by mathematician, George Polya.",CodeTinkerer,2025-11-16 15:45:04,1,learnprogramming,t3_1oynnlv,False,
np48xyg,"> I honestly don’t know how anyone gets an app onto the Microsoft store.To be frank, I honestly don't know anyone who uses the Microsoft store anyway. The only app I've ever installed from the store was `python3` because I typed `python3` in my command prompt and it opened the Microsoft Store instead.",dtsudo,2025-11-16 08:40:25,1,learnprogramming,t3_1oybuhw,False,
np3w5gt,"honestly, your frustration makes total sense. the MSIX tooling feels like it was built for large enterprise teams with entire build pipelines, not for one developer trying to ship something simple. the error messages are vague, the process is fragile, and having to reinstall your own app over and over is ridiculous.a few things that can make your life a little less painful:1. use a clean VM don’t package on your dev machine. Windows likes to track every tiny thing during install, and random background stuff can ruin the package. a throwaway VM cuts down on the chaos.2. package through a build pipeline instead of the “wizard” tool the interactive MSIX Packaging Tool is notorious for unpredictable results. using the command line or Visual Studio packaging is less painful once you get it set up.3. run the analyzer early the MSIX Packaging Tool has a validation pass before signing and uploading. running that more often can help catch the filename issues before you get deep into the workflow.4. use the Windows App Cert Kit often it gives clearer errors than the packaging tool itself. not perfect, but better than “something somewhere is wrong, good luck.”5. don’t be afraid to lean on the store submission support they actually respond and can look at what the logs are trying (and failing) to tell you.none of that makes the tool magically good, but it gives you a bit more control over the chaos.",OutsidePatient4760,2025-11-16 06:35:39,1,learnprogramming,t3_1oybuhw,False,
np5ftp8,Thanks. Appreciate it.,donotfire,2025-11-16 14:42:18,1,learnprogramming,t1_np3w5gt,True,
np7vzon,I tried a clean VM. Even bought windows 11 Pro for ultra-V. Did not work. I don’t know what I expected. I’m just gonna give up. This is costing me sanity and I want to yeet my computer into a river.,donotfire,2025-11-16 22:18:59,1,learnprogramming,t1_np3w5gt,True,
not4cel,"yeah that’s a cool first project idea. making your own calendar is way more fun than it sounds and it teaches you a ton of real stuff without being overwhelming.the easiest way to start is to build the simplest version on your computer first. something like a little web page where you can add events, save them, and show what’s happening today. once that works, you can add notifications and then figure out how to get it on your phone.for the phone part, you can either make it a small website that you bookmark on your home screen or turn it into a simple mobile app later. but don’t think about that yet. just get the basic calendar working on your laptop first.",OutsidePatient4760,2025-11-14 13:53:15,3,learnprogramming,t3_1owwrpg,False,
nozx5qt,"One thing at a time. Worry about mobile later. You can sorta code with ""responsive HTML"" that adjusts itself to the width of the screen, but that's more UI tweak than fundamental design. Use a framework/toolkit/library to help you with that. You *should* know which ones if you supposedly have HTML/CSS/JS experience. So, how would you design a calendar app? It's just a database with UI. So you need some sort of database backend. Pick one that fits your needs. (Complicated: Firebase. Simple as heck: SQLite)Then you need some sort of middleware linking database to the UI. That's what you program the ""webapp"" in. And you need to learn THAT. The combination of database and middleware and UI is sometimes called a ""web stack"". For example, the MERN stack is MongoDB as database, Express.js and Node.js as Middleware, and React for UI. No, not suggesting that. It's too complicated for your needs. Figure out the right stack for your project is YOUR responsibility. How would an app send you message? Well... WHAT TYPE of message? Text Message cost money, notifications don't, but routing it to yourself requires going through some sort of OS API. Again, your own research. Yes, I've kept things vague for a reason. I want YOU to finish the research. I merely gave you some ideas to get started.EDIT: If you still don't quite get it, I want you to NAIL DOWN the requirements first. Right now, your requirement is kinda vague. Write the requirements down, into a requirement document. You need it written down and set in stone (well, mostly) before you start. Else, you'll suffer ""feature creep"". THEN you think about HOW TO MEET the requirements with your design, BEFORE you start coding. Once you have the design and architecture of your app down, THEN you start picking it apart, and code it piece by piece. (and test piece and piece if you can). As the cliche goes, (you eat an elephant) ""one bite at a time"".",kschang,2025-11-15 16:18:18,1,learnprogramming,t3_1owwrpg,False,
nouzi12,Alright I think I’ll do that sounds like a good order :) thanks,lina102,2025-11-14 19:34:27,1,learnprogramming,t1_not4cel,True,
nov9f2c,"This is good advice! I want to add a note about saving events. If you use a JavaScript object to save events, they will not be there the next time you reload the web page. I use localStorage to save the JavaScript object for this so I can test/iterate with more persistent data. Look it up on MDN.",Ok_Substance1895,2025-11-14 20:26:30,1,learnprogramming,t1_not4cel,False,
nph36z9,Doesn't need to be a substate. Also doesn't need to be an extra state IMO. Job queue simply retries to update the database state until it succeeds. I don't see why you'd re-notify an external service if that was already successful.,HashDefTrueFalse,2025-11-18 11:15:01,2,learnprogramming,t3_1p096f5,False,
nphrjgt,what happens if the notification succeeds but the DB update fails due to a temporary error?,phactfinder,2025-11-18 13:57:53,1,learnprogramming,t3_1p096f5,False,
nph4izw,Lol this is why devs make everything 10x more complicated than it needs to be. Just use a boolean flag for notification\_sent and call it a day instead of overengineering your state machine,Alpha-infinite,2025-11-18 11:27:04,1,learnprogramming,t3_1p096f5,False,
nphb5vg,This is such a smart approach! :hundred_points: I love how simple and elegant this solution is. Why overcomplicate things when the retry logic handles it perfectly?,Calm_Cartoonist6977,2025-11-18 12:18:23,1,learnprogramming,t1_nph36z9,False,
nph5eet,A boolean flag is effectively a substate,ConfidentCollege5653,2025-11-18 11:34:45,1,learnprogramming,t1_nph4izw,False,
npby42y,Use a framework such as Cordova which allows regular web pages to be compiled into both Android and iOS. Way better than learning both Java and ObjectiveC.,StefonAlfaro3PLDev,2025-11-17 15:41:48,3,learnprogramming,t3_1ozjh7z,False,
npc0oru,"Why do you need a mobile app that you install on the phone from your phone's app store? Why not go with a mobile website? If the user needs to create a shortcut to the mobile website on their phone's home screen so it looks like an installed app, you can put instructions on how to do that on your mobile website. That's what I did on the mobile website I built: https://sea-air-towers.herokuapp.com/mobile-app-shortcut :backhand_index_pointing_up_medium-light_skin_tone: That mobile website works on both desktop and mobile phone. No need to have an Android app in Kotlin, an iPhone app in Swift, and also a desktop website. One thing works across all platforms. Less work. Also, the user doesn't have to wait a while to install something from the app store the first time they use it. But yeah, I personally generally only need something to be a mobile app when it has like 3D graphics, like a videogame. If it's just pages and text a mobile website works fine. As another person said, if you really, really need a mobile app that you download and install from your phone's app store, you can use Apache Cordova after you built the mobile website and just plug your existing website code (HTML, CSS JavaScript) into Apache Cordova. Heck, you might even be able to get away with just a Progressive Web App (a PWA). See: https://en.wikipedia.org/wiki/Progressive_web_app",Anonymous_Coder_1234,2025-11-17 15:54:36,3,learnprogramming,t3_1ozjh7z,False,
npbyti8,"My best advice, is to learn by practice. You need minimum theory to get started with app development. Its depends on your goals each programing language to choose, there 2 directions startups and enterpises. If you choose to work with startups like i do, so I would recommend to go with web development. Frontendmentor is one app that helped me to actually write code, instead of watching vidios in yt.",ArseniyDev,2025-11-17 15:45:18,2,learnprogramming,t3_1ozjh7z,False,
npd0gvb,Don't make the mistake of jumping between resources or you will land in tutorial hell. Pick one resource and stick to it. There are several good ones but the only one I can really talk about is the Odin Project as I used it to learn full stack Web development and later I used what I learned in the React block of the course to learn React Native to create mobile Apps as well. The Odin Project is a great resource because it's free and open source. It is hard and will take a huge amount of time to finish and some projects you have to do there are no joke. However if you push through then you'll be able to develop pretty much almost anything you want. I started with zero and after 7 months I started developing a project that is now used in the company I work for and I also won a company prize for this App.,sandspiegel,2025-11-17 18:49:00,1,learnprogramming,t3_1ozjh7z,False,
npgrnox,"If you're new to IT and want to create an app quickly, RapidNative could be a great fit. It lets you turn simple sketches or designs into production-ready React Native apps without deep coding knowledge, so you can start building without getting overwhelmed.",StillKitchen3253,2025-11-18 09:18:36,1,learnprogramming,t3_1ozjh7z,False,
npi5vk3,[https://www.b4x.com/](https://www.b4x.com/) **B4A** For Android **B4i** For iOS **B4J** For Java,ImpressiveFuture3595,2025-11-18 15:13:47,1,learnprogramming,t3_1ozjh7z,False,
npbzpt4,"Also I have a MacBook, but I’ve heard negative things about programming with them. I’ve been thinking about getting a new laptop, does anyone have any recommendations that will work well with programming",dumbbrunette3,2025-11-17 15:49:47,1,learnprogramming,t3_1ozjh7z,True,
npc2p13,Most devs I know prefer to code on MacBook than Linux. Almost none code on windows.Use the MacBook (source: I’m a software engineer with 15+ yoe),jabuchae,2025-11-17 16:04:32,3,learnprogramming,t1_npbzpt4,False,
npc2bdf,"well best os is probably similar what you running on production. Most of the time its linux, because linuxes having not manufacturing its less usable for using in daily basis and coding. Mac use similar to linux architecture so it pretty handy, I do recommend it.",ArseniyDev,2025-11-17 16:02:38,3,learnprogramming,t1_npbzpt4,False,
npd13ea,"If you want to ever develop for IOS devices then keep your Macbook because the development tools you need for this are only available on a MacBook. Also I came from a Windows laptop and was pissed that Apple forced me to buy a Mac to develop for IOS devices. Long story short, the MacBook is just a better laptop. It's basically silent. However you do need RAM, the more the better actually. Especially if Emulators are involved then 16Gb is too little for example.",sandspiegel,2025-11-17 18:52:01,2,learnprogramming,t1_npbzpt4,False,
npbfdm1,"I'm a backend developer and sometimes I'll be asked to add a field to an existing form on the front end and handle it on the back end. I don't have to be an HTML/CSS expert to do this, but I do have to know my way around the front end code so I can make the change.",sid-klc,2025-11-17 14:00:11,12,learnprogramming,t3_1ozftik,False,
npb9m3m,The basics of html is useful for testing and understanding. The rest is optional.,DarkLupus,2025-11-17 13:25:42,4,learnprogramming,t3_1ozftik,False,
npbphmv,">Do I need to know as much as a frontend developer to become a backend developer?No, but you can't really be clueless either. The front end's entire existence is built upon what your back end provides it. You will need to make available what the front end needs, which often involves knowing a decent amount about front end development. E.g. You're working with a server-rendered app and the front end suddenly needs some back end data globally available. You *could* create an endpoint and have the front end devs request the data from the back end when the JS runs. But... you just sent the page to the client, and it's a single context, right? So you could just render some JS into the page to define some global data, avoiding the unnecessary round trip, and tell front end devs they have the data already. (I'm not saying this matters per se, just an example of some knowledge of front end helping you make a back end decision. There might be reasons you *want* an endpoint instead).",HashDefTrueFalse,2025-11-17 14:57:16,5,learnprogramming,t3_1ozftik,False,
npb8g7u,"To my knowledge, none. HTML and CSS are for front end development.",Espfire,2025-11-17 13:18:23,4,learnprogramming,t3_1ozftik,False,
npbpg7i,"I would argue that to become a good backend dev, you should at least be a decent frontend dev. So while it doesn't reflect immediately on backend development, I'd say learn the basics of HTML/CSS/JS. Enough to be able to call an API and show the results on a webpage. Doesn't have to be pretty.",plastikmissile,2025-11-17 14:57:04,3,learnprogramming,t3_1ozftik,False,
npbzr5m,"Front-end dev here. In my experience, the best backend devs have an understanding of how the UI works but aren’t really UI “experts” by any means. If you understand the tools that the UI has access to and the trade offs that different UI decisions have, that’s much more important than being able to center a div. I don’t care if a backend dev knows the intricacies of flex box or what browsers css-grid works in, they should know that giving the UI a huge garbled mess, and telling them to just sort and filter it all out in the UI, that’s not only a jerk thing to do, it’s MUCH slower to do almost any of that in a browser on a 5 year old phone than to just do it on the server (could also be a vulnerability based on what it is).As another person said however: if you do have to make a change in the UI, you should know what you’re doing, within reason. If you don’t know what you’re doing, you may screw things up and make the other devs mad at you and please don’t do that. You’re supposed to be a team. If you need help, always ask. If your team isn’t helpful (for any reason other than lack of expertise), they aren’t a very good team.",Whitey138,2025-11-17 15:49:58,3,learnprogramming,t3_1ozftik,False,
npb7jsk,I would have thought a strong knowledge of HTML and CSS was a front-end skill?,ScholarNo5983,2025-11-17 13:12:39,2,learnprogramming,t3_1ozftik,False,
npciv67,"In theory essentially none, but a base-knowledge of how they work is always useful. In my experience back-end is rarely purely backend but that more determined by the size of your team, etc.",Candid_Heat_4796,2025-11-17 17:23:59,2,learnprogramming,t3_1ozftik,False,
npcngd0,"""Need""? none... ""Should""? probably the basics. I would expect a BE developer to be able to throw together the most basic of frontends, just enough to test whatever it is being done in the backend. Meaning, a basic HTML form or a basic table to list query results. Nothing fancy, just basic text with white background barely aligned.",BroaxXx,2025-11-17 17:46:43,2,learnprogramming,t3_1ozftik,False,
np4idb8,"Honestly, the “lifetime deal” only makes sense if you’re committed to long-term, structured learning. Most people buy big bundles and end up using only a fraction. Mosh is great, but before spending ₹11k, ask yourself: Will I actually follow multiple courses, or is this just motivation shopping? If you’re not sure, start with a single course first.",Digitalunicon,2025-11-16 10:16:25,3,learnprogramming,t3_1oyhpu9,False,
np5aab8,I bought it for 7k on sale,Decider2002,2025-11-16 14:08:00,1,learnprogramming,t3_1oyhpu9,False,
np4qsw7,"Thank you for the comment. Yes, I did go through one of his short courses on YouTube about Nextjs and found it interesting.Let me check all the courses and see how much I can learn from them.",Emotional-Room-3930,2025-11-16 11:40:34,1,learnprogramming,t1_np4idb8,True,
np5cp0d,That’s a nice deal,Emotional-Room-3930,2025-11-16 14:23:03,1,learnprogramming,t1_np5aab8,True,
np5who7,"I will second what Digitalunicon said ALSO [https://www.youtube.com/c/programmingwithmosh](https://www.youtube.com/c/programmingwithmosh) he has a bunch of ""full courses"" on youtubeThis would be a great way for you to do a course for ""free"" or see if you even like his teaching style. I personally like it but I know some ppl that don't so I would at least try before you buy",boomer1204,2025-11-16 16:13:51,1,learnprogramming,t1_np4qsw7,False,
np2wgyb,"Not exactly sure what you are asking. Are you asking what to do AFTER the CS degree? If so, that's in a minimum 4years time, you got time to think about it.",maqisha,2025-11-16 02:17:46,4,learnprogramming,t3_1oy9jzz,False,
np341vz,"If you want to dig deeper into how a computer works, then it's time for a low level language. C (not C++) would be perfect for this.I would also recommend Ben Eater's YouTube channel, which digs pretty deeply into how the actual hardware works.",plastikmissile,2025-11-16 03:05:28,2,learnprogramming,t3_1oy9jzz,False,
np2z8ze,It really doesn't matter which language you choose,grantrules,2025-11-16 02:35:13,1,learnprogramming,t3_1oy9jzz,False,
np36z3w,"> I also understand OOP and Functional programmingWhat is a monad?> I understand C++ as C but with additional functionality and tools, but I don't know what those specific tools are.Mostly OOP & templates.> I like learning about how computers work under the hood and wish to expand my knowledge but don't know which one to choose.Prolly some RISC assembler & computer architectures, hard to go lower. Depends what do you want to do later, if you are aiming for writing CRUDs writing in assembly might be pointless. > After that, I don't know exactly what kind of project I should make. If you have any suggestions, that'd be greatly appreciated!Any. Find something in real world that consist of roughly 15 classes and try to write program that helps with it.> If you have any books you find to be helpful, please send them. I like having something in my room full of information that reminds me to try to complete it. If you have any online resources, that'd be appreciated as a stepping point for the book.Design patterns.",Adorable-Strangerx,2025-11-16 03:24:23,1,learnprogramming,t3_1oy9jzz,False,
np3m6ox,Make projects.,Tobacco_Caramel,2025-11-16 05:12:32,1,learnprogramming,t3_1oy9jzz,False,
np3qooo,You're a beginner as long as you have no projects.You can't convince me you are intermediate or advanced and then have nothing to show,mxldevs,2025-11-16 05:48:57,1,learnprogramming,t3_1oy9jzz,False,
np5l3gy,"It depends what you want to do. Software, webb, apps, games... Code a vacuumcleaner that runs C...C is very basic and terminal (butn tsss)C++ is difficult but raw power. Is widely used.Maybe look at C#? OOP and used in higher level than C/C++. Like many points out: Get to know 1 language well, then look at others. You will also have an easier time learning other languages later.",knufus,2025-11-16 15:12:57,1,learnprogramming,t3_1oy9jzz,False,
np31xez,Could do it in 3. I did,Linkpharm2,2025-11-16 02:51:58,2,learnprogramming,t1_np2wgyb,False,
np3m4tx,No sorry just asking for what I should do now that I have the basics of a simple language? I was also asking the differences between C and C++ as a learning tool.,ToeConsumer420,2025-11-16 05:12:08,1,learnprogramming,t1_np2wgyb,True,
np7349j,"Thank you, Ben Eater was a type of channel I was looking to find.",ToeConsumer420,2025-11-16 19:49:46,1,learnprogramming,t1_np341vz,True,
