id,body,author,created_utc,score,subreddit,parent_id,is_submitter,distinguished
n7xwga0,I will be messaging you in 6 days on [**2025-08-16 13:58:48 UTC**](http://www.wolframalpha.com/input/?i=2025-08-16%2013:58:48%20UTC%20To%20Local%20Time) to remind you of [**this link**](https://www.reddit.com/r/dataengineering/comments/1mlhrhx/accountability_post/n7xw9ix/?context=3)[**CLICK THIS LINK**](https://www.reddit.com/message/compose/?to=RemindMeBot&subject=Reminder&message=%5Bhttps%3A%2F%2Fwww.reddit.com%2Fr%2Fdataengineering%2Fcomments%2F1mlhrhx%2Faccountability_post%2Fn7xw9ix%2F%5D%0A%0ARemindMe%21%202025-08-16%2013%3A58%3A48%20UTC) to send a PM to also be reminded and to reduce spam.^(Parent commenter can ) [^(delete this message to hide from others.)](https://www.reddit.com/message/compose/?to=RemindMeBot&subject=Delete%20Comment&message=Delete%21%201mlhrhx)*****|[^(Info)](https://www.reddit.com/r/RemindMeBot/comments/e1bko7/remindmebot_info_v21/)|[^(Custom)](https://www.reddit.com/message/compose/?to=RemindMeBot&subject=Reminder&message=%5BLink%20or%20message%20inside%20square%20brackets%5D%0A%0ARemindMe%21%20Time%20period%20here)|[^(Your Reminders)](https://www.reddit.com/message/compose/?to=RemindMeBot&subject=List%20Of%20Reminders&message=MyReminders%21)|[^(Feedback)](https://www.reddit.com/message/compose/?to=Watchful1&subject=RemindMeBot%20Feedback)||-|-|-|-|,RemindMeBot,2025-08-10 13:59:53,1,dataengineering,t1_n7xw9ix,False,
n88sve2,Then switch to Datalemur,TXaccountant,2025-08-12 06:06:35,1,dataengineering,t1_n7sc6s1,False,
n88tu2c,Alright I am at the site so just practice Basic SQL? Right?,sea_queen_5,2025-08-12 06:15:14,1,dataengineering,t1_n88sve2,False,
n8tghjn,"hey i am cofounder of dlthub, the pythonic OSS data integration standard.MCP simply connects a LLM with python functions that can do things. It will not be in any way useful for what you want. It's simply a way to give a LLM ""tools"" (python functions that could do anything)I suggest to go for option 3 because low cost high throughput. If you must do 1, then why not use dlt, we have reverse ETL. Absolutely do not do 2, if you can avoid it because it can affect db performance and cripple the money making engine of the company.",Thinker_Assignment,2025-08-15 12:02:53,4,dataengineering,t3_1mqui5z,False,
n8tijbv,You could check out https://delta.io/sharing/ or similar.,Operadic,2025-08-15 12:15:59,2,dataengineering,t3_1mqui5z,False,
n8tb5lg,"The direct data base connection is not a good idea because of isolation between operational and analytical. If the database doesn't scale and your queries become complex and frequent, you might crash an operational system. Similar concerns exist for change management: if your analysis depends on the internal workings of that database, they will very easily introduce breaking changes. The API serves as a contract to stabilise the interface in both scenarios. If you want an odbc connection, the operational system should at least provide you with the views that form the contract so their changes won't break your system.MCP would just layer on top of the view or the API. Anything else is bad design.",ProfessorNoPuede,2025-08-15 11:26:23,1,dataengineering,t3_1mqui5z,False,
n8tsgmd,MCP has zero relevance to this task,themightychris,2025-08-15 13:14:17,1,dataengineering,t3_1mqui5z,False,
n8ts952,"There are cases where I'd go with #3If the API is shit and you can't trust the vendor to be competent about fixing/maintaining it, and the data you need to pull is from append-only tables that have an indexed timestamp or sequential ID you select on, #3 could absolutely be your best option. Especially if you only need to pull the data in daily batches and can schedule the pull at a time when database load will always be lowedit: I meant #2 lol",themightychris,2025-08-15 13:13:07,1,dataengineering,t1_n8tghjn,False,
n8ttn87,that's another solid reason for #3the only good reason to go via an api is because you can add logic like validation to reject data. but you can do this with files too by agreeing on a rejection protocol like moving non conforming data to a bad bucket with an alert,Thinker_Assignment,2025-08-15 13:20:51,1,dataengineering,t1_n8ts952,False,
n8txtmm,whoops I meant to say #2 lolI'd prefer #3 myself,themightychris,2025-08-15 13:43:44,1,dataengineering,t1_n8ttn87,False,
n8u3r9x,yeah #2 has high throughput but you need to make sure the reads are not causing slowness on production. Not an issue for everyone. At least SQL comes with metadata and you can fast transfer it to other strongly typed destinations with arrow or connectorx (which is better in this regard than a rest api),Thinker_Assignment,2025-08-15 14:14:34,1,dataengineering,t1_n8txtmm,False,
n8qjqxc,Athena + Glue + iceberg + sqlmesh is fine. (Assuming your use cases fit reasonably) I would not replace Athena with Trino. You’d have to manage Trino and its compute. I’ve no experience with clickhouse.,BonzoDoesBitburg,2025-08-14 22:57:18,1,dataengineering,t3_1mq7z2c,False,
n8qlhzw,"wrangling 100+ analysts writing SQLmesh will be the issue, not so much the stack",BonzoDoesBitburg,2025-08-14 23:07:58,1,dataengineering,t1_n8qjqxc,False,
n8qrz6x,"Trino devrel here from Starburst (my disclaimer) -- remember that Athena IS Trino. A SaaS hosted version just like Starburst Galaxy; https://www.starburst.io/starburst-galaxy/. Just making sure you know you could switch your Trino hosting provider if you don't want to manage a naked Trino cluster yourself. But yes, if you want to deploy yourself, Trino can deploy nicely in AWS using EKS. Good luck.",lester-martin,2025-08-14 23:45:37,1,dataengineering,t1_n8qjqxc,False,
n8r1a9u,This dude is correct. Athena is Trino. And a SaaS just like Starburst Galaxy. IF I was doing more than ad hoc queries I’d pick Starburst. Better governance and management features generally and likely cheaper than Athena. Depending on how delusional your management is and your powers of persuasion might be worth making a case for it,BonzoDoesBitburg,2025-08-15 00:38:15,2,dataengineering,t1_n8qrz6x,False,
n8ifb28,"It really depends on the compliance requirement. If you have the need to recreate a post-data-aggregation financial number in 5 years, you absolutely need the raw data upstream of it, and versions of every data transformation step in between.",davrax,2025-08-13 18:22:50,4,dataengineering,t3_1mp5x5d,False,
n8hit75,"If you partition your data correctly, I believe you can put older data into a cheaper storage option such as glacier and have a job that truncates the tail end of 7-8 years.",BubbleBandittt,2025-08-13 15:48:18,3,dataengineering,t3_1mp5x5d,False,
n8jd13o,">If you have the need to recreate a post-data-aggregation financial number in 5 years, you absolutely need the raw data upstream of itwhat does this mean? i coudnt get you, sorry",Just_A_Stray_Dog,2025-08-13 21:04:25,1,dataengineering,t1_n8ifb28,True,
n8hryje,so how does it work i mean at what stage do we store this raw data in pipeline like immediately at the other end of broker?,Just_A_Stray_Dog,2025-08-13 16:32:17,1,dataengineering,t1_n8hit75,True,
n8jvgys,"Let’s say you have a reporting table with a value “June 2025 Total Sales: $500”. That table might be sourced from multiple upstream systems (maybe an e-commerce engine, your bank, payment processor, or somewhere else). If an auditor in 5 years says “show me the sources and logic underlying the $500 value”, then you need raw data from all of those sources, copies of any transformed or aggregated data from there, and that reporting table itself. —For standards like GDPR, the more complex issue is the consumer “right to be forgotten”—with proper notice, you need to fully delete every trace of data associated with that person across systems, including archival.",davrax,2025-08-13 22:38:00,2,dataengineering,t1_n8jd13o,False,
n8ht1rq,ALL of your data should have some temporal aspect baked in. So if you’re storing raw data either use a processed at timestamp or derive it from the data attributes.,BubbleBandittt,2025-08-13 16:37:36,2,dataengineering,t1_n8hryje,False,
n8fcyco,"People can correct me but what ive heard is that you move it back to archiving in a file storage after sometime because you might need the raw in your warehouse for a while but after sometime you dont need it there anymore. File storage systems are cheap specially the ""archiving"" mode",Scepticflesh,2025-08-13 06:46:15,3,dataengineering,t3_1mowmo6,False,
n8fgcnf,"two questions: 1. How does this moving work? is it like we move after a certain amount of time via batch process that does this job? 2. so for complaince domain, when auditors ask, do we not show the real raw data? and instead show transformed data?",Just_A_Stray_Dog,2025-08-13 07:18:46,1,dataengineering,t1_n8fcyco,True,
n8fove4,1. Yes2. You pull it out of archive to show them :skull:,Scepticflesh,2025-08-13 08:44:01,1,dataengineering,t1_n8fgcnf,False,
n8vxgsb,Please be more specific with your problem statement.,SryUsrNameIsTaken,2025-08-15 19:34:00,3,dataengineering,t3_1mr7kg8,False,
n8w4j4f,You should be more focused on schema rather than data types ig,FantasticOrder4733,2025-08-15 20:08:51,3,dataengineering,t3_1mr7kg8,False,
n8vxxgg,"A datatype normally means a string, number, date, etc. I’m guessing that’s not what you’re talking about? Could you clarify - maybe give examples?",NW1969,2025-08-15 19:36:19,1,dataengineering,t3_1mr7kg8,False,
n8w1d8h,"Since you say JSON format I assume you’re talking about different file formats from a data source like CSVs, Excel files or Text files.Yes, you process them in a common data structure. This could be a Pandas/ Polars/ PySpark dataframe.Then, you can store them in a common data storage format as well. That could be Delta Tables/ SQLite/ PostgreSQL, among others.",Particular-Umpire-58,2025-08-15 19:53:16,1,dataengineering,t3_1mr7kg8,False,
n8w6ajt,Suppose you'll have different fields from various sources that you want to combine at the end depending on the use case.,FantasticOrder4733,2025-08-15 20:17:31,1,dataengineering,t3_1mr7kg8,False,
n8woibw,What kind of software engineering experience do you have?Because your questions—even with the additional details—is still ridiculously broad. What format is your source data? Where is it coming from? What format do you want to work with it in?You’re going to have to answer those questions—at the very least—in complete detail before you can get clear answers. “Instagram content” is absurdly short of the mark as far as details go.,Slggyqo,2025-08-15 21:48:07,1,dataengineering,t3_1mr7kg8,False,
n8wrr6g,"When you first start, you basically write procedural code. There is almost no reuse.Then you move to functions. You aren't sure why, but you do.Eventually, you start seeing patterns and classes start to make sense. You first implement really shitty classes which are no more than functions with extra steps, although it gets better over time.Unfortunately, your post below is a bit more of a difficult one as webscraping is much more complicated than regular data extraction. I'd personally have specifically for getting videos and pictures a `PictureExtractor`class and a `VideoExtractor` class along with specific subclasses for said websites since they're unique enough to justify building their own classes.",MikeDoesEverything,2025-08-15 22:05:40,1,dataengineering,t3_1mr7kg8,False,
n8xfbhb,You have to implement support for each and every API you want to consume.,Nekobul,2025-08-16 00:21:58,1,dataengineering,t3_1mr7kg8,False,
n8vz494,"sorry for lack of specificity, edited the question my question is if i have to build a pipeline which will ingest say instagram content and i want to use same pipeline for youtube ingestion and google drive ingestion, in that case for different types of data formats how can i handle so that i can save correctly all these data formats",Saitama_B_Class_Hero,2025-08-15 19:42:08,1,dataengineering,t1_n8vxgsb,True,
n8w5ts4,can you please elaborate a little bit more with my context please like with an example maybe?,Saitama_B_Class_Hero,2025-08-15 20:15:12,0,dataengineering,t1_n8w4j4f,True,
n8tljcq,"If you had some pipeline you wanted to build for yourself, I would do that and put it on your resume. My team and I would look at something like that (once you pass the HR filtering). I made simple analytics dashboards for myself for sports leagues—NFL, NBA, etc.—just for fun to try out a new backend or orchestrator.It helps a lot to learn fast. At work, half the time is spent trying to fit your work into the framework rather than necessarily achieving the goal (e.g., firewall changes, infrastructure sign-offs...).This might get you in the door. You can try pursuing a master's degree to get past the junior level. In an interview, if you can say ""I saw you use Dagster, and I was learning it on the side and built this flow,"" that would put you over 95% of candidates.",thegreenmushrooms,2025-08-15 12:34:33,1,dataengineering,t3_1mqmwjm,False,
n8f7j5c,"This [SQL Data Warehouse from Scratch tutorial](https://www.youtube.com/watch?v=9GVqKuTVANE) is a reasonable intro to data warehousing and ETL pipelines, but it seems pretty narrow in scope. It focuses on building SQL-based workflows, which is useful, but it doesn't expose you to the full range of technologies and challenges in data engineering, like pipelines, orchestration, streaming, or cloud-native architecture. You might want a [diversified set of data engineering projects](https://www.projectpro.io/learning-paths/data-engineer-learning-path) that provide a structured experience covering real-world data pipelines, ETL, data warehousing, big data tools, and cloud platforms. You need to expose yourself to different data formats, integration patterns, and performance challenges you’ll face in real-world systems. Personally, diversification helps you understand how tools behave at scale, so you have the instincts to troubleshoot and optimize.",Aggravating_Map_2493,2025-08-13 05:55:34,2,dataengineering,t3_1moqi55,False,
n8e2bsl,"What you do? What is your experience, education?",rtalpade,2025-08-13 01:03:23,1,dataengineering,t3_1moqi55,False,
n8e5eon,I am studying computer science And i came from a ML background,Mugiwara_boy_777,2025-08-13 01:22:00,1,dataengineering,t1_n8e2bsl,True,
n8e7eev,"Great! Yeah the guy is good, go ahead and watch it!",rtalpade,2025-08-13 01:34:09,3,dataengineering,t1_n8e5eon,False,
n7rpm4r,"Most beginners don’t realize that if you learn one language really well, learning others is quite easy.",daedalis2020,2025-08-09 12:54:34,125,learnprogramming,t3_1mlmi7k,False,
n7ra8qd,Great stuff! I'll add the suggestion to read other peoples' code. That's a big benefit of the open source movement.,Aggressive_Ad_5454,2025-08-09 10:55:08,59,learnprogramming,t3_1mlmi7k,False,
n7uahph,"Oh wow, a time traveler - [**You - 3 months ago**](https://redd.it/1khzxng)> been coding for like 3 yrs nowWhat is it now? 3 years, or 5 years?Just alone this destroys your entire credibility.> I've been chatting with a bunch of beginners from this sub over the past couple months (like 12 of you lol)Without any participation in the subreddit?> I've been on both sides of interviews and helped with hiring at my last companyNot believable even if we take 5 years experience **as a professional** into consideration.You are just giving generic advice that has been given 1000s of times already here and in all related subreddits to farm karma and promote your substack/medium articles.I call fake on everything you say about your ""career"" and ""experience"".You just want to promote your newsletter. That's all.",aqua_regis,2025-08-09 21:36:03,45,learnprogramming,t3_1mlmi7k,False,
n7rdxum,Thanks op. I actually do the last paragraph right now. I’m not sure if I’ll land a job or not but learning a new skill and the enjoyment of solving something is pretty rewarding,Psychological-Will29,2025-08-09 11:27:16,9,learnprogramming,t3_1mlmi7k,False,
n7s07pp,"I feel like I've read this before. I've definitely read ""one of the best devs I know beat me in chess after only reading strategy for a few days"" somewhere. I thought it was from Cracking the Coding Interview, but I can't find it.",PossiblyA_Bot,2025-08-09 14:01:16,10,learnprogramming,t3_1mlmi7k,False,
n7ssv6p,">If you're stuck on what to build - thats kinda a warning sign tbh. You should want to build SOMETHING.I don't see why. Been a full time dev for 8 years. Never wrote a single line of code outside of work or education. There has never been a project simple enough that I could do alone in a reasonable time, that hasn't already been done better by other people. Building something useless just to have a portfolio project would have felt like a massive waste of time. Thankfully my first employer just asked for examples of code I wrote in college, and after that it didn't matter.",Dissentient,2025-08-09 16:39:02,9,learnprogramming,t3_1mlmi7k,False,
n7rcz69,Solid,flow_Guy1,2025-08-09 11:19:07,6,learnprogramming,t3_1mlmi7k,False,
n7rxjtr,"Languages are just tools meanwhile, beginners treating them like Hogwarts houses. :grinning_squinting_face:",Significant_Loss_541,2025-08-09 13:45:03,6,learnprogramming,t3_1mlmi7k,False,
n7ryzvl,"Very helpful! Been teaching myself to code in my limited spare time ( new little human takes up most of my time) I got caught up for a week on what language to learn and then I just said f*ck it and jumped into Java… wasn’t easy but wasn’t super difficult either I did a Codecademy course which was helpful once I finished that I jumped into Kotlin which has tons of similarities and I’ve been learn that for a few weeks now! I find the more you do it and the more time you can focus on it the easier it gets! I’m no computer wiz, I work on German cars for my day job and always have had a passion for tech so I figured why not try it maybe make a few bucks on the side or even make a career out of it",PossibleProgress3316,2025-08-09 13:53:53,5,learnprogramming,t3_1mlmi7k,False,
n7zbdau,A lot of this is covered in the FAQ but of course nobody reads that shit and that's yet another reason why they struggle. Gotta learn how to learn.,Moloch_17,2025-08-10 18:27:46,4,learnprogramming,t3_1mlmi7k,False,
n8s48d8,Long live the epiphany moments.,Dappster98,2025-08-15 04:58:00,106,learnprogramming,t3_1mqnpoy,False,
n8s3pfa,Congratulations!Would love to hear you elaborate more. Where were you stuck and how did it click? Reading? Practicing? A video?,maujood,2025-08-15 04:53:38,31,learnprogramming,t3_1mqnpoy,False,
n8so492,You stuck with something that didn't click for 2 years? That already is amazing. Congratulations!,Fun-Republic-8968,2025-08-15 08:00:28,15,learnprogramming,t3_1mqnpoy,False,
n8tfzl9,It's a great feeling isn't it! And addictive. Now learn \*everything\* LMAO,bravopapa99,2025-08-15 11:59:36,8,learnprogramming,t3_1mqnpoy,False,
n8sf849,"Congratulations, keep it up",rcb_7983,2025-08-15 06:35:18,3,learnprogramming,t3_1mqnpoy,False,
n8ug8h8,Eureka!,lgastako,2025-08-15 15:15:42,3,learnprogramming,t3_1mqnpoy,False,
n8v02ud,"DEFINITELY. LEARN. GOLANG. Seriously, I love Go, because of Go, I have been learning a TON about more advanced concepts in a very short period of time that would have probably taken me more time if I were continuing to learn just Python or C++ or what have you. But yeah, Golang, I highly suggest you learn this language. Will never think of my previous favorite language (Python) the same way ever again.",Efficient_Clock2417,2025-08-15 16:51:16,3,learnprogramming,t3_1mqnpoy,False,
n8v0mnm,Englitenment ehh,PoosiNegotiator,2025-08-15 16:53:49,2,learnprogramming,t3_1mqnpoy,False,
n8vaf8o,"Ahh I remember this moment, congrats. Now comes the “why isn’t this working” moments from here.",CartoonistBusiness,2025-08-15 17:39:47,2,learnprogramming,t3_1mqnpoy,False,
n8vcylx,"Souds great!Just a heads up, in a week you will come upon an issue which makes you doubt everything you know again, but such is life.",thali256,2025-08-15 17:51:54,2,learnprogramming,t3_1mqnpoy,False,
n7qr790,"That “I feel dumb most of the time” part? Congrats, you’re officially a programmer. :grinning_squinting_face:",Significant_Loss_541,2025-08-09 07:41:35,85,learnprogramming,t3_1mljio6,False,
n7qw6px,"Same here. Never wrote a line of code until I was 49!It is just something I’ve always wanted to do so I bit the bullet and started with JavaScript, HTML & CSS as something to do during long winter nights. Even though it is purely a hobby I started Python recently and love it. More than once I’ve punched the air after solving a problem that has had me befuddled for a while.",This_University_547,2025-08-09 08:31:49,27,learnprogramming,t3_1mljio6,False,
n7qz3um,Learning from books is a great way to learn. My only hints would be read and re-read each chapter multiple times and of course type by hand all examples found in those books to see how they run. That is the best way to get the details to stick.,ScholarNo5983,2025-08-09 09:02:11,11,learnprogramming,t3_1mljio6,False,
n7qwco9,"Also, there's a weird vibe on the internet that ""everybody hates JAVA"" I don't quite understand it. From what I have learnt over those 2 months is that JAVA is very portable language and can adapt to new standards. I like it. I wasn't choosing language because of how ""easy"" IT is but because my favorite games are in JAVA. I hear this notion from Python people. Is it true or it's just the interent thing? I like JAVA.",RealAd6237,2025-08-09 08:33:32,7,learnprogramming,t3_1mljio6,True,
n7qqgwj,Awesome! Keep it up :flexed_biceps:,copperfoxtech,2025-08-09 07:34:19,5,learnprogramming,t3_1mljio6,False,
n7xcn0f,never too late to pikckup something new.even if its just a hobby,Such-Catch8281,2025-08-10 11:46:34,3,learnprogramming,t3_1mljio6,False,
n7qqn4u,"Well yeah, like with any hobby, once you rely on it to take care of paychecks, fun sorts of stops coming for free. Not that it was a hobby really for me, always mainly a careerpath. Envy those who find enjoyment in casually wrestling with code! I am like that with music production instead, which probably actually means I should quit my sad programming job to go program drums or something.",Einareen,2025-08-09 07:36:02,3,learnprogramming,t3_1mljio6,False,
n81zoc8,31 here on my way of learning python. I programmed before back in collage (C#) but never really got fully into it. Week 4 of CS50P and so muy fun till now.,brian_veinti14,2025-08-11 03:53:58,3,learnprogramming,t3_1mljio6,False,
n844lrv,"Well, there are two of us now but I am 45, it is a new entertaining hobby.",trottersu,2025-08-11 14:15:50,3,learnprogramming,t3_1mljio6,False,
n7sfnba,"I don't want to discourage you but there will be days where you hit a problem or bug that will suck, a lot. On days like these you will feel like crap and like you are the dumbest programmer around and ask yourself if this stuff is even for you. I think often people give up on days like these. If you can overcome all of that and continue when things aren't fun and also ignore the many many posts on Reddit how AI will replace all programmers, then doors could open in future that you cannot see now as a beginner. As many say consistency is more important than motivation because you will have days where you don't want to do it and aren't motivated. On these days it's especially important to do it so you can build a habit.",sandspiegel,2025-08-09 15:28:01,2,learnprogramming,t3_1mljio6,False,
n8ildaa,"i get distracted all the time. I'm not even supposed to be on reddit right now and I'll tell you why, after observing it for months. I should probably delete my account right after this post so I'll try to make this last one count.When I encounter a hard problem, I can't take it. People don't want to do hard things and the brain gets wired to equate ***difficulty*** as something 'bad' so they reach for their phone to entertain themselves. We have an entire generation of people with weak self-control because they're addicted to being entertained and doing the easy thing as a **way of life**.I'm not getting high and mighty like I'm better than everyone. This is something I see in myself daily as I grind through hours of difficult material.every day I study I meet the following criteria:* 7 hours of sleep at least. ( focus / self control diminishes if I go any less )* I have coffee* I sit in my chair in my room and there is NOTHING in my field of view to distract me. If my butt is in the chair I am here to work. Anything else I want to do in my life is free to do, but NOT in this chair. It's just like a bed: it's for sleep and sex; if I want to scroll on my phone I can do it on the couch or watch tv.* I put a focus track for 30 minutes from [brain.fm](http://brain.fm) ( they have freebies on youtube ) and I just get through 30 minutes. After that I mark one tally on my whiteboard, take a walk outside for 5 minutes, then come back.Rinse and repeat, with the intent to do 5 hours that day. Maybe more, maybe less, but that's what I shoot for.You have to get comfortable with being uncomfortable. You can train your mind to not freak out and rush for the digital equivalent of a candy bar but it takes training. That training requires an environment, routine, and a schedule.... and plugins to prevent going on youtube and reddit... if the temptation is there you will go for it, again and again.anyway, good luck.",_Ishikawa,2025-08-13 18:52:28,89,learnprogramming,t3_1mpcbyz,False,
n8igb6v,"Set definitive, achievable, short-term goals for your code and achieve them. Don't stop until you have. Do something dopamine-inducing when you're done. Gradually make goals out of things that take a little longer.",florvas,2025-08-13 18:27:43,22,learnprogramming,t3_1mpcbyz,False,
