id,body,author,created_utc,score,subreddit,parent_id,is_submitter,distinguished
mndosgr,"Former scientist turned DE here, so kind of get what you're saying.> These instruments are standalone (not connected to the internet), but they might be connected to a computer that has access to a network drive (e.g., an SMB share).So, of course, first point would be to raise an IT request to have a central location where all output data gets pushed to as well as a folder structure. I'd recommend having a folder structure by instrument name, date, and split it either by user, by the test, or by both e.g:`FTIR/01Jan2025/Test/file.csv` or `FTIR/01Jan2025/User/file.csv` or `FTIR/01Jan2025/Test/User/file.csv`(I label dates like this because for my sins I have spent time working in QC where I sent samples around the world and we needed a universal date format everybody understood)This will be on your local network so all computers connected to instruments can dump the data there and then you have a single location to point your data processing tools to.> The output files are typically in a binary format. Instrument vendors usually don’t provide parsers or APIs, as they want to protect their proprietary technologies.This is a huge ballache. You'll want to put all unprocessed binary files into their own folder and convert them into a digestible format if absolutely required. Bear in mind each file might need it's own process, hence, the ballache.> In most cases, the instruments come with dedicated software for data analysis, and the results can be exported as XLSX or CSV files. However, since each user may perform the analysis differently and customize how the reports are exported, the output formats can vary significantly—even for the same instrument.One potential way is to have a standardised output. I get this massively depends on the instrument and testing although if that's possible, it would make everybody's lives easier.> Even if we can parse the raw or exported files, interpreting the data often requires domain knowledge from the lab scientists.Which makes complete sense. What happens to the data after you parse it? i.e. do you email it to specific users, do you have it printed out? etc> Given these constraints, is it even possible to build a reliable ELT/ETL pipeline?I'd say yes, although there's a high level of complexity.",MikeDoesEverything,2025-04-16 09:14:19,1,dataengineering,t3_1k08v9b,False,
mnfa99y,"I think you're missing a piece of the puzzle here ... What's the envisioned end use case for this data? Do you want to produce a weekly calibration report and dashboard to show the machines are in spec? Do you have a particular kind of analysis that is repeated multiple times a day that you'd like to automate?For the use case of calibration reports, we collaborated with lab management to have a technican use the machine's proprietary software to export the raw data and a standard analysis to a csv report, and we stored these csv's in a specific network folder. Periodically, a scraper searched the networked folder for new data and loaded it to the warehouse. An ETL cleaned the data and formatted it so that it could be displayed on the calibration status dashboard. The cleaned data were also available on the self service abalytics platform. Lab data is challenging because it's ofte less structured than data from an API or service backend. At all times you need to make sure the extraction and transformation process is representative of something physical that really happened. It involves a lot of conversation and buy in from stakeholders and lab management to do this right. So, I'd recommend to start there.",chaoselementals,2025-04-16 15:31:36,1,dataengineering,t3_1k08v9b,False,
mnewcte,"Yup, data transfer to a centralized location is the easier part. Conversion to the digestable formats (JSON, XML, parquet, etc) is the harder one. Given that this needs to be done manually, via the instrument software and executed by the lab scientists, this might need to come first, before ingesting them to an S3 bucket, etc. I wish there are better ways to do this (i.e ingesting first, then digest later)I totally get what you mean, and believe me that is literally what those vendors are trying to do right now, trying to lock the users in the crappy cloud ecosystem that only works for their system.",mardian-octopus,2025-04-16 14:22:37,2,dataengineering,t1_mnc7mn1,True,
mndq8wl,"Getting data into S3 doesn’t have to be that painful. Assuming the instrument is network connected in some way, it should be possible to pull from it as a network drive (NFS, SMB, etc). From there, push the raw data to S3 with AWS CLI. Simplest way to do these tasks is through a bunch of bash scripts and scheduled cron jobs, though if you have the infrastructure set up for more complex event-based workflows, I’m sure the company will already have experienced people who can better advise.Once in S3, ETL can follow on pretty easily using the tools of your choice.The most annoying thing that might happen is if the instrument only allows you to export your data to some external drive.",sylfy,2025-04-16 09:30:00,1,dataengineering,t1_mnc7mn1,False,
mneqxb2,"Yes, I'm pretty sure they are proprietary as every instrument has unique extensions. I don't remember all of them, for example there is an instrument called NanoTemper generating .paa and .pan files. Another instrument called Biacore generating .blr files. Some vendors even sell data converter software to get those files into more common formats (JSON or XML) --but even this converter is not API enabled. I think that is just how the industry works, even though I'd argue why do we even need to buy a converter for data that we generated and own.",mardian-octopus,2025-04-16 13:54:05,1,dataengineering,t1_mnchx40,True,
mnerdla,"Yup I'm familiar with Nextflow. For genomics data analysis, it is slightly better as the file formats are quite generic and parsable by common programming language (i.e. Python). But it is good idea to check that sub.",mardian-octopus,2025-04-16 13:56:33,1,dataengineering,t1_mndeki0,True,
mneuy45,"Completely agree on your point on a centralized location with a proper structure, although I might want to use YYYYMMDD format for my date (it is easier to sort and convert to datetime object if needed)As for the data parsing and export, as you said this depends a lot on the manual process to convert those data into some digestable formats. Another problem is not every scientist has a good habit in saving/organizing their raw data (as you might have known some instruments do not automatically generate output files unless you save them). Some will just do the analysis and export only the necessary information to the excel format. Asking people (more specifically lab scientists) to change their habis is a nightmare. The same thing about standardizing the data export format. The larger the team is, this gets more exponentially difficult to achieve, and I'm working in one big pharma company that literally have multiple teams working in different sites. Not to mention the scientists attitude to think that they know better that everyone else. I really hate when they tell me: it is not as simple as you think, you cannot really automate it, bla bla... It is simply because most of time they are just too stubborn to change the way they work, and they don't think about how those data could be made accessible to everyone else who might need them in a more seamless way.",mardian-octopus,2025-04-16 14:15:25,1,dataengineering,t1_mndosgr,True,
mn6gt4o,Dataverse is essentially azure SQL for noobs. The knowledge barrier for entry is much lower for a neophyte. You can do essentially everything without coding or minimal coding whereas azure SQL you'll be building a database with code by code.Beyond that you're going to have to get familiar with azure portal and azure tools versus dynamics/dataverse etc. azure portal is in general much more complex than the latter.Azure SQL will shine when you have more experience and are in need of more throughput. An example being dataverse handles queries through fetch xml which is rather slow and clunky versus a traditional SQL query you can execute in azure. Relationships between tables is also annoying and superficial in dataverse.If you are new dataverse is a good POC platform until you outgrow it.,lysis_,2025-04-15 03:48:44,3,dataengineering,t3_1jzi6u4,False,
mn6iqbh,"Thank you very much! So, I already have some experience with coding and cloud services thus I'm leaning towards Azure SQL. Is there any reason why I'd use Dataverse over Azure SQL? Dataverse seems to be a more limited and slower version of Azure SQL from what I've gathered online.",JPBOB1431,2025-04-15 04:03:28,1,dataengineering,t1_mn6gt4o,True,
mn7qbfx,"It really is in case you have a noob team that needs all automated integrations within the power apps/dynamics ecosystem. All the limitations are in service of that simplicity. If you have SAS it would more easily connect directly to SQL server. You may also find it easier to extract data with ADF , if you want to pull CSV snapshots to SAS.",azirale,2025-04-15 11:12:04,2,dataengineering,t1_mn6iqbh,False,
mn7suy2,No reason to go with dataverse if your team has experience with SQL setup and maintain ability,lysis_,2025-04-15 11:31:58,1,dataengineering,t1_mn6iqbh,False,
mmlwv67,"We used datafold in a migration from sql server to snowflake. We had a few hundred objects to move and were rewriting our sql server stored procedure into dbt (which was a huge pain, but definitely worth doing <3 dbt) Before finding datafold we were just writing queries to compare the datasets on each side and some key metrics, which was tedious at best. About 30% of the way through the process we got onto datafold and started data diffing the datasets in both places and found a tonnnnnn of random stuff we missed in migration because sql server and snowflake just work differently, like with case sensitivity and extra spaces and date function quirky-ness. We even found issues with our previous load process in sql server that we had no idea about XD. The team is responsive and during the migration we reached out for them to fix or add a bunch of features and they consistently turned them around to keep us moving. Definitely recommend when migrating out of sql server. I have not worked with databricks, so I don't know how closely it matches sql server functionality, but the biggest things that got us were untrimmed values, case sensitivity and date stuff.",Efficient_Ad_8020,2025-04-11 18:42:55,4,dataengineering,t3_1jwn3gu,False,
mmpaws9,We are working with Datafold on a couple of database and ETL migration projects into Databricks. They are an excellent company to work with and have so far delivered on their promises.,Current-Usual-24,2025-04-12 08:22:22,3,dataengineering,t3_1jwn3gu,False,
mmr26hb,"Is it a one time fee for the migration, like consulting services?",captaintobs,2025-04-12 16:02:31,1,dataengineering,t3_1jwn3gu,False,
mng1o61,What's the name of your present platform?,Buddy_Useful,2025-04-16 17:44:32,3,dataengineering,t3_1k0n177,False,
mnhyf3e,I have the same question as Buddy\_Useful . What is the present middleware platform ?,Nekobul,2025-04-16 23:42:34,1,dataengineering,t3_1k0n177,False,
mn78jvx,"A terrible idea, please don't do this. Power automate is not an etl tool. It's not reliable, can't transfer large files, it's slow as hell, it's a mess code control. Use Azure Data Factory if you need easy to use etl tool.",Demistr,2025-04-15 08:11:52,24,dataengineering,t3_1jzm2zf,False,
mn7sl7n,Power Automate is a toy. SSIS is the right tool for the job.,Nekobul,2025-04-15 11:29:54,2,dataengineering,t3_1jzm2zf,False,
mn7tlgs,"If your shared folder is SharePoint or OneDrive, consider using the HTTP with Azure AD (preauthorised) step in Power Automate. Allows you to quickly deliver value with a POC while giving you the flexibility in future to rework into a pro-code implementation that's more robust. Google around for bulk operations with Excel files using Power Automate, and you should find enough tutorials. You might face API timeout issues with larger data extractions that might need some workarounds. Long term wise you should still find a way to wean users off Excel into proper user interfaces, if possible. PowerApps may be a potential route if your org can afford premium licensing costs.",detaurus,2025-04-15 11:37:31,2,dataengineering,t3_1jzm2zf,False,
mn94udf,ive never seen PowerAutomate considered as an enterprise ETL toolmore of a thing to do personal workflow stuff.,ScroogeMcDuckFace2,2025-04-15 16:03:16,2,dataengineering,t3_1jzm2zf,False,
mna2btf,Hell nah,fuchibolguy,2025-04-15 18:48:29,1,dataengineering,t3_1jzm2zf,False,
mnapgwj,"I think power automate can work. I think your main problem are unstandardized csv and excel files. It wont scale basically If you dont standardize everything. Going for ""yeah the data team will figure everything out"" instead of ""we and especially the business has to figure it out"" you will be at a loss.. Good luck you need it! RPA is basically never the way..",Ok-Sentence-8542,2025-04-15 20:43:46,1,dataengineering,t3_1jzm2zf,False,
mnfmq1b,Python is better anytime than power automate,Turbulent-Tomato638,2025-04-16 16:33:18,1,dataengineering,t3_1jzm2zf,False,
mnf10n4,Power Automate has been plenty reliable for my team…,digitalghost-dev,2025-04-16 14:46:00,1,dataengineering,t1_mn78jvx,False,
mn796ou,"Problem is not ETL. We don’t have any data to begin with. Everything has been done manually for years with damn Excel files. There are 40 person and their only job was to work with Excels. We are building them an SQL Server database and our ETL tool will be SSIS. But we have to generate all the data from the source interfaces and apps. This has been done manually by the said people. I will use power automate (be an RPA developer for a while) and then put the csv, excel files to a shared folder. Then we will get the data with SSIS and apply transformations and PowerBI and so on. I was just wondering If I can just forget about SSIS and use PowerAutomate for this purpose as well.",Brilliant_Breath9703,2025-04-15 08:18:57,0,dataengineering,t1_mn78jvx,True,
mnaejjv,Premium licensing is usually not necessary if there is a middleware between the PowerApp and the SQL server.,Demistr,2025-04-15 19:49:56,1,dataengineering,t1_mn7tlgs,False,
mn6angl,Found or wrote?,Witty_Username704,2025-04-15 03:04:26,5,dataengineering,t3_1jzgdob,False,
mn7oovj,Maybe you're looking for the business intelligence sub,financialthrowaw2020,2025-04-15 10:58:36,3,dataengineering,t3_1jzgdob,False,
mn6d257,Naah i found while browsing,Sadikshk2511,2025-04-15 03:21:24,-2,dataengineering,t1_mn6angl,True,
mn7pnch,Yeah but they are not accepting with the links their in the community,Sadikshk2511,2025-04-15 11:06:36,-1,dataengineering,t1_mn7oovj,True,
mn7qco4,Sounds like a good rule that the mods should implement here.,financialthrowaw2020,2025-04-15 11:12:20,3,dataengineering,t1_mn7pnch,False,
mn7qsby,Yeah but only with low karma ratings profiles only,Sadikshk2511,2025-04-15 11:15:50,0,dataengineering,t1_mn7qco4,True,
mn14x0t,"Pre-relate core dimensions and facts in the warehouse, but keep it manageable. Create certified datasets for common use cases, let power users do custom modelingDon't try to build one model to rule them all - you'll end up with a maintenance nightmare",Mikey_Da_Foxx,2025-04-14 08:41:33,6,dataengineering,t3_1jytgrh,False,
mn20uqs,thanks Mikey!,Able-Tomatillo-5122,2025-04-14 13:10:34,1,dataengineering,t1_mn14x0t,True,
mmvov0u,"Since you are using Dagster, you may want to consider [https://cube.dev/product/data-apis](https://cube.dev/product/data-apis) as Dagster has a nice integration with [https://dagster.io/integrations/dagster-cube](https://dagster.io/integrations/dagster-cube)If you are looking for just a framework, FastAPI is definitely the leader in both performance as well as it streamlines documenting your API.",teh_zeno,2025-04-13 11:30:57,3,dataengineering,t3_1jxdch4,False,
mmvhgmv,"As a side, don’t forget PostGIS.",DeepFryEverything,2025-04-13 10:19:19,1,dataengineering,t3_1jxdch4,False,
mn0tvxe,"Fastapi is simple enough for basic stuff and still powerful enough for complex stuff so with it you're highly unlikely to end up saying ""oops, I should have chosen another framework for this feature""",markojov78,2025-04-14 06:43:58,1,dataengineering,t3_1jxdch4,False,
mn9gegy,"Hevo is probably better than Fivetran regarding pricing transparency and flexibility, especially at higher volumes like yours. But, before you make the switch, I’d recommend looking into [**Estuary**](https://estuary.dev/etl-tools/estuary-vs-hevo/) as wellIt provides real-time (CDC) sync out of the box, with support for both streaming and batch pipelines. The pricing is much more predictable ($0.50/GB + flat-rate connector pricing) which can be significantly more cost-effective at scale, especially compared to Fivetran’s new MAR-per-connector (what a mouthful) model or Hevo’s event-based model, which can become unpredictable if your upstream volumes spike as well.[Here’s](https://estuary.dev/etl-tools/estuary-vs-hevo/) a direct comparison we found helpful when evaluating.Happy to chat more if helpful! Disclaimer: I work at Estuary",dani_estuary,2025-04-15 17:00:40,6,dataengineering,t3_1jwrfit,False,
mmkjwf1,Subscribed. (I'm [biased](https://www.reddit.com/r/dataengineering/s/i4MVcVABSc) :),seriousbear,2025-04-11 14:41:46,1,dataengineering,t3_1jwrfit,False,
mmmlowy,"If you’re primarily moving data from Postgres to Snowflake and Databricks, have you checked out [Artie](https://artie.com?utm_source=reddit)? We’re a real-time ELT tool that is specialized in databases and help companies like Substack and Alloy sync data fast and reliably.Disclaimer: I’m the founder",sometimesworkhard,2025-04-11 20:49:35,1,dataengineering,t3_1jwrfit,False,
mmkq8yc,From what services you are pulling data?,Nekobul,2025-04-11 15:13:07,0,dataengineering,t3_1jwrfit,False,
mmkqsjn,Mostly Amazon RDS and Amazon Aurora postgres,pedrocwb_biotech,2025-04-11 15:15:47,1,dataengineering,t1_mmkq8yc,True,
mmz7gtw,You can use AWS DMS (Data Migration Service) to have incremental copy of your AWS databases to S3. I think it’s cheaper and easy to use.,baby-wall-e,2025-04-13 23:28:35,1,dataengineering,t1_mmkqsjn,False,
mmkuqke,And where do you land the data?,Nekobul,2025-04-11 15:35:02,0,dataengineering,t1_mmkqsjn,False,
mmkzrb8,Pulling from Amazon RDS and Amazon Aurora postgres and landing into Snowflake and DataBricks.,pedrocwb_biotech,2025-04-11 15:59:18,2,dataengineering,t1_mmkuqke,True,
mmvboeo,What kind of data volume and change rate are you expecting from the Postgres db?Most of the pg extractors (including Fivetran’s) are using the wal-replication slots. You can even set your own connector up using something like airbyte/Meltano.,gnome-child-97,2025-04-13 09:16:53,1,dataengineering,t1_mmkzrb8,False,
mml39u4,Why do you need third-party tool for that? Why not export Amazon RDS snapshot to S3 and then import into Snowflake from S3?Please check here:[https://www.phdata.io/blog/loading-aws-rds-snaphot-to-snowflake/](https://www.phdata.io/blog/loading-aws-rds-snaphot-to-snowflake/),Nekobul,2025-04-11 16:16:54,1,dataengineering,t1_mmkzrb8,False,
mmjj83v,"Your options: * NoSQL: Firestore is very cheap * SQL OLTP: Cloud SQL is really your only option, but the Postgres/MySQL options are probably overly expensive for what you are doing * SQL OLAP: BigQuery's first 10gb of storage is free, first TB of queries is free Since you mention a dashboard, I'd just load into BigQuery. Maybe write a Python script to move all your existing data into the cloud. Run your existing pipeline from Spotify in cloud functions or Cloud Run depending on how complex it is. Kick it off with Cloud Scheduler or Workflows. That should do it.",mailed,2025-04-11 10:56:16,4,dataengineering,t3_1jwlp4n,False,
mmkffhd,"Question: why would it make sense in your situation to use a NoSQL database? You don't have enough data to make the complex joins extremely inefficient in a relational database. It also sounds like your data's schema is relatively fixed, so you should be able to take the sqlite data and transition its schema onto one of GCP's relational products, then upload using the data transfer service: https://cloud.google.com/bigquery/docs/dts-introduction. (Maybe push your sqlite data into MySQL first to make this easier.)Are you intending to add a new feature that receives a lot of variable schema events?",KilimAnnejaro,2025-04-11 14:19:22,1,dataengineering,t3_1jwlp4n,False,
mmjjyg5,Is there a reason BigQuery is more suited to a dashboard? Thanks for the answer,ColdStorage256,2025-04-11 11:02:20,1,dataengineering,t1_mmjj83v,True,
mmkhu6o,"I was mostly curious. I intend to keep it in a structured format, however, Spotify's API response is in JSON format with each song recorded as an event.",ColdStorage256,2025-04-11 14:31:23,2,dataengineering,t1_mmkffhd,True,
mmjkily,"Dashboards usually present aggregated figures sliced by some kind of dimension, and that's BigQuery's specialty. It's not a database that's built for highly normalized information or high amounts of write operations. But if you're inserting records in bulk every so often, it's a great choice.",mailed,2025-04-11 11:06:57,3,dataengineering,t1_mmjjyg5,False,
mmjl7u0,BiqQuery can act as a database. Datasets = schemas where you can create tables and views. I would store your data in BigQuery then you can throw a dashboard over top.,greenazza,2025-04-11 11:12:39,1,dataengineering,t1_mmjjyg5,False,
mmjmsxo,"I mean, sure, but I don't see the need in stringing together that many services for a home project handling 20mb",mailed,2025-04-11 11:24:57,1,dataengineering,t1_mmjlr3w,False,
mmrgk83,Pub/Sub writing to BigQuery with several hundred messages per second works perfectly fine.,Budget-Minimum6040,2025-04-12 17:16:38,1,dataengineering,t1_mmjkily,False,
mmj2jcb,"You can find a list of community-submitted learning resources here: https://dataengineering.wiki/Learning+Resources*I am a bot, and this action was performed automatically. Please [contact the moderators of this subreddit](/message/compose/?to=/r/dataengineering) if you have any questions or concerns.*",AutoModerator,2025-04-11 08:08:13,1,dataengineering,t3_1jwkotf,False,moderator
mmj3krt,I'd just use notebooks. I'd never touch holistic data solutions for small local tests or for personal use. Bring in the big guns when you are looking for medium size company needs to enterprise needs. No need to fly a fighter jet if you are only going on a vacation,BadBouncyBear,2025-04-11 08:19:22,5,dataengineering,t3_1jwkotf,False,
mmjvlio,"The benefit of databricks is that it’s effectively a wrapper for Apache spark, which is a distributed computing framework. This means that if you have very large datasets or compute heavy procedures, they will often be more performant. If you’re just doing local ML development, Jupyter notebooks should be perfectly sufficient. Using databricks would probably be overkill quite frankly.",rewindyourmind321,2025-04-11 12:26:52,2,dataengineering,t3_1jwkotf,False,
mmk0caz,I assume this really depends on where your data is and how adept you are at setting up a local environment. The databricks runtimes include a ton of installed libraries (and effectively do environment management for you) and depending on what you’re doing you may not even have to install anything (on the chosen cluster).If your data is already in delta lake / unity catalog that would also make databricks notebooks easier.but if you have a process that won’t set your computer on fire or have it grind to a halt as it runs out of memory - setting up a local environment (preferably without Conda) would be a good exercise and you can use VSCode’s built in jupyter support (and plugin) vs spawning a browser window. and if your data is in a .csv already … even easier to have that locally.,CesiumSalami,2025-04-11 12:56:54,1,dataengineering,t3_1jwkotf,False,
mmja5t2,"Databricks itself has a notebook, if I remembered correctly? Or it is just to say that there really is no purpose of using Databricks at all (even if i use the free version)?",CountProfessional840,2025-04-11 09:30:17,1,dataengineering,t1_mmj3krt,True,
mmmvri9,"It is a .csv file. I usually run Jupyter notebook using anaconda, and why is using VSCode's built in jupyter support a good exercise?",CountProfessional840,2025-04-11 21:44:01,1,dataengineering,t1_mmk0caz,True,
mmjbf4w,"Mate, if you are gonna use pandas on a small dataset there's no reason to use databricks at all. It's a way to abstract away a lot of complexity regarding spark (distributed processing), cloud infrastructure (VMs, storage), data catalog etc.If it's even an option to run things locally on a jupyter notebook then why are you considering using databricks? You move your code there (and it's easy to do, it's all notebooks in the end), when it makes sense to do so, when you will use cloud infrastructure to store and manage data, when your benefit from parallel execution with spark (not pandas) etc",slevemcdiachel,2025-04-11 09:43:25,3,dataengineering,t1_mmja5t2,False,
mmmwbwv,Just using different tools is good and if you ever move away from Jupyter VSCode is a good IDE to work in. I may be biased but if you can start using virtual environments that don’t leverage anaconda it’s also a good exercise. I’ve never seen those used in production data science pipelines.,CesiumSalami,2025-04-11 21:47:09,1,dataengineering,t1_mmmvri9,False,
mmmzxrq,Your advice is well noted. Thank you for your time and I wish you all the best.,CountProfessional840,2025-04-11 22:07:33,2,dataengineering,t1_mmmwbwv,True,
