id,title,author,subreddit,content,score,upvote_ratio,num_comments,url,created_utc,extracted_at
1obr8xn,[Update] My husband wants to switch from nurse anesthetist to software engineering.,flatbootyhere,cscareerquestions,"https://www.reddit.com/r/cscareerquestions/s/MMxT0pVzJXAs I suspected he is bored of the mundanity of his job and need to focus so much all the time and wishes he stayed in engineering as it’s hard seeing his fellow coworkers who became super successful. I didn’t ask but I feel he regrets leaving nvidia long ago. The compromise is that he will take online courses at one of the big name online cs programs for a masters while still working as a CRNA. Then if he gets a job, he can leave CRNA and come back if he ever changes his mind. Originally he wanted to leave CRNA and focus on applying and studying full time.",158,0.79,202,https://www.reddit.com/r/cscareerquestions/comments/1obr8xn/update_my_husband_wants_to_switch_from_nurse/,2025-10-20 19:31:06,2025-10-25 01:26:50
1of6d1q,Google L4 but offer letter says Senior,General_Jaguar_7579,cscareerquestions,I just got an offer letter this morning. I interviewed as L4 infra sde. My offer Letter says my title is Senior Software Engineer. I followed up with my recruiter but he hasn’t replied yet. Is this correct?I thought L5 was Senior,148,0.88,69,https://www.reddit.com/r/cscareerquestions/comments/1of6d1q/google_l4_but_offer_letter_says_senior/,2025-10-24 19:02:25,2025-10-25 01:26:50
1ocy8l5,Your experience in the job market is going to be unique,sli7246,cscareerquestions,"I've been lurking in this sub for the last 3 years and feeling pretty disheartened regarding where the job market is. I took a staff / principal / lead engineer role earlier this year that has been an unmitigated disaster. Things came to a head this August when I decided screw the shit market. I need to get out or I'm going to \_\_\_\_\_ my boss. Prepared for a 6-12 month job search, relocating for the role and down leveling. Spent most of August doing the Neetcode 150. Responded to every LinkedIn inbound message. Expected all the conversations to fall through after the first one or two conversations. Instead they all kept going and at one point I was interviewing with 5-6 companies in the same week. Got my first offer today, team lead, top of category startup, fully remote. Genuinely excited about the product and the culture. Sent follow ups to two other fully remote roles I finished full loops for last week. End up sending no outbound resumes and withdrawing from 5-7 conversations that required relocation or were too early in the process. Not trying to brag here, just posting this for someone else out there like me (absolutely miserable at a role thinking that market is too shitty to jump).",145,0.94,29,https://www.reddit.com/r/cscareerquestions/comments/1ocy8l5/your_experience_in_the_job_market_is_going_to_be/,2025-10-22 04:00:52,2025-10-25 01:26:50
1od7t19,Unemployed: Depression is starting to hit,Ready_Plastic1737,cscareerquestions,"background: bs, ms, and been doing ML for 2 yrsOfficially 3 weeks unemployed. My emergency fund is slowly going down. Ive applied to 85 jobs. Ive gotten 2 call backs. One I believe is ghosting me and another Im sure to fail (and its a pre seed startup which would be rough on my mental).I see no light at the end of the tunnel. Im constantly on reddit. My head feels heavy. I just feel like crying.",132,0.87,95,https://www.reddit.com/r/cscareerquestions/comments/1od7t19/unemployed_depression_is_starting_to_hit/,2025-10-22 13:08:28,2025-10-25 01:26:50
1ocen9a,"$21,000/year junior full-stack developer",Insipid-Me,cscareerquestions,"I’m based in Asia, working remotely for a company in CA. I make around $21k/year as a junior full-stack developer. I graduated last year. It’s very flexible, no micromanagement, and the workload varies. I’m wondering how this compares to U.S. payEdit: removed question asking if it’s fair since I know you can’t really compare, mostly just curious what $21k could afford in the U.S. or other countries. Also I’m a girl; people keep referring to me as “he,” but it’s okay.",130,0.72,148,https://www.reddit.com/r/cscareerquestions/comments/1ocen9a/21000year_junior_fullstack_developer/,2025-10-21 14:35:23,2025-10-25 01:26:50
1odpcra,"Haven't landed a job since graduation in dec 2023, Am I not fit for a tech job ?",Adventurous_South874,cscareerquestions,I don't see myself doing anything else other than this honestly. I've always loved tech. I graduated in Dec 2023 and haven't been able to land a job since then. Currently stuck working a dead end job. I'm tired of applying to every job out there only for them ghost me or send me a rejection email if they're being nice. I need to know if my current resume is good. I'm honestly sick of trying. My self esteem as at an all time low. Please help me. resume: [https://imgur.com/a/ojYd49f](https://imgur.com/a/ojYd49f),129,0.91,81,https://www.reddit.com/r/cscareerquestions/comments/1odpcra/havent_landed_a_job_since_graduation_in_dec_2023/,2025-10-23 00:34:19,2025-10-25 01:26:50
1ob1oc5,"My manager said he ""would rather die than deliver this project late""",ScarecrowTEP,cscareerquestions,"Hello all. I'm a software dev with about 6 years of experience. I'm in a bit of a tricky situation and need some advice. I was laid off about a year ago and was super happy to find my current role as a software dev engineer about 4 months ago. My background is mostly backend web applications with some front end work (10%) Upon arrival I found out that I'll be part of a devops team which was not a huge issue for me, I've built CICD pipelines in the past and know the basics of what might be required.Anyway, about 2 months ago I got handed this high visibility project. Basically it is a massive application monorepo and I'm in charge of the pipeline for this project. I've have been struggling to get any support from the team that manages the application. And the person who has become my ""main contact"" is constantly out of office and I'm starting to notice that the delivery target for this pipeline will get delayed. Whenever I bring up any issues to my manager he immediately dismisses my concerns and his rebuttal is ""oh that's not an issue we can resolve it by xyz"" without actually understanding the concern I'm trying to raise. I suppose I could do a better job of not ""accepting"" his answer and trying to make my point clearer but anyway we are kinda past that.The other problem is that I've become a defacto project manager. My manager has told me to assign work to other team members and I've had to create a ""second standup"" outside of my main teams standup where we go over the tickets related to this project. My manager has set an aggressive timeline to deliver this project but I'm seeing that we will not be able to deliver it on his timeline and now I'm getting yelled at for delays. I wasn't really expecting to become a project manager for this role, I don't know how to go about dealing my manager who told me in a 1:1 that he would ""rather die than deliver this project late""Any advice would be appreciated. On the one hand I'm thinking I can use this opportunity to learn about project management etc however I've started doing the ""project manager"" role really close to the deadline so now I'm getting people up to speed etc while we are expecting to go into production asap. But on the other I'm feeling quite overwhelmed and feeling like this was not my expectations for this role.Thanks for any advice in advance!!",129,0.96,69,https://www.reddit.com/r/cscareerquestions/comments/1ob1oc5/my_manager_said_he_would_rather_die_than_deliver/,2025-10-19 21:27:13,2025-10-25 01:26:50
1occvuf,"6 years as a backend developer, feeling stuck and scared AI will make me irrelevant",Alvotimberlake,cscareerquestions,"i’ve been working as a backend developer for 6 years now, mostly in fintech. it used to feel exciting doing things like solving problems, building systems that actually mattered. but lately, i’m starting to feel… replaceable. AI tools are getting faster and better. they’re writing cleaner code, generating tests, even catching bugs before I do. It’s like the parts of my job that made me feel skilled are slowly disappearing. Every sprint feels flatter with more tickets, less creativity.i’m not ready to leave tech, but I can’t shake this fear that I’m falling behind, really. I’ve thought about moving into product or data, but I don’t even know where to start or what’s realistic anymore.how do you keep growing when the ground keeps shifting beneath you? Has anyone here managed to pivot within tech without starting over completely before it’s too late?",95,0.91,46,https://www.reddit.com/r/cscareerquestions/comments/1occvuf/6_years_as_a_backend_developer_feeling_stuck_and/,2025-10-21 13:25:03,2025-10-25 01:26:50
1o9nq5d,Electrical Engineering better than computer engineering degree now?,trademarktower,cscareerquestions,Seems it offers more flexibility. You can do computer hardware design or work at a power plant if the world goes to hell. AI is driving an extreme increase in power generation and energy needs.,96,0.79,150,https://www.reddit.com/r/cscareerquestions/comments/1o9nq5d/electrical_engineering_better_than_computer/,2025-10-18 05:42:05,2025-10-25 01:26:50
1ob9ezh,Lost my SWE job after 8 years. Been looking for 10 months and still nothing. Any advice?,krisko612,cscareerquestions,"I held three different SWE positions at a prominent tech company for the past 8+ years but was unfortunately laid off in January. I’ve been sending out my resume all over the place but I’m struggling to get a lot of bites.I’m a back-end engineer who specializes in C#, .Net and some SQL, however I’m finding that a lot of the companies I’ve been applying for demand full-stack, but the problem is that I have very little UX experience. I had been meaning to get more into that while I was on my job, but I was never really given an opportunity to learn.I started a React course a couple of months ago but I’m having a difficult time maintaining my interest in it. I’m almost considering abandoning my job search and just focusing on the course just to get it done, but even then I’ll still have fairly minimal experience with React.The best results I’ve had so far have been individuals from recruiting companies pinging me on LinkedIn. Most of the time this results in me sending a resume to them for a contract job. I’ve had a few seem really promising but then ghost me after I get the resume. This last week I got in touch with a contractor who was looking for a position that just so happened to be with my first team at the tech company. They fast-tracked me into an interview that ran for far longer than it should have, and actually ran over what was supposed to be a second interview. The recruiter told me they would reschedule the second interview but I haven’t heard back from them. The team wants to have someone in the role by the end of this week but now I fear that even they might not be willing to take me back, even though they have my receipts, are probably using my code, and should know what I’m capable of.Any advice? I really don’t want to have to get a masters degree or change careers if I can help it.",87,0.91,48,https://www.reddit.com/r/cscareerquestions/comments/1ob9ezh/lost_my_swe_job_after_8_years_been_looking_for_10/,2025-10-20 03:27:06,2025-10-25 01:26:50
1oerldf,"All of my once ""peers"" have grown into lead, mgmt roles and I'm stuck in Senior",athens2019,cscareerquestions,"A series of wrong decisions? MaybeStaying too long in my comfort zone? PossibleLack of talent / skill? Possible (this hurts the most)My first website was a Joomla-Drupal website (PHP/HTML/CSS) back in...2006! I was spending my christmas holidays as CS student trying to fix CSS issues and launch my ""unique idea"" (it kind of was but I had no idea how to monetize or grow at my 22 years).A career came relatively easy in the richer northern EU countries with plenty of corporate, slow paced jobs (cruising/rest and vest) (without really vesting anything - no stocks).Looking back I probably wasted my first 5 years of work with minor skill building in CSS. I did get pretty good in CSS though.Enter JS hype circa 2015. I Suddenly realize I was a pixel pusher / HTML-CSS guy who barely understood how jQuery worked and my JS skills were close to 0. hoisting? closures? MVVM? wtf are you talking about? I can tell you whats the difference of relative/absolute positioning and the box model, but you're not really interested are you?A lack of effort in personal projects, lack of studying the proper material, and a choice of relatively comfortable jobs that did not use Angular/Backbone or React (early days) meant I stayed behind.Around 2017 I realize I need to do something. I start grinding JS problems, non stop interviewing, codewars, and other learning platforms. I get into my first full time VueJS projects after a whiteboard recursion test and a coding challenge. Only problem: I hated the role, the product, and the people. I get into two more gigs in VueJS projects for a period of a total of 6 years in Vue. And that means: I get left out of the ReactJS game. One more thing to play catchup on.I wake up on morning and realize it's been 15 years I am coding professionally. Most of the peers I've worked with are in Lead, Senior Manager, Investor (!!) roles.I'm still doing take home code challenges, leetcode live interviews - to which I suck -, and struggling to get decent Senior SE roles.I keep interviewing, and something lands on my lap: I take over the tech of a startup without engineers. NextJS, Mongo, AWS, the whole shebang. I m getting good at harder concepts. Do a little of AWS, deployments, backend. AI is happening, this helps. But I hate the product, and I'm working for half the salary I was making before. I get a contract at a FinTech which paid double. 3 months later I'm let go because of ""reasons"".the job market shitshow is here. The TRUMP / Putin / War / Interest Rate bullshit all are happening. I'm trying to get jobs and interview but my age is catching up on me. My eyes are more easily tired. So is my lower back.My net worth is decent, but not one to say I can ""FIRE"". Nor do I want to.Despair is setting in.",77,0.85,53,https://www.reddit.com/r/cscareerquestions/comments/1oerldf/all_of_my_once_peers_have_grown_into_lead_mgmt/,2025-10-24 07:44:08,2025-10-25 01:26:50
1oa32q9,When should a CS grad start looking at other fields?,Lamereddituser312,cscareerquestions,"I'm thinking heavily about trades right now.3.5 gpa, 1 internship. Graduated a year ago.Not competent enough for tech support. Can't do web dev, can't really use any stacks or frameworks lol. No proper projects.Overall way behind where I should be as a grad, I was not aware I actually had to upskill prior to graduating, because I still managed to interview for internships.",73,0.92,65,https://www.reddit.com/r/cscareerquestions/comments/1oa32q9/when_should_a_cs_grad_start_looking_at_other/,2025-10-18 18:19:05,2025-10-25 01:26:50
1o9zovl,Is it just me or have IDEs and other programs become exponentially easier to install and set up in the last decade?,Awkward_Stay8728,cscareerquestions,"I remember ten years ago, when I was just starting to learn programming, that just installing the IDE would give me headaches. You would have to find a 30min tutorial showing you all of the steps and all of the commands you had to put in the terminal to set it up in your computer; and then of course the video was from 2 years ago, so there were now some missing steps that you had to figure out somewhere else.But now, you just search ""\_\_\_\_ install"", go to official website, download installer, hit next, next, next, install, and there you have it.Is this all just me getting less dumb around computers or has this process actually changed that much in these last years?",67,0.9,36,https://www.reddit.com/r/cscareerquestions/comments/1o9zovl/is_it_just_me_or_have_ides_and_other_programs/,2025-10-18 16:04:30,2025-10-25 01:26:50
1oc6n0s,Is this normal for 2 juniors who are hired together?,bikinbaebuatcurhat,cscareerquestions,"So I'm a junior cloud engineer, working for around a year now in my first job straight out of uni. I was hired with another junior, but he has a masters and 2 prior years of work experience so I was hired for my ""potential"" whereas he was actually selected for his skillset too. I have no problem with that, I'm happy to learn and grow as fast as I can. My manager however, seemingly doesn't want me to forget how much better he is than me. Here are some things that have been said during our 1-on-1s, without me ever mentioning him (for the story's sake, we'll call him Tyler).""You're doing well, you don't need to compare yourself with Tyler."" I never was.""You are doing your tasks and learning a lot of things, *it's not super great but that's what we expect from you*. Of course we can't expect for you to be an expert. Tyler is different, he has had experience before""""You are real junior here to be honest, if Tyler applied for a mid level role he would've gotten in, we just hired him as a way to get him in the company. So don't worry about him.""""You are an early career experiment, we want to see how we can develop people from zero, but Tyler is not really a junior to be honest""Amongst other things. I don't know if I'm just being sensitive to some very normal or mildly negative feedback, but I just don't understand how I'm supposed to respond to these. I feel like I'm having my inferiority drilled in to me again and again, even when me and Tyler are not working in even remotely similar things. I also find it not productive to have him as an arbitrary benchmark, and spend less time focusing on my performance and growth in isolation. My other coworkers are actually giving me plenty of props and good feedback and think I'm learning super fast, but I feel like I'm not perceived as good as I would've been by my manager if Tyler wasn't working alongside. If I was hired for my potential, then why don't we spend most of our attention maximizing it?Another annoying thing is our objective setting. We've done this process twice now. The first time, I made mine quite compact and Tyler made his more elaborated. Our manager said ""we could make yours a bit more like Tyler's, see how he made his a little clearer?"". Yup, absolutely. That makes sense.But the next cycle, he had his very short. Almost lazy. It was literally just a bullet point of the stacks he wants to learn and get to work with. Whereas I elaborated on mine more specifically. But guess what? ""We can make it similar to Tyler's one just so its easier.""So what the hell. I get that he's older, more educated, more experienced and most importantly, he's a he. I don't want to link these treatments to me being the only girl in the team and the youngest member by a lot, but I can't help to think those things play a part.Or, alternatively, I could be overthinking and these are perfectly normal parts of a manager's evaluations. In which case Im happy to learn to get used to it and move on with my life.I have recently had a hiring manager reach out to me for a position in a different company. I've cleared a few interview rounds and they've said they're willing to offer me a 20% pay raise, with a sign on bonus and stock which I don't currently get at my company. I don't wanna leave my current place for some other reasons that compensate the lower pay, but if this treatment isn't normal I might just consider leaving. However, that also lets me know that I don't suck, so I'm really not sure of what to think anymore now.",67,0.9,17,https://www.reddit.com/r/cscareerquestions/comments/1oc6n0s/is_this_normal_for_2_juniors_who_are_hired/,2025-10-21 07:35:50,2025-10-25 01:26:50
1obv98o,"Calling all ""lifers"". Why do you plan on sticking with your current company for the rest of your career?",Easy_Aioli9376,cscareerquestions,Title. What makes you want to stay at your current company as opposed to job hopping and maximizing TC?,64,0.92,79,https://www.reddit.com/r/cscareerquestions/comments/1obv98o/calling_all_lifers_why_do_you_plan_on_sticking/,2025-10-20 22:02:21,2025-10-25 01:26:50
1odmj8n,Temporary oversaturated market or paradigm shift in CS/SE?,TheJoker1432,cscareerquestions,"I know 3 recent CS graduates that are unable to find any job in our region for months nowI fear this is not just a temporary economic phase but a paradigm shift where CS will become an oversaturated field thus bad as an employeeIMO but please disagree: CS is a field with an oversupply of graduates and the days of ""easy"" software/tech developments is overAnd some point most major software markets are saturated. This is something i am the most unsure of but... I feel like e.g. vending machine software is a done deal? Also payment processing? Or video sharing?Additionally from a european/american perspective a lot of SE is outsourced to cheaper wage countriesAnd lastly AI does a lot of coding ""legwork"" just fine and it likely wont get worse at it How will there be more jobs/growing market in CS at any point?",61,0.77,118,https://www.reddit.com/r/cscareerquestions/comments/1odmj8n/temporary_oversaturated_market_or_paradigm_shift/,2025-10-22 22:27:21,2025-10-25 01:26:50
1oaap42,How in your perspective with how the job market right now?,NewLegacySlayer,cscareerquestions,"I know this is asked a lot, I just started actually job hunting again seriously and I think my skills are decent enough and my resume/linkedin is decent as well. The thing is most of it doesn't matter if the market is bad.What's your experience right now and also please say if you're employed or unemployed because it's really looking at it from two different sides",59,0.92,97,https://www.reddit.com/r/cscareerquestions/comments/1oaap42/how_in_your_perspective_with_how_the_job_market/,2025-10-18 23:28:40,2025-10-25 01:26:50
1ocwdr0,Leaving tech and need advice,MetaphysicalPhilosop,cscareerquestions,"I got laid off six months ago from my tech job after many years in the industry as a software performance engineer. Now I’m thinking of leaving tech for various reasons. Job postings have unreasonable demands and employers make you go through hoops and hoops of leetcode style interviews only to get rejected at the end. I’m disillusioned and frustrated by all this and am under pressure to get some income soon.I’m thinking of shifting to AI enablement (using AI tools to solve problems) or technical account manager or business analyst/operations analyst roles. Does anyone have advice on other alternative career paths that might be easier entry?Also I’d like to get a part time job for income while I’m preparing to pivot to one of these career paths. If I could bring in $1500-2000/ month I’d be well off. Looking at data entry or remote virtual assistant/tech support type jobs, but I don’t know how to dumb down my resume which now reeks of overqualification. Should I go to a staffing agency for these type of jobs?Any advice would be appreciated.",50,0.9,60,https://www.reddit.com/r/cscareerquestions/comments/1ocwdr0/leaving_tech_and_need_advice/,2025-10-22 02:28:14,2025-10-25 01:26:50
1ocm2l0,Has anyone here gone from C or B player to A player if they don't have natural ability?,beholdthemoldman,cscareerquestions,"Was reading[ this thread](https://x.com/StartupArchive_/status/1980240080565641668) on Twitter, just an excerpt from Pavel on the Lex Fridman podcast. Realized I am probably a C or B player to my teammates.Pavel says it's often just natural ability and some people just don't have it. I don't think that's true but I am inexperienced and could be wrong. Also, managing a B player is different from being a B player, there may be some dials a manager cannot turn that the employee can only turn within themselves.Anyone here who went from C/B player to A player that can describe how they did it?",48,0.71,55,https://www.reddit.com/r/cscareerquestions/comments/1ocm2l0/has_anyone_here_gone_from_c_or_b_player_to_a/,2025-10-21 19:14:01,2025-10-25 01:26:50
1ocly5t,I have a on-site tomorrow and they gave me 4 days to prep. I got scheduled last Thursday. Do I just do it?,Vivid_Tennis6983,cscareerquestions,"Its for a mid-level role SWE role in NYC TC 200k.System design, 2 coding/DSA, Behavioral. I barely had any time to prep, I have 3.5 YOE as a backend engineer but system design prep is something else. Do I just take it or think of some excuse? Its a good company as well.",51,0.88,24,https://www.reddit.com/r/cscareerquestions/comments/1ocly5t/i_have_a_onsite_tomorrow_and_they_gave_me_4_days/,2025-10-21 19:09:29,2025-10-25 01:26:50
