id,title,author,subreddit,content,score,upvote_ratio,num_comments,url,created_utc,extracted_at
1l5sv28,I want to learn pyhton,Big_Moris,learnprogramming,"Hi guys,I want to start learning full Stack programming using python, so I dig up a few courses in two different collages in my area and I’m having hard time to decide between the two.I made a table to help me summarise the differences between the courses. Can you pls help me decide with your knowledge of what is more important in the start and what would me easer for me to learn later? |subject|College 1|College 2||:-|:-|:-||Scope of Hours|450 hours of study + self-work|Approximately 500 hours of study||Frontend|HTML, CSS, JavaScript, React|HTML, CSS, JavaScript, React, TypeScript||Backend|Node.js, Python (Django)|Node.js (Express), Python (Flask), OpenAI API||Database|SQL, MongoDB|SQL (MySQL), Mongoose||Docker and Cloud|Docker, Cloud Integration|Docker, AWS Cloud, Generative AI||AI and GPT|Integrating AI and ChatGPT tools throughout the course|Generative AI + OpenAI API in Projects||Course Structure|Modular with a focus on Django and React|Modular with Flask, AI, TypeScript|",7,0.69,15,https://www.reddit.com/r/learnprogramming/comments/1l5sv28/i_want_to_learn_pyhton/,2025-06-07 19:20:19,2025-06-11 01:44:20
1l5qsrd,How to learn how to learn the right amount to learn?,realitynofantasy,learnprogramming,"I know weird title.I observe that I have a behavior where I am learning something and I don't understand a part. I try to learn so much about that part then get lost, feel overwhelmed, and don't know where to continue.Say for example, I am learning about how to cook a spaghetti and I don't understand why they put tomatoes, then I go learning things about what tomatoes do on a dish and how they came up with putting in spaghetti.I know that examples does not make sense at all, but I hope you somehow get my point? Like where should I stop learning something? If I don't understand something, is it good to just assume something?",8,0.79,15,https://www.reddit.com/r/learnprogramming/comments/1l5qsrd/how_to_learn_how_to_learn_the_right_amount_to/,2025-06-07 17:51:07,2025-06-11 01:44:20
1l4cvf6,I have a strong interest in both C and C++. Help deciding which path to go down? Thanks!,Crapahedron,learnprogramming,"So I want to learn programming and from I've seen from people I know, the biggest motivator that keeps them going is the ability to build a personal passion project or to contribute to an open source project they themselves use / consume / enjoy. I do not have much interest in web development or some of the other traditional things beginners get involved in, or are recommended to start at, but rather in some open source projects that I am very fond of. Some are C language developed projects, some are c++ (open source games mostly).So here's where I'm stuck: From what I gather, c++ is more difficult overall for a beginner to learn than c, but the open source projects I would be interested in that are in c are likely more difficult to get a handle on as a beginner. So I'm not sure if I go with the higher difficulty lang or higher skill-floor projects? Secondly, I'm on an absolute poopoo of a laptop :D it's this old thinkpad I'm going to strip and put linux on. It has an SSD but is an old i3 (dual-core 2.1GHz Intel Core i3-2310M CPU) from like 12 years ago or whatever (thinkpad x220i aww yeah) so there will be some hardware limitations. (another checkmark for C maybe?)Thankfully, it's 2025 and there is a TON of resources online for getting started with both languages, and discord servers to support it are just amazing. (wish I had this stuff 20 years ago when I tried this the last time!) However I want to try and get as deep as I can with learning CS and contributing as quickly as I can so I want to focus on just one technology or stack. Suggestions or input? Thanks!",8,1.0,13,https://www.reddit.com/r/learnprogramming/comments/1l4cvf6/i_have_a_strong_interest_in_both_c_and_c_help/,2025-06-05 22:41:39,2025-06-11 01:44:20
1l3pqr6,Wondering about what to learn?,z9t02iefwj165ko642xj,learnprogramming,"Hi, I'm wondering what programming languages would be best to try and learn and what their primary usage is and where to learn them. Right now I'm 18 and doing a course in IT. I'm learning C# through that course right now and I love it. I'm not good at programming, I'm very new to it, however programming and gaming are the only two things I can just lose time on. When I'm working on programming something I can just completely focus and zone in, and straight code for like nine hours, (I haven't tried any longer than that as of now). Next year I plan to go to university and study computer science (Don't worry I only plan on using that degree to get a cybersecurity job as it's the closest thing to a cybersec qualification where I live, also compsci is not oversaturated where I live unlike in America.) Overall I'm quite interested in cybersecurity and programming, and would like to get a career relating to one of those some day. So that's my career plan but right now I'm just wondering what should I learn? I have literally zero idea. I'm already learning C# but would love to learn more, and it would drive me if they had a specific use that I could use, because to be quite frank I don't want to learn a language that'll be useless to me.",8,1.0,11,https://www.reddit.com/r/learnprogramming/comments/1l3pqr6/wondering_about_what_to_learn/,2025-06-05 03:57:57,2025-06-11 01:44:20
1l5dwkg,New in C.,JeremyUwu1118,learnprogramming,"Hey guys! I am a junior high student who learn JavaScript and java for years. And now I am trying to code the ""real stuff"" in programming world as C being a compiled language to be able to run on all the hardware. I have there most of the thing in stdio.h but now I am trying to code a Kernal, but I am not familiar with such a hardware closing related language such as pointer and thing, can anyone help me? Thank you so much.",7,0.74,11,https://www.reddit.com/r/learnprogramming/comments/1l5dwkg/new_in_c/,2025-06-07 06:08:10,2025-06-11 01:44:20
1l3zn4i,Java tutorials reccomendations,sebastianmicu24,learnprogramming,"Hi, could you help me find some useful tutorials to learn java?**Context:** I have experience with web development, but i'm new with compiled languages: I only know the basics of Java (hello world level). I started doing some quantitative analysis in Fiji/ImageJ and i vibe-built a basic plugin to streamline the workflow. Now the project became much more promising than anticipated so I want to re-write it without the help of AI to understand it better. **Needs:** * Not entry-level (I don't want to re-learn what's an array or a variable)* Covers best practices (I want to build a public repo and I don't want to be judged lol)* Doesn't need to be recent (I have to work with java 8)* It's free or costs at most a few bucks",8,0.85,1,https://www.reddit.com/r/learnprogramming/comments/1l3zn4i/java_tutorials_reccomendations/,2025-06-05 13:47:59,2025-06-11 01:44:20
1l3ttim,Learning DSA (non programming),vi0411,learnprogramming,"Hi everyone, I know this is something discussed often, but hear me out. I want to learn Data Structures and Algorithms from scratch and not in the context of programming/leetcode/for the sake of interviews.I really want to take my time and actually understand the algorithms and intuition behind them, see their proofs and a basic pseudocode.Most online resources target the former approach and memorize patterns and focus on solving for interviews, I would really like to learn it more intuitively for getting into the research side of (traditional) computer science.Any suggestions?",8,0.9,25,https://www.reddit.com/r/learnprogramming/comments/1l3ttim/learning_dsa_non_programming/,2025-06-05 08:15:27,2025-06-11 01:44:20
1l2xlex,"DSA for AIML student-C,C++,Java, Python?",Ill_Help_7132,learnprogramming,"Hey everyone!I’m currently pursuing a degree in Artificial Intelligence & Machine Learning (AIML), and I’ve reached the point where I really want to dive deep into Data Structures and Algorithms (DSA).I’m a bit confused about which programming language I should use to master DSA. I’m familiar with the basics of:JavaCC++PythonHere’s what I’m aiming for:Strong grasp of DSA for interviews and placementsTargeting product-based companies like Amazon, Google, etc.Also want to stay aligned with AIML work (so Python might be useful?)I’ve heard that C++ is great for CP and interview prep, Java is used in a lot of company interviews, and Python is super readable but might be slower or not ideal for certain problems.So my question is:Which language should I stick to for DSA as an AIML student who wants to crack top tech company interviews and still work on ML projects?Would love to hear your experiences, pros & cons, and what worked for you!Thanks a lot in advance :folded_hands:",7,1.0,3,https://www.reddit.com/r/learnprogramming/comments/1l2xlex/dsa_for_aiml_studentccjava_python/,2025-06-04 05:27:47,2025-06-11 01:44:20
1l802pr,"i started studying web development a year ago , but i have poor technical communication in interviews, how should i improve that ?",imFAILINGcollege6,learnprogramming,"its like i understand the concept but i dont have the right keywords to talk about it or i don't even understand it deeply , although i build good websites with clean code , should i start learning all over again from the beginning?",7,1.0,15,https://www.reddit.com/r/learnprogramming/comments/1l802pr/i_started_studying_web_development_a_year_ago_but/,2025-06-10 14:25:05,2025-06-11 01:44:20
1l7p90o,DSA in Go or C++,CODSensei,learnprogramming,Well basically I am starting dsa and I am confused should I do dsa in Golang or C++. I know golang and c++. What would be the best choice for interviews or does it even matter. I am third year college student. That's it,6,0.75,16,https://www.reddit.com/r/learnprogramming/comments/1l7p90o/dsa_in_go_or_c/,2025-06-10 03:57:38,2025-06-11 01:44:20
1l76z51,Basic industry questions,CalamityPhant0m,learnprogramming,"Hi, I’ll try to make this quick. I’m 40 and have always secretly wanted to be a “computer guy”. It intimidated me, like a lot of people probably feel, so I never pulled the trigger on learning.I built my first computer a couple months ago and it gave me some more knowledge of hardware and how computers work, and now I’d genuinely like to learn programming. I wanted to ask if CS50 or an Intro to CS50x would be the wisest route to get my feet wet, as I’m not entirely sure what my end goal would be, career wise, but I’m willing to do the work.I’m fairly bright, just never bothered learning or seeking the knowledge out. I’m in a skilled trade now and to be honest my body and degenerative back issues won’t sustain that for the next 20 years. I expect it will be insanely challenging, especially at my age, but I’m up for the challenge, I just need to be pointed in a good starting direction. Thanks for any help in advance",6,1.0,9,https://www.reddit.com/r/learnprogramming/comments/1l76z51/basic_industry_questions/,2025-06-09 14:57:42,2025-06-11 01:44:20
1l720js,Improve/learn skills as programmer,D3vil_Dant3,learnprogramming,"Hello. I'm here to ask for some tips and advices for both personal and carrier growth. Some years ago, after university, I had to start from beginning to change my work carrier and for the first time, I've approached to the coding world. I love it. I took a master in data science, then I continued to study, c# and unity for game developer. I was hired as data scientist but few months later, the project ended and I was moved in another segment in the same society, as solution architect, with something that really wasn't suit for me. So, I spent some months for a master in devops and I finally could ask to change another team, this time in a team of integration. My team works as middle ware, and I could learn a lot about microservices, api, Aws tools and such that we have as infrastructure. So, I decided to stop trying to learn from others and start study, again, in order to have a robust knowledge of the entire process, end to end. So, with the chance to see how some lambda function (Aws) was integrated into other tools, I asked to write a new one that was needed for a new application. Following all pipeline and integrate it into cloud watch. Was a good work (both cause I used cdk libraries, but mostly cause I saw how pipelines really work in production, as a player and not just spectator). But in the end, the more I learn, the more I find out new stuff, that probably should have been discovered ten years ago at the university. So, right now, I'm trying to study about spring boot and Java, nodejs, maven, camel and how to make whole works together, in order to write good api/web app. Now, I feel full of stuff I don't know, and in my future I would like to have the chance to work as software dev, solution architect or whatever, cause I feel like all these worlds overlap somehow, somewhere.That said, I kindly ask for some suggestions:1)where should I start?2)what should I prioritize? 3)im not gonna lie, I'm using a lot chatgpt or Claude to study, like asking focused questions, like usage, best practice, asking for exercises and dig down every time I have a doubt, but, because I always been a self taught in this world, I have no idea if there are books, documentations or whatever that can be exhaustive and valid.I know can be confusing, but I'm very confused right now. The moment in your life when you realize you know enough to be where you are, but not enough to go much further. Thanks for your time",6,0.88,3,https://www.reddit.com/r/learnprogramming/comments/1l720js/improvelearn_skills_as_programmer/,2025-06-09 11:10:37,2025-06-11 01:44:20
1l69vmk,How to add a blog page to my website,Supreme_Hanuman69,learnprogramming,"First of all I'll give some context:Website is made using a template in HTML, CSS and JS. Its hosted on Vercel with a custom domain. Its not a static website and uses a server behind the scenes for stuff like ""serving"" the html files from a public folder and contact.html so that people that visit the website can send us messages (That's also why its not hosted on Github). It uses NodeJS, ExpressJS and other Javascript libraries for having the server capabilities. Now I have not really studied and worked on ExpressJS and all but I was able to vibe-code it (I know I'm sorry but its my dad that wanted the website really quick).Fast forward to present day and my dad wants a blog page in the website. Now I asked copilot in VSCode to do do it for me but turns out it got really complicated. I setup a database schema in supabase connected to vercel and then it started spewing out all these lines of code that didn't work at all and I got confused. (`POST /api/blog`, `GET /api/blog` etc)So what my dad wants is that he should be able to make posts preferably with images and thats it. When I first heard of it, I thought maybe he would also like people to be able to comment and like on posts as well. Well he has clarified that he just wants the first part only. Now the thing is how should I go about it. I have 2 choices:1. Use something like what copilot gave me (Use GET methods along with response and requests) (Gonna have to learn it from YT tutorials and docs since ""AI slop"")2. Create a simple posts.json file and loading the posts from that website using JS script. (Only issue would be how to add images in a json file; maybe base64 encoding would work; base64 is quite heavy though). And then create a Flutter app that allows my dad to create, edit and delete posts and when he clicks on submit, it would automatically get pushed onto my vercel repository in production.First approach seems better to make it look like a proper production application whereas the second approach is a just a make-shift thingWhich one do you think I should work on? And if there's something you'd like to add, please tell me.PS: I'm more of a machine learning kind of guy and not frontend and all",5,0.86,2,https://www.reddit.com/r/learnprogramming/comments/1l69vmk/how_to_add_a_blog_page_to_my_website/,2025-06-08 11:24:14,2025-06-11 01:44:20
1l67r1u,Need Advice Please,SubstantialMotor8171,learnprogramming,"I am 17, and I have started learning programming I am doing Harvard's cs50 right now and I have completed 4 weeks of it till now , I wanna know is there something else i should do side by side or any advice any tip I would really like to know from seniors",7,0.89,12,https://www.reddit.com/r/learnprogramming/comments/1l67r1u/need_advice_please/,2025-06-08 09:02:02,2025-06-11 01:44:20
1l4pt4c,Is it normal to feel kind of lost after learning OOP and SOLID?,goodguyseif,learnprogramming,"I just finished a course that covered OOP and SOLID principles, and while I *think* I understood most of it while watching (stuff like SRP, OCP, Dependency Inversion, etc.), now that it’s over… I honestly don’t know what to do next.I’m sitting here like, “Okay… now what?” I don’t have a clear idea of how to apply these concepts in a real project or when I *should* be using them. It feels like I’ve been handed a bunch of tools, but no clue what to build.Is this a normal feeling? Did anyone else go through this after learning OOP and SOLID?I’d really appreciate any advice:* How did you go from understanding the theory to actually applying it?* Any good projects or tutorials you’d recommend for practicing?* Or even just personal experiences — what helped it all *click* for you?Would love to hear your thoughts. Thanks :folded_hands:",6,0.64,17,https://www.reddit.com/r/learnprogramming/comments/1l4pt4c/is_it_normal_to_feel_kind_of_lost_after_learning/,2025-06-06 11:14:58,2025-06-11 01:44:20
1l3xilp,Is “negative space programming” just type-safe programming in context?,Gemini_Caroline,learnprogramming,"I’ve seen a lot of talk lately about “negative space programming” like it’s this new paradigm. But isn’t it really just a way of describing what type-safe programming already encourages?Feels like people are relabeling existing principles—like exhaustiveness checking, compiler-guided design, or encoding constraints in types—as something brand new. Am I missing something deeper here, or is it just a rebrand?Would love to hear others’ thoughts, especially from folks who’ve actually applied it in real-world projects.",7,0.89,18,https://www.reddit.com/r/learnprogramming/comments/1l3xilp/is_negative_space_programming_just_typesafe/,2025-06-05 12:07:14,2025-06-11 01:44:20
1l7swrf,In-background Learning,Fraan3D,learnprogramming,"Hello,For past year and half im working hard on learning development with [TheOdinProject](https://www.theodinproject.com/) (MERN Stack) so i can be more ready to get a developer job in the future.Usually when working on my day job im lucky that i have freedom to watch whatever i want in the background.Currently its Jonas Schmedtmann JS Course, but its coming to an end.What course should i take next?***Disclaimer: I know that courses are not good, and projects are more important. Thats why im actively ""studying"" with TOP (project based learning) and this is just to immerse myself even more***",6,0.87,3,https://www.reddit.com/r/learnprogramming/comments/1l7swrf/inbackground_learning/,2025-06-10 07:49:45,2025-06-11 01:44:20
1l70xyf,Application first or concept first?,alex_sakuta,learnprogramming,"Modern programming languages, especially dynamic languages have a really good thing going for them which is there is a library for pretty much everything you want to do which is wrapper that makes it easy for you to do the thing without ever having to understand the core architecture of how something is happening.For example, talking about JS env: Need servers? Express. Need sockets? Socket.io. And so on.This makes it really easy tod develop application quickly and unfortunately that's all that an organisation would care for too.In my resume if someone sees a chat application, they don't care if I implemented the web socket architecture or I just used a library. They may ask that stuff in an interview and still not mind that I used a library.Now, I have found out that, that I'm really dumb. I had been using web servers for an year in JS and only recently I figured out the entire architecture when I had to build an HTTP server from scratch in C. It has been a huge challenge and still is.I also learnt how to implement an event loop. But would any company care about these skills if I don't have any decent project? I don't think so.But, keeping my own subjective thinking and personal experiences aside, I had a doubt.If I learn how to apply a concept without first trying to understand it completely, is this a good strategy?Like because I learnt Express, I had an easy time creating macros for implementing routes in my C HTTP server. I just imitated a syntax similar to that in C.On the other hand, had I never used Express, I don't think my abstraction of routes would be like the way Express has and don't know if it would have been this good which it is now.So, clearly the learning of the application helps the learning of architecture just as much as learning the architecture helps learning the application.With this, what do you suggest:- Learn application first, no matter how you do it.- Learn architecture first and then design your own and learn application through that instead of a simply using libs.- A mid ground, learn architecture, learn application using whatever tool is necessary and then if one wishes, one can design their architecture from scratch as well.",7,1.0,1,https://www.reddit.com/r/learnprogramming/comments/1l70xyf/application_first_or_concept_first/,2025-06-09 10:06:52,2025-06-11 01:44:20
1l67h8u,Question about PayPal Payouts API in sandbox (always pending),Working_Case_5953,learnprogramming,"Hi, I’m testing the PayPal Payouts API in the sandbox environment for a development project.I noticed that payouts always return a `PENDING` status and never move to `SUCCESS`, even though the API response shows no errors. I’m using valid sandbox Business and Personal accounts, and the receiver email is correct and verified.This is just for testing purposes. Is this normal behavior in sandbox, or am I missing a setup step?Thanks in advance for any help!",5,1.0,0,https://www.reddit.com/r/learnprogramming/comments/1l67h8u/question_about_paypal_payouts_api_in_sandbox/,2025-06-08 08:42:39,2025-06-11 01:44:20
1l3pu4o,I just took my Computer Architecture final and I still don’t understand assembly code. Any book recommendations?,Opposite_Ad_534,learnprogramming,"Exactly with the title says. Assembly code is so interesting, and I want to understand it so badly, but it’s just not clicking for me. If you have any books or video recommendations, then I’d love to have them.",5,1.0,13,https://www.reddit.com/r/learnprogramming/comments/1l3pu4o/i_just_took_my_computer_architecture_final_and_i/,2025-06-05 04:02:48,2025-06-11 01:44:20
1l3co1e,Struggle to think abstractly,Warmspirit,learnprogramming,"I have found that through speaking with peers and though my own attempts at projects that reasoning about programs / software / ideas is hard for me. For example, breaking down a project into different components and thinking about them *doing* things is difficult. I do much better with in-depth explanations; if I were using a library that abstracted away some task I would be more focused on *how the library works* than just accepting that it does a job and using it. I feel as though this is a big issue with my skills as a programmer. I particularly struggle with OOP and abstracting what I want from a system into various aspects. Concepts as a whole tend to confuse me at first and I need a real concrete understanding before ""getting it"". This leads to me feeling stupid for taking so long whereas others seem more able to understand new concepts, regardless of the topic being taught (although that could just be perceived). What steps can I take to improving this skill and understanding / reasoning with concepts in a way that doesn't require in-depth knowledge? I hope my question comes across clear, but please let me know if other wise and I will try and clear that up.Many thanks",4,0.76,4,https://www.reddit.com/r/learnprogramming/comments/1l3co1e/struggle_to_think_abstractly/,2025-06-04 18:10:26,2025-06-11 01:44:20
1l347cf,What's a good API for real-time commercial flight tracking?,neha-makcorps,learnprogramming,"I’m building a project that tracks commercial flights and displays key info like departure/arrival airports, scheduled vs. actual times, delays, and gate/terminal assignments.Anyone know a good flight tracking API that’s affordable and gives consistent data for global flights?",5,1.0,6,https://www.reddit.com/r/learnprogramming/comments/1l347cf/whats_a_good_api_for_realtime_commercial_flight/,2025-06-04 12:25:10,2025-06-11 01:44:20
