id,title,author,subreddit,content,score,upvote_ratio,num_comments,url,created_utc,extracted_at
1jtezgl,Who am i supposed to talk to while learning?,Deep_Construction856,learnprogramming,"for some background, i’m a senior in high school that’s about to graduate and go to college for computer science/engineering. i currently live in a mid size town in the deep south (<15k people.) I’ve been taking more time to try and make it past the fundamentals of programming for once. I spent a long time in a loop with no motivation just doing the most basic menial things with programming possible and it led to being bored very quickly. Now I have a lot of motivation and am able to pick what seems like a reasonable project and start. Unfortunately i haven’t had anyone in my life that even cares about technology, much less knows about it, to talk to. This has led to me making what is likely huge time wasting mistakes but i cant pick out which of my decisions are those mistakes.It should be easy to just find a community online and insert myself into it and make some friends with people who have made/are making these mistakes and can help guide me but it isn’t. Finding a community is hard enough but finding one where I don’t feel so immensely out of place and stupid compared to everyone else has been impossible. I cringe at the thought of even attempting to articulate my issues to these people who seem like they’re so advanced that it makes no sense that they had to spend any significant time making stupid mistakes at the start.",17,0.95,7,https://www.reddit.com/r/learnprogramming/comments/1jtezgl/who_am_i_supposed_to_talk_to_while_learning/,2025-04-07 06:44:32,2025-04-13 02:54:54
1jwnu2p,The Four Horsemen of Personal Programming Projects,He0x7D1,learnprogramming,"Hello longtime reader, first time poster!So I have recently completed a compiler for an optional module in university. I have never done any project like that in terms of the complexity and difficulty. It was hard at first but theory help me out a lot when trying to understand what I needed to do.I have long wanted to build a toy OS of my own from scratch if I can and this would I guess top the compiler in the amount of work I need to do and of course the complexity. This got me thinking what would be more difficult than an OS? Is this the hardest it would get? I am just a cyber security student, what do I know of these things.So instead of just asking what could be harder I thought I would make it fun. What do you consider the Four Horsemen of Programming Projects? It can be general or tailored to yourself and what you have experienced in the past. You can add on to mine or make your own one of course. I only have two since I don't at all have much experience here lol.I'll start:\- OS from scratch(boot loader and kernel etc.)\- Compiler\- ???\- ???",12,0.82,16,https://www.reddit.com/r/learnprogramming/comments/1jwnu2p/the_four_horsemen_of_personal_programming_projects/,2025-04-11 11:44:54,2025-04-13 02:54:54
1jw8es3,I feel like I got imposter syndrome how do I get up to speed?,Knyghttt,learnprogramming,"I’m a junior software engineer/data engineer (python & data) and I hardly ever coded before. I moved into more software due to working in tech before (IT support)I only started work a week or 2 ago and idk if I’m dumb, if I need to lock in and program 5 hours outside of work everyday or if this is a normal thing? Does anybody have some advice. My team are generally all helpful and they know I’m a junior but I don’t want to disturb but I do ask a heck of a lot of questions",14,0.78,14,https://www.reddit.com/r/learnprogramming/comments/1jw8es3/i_feel_like_i_got_imposter_syndrome_how_do_i_get/,2025-04-10 20:49:11,2025-04-13 02:54:54
1jto61y,"For making indie games, which is a better programming language? C++, or Python?",Open_Egg_1925,learnprogramming,"What I know, which could be false, is that C++ is better for AAA games and high-end games, while Python is generally better for indie games. However, isn't Python only able to make 2D games? Can you even make a game with amazing graphics and complex gameplay using Python? Or is that a C++ thing? The game I have in mind that I want to eventually make is a 3D free roam game. Simple design for the environment and characters, so not something very detailed and memory consuming. Is C++ better for this because of the 3D choice, or is Python better because it generally is better for indie games? What do you suggest?",13,0.67,46,https://www.reddit.com/r/learnprogramming/comments/1jto61y/for_making_indie_games_which_is_a_better/,2025-04-07 15:34:27,2025-04-13 02:54:54
1jug6mo,Back with v2! My son (still 9 years old) updated The Gamey Game based on your feedback.,veesahni,learnprogramming,"My son has been learning to code. Today he’s releasing v2 of his math battle game, The Gamey Game. He’s excited to share it with you all!The Gamey Game v2: [https://www.armaansahni.com/game-v2](https://www.armaansahni.com/game-v2)He’s also written a blog post about how he made this game: [https://www.armaansahni.com/how-i-took-the-gamey-game-to-the-next-level/](https://www.armaansahni.com/how-i-took-the-gamey-game-to-the-next-level/)He originally released v1 of the game a few months ago and got great feedback from this community. A big thank you for the feedback, it led to some great conversations and provided a ton of motivation for him to keep moving forward.v2 was built using HTML, JS, CSS. All written by hand in VSCode. No frameworks, no build steps. He made all the graphics himself and also recorded all the audio.Note that both parents are programmers so he has lots of hints and guidance along the way. He also leverages Google Gemini to answer coding questions (syntax, how to do something, etc), but the LLM isn’t coding for him and it isn’t available to him directly in his editor.For the blog post, we talked about the target audience and came up with an outline.  He then dictated his blog post directly into Google Docs.  Finally, we went through a few rounds of feedback/edits (for more clarity, more words, etc).Other links:v1 Game Link: [https://www.armaansahni.com/game](https://www.armaansahni.com/game-v2)v1 Blog Post: [https://www.armaansahni.com/how-i-coded-a-game-using-ai/](https://www.armaansahni.com/how-i-coded-a-game-using-ai/)v1 Discussion Thread: [https://www.reddit.com/r/learnprogramming/comments/1elfo3q/my\_son\_9\_years\_old\_coded\_a\_game\_in\_plain/](https://www.reddit.com/r/learnprogramming/comments/1elfo3q/my_son_9_years_old_coded_a_game_in_plain/)",13,0.89,3,https://www.reddit.com/r/learnprogramming/comments/1jug6mo/back_with_v2_my_son_still_9_years_old_updated_the/,2025-04-08 15:21:38,2025-04-13 02:54:54
1jtj2au,learn networking,Money-Suggestion5310,learnprogramming,"Hey folks! I’ve been learn about networking and documenting what I learn along the way in a GitHub repo. It’s a work-in-progress, but I’m keeping it clean, simpleWould love feedback or to connect with others learning the same stuff.my repo : [network-concepts](https://github.com/yosefther/network-concepts)",12,0.93,1,https://www.reddit.com/r/learnprogramming/comments/1jtj2au/learn_networking/,2025-04-07 11:34:15,2025-04-13 02:54:54
1jt7ufo,How do you manage working across multiple PCs while keeping your dev workflow seamless?,Z00fa,learnprogramming,"I’m looking for some insight into how other developers handle working across multiple machines without breaking their flow.Here’s my situation: I have a desktop built for gaming with a full setup of peripherals that I really enjoy using. At the same time, I’ve traditionally done most of my coding on a laptop when I’m away from home. Now I have the flexibility to use both—and I want to make that switch as smooth as possible.I initially thought about just swapping peripherals between the two, but realistically, I know I won’t keep up with that. I already use Git regularly, so version control is covered. The issue is more with environment-specific stuff—secrets, config/property files, local services, etc.—that I can’t or don’t want to push to GitHub.So for those of you juggling multiple dev environments:* How do you keep things in sync across machines?* Are you using dotfile managers, containerization, rsync, synced volumes, or something else?* How do you deal with sensitive files or machine-specific configs?Would love to hear how others approach this.",12,0.89,33,https://www.reddit.com/r/learnprogramming/comments/1jt7ufo/how_do_you_manage_working_across_multiple_pcs/,2025-04-06 23:45:31,2025-04-13 02:54:54
1jwhnym,Correct mindset for (learning) unit testing,sltrsd,learnprogramming,"When there is need to write unit tests, how and what should I think?I have been trying to learn unit testing now almost ten years and it still is one big puzzle for me. Like why others just understands it and starts using it.if I google about unit testing, 99% of results is just about praising unit testing, how awesome and important it is and why everybody should start using it. But never they tell HOW to do it. I have seen those same calculator code examples million times, it has not helped.Also mocks, stubs and fakes are things I have tried to grasp but still they confuse me.How to define what things can be tested, what cannot, what should be tested etc?Is it just about good pre planning before starting to code? Like first plan carefully all functions and their actions? I am more like ""just start doing things, planning and theoretical things are boring.""",10,0.82,11,https://www.reddit.com/r/learnprogramming/comments/1jwhnym/correct_mindset_for_learning_unit_testing/,2025-04-11 04:35:32,2025-04-13 02:54:54
1jw7omo,How do you keep up to date with the latest coding trends?,Imnotneeded,learnprogramming,Websites / Blogs / Youtube?Thanks!,10,0.79,5,https://www.reddit.com/r/learnprogramming/comments/1jw7omo/how_do_you_keep_up_to_date_with_the_latest_coding/,2025-04-10 20:18:41,2025-04-13 02:54:54
1jut04u,"New programmer, who isn’t great with maths",17skum,learnprogramming,"Hey! For context, I am not academically gifted, during school I was very naive, prioritising hanging out with friends instead of attending classes etc, and for many other reasons; I didn’t do very well in school and I absolutely suck at maths. I have been a self taught 3D artist for the past three years, and within the last year I found what I wanted a career in, which was VFX (Compositor to be specific), so I’ve been learning a ton from my mentor and online resources. At the moment I work full time as a chef at a local restaurant whilst studying Compositing and recently Python on my free time.I had chosen to learn Python alongside Compositing to hopefully leverage my career in VFX, and Python so far had been quite a lot of fun. Although I’ve found that through learning to code, there are quite a bit of maths. For example, recently I’ve coded a tip calculator (a challenge from the 100 days of code by Angela Yu)On this particular challenge- I didn’t struggle with the coding aspects, but instead with understanding the math formulas to calculate tip and percentage. Which I took it upon myself to learn through the internet. My main question would be, since I am very bad at maths, would it be best for me to re-learn maths on the side also? Or learn the math formulas as I encounter them through the journey of learning to code? Edit: I want to specify that in the end goal, I’d like to write automation systems and tools for the software I use (Nuke by The Foundry), or perhaps dabble into coding shaders within game engines (unity or unreal engine) But ultimately be able to make tools and automations of repetitive actionsEdit2: I really appreciate the inputs! Thank you :)",10,0.86,20,https://www.reddit.com/r/learnprogramming/comments/1jut04u/new_programmer_who_isnt_great_with_maths/,2025-04-09 00:29:55,2025-04-13 02:54:54
1jtv4hu,Career switch from medicine into tech,Fit-Following-4918,learnprogramming,"(Not-USA)I'm a 4th year med student and after years of just pushing my doubts away I realised I don't want to do this anymore . I did it because I didn't have any idea what else to do. I can barely even finish the degree, I dread it going back to uni and exams so much I might actually drop out right now. I can't do something I despise.How do I get into tech . I can code for hours on end or be on a problem for hours and not get tired whereas medicine is just memory and I hate it now. Ik getting in without a degree is hard so I m trying to get an apprenticeship(uk) where they train you and teach you. What certificates can I get to increase my chances , it's not gonna be easy but atleast I have discipline to study.",9,0.63,35,https://www.reddit.com/r/learnprogramming/comments/1jtv4hu/career_switch_from_medicine_into_tech/,2025-04-07 20:16:16,2025-04-13 02:54:54
1jxkgfu,Multiple languages?,demonic_spirit,learnprogramming,"Btw I am not looking at learning a 2nd language, but was just thinking, how do you guys do it. As sitting through a beginners course is probably quite tedious. Do you just read some documents for syntax and Google when stuck. Are there courses for this, just course as you would already know how a for loop works, you just have to know the syntax?Just curious is all.",9,0.91,20,https://www.reddit.com/r/learnprogramming/comments/1jxkgfu/multiple_languages/,2025-04-12 15:55:33,2025-04-13 02:54:54
1jwvunt,"""Internship dilemma: Should I focus on Web Dev (JavaScript) or AI/ML (Python) for my internship?""",Zestyclose-Intern522,learnprogramming,"Hi, I'm a final-year student with a background in C++, HTML, and CSS. I'm currently doing my final year project in Generative AI and taking courses in Machine Learning and Data Science. I need to do an internship, but I'm torn between learning Python for AI/ML or JavaScript for Web Dev.I have a short time to prepare, and I want to know which path would be more beneficial for my career. How can I stand out in either field, and what are some essential skills or projects I should focus on?",8,1.0,9,https://www.reddit.com/r/learnprogramming/comments/1jwvunt/internship_dilemma_should_i_focus_on_web_dev/,2025-04-11 17:43:24,2025-04-13 02:54:54
1jt7ddt,Should I go into cybersecurity?,Sad-Statistician9494,learnprogramming,"I am a college freshman compsci student, planning to concentrate in cybersecurity. Over the past 2 semesters, I have realized that I really really enjoy programming, building things. Its making me question if cybersecurity is right for me. I feel like I've heard sentiments that programming is a ""good tool"" for people in cyber, but that the job would not primarily consist of programming. Does anyone have any input on this?",7,0.74,4,https://www.reddit.com/r/learnprogramming/comments/1jt7ddt/should_i_go_into_cybersecurity/,2025-04-06 23:21:31,2025-04-13 02:54:54
1jxor7l,Which Programming Course?,ProAmara,learnprogramming,"I’m a cybersecurity student currently and am thinking about working to master Python at least as a software engineering path, in case cybersecurity doesn’t work out. Are there any good Udemy courses on Python or even software engineering?",7,1.0,10,https://www.reddit.com/r/learnprogramming/comments/1jxor7l/which_programming_course/,2025-04-12 19:05:08,2025-04-13 02:54:54
1jvb8a3,How would you approach becoming good at programming when you're struggling with discipline and understanding?,Sadiistic,learnprogramming,"Hey everyone,I'm currently close to finishing my Associate Degree in Software Development (a 2-year bachelor track with an interim diploma), and I’ve been offered the opportunity to complete my full Bachelor of Science in Computer Science in just two more years.Here’s the problem: I’m not that good at programming.I’m doing an internship right now, and it’s going okay, but I know that the last two years of the bachelor are the most challenging. I want to be good at programming. I really do. But I often quit after just a few tutorials because I don’t understand the material well enough. I also know that I should stop just watching tutorials and actually start *building* things on my own—but I never really get to that part.Lately, I’ve been thinking: maybe I should try building something I actually find fun—like a Minecraft mod in Java. Maybe that would keep me engaged and motivated. I enjoy Minecraft, and I think making something small but real could help me break the cycle.I genuinely want to learn how to code and become proficient, but I’m noticing a pattern: I get demotivated easily, I procrastinate, and I don’t build the discipline to push through. It’s a bit of a contradiction—I *want* to be good, but I don’t manage to get myself to actually *do* the hard parts.I would really appreciate advice or guidance. Here are my specific questions:* How would you approach learning to program properly when tutorials alone don’t work anymore?* How do you build discipline when you often lose motivation or feel stuck early on?* Would you still recommend finishing the last 2 years of a CS bachelor if programming doesn't come naturally to you?* Are there any beginner-friendly project ideas that helped *you* break the tutorial cycle?* Do you think making a Minecraft mod (or something similar I personally enjoy) is a good way to get into coding?* How do you push through when you're in that “I want to learn, but I suck at it” phase?Any personal stories, tough love, or practical tips would really help me out.Thanks in advance!",7,1.0,8,https://www.reddit.com/r/learnprogramming/comments/1jvb8a3/how_would_you_approach_becoming_good_at/,2025-04-09 17:17:22,2025-04-13 02:54:54
1jtgor0,What's the best school for learning to code with hands-on lessons?,Sea_Map_3956,learnprogramming,"I'm going to graduate from high school at the end of the year, and I'm wondering which school I'm going to go to to further my passion for dev.I've seen that there are campuses like Epitech or 42 (Xavier Niel), but several people have told me about ALGOSUP (created by the founder of Ledger), which offers courses that are 100% English and above all practice-based.I'm not sure.What do you recommend?",6,0.81,4,https://www.reddit.com/r/learnprogramming/comments/1jtgor0/whats_the_best_school_for_learning_to_code_with/,2025-04-07 08:51:56,2025-04-13 02:54:54
1jxmzho,How to start C,spectre007_soprano,learnprogramming,Hey guys i want to learn C from scratch like everyone is telling it is a low level programming language so I want to learn C to get a good grasp of how computers actually work. I am planning to learn about operating system. Should I start C after learning about operating systems so I can understand it better.,6,0.88,20,https://www.reddit.com/r/learnprogramming/comments/1jxmzho/how_to_start_c/,2025-04-12 17:46:31,2025-04-13 02:54:54
1jvzohr,What’s your biggest frustration finding a good coding mentor?,sunny_bibyan,learnprogramming,"I’m exploring an idea to connect beginner/intermediate programmers with mentors from the tech industry (engineers, tech leads, etc.) for career help, interview prep, and real-world guidance.→ Would you pay for a 1:1 mentor who actually helps you grow? → Or do you feel it should be free (Discords, YouTube, etc.)?Reddit, hit me with honest thoughts :folded_hands:",6,0.69,49,https://www.reddit.com/r/learnprogramming/comments/1jvzohr/whats_your_biggest_frustration_finding_a_good/,2025-04-10 14:45:45,2025-04-13 02:54:54
1jvw420,C# library to create games,Extreme-Text-6769,learnprogramming,"Hi, I want to create my first game in C#, but I don't want to use an engine like Unity or Godot. I want to use a library to create games, but I can't find a good library for C#. I only found Raylib, but there are only tutorials for C or C++. If anyone knows a good C# library to create games, I would be very grateful if someone could tell me the name of that library.",8,0.9,3,https://www.reddit.com/r/learnprogramming/comments/1jvw420/c_library_to_create_games/,2025-04-10 11:57:55,2025-04-13 02:54:54
1juxflo,How do you folks currently test APKs or mobile apps for vulnerabilities?,devkart,learnprogramming,"I’ve been diving into mobile app security lately, and I’m curious—what tools or platforms are developers and students using to test their apps for vulnerabilities?Would love to hear what the process looks like for you—manual testing, third-party services, or something else?Also wondering: do you feel like there’s enough gamified or learning-based stuff around security that’s actually fun to use?",7,0.9,1,https://www.reddit.com/r/learnprogramming/comments/1juxflo/how_do_you_folks_currently_test_apks_or_mobile/,2025-04-09 04:28:27,2025-04-13 02:54:54
1juni23,Whats going on with unions... exactly?,AbyssalRemark,learnprogramming,"Tldr; what is the cost of using unions (C/C++). I am reading through and taking some advice from Game Engine Architecture, 3rd edition. For context, the book talks mostly about making game engines from scratch to support different platforms. The author recommends defining your own basic types so that if/when you try to target a different platform you don't have issues. Cool, not sure why int8_t and alike isn't nessissarly good enough and he even brings those up.. but thats not what's troubling me that all makes sense. Again, for portability, the author brings up endianess and suggests, due to asset making being tedious, to create a methodology for converting things to and from big and little endian. And suggest using a union to convert floats into an int of correct size and flipping the bytes because bytes are bytes. 100% agree. But then a thought came into my head. Im defining my types. Why not define all floats as unions for that conversion from the get go? And I hate that idea. There is no way, that is a good idea. But, now I need to *know* its a bad idea. Like that has got to come at some cost, right? If not, why stop there? Why not make it so all data types are in unions with structures that allow there bytes to be addressed individually? Muhahaha *lightning strike accompanied with thunder*. I have been sesrching for a while now and I have yet to find something that thwarts my evil plan. So besides that being maybe tedious and violating probably a lot of good design principles.. whats a real, tangible reason to *not* do that?",6,0.76,25,https://www.reddit.com/r/learnprogramming/comments/1juni23/whats_going_on_with_unions_exactly/,2025-04-08 20:20:27,2025-04-13 02:54:54
1jt41gb,Struggling with my C class,Practical_Fix8520,learnprogramming,"Honestly, my C programming prof seems like a good, funny guy, and I get the feeling that he really knows what he's doing. But sometimes I just don’t understand what exactly he’s trying to teach us.Like, one of his first rules was: never use modulus or division. At first, it kind of made sense. For simple programs like printing even numbers, instead of using %, he made us use basic arithmetic to understand what’s happening under the hood. That part was kinda cool, and I respected it. it forced me to think deeper.But now its getting out of hand. He wants us to write more complex programs without using modulus and division, and its becoming super confusing. I can maybe get around % if I really push, but doing everything without /? My brain starts to melt.Sometimes I wonder if this is actually the ""right"" way to learn C at a deeper level, and I’m just behind the rest of the class. Or maybe it's just an overcomplicated approach for no reason. I don’t know. I just wanted to get this off my chest, because I have no idea who else to talk to about it.",6,1.0,11,https://www.reddit.com/r/learnprogramming/comments/1jt41gb/struggling_with_my_c_class/,2025-04-06 20:44:46,2025-04-13 02:54:54
1jx4ywi,Where to go from here? Feel like I'm stuck in Limbo,soelsome,learnprogramming,"Hello, I've been working as a junior software engineer for a year and a half. I got the job because I was already at the company, taught myself the basics of web development, and then expressed interest. The company was a startup. My leadership at the time pushed for me to get on the engineering team, and it eventually happened. No tech interview. No degree.I've been able to handle most tickets assigned to me without issue. With research, LLMs, and some Udemy courses after work, I've managed to get by. But I feel like I'm severely lacking. Since I didn't go to school, and my self-taught journey didn't really touch on the fundamentals of computer science, I feel like I'm grossly underprepared and destined to fail. I feel like I know syntax well for the languages I use, and I understand at a basic level the technologies we use, such as docker, but I don't feel like I'm a good programmer. For example, I don't know data-structures and algorithms at all. I've heard of Big O in passing and that's about it. I haven't really ever had to employ any design patterns, so I haven't learnt about them for the most part. I never had to grind leet code or anything like that. I put together a few simple React applications before this job and that's it. Granted, I've learnt things on the job, such as separating the UI layer from the business logic and data layer, but I just don't know what direction I should go to get better. Should I start learning the basic, fundamental stuff I kind of skipped? Should I start grinding leet code even though I already have a job? I'm planning on getting into a school next year and getting a degree, but what should I be doing in the meantime? Any and all advice would be super appreciated. Thank you!",5,1.0,7,https://www.reddit.com/r/learnprogramming/comments/1jx4ywi/where_to_go_from_here_feel_like_im_stuck_in_limbo/,2025-04-12 00:32:53,2025-04-13 02:54:54
