id,title,author,subreddit,content,score,upvote_ratio,num_comments,url,created_utc,extracted_at
1mf0jc4,Should a student learn computer science with pseudocode first to learn programming or learn programming through projects to learn computer science? How to get out of the theory->application-> theory loop?,tree332,learnprogramming,"I tried to learn CS both out of an interest to learn about applied mathematics field and to understand the theory behind software development. I had taken an intermediate java course and while I often asked for help, I thought I was prepared for the next semester of: linear algebra, intro to discrete math, intro to dsa. I failed all of these classes simultaneously despite my efforts.In linear algebra I think I failed because I could not rely on recognizing patterns within the syntax and formatting of the problem, and even when I tried to review axioms and patterns from lecture I still wasn't prepared for the vast variety of scenario problems, especially if I had to try and recognize which parts of the problem were which fact or formula due to the problem being a real world scenario example where the properties are not labelled. When I would try to ask other students how they were comprehending the material they mainly gave general study tips such as going through textbook problems and watching 3blue1brown. When I would do textbook problems because the homework was assigned by the university question bank based on 'real world/puzzle scenarios' and not the professor. I never felt prepared even after going through several textbook problems, but that was not an excuse- I just wasn't sure what I needed to know to be able to answer \*any\* linear algebra question. I would try rewriting facts on paper over and over, I would try asking myself conceptual questions and going through the lecture until I could answer my own problems, which was not manageable because I would run out of time for my homework I was struggling to do no matter how many textbook problems I tried in preparation. In discrete math I failed I believe because I was too pre-occupied in surviving linear algebra and intro to dsa that I also was unprepared for the puzzle format of the class because linear algebra was already a puzzle to me. In intro to dsa I failed because I lacked programming experience to implement the algorithms and data structures we were learning from scratch as per instruction, and the teacher even told me that my programming skills were too remedial. I also wasn't making any projects outside of class to catch up because I was butting heads with linear algebra.I ended up feeling I spent too much time just trying to survive my math classes, and I failed anyways.I have tried just focusing on programming since I had to drop out of CS irregardless due to not being able to afford more than 2 more years of college at most and everything going all over the place in my family finances and working full time during school. I was barely a freshman in terms of core class credits going into junior year, but I don't want to give up and still want to technically finish a CS degree curriculum on my own even if my degree is no longer CS.When I am given advice on how to learn programming, the advice is to find a field of interest and start making projects from scratch, but I'm not sure how to make projects from scratch if both my programming and computer science skills are novice. I then watch a tutorial 'for complete beginners' in a field such as gamedev or android app development, I learn about methods and variables from programming frameworks such as godot or kotlin, but I still don't really understand the design of the library and how everything works. when I am having trouble making a project from scratch I am told to start very simple, but even things such as ""how to draw a 2d triangle program"" opens up a new journey learning the opengl library which I don't have the cs/programming skills to properly parse the documentation, or watching a tutorial, trying to search up the code I see in the documentation, and still not understanding.I have still tried to review intro to dsa and discrete math, but I don't feel any more prepared programming wise when going through topics such as cardinality of sets or linked lists. To understand these concepts more I am told to try implementing them from scratch..but I don't know how. I then go back to an ""intro to java/python/c# course"" for the nth time, go over arrays, variable types, string, int, if else statements, loops, nested loops, pointers, but still don't feel I know how to design a program and implement it in code. I still don't feel I understand the native library in those languages. I don't understand how a computer is able to encode the concept of inequality such as 2 <3 or why I need a current and temp variable when traversing an array or swapping array values.I'm not quite sure how to move forward.",11,0.93,20,https://www.reddit.com/r/learnprogramming/comments/1mf0jc4/should_a_student_learn_computer_science_with/,2025-08-01 16:07:01,2025-08-02 01:48:15
1mdt02z,Has this happened to anyone else?,Klutzy_Point_7831,learnprogramming,"A while ago, I started building a project using just HTML and CSS — and recently, I began adding a bit of JavaScript too. I was so excited. For once, I felt like I was building something that could solve a real problem.But now? I’ve completely lost that spark.I’ve never had a tech job or internship, and I have no idea how freelancing even works. I feel stuck — like I’m floating somewhere between “beginner tutorials” and “real-world projects” with no clear path forward.Has anyone else been through this phase? How did you push through it or find direction again?",11,0.93,6,https://www.reddit.com/r/learnprogramming/comments/1mdt02z/has_this_happened_to_anyone_else/,2025-07-31 05:17:00,2025-08-02 01:48:15
1mdrp85,Need advice for math in computer science,FirmAssociation367,learnprogramming,"Good day! Im an upcoming freshman of computer science and I'd like to ask what topics in mathematics should i study in advance since I've heard that cs is like a ""glorified math degree""I did pretty well in our math subjects during high school, but the thing is I was the type of student to forget about everything after the test:face_with_crossed-out_eyes: and I've only realized recently that memorizing does not equal to understanding (yes i learned that pretty late, my bad) Currently, im using Khan academy as my resources for math so if you have any tips on what I should start first, what subjects should I focus on, and if there are resources you'd recommend then I hope you could share it with me and I'd be very grateful :DPs: yes im learning how to code too but i want to study the math part too and ill try my best managing my time studying both",13,1.0,24,https://www.reddit.com/r/learnprogramming/comments/1mdrp85/need_advice_for_math_in_computer_science/,2025-07-31 04:03:30,2025-08-02 01:48:15
1mczxde,"To web devs, how much discrete math/calculus/linear algebra/stats/probability do you actually use in your job?",MAwais099,learnprogramming,"I'm a beginner and I'm trying to self learn web dev. goal is to start freelancing as a full stack web dev.some say you need math, some say you don't need it for web dev.plz guide me.how much of which math do you use frequently in your day job?",14,0.82,36,https://www.reddit.com/r/learnprogramming/comments/1mczxde/to_web_devs_how_much_discrete_mathcalculuslinear/,2025-07-30 07:11:26,2025-08-02 01:48:15
1mc786s,"I Can Build Beginner Projects, But I Struggle With Real-World Code and Going Further",Odd-Version-5602,learnprogramming,"Hey folks,I’m a self-taught programmer. I’ve followed tutorials and built basic apps (to-do lists, portfolios, simple clones), but I struggle when I look at real-world or open-source code. It feels overwhelming and hard to follow.I also find it hard to go beyond basic projects — I don’t know how to level up to intermediate or advanced stuff.How do I:*Get better at reading and understanding real codebases?*Transition from basic tutorial projects to meaningful, more complex ones?Any tips, strategies, or personal experiences would mean a lot. Thanks!",10,0.79,9,https://www.reddit.com/r/learnprogramming/comments/1mc786s/i_can_build_beginner_projects_but_i_struggle_with/,2025-07-29 09:50:49,2025-08-02 01:48:15
1mc9w1x,JavaScript,bxrhooom,learnprogramming,I've just finished html and css . Now i'm looking for good ressources on YouTube to learn JavaScript. If you now good channels or tutorials please help me,9,0.81,15,https://www.reddit.com/r/learnprogramming/comments/1mc9w1x/javascript/,2025-07-29 12:19:19,2025-08-02 01:48:15
1mbntl7,Exercism is great and free! Consider donating to keep the project alive,NumerousBand5901,learnprogramming,"I've been using Exercism to practice C++ and Python since it's been a while that I learned those, and I want to start working on my own projects. It's been so much fun!You have to put in some effort and sometimes do research to find a solution because they don't give you everything outright. I actually love that because that kind of is part of programming as well, and they give the right push!I was about to donate and noticed they aim for a monthly donation target of $25k for sustainability. I thought it would be a shame if they had to let the project die someday because of that...[https://exercism.org/insiders](https://exercism.org/insiders)",11,0.76,4,https://www.reddit.com/r/learnprogramming/comments/1mbntl7/exercism_is_great_and_free_consider_donating_to/,2025-07-28 18:14:51,2025-08-02 01:48:15
1mf5slt,My professor says the memory overhead of this realloc loop is constant — is that true?,Background-Roll-2535,learnprogramming,"Here's the code: int *f(int n){ int i, *a = NULL; for(i = 0; i < n; i++){ a = realloc(a, (i+1)*sizeof(int)); a[i] = i; } return a; }",7,0.77,18,https://www.reddit.com/r/learnprogramming/comments/1mf5slt/my_professor_says_the_memory_overhead_of_this/,2025-08-01 19:27:01,2025-08-02 01:48:15
1mew0sk,Need to learn math and programming,Livid-Selection-9805,learnprogramming,"I heard brilliant.org is no good, I’m over 40 and very rusty (and only completed senior high school ages ago). Which online place?",9,0.74,12,https://www.reddit.com/r/learnprogramming/comments/1mew0sk/need_to_learn_math_and_programming/,2025-08-01 13:07:43,2025-08-02 01:48:15
1mehk37,Noob to GitHub and just have some questions understanding site/app,Djxgam1ng,learnprogramming,"What do you call a GitHub post? Is it called a repository? And is there a way to bookmark and or like a repository just like you would like a Facebook post or something on Instagram? Could someone just give me a short synopsis of some of the terminology used on the site? I want to use it more but I just don’t understand any of the different things you can do. I guess I don’t understand the terminology. I am not a programmer or any of that. I love new tech but just not really good with that sort of thingJust to give you an idea, I didn’t build my PC just because I didn’t want to mess it up. I joined this subreddit because a few people said it’s more accepting to noobs. Some are not lolI just would like a rundown of the basics of the site and what are the main features someone like me who is not a programmer would need to know to work my way around it. I have used a couple posts to my benefit but each time had someone walk me through setting it up and after that, didn’t have to revisit it so it’s all a foreign language to me. Thanks in advance. Hope you guys have a great weekend!!-Tony",9,0.91,11,https://www.reddit.com/r/learnprogramming/comments/1mehk37/noob_to_github_and_just_have_some_questions/,2025-07-31 23:57:27,2025-08-02 01:48:15
1mdudrs,I don't know what should i do,FirmDoubt2581,learnprogramming,"I’m in my **third** year at university, studying **Computer Science.** I feel overwhelmed by the number of things out there. For example, I don’t know what I really want—do I want to focus on web development and improve my skills in it? Or should I learn artificial intelligence engineering? Or should I work on solving programming problems? One last note: I’m not really good at any specific area so far. Do you have any advice for me?",8,0.91,10,https://www.reddit.com/r/learnprogramming/comments/1mdudrs/i_dont_know_what_should_i_do/,2025-07-31 06:40:03,2025-08-02 01:48:15
1me284k,I wrote a free book on keeping systems flexible and safe as they grow — sharing it here,EgregorAmeriki,learnprogramming,"Over the past few years, I’ve been obsessed with one specific question: Why do clean, well-structured codebases end up tangled and brittle over time — even without bad developers involved?Not in a “massive enterprise system” way, but more like: How do everyday projects slowly degrade into something no one wants to touch?I kept running into two core issues:* Relying on runtime checks where static guarantees could’ve saved us* Writing “generic” code that ends up fragile under real-world changesSo I started keeping notes: practices, type patterns, architectural guardrails that helped reduce surprise and entropy. Eventually, I turned it into a short book.A few ideas it covers:* How to evolve a system without turning it into spaghetti* Safer ways to deserialize and construct your data* Turning input validation into something the compiler helps with* Where generics shine — and where they secretly hurt you* Treating time/space complexity as part of the interface contract* Making failure obvious and early instead of quiet and delayedIt’s all freely available — just a public repo on GitHub.If that sounds interesting, I’d be genuinely happy to hear what you think.",8,1.0,1,https://www.reddit.com/r/learnprogramming/comments/1me284k/i_wrote_a_free_book_on_keeping_systems_flexible/,2025-07-31 13:54:40,2025-08-02 01:48:15
1metpao,Confused about coding,WhaterZ_2305,learnprogramming,"Hey, so recently I've been confused on what field of coding I should focus on because I've been learning little web dev and then sometimes dsa in college which kind of confuses me about what path I should go down to.I learned HTML and CSS recently, I think they are good languages but I do not have any projects on it, our college (i am a sophomore) taught us DSA in Java as well as AIML theoretically (no code, just what concept is what) and a tad part of Data Science because my course in AI & Data Science.HTML and CSS are easy but still a little unnerving and on the other hand, DSA is a little difficult. I've recently been intrigued by computer vision right now but again, all of this confuses me what should i really study to land me something fruitful.I am just really confused what field I should be choosing for future. Can anyone guide me? Also, I flagged this debugging because I want to debug my life (its supposed to be a good joke :p)",8,0.79,15,https://www.reddit.com/r/learnprogramming/comments/1metpao/confused_about_coding/,2025-08-01 11:14:59,2025-08-02 01:48:15
1meo3cf,I have free afternoons at my 8-5 job,yigtkaya,learnprogramming,Currently i am working as software test automation engineer (just transitioned from mobile) in my company i have 3 years of android and cross-platform (RN) experience. After my first week in the automation i automate my job with claude every morning half hour session with it and till the lunch i basically finish 4 5 days of work. I want to take this as an advantage to get better at coding and find a better job in US or EU but currently i am already in a really big tech company so maybe its too ambitious but FAANG would be my target in a timespan of 1 1.5 year. I like mobile but lately roles like devops and backend catches my eye and with the ai coming into coding i have some concerns (last night i saw a post about googles code written by %50 ai). What would be your opinion? I need a brain storming.,7,0.71,2,https://www.reddit.com/r/learnprogramming/comments/1meo3cf/i_have_free_afternoons_at_my_85_job/,2025-08-01 05:27:16,2025-08-02 01:48:15
1meef7c,is it possible to do both medicine and coding?,Niamoko112,learnprogramming,"hey, I’m becoming senior in HS and i’m 16. I really want to persue medicine to directly help people, not with tech or statistics or anything like that, but to help patients face to face. but i also really want to get into coding, and want to earn from it(originally i wanted to be a software engineer). so question: can i do both? or: should i learn coding now in high school(while continuing learning it) and in college do medicine? is it gonna be hard? is it possible?",7,0.77,23,https://www.reddit.com/r/learnprogramming/comments/1meef7c/is_it_possible_to_do_both_medicine_and_coding/,2025-07-31 21:43:00,2025-08-02 01:48:15
1me13l2,Best course for programming?,BigDiggidyD,learnprogramming,"Hello everyone, i’m looking to get into coding and hopefully get a job within the industry. I am 32 and a father of 2 with a part time job and would like to do a course in coding that has flexible learning but also will teach me what i actually need. Do any of you know any good courses in the uk that i can apply for that won’t be a waste of time and doesn’t cost too much. Any help would be greatly appreciated, been looking at courses and reviews for some companies are really bad like learning people. And there’s a free course from gov.co.uk but i’m not sure how good that would be.",7,0.77,11,https://www.reddit.com/r/learnprogramming/comments/1me13l2/best_course_for_programming/,2025-07-31 13:07:45,2025-08-02 01:48:15
1mbwjs3,Not a coding question; how do you stay organized when everything is scattered?,coolandy00,learnprogramming,"This might be a bit meta, but one of the hardest things about learning or working on real projects isn’t just the code, it’s keeping track of all the context. When I was working on a group project, everyone used different tools; the requirements were in Google Docs, updates in Slack, bugs in Trello, and the actual code in GitHub. It was chaotic. I’m curious how others manage this without getting overwhelmed? Especially when the same data (like user info or task notes) shows up in different tools and slightly different formats.",7,1.0,4,https://www.reddit.com/r/learnprogramming/comments/1mbwjs3/not_a_coding_question_how_do_you_stay_organized/,2025-07-28 23:59:12,2025-08-02 01:48:15
1mb8cvh,"Need Advice: 1 Year to Graduate, Learning Java But Feeling Lost and Frustrated",mosahel,learnprogramming,"Hello,Just to clarify, I started with programming and all this tech stuff at the very beginning of 2024. I always knew about computers, but never actually owned one until then—so I began with touch typing on January 4, learned HTML, CSS, and basically figured out how to use a computer properly for those first 3–4 months. I had some help from a senior in the summer (May–June) with HTML, CSS, and JS, and it felt pretty intuitive and fun.Then I decided to seriously learn the MERN stack and bought Colt Steele’s Web Dev course in July, which covered HTML, CSS, Tailwind, JS, and VSC (Git, GitHub). But because of academic pressure, I barely coded at all during the final months of 2024—I got wrapped up more in Linux, version control, vim, and stuff like that and actually got pretty good at it. During a gap in November–December, I really enjoyed working with Linux, Lua, and was a Dotfile Engineer for a bit (which was honestly way more my vibe). Then, I learned some Python at a bootcamp in college/university, circled back to JavaScript in March, and then got into React in April/May.I’ll admit, I was really just rushing through React so I could get to backend stuff—I kept getting frustrated with frontend, and after talking with a couple of techie friends (with 7–8 years of experience each), they told me I’d probably be happier and do better if I went into backend, considering how much I liked working with Linux and all. I realized frontend really isn’t my thing: I can tweak things decently, but I can’t design or build from scratch like true frontend devs.So now, I’m currently in my 6th semester of engineering with exactly one year and 28 days left to graduate. I’ve just started learning Java and I’m actually liking it, especially compared to some parts of frontend. In my country, Java also seems to have way better career prospects, and the React/frontend job market is extremely saturated—tons of applicants for every position.Right now, the challenge is I’m just not sure how to organize my next steps. There’s a lot of anxiety because I’m still new, I’ve got 5 backlogs (3 in Maths), and it’s hard to stay motivated or focused when I don’t even know what to prioritize—should I hammer down Java fundamentals, focus on DSA, Leetcode, frameworks like Spring Boot, or work on projects? I really want to make the most of this last year so I don’t end up with no job at the end, but I could use some advice—even just on what to learn, what order to tackle things, or how to structure my study time.If anyone’s been in a similar situation, or has tips for making the most of this final stretch—whether it’s about Java, backend projects, passing those backlogs, or handling the stress of not knowing what’s next—I’d really appreciate any guidance.Thank you!",7,0.78,6,https://www.reddit.com/r/learnprogramming/comments/1mb8cvh/need_advice_1_year_to_graduate_learning_java_but/,2025-07-28 05:58:59,2025-08-02 01:48:15
1mb7lsi,Is a one variable solution preferable to a three variable solution?,todd_c,learnprogramming,"I'm trying to learn programming for the first time.I looked up two different solutions to the Harvard CS50 Python ""Making Faces"" problem in their Problem Set 0.The solution I liked (I'll call it Solution 1) uses only one variable and works with that to get the answer.The other solution (Solution 2) creates three variables.Does Solution 1 go against any ""best practices"" by only using one variable?Or, does Solution 2 provide some kind of benefit by breaking it down with three variables?Or, is it one of those things where both solutions are acceptable and it just depends on one's personal preference?Two solutions are below:Solution 1 def main(): # Get user input user_input = input(""Enter a sentence with the happy and sad emoticons: "") # Print the converted user input print(convert(user_input)) def convert(user_input): # Replace :) and :( with happy and sad emoji user_input = user_input.replace("":)"", "":slightly_smiling_face:"").replace("":("", "":slightly_frowning_face:"") return user_input main()Solution 2 def main(): # Get user input user_input = input(""Enter a sentence with the happy and sad emoticons: "") final_answer = convert(user_input) # Print the converted user input print(final_answer) def convert(user_input): # Replace :) and :( with happy and sad emoji converted_input = user_input.replace("":)"", "":slightly_smiling_face:"").replace("":("", "":slightly_frowning_face:"") return converted_input main() Thanks.",6,0.88,14,https://www.reddit.com/r/learnprogramming/comments/1mb7lsi/is_a_one_variable_solution_preferable_to_a_three/,2025-07-28 05:12:34,2025-08-02 01:48:15
1mamnvp,Is A level computer science enough?,Easy_Try9786,learnprogramming,"Hey there!FYI, the a level is spread across 2 years, first is known as AS level, and the second year is known as A2 level I've been thinking about a rather interesting academic route. Instead of pursuing a traditional bachelor's degree in computer science, I'm considering diving straight into a specialization for my undergraduate studies, specifically in Software Engineering or Cloud Computing.I believe this approach could save me a significant amount of time and better equip me for the future, potentially putting me ahead of the curve compared to my peers.What do you all think? Am I onto something brilliant, or should I reconsider my strategy?For your reference, I've attached the computer science syllabus. I look forward to hearing your thoughts! [Computer science syllabus](https://www.cambridgeinternational.org/Images/636089-2024-2025-syllabus.pdf)",9,0.7,20,https://www.reddit.com/r/learnprogramming/comments/1mamnvp/is_a_level_computer_science_enough/,2025-07-27 13:44:59,2025-08-02 01:48:15
1mf22pn,Leetcode or not?,Neat_Confidence9810,learnprogramming,"I am starting my college in a bit. Thought I should start doing leetcode problems for understanding DSA. I can't exactly solve even easy problems in like 1hr. Sometimes, they take upto 2hrs. Should I do something else before leetcode? Like reading a book on DSA or welp understanding all the algorithms first, or maybe just try a different platform?",7,0.89,4,https://www.reddit.com/r/learnprogramming/comments/1mf22pn/leetcode_or_not/,2025-08-01 17:05:36,2025-08-02 01:48:15
1meworw,Am I crazy to think that building a large project (possibly getting users) will help me get hired?,neptune-jam,learnprogramming,"I’m a self taught dev for about 10 months. I keep reading how important a portfolio is to have if you don’t have a cs degree. Am i crazy to think that if build a huge project, relevant to the company I want to work at, that I could actually apply for roles at large tech companies in Australia like Realestate dot com or Canva?",6,0.69,18,https://www.reddit.com/r/learnprogramming/comments/1meworw/am_i_crazy_to_think_that_building_a_large_project/,2025-08-01 13:36:17,2025-08-02 01:48:15
