id,title,author,subreddit,content,score,upvote_ratio,num_comments,url,created_utc,extracted_at
1oat7wd,Game engines are great. Building without one is also great. :smiling_face_with_halo:,veesahni,learnprogramming,"My son (10 years old now) started his coding adventure with the typical things that kids use - block based tools like scratch.When he outgrew those, he moved on to learn open web technologies. His first two games were built using just HTML, CSS, JS using divs, images and sound apis. Huge learning curve, and still limited in what you can do. It didn't stop him though. More importantly, it taught him the fundamentals (arrays, variables, file management, functions, etc), and there's a lot of value in that.He wanted to do more advanced stuff, and started learning how to use canvas with requestAnimationFrame. He even started thinking about what a collision detection algorithm would look like (with the help of AI). He never passed the experimentation phase here so a game wasn't released. But he learned a lot more about the fundamentals. In all the above, he did have support & guidance from parents. So I think having the right mentorship in place is key.Along the way, he discovered a game engine (Microsoft Makecode Arcade) which, while limited, gave him so much to build on - tilemaps, input management, animations, integrated sound/image editor, gravity, etc. Suddenly, his games could become more complex. Levels, hidden sections and boss battles were all easily approachable.From my observation, picking up the game engine was easy. He already loosely knew what needed to happen, it was just a matter of figuring out how to do it in the engine.What I'm trying to say: when you want to learn to code, using a game engine on day one will speed you up, but it may also mean you're skipping some valuable fundamentals. Perhaps, instead, start smaller and explore. Learn the fundamentals and build on it until you naturally are hitting the limits and need something more powerful.My son also did a writeup on his experience using a game engine - [https://www.armaansahni.com/how-i-built-my-first-game-using-a-game-engine/](https://www.armaansahni.com/how-i-built-my-first-game-using-a-game-engine/)(Disclosure -  Parents provided multiple rounds of feedback to ensure clarity and coherence of his writeup)",21,0.74,2,https://www.reddit.com/r/learnprogramming/comments/1oat7wd/game_engines_are_great_building_without_one_is/,2025-10-19 15:56:54,2025-10-25 01:26:49
1oc8hwq,Programming Fundamentals Or Start Learning Python,dm4aa,learnprogramming,"If I want to start programming, should I learn the fundamentals first or just pick a language like Python and start?",20,0.85,20,https://www.reddit.com/r/learnprogramming/comments/1oc8hwq/programming_fundamentals_or_start_learning_python/,2025-10-21 09:38:50,2025-10-25 01:26:49
1oc1jo7,Certs for Computer Science grad,ElonHatesVets,learnprogramming,"My son is likely going to college for a BS in Computer Science next year. We’ve talked and looked at different computer related career fields - Cybersecurity, Network Engineering, Cloud, so on, and he said he feels like he wants to get into software engineering. We’ve looked at all sorts of different certs from different fields and we’ve asked AI, but I wanted to hear from real people - What are the best certs for a new college grad that wants to work in the software engineering field? Thank you!",19,0.82,28,https://www.reddit.com/r/learnprogramming/comments/1oc1jo7/certs_for_computer_science_grad/,2025-10-21 02:46:09,2025-10-25 01:26:49
1obgm4o,Small wins > big breakthroughs,HonestCare545,learnprogramming,"Learning to code feels slow. Celebrate every small success — printing output, fixing a bug, writing your first function. Momentum builds confidence.",18,0.88,1,https://www.reddit.com/r/learnprogramming/comments/1obgm4o/small_wins_big_breakthroughs/,2025-10-20 11:33:30,2025-10-25 01:26:49
1obiujf,Is C++ a good language for starting learning coding?,mateus_moretto,learnprogramming,I'm very begginnner on coding and decided to start learning C. is it a good language for start? Do you have any suggestions?,18,0.84,50,https://www.reddit.com/r/learnprogramming/comments/1obiujf/is_c_a_good_language_for_starting_learning_coding/,2025-10-20 13:21:58,2025-10-25 01:26:49
1ocds06,What does it mean to know a programming language?,SunshineAstrate,learnprogramming,"Personally I have a background in theoretical physics and quantum computing. So for me things like logic tables and lookup tables and circuits are quite intuitive now while I still struggle heavily to understand object oriented programming. Assembly is a pain in the ass at the beginning but the structure is nice as it is quite simple in its concepts. Being able to do a lot with less like addition and multiplication is fun.My programming setup usually starts (whatever ""language"" or similar things like LaTeX) with a text editor and two to three terminals open. One for compiling or installing libraries, one for navigating the file system and one for the editor. When I code I often struggle with small syntactic errors all the time but have way less problems with things others consider difficult. Old things like Fortran and TCL are quite intuitive for me. I usually get good results by optimizing the underlying mathematical problem by using some tricks provided by the software or hardware. I usually write very specific solutions for a given scientific problem and optimize a lot by hand first. But understanding concepts that aim to hide complexity is very difficult. I need to use the terminal to install software on Mac as I struggle with the basic pictures showing me to drag the .dmg from one folder to the next. I still have huge issues with VS code because usually the problems I get are related to git or access privileges in the background. If Mac OS was not a full blown Unix I would have been lost at work. And yes, I still write some ""code"" with pen and paper and optimize things by hand from time to time.",17,0.82,15,https://www.reddit.com/r/learnprogramming/comments/1ocds06/what_does_it_mean_to_know_a_programming_language/,2025-10-21 14:00:56,2025-10-25 01:26:49
1oca2ou,overwhelmed,13Forward,learnprogramming,"I have started learning programming a few days ago so I can code my own 2d game.I tried to learn the fundamentals by having an idea (how do I move a character, how do I take damage, how do I collide with an object) and research the necessary steps.Then I quickly realised that a lot of steps are required.Now I have started the GDscript learn to code from zero app which really helped me so far.Now here is my question:what would you do after the completion of the app?return to my roots and try to implement what I have learnt/or not, try and code little projects, anything else?thx",17,0.88,17,https://www.reddit.com/r/learnprogramming/comments/1oca2ou/overwhelmed/,2025-10-21 11:11:08,2025-10-25 01:26:49
1oaipky,1990's programmers vs today programmers,Origin_of_Anomaly,learnprogramming,"ADDITIONAL CONTEXT:This is not some kind of comparision . I am more interested in how programming differ in these era's . To be honest I see the 1990's programmers more capable and genuine interested than today's and they might have possessed greater abilities . It's because most of the operating systems and programming languages were made that are currently used were made at that time for example linux operating systems and popular programming languages like python and C and many more. MAIN QUESTION:How does the programming was learnt back in 1990's , what were the resources used by them maybe manuals or documentations and how would you have learnt programming in 1990's?MORE CONTEXT: To be honest I just want to learn like in self taught way . The main reason being lots of resources being oversaturated in internet and tutorials . So want to become self reliant and understand and apply and build stuff to deeper level.",15,0.64,97,https://www.reddit.com/r/learnprogramming/comments/1oaipky/1990s_programmers_vs_today_programmers/,2025-10-19 06:40:18,2025-10-25 01:26:49
1oef5jb,What Are the True Fundamentals Every Full-Stack Developer Should Master Before Diving Deep Into Frameworks?,New-Help2408,learnprogramming,"Hey everyone I’m a software engineering student currently learning Angular and NestJS.While I can follow along with tutorials, I often find myself not fully understanding why certain things are done a specific way — or how to solve some problems, or how can i deal with things.I’ve heard many developers say that to really grow, you need to master the fundamentals first — so that frameworks become “just tools” instead of something you depend on blindlyThat made me realize I might have skipped or rushed some core concepts.So I’d love to hear your insights:•What are the core fundamentals every full-stack developer should really understand (before going deep into frameworks)?•How can I practice and measure my progress with those fundamentals?•Any recommended resources or project ideas that helped you personally?Thanks in advance",16,0.84,7,https://www.reddit.com/r/learnprogramming/comments/1oef5jb/what_are_the_true_fundamentals_every_fullstack/,2025-10-23 21:03:43,2025-10-25 01:26:49
1ock3t8,Can I get a bachelor's degree in compsci fully online?,Turbulent-Seaweed903,learnprogramming,"Hi, I'm currently enrolled at a college that I feel no real end to. I want to switch to computer science but I want a clean fresh new start at a different school, however with my current work schedule. Is it possible to get a bachelor's degree for comp sci fully online? I'm in New York City. Thanks!",16,0.91,25,https://www.reddit.com/r/learnprogramming/comments/1ock3t8/can_i_get_a_bachelors_degree_in_compsci_fully/,2025-10-21 18:01:49,2025-10-25 01:26:49
1odu83y,"Low CGPA, almost no coding skills, and 1-year detention — final year CSE student trying to pick a direction (AIML vs Cloud vs Data Science)",FoxShort3087,learnprogramming,"Hey everyone,Final year CSE student here — my college journey has been a mess so far :grinning_face_with_sweat:Low CGPA, weak coding skills, and even got detained for a year. But I’ve started taking things seriously now and want to actually build skills before graduating.I’m trying to figure out which path would be better to start from zero:AI / MLCloud Engineering (Azure/AWS + DevOps)Data ScienceI’m ready to put in consistent effort (5–6 hrs/day) and just want to know:Which one is more beginner-friendly?Which has better job chances for freshers right now?What’s a good roadmap to start improving skills step-by-step?Any guidance or personal experiences would mean a lot :folded_hands:",14,0.9,9,https://www.reddit.com/r/learnprogramming/comments/1odu83y/low_cgpa_almost_no_coding_skills_and_1year/,2025-10-23 04:42:20,2025-10-25 01:26:49
1odj3hg,Question for more senior developers when it comes to app building.,Wonder-Bones,learnprogramming,"What order do you typically start in, when building a new project from the ground up?For instance, I've recently started working on an app for the iOS app store, using swift, and things were going great for a while. I started with front end UI, and was working through components, and then when I started getting to things like persistent memory for storage or component interactions, I realized I should have built some of these other areas first because now I was back-tracking and making corrections to code I've already written when I wouldn't have to do that if I had just built everything in the right stacking order.But as someone who's not a real experienced developer, how do you even know what that proper order is? Can someone please breakdown their typical workflow, do you start with back-end? ground level framework stuff, and then work your way up to re-usable shared features that can nest into full components later?",13,0.8,13,https://www.reddit.com/r/learnprogramming/comments/1odj3hg/question_for_more_senior_developers_when_it_comes/,2025-10-22 20:10:45,2025-10-25 01:26:49
1od2dc4,"Choosing between C, C# and Go for Expanding my programming Skills.",Late-Metal8122,learnprogramming,"Hi Everyone, So i have recently landed a job and i have this 6 months before joining the company as i need to complete my last semester.I want to try out other languages so that in this 6 months if possible i can try to get a better job. Not only that but i also am interested in in learning these langues. C language is more like hobby of trying to understand the of Low-Level of a computer. While the other two are comparable to what i'm currently learning.I am currently Working with Java,Spring & Spring boot , MySQL, and front end as usual. C# is mainly here because a company came for placement and it seems the candidates trying to program with C# is pretty low as there are only few of them. Thanks in advance.",13,0.79,17,https://www.reddit.com/r/learnprogramming/comments/1od2dc4/choosing_between_c_c_and_go_for_expanding_my/,2025-10-22 08:10:10,2025-10-25 01:26:49
1ocvjhl,One of the Best Free JavaScript Books,Main_God2005,learnprogramming,"Hey everyone! :waving_hand:I recently started learning JavaScript and found Eloquent JavaScript — a completely free online book that explains JS concepts in a really elegant and practical way.It covers everything from the basics to advanced topics like higher-order functions, async programming, and even Node.js — with plenty of exercises to test your understanding.:link: Link: https://eloquentjavascript.net/Highly recommend it if you want to truly understand JavaScript instead of just memorizing syntax.Has anyone here finished it? Would love to hear how you used it in your learning journey!",13,0.85,1,https://www.reddit.com/r/learnprogramming/comments/1ocvjhl/one_of_the_best_free_javascript_books/,2025-10-22 01:47:33,2025-10-25 01:26:49
1oda3kb,In which language should we start dsa ??,Electronic_Seat_4336,learnprogramming,some xebia guys in our college teaching us C and saying its the best language i am kind a confused which language is preferred more ??how good is C for dsa ??i heard cpp and java are more preferred for dsa even though i dont know if those guys are legit are not who are giving traning in my college for coding whats your thoughts ??,12,0.73,33,https://www.reddit.com/r/learnprogramming/comments/1oda3kb/in_which_language_should_we_start_dsa/,2025-10-22 14:39:29,2025-10-25 01:26:49
1ocjhwd,"What text editor,compiler or smt for C++? Help pls",TessTheHuntress,learnprogramming,Hello! I am gonna start learning C++ in college and I was wondering whether some of you had advice on what to download as a text editor or compiler or smt. I am gonna be honest I don't really know yet what I need to program C++ code on but I would love some help! ;),13,0.94,23,https://www.reddit.com/r/learnprogramming/comments/1ocjhwd/what_text_editorcompiler_or_smt_for_c_help_pls/,2025-10-21 17:39:31,2025-10-25 01:26:49
1oboxyp,Looking for one mentor,Actual-Twist8724,learnprogramming,"I’m looking for one mentor in programming, someone I can follow, learn from, and get guidance from as I work to become a professional software engineer.I’m not looking for multiple mentors, just one person I can truly learn and grow with over time.Thanks in advance",12,0.88,6,https://www.reddit.com/r/learnprogramming/comments/1oboxyp/looking_for_one_mentor/,2025-10-20 17:59:02,2025-10-25 01:26:49
1oc7m7d,How to read and understand an existing project?,MundaneYam5519,learnprogramming,"I've been doing a project from jpmc, it is an existing git hub repo that I need to do tasks on for a certification. The first task had me adding dependencies and perform some debugging. The project uses Java, Kafka and Spring. It's my first time working with kafka and spring. My main question is I don't know how I to read and understand the pre-exisiting files. This goes for all any pre-existing project, I don't know what I need to be working on or what file does what, which files are the part of setup, which files are user defined and such. I really want to know what things are missing and what things need to be tweaked to get a grasp of the project and understand it really well. Please ask me any questions so I can help you help me",12,0.88,14,https://www.reddit.com/r/learnprogramming/comments/1oc7m7d/how_to_read_and_understand_an_existing_project/,2025-10-21 08:41:18,2025-10-25 01:26:49
1oe37hf,recursion with three input and three output,atof45456,learnprogramming,"recently, I have a problem involving number partitioning. Given a number *n*, such as *n*=2020, the goal is to partition it to three smaller numbers, like this:2019+12018+22018+1+12017+32017+1+22016+4...The partitions should continue until the sum of the digits in all partitioned numbers is equal.# Examples 1:* For 2020=2019+1:* sum(2019)=2+0+1+9=12* sum(1)=1# Examples 2:* For 2020=2000+11+9:* sum(2000)=2+0+0+0=2* sum(11)=1+1=2* sum(9)=9I found a relationship between the numbers. We can represent the partitions as \[*n*−*i*,*i*\], and further partition *i* into \[*i*−*j*,*j*\]. However, I had a very bad solution that took a very long time to execute without returning a result. Can anyone help me find a better or more efficient approach? #include int sum_digits(int sum_parts){ int sum_numbers=0; while(sum_parts!=0){ sum_numbers+=sum_parts%10; sum_parts /=10; } return sum_numbers; } int number_partition(const int& number){ int count = 0; for(int i=1; i<=number/2; i++){ for(int j=1; j<=i/2; j++){ int number2 = number - i; int temp = i - j; if(sum_digits(number2) == sum_digits(i) && sum_digits(number2) == sum_digits(temp) && sum_digits(i) == sum_digits(temp)){ count++; } } } return count; } int main() { int n; std::cin >> n; std::cout << number_partition(n); return 0; }",10,0.92,4,https://www.reddit.com/r/learnprogramming/comments/1oe37hf/recursion_with_three_input_and_three_output/,2025-10-23 13:25:35,2025-10-25 01:26:49
1ob2krm,any advices for a freshman computer engineering student?,haveyoumetmarie,learnprogramming,"i started computer enginnering major this year. i dont know coding and stuff and i really wanna improve myself as the best way possible first year. what is your advices for me to improve myself in the best way possible this year? i just started to learn python but i really wanna learn different things maybe platforms,video creators about these, github and stuff.and create some projects in the future.i wanna make money, being student is hard...",7,0.77,33,https://www.reddit.com/r/learnprogramming/comments/1ob2krm/any_advices_for_a_freshman_computer_engineering/,2025-10-19 22:04:16,2025-10-25 01:26:49
1oecjtb,What program is best for coding on tablet,PieAgile8114,learnprogramming,I think of using my android tablet for programming in html and python. Are there any programs that can do this,8,0.84,29,https://www.reddit.com/r/learnprogramming/comments/1oecjtb/what_program_is_best_for_coding_on_tablet/,2025-10-23 19:23:46,2025-10-25 01:26:49
1oc0pfm,Which Languages Should I Learn?,CamMST12,learnprogramming,"I'm a second year Computer Science Student, I haven't fully decided on a path I imagine I would likely try do AI/ML/Data, then fallback on SWE or Cybersecurity if I can't secure anything. Current Plan isC#C++ (Learning currently)JavaScriptPython (Know pretty well)Thoughts?",9,0.84,14,https://www.reddit.com/r/learnprogramming/comments/1oc0pfm/which_languages_should_i_learn/,2025-10-21 02:05:38,2025-10-25 01:26:49
1oa6rlk,Should I start my project in VS Code or VS?,koala-fighter,learnprogramming,"I am starting a personal project for a basic POS program for Windows. I also am going to use Microsoft SQL for the DB. I have worked with Visual Studio and Visual Studio code before.An issue I ran into the last time i tried to start a project was that if I started in VS code, i couldn't open my project in VS (I'm sure its possible, this is probably a learning issue on my part).I plan to use C# and .NET framework and later plan to introduce Syncfusion for building reports. Visual Studio seems like the best way to go since you can drag and drop items and buttons for the GUI, but I know this is useless without the actual code for events. I did some research and many say to start with one or the other, but I wanted to get a second opinion as to the pro's and cons for using either IDE.",8,0.79,16,https://www.reddit.com/r/learnprogramming/comments/1oa6rlk/should_i_start_my_project_in_vs_code_or_vs/,2025-10-18 20:41:58,2025-10-25 01:26:49
1o9knbu,Computer science vs Data science,Nearby-Vegetable-281,learnprogramming,"Hi! So I'm starting university this fall. I applied for a bachelors in CS but i found out later that, with the grades I had in Highschool, I could get a 100% tuition waiver for Data science or a 40% waiver for CS. I know CS is generally better and a CS graduate could basically do what a DS graduate can but the decision is kinda hard to make since the greater tuition waiver for DS looks very tempting. Can you help me decide what i should go for? Thanks.",8,1.0,9,https://www.reddit.com/r/learnprogramming/comments/1o9knbu/computer_science_vs_data_science/,2025-10-18 02:50:43,2025-10-25 01:26:49
1odvpm8,What is your general workflow while building a website?,Arunia_,learnprogramming,"right now mine is very messy, frontend, backend, auth, databases, logic, I try to tackle all at the same time which makes me lose track of what to do first. Like I'm supposed to fix the pause button AND set up an auth system completely from scratch?I don't even know whether or not a workflow is required/recommended or I should just go with the flow and keep tackling different things, but if you guys do have one (eg -> website design using stitch first, then url routes using Django, etc etc), lmk!",7,0.82,16,https://www.reddit.com/r/learnprogramming/comments/1odvpm8/what_is_your_general_workflow_while_building_a/,2025-10-23 06:10:43,2025-10-25 01:26:49
1obvta8,Growing as a Junior Developer,Far-Mode-8300,learnprogramming,"Hello, everyone! I'm in my final year of computer engineering and have been working as a developer for the past 4 months at a small startup. I’m eager to accelerate my growth in my early career by learning valuable skills and technologies, pursuing certifications, and taking online courses. However, I feel a bit lost on what exactly I should focus on to become more attractive to future hiring managers.My CV is relatively simple—I’ve had two internships and am currently in a junior role. I’ve also completed a few free certifications, including GitHub Foundations and OCI AI Foundations. I’ve heard that side projects and contributing to open-source projects can be valuable, but do hiring managers really prioritize these over professional experience? Would it be worth committing to a well-known certification like AWS SAA or DEV?Any advice would be greatly appreciated—thank you!",9,1.0,3,https://www.reddit.com/r/learnprogramming/comments/1obvta8/growing_as_a_junior_developer/,2025-10-20 22:25:15,2025-10-25 01:26:49
1ob2oia,At what point is programming worth it for non-software roles?,Mysterious_Time8042,learnprogramming,"I am an avionics tech and always have some projects that are tangentially related to programming like embedded systems and troubleshooting, but I’m wondering if it would be worth it for my career to go full blown in practicing my software skills, I’m not really sure what that would entail for my career to the point where it would make a difference to a hiring manager. I took intro to Java and algorithms in undergrad, so I know a small amount of the syntax, but is memorizing the syntax what makes you proficient enough to use programming professionally? I’m curious what I should do to further my skills as someone who has no plans on entering the R&D or engineering aspects of my trade as that’s what more intense learning like boot camps are for.",5,0.67,10,https://www.reddit.com/r/learnprogramming/comments/1ob2oia/at_what_point_is_programming_worth_it_for/,2025-10-19 22:08:46,2025-10-25 01:26:49
1oe7txq,What to post on GitHub?,JVictor4966,learnprogramming,"""I am currently refocusing my efforts on programming, both through my university studies and specialized courses. My question regarding GitHub is: **what is worthwhile to post on GitHub?**Is it beneficial to upload small activities developed during my learning process, such as: Creating a shopping menu website using HTML and CSS; a calculator built with Java; a number reader within an array using C, and so on? This way, I could showcase my continuous improvement.Or is it only valuable to upload more developed projects to GitHub, like a website created for a bakery, for example, which would serve more as a 'Look what I can do for you' type of project, those more focused on real-world application?""",6,0.72,9,https://www.reddit.com/r/learnprogramming/comments/1oe7txq/what_to_post_on_github/,2025-10-23 16:24:58,2025-10-25 01:26:49
1odiq14,"APIs, IDEs, Frameworks etc.",herrbolzen70,learnprogramming,"I am new to coding.I’ve done a few simple personal projects and taken a class about Java Basics (got as far as multidimensional Arrays and manipulating them etc.) I often hear terms such as API, IDE or Framework but I don’t really know what they are. Can somebody please explain them to me? Are there other coding expression I should know about?Thanks in advance!",4,0.71,9,https://www.reddit.com/r/learnprogramming/comments/1odiq14/apis_ides_frameworks_etc/,2025-10-22 19:56:54,2025-10-25 01:26:49
