id,title,author,subreddit,content,score,upvote_ratio,num_comments,url,created_utc,extracted_at
1odxic5,"In a small-mid size company, how often do devs slow down ""their tasks"" if they finish too fast they might get fired....",KiraLawliet68,cscareerquestions,"Imagine you got hired to build XYZ and once you are done, the boss are likely to fire you. Cause they dont need you anymore...>“We don’t need a developer anymore — the system works.” BossBut again I know some boss they keep their devs even they dont have any tasks for a long periode like weeks, months , so the devs they maintaince or add nice to have feature like logging, refactoring etc... in case the boss want new features...",38,0.82,23,https://www.reddit.com/r/cscareerquestions/comments/1odxic5/in_a_smallmid_size_company_how_often_do_devs_slow/,2025-10-23 08:08:05,2025-10-26 01:42:17
1ocd99x,How do you “assess” someone without having done that before?,Mike_Oxlong25,cscareerquestions,I am going to be sitting on two interviews today since I’m the sole UI developer on my project and we are in need of more. I’ve never interviewed someone before so I was wondering if anyone had any tips?,37,0.94,18,https://www.reddit.com/r/cscareerquestions/comments/1ocd99x/how_do_you_assess_someone_without_having_done/,2025-10-21 13:40:22,2025-10-26 01:42:17
1ocpx6l,"For anyone who's in not in a tech role/unemployed, what do you do all day?",NewLegacySlayer,cscareerquestions,"Other than applying or maybe shaping up your skills, what do you do all day?There's so many hours and feels like there not that much to do",34,0.93,38,https://www.reddit.com/r/cscareerquestions/comments/1ocpx6l/for_anyone_whos_in_not_in_a_tech_roleunemployed/,2025-10-21 21:39:33,2025-10-26 01:42:17
1obsatk,How do you cope after a major fuck up?,WeHappyF3w,cscareerquestions,"No, it wasn’t me. I wish I get paid with Amazon RAU. But I have made mistakes with multi hours downtime at work in the past that are 100% my fault. Can’t even blame anyone or process. Genuinely curious on how do you cope? Or stay mentally sane? Logically I understand that a job is just a job, but mentally I don’t do so well after these kind of mistakes. If it’s a mega big one, it affects my physical health, I’d get stress hives or stomachaches.",34,0.89,19,https://www.reddit.com/r/cscareerquestions/comments/1obsatk/how_do_you_cope_after_a_major_fuck_up/,2025-10-20 20:09:45,2025-10-26 01:42:17
1oelfbq,What’s Revature about?,NephewsGonnaNeph,cscareerquestions,"Since graduating in May I’ve been working as an automation intern with Python and Ansible. Unfortunately they cannot keep me beyond 6 months so I will leave in mid-November.I’ve been having some trouble applying to entry-level jobs. I thought this internship would be the key to being able to compete but it’s looking much harder than I imagined. Granted I only recently started looking. But a lot of jobs are asking for a wide, wide variety of skills I haven’t even heard of, like XML or… Quartz. I want to build up my resume but I will be out of a job in 3 weeks.But then I came across Revature for their “Entry Level Software Developer” position, and they actually called me. At first I was a little worried - they seemed a little too excited to have me on their team, and I remember getting myself into a MLM scheme once so it felt pretty familiar.Im reading a lot about it but can someone just explain in layman’s terms what exactly goes on at Revature? It’s a contract? At a high-level, what does this contract entail? Is it true that I’d have to relocate? I live in NJ, is it possible I’d have to fly to the West? More importantly, will I know important details like which state before signing the contract? And, is the wage livable?I’m reading that while it’s bottom of the barrel, it’s not a scam. I may be willing to look into this if I run out of options. I would do a lot to be able to have a career coding, that’s the whole damn reason I came to college. Any input or experience is appreciated. TY",32,0.89,23,https://www.reddit.com/r/cscareerquestions/comments/1oelfbq/whats_revature_about/,2025-10-24 01:49:52,2025-10-26 01:42:17
1od59p0,One more Senior Engineer who can't land a job ( Coding Assignments & Live Coding ),athens2019,cscareerquestions,"Nothing new I guess, this is starting to get a toll on me. Despair is setting in. Career choices, life choices, and all this affects the people around me.I'm a decent engineer. I've built stuff, I've solved problems. I know my FE shit.Since end of August I've participated in several processes, both startups and non startups. I am not in the US/UK ecosystem (S.Europe here) so I am trying to be relatively picky with my choices (I am getting less picky as we go of course).I recently was rejected after delivering a coding assignment - following two very nice (good vibes) calls with the two founders of a startup.Here is the weird part. I am pretty confident on my delivery. The assignment had a lot business detail, one had to think of what it actually needed - but thanks to AI - I delivered. Finishing touches mine, and I was prepared to answer any questions about the code. We even had a follow-up call planned to talk about the challenge.24 hours later, I receive the most generic rejection message ever - nothing about the challenge , and a cancellation of the follow-up call. I've messaged the guy who I was in touch with - and he wrote something super abstract like ""we wanted to see how you would approach the problem"" and ""we didnt see the depth we were looking for"". (honestly I dont buy it)I accidentally noticed that one of their engineers was stalking my Linkedin Profile a few hours before the rejection mail arrived. I was generally vocal about the ""AI Bubble"" and I am wondering if the fact that their business was AI-driven had something to do with it?The other thing I am thinking is that the guy who visited my profile only did so after I spoke with the two founders so he decided for one or the other reason I am not a good fit - so they had nothing to say about the code by itself.Needless to say this is a brutal market, and I have never seen so challenging interview processes, so lengthy filtering mechanisms. I happen to also be in a relatively small market so this might have to do with it. Remote gigs are harder to find these days.What the heck should I do? I am not a top 10% coder but I'm good enough for most normal businesses. I don't grind Leetcode, and I do suffer from live coding brain freeze which I am trying to battle by doing a lot of live coding interviews. But it is \_very\_ easy for an interviewer to find reasons to reject you.I have excellent soft skill presentation, most recruiters / HR folk are super happy with me, I present myself in an excellent manner.The other day I was prepared to answer a specific live coding challenge following tips from the recruiter. I did it async before the call, almost memorized it.During live coding it, I froze because the API wasnt returning the response I was thinking it would. It took me like 5' to solve the bug.Rejected",33,0.88,13,https://www.reddit.com/r/cscareerquestions/comments/1od59p0/one_more_senior_engineer_who_cant_land_a_job/,2025-10-22 11:08:19,2025-10-26 01:42:17
1ob4dik,"Manager ""wishes I could act like a lead"" when I am not, how to handle mid experience developer reviews?",ChildrenzzAdvil,cscareerquestions,"~4 years. Not sure how to feel about this latest performance review. Long story short, I'm doing great as an underling but manager wishes that I would take on more leader/manager roles. I have little to no desire to deal with the stuff above my current pay grade (daily 1 on 1 with newbies, taking my laptop with me to corporate retreats, setting my own meetings with third parties). Obviously I want to continue getting raises, but I'm reaching that mid-high experience point where I become leadership or become a slacker. I don't mind becoming leadership but I don't want to do leadership things for a year+ before annual review where I get the title and salary raise for it. How have you all handled this transition?",34,0.93,31,https://www.reddit.com/r/cscareerquestions/comments/1ob4dik/manager_wishes_i_could_act_like_a_lead_when_i_am/,2025-10-19 23:23:40,2025-10-26 01:42:17
1odn3a2,Did your company culture changed eversince the job market became bad?,lirikthecat,cscareerquestions,"I used to love my job. It changed alot after consultant/private equity guys coming in, a good amount of attrition from other departments, I got met with higher expectations, I work longer hours now, I don't feel physiologically safe (which drains me alot) as mistakes can be punished and be used angainst you in performance reviews. My mistakes are weighed more than my accomplishments (eg a 'mistake' weighted would be for merging a branch without the best optimal solution or sometimes missing a small detail despite my co workers approving the PR) . I love my co-workers, I dont slack. I get along with them and pair program with them often. I eventually got a PIP and desptie going beyond expectations. I dont think Ill make it as it got extended. I survived many layoffs here, but I guess this is how I go.I think the positive of PIP is that it pushes you to be aware of your flaws and focus on perfecitonism, but at the same time its burning me out lol and perfectionism is not sustainable as we are all humans. We all mistakes. Maybe its stockholm syndrome at this point.",30,0.92,30,https://www.reddit.com/r/cscareerquestions/comments/1odn3a2/did_your_company_culture_changed_eversince_the/,2025-10-22 22:51:41,2025-10-26 01:42:17
1oehx9b,Worth getting a Master's to delay the start of my career?,DarioSaintLaurent,cscareerquestions,"Sidenote: I graduated back in June with a B.S in CS and have not been lucky finding a job with this tough job market that we constantly hear about.Is it worth getting a master's to delay the start of my career so I can carry on that ""New Grad"" title for a little more? I don't want to just sit on my ass the whole time hoping I land a job out of the blue, I was considering maybe pursuing a master's so I can at least show something for all this 'lost' time. Is this a smart route to take?",31,0.83,38,https://www.reddit.com/r/cscareerquestions/comments/1oehx9b/worth_getting_a_masters_to_delay_the_start_of_my/,2025-10-23 23:01:03,2025-10-26 01:42:17
1obypnf,How long do you think it would take to move from being a weak graduate applicant to a strong one?,Iseith31,cscareerquestions,"Graduated 2024.No projects.1 internship.Shit at writing code, only good at debugging native executable code lol.Can't do web dev, database, anything gui related. Only ever write protocol-specific networking stuff, never interacted with web services. I'm thinking I need to switch to part time work, to give myself more time to focus on actually learning shit. Currently doing labor work, probably a bad idea because it leaves me hella tired, hence why it's been almost a year and I haven't done any coding.",26,0.86,14,https://www.reddit.com/r/cscareerquestions/comments/1obypnf/how_long_do_you_think_it_would_take_to_move_from/,2025-10-21 00:33:02,2025-10-26 01:42:17
1obhom8,"To those that love to code, how long do we have to wait out this market?",JungGPT,cscareerquestions,"So I'm 31 self-taught web developer, just javascript/node and associated technologies (and maybe that doesn't help me), but a full stack dev. I've been coding for about 4-5 years now and have built some bigger projects. I'll try to keep this short.I love coding. I have a few hobbies and it's basically coding, playing music, and gaming. I pretty much stick to doing these 3 and I love to learn. For a person like this, you have no choice but to kind of get better at things. I understand the market used to be they'd take anybody with a pulse. I'm definitely a solid junior dev maybe a bit above junior? But...how long do people like me have to wait out this market? How many more years?In some sense it's like...I'm just gonna keep coding and learning and I figure at some point when this market turns around I'll have some job to fall back on even if its not the exorbitant salaries that previously marked the industry. For me, when I'm in the mood for it, doing leetcode is just sudoku, and any time I get an idea that excites me I typically go build it, but only if the idea excites me. It's stuff like this that makes me know I'm a ""real dev"" - even if I am new.So I guess my question is just like how long do you guys perceive this market being this way?",30,0.75,41,https://www.reddit.com/r/cscareerquestions/comments/1obhom8/to_those_that_love_to_code_how_long_do_we_have_to/,2025-10-20 12:27:18,2025-10-26 01:42:17
1of1m2m,What should I learn to actually get a job?,EconomicsHoliday,cscareerquestions,"I graduated from a mid-tier UC earlier this year and still haven’t been able to find any relevant jobs. I was young and naive in college—I focused on keeping a high GPA and taking advanced courses in algorithms and machine learning instead of getting internships. Looking back, I realize that left me with a broad but superficial understanding of interesting theories, yet very few practical or marketable skills.After being ghosted countless times, I realized my mistakes and started learning more practical skills by doing gig work and earning certifications like Security+ and CCNA. But even after that, I still can’t seem to land stable employment. Being unemployed has been tough for me and my family, and I’m honestly not sure what to do next.Should I take on more student loans and pursue a master’s degree? Or would joining the military be a better option, since I’ve heard they’re always short on people?I’d really appreciate any comments or advice. Thanks in advance.",27,0.89,29,https://www.reddit.com/r/cscareerquestions/comments/1of1m2m/what_should_i_learn_to_actually_get_a_job/,2025-10-24 15:59:47,2025-10-26 01:42:17
1oborb7,Am I crazy for considering leaving my current job to join the Navy?,ElDumbminican,cscareerquestions,"For context, I’m a 22M recent grad (graduated May 2025) and am working at a F500 insurance company making ~80,000 as a software engineer. I interned at this company during my senior year, and pretty much joined full time right after graduation (I had maybe a week off).The company is amazing. The work life balance is great, my coworkers and boss are great, and the pay isn’t bad (especially considering I still live with my parents in a low cost of living area). I’m nearby most of my friends and have a very healthy life outside of work with multiple hobbies.Yet I can’t help but feel like something feels missing. My job is right next to my house where I grew up (10 min commute) and I went to school in state only 30 ish minutes away. I feel like I haven’t seen or done anything and am missing out. I know I’m in a situation some would envy, but I just feel… bored?I’ve always been interested in the idea of joining the military, but have obviously heard horror stories about it too (hence why I never joined). But just today I was having a casual conversation with the lead engineer and he told me about his experiences in the Navy. All of the fun he had, all of the minor trouble he got into, the places he’s been, etc… It honestly sounded like a fun adventure and he said he hasn’t regretted a second of it. And obviously it didn’t impact his career negatively as he’s the lead engineer in our team.So I guess the TL:DR is, am I crazy for considering leaving my current job to join as an Officer in the Navy/Air Force? What tech skills will I learn and how will it impact me in the future? Obviously I had my lead engineer as a resource, but I want to get a broader set of opinions too that may not be biased by previous experiences.",26,0.62,134,https://www.reddit.com/r/cscareerquestions/comments/1oborb7/am_i_crazy_for_considering_leaving_my_current_job/,2025-10-20 17:50:52,2025-10-26 01:42:17
1oaz1ii,Should I even switch job now?,SoulflareRCC,cscareerquestions,"New grad almost 1 year into my first job. Joined because of the good pay & perks, but I slowly found out my team is a hot mess: no testing, no docs, no staging environment, no ci/cd, a bunch of tech debt and v1/2/3/4/5 to maintain at the same time, stagnant product, team lack of clear direction on what to do next...Very low productivity on everything like oncall, bug fix, project launch, etc, due to all these issues. More importantly, I don't seem to learn much on the job, it's all pretty repetitive work.I panicked and thought my career growth is gonna be nonexistent, so I started spraying resume to all the new grad positions blindly several months ago, I was able to get 1-2 offers from some other large company, the pay is on-par with my current company, the work seems more interesting to me, and I signed the offers. But now I'm a bit scared when I actually think about job switching. My manager and my colleagues like me, and my manager is promising a promo in 1-2 years (i know this can be bs), seems like most junior engineers get promoted pretty fast. WLB is ok too.I chatted with my friends, and it seems like they are all not getting much learning in their job, and it sounds like dealing with a hot mess is a norm in this industry, doesn't that defeat my original purpose for job switching? Given that there's no significant pay bump in these offers and unknown manager/wlb, should I actually just wait at least until 2/3 yoe to promo/jump to the next level?",28,0.94,27,https://www.reddit.com/r/cscareerquestions/comments/1oaz1ii/should_i_even_switch_job_now/,2025-10-19 19:43:19,2025-10-26 01:42:17
1ocsq3l,How common is down leveling?,UniversityHuman5642,cscareerquestions,"I am aware that if you have a lot of yoe from very small companies or non tech company and jump to big tech, you are almost guaranteed to get downleveled. How bout in the case of bigger tech startup/lesser known tech companies with relatively high tc or name value (obv not like oai or anthropic but more like series C-E)? Will your yoe also be considered less?Clarification: I am not talking about name of the title but more about req for certain comp/level within the company. Like if you have whatever yoes required to be Senior at Faang(let’s say 7) from lesser known tech companies, will your yoe be considered less and ineligible to get the role?",26,0.91,37,https://www.reddit.com/r/cscareerquestions/comments/1ocsq3l/how_common_is_down_leveling/,2025-10-21 23:37:23,2025-10-26 01:42:17
1od7tfi,Big tech career growth,Zestyclose-Will6041,cscareerquestions,"I'm a mid-level SDE at a big tech and currently on a promo path. However, I don't see much growth potential beyond senior at this company. There's just too many people fighting for too little scope.Rather than grind it out I'd like to start thinking about startups, primarily for career growth rather than striking it big. My old skip and current director both came from a startup background, and they don't seem to be outliers.What series / company size should I be looking at? Any recommendations?And how would my path differ between targeting Principal IC vs Director (with PnL ownership).P.S. I tried asking on Blind but got no hits. Hoping for some experienced PoVs here.",23,0.88,31,https://www.reddit.com/r/cscareerquestions/comments/1od7tfi/big_tech_career_growth/,2025-10-22 13:08:56,2025-10-26 01:42:17
1oc9e94,"In critical areas like Banking, Military, Medical. do people refactor codebase just to imporve maintainbility?",Yone-none,cscareerquestions,"Imagine you refactor those codebases just so you can have easier life with maintaining but your new refactorede cod breaks production and people die, lose money etc... As the title says",26,0.87,25,https://www.reddit.com/r/cscareerquestions/comments/1oc9e94/in_critical_areas_like_banking_military_medical/,2025-10-21 10:32:45,2025-10-26 01:42:17
1oah2fm,Feels like I'm falling behind?,WantToStudy777,cscareerquestions,"I have to say a long period of unemployment after grad really makes me feel like I'm falling behind. I know it's hard for international students right now but I still see some of my friends score a deal with Google, Meta, ... and I can't even get a job lol. I'm going back to my country soon but I'm not even sure I can compete after wasting 5 month in the US. Also no matter how much leetcode and projects I do I just never feel ready to take on those interview? I'm not sure how smart you got to be to get a good job. I did a few internship but I never really feel confident to design a professional backend system",22,0.82,3,https://www.reddit.com/r/cscareerquestions/comments/1oah2fm/feels_like_im_falling_behind/,2025-10-19 05:00:10,2025-10-26 01:42:17
1ob434j,Masters in Computer Science or keep applying.,Own_Ocelot25,cscareerquestions,"I'll just be blunt and say that I wasted my undergrad years in college. I have a degree in Computer science, Management, and Communications but I really can't code that well at all. I work in an unrelated job with bad pay (product management) that feels like a dead end. I've been waying options on taking some entry level IT roles or going back for a masters degree. My question is, is that a smart decision? I know people say experience always beats education in this field, but it would give me more opportunities to get internships and would allow me to focus on getting more out of my education.",23,0.93,30,https://www.reddit.com/r/cscareerquestions/comments/1ob434j/masters_in_computer_science_or_keep_applying/,2025-10-19 23:10:44,2025-10-26 01:42:17
1oft8e8,I am 2 years in and I feel like I learned nothing practical - what should I study now to get a job in 6 months,Migdan,cscareerquestions,"I learned a lot about networking, advanced algorithms and such, which is great, I am thankful for it, but even after finishing the rest of the courses I need to get the degree, I can't imagine having enough knowledge to land a job let alone do well in oneWhat should I study now, so in 6 months I will be able to find a job?I know C#, Java, basic Python and basic C, I enjoy high level languages (C# and Java), I also really enjoyed tinkering with datasets for machine learning, but I feel like machine learning is too competitive now I am not really a top programmer materialWhat are some directions I should chase?",17,0.91,7,https://www.reddit.com/r/cscareerquestions/comments/1oft8e8/i_am_2_years_in_and_i_feel_like_i_learned_nothing/,2025-10-25 14:41:23,2025-10-26 01:42:17
1ob3z71,How bad is a multi year traditional work gap (3-5 years) if one tried being a founder?,Ultrayano,cscareerquestions,"Title pretty much.Standing at a crossroad to either go back into traditional work after 2.5 years of full-time traveling or trying my way as a founder, building a SaaS and maybe even generate revenue.Basically if the founder way fails and I don't generate revenue, how hard will it be to find jobs? I'm in my end 20s and horribly scared to not find a job in the future if I go 1-2.5 years more without job but I'd love to build a fully autonomous life.Also the job market currently is so horrible, that I may as well be forced to try because I couldn't find anything in the last 3 months.I already have 4 YoE of experience as a Java Web Dev prior to the travels.Edit: I learned React/Next (was an Angular guy) in those 2.5 years of travel, neovim and lua + did some Python scripting so definitely not completely away from coding. Edit2: How fair would be open source contribution additionally? I never did so far but was thinking about it too.",18,0.82,34,https://www.reddit.com/r/cscareerquestions/comments/1ob3z71/how_bad_is_a_multi_year_traditional_work_gap_35/,2025-10-19 23:05:45,2025-10-26 01:42:17
1oawhh6,What specialization paths exist once you've broken into the industry?,Stefan474,cscareerquestions,"Long story short I went form tech support -> low code (webflow+design+jquery lol) -> full stack SWE over my career (28 now) and programming is what I want to pursue long term. I feel I am in a decent position now with having a job where I work with NextJS every day, am working on a go/react sideproject as well where I am using websockets and learning about constructing databases etc. I want to see what the 'next step' is though and take up something interesting for my next sideproject that has long term possibility of also being a career path. My issue though, as a self taught dev (though I want to go low-level as I am genuinely passionate and have studied compsci, just had to leave last year of college due to a family situation), I want to know what are my options to get deeper.**Things I know exist:**Go/AWS infra specializationDevOps specializationApplied ML (is this an actual field with a decent amount of jobs - it seems fun) Cybersec Going deeper into web dev High performant web app stuff (rust/wasm)My main goal is that in a year or two, if I ever lose my job, that I am in a strong position to find a new one + ideally to do something I am passionate about, and that seems to be digging deeper rather than working with lots of abstractions as I am now. Thanks!",18,0.95,7,https://www.reddit.com/r/cscareerquestions/comments/1oawhh6/what_specialization_paths_exist_once_youve_broken/,2025-10-19 18:04:32,2025-10-26 01:42:17
