id,title,author,subreddit,content,score,upvote_ratio,num_comments,url,created_utc,extracted_at
1jvwwcy,Tried to roll out Microsoft Fabric… ended up rolling straight into a $20K/month wall,Embarrassed_War3366,dataengineering,"Yesterday morning, all capacity in a Microsoft Fabric production environment was completely drained — and it’s only April. What happened? A long-running pipeline was left active overnight. It was… let’s say, *less than optimal* in design and ended up consuming an absurd amount of resources.Now the entire tenant is locked. No deployments. No pipeline runs. No changes. Nothing.The team is on the $8K/month plan, but since the entire annual quota has been burned through in just a few months, the only option to regain functionality before the next reset (in \~2 weeks) is upgrading to the $20K/month Enterprise tier.To make things more exciting, the deadline for delivering a production-ready Fabric setup is tomorrow. So yeah — blocked, under pressure, and paying thousands for a frozen environment.Ironically, version control and proper testing processes were proposed weeks ago but were brushed off in favor of moving quickly and keeping things “lightweight.”The dream was Spark magic, ChatGPT-powered pipelines, and effortless deployment. The reality? Burned-out capacity, missed deadlines, and a very expensive cloud paperweight.And now someone’s spending their day untangling this mess — armed with nothing but regret and a silent *“I told you so.”*",639,0.95,151,https://www.reddit.com/r/dataengineering/comments/1jvwwcy/tried_to_roll_out_microsoft_fabric_ended_up/,2025-04-10 12:40:01,2025-04-13 02:54:53
1jx0xpa,My 2025 Job Search,deal_damage,dataengineering,"Hey I'm doing one of these sankey charts to show visualize my job search this year. I have 5 YOE working at a startup and was looking for a bigger, more stable company focused on a mature product/platform. I tried applying to a bunch of places at the end of last year, but hiring had already slowed down. At the beginning of this year I found a bunch of applications to remote companies on LinkedIn that seemed interesting and applied. I knew it'd be a pretty big longshot to get interviews, yet I felt confident enough having some experience under my belt. I believe I started applying at the end of January and finally landed a role at the end of March.I definitely have been fortunate to not need to submit hundreds of applications here, and I don't really have any specific advice on how to get offers other than being likable and competent (even when doing leetcode-style questions). I guess my one piece of advice is to apply to companies that you feel have you build good conversational rapport with, people that seem nice, and genuinely make you interested. Also say no to 4 hour interviews, those suck and I always bomb them. Often the kind of people you meet in these gauntlets are up to luck too so don't beat yourself up about getting filtered.If anyone has questions I'd be happy to try and answer, but honestly I'm just another data engineer who feels like they got lucky.",448,0.97,62,https://i.redd.it/n2653y9vs9ue1.png,2025-04-11 21:19:34,2025-04-13 02:54:53
1jtxla8,So are there any actual data engineers here anymore?,fauxmosexual,dataengineering,"This subreddit feels like it's overrun with startups and pre-startups fishing for either ideas or customers for their niche solution for some data engineering problem. I almost long for the days when it was all 'I've just graduated with a CS degree how can I make 200K at FAANG?"".Am I off base here, or do we need to think about rules and moderation in this sub? I know we've got rules, but shills are just a bit more careful now by posing their solution as open-ended questions and soliciting in DMs. Is there a solution to this?",361,0.93,122,https://www.reddit.com/r/dataengineering/comments/1jtxla8/so_are_there_any_actual_data_engineers_here/,2025-04-07 22:00:20,2025-04-13 02:54:53
1jwi3wf,Struggling with coding interviews,Overall_Cheesecake_3,dataengineering,"I have over 7 years of experience in data engineering. I’ve built and maintained end-to-end ETL pipelines, developed numerous reusable Python connectors and normalizers, and worked extensively with complex datasets. While my profile reflects a breadth of experience that I can confidently speak to, I often struggle with coding rounds during interviews—particularly the LeetCode-style challenges. Despite practicing, I find it difficult to memorize syntax.I usually have no trouble understanding and explaining the logic, but translating that logic into executable code—especially during live interviews without access to Google or Python documentation—has led to multiple rejections.How can I effectively overcome this challenge?",151,0.99,61,https://www.reddit.com/r/dataengineering/comments/1jwi3wf/struggling_with_coding_interviews/,2025-04-11 05:03:49,2025-04-13 02:54:53
1jtch3e,Max severity RCE flaw discovered in widely used Apache Parquet,data4dayz,dataengineering,"Salient point from the article >However, the security firm avoids over-inflating the risk by including the note, ""Despite the frightening potential, it's important to note that the vulnerability can only be exploited if a malicious Parquet file is imported."">That being said, if upgrading to Apache Parquet 1.15.1 immediately is impossible, it is suggested to avoid untrusted Parquet files or carefully validate their safety before processing them. Also, monitoring and logging on systems that handle Parquet processing should be increased.Sorry if this was already posted but using reddit search I can't find anything for this subreddit. I saw it on HN but didn't see it posted on DE. [https://news.ycombinator.com/item?id=43603091](https://news.ycombinator.com/item?id=43603091)",135,0.99,12,https://www.bleepingcomputer.com/news/security/max-severity-rce-flaw-discovered-in-widely-used-apache-parquet/,2025-04-07 03:57:54,2025-04-13 02:54:53
1jv3rgi,I thought I was being a responsible tech lead… but I was just micromanaging in disguise,IllWasabi8734,dataengineering,"I used to think great leadership meant knowing *everything* — every ticket, every schema change, every data quality issue, every pull request.You know... ""being a hands-on lead.""But here’s what my team’s messages were actually saying:“Hey, just checking—should this column be nullable or not?” “Waiting on your review before I merge the dbt changes.” “Can you confirm the DAG schedule again before I deploy?”That’s when I realized: I wasn’t empowering my team — I was slowing them down.They *could’ve* made those calls. But I’d unintentionally created a culture where they felt they needed my sign-off… even for small stuff.What hit me hardest, wasn’t being helpful. I was micromanaging with extra steps. And the more I inserted myself, the less confident the team became in their own decision-making.I’ve been working on backing off and designing better async systems — especially in how we surface blockers, align on schema changes, and handle github without turning it into “approval theater.”**Curious if other data/infra folks have been through this:*** How do you keep autonomy high *and* prevent chaos?* How do you create trust in decisions without needing to touch everything?Would love to learn from how others have handled this as your team grows.",130,0.97,23,https://www.reddit.com/r/dataengineering/comments/1jv3rgi/i_thought_i_was_being_a_responsible_tech_lead_but/,2025-04-09 11:45:18,2025-04-13 02:54:53
1jved6i,Is this normal? Being mediocre,pixel_pirate1,dataengineering,"Hi.I am not sure if it's a rant post or reality check.I am working as Data Engineer and nearing couple of years of experience now.Throughout my career I never did the real data engineering or learned stuff what people posted on internet or linkedin.Everything I got was either pre built or it needed fixing. Like in my whole experience I never got the chance to write SQL in detail. Or even if I did I would have failed. I guess that is the reason I am still failing offers. I work in consultancy so the projects I got were mostly just mediocre at best. And it was just labour work with tight deadlines to either fix things or work on the same pattern someone built something. I always got overworked maybe because my communication sucked. And was too tired to learn anything after job.I never even saw a real data warehouse at work. I can still write Python code and write SQL queries but what you can call mediocre. If you told me write some complex pipeline or query I would probably fail.I am not sure how I even got this far. And I still think about removing some of my experience from cv to apply for junior data engineer roles and learn the way it's meant to be. I'm still afraid to apply for Senior roles because I don't think I'll even qualify as Senior, or they might laugh at me for things I should know but I don't. I once got rejected just because they said I overcomplicated stuff when the pipeline should have been short and simple. I still think I should have done it better if I was even slightly better at data engineering. I am just lost. Any help will be appreciated. Thanks",120,0.95,43,https://www.reddit.com/r/dataengineering/comments/1jved6i/is_this_normal_being_mediocre/,2025-04-09 19:23:53,2025-04-13 02:54:53
1jwyf7d,What’s with companies asking for experience in every data technology/concept under the sun ?,Hungry_Resolution421,dataengineering,"Interviewed for a Director role—started with the usual walkthrough of my current project’s architecture. Then, for the next 45 minutes, I was quizzed on medallion, lambda, kappa architectures, followed by questions on data fabric, data mesh, and data virtualization. We then moved to handling data drift in AI models, feature stores, and wrapped up with orchestration and observability. We discussed databricks, montecarlo , delta lake , airflow and many other tools. Honestly, I’ve rarely seen a company claim to use this many data architectures, concepts and tools—so I’m left wondering: am I just dumb for not knowing everything in depth, or is this company some kind of unicorn? Oh, and I was rejected right at the 1-hour mark after interviewing!",114,0.96,26,https://www.reddit.com/r/dataengineering/comments/1jwyf7d/whats_with_companies_asking_for_experience_in/,2025-04-11 19:31:22,2025-04-13 02:54:53
1jviip8,I'm an IT Director and I want to set our new data analyst up for success. What do you wish your IT department did for you?,64bitengine,dataengineering,"Pretty straight forward. We hired a multi-tool data analyst (Business Analyst/CRM Admin combo). Our previous person in this role was not very technical and struggled, especially since this role reports to marketing. I've advocated for matrix reporting to ensure the new hire now gets dedicated professional development, and I've done my best to build out some foundational documentation that never existed before like what tools are used across the business, their purpose and the kind of data that lives there. I'm heavily invested in this because the business is bad at making data driven decisions and I'm trying to change that culture. The new hire has the skills and mind to make this happen. I just need to ensure she has the resources.***Edit: Context***Full admin privileges on crm, local machine and power platform. All software and licenses are just a direct request to me for approvalNon-profit arts organization, ~100 Full time staff and 40m a year annually. Posted a deficit last year so using data to fix problems is my focus. She has a Pluralsight everything plan. I was a data analyst years ago in security compliance so I have a foundation to support her but ended up in general IT leadership with emphasis on security.",85,0.92,82,https://www.reddit.com/r/dataengineering/comments/1jviip8/im_an_it_director_and_i_want_to_set_our_new_data/,2025-04-09 22:21:08,2025-04-13 02:54:53
1ju81cr,Jira: Is it still helping teams... or just slowing them down?,IllWasabi8734,dataengineering,"I’ve been part of (and led) a teams over the last decade — in enterprisesAnd one tool keeps showing up everywhere: **Jira**.It’s the ""default"" for a lot of engineering orgs. Everyone knows it. Everyone uses it. But **I don’t seen anyone who actually likes it.**Not in the *""ugh it's corporate but fine""* way — I mean people who are actively frustrated by it but still use it daily.Here are some of the most common friction points I’ve either experienced or heard from other devs/product folks:1. **Custom workflows spiral out of control** — What starts as ""just a few tweaks"" becomes an unmanageable mess.2. **Slow performance** — Large projects? Boards crawling? Yup.3. **Search that requires sorcery** — Good luck finding an old ticket without a detailed Jira PhD.4. **New team members struggle to onboard** — It’s not exactly intuitive.5. **The “tool tax”** — Teams spend hours updating Jira instead of moving work forward.And yet... most teams stick with it. Because switching is painful. Because “at least everyone knows Jira.” Because the alternative is more uncertainty. What's your take on this?",75,0.85,62,https://www.reddit.com/r/dataengineering/comments/1ju81cr/jira_is_it_still_helping_teams_or_just_slowing/,2025-04-08 07:40:50,2025-04-13 02:54:53
1jwvpk6,Quitting day job to build a free real-time analytics engine. Are we crazy?,tigermatos,dataengineering,"Startup-y post. But need some real feedback, please.A friend and I are building a real-time data stream analytics engine, optimized for high performance on limited hardware (small VM or raspberry Pi). The idea came from how cloud-expensive tools like Apache Flink can get when dealing with high-throughput streams.The initial version provides:- continuous sliding window query processing (not batch)- a usable SQL interface- plugin-based Input/Output for flexibilityIt’s completely free. Income from support and extra features down the road if this is actually useful.---Performance so far:- 1k+ stream queries/sec on an AWS t4g.nano instance (AWS price \~$3/month)- 800k+ q/sec on an AWS c8g.large instance. That's \~1000x cheaper than AWS Managed Flink for similar throughput.---Now the big question:Does this solve a real problem for enough folks out there? (We're thinking logs, cybersecurity, algo-trading, gaming, telemetry). Worth pursuing or just a niche rabbit hole? Would you use it, or know someone desperate for something like this?We’re trying to decide if this is worth going all-in. Harsh critiques welcome. Really appreciate any feedback.Thanks in advance.",72,0.85,73,https://www.reddit.com/r/dataengineering/comments/1jwvpk6/quitting_day_job_to_build_a_free_realtime/,2025-04-11 17:37:25,2025-04-13 02:54:53
1jwl4w8,":pile_of_poo: When your SaaS starts scaling, the database architecture debate begins: One giant pile or many little ones?",Adela_freedom,dataengineering,No content,72,0.82,21,https://i.redd.it/cnix3psn46ue1.png,2025-04-11 08:42:49,2025-04-13 02:54:53
1jvsk3c,"Data analytics system (s3, duckdb, iceberg, glue) ko",lost_soul1995,dataengineering,"I am trying to create an end-to-end batch pipeline and i would really appreciate your feedback+suggestion on the data lake architecture and my understanding in general. - If analytics system is free and handled by one person, i am thinking of 1 option. - If there are too many transformations in silver layer and i need data lineage maintenance etc, then i will go for option 2. - Option 3 incase i have resources at hand and i want to scale. Above architecture ll be orchestrated using MWAA.I am in particular interested about above architecture rather than using warehouse such as redshift or snowflake and get locked by vendors. Let’s assume we handle 500 GB data for our system that will be updated once or day or per hour.",70,0.97,17,https://i.redd.it/swk8caawryte1.jpeg,2025-04-10 07:58:21,2025-04-13 02:54:53
1jukwsu,Why do you dislike MS Fabric?,cdigioia,dataengineering,"Title. I've only tested it. It seems like not a good solution for us (at least currently) for various reasons, but beyond that...It seems people generally don't feel it's production ready - how specifically? What issues have you found?",66,0.92,80,https://www.reddit.com/r/dataengineering/comments/1jukwsu/why_do_you_dislike_ms_fabric/,2025-04-08 18:33:12,2025-04-13 02:54:53
1jtixza,Pros and Cons of Being a Data Engineer,MazenMohamed1393,dataengineering,"I think that I’ve decided to become a Data Engineer because I love **Software Engineering** and see **data** as a key part of the future. However, I understand that every career has its pros and cons. I’m curious to know the pros and cons of working as a Data Engineer. By understanding the challenges, I can better determine if I will be prepared to handle them or not.",66,0.84,63,https://www.reddit.com/r/dataengineering/comments/1jtixza/pros_and_cons_of_being_a_data_engineer/,2025-04-07 11:27:14,2025-04-13 02:54:53
1jt4u9g,Would you take a DE role for less than $100k ( in USA)?,davf135,dataengineering,"What would you say is a fair compensation for an average DE?I just saw a Principal DE role for a NYC company paying as little as 84k. I could not believe it. They are asking for a minimum of 10 YOE yet willing to pay so low.Granted, it was a remote role and the 84k was the lower side of a range (upper side was ~135k) but I find it ludicrous for anyone in IT with 10 yoe getting paid sub 100k. Worse, it was actually listed as hourly, meaning most likely it was a contractor role, without benefits and bonuses.I was getting paid 85k plus benefits with just 1 yoe, and it wasnt long ago. By title, I am a Senior DE and already I get paid close to the upper range for that Principal role (and I work for a company I consider to be cheap/stingy). I expect a Principal to get paid a lot more than I do.Based on YOE and ignoring COLA, what would you say is a fair compensation for a Datan Engineer?",57,0.85,42,https://www.reddit.com/r/dataengineering/comments/1jt4u9g/would_you_take_a_de_role_for_less_than_100k_in_usa/,2025-04-06 21:20:52,2025-04-13 02:54:53
1jv4gb5,Is there a European alternative to US analytical platforms like Snowflake?,wenz0401,dataengineering,I am curious if there are any European analytics solutions as alternative to the large cloud providers and US giants like Databricks and Snowflake? Thinking about either query engines or lakehouse providers. Given the current political situation it seems like data sovereignty will be key in the future.,59,0.86,58,https://www.reddit.com/r/dataengineering/comments/1jv4gb5/is_there_a_european_alternative_to_us_analytical/,2025-04-09 12:22:56,2025-04-13 02:54:53
1ju3tor,Previewing parquet directly from the OS,Impressive_Run8512,dataengineering,"Hi!I've worked with Parquet for years at this point and it's my favorite format by far for data work.Nothing beats it. It compresses super well, fast as hell, maintains a schema, and doesn't corrupt data (I'm looking at you Excel & CSV). but...It's impossible to view without some code / CLI. Super annoying, especially if you need to peek at what you're doing before starting some analyse. Or frankly just debugging an output dataset.This has been my biggest pet peeve for the last 6 years of my life. So I've fixed it haha.The image below shows you how you can quick view a parquet file from directly within the operating system. Works across different apps that support previewing, etc. Also, no size limit (because it's a preview obviously) I believe strongly that the data space has been neglected on the UI & continuity front. Something that video, for example, doesn't face.I'm planning on adding other formats commonly used in Data Science / Engineering.Like:\- Partitioned Directories *( this is pretty tricky )*\- HDF5\- Avro\- ORC\- Feather\- JSON Lines\- DuckDB (.db)\- SQLLite (.db)\- Formats above, but directly from S3 / GCS without going to the console. Any other format I should add?Let me know what you think!https://i.redd.it/u7fgrobkzite1.gif",49,0.92,24,https://www.reddit.com/r/dataengineering/comments/1ju3tor/previewing_parquet_directly_from_the_os/,2025-04-08 03:07:12,2025-04-13 02:54:53
1jtj1hm,SQL proficiency tiers but for data engineers,myPacketsAreEmpty,dataengineering,"Hi, trying to learn Data Engineering from practically scratch (I can code useful things in Python, understand simple SQL queries, and simple domain-specific query languages like NRQL and its ilk).Currently focusing on learning SQL and came across this skill tier list from r/SQL from 2 years ago:[https://www.reddit.com/r/SQL/comments/14tqmq0/comment/jr3ufpe/?utm\_source=share&utm\_medium=web3x&utm\_name=web3xcss&utm\_term=1&utm\_content=share\_button](https://www.reddit.com/r/SQL/comments/14tqmq0/comment/jr3ufpe/?utm_source=share&utm_medium=web3x&utm_name=web3xcss&utm_term=1&utm_content=share_button)|Tier|Analyst|Admin||:-|:-|:-||S|PLAN ESTIMATES, PLAN CACHE|DISASTER RECOVERY||A|EXECUTION PLAN, QUERY HINTS, HASH / MERGE / NESTED LOOPS, TRACE|REPLICATION, CLR, MESSAGE QUEUE, ENCRYPTION, CLUSTERING||B|DYNAMIC SQL, XML / JSON|FILEGROUP, GROWTH, HARDWARE PERFORMANCE, STATISTICS, BLOCKING, CDC||C|RECURSIVE CTE, ISOLATION LEVEL|COLUMNSTORE, TABLE VALUED FUNCTION, DBCC, REBUILD, REORGANIZE, SECURITY, PARTITION, MATERIALIZED VIEW, TRIGGER, DATABASE SETTING||D|RANKING, WINDOWED AGGREGATE, CROSS APPLY|BACKUP, RESTORE, CHECK, COMPUTED COLUMN, SCALAR FUNCTION, STORED PROCEDURE||E|SUBQUERY, CTE, EXISTS, IN, HAVING, LIMIT / TOP, PARAMETERS|INDEX, FOREIGN KEY, DEFAULT, PRIMARY KEY, UNIQUE KEY||F|SELECT, FROM, JOIN, WERE, GROUP BY, ORDER BY|TABLE, VIEW|If there was a column for Data Engineer, what would be in it? Hoping for some insight and please let me know if this post is inappropriate / should be posted in r/SQL. Thank you \_/\\\_",51,0.92,11,https://www.reddit.com/r/dataengineering/comments/1jtj1hm/sql_proficiency_tiers_but_for_data_engineers/,2025-04-07 11:32:54,2025-04-13 02:54:53
1jwf5ks,What is the progression options as a Data Engineer?,eastieLad,dataengineering,"What is the general career trend for data engineers? Are most people staying in data engineering space long term or looking to jump to other domains (ie. Software Engineering)? Are the other ""upwards progressions"" / higher paying positions more around management/leadership positions versus higher leveled individual contributors?",45,0.91,25,https://www.reddit.com/r/dataengineering/comments/1jwf5ks/what_is_the_progression_options_as_a_data_engineer/,2025-04-11 02:14:29,2025-04-13 02:54:53
1jwnwe0,Is data engineering easy or am i in an easy environment?,_somedude,dataengineering,"i am a full stack/backend web dev who found a data engineering role, i found there is a large overlap between backend and DE (database management, knowledge of network concepts and overall knowledge of data types and systems limits) and found myself a nice cushiony job that only requires me to keep data moving from point A to point B. I'm left wondering if data engineering is easy or is there more to this",42,0.81,47,https://www.reddit.com/r/dataengineering/comments/1jwnwe0/is_data_engineering_easy_or_am_i_in_an_easy/,2025-04-11 11:48:40,2025-04-13 02:54:53
1jwpc7l,System Design for Data Engineers,ElderberryOk6372,dataengineering,"Hi everyone,I’m currently preparing for system design interviews specifically targeting FAANG companies. While researching, I came across several insights suggesting that system design interviews for data engineers differ significantly from those for software engineers.I’m looking for resources tailored to system design for data engineers. If there are any data engineers from FAANG here, I’d really appreciate it if you could share your experience, insights, and recommend any helpful resources or preparation strategies.Thanks in advance!",37,0.97,12,https://www.reddit.com/r/dataengineering/comments/1jwpc7l/system_design_for_data_engineers/,2025-04-11 13:03:15,2025-04-13 02:54:53
1jvs8f1,Is the Data Engineer Role Still Relevant in the Era of Multi-Skilled Data Teams?,MazenMohamed1393,dataengineering,"I'm a final-year student with no real work experience yet, and I've been exploring the various roles within the data field. I’ve decided to pursue a career as a Data Engineer because I find it to be more technical than other data roles.However, I have a question that’s been on my mind: Is hiring a dedicated Data Engineer still necessary and important?I fully understand that data engineering tasks—such as building ETL pipelines, managing data infrastructure, and ensuring data quality—are critical. But I’ve noticed that data analysts and BI developers are increasingly acquiring ETL skills and taking on parts of the data engineering workflow themselves.In addition to the rise of AI tools and automation, I’m starting to wonder:- Will the role of the Data Engineer become more blended with other data positions?- Could this impact the demand for dedicated Data Engineers in the future?- Am I making a risky choice by specializing in this area, even though I find other data roles less appealing due to their lower technical depth?",33,0.77,35,https://www.reddit.com/r/dataengineering/comments/1jvs8f1/is_the_data_engineer_role_still_relevant_in_the/,2025-04-10 07:33:34,2025-04-13 02:54:53
