id,title,author,subreddit,content,score,upvote_ratio,num_comments,url,created_utc,extracted_at
1obisxn,Help: Fine-grained Instructions on SparkSQL,ukmurmuk,dataengineering,"Hey folks, I need to pick your brains to brainstorm a potential solution to my problem.Current stack: SparkSQL (Databricks SQL), storage in Delta, modeling in dbt.I have a pipeline that generally works like this: WITH a AS (SELECT * FROM table) SELECT a.*, 'one' AS type FROM a UNION ALL SELECT a.*, 'two' AS type FROM a UNION ALL SELECT a.*, 'three' AS type FROM aThe source table is partitioned on a column, let's say column \`date\`, and the output is stored also with partition column \`date\` (both with Delta). The transformation in the pipeline is just as simple as select one huge table, do broadcast joins with a couple small tables (I have made sure all joins are done as \`BroadcastHashJoin\`), and then project the DataFrame into multiple output legs.I had a few assumptions that turns out to be plain wrong, and this mistake really f\*\*ks up the performance.**Assumption 1:** I thought Spark will scan the table once, and just read it from cache for each of the projections. Turns out, Spark compiles the CTE into inline query and read the table thrice.**Assumption 2**: Because Spark read the table three times, and because Delta doesn't support bucketization, Spark distributes the partition for each projection leg without guarantee that rows that share the same \`date\` will end up in the same worker. The consequence of this is a massive shuffling at the end before writing the output to Delta, and this shuffle really kills the performance.I have been thinking about alternative solutions that involve switching stack/tools, e.g. use pySpark for a fine-grained control, or switch to vanilla Parquet to leverage the bucketization feature, but those options are not practical. Do you guys have any idea to satisfy the above two requirements: (a) scan table once, and (b) ensure partitions are distributed consistently to avoid any shuffling.",3,0.81,14,https://www.reddit.com/r/dataengineering/comments/1obisxn/help_finegrained_instructions_on_sparksql/,2025-10-20 13:19:52,2025-10-26 01:42:14
1ofbeax,Enforced and versioned data product schemas for data flow from provider to consumer domain in Apache Iceberg?,fabkosta,dataengineering,"Recently I have been contemplating the idea of a ""data ontology"" on top of Apache Iceberg. The idea is that within a domain you can change data schema in any way you intend using default Apache Iceberg functionality. However, when you publish a data product such that it can be consumed by other data domains then the schema of your data product is frozen, and there is some technical enforcement of the data schema such that the upstream provider domain cannot simply break the schema of the data product thus causing trouble for the downstream consumer domain. Whenever a schema change of the data product is required then the upstream provider domain must go through an official change request with version control etc. that must be accepted by the downstream consumer domain.Obviously, building the full product would be highly complicated with all the bells and whistles attached. But building a small PoC to showcase could be achievable in a realistic timeframe.Now, I have been wondering:1. What do you generally think of such an idea? Am I onto something here? Would there be demand for this? Would Apache Iceberg be the right tech for that?2. I could not find this idea implemented anywhere. There are things that come close (like Starburst's data catalogue) but nothing that seems to actually technically enforce schema change for data products. From what I've seen most products seem to either operate at a lower level (e.g. table level or file level), or they seem to not actually enforce data product schemas but just describe their schemas. Am I missing something here?",2,1.0,6,https://www.reddit.com/r/dataengineering/comments/1ofbeax/enforced_and_versioned_data_product_schemas_for/,2025-10-24 22:30:02,2025-10-26 01:42:14
1of07iu,Faster insights: platform infrastructure or dataset onboarding problems?,datancoffee,dataengineering,"If you are a data engineer, and your biggest issue is getting insights to your business users faster, do you mean:1. the infrastructure of your data platform sucks and it takes too much time of your data team to deal with it? or2. your business is asking to onboard new datasets, and this takes too long?Honest question.",2,0.76,3,https://www.reddit.com/r/dataengineering/comments/1of07iu/faster_insights_platform_infrastructure_or/,2025-10-24 15:05:43,2025-10-26 01:42:14
1oexqja,ETL help,Exact_Effect2869,dataengineering,"Hey guys! Happy to be part of the discussion. I have 2 year of experience in data engineering, data architecture and data analysis. I really enjoy doing this but want to see if there are better ways to do an ETL. I don’t know who else to talk to! I would love to learn how you all automate you ETL process ? I know this process is very time consuming and requires a lot of small steps, such as removing duplicates and applying dictionaries. My team currently uses an excel file to track parameters such as the name of the tables, column names, column renames, unpivot tables, etc. Honestly, the excel file gives us enough flexibility to make changes to the data frame.And while our process is mostly automated and we only have one python notebook doing the transformation, filling the excel file is very painful and time Consuming. I just wanted to hear some different point of view? Thank you!!!",2,0.67,3,https://www.reddit.com/r/dataengineering/comments/1oexqja/etl_help/,2025-10-24 13:27:13,2025-10-26 01:42:14
1oejf2i,How to Handle deletes in data warehouse,Natural_Reception_63,dataengineering,"Hi everyone,I need some advice on handling deletions occurring in source tables. Below are some of the tables in my data warehouse:https://preview.redd.it/nlen7esrbywf1.png?width=530&format=png&auto=webp&s=41d8358c9d9b58169d1a52d6d049f5dcba224500Exam Table: This isn’t a typical dimension table. Instead, it acts like a profile table that holds the source exam IDs and is used as a lookup to populate exam keys in other fact tables.Let’s say the source system permanently deletes an exam ID (for example, DataSourceExamID = 123). How should I handle this in our data warehouse?I’m thinking of updating the ExamKey value in Fact\_Exam and Fact\_Result to a default value like -1 that corresponds to Exam ID 123, and then deleting that Exam ID 123 row from the Exam table.I’m not sure if this is even the correct approach. Also, considering that the ExamKey is used in many other fact tables, I don’t think this is an efficient process, as I’d have to check and update several fact tables before deleting. Marking the records in the Exam table is not an option for me.Please suggest any best approaches to handle this.",2,0.67,7,https://www.reddit.com/r/dataengineering/comments/1oejf2i/how_to_handle_deletes_in_data_warehouse/,2025-10-24 00:10:19,2025-10-26 01:42:14
1oeflsb,Multi-tenant schema on Clickhouse - are we way off?,RevolutionaryOwl2455,dataengineering,"At work (30-person B2B SaaS), we’re currently debating evolving our data schema. The founders cobbled something together 10 years ago on AWS and through some patching and upgrading, we’ve scaled to 10,000 users, typically sales reps.One challenge we’ve long faced is data analysis. We take raw JSON records from CRMs/VOIPs/etc, filter them using conditions, and turn them into performance records on another table. These “promoted” JSON records are then pushed to RedShift where we can do some deeper analysis (such as connecting companies and contacts together, or tying certain activities back to deals, and then helping clients to answer more complex questions than “how many meetings have my team booked this week?”). Without going much deeper, going from performance records back to JSON records and connecting them to associated records but only those that have associated performance… Yeah, it’s not great. The evolved data schema we’re considering is a star schema making use of our own model that can transform records from various systems into this model’s common format. So “company” records from Salesforce, HubSpot, and half a dozen all CRMs are all represented relatively similarly (maybe a few JSON properties we’d keep in a JSON column for display only). Current tables we’re sat on are dimensions for very common things like users, companies, and contacts. Facts are for activities (calls, emails, meetings, tasks, notes etc) and deals.My worry is that any case of a star schema being used that I’ve come across has been for internal analytics - very rarely a multi-tenant architecture for customer data. We’re prototyping with Tinybird which sits on top of Clickhouse. There’s a lot of stuff for us to consider around data deletion, custom properties per integration and so on, but that’s for another day. Does this overall approach sit ok with you? Anything feel off or set off alarm bells? Appreciate any thoughts or comments!",2,0.76,3,https://www.reddit.com/r/dataengineering/comments/1oeflsb/multitenant_schema_on_clickhouse_are_we_way_off/,2025-10-23 21:21:56,2025-10-26 01:42:14
1oe8w2c,Delta load for migration,kalmconistent,dataengineering,I am doing a migration to Salesforce from an external database. Client didn't provide any write access to create staging tables and instead said they have a mirror copy of production system db and fetch data from it for initial load based and fetch delta load based on the last run date(migration)and last modified date on records.I am unable to understand the risks of using it as in my earlier projects I have separate staging db and client used to refresh the data whenever we requested for.Need opinions on the approach to follow,2,0.76,0,https://www.reddit.com/r/dataengineering/comments/1oe8w2c/delta_load_for_migration/,2025-10-23 17:05:11,2025-10-26 01:42:14
1oe1lou,Data warehouse options for building customer-facing analytics on Vercel,zenspirit20,dataengineering,"My product would be exposing analytics dashboards and a notebook-style exploration interface to customers. Note that it is a multi-tenant application, and I want isolation at the data layer across different customers. My web app is currently running on Vercel, and looking for options for a good cloud data warehouse that integrates well with Vercel. While I am currently using Postgres, my needs are better suited for an OLAP datababase so I am curious if this is still the best option. What are the good options on Vercel for this?I looked at Motherduck and looks like it is a good option, but one challenge I am seeing is that the WASM client would be exposing the tokens to the customer. Given that it is a multi-tenant applications, I would need to create a user per tennant and do that user management myself. If I go with MotherDuck, my alternative is to move my webapp to a proper nodejs deployment where I don't need to depend on WASM client. Its doable but a lot of overhead to manage.This seems like a problem that should already be solved in 2025, AGI is around the corner, this should be easy :D . So curious, what are some other good options out for this?",2,0.67,1,https://www.reddit.com/r/dataengineering/comments/1oe1lou/data_warehouse_options_for_building/,2025-10-23 12:12:03,2025-10-26 01:42:14
1ody8jg,BiqQuery to on-prem SQL server,Aguerooooo32,dataengineering,"Hi,I come from a Azure background and am very new to GCP. I have a requirement to copy some tables from BiqQuery to an on-prem SQL server. The existing pipeline is in cloud composer. Can someone help with what steps should I do to make it happen? what are the permissions and configurations that need be set at the SQL server. Thanks in advance.",2,0.67,3,https://www.reddit.com/r/dataengineering/comments/1ody8jg/biqquery_to_onprem_sql_server/,2025-10-23 08:56:31,2025-10-26 01:42:14
1odslm9,Making SQL to Viz tools,noobkotsdev,dataengineering,"Hi,there!I'm making OSS of visialization from SQL.（Just SQL to any grid or table）Now,I'll try to add feature.Let me know about your thoughts!",2,0.76,0,https://github.com/nkwork9999/sql2viz,2025-10-23 03:12:50,2025-10-26 01:42:14
1odgfnc,How to address query performance challenges in Snowflake,noasync,dataengineering,No content,2,0.75,0,https://www.capitalone.com/software/blog/addressing-query-performance-challenges-snowflake/?utm_campaign=fordev&utm_source=reddit&utm_medium=social-organic,2025-10-22 18:31:18,2025-10-26 01:42:14
1ocery5,Anyone else use AWS Redshift Zero-ETL in US-EAST-1?,bingbongbangchang,dataengineering,This is a service that basically puts a read replica of an RDS streaming into your Redshift data warehouse. We have this set up in our environment and it runs many critical systems. After the nightmares of yesterday I checked this morning after getting some complaints from unhappy users about stale data and our ZETL integrations appear to have disappeared entirely. I can see the data and it appears to have stopped updating coincident with yesterday's outage. Looks like I'll have to completely remake these. This is pretty irritating because I can't find any information anywhere from AWS about the outage having *deleted* this infrastructure.,0,0.5,1,https://www.reddit.com/r/dataengineering/comments/1ocery5/anyone_else_use_aws_redshift_zeroetl_in_useast1/,2025-10-21 14:40:29,2025-10-26 01:42:14
1oc6sq1,Cannot determine primary keys in raw data as no column is unique and concatenation of columns too don’t provide uniqueness,Pleasant-Insect136,dataengineering,"Hey guys, Cannot determine primary keys in raw data as no column is unique and concatenation of columns too don’t provide uniqueness even if I go by business logic and say these columns are pk I don’t get uniqueness, I get many duplicate rows, any idea on how to approach this? I can’t just remove those duplicatesEDIT - I checked each column for uniqueness and concatenation of columns and checked their uniqueness by using distinct but nothing uniqueI got duplicates and then I hashed all the columns together and removed the duplicate hashed columns and now I'm only hashing ID columns as other columns can like time and date can be changed and got some unique combo of columns that can be pk, I hope this approach is good guys",2,0.56,55,https://www.reddit.com/r/dataengineering/comments/1oc6sq1/cannot_determine_primary_keys_in_raw_data_as_no/,2025-10-21 07:46:44,2025-10-26 01:42:14
1obdu67,How do you do a Dedup check in batch & steam?,NefariousnessSea5101,dataengineering,How would you design your pipelines for handling deduplicates before they move to your downstream?,2,0.67,2,https://www.reddit.com/r/dataengineering/comments/1obdu67/how_do_you_do_a_dedup_check_in_batch_steam/,2025-10-20 07:42:38,2025-10-26 01:42:14
1oai1xu,Important analytical models/metrics you have made for social media and web analyst,ketopraktanjungduren,dataengineering,Hello!I am making some data models for marketing insights through social and web channels. Surely each of their APIs provide users with some useful default metricsBut I am curious tho if anyone here has the experience on building metrics that don't exists in the first placeWhat important metrics have you built for social media and web analyses that are not provided by default?How's that helping your analyst or scientist?,2,0.75,2,https://www.reddit.com/r/dataengineering/comments/1oai1xu/important_analytical_modelsmetrics_you_have_made/,2025-10-19 05:59:41,2025-10-26 01:42:14
1of2nm4,Writing artifacts on a complex fact for data quality / explainability?,rotr0102,dataengineering,"Some fact tables are fairly straightforward, others can be very complicated. I'm working on a extremely complicated composite metric fact table, the output metric is computed queries/combinations/logic from \~15 different business process fact tables. From a quality standpoint I am very concerned about transparency and explainability of this final metric. So, in addition to the metric value, I'm also considering writing to the fact the values which were used to create the desired metric, with their vintage and other characteristics. So, for example if the metric M=A+B+C-D-E+F-G+H-I; then I would not only store each value, but also the point in time it was pulled from source \[some of these values are very volatile and are essentially sub queries with logic/filters\]. For example: A\_Value = xx, B\_Value = yyy, C\_value = zzzz, A\_TimeStamp = 10/24/25 3:56AM, B\_Timestamp = 10/24/25 1:11AM, C\_Timestamp = 10/24/25 6:47AM.You can see here that M was created using data from very different points of time, and in this case the data can change a lot within a few hours. \[data is not only being changed by a 24x7 global business, but also by system batch processing on schedule\] If someone else uses the same formula, but data from later points in time they might get a different result (and yes, we would ideally wish A,B,C... to be from the same point in time). Is this a design pattern being used? Is there a better way? Is there resources I can use to learn more about this? Again, I wouldn't use this in all designs, only those of sufficient complexity to create better visibility as to ""why the value is what it is"" (when others might disagree and argue because they used the same formula with data from different points in time or filters). \*\* note: I'm considering techniques to ensure all formula components are from the same ""time"" (aka: using time travel in Snowflake, or similar techniques) - but for this question, I'm only concerned about the data modeling to capture/record artifacts used for data quality / explainability. Thanks in advance!",1,0.6,7,https://www.reddit.com/r/dataengineering/comments/1of2nm4/writing_artifacts_on_a_complex_fact_for_data/,2025-10-24 16:39:47,2025-10-26 01:42:14
1oexxjn,Best approach for managing historical data,perronac,dataengineering,I’m using Kafka for real-time data streaming in a system integration setup.I also need to manage historical data for AI model training and predictive maintenance.What’s the best way to handle that part?,1,0.6,6,https://www.reddit.com/r/dataengineering/comments/1oexxjn/best_approach_for_managing_historical_data/,2025-10-24 13:35:32,2025-10-26 01:42:14
1oewno2,Help with running Airflow tasks on remote machines (Celery or Kubernetes)?,siddankcode,dataengineering,"Hi all, I'm a new DE that's learning a lot about data pipelines. I've taught myself how to spin up a server and run a pretty decent pipeline for a startup. However, I'm using the LocalExecutor which runs everything on a single machine. With multiple CPU bound tasks running in parallel, my machine can't handle them all and as a results the tasks become really slow.I've read the docs and asked AI on how to setup a cluster with Celery, but all of this is quite confusing. After setting up a celery broker, how can I tell Airflow which servers to connect to? For me, I can't grasp the concept just by reading the docs. Looking online only have introductions about how the Executor works, not in detail and not going into the code much.All of my tasks are docker containers run with DockerOperators, so I think running on a different machine would be easy. I just can't figure out how to set them up. Any experienced DEs know some tips/sources that could be of help?",1,0.67,2,https://www.reddit.com/r/dataengineering/comments/1oewno2/help_with_running_airflow_tasks_on_remote/,2025-10-24 12:40:53,2025-10-26 01:42:14
1ocvodq,Data Streaming Delivery Semantics,gangtao,dataengineering,https://preview.redd.it/h4k1298ikkwf1.png?width=1744&format=png&auto=webp&s=ebf666f0ad1f466edc7e8802e4087f65c35dfd4c[https://codepen.io/gangtao/full/raxdOOK](https://codepen.io/gangtao/full/raxdOOK),1,0.67,0,https://www.reddit.com/r/dataengineering/comments/1ocvodq/data_streaming_delivery_semantics/,2025-10-22 01:54:02,2025-10-26 01:42:14
1ocaik3,Integrating sqlmesh models with Dagster,YameteGPT,dataengineering,"Hey folks,I’m currently using Dagster as the orchestrator in my team’s data stack and I’m considering incorporating sqlmesh as our transformation library. But, I can’t really figure out a way to integrate my sqlmesh models with Dagster so that they show up as individual assets. Has anyone had any luck in achieving this ? How did you go about doing it ?",1,0.57,1,https://www.reddit.com/r/dataengineering/comments/1ocaik3/integrating_sqlmesh_models_with_dagster/,2025-10-21 11:35:12,2025-10-26 01:42:14
1obtotd,Is there a website like MDN for data engineers?,Aurora-Optic,dataengineering,MDN seems to be the gold standard for web devs for gaining knowledge. Are there any similar websites for Data Engineers?,1,0.6,2,https://www.reddit.com/r/dataengineering/comments/1obtotd/is_there_a_website_like_mdn_for_data_engineers/,2025-10-20 21:01:01,2025-10-26 01:42:14
1obdotn,Designing a hybrid batch stream pipeline for fintech data,FitImportance606,dataengineering,We recently had to handle both batch and stream data for a fintec client. I set up Spark structured streaming on top of Delta Lake with Airflow scheduling. The tricky part was ensuring consistency between batch historical loads and realtime ingestion Had to tweak checkpointing and watermarks to avoid duplicates and late arrivals. Felt like juggling clocks and datasets at the same time. Anyone else run into weird late arrival issues with Spark streaming?,1,0.6,0,https://www.reddit.com/r/dataengineering/comments/1obdotn/designing_a_hybrid_batch_stream_pipeline_for/,2025-10-20 07:34:17,2025-10-26 01:42:14
1oeonrp,"I'm a MS student in my last year, should I go back to my old company or should I go with a new I interned for over the summer?",DataByte7389,dataengineering,"Background: I’m finishing up my last year in my M.S. program studying a mixture of Data Analytics and Information Systems. Before grad school, I spent a little over 4 years working remotely at a med-tech startup (around 500 people) in product management. It was a great learning experience but also very stressful. They constantly overloaded me, interfered with my school schedule (when I was working part-time in undergrad), worked late into the night constantly, and broke promises around pay and promotions.I eventually left when I started my master’s, mainly for my own sanity and so I could focus on my health, school, and my relationship. I made sure to leave on good terms since I still really like the company and the products they are creating. It’s a small, niche industry, so I wanted to keep that bridge intact.This past summer, I interned at a manufacturing company that works in the AI/data center space. My role started as Systems Analyst but turned into more of a Data Engineering internship by the end of it. I learned a lot, but the culture was rough on my team. They didn’t really want an intern, and it was a pretty cold and dry environment with them being too busy to interact with me the whole summer. I very much had to figure out a lot of things on my own since I had to use tools and create projects I never had experience with ever. To add, this was just an issue with the team I was on, other interns had a great time on different teams. It made me consistently miss the energy and connection I had with my old coworkers at the startup, which is something I think I value a lot on a team.-Decision-The manufacturing company gave me a full-time offer for after graduation. It is a Sr Engineer role with a total comp of 145k (Yearly Breakdown: $105k base + 10% bonus + around 30k in stock). It’s stable, the benefits are great, and they even mentioned I might rotate through different engineering areas to choose a spot I like. But most likely due to company necessity I will end up in the same team (Data Engineering) I was with before since they are spread extremely thin. I am nervous about the role since they are asking me to do projects that I have little to no experience doing with little support just like the internship. It makes me afraid (A bit of imposter syndrome?) that I will not succeed in the role since I come from a more business / analytics background. But recently I also got contacted by my old company, who’s entering a big growth phase, and they asked if I’d consider coming back to the product team after graduation. They’ve made promises that they’ve reduced a lot of the work and the emergency late nights by creating a new team to manage them. I would focus more on actual product management and problem solving if I came back. They implied they would consider hiring me remotely again but are pushing for me to instead relocate to their HQ (based in Seattle when I am currently on the east coast). I’ve not received an offer yet as we are going back and forth still but I am familiar with the salary range based off of my co-workers. Estimated Breakdown: 80-97k Base + 10-15% Bonus + 12.5k in RSUs. Part of me wants to go back because I really loved the people and the work. But I’m scared of ending up in the same stressful situations again along with all the promises that were broken before and if they can keep them. Also scared that I won’t have much growth since they do not promote often in PM. On the other hand, the new company is stable and pays well with clear expectations but doesn’t excite me the same way as well with other fears about the position and team.How should I proceed? Also another thing I’m thinking about is long term on which role will let me best pursue other growth opportunities and not plateau early in my career. Any advice would be appreciated even if its outside the scope of my question.",0,0.5,3,https://www.reddit.com/r/dataengineering/comments/1oeonrp/im_a_ms_student_in_my_last_year_should_i_go_back/,2025-10-24 04:38:18,2025-10-26 01:42:14
