id,title,author,subreddit,content,score,upvote_ratio,num_comments,url,created_utc,extracted_at
1jt1mf9,Whats your favorite Orchestrator?,mjfnd,dataengineering,I have used several from Airflow to Luigi to Mage.I still think Airflow is great but have heared lot of bad things about it as well.What are your thoughts?[View Poll](https://www.reddit.com/poll/1jt1mf9),4,0.67,24,https://www.reddit.com/r/dataengineering/comments/1jt1mf9/whats_your_favorite_orchestrator/,2025-04-06 19:00:11,2025-04-13 02:54:53
1jssm0q,Data Lake file structure,Commercial_Dig2401,dataengineering,"How do you structure your raw files in your data lake, do you configured your ingestion engine to store files based on folder date time that represent the data or on folder date time that represent when they are stored in the lake ?For example if I have data for 2023-01-01 and I get that data today (2025-04-06), should my ingestion engine store the data in the 2025/01/01 folder or in 2025/04/06 folder ? Is there a better approach ? One would be better to structure it right away, but the other one would be better for select.Wonder what you think.",8,1.0,3,https://www.reddit.com/r/dataengineering/comments/1jssm0q/data_lake_file_structure/,2025-04-06 12:06:13,2025-04-13 02:54:53
1jxsce8,I'm struggling to evaluate job offer and would appreciate outside opinions,Dozer11,dataengineering,"I've been searching for a new opportunity over the last few years (500+ applications) and have finally received an offer I'm strongly considering. I would really like to hear some outside opinions.## Current position- Analytics Lead- $126k base, 10% bonus- Tool stack: on-prem SQL Server, SSIS, Power BI, some Python/R- Downsides: - Incoherent/non-existent corporate data strategy- 3 days required in-office (~20-minute commute)- Lack of executive support for data and analytics- Data Scientist and Data Engineer roles have recently been eliminated- No clear path for additional growth or progression - A significant part of the job involves training/mentoring several inexperienced analysts, which I don't enjoy- Upsides: - Very stable company (no risk of layoffs)- Very good relationship with direct manager## New offer- Senior Data Analyst- $130k base, 10% bonus- Tool stack: BigQuery, FiveTran, dbt / SQLMesh, Looker Studio, GSheets- Downsides:- High-growth company, potentially volatile industry- Upsides:- Fully remote- Working alongside experienced data engineersOther info/significant factors:- My current company paid for my MSDS degree, and they are within their right to claw back the entire ~$37k tuition if I leave. I'm prepared to pay this, but it's a big factor in the decision.- At this stage in my career, I'm putting a very high value on growth/development opportunitiesAm I crazy to consider a lateral move that involves a significant amount of uncompensated risk, just for a potentially better learning and growth opportunity?",5,0.73,25,https://www.reddit.com/r/dataengineering/comments/1jxsce8/im_struggling_to_evaluate_job_offer_and_would/,2025-04-12 21:49:54,2025-04-13 02:54:53
1jxhtte,Non IT background,Fancy_Arugula5173,dataengineering,After a year of self teaching I managed to secure an internal career move to data engineering from finance What I am wondering is long term will my non IT background matter/discount me against other candidates? I have a degree in accountancy and I am a qualified accountant but I am considering doing a masters in data or computing if it will be beneficial longer termThanks,7,0.73,8,https://www.reddit.com/r/dataengineering/comments/1jxhtte/non_it_background/,2025-04-12 13:54:29,2025-04-13 02:54:53
1jwlp4n,I need advice on how to turn my small GCP pipeline into a more professional one,ColdStorage256,dataengineering,"I'm running a small application that fetches my Spotify listening history and stores it in a database, alongside a dashboard that reads from the database.In my local version,I used sqlite and a windows task scheduler. Great. Now I've moved it on to GCP, to gain experience, and so I don't have to leave my PC on for the script to run.I now have it working by storing my sqlite database in a storage bucket, downloading it to /tmp/ during the Cloud Run execution, and reuploading it after it's been updated.For now, at 20MB, this isn't awful and I doubt it would cost too much. However, it's obviously an awful solution.What should I do to migrate the database to the cloud, inside of the GCP ecosystem? Are there any costs I need to be aware of in terms of storage, reads, and writes? Do they offer both SQL and NoSQL solutions?Any further advice would be greatly appreciated!",5,0.78,10,https://www.reddit.com/r/dataengineering/comments/1jwlp4n/i_need_advice_on_how_to_turn_my_small_gcp/,2025-04-11 09:25:08,2025-04-13 02:54:53
1jwkotf,Is Jupyter notebook or Databricks better for small scale machine learning,CountProfessional840,dataengineering,"Hi, I am very new to ML and almost everything here, and I have to choose to use jupyter notebook or databricks to do a personal test machine learning on weather. The data is just about 10 years (and i will still consider on deep learning and reinforcement learning etc), so just overall which is better(i'm very new, again)?",5,0.73,9,https://www.reddit.com/r/dataengineering/comments/1jwkotf/is_jupyter_notebook_or_databricks_better_for/,2025-04-11 08:08:13,2025-04-13 02:54:53
1jvj99c,Staying Up to Date with Tech News,frandrosa,dataengineering,"I'm a Data Scientist and AI Engineer, and I've been struggling to keep up with the latest news and developments in the tech world, especially in AI. I feel the need to build a routine of reading news and articles related to my field (AI, Data Science, Software Engineering, Big Tech, etc.) from more serious and informative sources aimed at a professional audience.With that in mind, what free (non-subscription) platforms, news portals, or websites would you recommend for staying up to date on a daily or weekly basis?",5,0.86,7,https://www.reddit.com/r/dataengineering/comments/1jvj99c/staying_up_to_date_with_tech_news/,2025-04-09 22:54:57,2025-04-13 02:54:53
1jv55e6,Dataform incremental loads and last run timestamp,Seldon_Seen,dataengineering,"I am trying to simplify and optimize an incrementally loading model in Dataform.Currently I reload all source data partitions in the update window (7 days), which seems unnecessary.I was thinking about using the `INFORMATION_SCHEMA.PARTITIONS` view to determine which source partitions have been updated since the last run of the model. **My question.... what is the best technique to find the last run timestamp of a Dataform model?**My ideas:1. Go the dbt freshness route and add an `updated_at` timestamp column to each row in the model. Then find the `MAX` of that in the last 7 days (or just be a little sloppy at get timestamp from newest partition and be OK with unnecessarily reloading a partition now and then.)2. Create a new table that is a **transaction log of the model runs**. Log a start and end timestamp in there and use that very small table to get a last run timestamp.3. Look at `INFORMATION_SCHEMA.PARTITIONS` on the incremental model (not the source). Use the `MAX` of that to determine the last time it was run. I'm worried this could be updated in other ways and cause us to skip source data.4. Dig it out of `INFORMATION_SCHEMA.JOBS`. Though I'm not sure it would contain what I need.5. Keep loading 7 days on each run but throttle it with a freshness check so it only happens X times per X.Thanks!",6,1.0,1,https://www.reddit.com/r/dataengineering/comments/1jv55e6/dataform_incremental_loads_and_last_run_timestamp/,2025-04-09 12:58:33,2025-04-13 02:54:53
1juo1uo,How are entry level data engineering roles at Amazon?,gta35,dataengineering,"If anyone on this sub has worked for Amazon as a Data engineer, preferably entry level or early careers, how has your experience been working at amazon at Amazon? I’ve heard their work culture is very startup like, and their is an abundance of poor managers. The company just cars about share holder value, instead of caring for their customers and employees.I wanted to hear on this sub, how has your experience been? How was the hiring process like? What all skills I should develop to work for Amazon?",4,0.61,6,https://www.reddit.com/r/dataengineering/comments/1juo1uo/how_are_entry_level_data_engineering_roles_at/,2025-04-08 20:43:31,2025-04-13 02:54:53
1jttqd5,GizmoSQL: Power your Enterprise analytics with Arrow Flight SQL and DuckDB,Adventurous-Visit161,dataengineering,"Hi! This is Phil - Founder of [GizmoData](https://gizmodata.com). We have a new commercial database engine product called: [GizmoSQL](https://gizmodata.com/gizmosql) \- built with Apache Arrow Flight SQL (for remote connectivity) and DuckDB (or optionally: SQLite) as a back-end execution engine.This product allows you to run DuckDB or SQLite as a server (remotely) - harnessing the power of computers in the cloud - which typically have more CPUs, more memory, and faster storage (NVMe) than your laptop. In fact, running GizmoSQL on a modern arm64-based VM in Azure, GCP, or AWS allows you to run at terabyte scale - with equivalent (or better) performance - for a fraction of the cost of other popular platforms such as Snowflake, BigQuery, or Databricks SQL.**GizmoSQL** is self-hosted (for now) - with a possible SaaS offering in the near future. It has these features to differentiate it from ""base"" DuckDB:* Run DuckDB or SQLite as a server (remote connectivity)* Concurrency - allows multiple users to work simultaneously - with independent, ACID-compliant sessions* Security * Authentication * TLS for encryption of traffic to/from the database* Static executable with Arrow Flight SQL, DuckDB, SQLite, and JWT-CPP built-in. There are no dependencies to install - just a single executable file to run* Free for use in development, evaluation, and testing* Easily containerized for running in the Cloud - especially in Kubernetes* Easy to talk to - with ADBC, JDBC, and ODBC drivers, and now a Websocket proxy server (created by GizmoData) - so it is easy to use with javascript frameworks * Use it with Tableau, PowerBI, Apache Superset dashboards, and more* Easy to work with in Python - use ADBC, or the new experimental Ibis back-end - details here: [https://github.com/gizmodata/ibis-gizmosql](https://github.com/gizmodata/ibis-gizmosql)Because it is powered by DuckDB - GizmoSQL can work with the popular open-source data formats - such as Iceberg, Delta Lake, Parquet, and more.GizmoSQL performs very well (when running DuckDB as its back-end execution engine) - check out our graph comparing popular SQL engines for TPC-H at scale-factor 1 Terabyte - on the homepage at: [https://gizmodata.com/gizmosql](https://gizmodata.com/gizmosql) \- there you will find it also costs far less than other options.We would love to get your feedback on the software - it is easy to get started:* Download and self-host GizmoSQL - using our Docker image or executables for Linux and macOS for both x86-64 and arm64 architectures. See our README at: [https://github.com/gizmodata/gizmosql-public](https://github.com/gizmodata/gizmosql-public) for details on how to easily and quickly get started that wayThank you for taking a look at GizmoSQL. We are excited and are glad to answer any questions you may have!* **Public facing repo (README):** [https://github.com/gizmodata/gizmosql-public?tab=readme-ov-file](https://github.com/gizmodata/gizmosql-public?tab=readme-ov-file)* **HomePage**: [https://gizmodata.com/gizmosql](https://gizmodata.com/gizmosql)* **ProductHunt:** [https://www.producthunt.com/posts/gizmosql?embed=true&utm\_source=badge-featured&utm\_medium=badge&utm\_souce=badge-gizmosql](https://www.producthunt.com/posts/gizmosql?embed=true&utm_source=badge-featured&utm_medium=badge&utm_souce=badge-gizmosql)* **GizmoSQL in action video:** [https://youtu.be/QSlE6FWlAaM](https://youtu.be/QSlE6FWlAaM)",5,1.0,1,https://www.reddit.com/r/dataengineering/comments/1jttqd5/gizmosql_power_your_enterprise_analytics_with/,2025-04-07 19:20:00,2025-04-13 02:54:53
1jt9rib,Review of Data Orchestration Landscape,averageflatlanders,dataengineering,No content,7,0.7,1,https://dataengineeringcentral.substack.com/p/review-of-data-orchestration-landscape,2025-04-07 01:26:29,2025-04-13 02:54:53
1jw9im6,Is Databricks right for this BI use case?,TimeBomb006,dataengineering,"I'm a software engineer with 10+ years in full stack development but very little experience in data warehousing and BI. However, I am looking to understand if a lakehouse like Databricks is the right solution for a product that primarily serves as a BI interface with a strict but flexible data security model. The ideal solution is one that:- Is intuitive to use for users who are not technical (assuming technical users can prepopulate dashboards)- Can easily, securely share data across workspaces (for example, consider Customer A and Customer B require isolation but want to share data at some point) - Can scale to accommodate storing and reporting on billions or trillions of relatively small events from something like RabbitMQ (maybe 10 string properties) over an 18 month period. I realize this is very dependent on size of the data, data transformation, and writing well optimized queries- Has flexible reporting and visualization capabilities- Is affordable for a smaller company to operateI've evaluated some popular solutions like Databricks, Snowflake, BigQuery, and other smaller tools like Metabase. Based on my research, it seems like Databricks is the perfect solution for these use cases, though it could be cost prohibitive. I just wanted to get a gut feel if I'm on the right track from people with much more experience than myself. Anything else I should consider?",3,0.72,19,https://www.reddit.com/r/dataengineering/comments/1jw9im6/is_databricks_right_for_this_bi_use_case/,2025-04-10 21:36:31,2025-04-13 02:54:53
1jvsr6u,Databases supporting set of vectors on disk?,qalis,dataengineering,"I have a huge set of integer-only vectors, think millions or billions. I need to check their uniqueness, i.e. for a new vector determine if it is in a set already and add it if not. I'm looking for an on-disk solution for this. I have no metadata, just vectors.Redis has vextor sets, but in memory only. Typical key-value DBs like RocksDB don't support vectors as set elements. I couldn't find anythink like this for relational DBs either.I also considered changing vectors to strings, but I'm not sure if that would help. I require exact computation, so without hashing or similar lossy changes.Do you have an idea for this problem?EDIT: I am not looking for approximate nearest neighbors (ANN) indexes and DBs like pgvector, pgvectorscale, Milvus, Qdrant, Pinecone etc. They solve a much more complex problem (nearest neighbor search) and thus are much less scalable. They are also all approximate, not exact (for scalability reasons).",5,0.86,2,https://www.reddit.com/r/dataengineering/comments/1jvsr6u/databases_supporting_set_of_vectors_on_disk/,2025-04-10 08:13:14,2025-04-13 02:54:53
1jvl2z4,"Working with data in manufacturing and Industry 4.0, any tips? Bit overwhelmed",stop_the_entropy,dataengineering,"Context: I’m actually a food engineer (28), and about a year ago, I started in a major manufacturing CPG company as a process and data engineer. My job is actually kind of weird, it has two sides to it. On one hand, I have a few industrial engineering projects: implementing new equipment to automate/optimize processes. On the other hand: our team manages the Data pipelines, data models and power bis, including power apps, power automates and sap scripts. There are two of us in the team.We use SQL with data from our softwares. We also use azure data explorer (sensors streaming equipment related data (temp, ph, flow rates, etc) Our tables are bloated. We have more than 60 PBIs. Our queries are confusing. Our data models have 50+ connections and 100+ DAX measures. Power queries have 15+ confusing steps. We don’t use data flows, instead each pbi queries the sql tables, and sometimes there’s difference in the queries. We also calculate kpis in different pbis, but because of these slight differences, we get inconsistent data. Also, for some apps we can’t have access to the DB, so we have people manually downloading files and posting them to share point.I have a backlog of 96+ tasks and every one is taking me days, if not weeks. I’m really the only one that knows his way around a PBI, and I consider myself a beginner (like I said, less than a year of experience). I feel like I’m way over my head, just checking if a KPI is ok is taking me hours, and I keep having to interrupt my focus to log more and more tickets.I feel like writing it like this makes this whole situation sound like a shit job. I don’t think it is, maybe a bit, but we’ll, people here are engineers, but they know manufacturing. They don’t know anything about data. They just want to see the amount of boxes made, the % of time lost grouped by reason and etc… I am learning a lot, and I kinda want to master this whole mess, and I kinda like working with data. It makes me think.But I need a better way of work. I want to hear your thoughts, I don’t know anyone that has real experience in Data, especially in manufacturing. Any tips? How can I improve or learn? Manage my tickets? Time expectations? Any ideas on how to better understand my tables, my queries, find data inconsistencies? Make sure I don’t miss anything in my measure? I can probably get them to pay for my learning. Is there a course that I can take to learn more?Also, they are open to hiring an external team to help us with this whole ordeal. Is that a good idea? I feel like it would be super helpful, unless we lost track of some of our infrastructure (although we actually don’t have it well documented either).Anyways, thanks for reading and just tell me anything, everything is helpful",2,0.67,7,https://www.reddit.com/r/dataengineering/comments/1jvl2z4/working_with_data_in_manufacturing_and_industry/,2025-04-10 00:25:27,2025-04-13 02:54:53
1jv1gua,Forcing users to keep data clean,MedicalBodybuilder49,dataengineering,"Hi,I was wondering if some of you, or your company as a whole, came up with an idea, of how to force users to import only quality data into the system (like ERP). It does not have to be perfect, but some schema enforcement etc.Did you find any solution to this, is it a problem at all for you?",6,0.8,21,https://www.reddit.com/r/dataengineering/comments/1jv1gua/forcing_users_to_keep_data_clean/,2025-04-09 09:16:36,2025-04-13 02:54:53
1jujn9j,Lessons from optimizing dashboard performance on Looker Studio with BigQuery data,kodalogic,dataengineering,"We’ve been using Looker Studio (formerly Data Studio) to build reporting dashboards for digital marketing and SEO data. At first, things worked fine—but as datasets grew, dashboard performance dropped significantly.The biggest bottlenecks were:• Overuse of blended data sources• Direct querying of large GA4 datasets• Too many calculated fields applied in the visualization layerTo fix this, we adjusted our approach on the data engineering side:• Moved most calculations (e.g., conversion rates, ROAS) to the query layer in BigQuery• Created materialized views for campaign-level summaries• Used scheduled queries to pre-aggregate weekly and monthly data• Limited Looker Studio to one direct connector per dashboard and cached data where possibleResult: dashboards now load in \~3 seconds instead of 15–20, and we can scale them across accounts with minimal changes.Just sharing this in case others are using BI tools on top of large datasets—interested to hear how others here are managing dashboard performance from a data pipeline perspective.",3,0.72,2,https://www.reddit.com/r/dataengineering/comments/1jujn9j/lessons_from_optimizing_dashboard_performance_on/,2025-04-08 17:43:22,2025-04-13 02:54:53
1jslgbb,Is Strong DSA Knowledge Essential for Data Engineering Roles?,MazenMohamed1393,dataengineering,"Is data engineering more like software engineering, requiring solid skills in data structures and algorithms (DSA)? Do data engineers need to be able to solve at least medium-level problems on LeetCode to succeed in interrviews at good companies?Also, is it necessary to thoroughly understand and solve problems for all of the following topics, or just some of them?Data Structures:Vectors, Time and Space Complexity, Singly Linked List, Doubly Linked List, Stack, Queue, Binary Tree, Binary Search Tree, Heap, Trie, AVL Tree, Hash Tables.Algorithms:Sorting, Binary Search, Graph Algorithms (Kruskal, Prim, Dijkstra, ...), Dynamic Programming, Backtracking, Divide and Conquer.",4,0.6,19,https://www.reddit.com/r/dataengineering/comments/1jslgbb/is_strong_dsa_knowledge_essential_for_data/,2025-04-06 03:55:00,2025-04-13 02:54:53
1jsl4jz,Data streaming experience,x-modiji,dataengineering,Have you ever worked on real-time data integration? Can you share the architecture/data flow and tech stack? what was the final business value that was extracted?I'm new to data streaming and would like to do some projects around this.Thanks!!,4,0.75,2,https://www.reddit.com/r/dataengineering/comments/1jsl4jz/data_streaming_experience/,2025-04-06 03:34:49,2025-04-13 02:54:53
1jxswyj,Dilemma: SWE vs DE @ Big Tech,marioagario123,dataengineering,"I currently work at a Big Tech and have 3 YoE. My role is a mix of Full-Stack + Data Engineering. I want to keep preparing for interviews on the side, and to do that I need to know which role to aim for. Pros of SWE:- more jobs positions - I have already invested 300 hours into DSA Leetcode. Don’t have to start DE prep from scratch-Maybe better quality of work/pay(?)Pros of DE:- targeting a niche has always given me more callbacks- if I practice a lot of sql, the interviews at FAANG could be gamed. FAANG do ask DSA but they barely scratch the surfaceMy thoughts:Ideally I want to crack the SWE role at a FAANG as I like both roles equally but SWE pays 20% more. If I don’t get callbacks for SWE, then securing a similar pay through a DE role at FAANG is lucrative too. I’d be completely fine with doing DE, but I feel uneasy wasting the 100s of hours I spent on DSA. Applying for both jobs is sub optimal as I can only sink my time into SQL or DSA | system design or data modelling. What do you folks suggest?",4,0.62,6,https://www.reddit.com/r/dataengineering/comments/1jxswyj/dilemma_swe_vs_de_big_tech/,2025-04-12 22:17:20,2025-04-13 02:54:53
1jxp3m5,Question about HDFS,undercoverlife,dataengineering,"The course I'm taking is 10 years old so some information I'm finding is irrelevant, which prompted the following questions from me: I'm learning about replication factors/rack awareness in HDFS and I'm curious about the current state of the world. How big are replication factors for massive companies today like, let's say, Uber? What about Amazon? Moreover, do these tech giants even use Hadoop anymore or are they using a modernized version of it in 2025? Thank you for any insights.",4,0.71,10,https://www.reddit.com/r/dataengineering/comments/1jxp3m5/question_about_hdfs/,2025-04-12 19:20:05,2025-04-13 02:54:53
1jxk6l2,Mastering Spark Structured Streaming Integration with Azure Event Hubs,Nice_Substance_6594,dataengineering,"Are you curious about building real-time streaming pipelines from popular streaming platforms like Azure Event Hubs? In this tutorial, I explain key Event Hubs concepts and demonstrate how to build Spark Structured Streaming pipelines interacting with Event Hubs. Check it out here: [https://youtu.be/wo9vhVBUKXI](https://youtu.be/wo9vhVBUKXI)",2,0.63,0,https://www.reddit.com/r/dataengineering/comments/1jxk6l2/mastering_spark_structured_streaming_integration/,2025-04-12 15:43:22,2025-04-13 02:54:53
1jxdch4,Which API system for my Postgres DWH?,rick854,dataengineering,"Hi everyone,I am building a data warehouse for my company and because we have to process mostly spatial data I went with a postgres materialization. My stack is currently:- dlt- dbt- dagster- postgresNow I have the use case that our developers at our company need some of the data for our software solutions to be integrated. And I would like to provide an API for easy access to the data. So I am wondering which solution is best for me. I have some experience in a private project with postgREST and found it pretty cool to directly use DB views and functions as endpoints for the API. But tools like FastAPI might be more mature for a production system. What would you recommend?[View Poll](https://www.reddit.com/poll/1jxdch4)",3,0.81,0,https://www.reddit.com/r/dataengineering/comments/1jxdch4/which_api_system_for_my_postgres_dwh/,2025-04-12 09:20:05,2025-04-13 02:54:53
