id,title,author,subreddit,content,score,upvote_ratio,num_comments,url,created_utc,extracted_at
1l4wv4r,Stuck in a “Data Engineer” Internship That’s Actually Web Analytics — Need Advice,GarageFederal,dataengineering,"Hi everyone,I’m a 2025 graduate currently doing a 6-month internship as a Data Engineer Intern at a company. However, the actual work is heavily focused on digital/web analytics using tools like Adobe Analytics and Google Tag Manager. There’s no SQL, no Python, no data pipelines—nothing that aligns with real data engineering.Here’s my situation:•It’s a 6-month probation period, and I’ve completed 3 months.•The offer letter mentions a 12-month bond post-probation, but I haven’t signed any separate bond agreement—just the offer letter.•The stipend is ₹12K/month during the internship. Afterward, the salary is stated to be between ₹3.5–5 LPA based on performance, but I’m assuming it’ll be closer to ₹3.5 LPA.•When I asked about the tech stack, they clearly said Python and SQL won’t be used.•I’m learning Python, SQL, ETL, and DSA on my own to become a real data engineer.•The job market is rough right now and I haven’t secured a proper DE role yet. But I genuinely want to break into the data field long term.•I’m also planning to apply for Master’s programs in October for the 2026 intake.",6,0.69,16,https://www.reddit.com/r/dataengineering/comments/1l4wv4r/stuck_in_a_data_engineer_internship_thats/,2025-06-06 16:32:14,2025-06-11 01:44:19
1l4as6j,How to handle source table replication with duplicate records and no business keys in Medallion Architecture,UnusualIntern362,dataengineering,"Hi everyone,I’m working as a data engineer on a project that follows a Medallion Architecture in Synapse, with bronze and silver layers on Spark, and the gold layer built using Serverless SQL.For a specific task, the requirement is to replicate multiple source views exactly as they are — without applying transformations or modeling — directly from the source system into the gold layer. In this case, the silver layer is being skipped entirely, and the gold layer will serve as a 1:1 technical copy of the source views.While working on the development, I noticed that some of these source views contain duplicate records. I recommended introducing logical business keys to ensure uniqueness and preserve data quality, even though we’re not implementing dimensional modeling. However, the team responsible for the source system insists that the views should be replicated as-is and that it’s unnecessary to define any keys at all.I’m not convinced this is a good approach, especially for a layer that will be used for downstream reporting and analytics.What would you do in this case?Would you still enforce some form of business key validation in the gold layer, even when doing a simple pass-through replication?Thanks in advance.",5,0.79,7,https://www.reddit.com/r/dataengineering/comments/1l4as6j/how_to_handle_source_table_replication_with/,2025-06-05 21:12:17,2025-06-11 01:44:19
1l3vbca,My first data engineer project is it good ? I can take negative comments too so you can review it completely,thetemporaryman,dataengineering,https://github.com/sksj007/lstm-traffic-flow-prediction.git,6,0.6,11,https://www.reddit.com/r/dataengineering/comments/1l3vbca/my_first_data_engineer_project_is_it_good_i_can/,2025-06-05 10:00:14,2025-06-11 01:44:19
1l37a1g,Why Your Data Architecture Needs More Than Basic Storage-Compute Separation,AssistPrestigious708,dataengineering,"I wrote a new article about Storage-Compute Separation: a deep dive into the concept of storage-compute separation and what it means for your business. If you're into this too or have any thoughts, feel free to jump in — I'd love to chat and exchange ideas!",8,0.63,5,https://medium.com/@databend/why-your-data-architecture-needs-more-than-basic-storage-compute-separation-5f845605671e,2025-06-04 14:40:49,2025-06-11 01:44:19
1l342li,"refactoring my DE code, looking for advice",BigMickDo,dataengineering,[deleted],6,1.0,1,https://www.reddit.com/r/dataengineering/comments/1l342li/refactoring_my_de_code_looking_for_advice/,2025-06-04 12:18:25,2025-06-11 01:44:19
1l30m1l,Suggestions for on-premise dwh PoC,Top_Manufacturer1205,dataengineering,"We currently have 20-25 MSQL databases, 1 Oracle and some random files. The quantity of data is about 100-200GB per year. Data will be used for Python data science tasks, reporting in Power BI and .NET applications.Currently there's a data-pipeline to Snowflake or RDS AWS. This has been a rough road of Indian developers with near zero experience, horrible communication with IT due to lack of capacity,... Currently there has been an outage for 3 months for one of our systems. This cost solution costs upwards of 100k for the past 1,5 year with numerous days of time waste.We have a VMWare environment with plenty of capacity left and are looking to do a PoC with an on-premise datawarehouse. Our needs aren't that elaborate. I'm located in operations as data person but out of touch with the latest solutions.* Cost is irrelevant if it's not >15k a year.* About 2-3 developers working on seperate topics",5,0.71,13,https://www.reddit.com/r/dataengineering/comments/1l30m1l/suggestions_for_onpremise_dwh_poc/,2025-06-04 08:50:06,2025-06-11 01:44:19
1l7u2u7,Presentation Layer Approach,regal_ethereal7,dataengineering,"I work for a transportation company, and data users around the business almost exclusively use Power BI for reporting and dashboards etc.Our data warehouse design therefore tends towards presenting these users with fact and dimension tables in a traditional star schema for use in Power BI.We utilise surrogate keys to join between the fact and dim tables.Our data analysts perform the joins within Power BI so that they can resolve the surrogate key values and present users with the descriptions instead of the arbitrary surrogate key values.In your experience, is this a typical/preferred approach, or would you expect the table/view accessed by the analyst to already have the joins resolved?I’m sure the answer lies in the “it depends” category. We have a bit of a stand off between those who think joins should always be resolved in PBI and those who think otherwise.Interested to hear of others opinions and experience.",4,0.84,2,https://www.reddit.com/r/dataengineering/comments/1l7u2u7/presentation_layer_approach/,2025-06-10 09:10:52,2025-06-11 01:44:19
1l7tbsz,What is the best way to reduce parallel task runs in a pipeline if the tool does not natively support it?,klenium,dataengineering,"Imagine that we have a pipeline and 100s of tasks inside it. Some tasks are depend on others so we can fill dependency trees. But not just one, as there are subsets of tasks that do not depend on any other subsets of tasks. So those subsets can run parallel (as without dependency connection they can be started immediately by the platform).I work in Databricks, which does not allow limiting the number of in-progress tasks at once. If there are too many in-progress tasks, the driver node may receive too large workload and crash.1. Upscale driver: I do not need this, I could wait for normal, slower, cheaper run.2. Add a normal dependency from the end of A subtree to the beginning of B subtree. This way I can limit the number of in-progress tasks, but if something in A fails, B will not start. Also it messes up lineage reporting.3. Same as #2 but the dependency type is All Done. The problem is that if something in A fails, B is started and if it finishes successfully, the pipeline hides the error from A.4. Create ""dummy tasks"" as checkpoints, connect 10 tasks to the first, checkpoint, connect another 10 ... This would kill the overall performance.5. Create separated workflows to all dependent subset of tasks, and use All Done connection type between them, and set up error reporting to the sub-workflows.6. Dynamically start tasks based on the current workload. This would add extra maintenance, manual dependency processing.Do you have any better solutions?",5,1.0,3,https://www.reddit.com/r/dataengineering/comments/1l7tbsz/what_is_the_best_way_to_reduce_parallel_task_runs/,2025-06-10 08:18:46,2025-06-11 01:44:19
1l7oij7,Airflow for ingestion and control m for orchestration,Foot_Straight,dataengineering,"My current company ( bank in newzealand) is using astronomer hosted airflow for creating etl pipeline then using control m for orchestration ‌, what could be the reason ? For me it's kind of looks like messed up .",4,0.76,6,https://www.reddit.com/r/dataengineering/comments/1l7oij7/airflow_for_ingestion_and_control_m_for/,2025-06-10 03:17:09,2025-06-11 01:44:19
1l7nomj,Recommendation for comparing two synced data sources?,devschema,dataengineering,"We’re looking for a tool to compare data across two systems that are supposed to stay in sync. Right now, it’s Oracle and BigQuery, but ideally the tool would work with any combination of databases.This isn’t a one-time migration, we need to reconcile differences continuously to ensure data consistency across systems. Any recommendations?",4,0.76,6,https://www.reddit.com/r/dataengineering/comments/1l7nomj/recommendation_for_comparing_two_synced_data/,2025-06-10 02:33:42,2025-06-11 01:44:19
1l6pkjp,Data Governance Open-source Tool,Data-Sleek,dataengineering,I was wondering if someone could recommend an open source Data Governance tool and share their experience. I've looked at: [https://datahub.com/](https://datahub.com/) [https://www.truedat.io/](https://www.truedat.io/),5,0.78,5,https://www.reddit.com/r/dataengineering/comments/1l6pkjp/data_governance_opensource_tool/,2025-06-08 23:05:41,2025-06-11 01:44:19
1l5o5e9,I’m building a customizable XML validator – feedback welcome!,Andrewraj10,dataengineering,"Hey folks — I’m working on a tool that lets you define your own XML validation rules through a UI. Things like:* Custom tags* Attribute requirements* Regex patterns* Nested tag rulesIt’s for devs or teams that deal with XML in banking, healthcare, enterprise apps, etc. I’m trying to solve some of the pain points of using rigid schema files or complex editors like Oxygen or XMLSpy.If this sounds interesting, I’d love your feedback through this quick 3–5 min survey: :backhand_index_pointing_right: [https://docs.google.com/forms/d/e/1FAIpQLSeAgNlyezOMTyyBFmboWoG5Rnt75JD08tX8Jbz9-0weg4vjlQ/viewform?usp=dialog](https://docs.google.com/forms/d/e/1FAIpQLSeAgNlyezOMTyyBFmboWoG5Rnt75JD08tX8Jbz9-0weg4vjlQ/viewform?usp=dialog)No email required. Just trying to build something useful, and your input would help me a lot. Thanks!",5,1.0,2,https://www.reddit.com/r/dataengineering/comments/1l5o5e9/im_building_a_customizable_xml_validator_feedback/,2025-06-07 15:57:51,2025-06-11 01:44:19
1l5iv1q,Suggestions welcome: Data ingestion gzip vs uncompressed data in Spark?,devanoff214,dataengineering,"I'm working on some data pipelines for a new source of data for our data lake, and right now we really only have one path to get the data up to the cloud. Going to do some hand-waving here only because I can't control this part of the process (for now), but a process is extracting data from our mainframe system as text (csv), and then compressing the data, and then copying it out to a cloud storage account in S3.Why compress it? Well, it does compress well; we see around \~30% space saved and the data size is not small; we're going from roughly 15GB per extract to down to 4.5GB. These are averages; some days are smaller, some are larger, but it's in this ballpark. Part of the reason for the compression is to save us some bandwidth and time in the file copy.So now, I have a spark job to ingest the data into our raw layer, and it's taking longer than I \*feel\* it should take. I know that there's some overhead to reading compressed .gzip (I feel like I read somewhere once that it has to read the entire file on a single thread first). So the reads and then ultimately the writes to our tables are taking a while, longer than we'd like, for the data to be available for our consumers.The debate we're having now is where do we want to ""eat"" the time:* Upload uncompressed files (vs compressed) so longer times in the file transfer* Add a step to decompress the files before we read them* Or just continue to have slower ingestion in our pipelinesMy argument is that we can't beat physics; we are going to have to accept some length of time with any of these options. I just feel as an organization, we're over-indexing on a solution. So I'm curious which ones of these you'd prefer? And for the title:",7,0.89,9,https://www.reddit.com/r/dataengineering/comments/1l5iv1q/suggestions_welcome_data_ingestion_gzip_vs/,2025-06-07 11:42:44,2025-06-11 01:44:19
1l59cde,Enriching data across databases,Zestyclose_Rip_7862,dataengineering,"We’re working with a system where core transactional data lives in MySQL, and related reference data is now stored in a normalized form in Postgres.A key limitation: the apps and services consuming data from MySQL cannot directly access Postgres tables. Any access to Postgres data needs to happen through an intermediate mechanism that doesn’t expose raw tables.We’re trying to figure out the best way to enrich MySQL-based records with data from Postgres — especially for dashboards and read-heavy workloads — without duplicating or syncing large amounts of data unnecessarily.We use AWS in many parts of our stack, but not exclusively. Cost-effectiveness matters, so open-source solutions are a plus if they can meet our needs.Curious how others have solved this in production — particularly where data lives across systems, but clean, efficient enrichment is still needed without direct table access.",4,0.75,9,https://www.reddit.com/r/dataengineering/comments/1l59cde/enriching_data_across_databases/,2025-06-07 01:43:31,2025-06-11 01:44:19
1l4pdjv,Relative simple ETL project on Azure,skarnl,dataengineering,"For a client I'm looking to setup the following and figured here was the best place to ask for some advice: they want to do their analyses using Power BI on a combination of some APIS and some static files. I think to set it up as follows: \- an Azure Function that contains a Python script to query 1-2 different api's. The data will be pushed into an Azure SQL Database. This Function will be triggered twice a day with a timer \- store the 1-2 static files (Excel export and some other CSV) on an Azure Blob StorageNever worked with Azure, so I'm wondering what's the best approach how to structure this. I've been dabbling with \`az\` and custom commands, until this morning I stumbled upon \`azd\` - which looks more to what I need. But there are no templates available for non-http Functions, so I should set it up myself. ( And some context, I've been a webdeveloper for many years now, but slowly moving into data engineering ... it's more fun :D )Any tips are helpful. Thanks.",6,0.88,8,https://www.reddit.com/r/dataengineering/comments/1l4pdjv/relative_simple_etl_project_on_azure/,2025-06-06 10:49:28,2025-06-11 01:44:19
1l4hdje,Industry Conference Recommendations,WonderfulActuator312,dataengineering,"Do you guys have any recommendations for conferences to attend or that you found helpful both specific to the Data Engineering profession or adjacently related? Mostly looking for events to do some research on to attend either this year or next and not necessarily looking specifically for my tech stack (AWS, Snowflake, Airflow, Power BI).",3,0.72,6,https://www.reddit.com/r/dataengineering/comments/1l4hdje/industry_conference_recommendations/,2025-06-06 02:26:55,2025-06-11 01:44:19
1l4336d,"Database, Data Warehouse Migrations & DuckDB Warehouse with sqlglot and ibis",Mevrael,dataengineering,"Hi guys, I've released the next version for the Arkalos data framework. It now has a simple and DX-friendly Python migrations, DDL and DML query builder, powered by sqlglot and ibis: class Migration(DatabaseMigration): def up(self): with DB().createTable('users') as table: table.col('id').id() table.col('name').string(64).notNull() table.col('email').string().notNull() table.col('is_admin').boolean().notNull().default('FALSE') table.col('created_at').datetime().notNull().defaultNow() table.col('updated_at').datetime().notNull().defaultNow() table.indexUnique('email') # you can run actual Python here in between and then alter a table def down(self): DB().dropTable('users')There is also a new and partial support for the DuckDB warehouse, and 3 data warehouse layers are now available built-in: from arkalos import DWH() DWH().raw()... # Raw (bronze) layer DWH().clean()... # Clean (silver) layer DWH().BI()... # BI (gold) layerLow-level query builder, if you just need that SQL: from arkalos.schema.ddl.table_builder import TableBuilder with TableBuilder('my_table', alter=True) as table: ... sql = table.sql(dialect='sqlite')**GitHub and Docs:**Docs: [https://arkalos.com/docs/migrations/](https://arkalos.com/docs/migrations/)GitHub: [https://github.com/arkaloscom/arkalos/](https://github.com/arkaloscom/arkalos/)",6,0.88,0,https://www.reddit.com/r/dataengineering/comments/1l4336d/database_data_warehouse_migrations_duckdb/,2025-06-05 16:07:13,2025-06-11 01:44:19
1l3k2zf,Iceberg CDC,komm0ner,dataengineering,"Super basic flow description - We have Kafka writing parquet files to S3 which is our Apache Iceberg data layer supporting various tables containing the corresponding event data. We then have periodically run ETL jobs that create other Iceberg tables (based off of the ""upstream"" tables) that support analytics, visualization, etc.These jobs run a `CREATE OR REPLACE ` sql statement, so full table refresh each time. We'd like to be able to also support some type of change data capture technique to avoid always dropping/creating tables and the cost and time associated with that. Simply capturing new/modified records would be an acceptable start. Can anyone suggest how we can approach this. This is kinda new territory for our team. Thanks.",5,0.78,8,https://www.reddit.com/r/dataengineering/comments/1l3k2zf/iceberg_cdc/,2025-06-04 23:12:38,2025-06-11 01:44:19
1l3c481,Feeling stuck as a Data Engineer at Infosys — Seeking guidance to switch to a startup or product-based company,Top_Anteater_8378,dataengineering,"Hi everyone,I’m currently working as a Data Engineer at Infosys. I joined in September 2024 and graduated the same year. It's been about 9 months, but I feel like I’m not learning enough or growing in my current role.I’m seriously considering a switch to a startup or product-based company where I can gain better experience and skills.I’d appreciate your guidance on:* How to approach the job search effectively* Ways to stand out while applying* What are the chances of getting shortlisted with my background* Any tips or resources that helped you in a similar situationThanks a lot in advance for your support and advice!",7,0.82,12,https://www.reddit.com/r/dataengineering/comments/1l3c481/feeling_stuck_as_a_data_engineer_at_infosys/,2025-06-04 17:49:07,2025-06-11 01:44:19
1l8902a,Help Needed: AWS Data Warehouse Architecture with On-Prem Production Databases,Affectionate_Ship256,dataengineering,"Hi everyone,I'm designing a data architecture and would appreciate input from those with experience in hybrid on-premise + AWS data warehousing setups.Context* We run a SaaS microservices platform on-premise using mostly PostgreSQL although there are a few MySQL and MongoDB.* The architecture is database-per-service-per-tenant, resulting in many small-to-medium-sized DBs.* Combined, the data is about 2.8 TB, growing at \~600 GB/year.* We want to set up a data warehouse on AWS to support: * Near real-time dashboards (5 - 10 minutes lag is fine), these will mostly be operational dashbards * Historical trend analysis * Multi-tenant analytics use cases# Current Design ConsiderationsI have been thinking of using the following architecture:1. CDC from on-prem Postgres using AWS DMS2. Staging layer in Aurora PostgreSQL - this will combine all the databases for all services and tentants into one big database - we will also mantain the production schema at this layer - here i am also not sure whether to go straight to Redshit or maybe use S3 for staging since Redshift is not suited for frequent inserts coming from CDC3. Final analytics layer in either: * Aurora PostgreSQL - here I am consfused, i can either use this or redshift * Amazon Redshift - I dont know if redshift is an over kill or the best tool * Amazon quicksight for visualisationsWe want to support both real-time updates (low-latency operational dashboards) and cost-efficient historical queries.# Requirements* Near real-time change capture (5 - 10 minutes)* Cost-conscious (we're open to trade-offs)* Works with dashboarding tools (QuickSight or similar)* Capable of scaling with new tenants/services over time# :red_question_mark: What I'm Looking For1. Anyone using a similar **hybrid on-prem → AWS** setup: * What worked or didn’t work?2. Thoughts on using Aurora PostgreSQL as a landing zone vs S3?3. Is Redshift overkill, or does it really pay off over time for this scale?4. Any gotchas with AWS DMS CDC pipelines at this scale?5. Suggestions for real-time + historical unified dataflows (e.g., materialized views, Lambda refreshes, etc.)",3,0.72,1,https://www.reddit.com/r/dataengineering/comments/1l8902a/help_needed_aws_data_warehouse_architecture_with/,2025-06-10 20:11:07,2025-06-11 01:44:19
1l7stk1,How popular is Apache Pinot - Paimon - Kudu and are they a good combo for lakehouse atm?,agony1091,dataengineering,"My company CEO suddenly hires a consultant firm from a guy he knows (ex-CTO of a pretty big company) to overhaul the internal IT and Data system, mostly the IT system. But they advised to rebuild the whole data system first and sent a doc file describing these 3 things (just the storage, not event the architecture) then got mad when our data team got questions and refused to answer anything.I'm livid, but that's beside the point. What I want to ask is whether those are a good storage - metastore and DWH db for lakehouse compared to the more modern opensource stack (says Minio - Iceberg/Delta - Trino for query) or classics like Hadoop. I almost never heard of Pinot and Paimon and don't know if I can even find guys with experience with those in my country if we have to maintain the thing in case they got built. For Apache Kudu, their last update is like 3 years ago.",4,0.67,7,https://www.reddit.com/r/dataengineering/comments/1l7stk1/how_popular_is_apache_pinot_paimon_kudu_and_are/,2025-06-10 07:43:30,2025-06-11 01:44:19
1l7hb43,Ideas to Automate Data Report from SaaS with no access to API,onmywaytostealyagirl,dataengineering,"Hi All! I am working on trying to automate a data extraction from a SaaS that displays a data table that I want to push into my database hosted on Azure. Unfortunately the CSV export requires me to sign-in with an email 2FA and then request it on the UI, and then download it after about 1min or so. The email log-in has made it difficult to scrape with headless browser and they do not have a read-only API, and they do not email the CSV export either. Am I out of luck here? Any avenues to automatically extract this data?",5,1.0,3,https://www.reddit.com/r/dataengineering/comments/1l7hb43/ideas_to_automate_data_report_from_saas_with_no/,2025-06-09 21:37:43,2025-06-11 01:44:19
1l78ec8,Custom mongoDB CDC handler in pyspark,iam_mahend,dataengineering,"I want to replicate a collection and sync in real time.The CDC events are streamed to Kafka and I’ll be listening to it and based on operationType I’ll have to process the document and load it in delta table. I have all the columns possible in my table in case of schema change in fullDocument.I am working with PySpark in Databricks. I have tried couple of different approaches -1. using forEachBatch, clusterTime for ordering but this requires me to do a collect and process event, this was too slow2. Using SCD kind of approach where Instead of deleting any record I was marking them inactive -This does not give you a proper history tracking because for an `_id` I am taking the latest change and processing it. What issue I am facing with this is - I have been told by the source team that I can get an insert event for an `_id` after a delete event of the same `_id` so if in my batch for an `_id` there are events - “update → delete, → insert” then based on latest change I’ll pick the insert and this will cause a duplicate record in my table.What will be the best way to handle this?",3,0.81,1,https://www.reddit.com/r/dataengineering/comments/1l78ec8/custom_mongodb_cdc_handler_in_pyspark/,2025-06-09 15:53:39,2025-06-11 01:44:19
