id,title,author,subreddit,content,score,upvote_ratio,num_comments,url,created_utc,extracted_at
1l3j997,Leave current job for Capital One,Peach_Boi_,cscareerquestions,Have been working at a gov contracting company and the WLB and tech stack is good. Also it is fully remote. I recently interviewed with capital one and got an offer for their senior engineer role. Here is a comparison between the jobs:Current role:Comp: 110kBonus: NoneDays in office: RemoteCommute: noneCapital one:Comp: ~170kBonus: ~9kDays in office: 3Commute: 35minLocation: McLeanMy question is that I know Capital one has much better compensation but I am worried about the stack ranking that they do there. I am prepared to work hard but I’ve heard that if you get a bad manager you are screwed. What do you all think is the best choice. Stay or go? Any team recommendations or teams to stay away from?,230,0.93,197,https://www.reddit.com/r/cscareerquestions/comments/1l3j997/leave_current_job_for_capital_one/,2025-06-04 22:36:18,2025-06-11 01:44:21
1l6yrv6,Why are there so many non-tech leaders in this industry?,RareMeasurement2,cscareerquestions,"Why are there so many non-technical leaders in the IT industry without CS or Engineering backgrounds? Curious to know how these career transitions happen, and why does the industry seem to reward them over experienced technical professionals?Examples I found while browsing LinkedIn:- Background in English Literature, now a Senior Product Manager at a Fortune 500 company- Background in Accounting, now VP of Digital Transformation- Background in Religious Studies, now Director of IT Strategy at a global multinationalI wish I was joking, but you can also look up yourself and find similar examples. I don't think there has been any research on why this happens, but interested to hear everyone's thoughts.",231,0.9,88,https://www.reddit.com/r/cscareerquestions/comments/1l6yrv6/why_are_there_so_many_nontech_leaders_in_this/,2025-06-09 07:40:34,2025-06-11 01:44:21
1l30ir3,Why don't US companies just offer lower wages?,Prudent-Fun-2833,cscareerquestions,"It's obvious the market is highly-competitive. Couldn't companies just get away with paying less money and still getting a fairly wide range of applicants to choose from? Plus, not only is the market competitive for domestic US workers, but COVID expanded the labor pool by further enabling remote work and offshoring. Why don't companies just pay less? It really seems like they have the leverage to.",195,0.75,182,https://www.reddit.com/r/cscareerquestions/comments/1l30ir3/why_dont_us_companies_just_offer_lower_wages/,2025-06-04 08:43:52,2025-06-11 01:44:21
1l6era4,"People who made a complete career pivot to another industry/life path after working in tech, what's the story?",amanhasnoname54,cscareerquestions,"I'm 28, 5 YoE, and like my job just fine and feel very fortunate to have it. But as I become closer to paying off student loans and other debts, I am increasingly thinking about roads not taken and whether I want my career/life defined by an industry I don't have much passion for.",180,0.96,64,https://www.reddit.com/r/cscareerquestions/comments/1l6era4/people_who_made_a_complete_career_pivot_to/,2025-06-08 15:23:55,2025-06-11 01:44:21
1l66t6h,"Programmers who spend many hours sat down, how do you stay physically fit and healthy? what stretches or exercises i should be doing everyday to undo damage of sitting down for many hours?",TailungFu,cscareerquestions,"the physical health is taking a toll on me, i need recommendations from professionals at sitting down for many hours without experiencing body decay and detoriation",179,0.93,265,https://www.reddit.com/r/cscareerquestions/comments/1l66t6h/programmers_who_spend_many_hours_sat_down_how_do/,2025-06-08 07:56:17,2025-06-11 01:44:21
1l33d0i,"""We are a very lean company"" then why so much management?",intimate_sniffer69,cscareerquestions,"I worked at Comcast, a Fortune 50 company, in business intelligence and data engineering. I was a senior analyst, but basically a manager mentoring three other associate two had no idea what they were doing half the time. But the weird part was the layoff they did earlier this year in April, laying off thousands of roles of White collar workers. They said that we have to be a lien company, we have to eliminate redundancies, which means that we have to make people who are already overworked suffer even more and now people are straddled with so much work that they don't have time to do....... One person doing the work of two or three, same deadlines, same expectations the entire team had... **""We are a lean company""** **BUT WHY IS THERE SO MUCH MANAGEMENT?** Above me in my org I had my manager, senior manager, director, senior director, VP number one, VP number two, SVP.... And this was supposedly a very lean organization, right? Totally lean, definitely no bloat there! /s there was a partner team that did almost the exact same thing as us for a different business unit and mirrored nearly the same management structure. VP down to analysts, and we often took on a lot of the stuff that they were supposed to take but they didn't have enough workers...And the weirdest part is that even though we have shifted hundreds of thousands of jobs over to India in their glorified BS office, we still continue to cut more jobs but none of them are management. I don't understand it. What the hell do you need all these managers for?",175,0.96,32,https://www.reddit.com/r/cscareerquestions/comments/1l33d0i/we_are_a_very_lean_company_then_why_so_much/,2025-06-04 11:41:19,2025-06-11 01:44:21
1l4zudm,"I have applied to around 500 jobs in computer vision seeking an entry level position, and I still don't have any offers. Can anyone relate?",Cheetah3051,cscareerquestions,"https://www.linkedin.com/in/yuvallevental/Admittedly, I have mostly been applying online. It's difficult to network in person, since I don't have a car, but I have managed to get around a little bit.I probably could have networked more during my classes, but I thought RIT was going to be very supportive and that I would find what I need (admittedly, I misunderstood the co-op program). Over the past couple years though, everything really went downhill.",168,0.88,45,https://www.reddit.com/r/cscareerquestions/comments/1l4zudm/i_have_applied_to_around_500_jobs_in_computer/,2025-06-06 18:33:00,2025-06-11 01:44:21
1l67bm5,Laid off,HiddenSquid404,cscareerquestions,"Got laid off after 5 years at this company, a few days ago. Along with 22 other people (mostly devs). I’m not complaining about the company - this job changed my life and I’d rather be here now than be one of those that are still there because it must be chaos them. I just don’t know how to deal with this emotional anxiety. I was ready for this, given how the tech industry has been lately. I started interviews already, hit up some folks in my network, started leetcode prep. But it’s this empty feeling that I can’t shake. Not my first lay off situation but it just rattles me like it did the first time. Thought I’d post here to get some guidance. Thank you in advance!",128,0.97,23,https://www.reddit.com/r/cscareerquestions/comments/1l67bm5/laid_off/,2025-06-08 08:31:16,2025-06-11 01:44:21
1l83wcw,Why is everyone SWE or bust and refuse to look at IT fields when salaries aren't that different?,tuckfrump69,cscareerquestions,A quick google search shows technical support engineers get paid maybe 15% less than SWE in general. And support engineers can easily make SWE level money with proper certs/skillsets.So why is everyone chasing SWE? It's not that great of a job anymore and is like 10x harder to get in.,129,0.76,193,https://www.reddit.com/r/cscareerquestions/comments/1l83wcw/why_is_everyone_swe_or_bust_and_refuse_to_look_at/,2025-06-10 16:55:36,2025-06-11 01:44:21
1l6rt8c,"Mastercard Job Offer Not Called ""Job Offer""?",Dyne790,cscareerquestions,"Hi all,Anyone have recent experience with job offers from MC?After a couple rounds of interviews for a Software Engineer II I got a phonecall from the recruiter. I wasn't actually expecting anything great because a couple weeks ago I was told that they still wanted to interview other candidates, but surprisingly the recruiter started giving me information about the job including what my exact salary would be, the bonus, etc. All details that were not concrete at this point.I was a little confused so I asked ""Is this you firmly giving me a job offer"" and the reply was ""Here at MC we don't give job offers, this is a calibration.""Still confused, I tried to get more information and said I was interested and said I wanted to discuss with my wife. The recruiter said that is okay, but let me know in a few hours. I asked for the weekend to think it over and said I would get back Monday. This seemed okay but said she would need the answer soon because of other candidates.Truthfully I have another final round that I am hoping to hear good news back from next week, but wanted to know if anyone had ever heard something similar about them not calling the job offer an actual job offer?",121,0.9,34,https://www.reddit.com/r/cscareerquestions/comments/1l6rt8c/mastercard_job_offer_not_called_job_offer/,2025-06-09 00:54:46,2025-06-11 01:44:21
1l3887x,"Meta or ex-Meta software engineers, what is your advice to fast promo and avoid layoffs?",lIIlIIIllIIIllIl,cscareerquestions,"I’m joining as E3. I would love to get to E4 in 18 months or less. I would also really hate to get laid off. Ideally, I think I would like to be at Meta at least until I’ve been E5 for a year or two.Fortunately for me, I have 4 internships under my belt and in my last 3, my managers have all been extremely happy with my performance. In my first internship, I had no idea what I was doing, so I think I underperformed but my manager never explicitly told me that I was underperforming or anything. He never told me I was doing well either.For my second internship, there were a few weeks where I put in 50-60 hour weeks to ship features ahead of conference demos and production timelines. And for my third internship, I was able to create a lot of BS impact. For my fourth internship, I worked on core changes that were actually used at scale (millions only, not billions like Meta).My point is that I think it’s clear that I am willing to put in long hours, I’m able to BS impact, I’ve worked at scale, and I’ve been previously a high-performer elsewhere. I think all of these will be helpful in fast promo and avoiding layoffs.",117,0.84,64,https://www.reddit.com/r/cscareerquestions/comments/1l3887x/meta_or_exmeta_software_engineers_what_is_your/,2025-06-04 15:17:42,2025-06-11 01:44:21
1l5aptb,Are there people with 10+ years of tech work experience who are struggling to find a job right now in the US? Which part of the jobhunt process are you facing issues in?,NightWarrior06,cscareerquestions,Please share your experience with the jobsearch with us.,108,0.97,65,https://www.reddit.com/r/cscareerquestions/comments/1l5aptb/are_there_people_with_10_years_of_tech_work/,2025-06-07 02:57:18,2025-06-11 01:44:21
1l50ygf,"Worked in North America for 8 years, got mocked behind my back for ""heavy accent""",ChatsNY,cscareerquestions,"This happened a few years ago, but I still think about it sometimes.I had a referral to a team and went through the interview, but I didn’t perform well. One question totally threw me off. They asked me to describe what a vacuum cleaner looks like to someone who’s never seen one, like on a phone call. So no gestures, no pictures, just words. I blanked. Couldn’t find the right words, not even with my mother tongue, got nervous, and the whole thing just spiralled.Then I got rejected. And I accepted this result.What I didn’t know was that some people on that team joked about me afterwards, said my English was bad and my accent was strong. I’ve been in North America for 8 years. It wasn’t even about my tech skills at that point, just that one moment became the whole impression.Fast forward a few months, and I got to know some people from that team through mutual friends. We ended up hanging out, chatting, nothing formal. At some point they realized I had applied before, and their reaction was... weird. They were like “wait, that was you? That new grad with a thick accent?”Guess what, they never even thought I had an accent, not once, until I told them I interviewed with their team before.They literally didn’t connect me with their memory of the interview, because I didn’t fit the version they made up.I’ve moved on now. It took time because, for a while, I really started questioning myself. My language, my background, my worth. All because of one bad moment and some people’s careless comments. But I’m sharing this now because I’ve healed enough to look back without that same sharp pain. Maybe someone out there needs to hear this too.",104,0.73,37,https://www.reddit.com/r/cscareerquestions/comments/1l50ygf/worked_in_north_america_for_8_years_got_mocked/,2025-06-06 19:18:48,2025-06-11 01:44:21
1l3m70p,"Name and shame: CoreWeave - almost ghosted twice after 7 rounds over 6 months - unclear roles, moving targets, zero feedback",LeadBamboozler,cscareerquestions,"Sharing this as a heads-up for anyone considering interviewing with CoreWeave, especially for security or infrastructure roles. I went through two interview loops with them, several months apart, and was ghosted once and required multiple follow-ups to not be ghosted a second time — despite confirmed positive feedback from interviewers.**Round 1 (~7 months ago)**I interviewed for a Tech Lead role with a near perfect match in domain, stack, ownership, and experience level. Went through five rounds:- Recruiter- Director- Tech Lead (coding round)- Principal Engineer (system design)- Security Analyst (cross-functional)I moved through the interview cycle and after the cross-functional round, the recruiter emailed me thanking me for taking the time to interview and said he’d collate the feedback and be in touch when he had an update. Ghosted after this email despite repeated follow-ups. I connected with the Director on LinkedIn a month or so after this.**Round 2 (3 weeks ago)**The director shared a Staff Engineer posting that looked to be a direct replacement for the Tech Lead role, so I reached out to him on LinkedIn. He apologized for the earlier ghosting, said I got strong feedback, and that the org had new leadership and shifted direction — fewer managers, more senior ICs. He said he’d love to re-engage and that the recruiter would reach out.The recruiter (same one who ghosted me originally) called me a few days later — but instead of the Staff role, he described an Infrastructure Security role that had similar domain requirements. Maybe I should’ve clarified right then, but I assumed it was all part of the same track and the recruiter mentioned that I would be assessed on the same principles that I was assessed on in the previous interview loop - he explicitly said that he had no concerns at all.They scheduled me with a new distinguished engineer who had joined since the original ghosting. We did not cover a single topic that was discussed in the previous interview.While the discussion was somewhat related to my area, there was a focus on some fairly obscure but oddly specific topics. Despite the curveball - I think I reasoned correctly about the nuances while acknowledging that this area was not something I had direct experience in. The discussion was still highly collaborative and flowed naturally and at the end, the DE mentioned he hoped to speak with me again soon.Then: more silence. Followed up with the recruiter. Nothing. Followed up with the Director on LinkedIn. He said, “let me talk to the recruiter.” A few days later I got a templated rejection email. Zero feedback with an explicit note in the template saying they can’t provide feedback.I understand that goals evolve quickly at high-growth companies. But from a candidate’s perspective, this felt like goalposts were shifting between cycles, and maybe even between rounds. There is a total misalignment in what they’re looking for and across what experience levels. Interestingly - one of the questions I asked DE was *what was the hardest problem he was trying to solve at CoreWeave?*His answer? Hiring and building the team.So if you're thinking of interviewing with CoreWeave: proceed with your eyes open. This process burned a lot of my time, and I walked away with zero signal on where I was off target.",102,0.96,14,https://www.reddit.com/r/cscareerquestions/comments/1l3m70p/name_and_shame_coreweave_almost_ghosted_twice/,2025-06-05 00:54:17,2025-06-11 01:44:21
1l7jh7e,How bad is it to take a year off?,littlehuman86,cscareerquestions,"Hi! I was recently laid off after working at the same company for six years. I've been applying for jobs, but haven't had any luck so far. I'm feeling mentally and physically burned out and really want to take some time off to rest and catch up with the industry. However, I'm worried that this break might hurt my chances when I start applying again. If anyone has any advice or experience to share, I would really appreciate it.",102,0.94,64,https://www.reddit.com/r/cscareerquestions/comments/1l7jh7e/how_bad_is_it_to_take_a_year_off/,2025-06-09 23:10:09,2025-06-11 01:44:21
1l3qxqk,Is the entire industry like this right now?,Personal-Molasses537,cscareerquestions,"I've been looking at applications on LinkedIn, and all I can see are posts that get 100+ applications in a few hours like [this one](https://www.linkedin.com/jobs/view/4190814820). Is the market really that bad that somehow employers have all the leverage and competition is really that fierce? I've looked through hundreds of postings so far and all the same, 100s of applications. I'm considering looking for jobs in other fields if it's this bad.",102,0.9,66,https://www.reddit.com/r/cscareerquestions/comments/1l3qxqk/is_the_entire_industry_like_this_right_now/,2025-06-05 05:07:13,2025-06-11 01:44:21
1l2y605,The Tech Recruitment Ruse That Has Avoided Trump’s Crackdown on Immigration,Worth-Television-872,cscareerquestions,"Great article about US immigration laws (H1B, PERM, etc):[https://www.propublica.org/article/trump-immigration-h1b-visas-perm-tech-jobs-recruitment](https://www.propublica.org/article/trump-immigration-h1b-visas-perm-tech-jobs-recruitment)",92,0.86,58,https://www.reddit.com/r/cscareerquestions/comments/1l2y605/the_tech_recruitment_ruse_that_has_avoided_trumps/,2025-06-04 06:04:31,2025-06-11 01:44:21
1l7ngge,Tax section 174 and its impact on IT Layoffs,Fearless_Weather_206,cscareerquestions,They are trying to organize Americans who’ve been impacted or to be potentially impacted to help sign a letter to committee members to prevent further job losseshttps://news.ycombinator.com/item?id=44226145,85,0.9,16,https://www.reddit.com/r/cscareerquestions/comments/1l7ngge/tax_section_174_and_its_impact_on_it_layoffs/,2025-06-10 02:22:21,2025-06-11 01:44:21
1l76z18,"How do I talk to my ""mentor""",Fabulous_Yam_6386,cscareerquestions,"So I just got an internship, and have been told that a guy a few ranks up from myself is my ""mentor."" He seems super chill, and has been reaching out and we've been chit-chatting very formally about work.He gave a speech to me and the other incoming employees, and in he said it he said something like ""It's good to be professional, but don't be a robot and don't always talk about work.""So would it be okay for me to say things like ""lol"" or casually ask him how his weekend went?",82,0.9,39,https://www.reddit.com/r/cscareerquestions/comments/1l76z18/how_do_i_talk_to_my_mentor/,2025-06-09 14:57:35,2025-06-11 01:44:21
1l4ixlv,Norm companies think themselves too high,NiceGame2006,cscareerquestions,"Shitty vendors interviewed for > 1 hr , and told me there are maybe 2 more roundsWtf do you think you are some ibank or famous inhouse? hire me or don't jeezPs. Junior role",77,0.76,51,https://www.reddit.com/r/cscareerquestions/comments/1l4ixlv/norm_companies_think_themselves_too_high/,2025-06-06 03:50:18,2025-06-11 01:44:21
1l5sz35,You’re Afraid of Networking? That’s Your Sign to Start Today,seekgs_2023,cscareerquestions,"I've helped a lot of students & early-career folks with job hunting, and one fear comes up all the time: **networking**. So many people are scared they'll say the wrong thing, or that their message will just get ignored.Totally get it! I've been there too. But based on what I’ve seen from job seekers who’ve actually landed roles (including some who started with zero connections), here are some tips that really work:**1. Start with a 15 min coffee chat**Don’t overthink it. You’re not asking for a job. You’re just asking for 15 minutes to get to know the other person’s position. Most professionals remember what it felt like in the beginning, and they’re happy to help.You can say something like, “Hi \[name\], I’m currently studying \[major\] and exploring career paths in \[field\]. If you’d like to chat with me for 15 minutes, I’d love to hear about your experiences.”**2. Build rapport: \~2 min**Don’t jump right into the subject. Start by warming up with a friendly opening line:“How are you doing today?”“Hope you’re having a great week, thank you for your time!”It’s a small thing, but it can create a relaxed atmosphere and make both parties feel more comfortable.**3. Introduce yourself: 2-3 min**Keep it brief and to the point. Think of it like your LinkedIn verbal summary.“I’m currently a Data Analytics student at \[school\] and I’m really interested in marketing analytics. I’ve worked on projects with A/B testing and Tableau dashboards, and I’d love to learn more about what careers in this field really look like.”Confidence comes from clarity of thought: if you know what you want, you’ll be ten times more confident when you speak your mind.**4. Ask two good questions: \~10 min**This is where you learn. Try:“What do you like most (and least) about your job?”“How did you get into this field?”“If you graduated today, what would you focus on?”Avoid asking generic questions like “How is your company?” Just try to show curiosity and depth.**5. Follow up consistently**Send a quick thank you note and ask if they’d like to stay in touch. That’s it. Relationships are developed through follow-up, not one-off chats.**Tips:**\- If you don't hearing back so far: Try alumni, smaller companies, or people who are 1-3 years ahead of you. They’re often more responsive than FAANG executives.\- Feeling nervous all the time? Write a pitch and practice it with a friend before the actual chat.\- Keep a spreadsheet of who you reached out to, when, and what you learned.So if you’re afraid of networking, you’re not alone. I’ve been there. Take the first step and you’ll be pleasantly surprised at where it leads.Has anyone else networked their way into your first job? How did you succeed?",77,0.77,29,https://www.reddit.com/r/cscareerquestions/comments/1l5sz35/youre_afraid_of_networking_thats_your_sign_to/,2025-06-07 19:25:23,2025-06-11 01:44:21
1l6x2lg,How many of you in this subreddit are unemployed at the moment? How long have you been out of a job?,NightWarrior06,cscareerquestions,Maybe hearing that everyone is in this together would help some people feel less hopeless and alone.,69,0.88,77,https://www.reddit.com/r/cscareerquestions/comments/1l6x2lg/how_many_of_you_in_this_subreddit_are_unemployed/,2025-06-09 05:47:11,2025-06-11 01:44:21
1l4xiss,How do I explain to non-tech people how difficult a project is?,AgeOfWorry0114,cscareerquestions,"I have a weird one for you all. I am not in the industry full-time, but I know how to code. I started freelancing for fun on the side for people drastically outside of the tech world. In this case, I am building software for school districts. Pretty cool.However, the people who I am building projects for genuinely do not understand anything about this stuff. Because of this, they do not understand how difficult some of their tasks are to implement successfully (and quickly). I keep on getting comments like, ""Can't you just do this today?"" or ""Why would it take you a month to do this?"" or ""Why is that so hard to implement?"" I try to explain that, unlike an iPhone or Excel, these very particular requests don't just happen with the click of a button - *that is why you are hiring me*. I also stress the importance of doing things correctly. Finally, I stress that I am a freelancer, and I have a full-time job. I don't know how to get it through to their head that this stuff is complicated and takes time. In addition, I don't just want to drop them because I genuinely like doing the work (and the money is nice). **Is there a non-arrogant way to discuss these matters?** A part of me just wants to say, ""Ok. Well then you do it. Here's the code."" But obviously, I don't *actually* want to do that.",73,0.91,26,https://www.reddit.com/r/cscareerquestions/comments/1l4xiss/how_do_i_explain_to_nontech_people_how_difficult/,2025-06-06 16:59:34,2025-06-11 01:44:21
