id,title,author,subreddit,content,score,upvote_ratio,num_comments,url,created_utc,extracted_at
1l4z7bj,I attended a databricks event in Europe,BadBouncyBear,dataengineering,"And told my colleagues while in line to enter a workshop ""time to get data bricked the fuck up"", then two guys in their 50's turned around to us and stared at us for about 5 seconds before turning away.I didn't really like the event and I didn't get the promised Databricks shirt because they ran out. 3/10",907,0.95,55,https://www.reddit.com/r/dataengineering/comments/1l4z7bj/i_attended_a_databricks_event_in_europe/,2025-06-06 18:06:44,2025-06-11 01:44:19
1l3x7vk,A disaster waiting to happen,kerokero134340,dataengineering,"TLDR; My company wants to replace our pipelines with some all-in-one “AI agent” platformI’m a lone data engineer in a mid-size retail/logistics company that runs SAP ERP (moving to HANA soon). Historically, every department pulled SAP data into Excel, calculated things manually, and got conflicting numbers. I was hired into a small analytics unit to centralize this. I’ve automated data pulls from SAP exports, APIs, scrapers, and built pipelines into SQL Server. It’s traceable, consistent, and used regularly.Now, our new CEO wants to “centralize everything” and “go AI-driven” by bringing in a no-name platform that offers:\- Limited source connectors for a basic data lake/warehouse setup\- A simple SQL interface + visualization tools\- And the worst of it all: an AI agent PER DEPARTMENTEach department will have its own AI “instance” with manually provided business context. Example: “This is how finance defines tenure,” or “Sales counts revenue like this.” Then managers are supposed to just ask the AI for a metric, and it will generate SQL and return the result. Supposedly, this will replace 95–97% of reporting, instantly (and the CTO/CEO believe it).Obviously, I’m extremely skeptical:\- Even with perfect prompts and context, if the underlying data is inconsistent (e.g. rehire dates in free text, missing fields, label mismatches), the AI will silently get it wrong.\- There’s no way to audit mistakes, so if a number looks off, it’s unclear who’s accountable. If a manager believes it, it may go unchallenged.\- The answer to every flaw from them is: “the context was insufficient” or “you didn’t prompt it right.” That’s not sustainable or realistic\- Also some people (probs including me) will have to manage and maintain all the departmental context logic, deal with messy results, and take the blame when AI gets it wrong.\- Meanwhile, we already have a working, auditable, centralized system that could scale better with a real warehouse and a few more hires. They just don't want to hire a team or I have to convince them somehow (bc they think that this is a cheaper, more efficient alternative).I’m still relatively new in this company and I feel like I’m not taken seriously, but I want to push back before we go too far, I'll switch jobs probably soon anyway but I'm actually concerned about my team.How do I convince the management that this is a bad idea?",206,0.97,94,https://www.reddit.com/r/dataengineering/comments/1l3x7vk/a_disaster_waiting_to_happen/,2025-06-05 11:52:01,2025-06-11 01:44:19
1l6psm3,Where to practice SQL to get a decent DE SQL level?,LongCalligrapher2544,dataengineering,"Hi everyone, current DA here, I was wondering about this question for a while as I am looking forward to move into a DE role as I keep getting learning couple tools so just this question to you my fellow DE.Where did you learn SQL to get a decent DE level?",203,0.96,50,https://www.reddit.com/r/dataengineering/comments/1l6psm3/where_to_practice_sql_to_get_a_decent_de_sql_level/,2025-06-08 23:15:58,2025-06-11 01:44:19
1l4nr34,onlyProdBitesBack,op3rator_dec,dataengineering,No content,182,0.94,0,https://i.redd.it/auxq3m2yu95f1.png,2025-06-06 09:00:57,2025-06-11 01:44:19
1l5qmu9,What your most favorite SQL problem? ( Mine : Gaps & Islands ),NefariousnessSea5101,dataengineering,"Your must have solved / practiced many SQL problems over the years, what's your most fav of them all?",117,0.98,81,https://www.reddit.com/r/dataengineering/comments/1l5qmu9/what_your_most_favorite_sql_problem_mine_gaps/,2025-06-07 17:44:06,2025-06-11 01:44:19
1l3fzlr,"AWS forms EU-based cloud unit as customers fret about Trump 2.0 -- ""Locally run, Euro-controlled, ‘legally independent,' and ready by the end of 2025""",throwaway16830261,dataengineering,No content,121,0.96,8,https://www.theregister.com/2025/06/03/aws_european_sovereign_cloud/,2025-06-04 20:21:11,2025-06-11 01:44:19
1l47het,DuckDB enters the Lake House race.,averageflatlanders,dataengineering,No content,116,0.94,101,https://dataengineeringcentral.substack.com/p/duckdb-enters-the-lake-house-race,2025-06-05 18:59:13,2025-06-11 01:44:19
1l6b8g6,New requirements for junior data engineers are challenging.,Vw-Bee5498,dataengineering,"It's just me, or are the requirements out of control? I just checked some data engineering offers, and many require knowledge of math, machine learning, DevOps, and business skills. Also, the pay is ridiculously low, even from reputable companies (banks and healthcare). Are data engineers now also data scientists or what?",104,0.96,45,https://www.reddit.com/r/dataengineering/comments/1l6b8g6/new_requirements_for_junior_data_engineers_are/,2025-06-08 12:41:59,2025-06-11 01:44:19
1l2y1dw,"Business Insider: Jobs most exposed to AI include DE, DBA, (InfoSec, etc.)",issai,dataengineering,[https://www.businessinsider.com/ai-hiring-white-collar-recession-jobs-tech-new-data-2025-6](https://www.businessinsider.com/ai-hiring-white-collar-recession-jobs-tech-new-data-2025-6)Maybe I've been out of the loop to be surprised by AI making inroads on DE jobs. But I can see more DBA / DE jobs being offshored over time though.,101,0.86,64,https://www.reddit.com/r/dataengineering/comments/1l2y1dw/business_insider_jobs_most_exposed_to_ai_include/,2025-06-04 05:56:32,2025-06-11 01:44:19
1l4mjnp,I've advanced too quickly and am not sure how to proceed,SocioGrab743,dataengineering,"It's me, the guy who bricked the company's data for by accident. After that happened, not only did I not get reprimanded, what's worse is that their confidence in me has not waned. Why is that a bad thing, you might ask, well they're now giving me legitimate DE projects (such as adding in new sources from scratch).....including some which are half baked backlogs, meaning I've no idea what's already been done and how to move forward (the existing documentation is vague, and I'm not just saying this as someone new to the space, it's plain not granular enough).I'm in quite a bind, as you can imagine, and am not quite sure how to proceed. I've communicated when things are out of scope, and they've been quite supportive and understanding (as much as they can be without providing actual technical support and understanding), but I've already barely got a handle on keeping things going as smooth as it was before, I'm fairly certain any attempt for me to improve things, outside of my actual area of expertise, is courting disaster.",90,0.89,30,https://www.reddit.com/r/dataengineering/comments/1l4mjnp/ive_advanced_too_quickly_and_am_not_sure_how_to/,2025-06-06 07:34:35,2025-06-11 01:44:19
1l7jhoa,How is everyone's organization utilizing AI?,wxf140430,dataengineering,"We recently started using Cursor, and it has been a hit internally. Engineers are happy, and some are able to take on projects in the programming language that they did not feel comfortable previously.Of course, we are also seeing a lot of analysts who want to be a DE, building UI on top of internal services that don't need a UI, and creating unnecessary technical debt. But so far, I feel it has pushed us to build things faster. What has been everyone's experience with it?",80,0.92,57,https://www.reddit.com/r/dataengineering/comments/1l7jhoa/how_is_everyones_organization_utilizing_ai/,2025-06-09 23:10:45,2025-06-11 01:44:19
1l4ym6m,Any real dbt practitioners to follow?,OlimpiqeM,dataengineering,"I keep seeing post after post on LinkedIn hyping up dbt as if it’s some silver bullet — but rarely do I see anyone talk about the trade-offs, caveats, or operational pain that comes with using dbt at scale.So, asking the community:**Are there any legit dbt practitioners you follow** — folks who actually write or talk about:* Caveats with incremental and microbatch models?* How they handle model bloat?* Managing tests & exposures across large teams?* Real-world CI/CD integration (outside of dbt Cloud)?* Versioning, reprocessing, or non-SQL logic?* **Performance related** issuesNot looking for more “dbt changed our lives” fluff — looking for the equivalent of someone who’s 3 years into maintaining a 2000-model warehouse and has the scars to show for it.Would love to build a list of voices worth following (Substack, Twitter, blog, whatever).",76,0.94,41,https://www.reddit.com/r/dataengineering/comments/1l4ym6m/any_real_dbt_practitioners_to_follow/,2025-06-06 17:42:55,2025-06-11 01:44:19
1l3usad,Are Data Engineers Being Treated Like Developers in Your Org Too?,Consistent_Law3620,dataengineering,"Hey fellow data engineers :waving_hand:Hope you're all doing well!I recently transitioned into data engineering from a different field, and I’m enjoying the work overall — we use tools like Airflow, SQL, BigQuery, and Python, and spend a lot of time building pipelines, writing scripts, managing DAGs, etc.But one thing I’ve noticed is that in cross-functional meetings or planning discussions, management or leads often refer to us as ""developers"" — like when estimating the time for a feature or pipeline delivery, they’ll say “it depends on the developers” (referring to our data team). Even other teams commonly call us ""devs.""This has me wondering:Is this just common industry language?Or is it a sign that the data engineering role is being blended into general development work?Do you also feel that your work is viewed more like backend/dev work than a specialized data role?Just curious how others experience this. Would love to hear what your role looks like in practice and how your org views data engineering as a discipline.Thanks!",76,0.76,80,https://www.reddit.com/r/dataengineering/comments/1l3usad/are_data_engineers_being_treated_like_developers/,2025-06-05 09:24:39,2025-06-11 01:44:19
1l47n19,Is there little programming in data engineering?,Rare-Bet-6845,dataengineering,"Good morning,I bring questions about data engineering. I started the role a few months ago and I have programmed, but less than web development.I am a person interested in classes, abstractions and design patterns.I see that Python is used a lot and I have never used it for large or robust projects.Is data engineering programming complex systems? Or is it mainly scripting?",59,0.9,37,https://www.reddit.com/r/dataengineering/comments/1l47n19/is_there_little_programming_in_data_engineering/,2025-06-05 19:05:02,2025-06-11 01:44:19
1l5jbp8,Homemade Change Data Capture into DuckLake,doenertello,dataengineering,"Hi :waving_hand_light_skin_tone: I've been reading some responses over the last week regarding the DuckLake release, but felt like most of the pieces were missing a core advantage. Thus, I've tried my luck in writing and coding something myself, although not being in the writer business myself. Would be happy about your opinions. I'm still worried to miss a point here. I think, there's something lurking in the lake :blowfish:",61,0.96,12,https://medium.com/@wergstatt/homemade-change-data-capture-into-your-private-lake-e4978ebc23a7,2025-06-07 12:09:21,2025-06-11 01:44:19
1l5tldx,Are there any books that teach data engineering concepts similar to how The Pragmatic Programmer teaches good programming principles?,Reddit_Account_C-137,dataengineering,"I'm a self-taught programmer turned data engineer, and a data scientist on my team (who is definitely the best programmer on the team) gave me this book. I found it incredibly insightful and it will definitely influence how I approach projects going forward.I've also read Fundamentals of Data Engineering and didn't find it very valuable. It felt like a word soup compared to The Pragmatic Programmer, and by the end, it didn’t really cover anything I hadn’t already picked up in my first 1-2 years of on-the-job DE experience. I tend to find that very in-depth books are better used as references. Sometimes I even think the internet is a more useful reference than those really dense, almost textbook-like books.Are there any data engineering books that give a good overview of the techniques, processes, and systems involved. Something at a level that helps me retain the content, maybe take a few notes, but doesn’t immediately dive deep into every topic? Ideally, I'd prefer to only dig deeper into specific areas when they become relevant in my work.",61,0.97,12,https://www.reddit.com/r/dataengineering/comments/1l5tldx/are_there_any_books_that_teach_data_engineering/,2025-06-07 19:53:22,2025-06-11 01:44:19
1l5pctb,Snapchat Data Tech Stack,mjfnd,dataengineering,"Hi!Sharing my latest article from the Data Tech Stack series, I’ve revamped the format a bit, including the image, to showcase more technologies, thanks to feedback from readers. I am still keeping it very high level, just covering the 'what' tech are used, in separate series I will dive into 'why' and 'how'. Please visit the link, to fine more details and also references which will help you dive deeper. Some metrics gathered from several place.* Ingesting \~2 trillions of events per day using Google Cloud Platform.* Ingesting 4+ TB of data into BQ per day.* Ingesting 1.8 trillion events per day at peak.* Datawarehouse contains more than 200 PB of data in 30k GCS bucket.* Snapchat receives 5 billions Snaps per day.* Snapchat has 3,000 Airflow DAGS with 330,000 tasks.Let me know in the comments, any feedback and suggests. Thanks",58,0.97,5,https://www.junaideffendi.com/p/snapchat-data-tech-stack?r=cqjft,2025-06-07 16:49:55,2025-06-11 01:44:19
1l4usne,Is Airflow 3 finally competitive with dagster and flyte?,e_safak,dataengineering,"I am in the market for workflow orchestration again, and in the past I would have written off Airflow but the new version looks viable. Has anyone familiar with Flyte or Dagster tested the new Airflow release for ML workloads? I'm especially interested in the versioning- and asset-driven workflow aspects.",56,0.8,72,https://www.reddit.com/r/dataengineering/comments/1l4usne/is_airflow_3_finally_competitive_with_dagster_and/,2025-06-06 15:08:27,2025-06-11 01:44:19
1l7v4w0,"system design interviews for data engineer II (26 F), need help!",yosenpaiftw,dataengineering,"Hi guys, I(26 F) joined as a data engineer at amazon 3 years back, however my growth halted since most of the tasks assigned to me were purely related to database managing engineer, providing infra at large scale for other teams to run their jobs on, there was little to no data engineering work here, it was all boring, ramping up the existing utilities to reduce IMR and what not, and we kept using the internal legacy tools which have 0 value in the outside world, never got out of redshift, not even AWS glue, just using 20 years old ETL tools, so I decided to start giving interviews and here's the deal, this is my first time giving system design interviews because i'm sitting for DE II roles, and i'm having a lot of trouble while evaluating tradeoffs, data modelling and deciding which technologies to used for real time/batch streaming, there's a lot of deep level questions being asked about what i'd do if the spark pipeline slows down or if data quality checks go wrong, coming from a background and not having worked on system design at all, I'm having trouble on approaching these interviews. There are a lot of resources out there but most of the system design interviews are focussed on software developer role and not Data engineering role, are there any good resources and learning map i can follow in order to ace the interviews?",45,0.8,15,https://www.reddit.com/r/dataengineering/comments/1l7v4w0/system_design_interviews_for_data_engineer_ii_26/,2025-06-10 10:20:31,2025-06-11 01:44:19
1l68zpq,"As Europe eyes move from US hyperscalers, IONOS dismisses scaleability worries -- ""The world has changed. EU hosting CTO says not considering alternatives is 'negligent'""",throwaway16830261,dataengineering,No content,40,0.88,8,https://www.theregister.com/2025/06/06/ionos_dismisses_scalability_worries_interview/,2025-06-08 10:27:03,2025-06-11 01:44:19
1l5ty65,Bad data everywhere,Melodic_One4333,dataengineering,"Just a brief rant. I'm importing a pipe-delimited data file where one of the fields is this company name:PC'S? NOE PROBLEM||| INCORPORATEDAnd no, they didn't escape the pipes in any way. Maybe exclamation points were forbidden and they got creative? Plus, this is giving my English degree a headache.What's the worst flat file problem you've come across?",45,0.94,44,https://www.reddit.com/r/dataengineering/comments/1l5ty65/bad_data_everywhere/,2025-06-07 20:09:07,2025-06-11 01:44:19
1l3kx85,New company uses Foundry - will my skills stagnate?,DataAnalCyst,dataengineering,"Hey all,DE with 5.5 years of experience across a few big tech companies. I recently switched jobs and started a role at a company whose primary platform is Palantir Foundry - in all my years in data, I have yet to meet folks who are super well versed in Foundry or see companies hiring specifically for Foundry experience. Foundry seems powerful, but more of a niche walled garden that prioritizes low code/no code and where infrastructure is obfuscated. Admittedly, I didn’t know much about Foundry when I jumped into this opportunity, but it seemed like a good upwards move for me. The company is in hyper growth mode, and the benefits are great. I’m wondering from others who may have experience whether or not my general skills will stagnate and if I’ll be less marketable in the future.? I plan to keep working on side projects that use more “common” orchestration + compute + storage stacks, but want thoughts from others.",36,0.87,41,https://www.reddit.com/r/dataengineering/comments/1l3kx85/new_company_uses_foundry_will_my_skills_stagnate/,2025-06-04 23:52:13,2025-06-11 01:44:19
1l80twd,How to Transition from Data Engineering to Something Less Corporate?,ThoseBigLegs,dataengineering,"Hey folks, Do any of you have tips on how to transition from Data Engineering to a related, but less corporate field. I'd also be interested in advice on how to find less corporate jobs within the DE space.For background, I'm a Junior/Mid level DE with around 4 years experience. I really enjoy the day-to-day work, but the big-business driven nature bothers me. The field is heavily geared towards business objectives, with the primary goal being to enhance stakeholder profitibility. This is amplified by how much investment is funelled to the cloud monopolies.I'd to like my job to have a positive societal impact. Perhaps in one of these areas (though im open to other ideas)?- science/discovery- renewable sector- social mobilityMy aproach so far has been: get as good as possible. That way, organisations that you'd want to work for, will want you to work for them. But, it would be better if i could focus my efforts. Perhaps by targeting specific tech stacks that are popular in the areas above. Or by making a lateral move (or step down) to something like an IoT engineer.Any thoughts/experiences would be appreciated :)",39,0.91,14,https://www.reddit.com/r/dataengineering/comments/1l80twd/how_to_transition_from_data_engineering_to/,2025-06-10 14:55:25,2025-06-11 01:44:19
1l327w2,"When using orchestrator, do you write your ETL code inside the orchestrator or outside of it?",linkinfear,dataengineering,"By outside, I mean the orchestrator runs an external script or docker image. Something like BashOperator or KubernetesPodsOperator in Airflow.Any experiences on both approach? Pros and Cons?Some that I can think of for writing inside the orchestrator.Pros:\- Easier to manage since everything is in one place.\- Able to use the full features of the orchestrator.\- Variables, Connections and Credentials are easier to manage.Cons:\- Tightly coupled with the orchestrator. Migrating your code might be annoying if you want to use different orchestrator.\- Testing your code is not really easy.\- Can only use python.For writing code outside the orchestrator, it is pretty much the opposite of the above.Thoughts?",38,0.94,20,https://www.reddit.com/r/dataengineering/comments/1l327w2/when_using_orchestrator_do_you_write_your_etl/,2025-06-04 10:35:43,2025-06-11 01:44:19
1l5aper,Alternatives to running Python Scripts with Windows Task Scheduler.,HelmoParak,dataengineering,"Hi, I'm a data analyst with 2 years of experience slowly making progress towards using SSIS and Python to move data around.Recently, I've found myself sending requests to the Microsoft Partner Center APIs using Python scripts in order to get that information and send it to tables on a SQL Server, and for this purpose I need to run these data flows on a schedule, so I've been using the Windows Task Scheduler hosted on a VM with Windows Server to run them, are there any other better options to run the Python scripts on a schedule?Thank you.",38,0.94,37,https://www.reddit.com/r/dataengineering/comments/1l5aper/alternatives_to_running_python_scripts_with/,2025-06-07 02:56:38,2025-06-11 01:44:19
1l465k9,Article: Snowflake launches Openflow to tackle AI-era data ingestion challenges,moinhoDeVento,dataengineering,"Openflow integrates Apache NiFi and Arctic LLMs to simplify data ingestion, transformation, and observability.",38,0.85,31,https://www.infoworld.com/article/4000742/snowflake-launches-openflow-to-tackle-ai-era-data-ingestion-challenges.html,2025-06-05 18:06:34,2025-06-11 01:44:19
1l7rd43,How do you deal with working on a team that doesn't care about quality or best practices?,analytical_dream,dataengineering,"I'm somewhat struggling right now and I could use some advice or stories from anyone who's been in a similar spot.I work on a data team at a company that doesn't really value standardization or process improvement. We just recently started using GIT for our SQL development and while the team is technically adapting to it, they're not really embracing it. There's a strong resistance to anything that might be seen as ""overhead"" like data orchestration, basic testing, good modelling, single definitions for business logic, etc. Things like QA or proper reviews are not treated with much importance because the priority is speed, even though it's very obvious that our output as a team is often chaotic (and we end up in many ""emergency data request"" situations).The problem is that the work we produce is often rushed and full of issues. We frequently ship dashboards or models that contain errors and don't scale. There's no real documentation or data lineage. And when things break, the fixes are usually quick patches rather than root cause fixes.It's been wearing on me a little. I care a lot about doing things properly. I want to build things that are scalable, maintainable, and accurate. But I feel like I'm constantly fighting an uphill battle and I'm starting to burn out from caring too much when no one else seems to.If you've ever been in a situation like this, how did you handle it? How do you keep your mental health intact when you're the only one pushing for quality? Did you stay and try to change things over time or did you eventually leave?Any advice, even small things, would help.PS: I'm not a manager - just a humble analyst :grinning_face_with_sweat:",37,0.96,32,https://www.reddit.com/r/dataengineering/comments/1l7rd43/how_do_you_deal_with_working_on_a_team_that/,2025-06-10 06:04:22,2025-06-11 01:44:19
1l7at7h,How are we helping our non-technical colleagues to edit data in the database?,ursamajorm82,dataengineering,"So I'm working on a project where we're building out an ETL pipeline to a Microsoft SQL Server database. But the managers want a UI to allow them to see the data that's been uploaded, make spot changes where necessary and have those changes go through a review process.I've tested Directus, Appsmith and baserow. All are kind of fine, though I'd prefer the team and time to build out an app even in something like Shiny that would allow for more fine grained debugging when needed. What are you all using for this? It seems to be the kind of internal tool everyone is using in one way or another. Another small detail is the solution has to be available for on-prem use.",36,0.9,46,https://www.reddit.com/r/dataengineering/comments/1l7at7h/how_are_we_helping_our_nontechnical_colleagues_to/,2025-06-09 17:26:46,2025-06-11 01:44:19
