id,title,author,subreddit,content,score,upvote_ratio,num_comments,url,created_utc,extracted_at
1opdfhk,How are you guys getting AI to write working code?,Thiccolas18,cscareerquestions,"So for some context, I would not consider myself old school by any means. I started learning to code with Java back in 2017, so I learned to code ""the old-fashioned way"" by looking at documentation and/or stack overflow before AI came into the mainstream.I now work in test automation primarily using C#, but I also have quite a bit of experience with Python as well. I now use Copilot in my daily workflow, but I genuinely do not understand how you guys are saying things like ""My workflow is 95% prompting then copy and pasting and I barely ever touch code manually now."" My experience with copilot is that it will make up functions left and right that do not exist in the codebase, and it's actually faster for me to just write the code manually and then use AI as sort of a glorified stack overflow. I.e. I can rubber duck with it, and it won't call me stupid for asking a question. I'm genuinely confused how people are vibe coding entire applications.When you guys do this is the code actually robust and work well? Or do you end up spending a lot of time refactoring? Do you spend a lot of time coming up with instructions for the AI? What are the strategies you guys use to make it effective for you? In my experience it seems to be good at things like leetcode, but bad in large codebases with dependencies and structure.Edit: From these responses it seems like most of you use AI basically the same way I do, with the exception of the cursor comments. Unfortunately I’m in a corporation so switching to cursor and trying it out isn’t really feasible for me in this context. Maybe I’ll give it a try on my own and see how it does for a side project.",91,0.89,106,https://www.reddit.com/r/cscareerquestions/comments/1opdfhk/how_are_you_guys_getting_ai_to_write_working_code/,2025-11-05 19:59:54,2025-11-10 01:44:58
1orvs8h,I suddenly got callback from big tech company after giving up hope of any employment - how do I get in shape in time,BOKUtoiuOnna,cscareerquestions,"Note: Do not tell me to not try and I'm doomed - even if its impossible its better that I make an effort and learn something than notI have been unemployed for 7 months as a an ex-bootcamper (non-stem bachelors) with 3 yoe. My last job was in a big household name company but not one known for tech (more publishing) in Java. I never felt I was more than mediocre, and then I got sick with nebulous undiagnosable long covid, which made my performance worse, and I became an easy budget cut. After a few months of inactive burnout (where I lost a lot of muscle memory), and a few months of sending out CVs, I had pretty much given up on getting any significant interviews any time soon and was pretty much just messing around with ones I didn't care about and building my portfolio as much as possible, with an aim of just learning out loud and then leveraging that in my next round of applying. I was making a language learning app with some NLP elements in python for the last couple months. I haven't written much Java since April, and even then, my last position was fullstack and they had me on a lot of frontend in the final year. I haven't done any leetcode since June (and most DSA I haven't revisited since I got hired at my last place >2 years ago). Studying up on the systems design I'm starting to be expected to understand better as a now potential mid was in my backlog.Suddenly, two days ago I got an email from a big tech company (not FAANG but close, and in an adjacent field to my last company) I had applied to a month or more ago. I remember filling in the application form thinking ""I don't know why I am doing this, I should definitely wait until I have improved myself and have an actual chance. They're going to think this application is pathetic"". I expected no response and honestly forgot entirely about the job position or what I even wrote in that form. They want to interview me for a Java position.I can only assume they saw how my last company is actually vaguely relevant to their product and clicked on my github and saw how active I am rn and actually wanted to give me a chance.I have accepted, have HR on Tuesday, I'm just trying to work out how to get myself in gear in time for the next stage if it happens. Currently revisiting all of DSA on leetcode and doing problems but I'm unsure I can manage to internalise this stuff in time... Plus there are other elements like SD that I need to look over.How would you strategise going about this? Have any of you been in a similar situation and given it your best shot? Lmk",85,0.85,50,https://www.reddit.com/r/cscareerquestions/comments/1orvs8h/i_suddenly_got_callback_from_big_tech_company/,2025-11-08 17:53:20,2025-11-10 01:44:58
1op29km,Whats a piece of code you've written that you are a extremly proud of ??,Cheap_trick1412,cscareerquestions,I remember me and my friends coding an elementary school's website .We didn't pay attention to our classes so we all learned while making itback then we did not know much so we used lots and lots shortcuts and tricks but we somehow got it all running (we fked up our databases tho)we used bootstrap3 and php in backendIt is still running and in use (tho they have changed UI quite a bit) but its used for actual students and it give me pride bcuz we did it in 2 weeksWhat about you??,89,0.92,73,https://www.reddit.com/r/cscareerquestions/comments/1op29km/whats_a_piece_of_code_youve_written_that_you_are/,2025-11-05 13:03:42,2025-11-10 01:44:58
1onkcv0,Bloomberg vs Atlassian,avocado352,cscareerquestions,"Trying to decide between both of these offers for new grad swe. Bloomberg (NYC):First Year: **200k**Recurring: **190k**Atlassian (SF):First Year: **200k**Recurring: **175k**I’ve heard bad things about Atlassian recently regarding pip and management, but they do promote fast at around 1-1.5 years where the TC will be around 250k.Bloomberg is super stable and chill, but they have an old tech stack and the promotion structure is weird. I think getting on a C++ team would be super cool tho and I want to stay away from web dev and frontend stuff, which I feel like a lot of the work at Atlassian is.I plan to job hop in around 2-3 years so I also want to prioritize exit opportunities and the resume value of each company. Curious of what others think",89,0.79,82,https://www.reddit.com/r/cscareerquestions/comments/1onkcv0/bloomberg_vs_atlassian/,2025-11-03 18:51:13,2025-11-10 01:44:58
1oq9k95,Provided my graduation date 4 times just to get told it's a dealbreaker,3_CatsInATrenchCoat,cscareerquestions,"So I just had an interview for a Summer 2026 internship. The interviewer cut the meeting short just minutes in because they're targeting continuing students and I graduate Spring 2026. Before this meeting I provided my graduation date:1. On my resume2. While filling out the job application3. During a virtual one-way interview4. To the recruiter while scheduling this interviewI understand that the job listing specified they're looking for continuing students, but I provided my graduation date several times prior to this interview and they didn't seem to have an issue. I've also interviewed for other internships targeting continuing students and no company has had an issue with my graduation date yet. Is it worth sending a follow up email to see if they're willing to budge? This experience has definitely soured me on working at this company, but it's a well-compensated remote role that I'm very qualified for. And in this job market, I'm hesitant to give up any opportunity so quickly.",78,0.91,51,https://www.reddit.com/r/cscareerquestions/comments/1oq9k95/provided_my_graduation_date_4_times_just_to_get/,2025-11-06 20:12:57,2025-11-10 01:44:58
1oowun2,Will you do this for life?,SuperbCelebration223,cscareerquestions,"Can you see yourself still coding in your 50s? Still chasing new frameworks, new tools, new “must-know” technologies? Sometimes I ask myself if this is something I’ll be doing for life. The learning never ends it's a cycle which can be Exciting, Exhausting, and Rewarding all at once. Do you have a backup plan or an “exit strategy”?Or is this the craft you’ll keep growing with, no matter how much it evolves? Genuinely curious how others see their long-term future in tech.",76,0.91,108,https://www.reddit.com/r/cscareerquestions/comments/1oowun2/will_you_do_this_for_life/,2025-11-05 07:46:44,2025-11-10 01:44:58
1opap4n,Are CS professionals still buying houses during this uncertain time??,Affectionate_Nose_35,cscareerquestions,"because starter houses in the Bay Area are like $2M for a ranch in an ok school district. hell, even in Boston a starter house is close to $1M...shouldn't these markets be crashing if the tech job market is deteriorating?",72,0.81,53,https://www.reddit.com/r/cscareerquestions/comments/1opap4n/are_cs_professionals_still_buying_houses_during/,2025-11-05 18:21:08,2025-11-10 01:44:58
1on2jtx,I wish I could just code forever and not have to take a manager / leader role,lookatlee,cscareerquestions,"**EDIT: Just a rant... if anyone can relate/have advice, would appreciate it.**As I progress further into a senior SWE, my job is less about coding and more about reviewing requirements and telling ppl what their code should then do. And I'm absolutely sick of it.Because nowadays I just write documentation, review solution documents / requirements, and acknowledge whether our team is ready to do it. On top of this, I need to help ppl with their coding, like PR review, daily discussions, and so on. And then I also get into Production calls, reviewing production outcomes, why our code isn't performing well or whatever, etc. I fucking hate all of this. It might sound easy due to not coding, but i need to stretch my brain in a way that just gets me very overwhelmed, while also being incredibly BORED.I just never imagined that, I would be coding less, while being 5x more stressed than ever. A lot of the requirement documents I review are poorly written, so I have to keep scheduling meetings / following up with ppl to ask questions.. my day sometimes is just meetings ALL day, with almost no time to eat a damn meal. And then I need time to do code review so my team members' aren't blocked! So oftentimes, I do the code review at like 7pm after dinner or early in the morning the next day. Shit's fucked. Anyway, just a dumb rant I guess. It just makes me sad that, this is ultimately where a SWE goes. You can't be that guy being told what to do all the time.. now I need to take accountability for things and be the one to tell others what to do. But it's just so.. overwhelming man. Sigh.",67,0.92,48,https://www.reddit.com/r/cscareerquestions/comments/1on2jtx/i_wish_i_could_just_code_forever_and_not_have_to/,2025-11-03 04:28:44,2025-11-10 01:44:58
1ophn3r,"Older workers, how do you read the screen anymore?",pinelands1901,cscareerquestions,"I'm 42 and been doing this for about 5 years. My glasses are up to date, there's nothing wrong with my eyes. I just can't read the text on screens anymore. It's like fonts are getting smaller and skinnier. (My company uses 15 year old LCD monitors.)By the end of the day I'm basically hallucinating what's on the screen because I have such a headache. How do you guys make a career out of this?",58,0.9,59,https://www.reddit.com/r/cscareerquestions/comments/1ophn3r/older_workers_how_do_you_read_the_screen_anymore/,2025-11-05 22:37:20,2025-11-10 01:44:58
1ongjxz,I don’t know what I need to work on as a mid level SWE?,Accomplished-Echo-86,cscareerquestions,"Back in college, I just grinded a few basic projects and leetcode, but as a mid level engineer, I feel like I learned nothing to the point I don’t even know what I need to work on. The job market is already bad so why not upskill myself.In order to make myself viable as a mid level engineer, generally what should I focus on? Leetcode, system design, cloud tech, AI(?!??)?I know this is dependent from person to person but generally, what is the “best bang for buck”?",49,0.94,11,https://www.reddit.com/r/cscareerquestions/comments/1ongjxz/i_dont_know_what_i_need_to_work_on_as_a_mid_level/,2025-11-03 16:35:33,2025-11-10 01:44:58
1on819f,Advice on not being allowed to take PTO?,Dovageris,cscareerquestions,"I'm an ML Engineer with 6 YoE and a PhD for ML in Applied Math, based in the US. I started a new job in January at a large company with 18 days of PTO, which I thought was nice considering I'm used to ""unlimited"" which left me constantly worried about what was ok to take.For the first few months, I didn't request any time as I know it can be considered unprofessional when you're new. I took a single day because I had to move for the job, which my manager didn't seem happy about, but it was a big move from a place I had lived in for a long time and I made it clear I was going to need to before I was even offered the job.Just for some background, over the year my manager's feedback has been very negative. Whenever I get this negative feedback I put in extra effort to address it, and at first I figured he was just a bit more demanding than most. But as I'm now grinding over the weekends and occasionally pulling all-nighters, I see that my manager is just looking for anything to critique and ignoring everything else. It's not like I'm just not doing the work or half-assing it, in fact I've gone above and beyond to meet every critique, no matter how minor, and I've tried to pull out all the stops on clever solutions and building out important features. I've even had other coworkers remark at the amount I've accomplished and the quality of the results, so I don't think it's just in my head. My team is also sort of ""R&D"" for a large company, so our results are important, but we don't have rush times or fast-paced deadlines.But whenever I've put in PTO requests, he has denied them, saying I'm too behind to be taking extra time off. I put in the requests at least 2 months in advance, and I'm not requesting much -- when I had ""unlimited"" PTO I never took more than 5 days total in a year so I'm not looking to take off an entire week or anything. Honestly I just want to use the time since it goes away at the end of the year and doesn't pay out or roll over. He and other members of my team seem to take long vacations all the time though, so I'm not sure why it's just me that can't take any days of PTO.Everyone I've talked to so far has basically said that it's ultimately my manager's discretion, which surprised me as I thought dedicated PTO totals meant there was some sort of legal requirement that you be allowed to use them. I guess lesson learned now.Any advice though? Simply leaving for another job is difficult considering it's not even been a year, and my previous roles have been 1-2 years as well so I was looking to have a long stint at one place to make it not look so bad. Beyond that, if anyone has experience with this I'd like to hear about it so I can understand what to do / not to do.",45,0.9,42,https://www.reddit.com/r/cscareerquestions/comments/1on819f/advice_on_not_being_allowed_to_take_pto/,2025-11-03 10:14:34,2025-11-10 01:44:58
1onahd2,Any lighter alternative to SonarQube?,CapnChiknNugget,cscareerquestions,"SonarQube is solid, but maintaining it sucks. The UI feels ancient, the config files are weird, and self-hosting it is pain. We only have like 15 devs, so paying for a full server setup feels like overkill. Anything smaller teams are using for code quality and static checks?",45,0.98,5,https://www.reddit.com/r/cscareerquestions/comments/1onahd2/any_lighter_alternative_to_sonarqube/,2025-11-03 12:31:58,2025-11-10 01:44:58
1ooy2ec,Vibe coding is eroding my learning and development capabilities,SignificantBoot7784,cscareerquestions,"After a 3 months’ search I landed a gig in R&D at a pretty early stage startup. Prior, I spent 2 years working in fundamental ML research at pretty big lab. I’m not happy about the switch, mainly because my goal is to get to grad school —> work in industry research. But I can’t stomach pseudo unemployment anymore.The new place develops agentic solutions for some really big government clients. Cool so far. The pay is good and the environment is semi flexible and more dynamic and fast paced than the lab. All fine and dandy.However, the structure of the work is pretty chaotic. And it’s especially subject to client expectations, which…. I mean— i feel like a country bum for making this observation— are ludicrous and verging on offensive. 3 weeks to develop a fully functional system? It seems insane. I’m trying to deliver fast, but the only way to iterate fast is to vibe code and frankly it’s a mind numbing exercise. I’m assessing the potential damage on my learning trajectory and well… i dunno. I feel like I’m just reinforcing my fraud status. I know that this is a stupid gripe to have especially when i’m lucky to even have a job. And I don’t have any other worthwhile experiences to benchmark against since the research lab was an atrocious place on all facets (garbage PI, no contract, no benefits, slow progress) except for the publication potential and the exposure to academic connections and really really intelligent people (who also happen to be horrible human beings).",42,0.94,8,https://www.reddit.com/r/cscareerquestions/comments/1ooy2ec/vibe_coding_is_eroding_my_learning_and/,2025-11-05 09:06:31,2025-11-10 01:44:58
1ooha57,Why does it feel like I will never get a SWE job again,danl6383,cscareerquestions,"I have been unemployed for the passed 6 months due to company lay offs. I have applied and gotten a few interviews but they all seem to just ghost me after. I have two years of experience and I have been preparing for these interviews a lot. I'm mainly frontend, so that's what I have been reviewing and applying to. However it seems like I never make it pass the first round.A lot of positions required more than 2 years of experience and there are so many rounds that it just feels like I'll never make it since I can't even make it pass the first round.Is there anything else I can do to prepare for this interviews? What does one need in order to successful in them?",45,0.91,7,https://www.reddit.com/r/cscareerquestions/comments/1ooha57/why_does_it_feel_like_i_will_never_get_a_swe_job/,2025-11-04 19:48:43,2025-11-10 01:44:58
1or1gbw,Would you ever go back to a company you were laid off from?,prm20_,cscareerquestions,"I was laid off with about 90% of my team due to company “restructuring” in early 2024. It obviously sucked ass, but I understood this was an unfortunate risk that comes with working Tech for the most part. So I made sure to have contingency plans in place so it wasn’t too bad overall. Here’s the kicker, I have a little under 7 years of experience in Tech, but I spent 4 years as a TPM and only 2.5 as a SDE. So my experience, with lack of schooling, has been hurting me lately. Fast forward to now, I’m currently working as technical ”specialist”, which is just a support role one level lower beneath the Support Engineers. It’s keeping the bills paid (barely) but I recently found out my old company has an opening and they could probably get me back in due to my old rapport with the company. A good part of me wants to have some respect and dignity for myself lol, but due to the job market and my specific situation, I’m really debating on taking it. What’s y’all’s opinion?",41,0.91,75,https://www.reddit.com/r/cscareerquestions/comments/1or1gbw/would_you_ever_go_back_to_a_company_you_were_laid/,2025-11-07 18:01:10,2025-11-10 01:44:58
1oo2n4f,How do you deal with the 9–5 structure when working from home?,noysma,cscareerquestions,"Hey everyone,I started my first full-time job right after I finished my master degree (tbh some months before finishing I got an offer), and I’m still trying to understand how people deal with the 9–5 schedule .Back in university, I was always out of the house. I’d spend around 12 hours a day between classes, studying, and hanging out in the library. It was intense but I loved the rhythm — I was constantly learning, moving around, and seeing people.Now I work for a big multinational company, I only go to the office once a week. My days look completely different: I wake up, sit at my desk, code my algorithms, and then around 6 PM I shut off my company laptop. And then… nothing. It’s already dark outside, everyone’s going home, and it feels too late to go do anything.I actually like my job — I’m doing exactly what I wanted to do — but the way the 9–5 structure works feels kind of pointless sometimes. There are days when I literally have nothing to do because I’m waiting on another team, yet I still have to sit in front of my computer “just in case”Is this normal? How do you all deal with this kind of schedule?If I have no tasks for the day, why am I supposed to just sit here doing nothing?",38,0.86,36,https://www.reddit.com/r/cscareerquestions/comments/1oo2n4f/how_do_you_deal_with_the_95_structure_when/,2025-11-04 09:02:40,2025-11-10 01:44:58
1onjhhz,Am I making a mistake studying CS?,isntitlovelyjess,cscareerquestions,"26F here, after having attended one year of college in 2017/18, then dropping out, I’m now back in school studying CS. After I dropped out of school I did a lot of traveling and worked mostly hospitality jobs which I’ve enjoyed for the most part. I just don’t know if I see myself working hospitality in the long run. Thus, I’ve gone back to school to give it another chance with the hopes to make good/decent money post-grad. I’m currently taking an intro to programming/scripting class which has been going ok, the thing is I’m just not sure if I love it yet. My true passion is travel, and I figured if I studied CS I could get a well paying job and potentially be able to work remotely whilst traveling in the future. But now I’m really second guessing everything considering how poor the job market for CS grads seem to be at the moment. So, am I making a mistake for continuing this path? Should I consider studying something else, or even just drop out again and see where life takes me? I’m also currently living with my parents and hate the state I live in (US), so the thought of being stuck here for another 3-4 years sounds miserable, but if I could set myself up for a good future I feel it’d be worth it. I just don’t know.",30,0.75,75,https://www.reddit.com/r/cscareerquestions/comments/1onjhhz/am_i_making_a_mistake_studying_cs/,2025-11-03 18:19:49,2025-11-10 01:44:58
