id,title,author,subreddit,content,score,upvote_ratio,num_comments,url,created_utc,extracted_at
1odfg0o,dbt-core fork: OpenDBT is here to enable community,gelyinegel,dataengineering,"Hey all,Recently there is increased concerns about the future of the dbt-core. To be honest regardless of the the fivetran acquisition, dbt-core never got any improvement over time. And it always neglected community contributions. [OpenDBT](https://github.com/memiiso/opendbt) fork is created to solve this problem. Enabling community to extend dbt to their own needs and evolve opensource version and make it feature rich.[OpenDBT](https://github.com/memiiso/opendbt) dynamically extends dbt-core. It's already adding significant features that aren't in the dbt-core. This is a path toward a complete community-driven fork.We are inviting developers and the wider data community to collaborate. Please check out the features we've already added, star the repo, and feel free to submit a PR! [https://github.com/memiiso/opendbt](https://github.com/memiiso/opendbt)",339,0.97,36,https://www.reddit.com/r/dataengineering/comments/1odfg0o/dbtcore_fork_opendbt_is_here_to_enable_community/,2025-10-22 17:54:56,2025-10-26 01:42:14
1odp2y6,Just got hired as a Senior Data Engineer. Never been a Data Engineer,Uncle_Snake43,dataengineering,"Oh boy, somehow I got myself into the sweet ass job. I’ve never held the title of Data Engineer however I’ve held several other “data” roles/titles. I’m joining a small, growing digital marketing company here in San Antonio. Freaking JAZZED to be joining the ranks of Data Engineers. And I can now officially call myself a professional engineer!",297,0.9,93,https://www.reddit.com/r/dataengineering/comments/1odp2y6/just_got_hired_as_a_senior_data_engineer_never/,2025-10-23 00:21:16,2025-10-26 01:42:14
1obfys7,[Megathread] AWS is on fire,MikeDoesEverything,dataengineering,"EDIT EDIT: This is a past event although it looks like there are still errors trickling in. Leaving this up for a week and then potting it.EDIT: AWS now appears to be largely working.In terms of possible root cases, as hypothesised by u/tiredITguy42:>So what most likely happened:>DNS entry from DynamoDB API was bad.>Services can't access DynamoDB>It seems AWS is string IAM rules in DynamoDB>Users can't access services as they can't get access to resources resolved.>It seems that systems with main operation in other regions were OK even if some are running stuff in us-east-1 as well. It seems that they maintained access to DynamoDB in their region, so they could resolve access to resources in us-east-1.>These are just pieces I put together, we need to wait for proper postmortem analysis.As some of you can tell, AWS is [currently experiencing outages](https://www.bbc.co.uk/news/live/c5y8k7k6v1rt)In order to keep the subreddit a bit cleaner, post your gripes, stories, theories, memes etc. into here.We salute all those on call getting shouted at.https://preview.redd.it/1ljfaxkc19wf1.jpg?width=500&format=pjpg&auto=webp&s=997eccdafb24bf1378b07503a37112e434c4470d",281,0.97,63,https://www.reddit.com/r/dataengineering/comments/1obfys7/megathread_aws_is_on_fire/,2025-10-20 10:55:54,2025-10-26 01:42:14
1of3kqp,Modern SQL engines draw fractals faster than Python?!?,Psychological-Motor6,dataengineering,"Just out of curiosity, I setup a simple benchmark that calculates a Mandelbrot fractal in plain SQL using DataFusion and DuckDB – no loops, no UDFs, no procedural code. I honestly expected it to crawl. But the results are … surprising: Numpy (highly optimized) 0,623 sec (0,83x) :1st_place_medal:DataFusion (SQL) 0,797 sec (baseline) :2nd_place_medal:DuckDB (SQL) 1,364 sec (±2x slower) Python (very basic) 4,428 sec (±5x slower) :3rd_place_medal: SQLite (in-memory)  44,918 sec (±56x times slower) Turns out, modern SQL engines are nuts – and Fractals are actually a fun way to benchmark the recursion capabilities and query optimizers of modern SQL engines. Finally a great exercise to improve your SQL skills. Try it yourself (GitHub repo): [https://github.com/Zeutschler/sql-mandelbrot-benchmark](https://github.com/Zeutschler/sql-mandelbrot-benchmark) Any volunteers to prove DataFusion isn’t the fastest fractal SQL artist in town? PR’s are very welcome…",140,0.83,27,https://i.redd.it/yklx634ke3xf1.png,2025-10-24 17:14:57,2025-10-26 01:42:14
1oe9gn9,I wish business people would stop thinking of data engineering as a one-time project,nickvaliotti,dataengineering,"cause it’s notpipelines break, schemas drift, apis get deprecated, a marketing team renames one column and suddenly the “bulletproof” dashboard that execs stare at every morning is just... blankthe job isn’t to build a perfect system once and ride into the sunset. the job is to *own* the system — babysit it, watch it, patch it before the business even realizes something’s off. it’s less “build once” and more “keep this fragile ecosystem alive despite everything trying to kill it”good data engineers already know this. code fails — the question is how fast you notice. data models drift — the question is how fast you adapt. requirements change every quarter -- the question is how fast you can ship the new version without taking the whole thing downthis is why “set and forget” data stacks always end up as “set and regret.” the people who treat their stack like software — with monitoring, observability, contracts, proper version control — they sleep better (well, most nights)data is infrastructure. and infrastructure needs maintenance. nobody builds a bridge and says “cool, see you in five years”so yeah. next time someone says “can we just automate this pipeline and be done with it?” -- maybe remind them of that bridge",124,0.93,16,https://www.reddit.com/r/dataengineering/comments/1oe9gn9/i_wish_business_people_would_stop_thinking_of/,2025-10-23 17:26:34,2025-10-26 01:42:14
1oed53z,"MDM Is Dead, Right?",DryRelationship1330,dataengineering,"I have a few, potentially false beliefs about MDM. I'm being hot-takey on purpose. Would love a slap in the face.1. Data Products contextualize dims/descriptive data, in the context of the product, and as such they might not need a MDM tool to master it at the full/edw/firm level.2. Anything with ""Master blah Mgmt"" w/r/t Modern Data ecosystems overall is probably dead just out of sheer organizational malaise, politics, bureaucracy and PMO styles of trying to ""get everyone on board"" with such a concept, at large.3. Even if you bought a tool and did MDM well - on core entities of your firm (customer, product, region, store, etc..) - I doubt IT/business leaders would dedicated the labor discipline to keeping it up. It would become a key-join nightmare at some point.4. Do ""MDM"" at the source. E.g. all customers come from CRM. use the account\_key and be done with it. If it's wrong in SalesForce, get them to fix it.No?EDIT: MDM == Master Data Mgmt. See Informatica, Profisee, Reltio",98,0.92,73,https://www.reddit.com/r/dataengineering/comments/1oed53z/mdm_is_dead_right/,2025-10-23 19:47:03,2025-10-26 01:42:14
1oc1w56,How do you decide when to move from batch jobs to real-time pipelines?,stephen8212438,dataengineering,"Our team has been running nightly batch ETL for years and it works fine, but product leadership keeps asking if we should move “everything” to real-time. The argument is that fresher data could help dashboards and alerts, but honestly, I’m not sure most of those use cases need second-by-second updates.We’ve done some early tests with Kafka and Debezium for CDC, but the overhead is real, more infrastructure, more monitoring, more cost. I’m trying to figure out what the actual decision criteria should be.For those who’ve made the switch, what tipped the scale for you? Was it user demand, system design, or just scaling pain with batch jobs? And if you stayed with batch, how do you justify that choice when “real-time” sounds more exciting to leadership?",93,0.96,43,https://www.reddit.com/r/dataengineering/comments/1oc1w56/how_do_you_decide_when_to_move_from_batch_jobs_to/,2025-10-21 03:02:52,2025-10-26 01:42:14
1oexofz,"You need to build a robust ETL pipeline today, what would you do?",blackfleck07,dataengineering,"So, my question is intended to generate a discussion about cloud, tools and services in order do achieve this (taking IA into consideration).Is the Apache Airflow gang still the best? Or do reliable companies build from scratch using SQS / S3 / etc or PubSub / Google equivalent ?By the way, it would be a function to extract data from third-party APIs, save raw response, then another function to transform data and then another one to load on DBEdit:- Hourly updates intraday- Daily updates last 15 days- Monthly updates last 3 months",60,0.92,44,https://www.reddit.com/r/dataengineering/comments/1oexofz/you_need_to_build_a_robust_etl_pipeline_today/,2025-10-24 13:24:43,2025-10-26 01:42:14
1odk2ry,What's the community's take on semantic layers?,cpardl,dataengineering,"It feels to me that semantic layers are having a renaissance these days, largely driven by the need to enable AI automation in the BI layer. I'm trying to separate hype from signal and my feeling is that the community here is a great place to get help on that. Do you currently have a semantic layer or do you plan to implement one? What's the primary reason to invest into one?I'd love to hear about your experience with semantic layers and any blockers/issues you have faced. Thank you!",61,0.98,53,https://www.reddit.com/r/dataengineering/comments/1odk2ry/whats_the_communitys_take_on_semantic_layers/,2025-10-22 20:48:02,2025-10-26 01:42:14
1od40jc,PSA: Coordinated astroturfing campaign using LLM–driven bots to promote or manipulate SEO and public perception of several software vendors,None,dataengineering,"Patterns of possible automated bot activity promoting several vendors across r/dataengineering and broader Reddit have been detected.Easy way to find dozens of bot accounts: Find one shilling a bunch of tools then search these tools together.Here's an [example query](https://www.reddit.com/search/?q=airbyte+dreamfactory&type=comments&sort=new) or[ this one](https://www.reddit.com/search/?q=airbyte+windsor&type=comments&sort=new) which find **dozens of bot users and hundreds of comments**. When pasting these comments to an LLM it will immediately identify patterns and highlight which vendors are being shilled with what tactic.Community: **stay alert and report suspected bots. Tell your vendor if on the list that their tactics are backfiring.** When buying, consider vendor ethics, not just product features.# Consequences exist! All it takes some pissed off reports.Luckily astroturfing is illegal in all of the countries where these vendors are based.[ ](https://www.bloomberg.com/news/articles/2013-09-25/operation-clean-turf-and-the-war-on-fake-yelp-reviews)[Here's what happened in 2013 to vendors with deceptive practise in sting operation ""clean turf"".](https://www.bloomberg.com/news/articles/2013-09-25/operation-clean-turf-and-the-war-on-fake-yelp-reviews) Founders and their CEOS were publicly named and shamed in major news outlets, like The Guardian, for personally orchestrating the fraud. Individuals were personally fined and forced to sign legally binding ""assurance of discontinuance"", in some cases prohibiting them from starting companies again.For the 19 companies, the founders/owners were forced to personally pay fines ranging from $2,500 to just under $100,000 and sign an ""Assurance of Discontinuance,"" legally binding them to stop astroturfing.# Reddit contextA [Reddit ban on AI bot research](https://www.reddit.com/r/Switzerland/comments/1kczxvw/reddit_bans_researchers_who_used_ai_bots_to/) shows how seriously this is taken. If that's ""a highly unethical experiment"" then **doing it for money instead of science is so much worse.**",48,0.93,15,https://www.reddit.com/r/dataengineering/comments/1od40jc/psa_coordinated_astroturfing_campaign_using/,2025-10-22 09:55:35,2025-10-26 01:42:14
1od2x2k,Parquet vs. Open Table Formats: Worth the Metadata Overhead?,DevWithIt,dataengineering,"I recently ran into all sorts of pain working directly with raw Parquet files for an analytics project broken schemas, partial writes, and painfully slow scans. That experience made me realize something simple: Parquet is *just* a storage format. It’s great at compression and column pruning, but that’s where it ends. No ACID guarantees, no safe schema evolution, no time travel, and a whole lot of chaos when multiple jobs touch the same data.Then I explored open table formats like Apache Iceberg, Delta Lake, and Hudi and it was like adding a missing layer of order on top impressive is what they are bringing in * ACID transaction**s** through atomic metadata commits* Schema evolution without having to rewrite everything* for easy rollbacks and historical analysis we have Time travel * you can scan millions of files in milliseconds by Manifest indexing another cool thing * not to forget the hidden partitions In practice, these features made a *huge* difference reliable BI queries running on the same data as streaming ETL jobs, painless GDPR-style deletes, and background compaction that keeps things tidy.But it does make you think is that extra metadata layer really worth the added complexity? Or can clever workarounds and tooling keep raw Parquet setups running just fine at scale?Wrote a blog on this that i am sharing here looking forward to your thoughts",47,0.93,16,https://olake.io/blog/iceberg-vs-parquet-table-format-vs-file-format,2025-10-22 08:46:11,2025-10-26 01:42:14
1oajs0h,Struggling with separate Snowflake and Airflow environments for DEV/UAT/PROD - how do others handle this?,Dependent_Lock5514,dataengineering,"Hey all,This might be a very dumb or ignorant question from me who know very little about DevOps or best practices in DE but would be great if I can stand on the shoulders of giants!For the background context, I'm working as a quant engineer at a company with about 400 employees total (60\~80 IT staff, separate from our quant/data team which consists of 4 people, incl myself). Our team's trying to build out our analytics infrastructure and our IT department has set up **completely separate environments** for DEV, UAT, and PROD including:* Separate Snowflake accounts for each environment* Separate managed Airflow deployments for each environment* GitHub monorepo with protected branches (dev/uat/prod) for code (In fact, this is what I asked for. IT dept tried to setup polyrepo for n different projects but I refused)This setup is causing major challenges or at least I do not understand how to:* As far as I am aware, zero copy cloning doesn't work across Snowflake accounts, making it impossible to easily copy production data to DEV for testing* We don't have dedicated DevOps people so setting up CI/CD workflows feels complicated* Testing ML pipelines is extremely difficult without realistic data given we cannot easily copy data from prod to dev account in SnowflakeI've been reading through blogs & docs but I'm still confused about what's standard practice for this circumstance. I'd really appreciate some real-world insights from people who've been in similar situations.# This is my best attempt to distill the questions:* For a small team like ours (4 people handling all data work), is it common to have completely separate Snowflake accounts AND separate Airflow deployments for each environment? Or do most companies use a single Snowflake account with separate databases for DEV/UAT/PROD and a single Airflow instance with environment-specific configurations?* How do you handle testing with production-like data when you can't clone production data across accounts? For ML development especially, how do you validate models without using actual production data?* What's the practical workflow for promoting changes from DEV to UAT to PROD? We're using GitHub branches for each environment but I'm not sure how to structure the CI/CD process for both dbt models and Airflow DAGs without dedicated DevOps support* How do you handle environment-specific configurations in dbt and Airflow when they're completely separate deployments? Like, do you run Airflow & dbt in DEV environment to generate data for validation and do it again across UAT & PROD? How does this work?Again, I have tried my best to arcitulate the headaches that I am having and any practical advice would be super helpful. Thanks in advance for any insights and enjoy your rest of Sunday!",43,0.98,22,https://www.reddit.com/r/dataengineering/comments/1oajs0h/struggling_with_separate_snowflake_and_airflow/,2025-10-19 07:47:36,2025-10-26 01:42:14
1oafuv2,Company is paying for my next DE cert. Which one to choose right now ?,Fast-Mediocre,dataengineering,"Hey r/dataengineering,​My company (consulting in europe) is giving me some time and an open budget to grab my next certification. I need your honest opinions on what's worth the time and money in today's market.​My Profile:​Started as: Data Analyst 5years ago (Power BI, SQL, Python).​Now shifting into: Data Engineering (Fabric, dbt, Snowflake).​Goal: Go deeper into proper DE work, (while keeping analytics sttenghts).​Current Certs I've already passed:* ​PL-300 (Power BI)* ​DP-600 (fabric Analytics Engineer Associate)* ​Plus, the basic dbt and Databricks Foundations certs.​So, what's the next move?​What serious, paid certification is the actual game-changer right now for staying competitive? Should I double down on a specific cloud (AWS/GCP/Azure DE path)? Focus on something like Databricks/snowflake/dbt ?I know certif are sometimes bullshiy, but I can't resist free time and free voucher :)​Hit me with your best recommendations !Edit: formating",43,0.91,37,https://www.reddit.com/r/dataengineering/comments/1oafuv2/company_is_paying_for_my_next_de_cert_which_one/,2025-10-19 03:51:39,2025-10-26 01:42:14
1of9y36,"Feeling stuck as the only data engineer, unpaid overtime, no growth, and burnout creeping in",vh_obj,dataengineering,"Hey everyone,I’m a data engineer with about 1 year of experience working in a 7 persons' BI team, and I’m the only data engineer there.Recently I realized I’ve been working extra hours for free. I deployed a local Git server, maintain and own the DB instance that hosts our DWH, re-implemented and redesigned Python dashboards because the old implementation was slow and useless, deployed some infrastructure for data engineering workloads, developed cli frameworks to cut-off manual work and code redundancy, and harmonized inconsistent sources to produce accurate insights (they used to just dump Excel files and DB tables into SSIS, which generated wrong numbers) all locally.Last Thursday, we got a request with a deadline on Sunday, even though Friday and Saturday are our weekend (I’m in Egypt, and my team is currently working from home to deliver it, for free).At first, I didn’t mind because I wanted to deliver and learn, but now I’m getting frustrated. I barely have time to rest, let alone learn new things that could actually help me grow (technically or financially).Unpaid overtime is normalized here, and changing companies locally won’t fix that. So I’ve started thinking about moving to Europe, but I’m not sure I’m ready for such a competitive market since everything we do is on-prem and I’ve never touched cloud platforms.Another issue: I feel like the only technical person in the office. When I talk about software design, abstraction, or maintainability, nobody really gets it. They just think I’m “going fancy,” which leaves me on-call. One time, I recommended loading all our sources into a 3rd normal form schema as a single source of truth, because the same piece of information was scattered across multiple systems and needed tracking, enforcement, and auditing before hitting our Kimball DWH. They looked at me like I was a nerd trying to create extra work.I’m honestly feeling trapped.Should I keep grinding, or start planning my exit to a better environment (like Europe or remote)?Any advice from people who’ve been through this?",34,0.9,20,https://www.reddit.com/r/dataengineering/comments/1of9y36/feeling_stuck_as_the_only_data_engineer_unpaid/,2025-10-24 21:26:38,2025-10-26 01:42:14
1obij50,Flink Watermarks. WTF?,rmoff,dataengineering,"Yeah, so basically that. WTF. That was my first, second, and third reaction when I started trying to understand watermarks in Apache Flink. So I got together with a couple of colleagues and built flink-watermarks.wtf. It's a 'scrollytelling' explainer of what watermarks in Apache Flink are, why they matter, and how to use them.Try it out: [https://flink-watermarks.wtf/](https://flink-watermarks.wtf/)",34,0.97,6,https://i.redd.it/51pn5j7tm9wf1.gif,2025-10-20 13:07:20,2025-10-26 01:42:14
1of1xxl,7x faster JSON in SQL: a deep dive into Variant data type,samyak210,dataengineering,"Disclaimer: I'm the author of the blog post and I work for e6data.If you work with a lot of JSON string columns, you might have heard of the Variant data type (in Snowflake, Databricks or Spark). I recently implemented this type in e6data's query engine and I realized that resources on the implementation details are scarce. The parquet variant spec is great, but it's quite dense and it takes a few reads to build a mental model of variant's binary format.This blog is an attempt to explain why variant is so much faster than JSON strings (Databricks says it's 8x faster on their engine). AMA!",30,0.9,2,https://www.e6data.com/blog/faster-json-sql-variant-data-type,2025-10-24 16:12:12,2025-10-26 01:42:14
1ob3566,What tools do you prefer to use for simple interactive dashboards?,IDoCodingStuffs,dataengineering,"I have been trying Apache Superset for some time, and it does most of the job but also comes just short of what I need it to do. Things like:- Not straightforward to reuse the same dashboard with different source tables or views. - Supports cert auth for some DB connections but not others. Unless I am reading the docs wrong.What other alternatives are out there? I do not even need the fancy visualizations, just something that can do filtering and aggregation on the fly for display in tabular format.",29,0.98,16,https://www.reddit.com/r/dataengineering/comments/1ob3566/what_tools_do_you_prefer_to_use_for_simple/,2025-10-19 22:28:23,2025-10-26 01:42:14
1oatq7o,Beginner Confused About Airflow Setup,Amomn,dataengineering,"Hey guys,I'm total beginner learning tools used data engineering and just started diving into orchestration , but I'm honestly so confused about which direction to goi saw people mentioning Airflow, Dagster, PrefectI figured ""okay, Airflow seems to be the most popular, let me start there."" But then I went to actually set it up and now I'm even MORE confused...* First option: run it in a Python environment (seems simple enough?)* BUT WAIT - they say it's recommend using a Docker image instead* BUT WAIT AGAIN - there's this big caution message in the documentation saying you should really be using Kubernetes* OH AND ALSO - you can use some ""Astro CLI"" too?Like... which one am I actually supposed to using? Should I just pick one setup method and roll with it, or does the ""right"" choice actually matter?Also, if Airflow is this complicated to even get started with, should I be looking at Dagster or Prefect instead as a beginner?Would really appreciate any guidance because i'm so lost and thanks in advance",30,0.97,19,https://www.reddit.com/r/dataengineering/comments/1oatq7o/beginner_confused_about_airflow_setup/,2025-10-19 16:16:55,2025-10-26 01:42:14
1odains,Ducklake on AWS,theManag3R,dataengineering,"Just finished a working version of a dockerized dataplatform using Ducklake! My friend has a startup and they had a need to display some data so I offered him that I could build something for them.The idea was to use Superset, since that's what one of their analysts has used before. Superset seems to also have at least some kind of support for Ducklake, so I wanted to try that as well.So I set up an EC2 where I pull a git repo and then spin up few docker compose services. First service is postgres that acts as a metadata for both Superset and Ducklake. Then Superset service spins up nginx and gunicorn that run the BI layer.Actual ETL can be done anywhere on the EC2 (or Lambdas if you will) but basically I'm just pulling data from open source API's, doing a bit of transformation and then pushing the data to Ducklake. Storage is S3 and Ducklake handles the parquet files there.Superset has access to the Ducklake metadata DB and therefore is able to access the data on S3.To my surprise, this is working quite nicely. The only issue seems to be how Superset displays the schema of the Ducklake, as it shows all the secrets of the connection URI (:I don't want to publish the git repo as it's not very polished, but I just wanted to maybe raise discussion if anyone else has tried something similar before?This sure was refreshing and different than my day to day job with big data.And if anyone has any questions regarding setting this up, I'm more than happy to help!",26,0.91,8,https://www.reddit.com/r/dataengineering/comments/1odains/ducklake_on_aws/,2025-10-22 14:55:09,2025-10-26 01:42:14
