id,title,author,subreddit,content,score,upvote_ratio,num_comments,url,created_utc,extracted_at
1jtw6k1,Was just told that there are only entry level and heavy senior level jobs only right now,Cdore,cscareerquestions,"Hi there. I'm in the 12 year yoe range. I've been on the market for two months now. I've had two recruiters tell me that they currently only have junior and heavy senior (20+ yoe) positions here locally in my city within Texas. That's a very big gap I've never seen before between expertise. Obviously, this leaves someone like me basically out of the running currently.What happened?",143,0.93,60,https://www.reddit.com/r/cscareerquestions/comments/1jtw6k1/was_just_told_that_there_are_only_entry_level_and/,2025-04-07 20:59:27,2025-04-13 02:54:55
1jtqab2,Why do startups have an attitude?,stealth_Master01,cscareerquestions,"I know, startups aren't a place for new grads but given the current market situation I am applying to every single opportunity. I am based in Canada and started to notice that about 90% of the startups here have this weird attitude that they are the best?I reached out to couple of startups and they have responded that ""We only take people with Professional experience not someone with Pet projects"" and I was baffled. On top of this, I reached out to a founder of a company looking for opportunities and the very next day he posts on Linkedin saying ""We had all trashy applicants so far with 0 value, here are the ways you are the best fit"".I know I could just move on, but I just wanted to rant about their behaviour. They feel so entitled with their VC funding and later wonder why they have 0 revenue coming in.",144,0.94,51,https://www.reddit.com/r/cscareerquestions/comments/1jtqab2/why_do_startups_have_an_attitude/,2025-04-07 17:01:06,2025-04-13 02:54:55
1jxczax,Is stack overflow headed for extinction?,wbcm,cscareerquestions,"I used to be active on SO around 10 years ago and it was generally great, mostly helpful and insightful but only a little rough around the edges. Fast forward to the last month and I started being active there again and... using it over the last month has been a dumpster fire. It really feels like the point of the site has gone from providing answers/solutions to being more of a game of clout and academic trivialities. After really reviewing the current rules of the site and the culture that has formed on it, it seems like SO is trying to extinct itself. There are two big problems I see.1: The culture is designed and empowered to be horribleComing back to answering questions after so many years I was really surprised to see the same one or two dozen people across nearly everything I was answering. The small group of power users or moderators have an uncanny ability to be posting or editing things on there all day. They also seem to be the ones who are more eager to downvote answers or close questions with little regard for the community, or even following the conversations. The way the points system works basically means that you cannot interact with anything in the community until amassing a lot of points, which is normally gate-kept by these power users. Other people can also upvote your posts, but in order to get the ability to upvote it seems like newer users have to endure a lot of bullying to get there, if they get there at all. If you are new and get a couple downvotes on your posts you are not allowed to post anything again until your existing posts get more upvotes, but there is no robust way for that to organically happen in most of the site that only sees under a 100 views per question. This has created a weird vacuum where the power users kind of have the ability to knight newer users or essentially permanently disable newer user's accounts. On top of this, the culture seems to really prize putting people (and their questions and answers) down. The first couple of times someone would leave a single sentence comment on my answer basically saying ""you're wrong"", I was more eager to engage with it to see what I was missing. Over time the majority of such engagements turned out to be someone who would continue to say ""you're wrong"" but not want to elaborate, or missing understanding on the question/answer that was relevant. Over time, I realized that this was just the culture that is there. Unsurprisingly, I have began to recognize certain power users usernames and saw them bullying newer people in the questions and answers. This is alienating a huge group of people who are either new to programming and SO, or are experienced programmers that are new to SO. AKA, not many new people want to stay on the site. This massively reflects in the lowering number of questions coming in and the speed in which they are answered. This is only worsened by the expanding prevalence of LLMs. It is hard to see the next generation of programmers preferring the high likelihood of waiting a long time to be bullied on SO, vs an LLM who can instantly offer any type of information for your question and will not be toxic. 2: [duplicate] It is good to not let a question get asked for the millionth time in a row, but I saw so many questions that were immediately closed as duplicates and the provided duplicates were either many years out of date or only partially related. At a certain point all the programming questions that people can ask, will have been asked... unless new programming languages or software versions allow for substantively new questions to be asked. There was no good globally centralized place to ask programming questions before SO, and so there was at least 30 years of programming questions that needed to be satiated. As time goes on, more and more questions will either legitimately be duplicates or, more likely, a mod is gonna mark it as duplicate since one part of the question overlaps with one part of another that was asked since the inception of SO. At this point, SO reads more like an encyclopedia than a lively place of discourse. Take somewhere like reddit, quora, or even the comment section of a youtube video where you are learning something, these all feel like they are much more engaging and are great places to connect and ask questions. SO on the other had feels like a good place to get your question turned away. Talking to some newer programmers I know, they have a shared sentiment that SO is a bad place to ask questions and prefer reddit and LLMs instead. There seemed to be a shared experience between all of them that any time they google a question that SO is often towards the top, which exposed them to it often, but when they made accounts and started trying to be active there they were met with bad experiences. This kind of reinforces the feeling like SO is heading towards being an encyclopedia/ghost town rather than a community. In any case, these are just my loose thoughts around being active on SO after having not been after almost a decade. I used to remember it as being a great place and have just generally been surprised about how dumb and toxic it feels to be on there now. Do other people feel this way? Or did I somehow just jump back into the wrong parts of it?",130,0.9,52,https://www.reddit.com/r/cscareerquestions/comments/1jxczax/is_stack_overflow_headed_for_extinction/,2025-04-12 08:52:59,2025-04-13 02:54:55
1ju3uw0,Survive in amazon as sde 2 without lot of coding experience,genericusername1527,cscareerquestions,"I’m a data engineer at one of the big fortune 10 companies. My experience has mainly been with python, airflow, spark, setting up cicd and hitting apis to get data etc. I recently cleared amazons sde 2 interview. The hiring manager has offered to coach me in areas of improvement like clean code etc. do you think I will be able to survive at Amazon as sde 2?Edit: people have said to me on blind that this is a hire to fire role. How true is “hire to fire”",125,0.91,83,https://www.reddit.com/r/cscareerquestions/comments/1ju3uw0/survive_in_amazon_as_sde_2_without_lot_of_coding/,2025-04-08 03:09:02,2025-04-13 02:54:55
1jwohyy,How many hours do you put in to study after work?,witchie66,cscareerquestions,"SWE 6YOE. Tired of the grind but in this field it never seems to stop, got into my last role few years ago without much prep at all. Looking for a change but hiring bar seems to have shifted a lot... I haven't touched LC/SD in years.Experienced devs, how much time do you spend studying a day for interview prep? Do you guys prep + apply for jobs at the same time? Or like... Prep for 2-3 months, then start applying?Honestly been too comfortable in my role I haven't realised how much the market has changed.",115,0.9,67,https://www.reddit.com/r/cscareerquestions/comments/1jwohyy/how_many_hours_do_you_put_in_to_study_after_work/,2025-04-11 12:21:03,2025-04-13 02:54:55
1jvn5i4,Applying to Amazon with different email than the cooldown one,acexsd1,cscareerquestions,"Hi all,I've applied to Amazon engineering and went through the interview process, but unfortunately did not make the cut. This was 4-5 months ago, I am getting a referral from a friend that currently works there now and I was wondering if I made a new email that has not applied to Amazon yet, would I get banned from applying or any other consequence?",113,0.87,38,https://www.reddit.com/r/cscareerquestions/comments/1jvn5i4/applying_to_amazon_with_different_email_than_the/,2025-04-10 02:13:50,2025-04-13 02:54:55
1jvvzaq,Is low code that bad,leprogrammeux,cscareerquestions,"I got a job a month ago, at the interview I was told I would do python. Turns out it's not python it's a proprietary language that is tied to low code tool.The place is a mess. Every new tasks is a fight to gather information and do tasks. I have tasks that I dont understand a single thing. Like clients send emails with no context or anything with heavy business logic involving money. Also everything is urgent but there are no proper planning, you're expected to do many tasks per day ( crazy context switching )I'm wondering how bad that job would be for my carreer. The only positive is that job has the highest salary since my graduation and it is remote.I have a job interview coming up for a company 10 minutes from home. I'm scared to switch to this place since they are a manufacturing company that exports a lot to USA, but at least is be a real dev. ( i also need to fight my anxiety going out is hard since the pandemic lol but listening to music helps a lot)So yeah I am very grateful they hired me since I was unemployed for 2 years and the team is nice but it is a chaotic mess and it is stressful. I feel bad to look for a new job a month in",111,0.92,31,https://www.reddit.com/r/cscareerquestions/comments/1jvvzaq/is_low_code_that_bad/,2025-04-10 11:50:41,2025-04-13 02:54:55
1juvd3t,Better option with Trump's tariffs in mind.,ZechariahKingsley,cscareerquestions,"I'm stuck deciding between two job offers: Amazon (AWS) and Shopify. I prefer Shopify simply because it is remote along with better work life balance.However, particularly worried about how the recent tariffs might impact job security at either company. The compensation difference is around $30k, which isn't a huge factor after considering relocation expenses.Amazon (AWS) seems bigger and maybe better protected. Shopify is smaller and might be more vulnerable to layoffs if tariffs create instability.Any thoughts on which would be safer right now? Is there much of a difference?",102,0.8,48,https://www.reddit.com/r/cscareerquestions/comments/1juvd3t/better_option_with_trumps_tariffs_in_mind/,2025-04-09 02:31:40,2025-04-13 02:54:55
1jvyhma,State of the job market,DeliciousPiece9726,cscareerquestions,"I see a lot of folks here discouraging people to get into CS. The job market is in shambles, and a lot of people are struggling, I know. But is it really as bad as this subreddit or the social media in general makes it out to be? If someone goes through this subreddit to understand the state of the job market, they will be left with the impression, that they will likely end up jobless, or working at McDonald's, even if they work hard and do everything right. Now is there any data that would indicate this? Or is there just anecdotal experiences of people on social media?",98,0.79,182,https://www.reddit.com/r/cscareerquestions/comments/1jvyhma/state_of_the_job_market/,2025-04-10 13:54:52,2025-04-13 02:54:55
1jvl9hl,"would you do a 1.5 hour commute each way, 3x a week, for less than 100k",spiderm-n,cscareerquestions,"job’s decent, pays around 80k, but i’m spending 3 hours a day driving, three days a week. not remote. curious if others would deal with this or if i’m just getting too used to it. asking for my sanity. eta: i have about 2yoe for context",90,0.8,179,https://www.reddit.com/r/cscareerquestions/comments/1jvl9hl/would_you_do_a_15_hour_commute_each_way_3x_a_week/,2025-04-10 00:34:59,2025-04-13 02:54:55
1jtfp4h,Haven't had work in 5+ weeks. Is this normal?,plebguy1125,cscareerquestions,I am a data scientist working in a non-IT team. I am the only data scientist. I haven't really had any work to do for several weeks and I was wondering if this is normal. There were other jobs where I did have no work for about 2-3 weeks but I feel this is long nowIs this normal for anyone else? I am pretty bored sitting in the office. There is legit no work to do like no automation and my place is boomer mentality so using things like even a RDBMS is not allowed for some weird reason.,91,0.9,47,https://www.reddit.com/r/cscareerquestions/comments/1jtfp4h/havent_had_work_in_5_weeks_is_this_normal/,2025-04-07 07:35:54,2025-04-13 02:54:55
1jxv1dg,"Formal written HR warning by manager after 2 ""failed"" sprints, been at this startup for 1.5 months",Neurprise,cscareerquestions,"I recently joined this startup near the middle/end of February for a new backend team they were building for a new product. At the same time as me joined a manager, older guy who's worked in startups for 20 years, as well as a coworker who worked at a big tech company.After two ""failed"" sprints, I had a 1:1 yesterday, as we usually do weekly on Fridays, and he basically told me that he had performance concerns about me and that I need to improve for the next sprint or two or ""things will get messy (implying termination)."" Soon after the conversation, he and HR send me a letter I had to sign essentially saying what he said in the call. Some details on the situation:- He said that in all his 20 years of working for startups, not once has he failed a sprint (and he defined failing one as not having any tickets roll over to the next sprint), yet since we started, he has failed every single one (when we first started, there was one ticket that blocked us and it rolled over, and he considered that a failure and wrote a big email about how he's sorry he failed). - Manager comes from a culture that emphasizes working long hours. Now I come from the same culture (I'm sure you can guess what it is) but I was born here instead so I don't have the same sort of expectations as he does.- Coworker is an overachiever who has spent considerable time at a big tech and brought a super convoluted [microservices](https://www.youtube.com/watch?v=y8OnoxKotPQ) architecture that is very difficult to grasp. The way it's set up, you essentially can't even fully run it locally as it uses dev containers and there's some issue with the ports overlapping when you try to work on multiple services at once, and you also essentially need one IDE window open for each service as they're all in different repos of course. He has so many PRs, it's even hard to follow for me to be productive, so, to be fair, I'm not as productive as I could be, but it's more me not being able to deal with this overcomplicated codebase. Since joining only 1.5 months ago, there was essentially no ramp up period for me to learn the new codebase and architecture that the overachieving coworker built in a week.- Together they essentially work at all hours of the day, most recently they were working at 10 pm working on some issue and I saw the Slack conversation only once I opened my laptop the next day. The manager during one of the standup calls said he was up around 5 or 6 am from the night before trying to debug some build issue.- I was dealing with a longer running illness and took 2 sick days a few weeks ago and then 2 earlier this week. The coworker took over my tickets that I had in progress and just finished them himself.- Manager said they are dealing with deadlines imposed on them from above, wanting to get a full backend and frontend MVP out by the end of next month, so it seems some of this stuff is him trying to deflect issues onto performance concerns on me, but funnily enough we have a separate frontend team and they seem a lot more chill, they essentially haven't done much as the designs themselves have not been finalized.The multi-page letter itself essentially mentioned some of these points and implied that I didn't work on enough tickets last sprint and none this sprint (due to coworker finishing them) and said that while they understood I had an illness, I essentially should have completed them by the end of the sprint anyway. The letter literally had a *day-by-day* account of every day of the sprints that I had failed to finish a ticket and that I should have communicated what I was doing that day. Never in my professional life had I seen such minute detail and I honestly don't know how the manager spent so much of their own time to draft this up. At the end of this section, he essentially implied that I lied about what I was doing every day and it said ""dishonesty is not tolerated at this company.""I brought up all of these sorts of concerns (overachieving coworker, hard to grasp codebase, illness) multiple times to my manager previously in 1:1s and he kinda acted like he sympathized but essentially said tough shit you gotta finish your work (like he acted nice in the video call and said it diplomatically but then on the letter it was harshly worded).At the end, the manager said that I should think about all this over the weekend and give it a ""fresh start"" on Monday, implying improving massively over the next few weeks. Is this essentially a PIP? Should I actually try working on this or start looking for new roles? Problem is this role pays quite well, at least 15% higher than other roles I've been seeing in the market so wondering if that's worth it or not (or maybe they'll just fire me anyway after a month).",117,0.97,101,https://www.reddit.com/r/cscareerquestions/comments/1jxv1dg/formal_written_hr_warning_by_manager_after_2/,2025-04-13 00:05:31,2025-04-13 02:54:55
1jt1c38,friend looking for job with too high expectations?,No_Technician7058,cscareerquestions,"my friend is a senior backend dev, former m7, former MIT, who previously made ~$350k TC as a senior dev with 11 years experience in a fully remote position.has been looking for work for about 18 months with no offers after a round of layoffs. didn't save much while employed so he's moving his family back in with his parents for now. recently we were catching up and he was complaining he hasn't even been able to apply to many roles as most are not offering anywhere near the TC he was making before. He's betting the market will improve soon and doesn't want to take something in the interm and miss out on reentering his previous payband or having to return to the office. his job applications to other m7 companies haven't gone anywhere either at this point but he is still working the recruiter network.I didn't want to comment on it in front of him, but are his expectations reasonable? as they seem quite optimistic to me. I have a similar level of experience but I've never made anywhere near that much. that said my pedigree is far lower with respect to where I studied (small university vs MIT) and my former employers. I'm not sure I will mention it to him regardless, I prefer to let people do what they want, but I am curious if I'm overly pessimistic about his chances or if people like him are able to get these jobs easier than I realize.",81,0.87,81,https://www.reddit.com/r/cscareerquestions/comments/1jt1c38/friend_looking_for_job_with_too_high_expectations/,2025-04-06 18:47:48,2025-04-13 02:54:55
1jx3ohm,Rejected after final round,SellPrize883,cscareerquestions,"Dream problem type, not dream company, but good enough. I made it through every round so easily! They said I was a strong candidate and received excellent feedback and that they would refer me to another team for the same role (MLE) and reach out when positions open on that team in the future. WTF? What do I have to do? I am a social guy, I answered the behavioral questions well. I solved the coding problem in like 7 minutes, communicated it well. I finished the system design interview in ample time, had what I thought was an intelligent conversation with the interviewer. Honestly this is so FUCKING LAME this field can be so challenging and rewarding but it’s so cut throat it’s unbelievable",76,0.9,42,https://www.reddit.com/r/cscareerquestions/comments/1jx3ohm/rejected_after_final_round/,2025-04-11 23:26:46,2025-04-13 02:54:55
1jx2tn7,"When applying to colleges, The Common Application makes it easy to apply to many places at once. However, when applying to CS jobs, every company has a unique application with ~5 pages each. Is there a place where one can apply to multiple companies at once?",Cheetah3051,cscareerquestions,That would be a good idea if it doesn't exist.,77,0.8,41,https://www.reddit.com/r/cscareerquestions/comments/1jx2tn7/when_applying_to_colleges_the_common_application/,2025-04-11 22:45:16,2025-04-13 02:54:55
1jvg7zk,I'm so tired,Initial_Lie8177,cscareerquestions,"May 2024 grad, unable to find anything for a full year after graduation. Just so tired of applying to hundreds of jobs every month to get almost no response back. Finally had one posting give me a chance, went through an OA, Behavioral and Technical interviews, that I did really well in. Left the final interview in high hopes thinking my grind has finally ended. Just when I thought I was seeing the light at the end of the tunnel, I get a call from the hiring manager saying they no longer had the funding for the position they were offering. I just don't have the motivation to even apply anymore man, I just feel like I'm completely unhirable at this point. Resume in case anyone wanted to see it https://imgur.com/a/fhAUngI",79,0.89,34,https://www.reddit.com/r/cscareerquestions/comments/1jvg7zk/im_so_tired/,2025-04-09 20:41:27,2025-04-13 02:54:55
1jsxa8j,"In tech, if your more senior coworkers make you feel nervous, how do you stop feeling that way (while asking questions, live coding, trying to get involved in conversations)?",IdeaExpensive3073,cscareerquestions,"The tone in their response from the coworkers are usually either frustration in answering questions, or treating your involvement in conversations as if you were a child.I hardly ever go to my senior coworkers for questions, because I usually leave the conversation without a good answer (and more confusion), or I feel seen as ignorant/seen as incompetent.",77,0.95,40,https://www.reddit.com/r/cscareerquestions/comments/1jsxa8j/in_tech_if_your_more_senior_coworkers_make_you/,2025-04-06 15:54:08,2025-04-13 02:54:55
1jvcv4b,Is it okay to ask for an entry level role even with 4 YoE?,wont-share-food,cscareerquestions,"I've been working at a no name company as a SWE for the last 4 years making peanuts. It's mostly been typical CRUD work with business logic sprinkled in. Nothing ground breaking or tough. I've launched many features on our platform by myself (one of them being building our payment system using Stripe lol) but again, it's basically just build a UI to take user input, spit out some output.I have an interview with Stripe for a Full Stack role and even their entry level salary is miles better than what I'm making now. I'd be completely satisfied getting an entry level position and having to work my way up, I know I can do it.The only issue is the interview. I'd rather get an entry level interview, join the company and work my way up rather than get interviewed for mid level position and bomb it. I'm confident in my skills but I definitely use google a lot on a day to day and I'm not some leetcode god either.So how does this work? Do they bucket me into a certain level and give me that levels interview? Or do they start off the interview and depending on how I do the questions they write me down as Entry, Mid, etc? Is it bad if I straight up tell them ""I'd like to try out for the lowest level please""?Any advice is appreciated!",75,0.95,32,https://www.reddit.com/r/cscareerquestions/comments/1jvcv4b/is_it_okay_to_ask_for_an_entry_level_role_even/,2025-04-09 18:22:45,2025-04-13 02:54:55
1jurawh,"Finally got an offer, after 7 months of unemployment",TigerLilly00,cscareerquestions,"https://imgur.com/a/1y4v76TI only just started keeping track of all my applications like last month, so I actually applied a lot more than this.The referrals ghosted me after the recruiter promised me interviews, so that was pretty annoying (they were all to the same company, different roles).Just got the offer today, from one of my cold applications.I've been so stressed, and this is such a relief. Now, more than ever, this is a numbers game. If you're still looking for a job, don't lose hope!",63,0.94,28,https://www.reddit.com/r/cscareerquestions/comments/1jurawh/finally_got_an_offer_after_7_months_of/,2025-04-08 23:06:50,2025-04-13 02:54:55
