id,title,author,subreddit,content,score,upvote_ratio,num_comments,url,created_utc,extracted_at
1opz0ve,"Unpopular Opinion: Data Quality is a product management problem, not an engineering one.",NewLog4967,dataengineering,"Hear me out. We spend countless hours building data quality frameworks, setting up Great Expectations, and writing custom DBT tests. But 90% of the data quality issues we get paged for are because the business logic changed and no one told us.A product manager wouldn't launch a new feature in an app without defining what quality means for the user. Why do we accept this for data products?We're treated like janitors cleaning up other people's messes instead of engineers building a product. The root cause is a lack of ownership and clear requirements *before* data is produced.Discussion Points:* Am I just jaded, or is this a universal experience?* How have you successfully pushed data quality ownership *upstream* to the product teams that generate the data?* Should Data Engineers start refusing to build pipelines until acceptance criteria for data quality are signed off?Let's vent and share solutions.",197,0.92,57,https://www.reddit.com/r/dataengineering/comments/1opz0ve/unpopular_opinion_data_quality_is_a_product/,2025-11-06 13:33:10,2025-11-10 01:44:56
1oos473,When the pipeline stops being “a pipeline” and becomes “the system”,stephen8212438,dataengineering,"There’s a funny moment in most companies where the thing that was supposed to be a temporary ETL job slowly turns into the backbone of everything. It starts as a single script, then a scheduled job, then a workflow, then a whole chain of dependencies, dashboards, alerts, retries, lineage, access control, and “don’t ever let this break or the business stops functioning.”Nobody calls it out when it happens. One day the pipeline is just *the system*.And every change suddenly feels like defusing a bomb someone else built three years ago.",176,0.97,20,https://www.reddit.com/r/dataengineering/comments/1oos473/when_the_pipeline_stops_being_a_pipeline_and/,2025-11-05 03:19:57,2025-11-10 01:44:56
1op7yd0,Is work life balance in data engineering is non-existent?,shanksfk,dataengineering,"I’ve been a data engineer for a few years now and honestly, I’m starting to think work life balance in this field just doesn’t exist.Every company I’ve joined so far has been the same story. Sprints are packed with too many tickets, story points that make no sense, and tasks that are way more complex than they look on paper. You start a sprint already behind.Even if you finish your work, there’s always something else. A pipeline fails, a deployment breaks, or someone suddenly needs “a quick fix” for production. It feels like you can never really log off because something is always running somewhere.In my current team, the seniors are still online until midnight almost every night. Nobody officially says we have to work that late, but when that’s what everyone else is doing, it’s hard not to feel pressured. You feel bad for signing off at 7 PM even when you’ve done everything assigned to you.I actually like data engineering itself. Building data pipelines, tuning Spark jobs, learning new tools, all of that is fun. But the constant grind and unrealistic pace make it hard to enjoy any of it. It feels like you have to keep pushing non-stop just to survive.Is this just how data engineering is everywhere, or are there actually teams out there with a healthy workload and real work life balance?",157,0.92,89,https://www.reddit.com/r/dataengineering/comments/1op7yd0/is_work_life_balance_in_data_engineering_is/,2025-11-05 16:44:47,2025-11-10 01:44:56
1oq6zoy,Banned from r/MicrosoftFabric for sharing a blog,b1n4ryf1ss10n,dataengineering,"I just got banned from r/MicrosoftFabric for sharing what I thought was a useful blog on OneLake vs. ADLS costs. Seems like people can get banned there for anything that isn't positive, which isn't a good sign for the community.Just wanted to raise this for everyone's awareness.",153,0.83,46,https://www.reddit.com/r/dataengineering/comments/1oq6zoy/banned_from_rmicrosoftfabric_for_sharing_a_blog/,2025-11-06 18:36:04,2025-11-10 01:44:56
1oqjm4v,Anyone else get that strange email from DataExpert.io’s Zack Wilson?,Quick_Ad269,dataengineering,"https://preview.redd.it/1dc9xc1y5rzf1.png?width=708&format=png&auto=webp&s=6c565b68dbbd65ce9582ab7eed5204be0e4b6573https://preview.redd.it/2awirdgy5rzf1.png?width=772&format=png&auto=webp&s=611fcbf389d67a661385e4248bd5c62036625ddbHe literally sent an email openly violating Trustpilot policy by asking people to leave 5 star reviews to extend access to the free bootcamp. Like did he not think that through?Then he followed up with another email basically admitting guilt but turning it into a self therapy session saying “I slept on it... the four 1 star reviews are right, but the 600 five stars feel good.” What kind of leader says that publicly to students?And the tone is all over the place. Defensive one minute, apologetic the next, then guilt trippy with “please stop procrastinating and get it done though.” It just feels inconsistent and manipulative.Honestly it came off so unprofessional. Did anyone else get the same messages or feel the same way?",149,0.92,90,https://www.reddit.com/r/dataengineering/comments/1oqjm4v/anyone_else_get_that_strange_email_from/,2025-11-07 03:19:41,2025-11-10 01:44:56
1onn50a,"What Data Engineering ""Career Capital"" is most valuable right now?",regal_ethereal7,dataengineering,"Taking inspiration from Cal Newport's book, ""So Good They Can't Ignore You"", in which he describes the (work related) benefits of building up ""career capital"", that is, skillsets and/or expertise relevant to your industry that prove valuable to either employers or your own entreprenurial endeavours - what would you consider the most important career capital for data engineers right now?The obvious area is AI and perhaps being ready to build AI-native platforms, optimizing infrastructure to facilitate AI projects and associated costs and data volume challenges etc.If you're a leader, building out or have built out teams in the past, what is going to propel someone to the top of your wanted list?",125,0.96,40,https://www.reddit.com/r/dataengineering/comments/1onn50a/what_data_engineering_career_capital_is_most/,2025-11-03 20:33:30,2025-11-10 01:44:56
1oo5rpu,Why everyone is migrating to cloud platforms?,dfwtjms,dataengineering,"These platforms aren't even cheap and the vendor lock-in is real. Cloud computing is great because you can just set up containers in a few seconds independent from the provider. The platforms I'm talking about are the opposite of that. Sometimes I think it's because engineers are becoming ""platform engineers"". I just think it's odd because pretty much all the tools that matter are free and open source. All you need is the computing power.",80,0.8,117,https://www.reddit.com/r/dataengineering/comments/1oo5rpu/why_everyone_is_migrating_to_cloud_platforms/,2025-11-04 12:16:51,2025-11-10 01:44:56
1orvevk,Shopify Data Tech Stack,mjfnd,dataengineering,"Hello everyone, hope all are doing great!I am sharing a new edition to Data Tech Stack series covering Shopify where we will explore what tech stack is used at Shopify to process 284 million peak requests per minute generating $11+ billions in sales.Key Points:* Massive Real-Time Data Throughput: Kafka handles 66 million messages/sec, supporting near-instant analytics and event-driven workloads at Shopify’s global scale.* High-Volume Batch Processing & Orchestration: 76K Spark jobs (300 TB/day) coordinated via 10K Airflow DAGs (150K+ runs/day) reflect a mature, automated data platform optimized for both scale and reliability.* Robust Analytics & Transformation Layer: DBT’s 100+ models and 400+ unit tests completing in under 3 minutes highlight strong data quality governance and efficient transformation pipelines. I would love to hear feedback and suggestions on future companies to cover. If you want to collab to showcase your company stack, lets work together.",76,0.9,15,https://www.junaideffendi.com/p/shopify-data-tech-stack,2025-11-08 17:38:13,2025-11-10 01:44:56
1opu9sk,What will Data Engineers evolve into in the future?,Artye10,dataengineering,"I was asking myself that the title of Data Engineer didn't exist 10-15 (being generous) years ago, so it's possible that in 5 to 10 years it will disappear, even if we do kind of the same things that we do right now (moving data from point A to point B).I know that predicting these things is impossible, but as someone that started his career 3 years ago as a Data Engineer, I wonder what is the future for me if I stay technical and if what I do will change significantly as the market changes. People that have been many years in the industry, how it's been the road for you? How did your responsibilities and day to day job change over time? Was it difficult to stay up to date when new technologies and new jobs and titles appeared?",66,0.93,64,https://www.reddit.com/r/dataengineering/comments/1opu9sk/what_will_data_engineers_evolve_into_in_the_future/,2025-11-06 09:17:17,2025-11-10 01:44:56
1onbz5a,Dumbest thing you have ever worked on?,Brief-Knowledge-629,dataengineering,"Right now, basically my entire workload is maintaining and adding new features to pipelines that support a few dozen dashboards. Like all dashboards....no one uses them.The only views in the past 6 months have been from our PO and they have only been viewing dashboards in order to QA tickets. My entire job is making sure dashboards say what one person thinks they should say....so I have started just running one off update statements to make problems go away. UPDATE some.tableSET value = what\_po\_saysWHERE id = some\_customer",67,0.95,19,https://www.reddit.com/r/dataengineering/comments/1onbz5a/dumbest_thing_you_have_ever_worked_on/,2025-11-03 13:38:11,2025-11-10 01:44:56
1onwcfn,From data entry to building AI pipelines — 12 years later and still at $65k. Time to move on?,JoeFromWyo,dataengineering,"I started in data entry for a small startup 12 years ago, and through several acquisitions, I’ve evolved alongside the company. About a year ago, I shifted from Excel and SQL into Python and OpenAI embeddings to solve name-matching problems. That step opened the door to building full data tools and pipelines—now powered by AI agents—connected through PostgreSQL (locally and in production) and developed entirely within Cursor.It’s been rewarding to see this grow from simple scripts into a structured, intelligent system. Still, after seven years without a raise and earning $65k, I’m starting to think it might be time to move on, even though I value the remote flexibility, autonomy, and good benefits.Where do I go from here?",64,0.83,26,https://www.reddit.com/r/dataengineering/comments/1onwcfn/from_data_entry_to_building_ai_pipelines_12_years/,2025-11-04 02:57:07,2025-11-10 01:44:56
1orc11c,Unsure whether to take 175k DE offer,Dense_Car_591,dataengineering,"On my throwaway account.I’m currently at a well known F50 company as a mid level DE with 3 yoe. base: $115k usdbonus: 7-8%stack: python, sql, terraform, aws (redshift, glue, athena, etc)I love my team, great manager, incredible wlb and i generally enjoy the work. but we do move very slowly, lot of red tape and projects constantly delayed by months. And I do want to learn data engineering frameworks beyond just Glue jobs moving and transforming data w pyspark transformations.I just got an offer at a consumer facing tech company for 175k TC. but as i was interviewing with the company, i talked to engineers who worked there on Blind who confirmed the glassdoor reviews citing bad wlb and toxic culture. Am i insane for not taking/hesitating a 50k pay bump because of bad culture and wlb? Have to decide by Monday and since i have a final round with another tech company next friday, it’s either do or die with this offer.",61,0.76,71,https://www.reddit.com/r/dataengineering/comments/1orc11c/unsure_whether_to_take_175k_de_offer/,2025-11-08 01:07:00,2025-11-10 01:44:56
1or815u,Trying to think of a git commit message at 4:45 pm on Friday.,nature_and_grace,dataengineering,No content,60,0.94,7,https://i.redd.it/hs5zde66twzf1.jpeg,2025-11-07 22:15:33,2025-11-10 01:44:56
1op2hle,pg_lake is out!,Wastelander_777,dataengineering,"pg\_lake has just been made open sourced and I think this will make a lot of things easier.Take a look at their Github: [https://github.com/Snowflake-Labs/pg\_lake](https://github.com/Snowflake-Labs/pg_lake)What do you think? I was using pg\_parquet for archive queries from our Data Lake and I think pg\_lake will allow us to use Iceberg and be much more flexible with our ETL. Also, being backed by the Snowflake team is a huge plus. What are your thoughts?",55,0.93,26,https://www.reddit.com/r/dataengineering/comments/1op2hle/pg_lake_is_out/,2025-11-05 13:13:09,2025-11-10 01:44:56
1onxcfo,Data Modeling: What is the most important concept in data modeling to you?,AMDataLake,dataengineering,What concept you think matters most and why?,49,0.9,46,https://www.reddit.com/r/dataengineering/comments/1onxcfo/data_modeling_what_is_the_most_important_concept/,2025-11-04 03:46:06,2025-11-10 01:44:56
1orwym9,Polars has been crushing it for me … but is it time to go full Data Warehouse?,Particular-Goat-7579,dataengineering,"Hello Polars lads,Long story short , I hopped on the Polars train about 3 years ago. At some point, my company needed a data pipeline, so I built one with Polars. It’s been running great ever since… but now I’m starting to wonder what’s next — because I need more power. :high_voltage:We use GCP, and process hourly over 2M data points arriving in streaming to pub/sub, then saved to cloud storage. Here goes the pipeline, with a proper batching i'm able to use 4GB memory cloud run jobs to read parquet, process and export parquet. Until now everything is smooth, but at the final step this data is used by our dashboard, because polars + parquet files are super fast this used to work properly but recently some of our biggest clients started having some latency and here comes the big debate:I'm currently querying parquet files with polars and responding to the dashboard\- Should i give more power to polars ? mode cpu, larger machine ...\- Or it's time to add a Data Warehouse layer ...There is one extra challenging point: the data is sort of semi structured. each rows is a session with 2 attributes and list of dynamic attributes, thanks to parquet files and pl.Struct the format is optimized in buckets: <s_1, Web, 12, [country=US, duration=12] <s_2, Mobile,13, [isNew=True,...]Most of the queries will be group\_by that would filter on the dynamic list (and you got it not all the sessions have the same attributes) The first intuitive solution was BiGquery, but it will not be efficient when querying with filters on a list of struct (or a json dict)So here i'm waiting for you though on this what would you recommend ?Thanks in advance.",44,0.94,13,https://www.reddit.com/r/dataengineering/comments/1orwym9/polars_has_been_crushing_it_for_me_but_is_it_time/,2025-11-08 18:39:20,2025-11-10 01:44:56
1op0rqb,Best Conferences for Data Engineering,AMDataLake,dataengineering,"What are your favorite conferences each year to catch up on Data Engineering topics, what in particular do you like about the conference, do you attend consistently?",42,0.96,18,https://www.reddit.com/r/dataengineering/comments/1op0rqb/best_conferences_for_data_engineering/,2025-11-05 11:51:44,2025-11-10 01:44:56
1onjmd6,What Developers Need to Know About Apache Spark 4.0,Lenkz,dataengineering,Apache Spark 4.0 was officially released in May 2025 and is already available in Databricks Runtime 17.3 LTS.,43,0.9,18,https://medium.com/@cralle/what-developers-need-to-know-about-apache-spark-4-0-508d0e4a5370?sk=2a635c3e28a7aa90c655d0a2da421725,2025-11-03 18:24:37,2025-11-10 01:44:56
1oroc7q,What failures made you the engineer you're today?,georchry_,dataengineering,"It’s easy to celebrate successes, but failures are where we really learn. What's a story that shaped you into a better engineer?",39,1.0,48,https://www.reddit.com/r/dataengineering/comments/1oroc7q/what_failures_made_you_the_engineer_youre_today/,2025-11-08 12:36:14,2025-11-10 01:44:56
1oqbtwj,How true is “90% of data projects fail?”,jedsk,dataengineering,"Ex digital marketing data engineer here, and I’ve definitely witnessed this first hand. Wondering what other’ stories are like.",35,0.82,41,https://www.reddit.com/r/dataengineering/comments/1oqbtwj/how_true_is_90_of_data_projects_fail/,2025-11-06 21:39:49,2025-11-10 01:44:56
1on1ben,Fabric Data Days -- With Free Exam Vouchers for Microsoft Fabric Data Engineering Exam,FabricPam,dataengineering,"Hi! Pam from the Microsoft Team. Quick note to let you all know that **Fabric Data Days starts November 4th.**We've got live sessions on data engineering, exam vouchers and more.We'll have sessions on cert prep, study groups, skills challenges and so much more!We'll be offering 100% vouchers for exams DP-600 (Fabric Analytics Engineer) and DP-700 (Fabric Data Engineer) for people who are ready to take and pass the exam before December 31st!You can register to get updates when everything starts --> [https://aka.ms/fabricdatadays](https://aka.ms/fabricdatadays)You can also check out the live schedule of sessions here --> [https://aka.ms/fabricdatadays/schedule](https://aka.ms/fabricdatadays/schedule)You can request exam vouchers starting on Nov 4 at 9am Pacific.",34,0.88,20,https://www.reddit.com/r/dataengineering/comments/1on1ben/fabric_data_days_with_free_exam_vouchers_for/,2025-11-03 03:24:44,2025-11-10 01:44:56
1orhrbh,"My goal is to become a Data Engineer, and I’m planning to make the switch within the next two years.",DrawingDesigner4856,dataengineering,"Currently, my job primarily involves SQL and Shell scripting. As we all know, it’s challenging to land a Data Engineering role with just two years of experience and limited exposure to tools beyond SQL.So I’m considering a strategic path: **Database Developer → DBA → Data Engineer**The idea is that working as a DBA could expose me to cloud platforms like AWS and tools such as Databricks and Snowflake, which are increasingly relevant in Data Engineering roles. This experience could give me a competitive edge when I eventually transition to a Data Engineer position.Thanks for taking the time to read this. I’d appreciate any feedback or suggestions! Please Suggest me another Roles I need to take Or Can i directly jump to an DE role from Current Job ?",33,0.77,43,https://www.reddit.com/r/dataengineering/comments/1orhrbh/my_goal_is_to_become_a_data_engineer_and_im/,2025-11-08 05:58:35,2025-11-10 01:44:56
1opgre4,Data Governance!,Any_Ad7701,dataengineering,"Has anyone here transitioned from Data Engineering leadership to Data Governance leadership (Director Level)?Has anyone made a similar move at this or senior level? How did it impact your career long term? I have a decent understanding of governance, but I’m trying to gauge whether this is typically seen as a step up, a lateral move, or a step down?",27,0.83,23,https://www.reddit.com/r/dataengineering/comments/1opgre4/data_governance/,2025-11-05 22:03:46,2025-11-10 01:44:56
1oqw08j,How do you make sure your data is actually reliable before it reaches dbt or your warehouse?,Binag94,dataengineering,"Hey everyone :waving_hand:I’m working on a small open-source side project called a lightweight engine that helps data engineers describe, execute, and audit their own reliability rules (before transformation, or modeling).I’ve realized there’s a lot of talk about data observability (Monte Carlo, Soda, GE etc.), but very little about data reliability before transformation — the boring but critical part where most errors are born.I’m trying to understand how people in the field actually deal with this today, so I’d love to hear your experience :backhand_index_pointing_down:Specifically: •How do you check your raw data quality today? •Do you use something like Great Expectations / Soda, or just code your own checks in Python / SQL? •What’s the most annoying or time-consuming part of ensuring data reliability? •Do you think reliability can be standardized or declared (like “Reliability-as-Code”) — or is it always too context-specific?The goal isn’t to pitch anything, just to learn from how you handle reliability and what frustrates you the most. If you’ve got battle stories, hacks, or even rants — I’m all ears.Thanks a lot :folded_hands:",26,0.87,19,https://www.reddit.com/r/dataengineering/comments/1oqw08j/how_do_you_make_sure_your_data_is_actually/,2025-11-07 14:34:30,2025-11-10 01:44:56
1oqoygu,Best domain for data engineer ? Generalist vs domain expertise.,Geralt_of_rivia_002,dataengineering,"I’m early in my career, just starting out as a Data Engineer (primarily working with Snowflake and ETL tools).As I grow into a strong Data Engineer, I believe domain knowledge and expertise will also give me a huge edge and play a crucial role in future job search.So, what are the domains that really pay well and are highly valued if I gain 5+ years of experience in a particular domain?Some domains I’m considering are:Fintech / Banking / AI & ML / Healthcare / E-commerce / Tech / IoT / Insurance / Energy / SaaS / ERPPlease share your insights on these different domains — including experience, pay scale, tech stack, pros, and cons of each.Thank you.",28,0.89,14,https://www.reddit.com/r/dataengineering/comments/1oqoygu/best_domain_for_data_engineer_generalist_vs/,2025-11-07 08:25:07,2025-11-10 01:44:56
1or4akw,Question for data engineers: do you ever worry about what you paste into any AI LLM,teejagzroy,dataengineering,"When you’re stuck on a bug or need help refactoring, it’s easy to just drop a code snippet into ChatGPT, Copilot, or another AI tool.But I’m curious, do you ever think twice before sharing pieces of your company or client code? Do you change variable names or simplify logic first, or just paste it as is and trust it’s fine?I’m wondering how common it is for developers to be cautious about what kind of internal code or text they share with AI tools, especially when it’s proprietary or tied to production systems.Would love to hear how you or your team handle that balance between getting AI help and protecting what shouldn’t leave your repo.",25,0.8,35,https://www.reddit.com/r/dataengineering/comments/1or4akw/question_for_data_engineers_do_you_ever_worry/,2025-11-07 19:48:36,2025-11-10 01:44:56
1onl9as,I became a Data Engineering Manager and I'm not a data engineer: help?,SpiritedAd400,dataengineering,"Some personal background: I have worked with data for 9 years, had a nice position as an Analytics Engineer and got pressured into taking a job I knew was destined to fail. The previous Data Engineering Manager became a specialist and left the company. It's a bad position, infrastructure has always been an afterthought for everybody here and upper management has the absolute conviction that I don't need to be technical to manage the team. It's been +/- 5 months and, obviously, I am convinced that's just BS. The market in my country is hard right now, so looking for something in my field might be a little difficult. I decided to accept this as a challenge and try to be optimistic. So I'm looking for advice and resources I can consult and maybe even become a full on Data Engineer myself. This company is a Google Partner, so we mostly use GCP. Most used services include BigQuery, Cloud Run, Cloud Build, Cloud Composer, DataForm and Lookerstudio for dashboards.I'm already looking into the Skills Boost data engineer path, but I'm thinking it's all over the place and so generalist.Any help?",28,0.8,15,https://www.reddit.com/r/dataengineering/comments/1onl9as/i_became_a_data_engineering_manager_and_im_not_a/,2025-11-03 19:24:14,2025-11-10 01:44:56
