id,title,author,subreddit,content,score,upvote_ratio,num_comments,url,created_utc,extracted_at
1opfr0a,Is this job for real?,Comfortable-Tie9199,dataengineering,"I was applying for jobs as usual and this junior data engineer position is triggering me? They mentioned entire full stack's tech requirements along with data engineering role requirements. That too for 4-5 years of experience and still call it Junior role -\_- **Jr. Data Engineer** Description**Title: Jr. Data Engineer – Business Automation & Data Transformation** **Location: Remote**  **Ekman Associates, Inc. is a Southern California based company focused on the following services: Management Consulting, Professional Staffing Solutions, Executive Recruiting and Managed Services.**  **Summary:**  As the Automation & Jr. Data Engineer, you will play a critical role in enhancing data infrastructure and driving automation initiatives. This role will be responsible for building and maintaining API connectors, managing data platforms, and developing automation solutions that streamline processes and improve efficiency. This role requires a hands-on engineer with a strong technical background and the ability to work independently while collaborating with cross-functional teams.**Key Skill Set:**  * **Ability to build and maintain API connectors - Mandatory*** Experience in cloud platforms like AWS, Azure, or Google Cloud. * Familiarity with data visualization tools like Tableau or Power BI. * Experience with CI/CD pipelines and DevOps practices. * Knowledge of data security and privacy best practices, particularly in a media or entertainment context.Requirements* Bachelor's degree in Computer Science, Information Technology, Engineering, or a related field, or equivalent experience. * 4 - 5 years of experience in data engineering, software development, or related roles, with a focus on API development, data platforms, and automation. * Proficiency in programming languages such as Python, Java, or similar, and experience with API frameworks and tools (e.g., REST, GraphQL). * Strong understanding of data platforms, databases (SQL, NoSQL), and data warehousing solutions. * Experience in cloud platforms like AWS, Azure, or Google Cloud. * Familiarity with data visualization tools like Tableau or Power BI. * Experience with CI/CD pipelines and DevOps practices. * Knowledge of data security and privacy best practices, particularly in a media or entertainment context. * Experience with automation tools and frameworks, such as Ansible, Jenkins, or similar. * Excellent problem-solving skills and the ability to troubleshoot complex technical issues. * Strong communication and collaboration skills, with the ability to work effectively with cross-functional teams. *  Ability to work in a fast-paced environment and manage multiple projects simultaneously. * Results-oriented, high energy, self-motivated.",4,0.64,6,https://www.reddit.com/r/dataengineering/comments/1opfr0a/is_this_job_for_real/,2025-11-05 21:25:14,2025-11-10 01:44:56
1ooxica,CDC and schema changes,Emanolac,dataengineering,"How do you handle schema changes on a cdc tracked table? I tested some scenarios with CDC enabled and I’m a bit confused what is going to work or not. To give you an overview, I want to enable CDC on my tables and consume all the data from a third party(Microsoft Fabric). Because of that, I don’t want to lose any data tracked by the _CT tables and I discovered that changing the schema structure of the tables, may potentially end up with some data loss if no proper solution is found. I’ll give you an example to follow.I have the User table with Id, Name,Age, RowVersion. The CDC is enabled at db and at this table level, and I set it to track every row of this table. Now some changes may appear in this operational table1. I add a new column, let’s say Salary as DECIMAL. I want to track this column as well. But I don’t want to disable and enable again the CDC for this table, because I will lose the data in the old capture instance2. After a while, I want to ALTER the column Salary from DECIMAL to INT (this is just for the sake of the example). Here, what I observed, is that after the ALTER state is run, the Salary column in CT table is automatically changed to INT which is weird that may lead to potentially some data loss from the previous data3. I will Delete the Salary column. The statement will not break but I need to update somehow the tracking for this table without the column. 4. I will rename the Name column to FirstName. The rename statement will break because it will see that the column is linked to CDC5. I will rename the table from User to Users. This statement is not failing but I still need to update the cdc tracking to not let misleading naming conventions that may be confusing Did you encounter similar issues in your development? How did you tackle it?Also, if you have any advices that you want to share related to your experience with CDC, it will be more than welcomed. Thanks, and sorry for the long postNote: I use Sql Server",2,0.67,1,https://www.reddit.com/r/dataengineering/comments/1ooxica/cdc_and_schema_changes/,2025-11-05 08:30:15,2025-11-10 01:44:56
1oot74h,How to efficiently seed large dataset (~13M rows) into SQL Server on low-spec VM?,userbowo,dataengineering,"Hi everyoneI’m currently building a Data Engineering end-to-end portfolio project using the Microsoft ecosystem, and I started from scratch by creating a simple CRUD app.The dataset I’m using is from Kaggle, around 13 million rows (\~1.5 GB).My CRUD app with SQL Server (OLTP) works fine, and API tests are successful, but I’m stuck on the data seeding process.Because this is a personal project, I’m running everything on a low-spec VirtualBox VM, and the data loading process is extremely slow.Do you have any tips or best practices to load or seed large datasets into SQL Server efficiently, especially with limited resources (RAM/CPU)?Thanks a lot in advance",2,0.67,10,https://www.reddit.com/r/dataengineering/comments/1oot74h/how_to_efficiently_seed_large_dataset_13m_rows/,2025-11-05 04:13:24,2025-11-10 01:44:56
1ool0ha,Can (or should) I handle snowflake schema mgmt outside dbt?,BeardedYeti_,dataengineering,"Hey all,Looking for some advice from teams that combine dbt with other schema management tools.I am new to dbt and I exploring using it with Snowflake. We have a pretty robust architecture in place, but looking to possibly simplify things a bit especially for new engineers.We are currently using SnowDDL + some custom tools to handle or Snowflake Schema Change Management. This gives us a hybrid approach of imperative and declarative migrations. This works really well for our team, and give us very fined grain control over our database objects.I’m trying to figure out the right separation of responsibilities between dbt and an external DDL tool:- Is it recommended or safe to let something like SnowDDL/Atlas manage Snowflake objects, and only use dbt as the transformation tool to update and insert records?- How do you prevent dbt from dropping or replacing tables it didn’t create (so you don’t lose grants, sequences, metadata, etc…)?Would love to hear how other teams draw the line between:- DDL / schema versioning (SnowDDL, Atlas, Terraform, etc.)- Transformation logic / data lineage (dbt)",2,1.0,1,https://www.reddit.com/r/dataengineering/comments/1ool0ha/can_or_should_i_handle_snowflake_schema_mgmt/,2025-11-04 22:11:54,2025-11-10 01:44:56
1ookgz2,Stuck integrating Hive Metastore for PySpark + Trino + MinIO setup,poogast,dataengineering,"Hi everyone,I'm building a real-time data pipeline using Docker Compose and I've hit a wall with the Hive Metastore. I'm hoping someone can point me in the right direction or suggest a better architecture.My Goal:I want a containerized setup where:1. A PySpark container processes data (in real-time/streaming) and writes it as a table to a Delta Lake format.2. The data is stored in a MinIO bucket (S3-compatible).3. Trino can read these Delta tables from MinIO.4. Grafana connects to Trino to visualize the data.My Current Architecture & Problem:I have the following containers working mostly independently:· pyspark-app: Writes Delta tables successfully to s3a://my-bucket/ (pointing to MinIO).· minio: Storage is working. I can see the _delta_log and data files from Spark.· trino: Running and can connect to MinIO.· grafana: Connected to Trino.The missing link is schema discovery. For Trino to understand the schema of the Delta tables created by Spark, I know it needs a metastore. My approach was to add a hive-metastore container (with a PostgreSQL backend for the metastore DB).This is the step that's failing. I'm having a hard time configuring the Hive Metastore to correctly talk to both the Spark-generated Delta tables on MinIO and then making Trino use that same metastore. The configurations are becoming a tangled mess.What I've Tried/Researched:· Used jupyter/pyspark-notebook as a base for Spark.· Set Spark configs like spark.hadoop.fs.s3a.path.style.access=true, spark.sql.catalog.spark_catalog=org.apache.spark.sql.delta.catalog.DeltaCatalog, and the necessary S3A settings for MinIO.· For Trino, I've looked at the hive and delta-lake connectors.· My Hive Metastore setup involves setting S3A endpoints and access keys in hive-site.xml, but I suspect the issue is with the service discovery and the thrift URI.My Specific Question:Is the ""Hive Metastore in a container"" approach the best and most modern way to solve this? It feels brittle.1. Is there a better, more container-native alternative to the Hive Metastore for this use case? I've heard of things like AWS Glue Data Catalog, but I'm on-prem with MinIO.2. If Hive Metastore is the right way, what's the critical configuration I'm likely missing to glue it all together? Specifically, how do I ensure Spark registers tables there and Trino reads from it?3. Should I be using the Trino Delta Lake connector instead of the Hive connector? Does it still require a metastore?Any advice, a working docker-compose.yml snippet, or a pointer to a reference architecture would be immensely helpful!Thanks in advance.",2,1.0,1,https://www.reddit.com/r/dataengineering/comments/1ookgz2/stuck_integrating_hive_metastore_for_pyspark/,2025-11-04 21:51:09,2025-11-10 01:44:56
1oog2fr,How do you schedule your test cases ?,boogie_woogie_100,dataengineering,I have bunch of test cases that I need to schedule. Where do you usually schedule test cases and alerting if test fails? Github action? Directly only pipeline?,2,0.67,5,https://www.reddit.com/r/dataengineering/comments/1oog2fr/how_do_you_schedule_your_test_cases/,2025-11-04 19:03:40,2025-11-10 01:44:56
1omzr8s,Data Engineering with AWS: Cookbook. Any reviews for those who have read it.,Big-Recording4456,dataengineering,https://preview.redd.it/in7ecf60ayyf1.png?width=1050&format=png&auto=webp&s=4504c5a3f5ef8c3a22f14d4b8005c900047b0a36Would like to anyones thought about this book before I buy it.,2,0.67,1,https://www.reddit.com/r/dataengineering/comments/1omzr8s/data_engineering_with_aws_cookbook_any_reviews/,2025-11-03 02:08:12,2025-11-10 01:44:56
1orw45f,Former TransUnion VP Reveals How Credit Bureaus Use Data Without Consent,Due_Clerk6655,dataengineering,No content,1,0.67,0,https://youtu.be/Bt4W5QpFZr4,2025-11-08 18:06:09,2025-11-10 01:44:56
1oridmt,GCP or AWS?,Adventurous-Reach470,dataengineering,"Hey guys, probably a dumb question but I could use some advice.I’ve been learning AWS on my own (currently messing around with Athena), but I just found out my company gives us all the GCP certs for free like the Data Engineer Pro, Cloud Engineer, Cloud Developer, etc.Now I’m a bit stuck. Should I switch to GCP and take advantage of the free certs, then maybe come back to AWS later? Or should I just stay focused on AWS since it’s more widely used?Tbh, I enjoy working with GCP more, and I already use it at a basic level in my current job (mainly BigQuery). But from what I’ve seen in job posts, most companies seem to ask for AWS, and I don’t want to go too deep into a cloud that might be considered “niche” and end up limiting my options later.What do you guys think? My gut says GCP = startups, ML and analytics (what I currently do), while AWS = enterprise / general cloud stuff. Curious what others here would do in my shoes",2,0.6,10,https://www.reddit.com/r/dataengineering/comments/1oridmt/gcp_or_aws/,2025-11-08 06:34:03,2025-11-10 01:44:56
1orfjtj,Typical for data analysts/scientists to use dbt to create models,BeardedYeti_,dataengineering,"New to dbt, trying to wrap my head around how other orgs are using it. Wondering if its typical for data analysts and data scientists to create models using dbt? If so, where would these models be created? At the data mart layer? Are these usually just views or do they actually create tables and incremental tables?",1,0.6,2,https://www.reddit.com/r/dataengineering/comments/1orfjtj/typical_for_data_analystsscientists_to_use_dbt_to/,2025-11-08 03:59:01,2025-11-10 01:44:56
1or3sxw,The collapse of Data and AI Infrastructure into one,Traditional_Rip_5915,dataengineering,"Lately, I feel data infrastructure is changing to serve AI use cases. There's a sort of merger between the traditional data stack and the new AI stack. I see this most in two places: 1) the semantic layer and 2) the control plane.On the first point, if AI writes SQL and its answers aren't correct for whatever reason - different names for data elements across the data stack, different definitions for the same metric - this is where a semantic model comes in. It's basically giving the LLM the context to create the right results. On the second point, it seems data infrastructure and AI infrastructure are collapsing into one control plane. For example, analytics are now agent-facing, not just customer-facing. This changes the requirements for data processing. Quality and lineage checks need to be available to agents. Systems need to meet latency requirements that are designed around agents doing analytic work and retrieving data effectively. How are y'all seeing this show up? What steps are y'all taking when implementing these semantic data models? Which metrics, context, and ontology are you providing to the LLMs to make sure results are good?",2,0.58,2,https://www.reddit.com/r/dataengineering/comments/1or3sxw/the_collapse_of_data_and_ai_infrastructure_into/,2025-11-07 19:29:30,2025-11-10 01:44:56
1oqutfg,Built pandas-smartcols: painless pandas column manipulation helper,RedHulk05,dataengineering,"Hey folks,I’ve been working on a small helper library called **pandas-smartcols** to make pandas column handling less awkward. The idea actually came after watching my brother reorder a DataFrame with more than a thousand columns and realizing the only solution he could find was to write a script to generate the new column list and paste it back in. That felt like something pandas should make easier.The library helps with swapping columns, moving multiple columns before or after others, pushing blocks to the front or end, sorting columns by variance, standard deviation or correlation, and grouping them by dtype or NaN ratio. All helpers are typed, validate column names and work with `inplace=True` or `df.pipe(...)`.Repo: [https://github.com/Dinis-Esteves/pandas-smartcols](https://github.com/Dinis-Esteves/pandas-smartcols)I’d love to know:• Does this overlap with utilities you already use or does it fill a gap? • Are the APIs intuitive (`move_after(df, [""A"",""B""], ""C"")`, `sort_columns(df, by=""variance"")`)? • Are there features, tests or docs you’d expect before using it? Appreciate any feedback, bug reports or even “this is useless.” Thanks!",1,0.67,2,https://www.reddit.com/r/dataengineering/comments/1oqutfg/built_pandassmartcols_painless_pandas_column/,2025-11-07 13:46:03,2025-11-10 01:44:56
1oq4lmn,Change Data Capture,kickenet,dataengineering,Looking to get feedback on my tech blog for cdc replication and streaming data.,0,0.5,1,https://medium.com/@ChillData/modernizing-data-architectures-with-change-data-capture-702bd38e5d88,2025-11-06 17:08:15,2025-11-10 01:44:56
1opt7vx,"Building ""Data as a Product"" platforms - tools, deployment patterns, and market demand?",JimiZeppelin1012,dataengineering,"I'm working on architecture for multi-tenant data platforms (think: deploying similar data infrastructure for multiple clients/business units) and wanted to get the community's technical insights:Has anyone worked on ""Data as a Product"" initiatives where you're packaging/delivering data or analytics capabilities to external consumers (customers, partners, etc.)?Looking for technical insights on:1. Tooling & IaC: Have you built custom platforms or use existing tools? Any experience using IaC to deploy white-labeled versions for different consumers?2. Cloud-agnostic options: Tools like Databricks but more portable across clouds for delivering data products? (Using AWS Cleanrooms, etc.)3. Are you seeing more requests for this type of work? Feeling like data-as-a-product engineering is growing?4. Does the tooling/ecosystem feel mature or still emerging? Do you think there is a possible emerging market for data monetisation tools?",1,0.57,5,https://www.reddit.com/r/dataengineering/comments/1opt7vx/building_data_as_a_product_platforms_tools/,2025-11-06 08:07:49,2025-11-10 01:44:56
1opmk25,"Platform, Systems, Real-Time work",lil_faucet,dataengineering,"How many of you work on Platform, Systems, or Real-Time data work? Would you mind telling me a bit more about what you do? I'm currently an analytics engineer but want to move more towards the technical side of DE and looking for motivation!",1,0.6,0,https://www.reddit.com/r/dataengineering/comments/1opmk25/platform_systems_realtime_work/,2025-11-06 02:09:20,2025-11-10 01:44:56
1oosu69,Transformation layer from Qlik to Snowflake,No_Candle_2534,dataengineering,"Hi everyone,I'm trying to modernize the stack in my company. I want to move the data transformation layer from qlik to snowflake. Have to convince my boss. If anyone had this battle before, please advice.For context, my team is me (frustrated DE), team manager (really supportive but with no technical background), 2 internal analyst focusing on gathering technical requirements and 2 external bi developer focusing on qlik.I use Snowflake + dbt but the models built in here are just a handful, because I was not allowed to connect to the ERP system (I am internal by the way) but only to other sources. It looks like soon I will have access to ERP data though.Currently the external consultants connects with Qlik directly to our ERP system, downloads a bunch of data from there + snowflake + a few random excels and create a massive transformation layer in Qlik.There is no version control, and the internal analysts do not even know how to use qlik - so they just ask the consultants to develop dashboards and have no idea of the data modelling built. Development is slow, dashboards look imho basic and as a DE I want to have at least proper development and governance standards for the data modelling.My idea: Step 1 - have ERP data in snowflake. Build facts and dim in there.Step 2 - let the analysts use SQL and learn DBT to have the ""reporting"" models in snowflake as well. Upskill the analyst so they can use github to communicate bugs, enhancements etc. Use qlik for visualization onlyMy manager is sold on step 1, not yet 2. The external consultants are saying that qlik workd best with facts and dims, instead of one normalized table. So that they can handle the downloads faster and do transformations in qlik.My points to go for step 2:- qlik has no version control (yet - noy sure if it is an optiom)- internally no visibility on the code, it is just a black box the consultants manage. Move would mean better knowledge sharing and data governance- the aim is not to create huge tables/views for the dashboards but rather optimal models with just the fields needed- possibility of internal upskill (analysts using sql/dbt + git)- better visbility on costs, both on the computation layer as well as storage costs decreased Anything else I can say to convince my manager to make this move?",1,0.6,6,https://www.reddit.com/r/dataengineering/comments/1oosu69/transformation_layer_from_qlik_to_snowflake/,2025-11-05 03:55:28,2025-11-10 01:44:56
1ooo2ub,Databricks migration cross cloud,shesHereyeah,dataengineering,"Hi,Currently working on migrating managed tables in Azure Databricks, to a new workspace in GCP. I read a blog suggesting using storage transfer service, while I know the storage paths of these managed tables in Azure, I don't think copying the delta files will allow recreating them, I tested in my workspace doing that and you can't create an external table on top of a managed table location, even when I copied the table folder. Don't know why though, I'd love to understand (especially when I duplicated that folder). PS, both workspaces are under unity catalog. Ps2: I'm not Databricks expert, so any help is welcome. We need to migrate years of historical data, and also might need to remigrate when new data is added. So incremental unloading is needed as well... I don't know if delta sharing is an option or would be too expensive, since we need just to copy all that history, I read there's cloning too but don't know if that's cross metastore/cloud possible...too much info, if someone migrated or you have ideas, thank you!",1,0.6,0,https://www.reddit.com/r/dataengineering/comments/1ooo2ub/databricks_migration_cross_cloud/,2025-11-05 00:15:52,2025-11-10 01:44:56
1ooih6o,railroad ops project help/critique,mfoley8518,dataengineering,"To start, I’m not a data engineer. I work in operations for the railroad in our control center, and I have IT leanings. But I recently noticed that one of our standard processes for monitoring crew assignments during shifts is wildly inefficient, and I want to build a proof of concept dashboard so that management can OK the project to our IT dept. Right now, when a train is delayed, dispatchers have to manually piece together information from multiple systems to judge if a crew will still make their next run. They look at real-time train delay data in one feed, crew assignments somewhere else, and scheduled arrival and departure times in a third place, cross-referencing train numbers and crew IDs by hand. Then they compile it all into a list and relay that list to our crew assignment office by phone. It’s wildly inefficient and time consuming, and it’s baffling to me that no one has ever linked them before, given how straightforward the logic should be.I guess my question is- is this as simple as I’m assuming it should be? I worked up a dashboard prototype using Chat GPT that I’d love to get some feedback on, if I get any interest on this post. I’d love to hear thoughts from people who work in this field! Thanks everyone",1,0.67,3,https://www.reddit.com/r/dataengineering/comments/1ooih6o/railroad_ops_project_helpcritique/,2025-11-04 20:33:21,2025-11-10 01:44:56
1ooiekb,Data Vault - Subset from Prod to Pre Prod,Salt_Anteater3307,dataengineering,"Hey folks,I am working at a large insurance company where we are building a new data platform (dwh) in Azure, and I have been asked to figure out a way to move a subset of production data (around 10%) into pre prod, while making sure referential integrity is preserved across our new Data Vault model. There is dev and test with synthetic data (for development) but pre prod has to have a subset of prod data. So 4 different env.Here’s the rough idea I have been working on, and I would really appreciate feedback, challenges, or even “don’t do it” warnings.The process would start with an input manifest – basically just a list of thousand of business UUIDs (like contract_uuid = 1234, etc.) that serve as entry points. From there, the idea is to treat the Vault like a graph and traverse it:I would use metadatacatalog (link tables, key columns, etc.) to figure out which link tables to scan, and each time I find a new key (e.g. a customer_uuid in a link table), that key gets added to the traversal. The engine keeps running as long as new keys are discovered. Every Iteration would start from the first entry point again (e.g contact_uuid) but with new keys discovered from the previous iteration added. Duplicates key in the iterations will be ignored.I would build this in PySpark to keep it scalable and flexible. The goal is not to pull raw tables, but rather end up with a list of UUIDs per Hub or Sat that I can use to extract just the data I need from prod into pre prod via a „data exchange layer“. If someone later triggers an new extract for a different business domain, we would only grab new keys no redundant data, no duplicates.I tried to challenge this approach internally but i felt like it did not lead to a discussion or even „what could go wrong“ scenario.In theory, this all makes sense. But I am aware that theory and practice do notalways match , especially when there are thousand of keys, hundreds of tables, and performance becomes an issue.So here what I am wondering:Has anyone built something similar?Does this approach scale?Are there proven practice for this that I might be missing?So yeah…am i on the right path or run away from this?",1,0.6,3,https://www.reddit.com/r/dataengineering/comments/1ooiekb/data_vault_subset_from_prod_to_pre_prod/,2025-11-04 20:30:27,2025-11-10 01:44:56
