id,title,author,subreddit,content,score,upvote_ratio,num_comments,url,created_utc,extracted_at
1og0ueg,"Which backend lang should I choose - Java, Go, JS, Python, Kotlin...?",Timely_Worth6916,learnprogramming,"I'm learning Native android development with all the modern tech stacks from the past few months and I have developed few apps that deals with some APIs and some do control native features like camera and flashlight features.Now, I want to get into the backend side so that, I can develop a full stack app and probably offer my services as a freelancer.But, there are so many confusion with which language to pick :confused_face: - Java, Go, JS, Python, Ruby, Kotlin etc.Which one should I go with? If this is what I want:- nice job/ freelance opportunities. (must)- can be used if I switch from Android to cross platform/iOS or Web. (nice to have)- beginner friendly. (preferred)- short learning period to use it in real world projects. (optional)Consider the scenario, I want to become a full stack Mobile developer.",7,0.74,11,https://www.reddit.com/r/learnprogramming/comments/1og0ueg/which_backend_lang_should_i_choose_java_go_js/,2025-10-25 19:49:30,2025-10-26 01:42:16
1ofuvkx,Is focusing on web dev a bad idea?,No-Translator-5386,learnprogramming,"If I want to make sure I can get a job after graduating, is it a bad idea to focus on web dev?",8,0.73,24,https://www.reddit.com/r/learnprogramming/comments/1ofuvkx/is_focusing_on_web_dev_a_bad_idea/,2025-10-25 15:48:30,2025-10-26 01:42:16
1oflqd0,Difficulty focusing on one language.,DesperateOriginal827,learnprogramming,"Over the last few years, I’ve been teaching myself programming. I’m currently 32 and I wouldn’t say I’m “good” at any specific language. During these past few years, I’ve always jumped between multiple languages (C++, C#, Python, Java, JavaScript, etc). I have basic knowledge in the languages listed, but I wouldn’t say enough to build something worth while.I do try and stick to one language, but then I’d usually get bored, see a new shiny thing, and jump towards that. Then most of the time, I’ll do a complete 360 and return to the language I initially started with. I’ve been doing this for years and always struggled just to stick to 1 language. And it feels like I’ve shot myself in the foot by not specialising in a single language to become efficient in it. I think the reason why I struggle focusing on a single language, is (in my honest opinion) ADHD. I haven’t been officially diagnosed with it, but a few friends who have it, have said it’s a common thing to hyper focus on something, then jump to something else (they work in tech themselves). And the other reason, is that I do find all languages interesting and want to learn as much as possible (which I know isn’t ideal when starting out).I do believe that my interests change quite a lot too, which is most likely another factor. Whether that’ll be attempting to make a small game, website, desktop app, etc. I’ve found it hard just to pick one language and run with it, ignoring the rest until I’ve built up good knowledge of different algorithms, data structures, design patterns etc.As an example, my current job, they use C#/.NET for the backend services, and now my brain wants to learn C# again. But then I’m telling myself, “what’s the point, as you’d only focus on it for a few weeks/months, then your focus will change when a new shiny thing is discovered, or you get bored.”Has anyone else done the same in the past? If so, how did you combat it? Any advice would be appreciated.",9,0.91,12,https://www.reddit.com/r/learnprogramming/comments/1oflqd0/difficulty_focusing_on_one_language/,2025-10-25 07:48:29,2025-10-26 01:42:16
1oe37hf,recursion with three input and three output,atof45456,learnprogramming,"recently, I have a problem involving number partitioning. Given a number *n*, such as *n*=2020, the goal is to partition it to three smaller numbers, like this:2019+12018+22018+1+12017+32017+1+22016+4...The partitions should continue until the sum of the digits in all partitioned numbers is equal.# Examples 1:* For 2020=2019+1:* sum(2019)=2+0+1+9=12* sum(1)=1# Examples 2:* For 2020=2000+11+9:* sum(2000)=2+0+0+0=2* sum(11)=1+1=2* sum(9)=9I found a relationship between the numbers. We can represent the partitions as \[*n*−*i*,*i*\], and further partition *i* into \[*i*−*j*,*j*\]. However, I had a very bad solution that took a very long time to execute without returning a result. Can anyone help me find a better or more efficient approach? #include int sum_digits(int sum_parts){ int sum_numbers=0; while(sum_parts!=0){ sum_numbers+=sum_parts%10; sum_parts /=10; } return sum_numbers; } int number_partition(const int& number){ int count = 0; for(int i=1; i<=number/2; i++){ for(int j=1; j<=i/2; j++){ int number2 = number - i; int temp = i - j; if(sum_digits(number2) == sum_digits(i) && sum_digits(number2) == sum_digits(temp) && sum_digits(i) == sum_digits(temp)){ count++; } } } return count; } int main() { int n; std::cin >> n; std::cout << number_partition(n); return 0; }",10,0.92,4,https://www.reddit.com/r/learnprogramming/comments/1oe37hf/recursion_with_three_input_and_three_output/,2025-10-23 13:25:35,2025-10-26 01:42:16
1ob2krm,any advices for a freshman computer engineering student?,haveyoumetmarie,learnprogramming,"i started computer enginnering major this year. i dont know coding and stuff and i really wanna improve myself as the best way possible first year. what is your advices for me to improve myself in the best way possible this year? i just started to learn python but i really wanna learn different things maybe platforms,video creators about these, github and stuff.and create some projects in the future.i wanna make money, being student is hard...",9,0.8,33,https://www.reddit.com/r/learnprogramming/comments/1ob2krm/any_advices_for_a_freshman_computer_engineering/,2025-10-19 22:04:16,2025-10-26 01:42:16
1oecjtb,What program is best for coding on tablet,PieAgile8114,learnprogramming,I think of using my android tablet for programming in html and python. Are there any programs that can do this,9,0.91,29,https://www.reddit.com/r/learnprogramming/comments/1oecjtb/what_program_is_best_for_coding_on_tablet/,2025-10-23 19:23:46,2025-10-26 01:42:16
1oc0pfm,Which Languages Should I Learn?,CamMST12,learnprogramming,"I'm a second year Computer Science Student, I haven't fully decided on a path I imagine I would likely try do AI/ML/Data, then fallback on SWE or Cybersecurity if I can't secure anything. Current Plan isC#C++ (Learning currently)JavaScriptPython (Know pretty well)Thoughts?",8,0.83,15,https://www.reddit.com/r/learnprogramming/comments/1oc0pfm/which_languages_should_i_learn/,2025-10-21 02:05:38,2025-10-26 01:42:16
1ofw23m,How to properly learn a framework,Swimming_Solution_82,learnprogramming,How does one properly learn a framework? I just don't get it. Should I memorize the syntax or should I learn the general architechture and relations of components? I'm currently learning it with AI and I feel like I'm a fraud. I mean I understand code but I wouldn't be able to build it from scratch by myself. I don't understand how does a person learns the framework syntax that repeats the same words after the same words separated by dots until it becomes a giant blob of text. Classes referencing classes referencing classes. Objects created from those classes. Oneliners that have 10 different objects referenced in them.Like you surely can't memorize it right? AI claims that everyone is either straight up copypasting stuff like that or is using AI and that I only have to know the architecture. How true is that? How do I learn this? I don't get it.,6,0.88,12,https://www.reddit.com/r/learnprogramming/comments/1ofw23m/how_to_properly_learn_a_framework/,2025-10-25 16:36:39,2025-10-26 01:42:16
1odvpm8,What is your general workflow while building a website?,Arunia_,learnprogramming,"right now mine is very messy, frontend, backend, auth, databases, logic, I try to tackle all at the same time which makes me lose track of what to do first. Like I'm supposed to fix the pause button AND set up an auth system completely from scratch?I don't even know whether or not a workflow is required/recommended or I should just go with the flow and keep tackling different things, but if you guys do have one (eg -> website design using stitch first, then url routes using Django, etc etc), lmk!",7,0.89,16,https://www.reddit.com/r/learnprogramming/comments/1odvpm8/what_is_your_general_workflow_while_building_a/,2025-10-23 06:10:43,2025-10-26 01:42:16
1obvta8,Growing as a Junior Developer,Far-Mode-8300,learnprogramming,"Hello, everyone! I'm in my final year of computer engineering and have been working as a developer for the past 4 months at a small startup. I’m eager to accelerate my growth in my early career by learning valuable skills and technologies, pursuing certifications, and taking online courses. However, I feel a bit lost on what exactly I should focus on to become more attractive to future hiring managers.My CV is relatively simple—I’ve had two internships and am currently in a junior role. I’ve also completed a few free certifications, including GitHub Foundations and OCI AI Foundations. I’ve heard that side projects and contributing to open-source projects can be valuable, but do hiring managers really prioritize these over professional experience? Would it be worth committing to a well-known certification like AWS SAA or DEV?Any advice would be greatly appreciated—thank you!",7,0.9,3,https://www.reddit.com/r/learnprogramming/comments/1obvta8/growing_as_a_junior_developer/,2025-10-20 22:25:15,2025-10-26 01:42:16
1ob2oia,At what point is programming worth it for non-software roles?,Mysterious_Time8042,learnprogramming,"I am an avionics tech and always have some projects that are tangentially related to programming like embedded systems and troubleshooting, but I’m wondering if it would be worth it for my career to go full blown in practicing my software skills, I’m not really sure what that would entail for my career to the point where it would make a difference to a hiring manager. I took intro to Java and algorithms in undergrad, so I know a small amount of the syntax, but is memorizing the syntax what makes you proficient enough to use programming professionally? I’m curious what I should do to further my skills as someone who has no plans on entering the R&D or engineering aspects of my trade as that’s what more intense learning like boot camps are for.",6,0.69,10,https://www.reddit.com/r/learnprogramming/comments/1ob2oia/at_what_point_is_programming_worth_it_for/,2025-10-19 22:08:46,2025-10-26 01:42:16
1ofcuth,Learn Express.js or something else?,Particular-Pass-4021,learnprogramming,"Hi there.. aspiring SWE here.I been doing JavaScript for a while now and I kinda soaked myself into React for quite some time now..I want definitely to enter the world of backend (moreover I want to be BE eng. I just wanted to start from FE.) and easiest way now seem something like Express.jsNow I have my doubts, my friend is saying how amazing of a framework that is, while I'm reading on internet how bad and how outdated it actually is .. and how future of express is uncertain.So yeah I don't know what to do now. Should close my eyes and ears and go all in Express.. or should I try Nest, Hono or maybe even leave node/js and try something like Laravel, Go or .Net...And one more thing is Node viable for good backend development or is it more of a specialty/niche thing.I know that this kind of questions may bother some, but what can I do .. I'm confused Thanks everyone in advance...",7,0.89,17,https://www.reddit.com/r/learnprogramming/comments/1ofcuth/learn_expressjs_or_something_else/,2025-10-24 23:36:55,2025-10-26 01:42:16
1oe7txq,What to post on GitHub?,JVictor4966,learnprogramming,"""I am currently refocusing my efforts on programming, both through my university studies and specialized courses. My question regarding GitHub is: **what is worthwhile to post on GitHub?**Is it beneficial to upload small activities developed during my learning process, such as: Creating a shopping menu website using HTML and CSS; a calculator built with Java; a number reader within an array using C, and so on? This way, I could showcase my continuous improvement.Or is it only valuable to upload more developed projects to GitHub, like a website created for a bakery, for example, which would serve more as a 'Look what I can do for you' type of project, those more focused on real-world application?""",6,0.67,9,https://www.reddit.com/r/learnprogramming/comments/1oe7txq/what_to_post_on_github/,2025-10-23 16:24:58,2025-10-26 01:42:16
1oeyg87,How can you host images for social media cheaply?,IHateHPPrinters,learnprogramming,"I was wondering recently about the start of social media websites and the cost that goes into just running them, and if you get users uploading a ton of photos that can get really expensive so, how do websites make it not so bad?I know there's compression, and conversion to other file types that might be smaller file size wise while preserving quality but, are there any other ways of making it not so pricey?",5,0.86,5,https://www.reddit.com/r/learnprogramming/comments/1oeyg87/how_can_you_host_images_for_social_media_cheaply/,2025-10-24 13:57:20,2025-10-26 01:42:16
1oeuglo,How can I get better in competitive programming?,HoxPox_,learnprogramming,"I know a lot about how to code, but not how to program. The problem is that I don't know what to use when I read a problem statement. During a 4-hour competition, I just sat there doing nothing the whole time. I really need guidance because I'm really interested in this field.",5,0.69,8,https://www.reddit.com/r/learnprogramming/comments/1oeuglo/how_can_i_get_better_in_competitive_programming/,2025-10-24 10:48:04,2025-10-26 01:42:16
1odiq14,"APIs, IDEs, Frameworks etc.",herrbolzen70,learnprogramming,"I am new to coding.I’ve done a few simple personal projects and taken a class about Java Basics (got as far as multidimensional Arrays and manipulating them etc.) I often hear terms such as API, IDE or Framework but I don’t really know what they are. Can somebody please explain them to me? Are there other coding expression I should know about?Thanks in advance!",6,0.81,9,https://www.reddit.com/r/learnprogramming/comments/1odiq14/apis_ides_frameworks_etc/,2025-10-22 19:56:54,2025-10-26 01:42:16
1od8nqu,Learning github development flow,goldprofred,learnprogramming,"I was able to get the AUTH token on my Linux machine and use:% git remote -v% git push -u origin to get the changes on github.I initiated the pull request and it automatically lints and does other checks some of which have failed.Rinse, lather, repeat...A family member with more GitHub knowledge was able to cobble up the commands I needed... I feel I know a fair amount of programming. I have a Linux machine at home and lots of time so I started adding a feature to one of my favorite open source projects. I think I have it in a good enough state to share but I am completely flabbergasted with github and what the flow is.I am generally a CLI and emacs guy, I have installed git and gh on my machine but really do not understand the flow at all.I have a fork of the project ""myname/neatprog"", I have committed my changes locally but I have no idea with how to sync my local changes with github.Is there a GUI I should be using on my Linux box to help with this? I just want to ""package it up"" so I can issue a PR so others can look at my changes...Thanks",5,0.74,12,https://www.reddit.com/r/learnprogramming/comments/1od8nqu/learning_github_development_flow/,2025-10-22 13:43:28,2025-10-26 01:42:16
1od7whe,Final year project,FrustrationAlsoSad,learnprogramming,"I just entered my third year of cs and have been thinking about my graduation project. I enjoyed my logic design and com org courses the most so I wanted to do something useful with them.I landed on a logic design simulator that is made specifically for my uni. It will have sequential circuits , combinational, k-map solver….etc with a lecture like system and maybe an ai element in there. The issue is I am kinda lost on how to go about doing it. I am thinking about using c# with wfp or windowsForm. But not sure if its the right move or if i should just make it on a web page. IS IT EVEN A GOOD GRADUATION PROJECT IDEA? I know it has been done before but I cannot think of anything that has not been done before. TLDR; i want to make a logic design simulator, and want to know where should I start with something like this? Is it even worth doing?",7,0.9,4,https://www.reddit.com/r/learnprogramming/comments/1od7whe/final_year_project/,2025-10-22 13:12:34,2025-10-26 01:42:16
1od0bl4,How to write Documentation,upgradeyalife,learnprogramming,"Hello, I am wondering how to document my work. Honestly, I've just started, and I didn't document during the html or css portion, but now I want to start that habit.The issue is that I have no idea how to document it. I don't know what to write as I feel like when you see the code, it tells you what it does. I want to add README, but again, I don't really get it. I hand comments, but they're for me to remember what each section was and did. Are there any specific examples for beginners, intermediate, advanced documentation, and ReadMe?I'd really appreciate the advice (Edit: punctuation and removal of unimportant info such as age and gender:saluting_face:)",4,0.7,33,https://www.reddit.com/r/learnprogramming/comments/1od0bl4/how_to_write_documentation/,2025-10-22 05:59:43,2025-10-26 01:42:16
1obew3t,How do I implement my software portfolio?,ADG_98,learnprogramming,"I have no prior work experience, therefore I am planning to build a portfolio. How do I actually go about creating a portfolio. Do I add all my projects on GitHub? Do I have them saved on my computer locally? How do I mention them on my CV, adding a link or just descriptions? Any advice on the best way and most suitable for recruiters will appreciated.",6,0.8,7,https://www.reddit.com/r/learnprogramming/comments/1obew3t/how_do_i_implement_my_software_portfolio/,2025-10-20 08:46:15,2025-10-26 01:42:16
1oaqxif,Is it common to work on a project and find very similar apps? Should I deploy?,Dplayerx,learnprogramming,"I worked on an app for ~6 months as a side project, I double checked a lot at first to make sure I don’t find duplicate and so I moved on making it. Last week I got upset because my friend showed me an app very similar to what I’m making and it made sad. I wonder if it’s even worth it to deploy the app since it already exists. Kind of bummed by the whole thing",4,0.67,12,https://www.reddit.com/r/learnprogramming/comments/1oaqxif/is_it_common_to_work_on_a_project_and_find_very/,2025-10-19 14:24:12,2025-10-26 01:42:16
1oaj57v,C++ or RUST,ceazer67,learnprogramming,"Hello guys i'm a CS student , i currently working on devoloping my tech stack, i want to be able to create and develop AI systems , AI applications and intract with hardware using AI, I already started with python , learned ML, deep learning with pytorch, pyside6 for GUI.but i want to expand and optimize my code knowledge more to control hardware so i need to learn a low level language, from my research i found two candidates RUST and C++ i'm already familiar with C++, because we took it in uni as a foundation or as an intro to programming , but from what i heard RUST is far more user friendly than C++ especially those who came from high-level languages like python , but C++ is more mature and very lib rich , so i'm very confused to what to choose, what you all think i should take as a second language",6,0.64,30,https://www.reddit.com/r/learnprogramming/comments/1oaj57v/c_or_rust/,2025-10-19 07:06:49,2025-10-26 01:42:16
1oafpmy,What to do after CS50x and CS50P,Motor_Sky7106,learnprogramming,"I'm a practicing mechanical engineer and I've taken CS50x and CS50P and I'm wondering what I should do after those courses. I would like to do something that can help my career as a mechanical engineer but also give me an opportunity to pivot into tech if I was ever out of a job. My thoughts are something c++ related since Open Foam (CFD software) uses c++ from what I understand. I have no professional experience with it. I'm not sure I am interested in web development since I feel like it's far off from mechanical engineering but maybe I'm wrong?I've also thought maybe some more Python courses on data science but I'm not sure which courses to take, if any. Are there any other areas in computer science that might overlap with mechanical engineering?",7,1.0,2,https://www.reddit.com/r/learnprogramming/comments/1oafpmy/what_to_do_after_cs50x_and_cs50p/,2025-10-19 03:43:26,2025-10-26 01:42:16
1ofmi5n,Learning to code in university,Signal-Building735,learnprogramming,"Lately, I’ve been realizing something about my journey in university — especially now that I’m in my second year. I’m not struggling with the subjects themselves. I’m struggling with caring about them the way the system expects me to.Every time exams approach, I don’t feel scared, anxious, or even motivated. I just feel… detached. Because my goal isn’t to chase marks — it’s to understand, to learn, to build. What excites me isn’t memorizing for a grade, it’s learning cutting, learning something that actually connects with my future.But the problem is that sometimes, the environment around you drains you before you even start. You see people studying hard to get top marks, while you’re there trying your best to understand — but there’s nothing to truly understand. You try to find meaning in what you study, but most teachers themselves aren’t motivated, and it kills your spark a little every day.Living in Algeria doesn’t make it easier — the system feels heavy, exhausting, and uninspiring. You go to university, follow the hours, come back home drained, and even on your “rest days,” you don’t really rest. You just survive.And sometimes I ask myself: do students in other countries feel the same? Are they also fighting to keep their curiosity alive in a system that wants to turn everyone into the same mold?I’m not saying I hate studying. I actually love learning. I just wish learning wasn’t reduced to chasing numbers on a piece of paper.So yeah, I’m excited to cut — to start my own path, to learn differently, to build something that feels alive. Because if the system can’t teach me what I was born to do, then I’ll teach myself.",4,0.84,6,https://www.reddit.com/r/learnprogramming/comments/1ofmi5n/learning_to_code_in_university/,2025-10-25 08:39:19,2025-10-26 01:42:16
1oe8y4b,"I have a confussing path now, what is the best option??",ShogunSkull12,learnprogramming,"Im a Compsci student in Mexico and i want to know which path suits me for the best. I don't have a ""wealthy"" family, but some of the members either have some businesses or good paying jobs. The thing is, i like the idea of having one in a near future, but i need a job that can provide me with money for starting it (or maybe be a software/hardware business), anyway, im deciding either to go the popular path of web dev due to the big market, or maybe go more ""traditional"" and become a c++ developer, since im interested in the field of low-level or even bare metal programming, i know this last one takes more time and even more professionalism in one hand, but i want something that can give me money ""asap"", maybe become a freelance ?? I have a medium knoledge of python, how to use linux and few more about c or java. Any reccomendation??",5,1.0,3,https://www.reddit.com/r/learnprogramming/comments/1oe8y4b/i_have_a_confussing_path_now_what_is_the_best/,2025-10-23 17:07:22,2025-10-26 01:42:16
1oddx9b,Someone who wants to develop skills for workplace after graduation,Professional-Egg3901,learnprogramming,"Hi everyone, I'm a student who studies electrical engineering and I wanna teach my self-robotics cause robots can take over the field so I asked AI for resources on how to start and how can I teach my self-robotics and they said I have to learn c++ any advice",5,0.86,6,https://www.reddit.com/r/learnprogramming/comments/1oddx9b/someone_who_wants_to_develop_skills_for_workplace/,2025-10-22 16:59:52,2025-10-26 01:42:16
1ocmu53,Enum inside of a Union? What exactly is happening here?,Eva_addict,learnprogramming,"In a couple of SDL tutorials that I have studied, they often mention types inside of a Union. I think. For example, they have an union called SDL\_Event which has an int called type inside it. What I don't understand is how they relate and work together. For example, they have this condition in a if : if( e.type == SDL_QUIT )I don't get it. I know that SDL has an Enum called SDL\_EventType which contains said SDL\_QUIT but I don't understand how it works. If the Enum is called SDL\_EventType, how can it be accessed using just ""type""? Shoudn't the condition be:`if ( e.SDL_EventType == SDL_QUIT )`This is really burning my heard right now. As I said in a previous post, it reminds me of when I learned math at school The teacher would explain something but when it came time to actually use it, it was someting completely different that I could not figure out by myself.",3,0.68,9,https://www.reddit.com/r/learnprogramming/comments/1ocmu53/enum_inside_of_a_union_what_exactly_is_happening/,2025-10-21 19:42:33,2025-10-26 01:42:16
