id,title,author,subreddit,content,score,upvote_ratio,num_comments,url,created_utc,extracted_at
1m9nykt,Data Quality Profiling/Reporting tools,Kojimba228,dataengineering,"Hi,When trying to Google for the tools matching my usecase, there is so much bloat, blurred definitions and ads that I'm confused out of my mind with this one. I will attempt to describe my requirements to the best of my ability, with certain constraints that we have and which are mandatory. Okay, so, our usecase is consuming a dataset via AWS Lakeformation shared access. Read-only, with the dataset being governed by another team (and very poorly at that).Data in the tables is partitioned on two keys, each representing a source database and schema from which a given table was ingested. Primarily, the changes that we want to track are: 1. count of nulls in columns of each table (an average would do, I think; reason for it is they once have pushed a change where nulls occupied majority of the columns and records, which went unnoticed for some time :smiling_face_with_tear:)2. changes in table volume (only increase is expected, but you never know)3. schema changes (either Data type changes, or, primarily, new column additions)4. Place for extended fancy reports to feed to BAs to do some digging, but if not available it's not a showstopper. To do the profiling/reporting we have the option of using Glue (with PySpark), Lambda functions, Athena. This what I tried so far:1. Gx. Overbloated, overcomplicated, doesn't do simple or extended summary reports, without predefined checks/""expectations"";2. Ydata-profiling. Doesn't support missing values check with PySpark, even if provided PySpark dataframe it casts it to pandas (bruh). 3. Just write custom PySpark code to collect the required checks. While doable, yes, setting up another visualisation layer on top, is surely going to be a pain in the ass. Plus, all this feels like redeveloping the wheel. Am I wrong to assume that a tool exists that has the capabilities described? Or is the market really overloaded with stuff that says that it does everything, while in fact does do squat?",8,0.85,13,https://www.reddit.com/r/dataengineering/comments/1m9nykt/data_quality_profilingreporting_tools/,2025-07-26 08:12:19,2025-08-02 01:48:14
1me6ah1,Understanding WAL in Plain English (And How to Stop It Filling Your Disk),Temporary_Depth_2491,dataengineering,[https://medium.com/@rohansodha10/understanding-wal-in-plain-english-and-how-to-stop-it-filling-your-disk-ba2ad0ce3248?sk=f18b13605ca868960c10d6751a2ca1f8](https://medium.com/@rohansodha10/understanding-wal-in-plain-english-and-how-to-stop-it-filling-your-disk-ba2ad0ce3248?sk=f18b13605ca868960c10d6751a2ca1f8),7,0.77,2,https://www.reddit.com/r/dataengineering/comments/1me6ah1/understanding_wal_in_plain_english_and_how_to/,2025-07-31 16:30:52,2025-08-02 01:48:14
1mcd0q3,Databricks Workflows vs Apache Airflow,averageflatlanders,dataengineering,No content,6,0.81,0,https://dataengineeringcentral.substack.com/p/databricks-workflows-vs-apache-airflow,2025-07-29 14:31:58,2025-08-02 01:48:14
1mbtb0x,Saleforce to Snowflake ELT pipeline issue,Unusual-Affect-8310,dataengineering,"We’re using Stitch to sync salesforce data to snowflake using incremental load, meaning that we just grab the updated data from last sync. Specifically we’re using the column SystemModStamp (only option on Stitch), so everyday we’re just extracting SystemModStamp >= last value. However, an issue arises with calculated field on Salesforce. For example, table A’s X field is just looking up the X field on table B. When we update X field on table B, table B will get a new SystemModStamp but table A won’t. So when we sync the data, table B will have correct data on Snowflake but table A won’t. I have identified 2 potential solutions 1. Full table replication: will have correct data but costly 2. Rebuild Salesforce logic: can use dbt to rebuild the logic but will take too much time Has anyone faced similar issues? What are your solutions? Thank you so much!",7,0.78,11,https://www.reddit.com/r/dataengineering/comments/1mbtb0x/saleforce_to_snowflake_elt_pipeline_issue/,2025-07-28 21:41:55,2025-08-02 01:48:14
1mbiio9,Grafana DE Pipeline Board,poopdood696969,dataengineering,Anyone out there have visualizations for the entirety of their dagster project? Kind of seems like overkill but I’m looking for projects to farm experience and this seems somewhat more helpful than having to click through the dagster UI to find metrics. I think it would also be helpful to log or monitor the most expensive warehouses / queries in snowflake on this board as well.,8,0.85,1,https://www.reddit.com/r/dataengineering/comments/1mbiio9/grafana_de_pipeline_board/,2025-07-28 15:00:20,2025-08-02 01:48:14
1m9y2f1,Inside Data Engineering with Julien Hurault,mjfnd,dataengineering,"Hello everyone,Sharing my latest article from the Inside Data Engineering series, collaborating with Julien Hurault.The goal of the series is to promote data engineering and help new data professionals understand more.In this article, consultant Julien Hurault takes you inside the world of data engineering, sharing practical insights, real-world challenges, and his perspective on where the field is headed.Please let me know if this is helpful, or any feedback is appreciated.Thanks",5,0.7,0,https://www.junaideffendi.com/p/inside-data-engineering-with-julien,2025-07-26 16:46:06,2025-08-02 01:48:14
1meiraf,Thoughts on how I can improve this very simple API consumer process?,nycstartupcto,dataengineering,"I've got a bunch of metrics and data that I want to capture from some python based Cloud Run processes. I currently have a dictionary object that I just set some first level data in. I save this dictionary object several times as a file up in a bucket. This tracks information about the process such asa. did i log into the API successfullyb. how much data is availablec. how much data did i download successfullyd. did the api report any license changes when queried.This is all separate from the API data that I download and save. I want to save the process information as it helps me troubleshoot and manage what happened. I then process the process information json file after the fact to see what happened. The read/report process runs in a different code base so the idea of having json is nice since i dont have to care about the json being a certain structure. I output some text to a chat bot to a small group of users. I would like to send some more information in the read/report process via email; or even save to a database and stand up a simple self hosted streamlit process. However, when I report it's a straight one-shot read the json files saved, do some simple calcs in pandas and output to a chat room. I dont save the metrics in another datasource.However i would like to send a lot more information in the json file as the process runs. And I want to report on it. Each process has several disparate steps that it goes through. I am thinking that I should convert the json file to a pub sub event process that publishes to a database. I have GCP so i can use pub sub, I also have access to a simple postgresdb to publish to. I do like that my stack is simple (json file to bucket) but i also know that I am not getting information that I want.Thoughts on how I could improve on this? I dont mind adding something to the stack to support it. Adding something like Sentry would be my last choice at the moment as I am trying to keep the reporting stack closer in house. I am mostly looking for nice incremental improvements I can make that aren't re-stacking everything.A few other notes\- These are cronjobs running in a linux box\- No airflow, airbyte, dagster in the stack at the moment",8,1.0,1,https://www.reddit.com/r/dataengineering/comments/1meiraf/thoughts_on_how_i_can_improve_this_very_simple/,2025-08-01 00:52:49,2025-08-02 01:48:14
1meh86u,Architecture question - Continuously running ECS service vs Lambda?,I_Blame_DevOps,dataengineering,"Hey r/dataengineering, I am going to be consuming a bunch of Kinesis streams and need to write this data to a Postgres database. My original plan was to use an AWS Lambda and configure Event Source Mapping to automatically invoke the Lambda when new events are written to the Kinesis stream. However, I've started wondering if this will cause performance issues as this could end up creating 120+ connections (1 invocation per shard, I have 30+ streams which each have 4 shards) to Postgres. One option could be to use RDS Proxy or PgBouncer. However, I think the ""easier"" solution could be to just write a continuously running script that creates a psycopg ConnectionPool and just run this in ECS as a service.How would you solve this? Thanks!",7,1.0,5,https://www.reddit.com/r/dataengineering/comments/1meh86u/architecture_question_continuously_running_ecs/,2025-07-31 23:42:30,2025-08-02 01:48:14
1mdybgm,New to data streams,pro-programmer3423,dataengineering,"Hi all, I want to learn about distributed systems, data streams , batch and stream processing. Also tools like flink, kafka, splink, fluss.Any recommendations to do any projects , books etc Thanks in advance",5,0.78,1,https://www.reddit.com/r/dataengineering/comments/1mdybgm/new_to_data_streams/,2025-07-31 10:51:02,2025-08-02 01:48:14
1md73sq,How to handle special characters in PARQUET file format,Few_Individual_266,dataengineering,I am dumping data from on prem sql server to adls data lake and I have special characters in my table as well as column names which is preventing me from bulk loading . Without using data flow as its expensive how do I load tables as parquet file format.,5,0.86,10,https://www.reddit.com/r/dataengineering/comments/1md73sq/how_to_handle_special_characters_in_parquet_file/,2025-07-30 13:49:24,2025-08-02 01:48:14
1ma4aip,Workflow Questions,looking_for_info7654,dataengineering,"Hey everyone. Wanting to get people’s thoughts on a workflow I want to try out. We don’t have a great corporate system/policy. We have an On prem server with two SQL instances. One instance runs two softwares that generate our data and analysts write their own SQL code/logic or connects db/table to Power BI and does all the transformation there. I want to get far away from this process. There is no code review and power bi reports have ton of logic that no one but the analyst knows about. I want to have sql query code review and strict policies on how to design reports. Code review being one of them. We also have analysts write Python scripts that connect to db, write code with logic and then load back into sql database. Again no version control there. It’s really the Wild West. What are yalls recommendations on getting things under control. I’m thinking dbt for SQL or git for Python. I’m also thinking if the data lives in db then all code must be in SQL.",8,1.0,3,https://www.reddit.com/r/dataengineering/comments/1ma4aip/workflow_questions/,2025-07-26 21:04:35,2025-08-02 01:48:14
1mex2l1,Coursera IBM course,Quiet_Bad_8675,dataengineering,"Anyone has an experince with [this IBM](https://www.coursera.org/professional-certificates/ibm-data-engineer) course from coursera to share your feedback? Also if it is not good, do you have any other recommendations? I'm still studying computer engineering and I am looking for a job as a data engineer after I graduate next January. I have knowledge in Python, SQL, and database managment systems from school.",4,0.84,3,https://www.reddit.com/r/dataengineering/comments/1mex2l1/coursera_ibm_course/,2025-08-01 13:52:14,2025-08-02 01:48:14
1me3ymx,Pyhton and Pyspark,Ok-Golf2549,dataengineering,"Hi guys, does anyone know a good Python or PySpark course that is helpful for data engineers to crack product-based companies ?",4,0.65,2,https://www.reddit.com/r/dataengineering/comments/1me3ymx/pyhton_and_pyspark/,2025-07-31 15:03:01,2025-08-02 01:48:14
1md8f9n,"PgBouncer in 15 Minutes: Kill Idle Connections, Boost Throughput",Temporary_Depth_2491,dataengineering,[https://medium.com/@rohansodha10/pgbouncer-in-15-minutes-kill-idle-connections-boost-throughput-a6220218648f?sk=7cdc035ebcf68571e9b526d57b26b252](https://medium.com/@rohansodha10/pgbouncer-in-15-minutes-kill-idle-connections-boost-throughput-a6220218648f?sk=7cdc035ebcf68571e9b526d57b26b252),7,0.89,1,https://www.reddit.com/r/dataengineering/comments/1md8f9n/pgbouncer_in_15_minutes_kill_idle_connections/,2025-07-30 14:42:21,2025-08-02 01:48:14
1mbl92t,Need Doubt Clearing on Azure Data Engineering,Straight-Party5296,dataengineering,"Hi.. Im working as a Azure Data Engineer for almost 3 years, but the truth is i dont have that much knowledge as how project works and its flow.. I didnt got good exposure in my company to work in the project. Working the same kind of task again and again.Now i'm facing problems while searching for jobs. I need help from anyone to just clear my doubts on how basic project flow works.I'm willing to learn these topics but things didn't went as expected. I need someone to clear all the blockage i have in my mind about the project flow i know. This would really help my future a lot. Anyone who is intrested to share thier knowledge, plz reach me in the chat.",3,0.72,2,https://www.reddit.com/r/dataengineering/comments/1mbl92t/need_doubt_clearing_on_azure_data_engineering/,2025-07-28 16:41:45,2025-08-02 01:48:14
1mbgihi,event-driven or real-time streaming?,Still-Butterfly-3669,dataengineering,"Are you using event-driven setups with Kafka or something similar, or full real-time streaming?Trying to figure out if real-time data setups are actually worth it over event-driven ones. Event-driven seems simpler, but real-time sounds nice on paper.What are you using? I also wrote a blog comparing them (it is in the comments), but still I am curious.",4,0.63,1,https://www.reddit.com/r/dataengineering/comments/1mbgihi/eventdriven_or_realtime_streaming/,2025-07-28 13:42:17,2025-08-02 01:48:14
1marnw3,Dimensional Modeling Periodic Snapshot Standard Practices,Boltonet12,dataengineering,"Our company is relatively new to using dimensional models but we have a need for viewing account balances at certain points in time. Our company has billions of customer accounts so to take daily snapshots of these balances would be millions per day (excluding 0 dollar balances because our business model closes accounts once reaching 0). What I've imagined was creating a periodic snapshot fact table where the balance for each account would utilize the snapshot from the end of the day but only include rows for end of week, end of month, and yesterday (to save memory and processing for days we are not interested in); then utilize a flag in the date dimension table to filter to monthly dates, weekly dates, or current data. I know standard periodic snapshot tables have predefined intervals; to me this sounds like a daily snapshot table that utilizes the dimension table to filter to the dates you're interested in. My leadership seems to feel that this should be broken out into three different fact tables (current, weekly, monthly). I feel that this is excessive because it's the same calculation (all time balance at end of day) and could have overlap (i.e. yesterday could be end of week and end of month). Since this is balances at a point in time at end of day and there is no aggregations to achieve ""weekly"" or ""monthly"" data, what is standard practice here? Should we take leadership's advice or does it make more sense the way I envisioned it? Either way can someone give me some educational texts to support your opinions for this scenario?",3,0.62,19,https://www.reddit.com/r/dataengineering/comments/1marnw3/dimensional_modeling_periodic_snapshot_standard/,2025-07-27 17:08:25,2025-08-02 01:48:14
1me8j6a,Data modeling and architecture: DBSchema pro,james2441139,dataengineering,"Have anybody used DBschema (free/community/pro)? Mainly looking for modeling Azure Synapse tables, DDL scripting, reverse engineering, database documenting capabilities. I have read that DBSchema is a robust tool for these. I would like first hand experience from the community here. I am planning to get the paid pro version of thios.",4,0.83,1,https://www.reddit.com/r/dataengineering/comments/1me8j6a/data_modeling_and_architecture_dbschema_pro/,2025-07-31 17:55:25,2025-08-02 01:48:14
1me5i1w,Little to no freelancing DE jobs... What about ecom?,PlayboiCult,dataengineering,"Hey there. I've been hearing about how Data Engineers dont have many freelance or small business opportunities (and they tend to be reserved for bigger companies with in-house teams). But what about creating dashboards and data pipelines for ecommerces? Isn't this a lucrative/in-demand highly-personalized service that can be installed in different businesses and can be done as a contractor or a small agency?I've been a software developer (full-stack) for 5 years now, and I really like Data Engineering but my personality is that of someone who needs to have his own agency or work alone/in small teams.Thanks in advance!",5,0.78,1,https://www.reddit.com/r/dataengineering/comments/1me5i1w/little_to_no_freelancing_de_jobs_what_about_ecom/,2025-07-31 16:01:31,2025-08-02 01:48:14
1me33o5,Suggestions on estuary.dev for Snowflake ingestion,lprakashv,dataengineering,Working with a client of mine to set up their data analytics. Evaluating Estuary.dev for ingestion to snowflake. Wanted some inputs from folks who have set up production grade replication with Estuary. What has the experience been like?,4,0.71,5,https://www.reddit.com/r/dataengineering/comments/1me33o5/suggestions_on_estuarydev_for_snowflake_ingestion/,2025-07-31 14:29:23,2025-08-02 01:48:14
1mdnx34,Data Cataloging,Existing-Roof-8431,dataengineering,"Hey everyone, does anybody else have any issues for cataloging/documenting data in a small/med sized company? We are small, but our needs are simply not enterprise level or worth it to spend thousands on a data cataloging tool. Something simple, easy to set up and cheap. Does anybody else have this problem, and what are your solutions?",3,0.72,10,https://www.reddit.com/r/dataengineering/comments/1mdnx34/data_cataloging/,2025-07-31 00:58:42,2025-08-02 01:48:14
1mcb8mf,Anyone working in environmental sustainability?,Green-Tea-21,dataengineering,"Hey all - I’m currently working as a Senior GIS Analyst for a federal not-for-profit doing digital divide related work. I’m recently waking up to the field of data engineering after being very interested in data sci for some time and I honestly love it - it’s so foundational for everything. My dream is to eventually work in the field of sustainability (GreenPeace, NRDC, smart grid optimization for electrical utilities,etc ) and I’m just wondering if anyone here does that or has experience working as a data engineer in that sort of setting ? I’d imagine that my GIS background would help a lot given the strong location dependency of environmental data.",3,0.72,7,https://www.reddit.com/r/dataengineering/comments/1mcb8mf/anyone_working_in_environmental_sustainability/,2025-07-29 13:19:14,2025-08-02 01:48:14
1mav3sj,Schedule config driven EL pipeline using airflow,afnan_shahid92,dataengineering,"I'm designing an EL pipeline to load data from S3 into Redshift, and I'd love some feedback on the architecture and config approach.All tables in the pipeline follow the same sequence of steps, and I want to make the pipeline fully config-driven. The configuration will define the table structure and the merge keys for upserts.The general flow looks like this:1. Use Airflow’s data_interval_start macro to identify and read all S3 files for the relevant partition and generate a manifest file.2. Use the manifest to load data into a Redshift staging table via the COPY command.3. Perform an upsert from the staging table into the target table.I plan to run the data load on ECS, with Airflow triggering the ECS task on schedule.My main question: I want to decouple config changes (YAML updates) from changes in the EL pipeline code.Would it make sense to store the YAML configs in S3 and pass a reference (like the S3 path or config name) to the ECS task via environment variables or task parameters?Also I want to create a separate ECS task for each table, is dynamic task mapping the best way to do this? Is there a way i get the number of tables from the config file and then pass it as a parameter to dynamic task mapping? Is this a viable and scalable approach? Or is there a better practice for passing and managing config in a setup like this?",5,0.86,8,https://www.reddit.com/r/dataengineering/comments/1mav3sj/schedule_config_driven_el_pipeline_using_airflow/,2025-07-27 19:24:28,2025-08-02 01:48:14
1maqe1u,Autovacuum Tuning: Stop Table Bloat Before It Hurts,Temporary_Depth_2491,dataengineering,[https://medium.com/@rohansodha10/autovacuum-tuning-stop-table-bloat-before-it-hurts-0e39510d0804?sk=57defbd7f909a121b958ea4a536c7f81](https://medium.com/@rohansodha10/autovacuum-tuning-stop-table-bloat-before-it-hurts-0e39510d0804?sk=57defbd7f909a121b958ea4a536c7f81),5,0.78,1,https://www.reddit.com/r/dataengineering/comments/1maqe1u/autovacuum_tuning_stop_table_bloat_before_it_hurts/,2025-07-27 16:17:59,2025-08-02 01:48:14
1ma19ck,App Integrations and the Data Lake,Full_Metal_Analyst,dataengineering,"We're trying to get away from our legacy DE tool, BO Data Services. A couple years ago we migrated our on prem data warehouse and related jobs to ADLS/Synapse/Databricks. Our app to app integrations that didn't source from the data warehouse were out of scope for the migration and those jobs remained in BODS. Working tables and history are written to an on prem SQL server, and the final output is often csv files that are sftp'ed to the target system/vendor. For on-prem targets, sometimes the job writes the data directly in.We'll eventually drop BODS altogether, but for now we want to build any new integrations using our new suite of tools. We have our first new integration we want to build outside of BODS, but after I saw the initial architecture plan for it, I brought together a larger architect group to discuss and align on a standard for this type of use case. The design was going to use a medallion architecture in the same storage account and bronze/silver/gold containers as the data warehouse uses and write back to the same on prem SQL we've been using, so I wanted to have a larger discussion about how to design for this.We've had our initial discussion and plan on continuing early next week, and I feel like we've improved a ton on the design but still have some decisions to make, especially around storage design (storage accounts, containers, folders) and where we might put the data so that our reporting tool can read it (on-prem SQL server write back, Azure SQL database, Azure Synapse, Databricks SQL warehouse).Before we finalize our standard for app integrations, I wanted to see if anyone had any specific guidance or resources I could read up on to help us make good decisions.For more context, we don't have any specific iPaaS tools, and the integrations that we support are fine to be processed in batches (typically once a day but some several times a day), so real-time/event-based use cases are not something we need to solve for here. We'll be using Databricks Python notebooks for the logic, unity catalog managed tables for storage (ADLS), and likely piloting orchestration using Datbricks for this first integration too (orchestration has been using Azure up to now).Thanks in advance for any help!",4,0.83,4,https://www.reddit.com/r/dataengineering/comments/1ma19ck/app_integrations_and_the_data_lake/,2025-07-26 18:56:38,2025-08-02 01:48:14
1mf0sdy,"Would a curated marketplace for exclusive, verified datasets solve a real gap? Testing an MVP",Brilliant-Draft2472,dataengineering,"I’m exploring an MVP to address a challenge I see often in data workflows: sourcing **high-quality, trustworthy datasets** without duplicates or unclear provenance.The concept is a marketplace designed for data professionals that offers:* *1-of-1 exclusive* datasets (no mass reselling)* Escrow-protected transactions to ensure trust* Strict metadata and documentation standards* Verified sellers to guarantee data authenticityFor data engineers and pipeline builders:* Would a platform like this solve a gap you face when sourcing data?* What metadata or schema standards would you consider must-have?* Any advice for integrating a marketplace like this into ETL/ELT workflows?Would really value insights from this community — share your thoughts in the comments.",4,0.7,18,https://www.reddit.com/r/dataengineering/comments/1mf0sdy/would_a_curated_marketplace_for_exclusive/,2025-08-01 16:16:35,2025-08-02 01:48:14
