id,title,author,subreddit,content,score,upvote_ratio,num_comments,url,created_utc,extracted_at
1on17lh,what is the saturation point?,Pretend_Bit_727,learnprogramming,"Am learning C now, doing some problems day by day. When should i go to next language? At what point will i know “ok i have done enough problems and learnt good theory lets go to next language”?.",10,0.71,28,https://www.reddit.com/r/learnprogramming/comments/1on17lh/what_is_the_saturation_point/,2025-11-03 03:19:20,2025-11-10 01:44:57
1oq8l16,Project Documentation Guidance,Zealousideal-Gas9552,learnprogramming,"Hey All, I am new to building projects and I realize over a time, I tend to forget, about the features or the modules I have, hence I require documentation, right from scratch; be it at planning, find requirements, updates, DDSDs, DESs, Decision Tables, User Business Scenarios, etc., Now, it takes a lot of time, and lot of documentations.Can you help me find safe, free/open-source tools that help with building the documentations, and then updating the documents automatically, maybe by some manual request or every push into main branch in github/gitlab. Automatically, without much effort from my end.Thanks for your help.",10,0.87,3,https://www.reddit.com/r/learnprogramming/comments/1oq8l16/project_documentation_guidance/,2025-11-06 19:36:15,2025-11-10 01:44:57
1op3mua,Learning Organization and Structure,kslidz,learnprogramming,"Self-taught so I have been scripting for a few years now and started more heavily into actual coding full projects and modules. The thing that always seems to escape me especially when I am first starting a new language is how to organize or plan more than getting the logic to work. What resources do people use to explore that part of the process?For instance I am working now on a an API interface witha few different utilities and services required reliant on a database tables in Java Spring framework. But outside of seeing how other people do it I struggle to know where to abstract or to just make fluid or modular as opposed to rigid and repeating the same logic over and over. The balance of over-complicating versus just getting it running. And know whether suggestions or examples actually are even relevant or a good way of creating the flow I intend in the first place. I guess this is more of a general question but yeah how do you focus on learning that? Like I understand concepts and often when I am moving through something I go to the underlying functionality of a method or existing class to explore options but I keep feeling like, I know I am neither the smartest or most experienced, so how can I find models of good ways of doing things or at least the principals to have some checklist or reference point to judge myself against?",9,0.86,3,https://www.reddit.com/r/learnprogramming/comments/1op3mua/learning_organization_and_structure/,2025-11-05 14:00:34,2025-11-10 01:44:57
1oooips,Recent Grad Imposter Syndrome...,twillyallen,learnprogramming,"Hey all! As the title says, I recently graduated! Bachelors in Computer Science. Super excited to (hopefully) one day become a software Engineer... But I feel inadequate...Although I know how to code, I feel like my lack of experience is killing me. I have ""created"" several projects on my own in my own time. A video game in GameMaker Studio, a JavaScript/HTML based NFL Trivia Website, and a Python based NFL Prediction program that uses Pandas to collect data... Although I ""created"" those projects, I gotta admit... They weren't created off the top of the ol' dome. The best way I can explain them is that they were put together with duct tape and bubble gum haha. Whenever I need help with a specific portion, i'd just google the question I had, use code from different forums and tutorials, and edit that code it to fit my specific needs. Like I have no idea how to just free-hand use Pandas for my NFL Algorithm. There is countless hours of googling and taking code to be able to make it happen. I don't know how to just free-hand create an HTML site lol. I just used the code that we learned in a project in school and edited to fit my ideas...I feel like an idiot for that. I guess the best solution is to just keep practicing... but for right now, I just feel like a fraud for not knowing all the intricacies of the languages I use. I am actively looking for entry-level jobs, especially because I have experience in the industy as an Engineering Technician that exposed me to the code that software engineers wrote... But I feel like my first interview (assuming I get that far) is going to be a disaster and i'll get made out to be a fraud...Has anyone else felt this level of Imposter Syndrome?",9,0.8,15,https://www.reddit.com/r/learnprogramming/comments/1oooips/recent_grad_imposter_syndrome/,2025-11-05 00:35:10,2025-11-10 01:44:57
1or4s4p,What to do now: Full-Stack Web studies?,Reasonable_Ninja6455,learnprogramming,"I am currently taking Angela Yu’s Full-Stack Web Development bootcamp on Udemy and I’m close to finishing the course, with only the React module left.So far, I have studied the following topics: HTML, CSS, Flexbox, Grid, Bootstrap, JavaScript, DOM, jQuery, Web Design, Unix Command Line, Node.js, Express.js, EJS, Git, GitHub and version control, APIs, SQL and PostgreSQL.Before diving into React, I decided to do a comprehensive review of the back end because I found it more challenging. I am rereading my notes, redoing the course exercises, and even creating flashcards. I’m also rereading the code and abstracting patterns to strengthen my understanding.**My question is the following:** What do I do now? What are the next steps, besides studying React soon? I’m lost; I don’t know what to do now or afterwards. Give me some guidance.",8,0.91,5,https://www.reddit.com/r/learnprogramming/comments/1or4s4p/what_to_do_now_fullstack_web_studies/,2025-11-07 20:07:03,2025-11-10 01:44:57
1oqpvsx,I'm having difficulty finding all kinds of fancy tools and technologies,ZealousidealKale2042,learnprogramming,"Hello everyone!Throughout my years of studying programming and work, I have always had the same question. I don't know how to properly find various tools and libraries.While developing projects or doing my work, I tend to use the simplest and most straightforward approaches, relying on old and time-tested techniques that are hard to ignore when learning programming.When faced with a problem or task, I turn to Google for a solution. I usually find one, but it's often not the most efficient or optimal solution. Later, I find a better, more concise, and secure way to solve the issue that I somehow missed when searching.Each time I publish a repository on GitHub, it only contains the bare essentials for the project and nothing more.But also, every time I open other people's repositories or developers' chats, I see people communicating in Elvish, casting unknown secret spells consisting of made-up words and names of tools and libraries, some of which I have never heard of, such as: just, dependabot, pre-commit, uv, unicornus-pam-pam, umdbpegasus, fizzbuzzenterprisemegacooltool, and so on (some of the names are made up, but I think such tools will appear and become a must-have in the next few days).Many of these pieces of technology can only be discovered by searching for their direct name. However, how can one stumble upon them if they are only searched by name? Furthermore, often, the descriptions of such projects' repositories are as strange as possible and do not reflect their essence. For example, ""FizzBuzzEnterpriseMegaCoolTool is your ambassador to the world of great programming achievements. A framework for delegating fractal powers to transcendent purple entities in the paradigm of the great actor's shift."" What??? Is this some kind of secret agent's code or is it really Elvish?And this framework itself, for example, is just a tool for generating HTTP clients based on a config. Of course, this example is made up, but I believe you understand what I am trying to say. Most project descriptions are a quiet horror. However, the most interesting thing is that it creates the feeling that everyone around you understands what they are and why they are needed.. And in general, everyone except me, of course, has been using this thing since it first appeared on the internet.When I first started studying, I looked at different roadmaps and study plans. There were lots of popular and useful tools and technologies, like git, Linux, VSCode, and more. Now, nothing has really changed - the basic stuff is still the same.I find similar roadmaps and look for these magic technologies, but I don't find them. The most you can find them in all sorts of awesome lists, but even then, not all and not always.Often, these projects have thousands of stars on GitHub, but neither Google nor GitHub search gives me this useful thing - just all the outdated nonsense and users' personal projects.And it happens even more often that such projects have fewer than 500 stars on GitHub, but people still use these things if you look at recent applications or in programmers' chats. How they discovered these things is not clear.There is also a common problem that I can't guess up to a certain concept in principle, and because of that, I can't create a search result, because that idea doesn't occur to me. For example, yesterday, I found out about such a thing as harper. I had never even thought of finding tools to check grammar, especially to automate this check in repositories. Or, for instance, hexagonal architecture, which has become popular in recent years (although the concept and original article have been around for many years). I stumbled upon this by accident. If you search for architecture on Google, there will only be MVC, MVP, MVVM and others, not this one. I don't understand how this spreads and why Google's search doesn't reflect actual trends.I understand that people often learn about concepts and tools through communication and job, rather than searching, but I would still like to know how people initially learn about these things and how they transfer their knowledge. Perhaps I just answered my own question - people simply communicate and interact with each other, sharing information and experiences. Someone may discover something interesting and share it with others, who tell others, and so on. But perhaps I need to hear confirmation of this understanding from you.In my attempts to ask these fundamental and interesting questions in chat rooms, but everyone there was toxic about it or ignored it, although, as for me, finding information and learning new things is the most important part of programming. I sometimes feel as if I have been banned from Google and Github search :D. It feels as if my searches are being filtered to exclude useful information and instead provide irrelevant or nonsensical results.TLDR: I am struggling to find useful new tools, libraries, and concepts in the development community when they are not well indexed by search engines and are mainly distributed through community channels. What important detail of the search for all this am I missing?I am sorry for the messy and unstructured nature of my text. I am feeling overwhelmed and unsure of what to do. Thank you for your patience and understanding. I appreciate your help.",9,0.92,3,https://www.reddit.com/r/learnprogramming/comments/1oqpvsx/im_having_difficulty_finding_all_kinds_of_fancy/,2025-11-07 09:24:41,2025-11-10 01:44:57
1oqeovs,.net framework vs .net core/other question,Financial_Radish,learnprogramming,It is my understanding that .net framework no longer going to have releases from Microsoft as MS has moved on to .net (formerly known as .net core). Would it be stupid to learn or program in .net framework if you're building a new application? Is there any advantage at all unless something was already developed in .net framework and there are no plans to migrate it to .net or some other platform?I'm having a tough conversation with a senior programmer who continues to want to build net new applications in .net framework as opposed to moving to something like .NET Core/.NET 6+ or even python.Am I missing something?,9,0.92,8,https://www.reddit.com/r/learnprogramming/comments/1oqeovs/net_framework_vs_net_coreother_question/,2025-11-06 23:35:33,2025-11-10 01:44:57
1opuhy2,How do you prepare mentally for impostor syndrome before it even starts?,kindabubbly,learnprogramming,"I haven’t even started university yet, but somehow I’m already intimidated. I see future classmates on Discord talking about the apps they’ve built and internships they’ve done, I know impostor syndrome is part of the CS experience, but I’d like to go in with a little armor. For those who’ve been there, what helped you deal with feeling like you weren’t “good enough” even when you were?Bonus points for real talk (preferably harsh slams and not just “believe in yourself” motivational posters).",7,0.69,23,https://www.reddit.com/r/learnprogramming/comments/1opuhy2/how_do_you_prepare_mentally_for_impostor_syndrome/,2025-11-06 09:31:28,2025-11-10 01:44:57
1ornf1h,How to document my progress thru a book,nice_kick_007,learnprogramming,so im like a beginner programmer and have just started to learn programming. I am trying to go through k and r. Is it worth it to create a git hub repo containing the solutions for the excercise questions. And how else could i make the most out of this from a portfolio stand point. Would it even matter? Or will it just be another price of boiler plate code,7,0.9,11,https://www.reddit.com/r/learnprogramming/comments/1ornf1h/how_to_document_my_progress_thru_a_book/,2025-11-08 11:45:34,2025-11-10 01:44:57
1or6n26,Places to code,Appropriate-Ice9626,learnprogramming,"Hi, I'm learning C++ all on my own and I don't know where to practice. I don't own a laptop and I'm using an iPad, and I'm struggling to find a place to practice instead of just using my notes app. Any recommendations are appreciated! :smiling_face:",8,1.0,12,https://www.reddit.com/r/learnprogramming/comments/1or6n26/places_to_code/,2025-11-07 21:19:54,2025-11-10 01:44:57
1or3hsw,Free assembly language lessons from the FFmpeg community,Jordi_Mon_Companys,learnprogramming,Find them in their [GitHub repo](https://github.com/FFmpeg/asm-lessons).,7,0.9,0,https://www.reddit.com/r/learnprogramming/comments/1or3hsw/free_assembly_language_lessons_from_the_ffmpeg/,2025-11-07 19:17:32,2025-11-10 01:44:57
1oq5pnp,Coding advice,BuffaloCool113,learnprogramming,My son is a pretty advanced coder and game developer for a 13 year old. I’m the opposite I wanted to make him a diy advent calendar with sort of daily “activities” that ultimately lead to maybe some sort of finished project… does this sort of thing exist or is there a relatively easy way for me to create my own? Any advice is appreciated since I am completely ignorant to it all!,7,0.74,9,https://www.reddit.com/r/learnprogramming/comments/1oq5pnp/coding_advice/,2025-11-06 17:49:28,2025-11-10 01:44:57
1oqs2bv,Have you tried using coding games to aid your learning?,Local-Crab2987,learnprogramming,I found one that uses python in a gamified style and its a good thing to do alongside a course to kind of solidify the concepts,4,0.71,11,https://www.reddit.com/r/learnprogramming/comments/1oqs2bv/have_you_tried_using_coding_games_to_aid_your/,2025-11-07 11:35:22,2025-11-10 01:44:57
1oprmhq,Even if I don’t know anything. Would it be better to just start the project?,Leading-Energy-2917,learnprogramming,"First, Thank you for your interest in my story, which has nothing to do with anything else.I’m not very good at English, but I’ll try my best to convey my sincerity.I am a 25 years old student attending a music collage in KoreaMy major is classic composition, and double majoring in electronic music composition.While attend school, I worked on recording and sound-related projects for films and performances (classical, electronic, traditional Korean, experimental, etc)Working in this industry forced to face reality.It made me think again about my future Then, last year, I reached a turning point in my life through the ircam Seoul workshop.After experiencing that, I developed a goal to become a composer, developer and creates my own audio platform.First of all, what I want to make right now is creating a system that automatically extracts the movement coordinates of objects in a video and then automatically mixes and renders them into 3D audio.**This is a study plan to realize the project.**1. Progrmming (Python)2. Signal processing3. Dsp simulation4. acoustic engineering5. psychoacoustics6. Spatial Audio / HRTF7. Coordinates → Audio MappingI studied Python through YouTube lectures, but I didn't fully understand it.I’m currently studying “Think Dsp” and I’m understanding it one by one by following the examples and adding my own comments.I’m trying to somehow get used to Python and the computer language system.I thought, Instead of following an example, why not just write the code from scratch?But I'm afraid it'll take too much time.Impatience comes first.**This is the one thing I really want to know.**How much of the basics should I study before starting a project?Is it better to start a project right away, even if I know nothing?I'm not sure if I'm on the right track right now, so I'm honestly asking for help.I took a year off from university to study on my own.But I had no one to talk to about these thingsEventually, I was trapped in my own world, talking to AI every day.Then I discovered Reddit,and I was genuinely moved seeing how people here give honest, caring advice to complete strangers.That’s what gave me the courage to write this post.And someday, I hope to be someone who can give advice to people who are lost like me.I’m still inexperienced, but I believe your words can change the direction of my life.Thank you, truly, for reading all of this.",6,1.0,7,https://www.reddit.com/r/learnprogramming/comments/1oprmhq/even_if_i_dont_know_anything_would_it_be_better/,2025-11-06 06:28:22,2025-11-10 01:44:57
1oniqno,Im coding without knowing whats behind,Role-Effective,learnprogramming,"I like machine learning and llms a lot but i only use frameworks like pytorch and api's so i dont really know anything about the math behind everything, do you think this is harmful?",6,1.0,25,https://www.reddit.com/r/learnprogramming/comments/1oniqno/im_coding_without_knowing_whats_behind/,2025-11-03 17:53:49,2025-11-10 01:44:57
1orgwoz,For full time workers learning coding on the side? Whats your study set up like?,Local-Crab2987,learnprogramming,"Ive got myself a standard laptop with an extra portable monitor, i just need to find a good place to study because all the libraries close after a knock off work I find this set up still a little clunky, i was looking into like pc tablets with a good battery so i can go for walks and code at the same time. ( my laptop battery is bad always need access to powerpoint)",7,0.82,5,https://www.reddit.com/r/learnprogramming/comments/1orgwoz/for_full_time_workers_learning_coding_on_the_side/,2025-11-08 05:10:28,2025-11-10 01:44:57
1org5se,Introduction of language dictionaries,lasopamata69,learnprogramming,"Hello guys, I have a questionIs it useful to create a library of commands translated into my language? For those who speak English or have more knowledge of the language, I suppose it is not a problem but I only speak Spanish and understand English a little, however I have focused on creating libraries in my programs that absorb large and useful functions or are directly basic functions that I commonly use as a print=print and I place them in my own library that stores basic functions separated by the usefulness they have (commons, connections, etc.) and on one side of that I place functions that I normally reuse in a new function in Spanish and only the I call in the code, but I don't know what is correct or what is best for my code, it is not difficult for me to write my function since it normally completes the functions that I will use when I am starting to write them",7,1.0,14,https://www.reddit.com/r/learnprogramming/comments/1org5se/introduction_of_language_dictionaries/,2025-11-08 04:30:51,2025-11-10 01:44:57
1or9go8,"So, I have a question I'm designing my first game and i'm on the fence about using either object oriented programming or entity component system.",WillenskraftBarbar,learnprogramming,"So, long story short, I'm just planning my game. I'm entering the phase where I'm just planning, but it's on my mind. I know two different coding styles, and I don't know which one to use.",4,0.84,4,https://www.reddit.com/r/learnprogramming/comments/1or9go8/so_i_have_a_question_im_designing_my_first_game/,2025-11-07 23:13:56,2025-11-10 01:44:57
1oqhpj7,Thoughts on boot.dev?,IveReturnedItsTrue,learnprogramming,"Hello!I'm a 24 year old girl trying to learn coding with no actual schooling. I started by teaching myself HTML, CSS, and JS online through websites like freeCodeCamp and TheOdinProject, along with a whole bunch of YouTube videos. I feel pretty confident in my ability so far in those 3 languages (JS was super har, though) and now I want to expand into backend coding, because it'd be really cool to work on video games one day.I was looking up backend coding sites similar to something like TheOdinProject, and I realized I've seen a LOT of ads for boot.dev recently, especially on YouTube. I was wondering if anybody has experience and has tried boot.dev, or any other backend coding website for that matter, and if so, what were your thoughts on them? Is there one that you really liked? One that you really disliked? And why?Thanks so much in advance!",6,0.75,3,https://www.reddit.com/r/learnprogramming/comments/1oqhpj7/thoughts_on_bootdev/,2025-11-07 01:48:52,2025-11-10 01:44:57
1oq16n1,Is my mac struggling too much?,we_oim,learnprogramming,"I just started learning Flutter and bought an online course.My Mac is a 2020 MacBook Air Retina with a 1.1 GHz dual-core Intel i3 and 8GB of memory, running macOS Sequoia 15.6.1.But when I started installing all the programs required for the lessons — Flutter SDK, Android Studio, Xcode, and Homebrew — I could feel that my Mac was struggling.Can it really handle all of this?I’m starting to think I underestimated how heavy coding can be.Could you recommend a better laptop for development? I don’t have enough money right now, but I plan to save up so I can continue learning smoothly.",5,0.86,10,https://www.reddit.com/r/learnprogramming/comments/1oq16n1/is_my_mac_struggling_too_much/,2025-11-06 15:00:35,2025-11-10 01:44:57
1opgv25,"Looking to make website, Completely new to coding",Technical_Bluejay731,learnprogramming,"Hello, I'm in Grade 10 and I have to complete the IB MYP's Personal Project, I want to make my own virtual food bar people can actually pre-order on. I don't want the design to be super modern and would rather go for something simple. What resources should I use to study and learn the programming languages needed to make this possible?",3,0.6,13,https://www.reddit.com/r/learnprogramming/comments/1opgv25/looking_to_make_website_completely_new_to_coding/,2025-11-05 22:07:40,2025-11-10 01:44:57
1op92xf,How to figure things out on my own?,HosseinTwoK,learnprogramming,"I'm self-learning game development, but I often fall into an endless learning loop, constantly consuming tutorials without actually learning or applying anything. I want to know how I can truly figure things out on my own and study effectively without missing important or essential information, while also avoiding wasting too much time. How can I build a system or mindset that helps me learn efficiently and make real progress?",4,0.84,12,https://www.reddit.com/r/learnprogramming/comments/1op92xf/how_to_figure_things_out_on_my_own/,2025-11-05 17:24:34,2025-11-10 01:44:57
1oohmu0,"I Want to Switch Back to IT, But I Feel Behind — Advice Needed",mahmoudalrihan,learnprogramming,"I’m 25. I graduated about two years ago with a bachelor’s degree in IT (Management Information Systems). While studying, I worked in restaurants, sales, and random jobs to pay the bills, so I never actually got hands-on IT experience. After graduating, I found a better-paying job at an outsourcing/customer support company — still not IT.Now I feel stuck. The job drains me, and I don’t see a future in it. I want to switch back to IT and start building real skills, but I feel like I forgot everything I studied. When I look into tech careers, there are so many paths and sub-fields that I don’t even know where to start or how long it would take to become employable.For anyone who’s been in this situation — how did you pick a starting point? Is it too late to switch? What would you do if you were in my place?Any advice or direction would help a lot. **Note:** After doing some research, I’m planning to start with the *Google IT Support Professional Certificate*, then move on to the *CompTIA A+*. It seems like a common entry-level path, but I’m still not sure if I’m making the right call — or if there’s a better direction I should be focusing on.",5,0.78,4,https://www.reddit.com/r/learnprogramming/comments/1oohmu0/i_want_to_switch_back_to_it_but_i_feel_behind/,2025-11-04 20:01:33,2025-11-10 01:44:57
