id,title,author,subreddit,content,score,upvote_ratio,num_comments,url,created_utc,extracted_at
1mbs1iw,Data Engineering Job Market - What the Hell Happened?,MoRakOnDi,dataengineering,"I might come off as complaining, but it’s been 9 months since I started hunting for a new data engineering position with zero luck. After 7 years of doing DE (working with Oracle BI, self-hosted Spark clusters, and optimizing massive Snowflake and BigQuery warehouses) I’m feeling stuck. For the first time, I’ve made it to the final stages with 8 companies, but unlike before when I’d land multiple offers, I'm totally out of luck.What’s changed?Why are companies acting like jerks?Last week, I had a design review meeting with an athletic clothing company, and the guy grilled me on specific design details that felt like his assigned homework; then he rejected me. I’ve spent days working on over 10 take-home assignments, and some looked like Jira tasks, only to get this: “While your take-home showed solid architectural thinking and familiarity with a wide range of data tools, the team felt you lacked the clarity and technical depth to match in the design review meeting.”Seriously? Last year, I was hiring a senior BI engineer and couldn’t find anyone who could write a left join SQL, and now I’m expected to write a query for complex marketing metrics on the fly and still fall short?Here’s what I’ve noticed:* Take-home assignments often feel like ticket work, not real evaluations.* Teams seem to gatekeep, shutting out anyone new.* There’s a huge gap between job descriptions and technical discussions. e.g., the JD and hiring manager were all about AWS Glue, but the technical questions were focused on managing and optimizing a self-hosted Spark cluster on Kubernetes.* Transferable skills get ignored. I’ve worked with BigQuery, Snowflake, Spark, Apache Beam, MongoDB, Airflow, Databricks, GCP, AWS, and set up Delta Lake in my assignment, but I couldn't recite the technical differences between Apache Iceberg and Delta Lake. Nope, not good enough. I got rejected.Do you guys really know all the technologies? Are you some sort of god or what? I can’t know every tech, but I can master anything new. why won’t they see that anymore?I’m tired of this crap! It’s not fair. No one values transferable skills anymore; they demand an exact match on tech stack, plus a massive time spent on prep work: online exams and technical assignments, only to get a “no” at the end.\-----\[EDIT\]I'm not a victim here; I already have a job with decent pay, 17 years of experience, and I want to switch to a better team with a 10% pay cut because I have a shitty boss.",455,0.93,126,https://www.reddit.com/r/dataengineering/comments/1mbs1iw/data_engineering_job_market_what_the_hell_happened/,2025-07-28 20:52:39,2025-08-02 01:48:14
1mc9qcp,Built Kafka from Scratch in Python (Inspired by the 2011 Paper),Substantial_Fig_7849,dataengineering,"Just built a mini version of Kafka from scratch in Python , inspired by the original 2011 Kafka paper, no servers, no ZooKeeper, just core logic: producers, brokers, consumers, and offset handling : all in plain Python. Great way to understand how Kafka actually works under the hood.Repo & paper: [notes.stephenholiday.com/Kafka.pdf](https://notes.stephenholiday.com/Kafka.pdf) : Paper , [https://github.com/yranjan06/mini\_kafka.git](https://github.com/yranjan06/mini_kafka.git) : RepoLet me know if anyone else tried something similar or wants to explore building partitions next!",380,0.96,42,https://i.redd.it/mltsjhwb1tff1.png,2025-07-29 12:11:42,2025-08-02 01:48:14
1m9gksl,"Microsoft admits it 'cannot guarantee' data sovereignty -- ""Under oath in French Senate, exec says it would be compelled – however unlikely – to pass local customer info to US admin""",throwaway16830261,dataengineering,No content,216,0.98,31,https://www.theregister.com/2025/07/25/microsoft_admits_it_cannot_guarantee/,2025-07-26 01:16:01,2025-08-02 01:48:14
1md5wp9,quick PSA on LLM fear.,Thinker_Assignment,dataengineering,"hey folks, i see a lot of fear of LLMs and i just wanted to say we are doing ourselves a disservice by having knee jerk reactions against it.# The real threat isn’t replacement. It’s displacement.Your work isn’t actually replaceable by autocomplete. But it **looks like it is,** and that’s the problem.LLMs are built to sound confident, not to be correct. They generate fluent, plausible output that gives the *illusion* of competence, without understanding, judgment, or responsibility.So the danger isn’t the model. **It’s your manager thinking you’re replaceable.** Or their manager pressuring them to “do more AI, less people.” Or a CFO using AI as cover for layoffs in a foggy, panic-driven economy.You won’t be replaced by a language model. But you can be **displaced** by the perception that one is “good enough.” The next few years look the same: Industry is adding: memory, tools, multimodal input, even planning— Still out of reach, no clear pathway ahead: **true cognition, self-awareness, reasoning under uncertainty, and grounded understanding.** even today for cognitive restructuring and grounding we use 2k year old methods like socratic questioning - we're nowhere close to solving this.# How you can win this fight Right now, every company is standing in a dense AI fog. No one knows what’s real, what’s hype, or how to use these tools safely.The most valuable roles today? They go to the **LLM navigators** — the people who understand what's possible, what’s coming, and how to steer through uncertainty.It’s the same prestige arc we saw with data 15 years ago. With ML 5–10 years ago. And now it’s your turn.You don’t need to be an LLM expert. But if you’re the one testing tools, forming opinions, stress-testing outputs, and helping others make sense of it all — you’ve already stepped into leadership.**Be the scout.** The one-eyed engineer guiding the blind through this strange new frontier. It’s improv now. The answer is “yes, and…” → Yes, and let’s do it safely. → Yes, and let’s make the most of it. → Yes, and let’s not blow up the business.But “no”? no AI, no experiments, no change? This will get interpreted as “no value.” ""falling behind"" ""missed opportunity"" ""company risk"". And if you’re a blocker, the system will set you free and find a helper.So don’t be a victim. Don’t freeze. Don’t frame it as *you vs. AI.* That’s a losing game.Frame it as: **“I’m the one who understands AI. I’ll help us use it — safely, effectively, and with eyes open.”**That’s who companies want. That’s who they’re **desperate** to invest in. And while you personally as an engineer may not care, this is the **prestige** that data managers in large companies are after - they want to be the person steering the company in AI age, keep job, get promoted, take credit for riding the possibilities out there. It's almost like whitepapers used to be a few years ago. Thanks for coming to my TED talk. I hope this helps you guys keep your jobs.",197,0.95,20,https://i.redd.it/5l0gt05s10gf1.png,2025-07-30 12:57:57,2025-08-02 01:48:14
1mejjjx,"If I get laid off tomorrow, what's the ONE skill I should have had to stay in demand?",Ajayxo999,dataengineering,"I'm a Data Engineer with 3 YOE at a Big4. With all the layoffs happening, wondering what skill would make me most marketable.Current stack:- Cloud platforms (GCP)- ETL tools & pipelines- SQL- Finance & pharma domain experienceWhat's the ONE skill I should start learning that would make me recession-proof or boost my career? Fellow DEs, please suggest.",185,0.95,110,https://www.reddit.com/r/dataengineering/comments/1mejjjx/if_i_get_laid_off_tomorrow_whats_the_one_skill_i/,2025-08-01 01:30:22,2025-08-02 01:48:14
1m9xbk5,Primary Keys: Am I crazy?,bengen343,dataengineering,"TLDR: Is there any reason *not* to use primary keys in your data warehouse? Even if there aren't any legitimate reasons, what are your devil's advocate arguments against using them?Maybe I am, indeed, the one who is crazy here since I'm interested in getting the thoughts of actual humans rather than ChatGPT, but... I've encountered quite the gamut of warehouse designs over the course of my time, especially in my consulting days. During this time, I've come to think of primary keys as ""table stakes"" (har har) in the creation of any table. In all my time, I've only encountered two outfits that didn't have any sort of key strategy. In the case of the first, their explanation was ""Ah yeah, we messed that up and should probably fix that."" But, now, in the case of this latest one, they're treating their lack of keys as a legitimate design choice. This seems unbelievable to me, but I thought I'd take this to the judgement of the broader group: is there a good reason to avoid having any primary keys?I think there are ample reasons to have some sort of key strategy:* Data quality tests: makes it easier to check for unique records and guard against things like fanout.* Lineage: makes it easy to trace the movement of a single record through tables.* Keeps code DRY (don't repeat yourself): effective use of primary/foreign keys can prevent complex \`join\` logic from being repeated in multiple places. * Not to mention general \`join\` efficiency* Interpretability: makes it easier for users to intuitively reason about a table's grain and the way \`join\`s should work.I'd be curious if anyone has any arguments against the above bullets or keys in data warehouses, specifically, more broadly.Full disclosure, I may turn this discussion into a blog post so I can lay out my argument once and for all. But I'll certainly give credit to all you r/dataengineers.",171,0.93,36,https://i.redd.it/meg7r48jr8ff1.jpeg,2025-07-26 16:15:28,2025-08-02 01:48:14
1mce29s,A little rant on (aspiring) data engineers,Stock-Contribution-6,dataengineering,"Hi all, this is a little rant on data engineering candidates mostly, but also about hiring processes.As everybody, I've been on the candidate side of the process a lot over the years and processes are all over the place, so I understand both the complaints on being asked leetcode/cs theory questions or being tasked with take-home assigned that feel like actual tickets. Thankfully I've never been judged by an AI bot or did any video hiring.That's why now that I've been hiring people I try to design a process that is humane, checks on the actual concepts rather than tools or cs theory and gets an overview of the candidate's programming skills.Now the meat of my rant starts. I see curriculums filled to the brim with all the tools in existance and very few years of experience. I see peopel straight up using AI for every single question in the most blatant way possible. Many candidates mostly cannot code at all past the level of a YouTube tutorial.It's very grim and there seems to be just no shame in feeding any request in any form to the latest bullshit AI that spews out complete trash.Rant over. I don't think most people will take this seriously or listen to what I'm saying because it's a delicate subject, but if you have to take anything out of this post is to stop using AIs for the technical part because it's very easy to spot and it doesn't help anybody.TLDR: stop using AI for the technical step of hiring, it's more damaging than anything",125,0.89,68,https://www.reddit.com/r/dataengineering/comments/1mce29s/a_little_rant_on_aspiring_data_engineers/,2025-07-29 15:12:15,2025-08-02 01:48:14
1maloa5,Leaving a Company Where I’m the Only One Who Knows How Things Work. Advice?,WasabiBobbie,dataengineering,"Hey all,I’m in a bit of a weird spot and wondering if anyone else has been through something similar.I’m about to put in my two weeks at a company where, honestly, I’m the only one who knows how most of our in-house systems and processes work. I manage critical data processing pipelines that, if not handled properly, could cost the company a lot of money. These systems were built internally and never properly documented, not for lack of trying, but because we’ve been operating on a skeleton crew for years. I've asked for help and bandwidth, but it never came. That’s part of why I’m leaving: the pressure has become too much.Here’s the complication:I made the decision to accept a new job the day before I left for a long-planned vacation.My new role starts right after my trip, so I’ll be giving my notice during my vacation, meaning 1/4th of my two weeks will be PTO.I didn’t plan it like this. It’s just unfortunate timing.I genuinely don’t want to leave them hanging, so I plan to offer help after hours and on weekends for a few months to ensure they don’t fall apart. I want to do right by the company and my coworkers.Has anyone here done something similar, offering post-resignation support?How did you propose it?Did you charge them, and if so, how did you structure it?Do you think my offer to help after hours makes up for the shortened two-week period?Is this kind of timing faux pas as bad as it feels?Appreciate any thoughts or advice, especially from folks who’ve been in the “only one who knows how everything works” position.",127,0.87,125,https://www.reddit.com/r/dataengineering/comments/1maloa5/leaving_a_company_where_im_the_only_one_who_knows/,2025-07-27 12:59:37,2025-08-02 01:48:14
1mb3280,"How do you decide between a database, data lake, data warehouse, or lakehouse?",Data-Sleek,dataengineering,"I’ve seen a lot of confusion around these, so here’s a breakdown I’ve found helpful:A database stores the current data needed to operate an app. A data warehouse holds current and historical data from multiple systems in fixed schemas. A data lake stores current and historical data in raw form. A lakehouse combines both—letting raw and refined data coexist in one platform without needing to move it between systems.They’re often used together—but not interchangeablyHow does your team use them? Do you treat them differently or build around a unified model?",115,0.93,42,https://www.reddit.com/r/dataengineering/comments/1mb3280/how_do_you_decide_between_a_database_data_lake/,2025-07-28 01:14:30,2025-08-02 01:48:14
1mdtjv7,Dashboard dysfunctorrhea: how the best leaders actually use data,sbalnojan,dataengineering,"I wrote this after years of watching beautiful dashboards get ignored while users export everything to Excel anyway. Having implemented BI tools for 700+ people at a last company, I kept seeing the same pattern: we'd spend months building sophisticated dashboards that looked amazing in demos, then discover 80% of users just exported the data to spreadsheets.The article digs into why this happens and what I learned about building dashboards that people actually use vs ones that just look impressive.Curious if others have seen similar patterns? What's been your experience with dashboard adoption in your organizations?(Full disclosure: this is my own writing, but genuinely interested in the discussion - this topic has been bothering me for years)",107,0.94,25,https://www.thdpth.com/p/dashboard-dysfunctorrhea-how-the,2025-07-31 05:49:26,2025-08-02 01:48:14
1me6rsv,How far can you go into Data Engineering without Software Engineering?,informatica6,dataengineering,"Being in BI for few years, Im getting into DE. But some people say that max I can become an Analytics Engineer. And that there's a ceiling above which Software Engineering knowledge like networking, security, algos is required. How true is this?",101,0.92,49,https://www.reddit.com/r/dataengineering/comments/1me6rsv/how_far_can_you_go_into_data_engineering_without/,2025-07-31 16:49:11,2025-08-02 01:48:14
1mdb9p7,10 Years of Generative AI Slop,Any_Rip_388,dataengineering,"[https://bauer.codes/post/2025/01/10-years-of-genai-slop/](https://bauer.codes/post/2025/01/10-years-of-genai-slop/)I thought this article was so well written and makes a lot of great points. I haven't seen it posted here before, so thought it would be a fun discussion.TLDR - we are already drowning in enterprise system complexity. 2x or 10x'ing the size of our codebases via LLM generated code that we don't understand is going to be an absolute disaster.",92,0.94,11,https://www.reddit.com/r/dataengineering/comments/1mdb9p7/10_years_of_generative_ai_slop/,2025-07-30 16:30:53,2025-08-02 01:48:14
1mdeifk,Interviewed and got hired for data engineer role but assigned Java project.,Ben4896,dataengineering,"As the title says, interviewed for 1 month multiple rounds and finally got hired. After joinininh the team, realized I was assigned a Java project. I have around 5 years of experience as data analyst and data engineer, should I reach out to HR, manager or the director ? Have basic knowledge in Java and getting stressed out(Imposter syndrome). I rejected other offer because of this one.Thanks in advance for the responses. Edit 1: it’s not anything close to data engineering, no where wiring spark jobs, it’s pure Java backend. Have asked one of my friend who does Java backend, and he wasn’t able to understand the code. He told to switch if I don’t wanna make myself miserable.",92,0.94,55,https://www.reddit.com/r/dataengineering/comments/1mdeifk/interviewed_and_got_hired_for_data_engineer_role/,2025-07-30 18:32:16,2025-08-02 01:48:14
1mf5ccy,Why don’t companies hire for potential anymore?,AdNext5396,dataengineering,I moved from DS to DE 3 years ago and I was hired solely based on my strong Python and SQL skills and learned everything else on the job. But lately it feels like companies only want to hire people who’ve already done the exact job before with the exact same tools. There’s no room for learning on the job even if you have great fundamentals or experience with similar tools.Is this just what happens when there’s more supply than demand?,107,0.95,46,https://www.reddit.com/r/dataengineering/comments/1mf5ccy/why_dont_companies_hire_for_potential_anymore/,2025-08-01 19:09:22,2025-08-02 01:48:14
1mb6wqc,How should I “properly learn” about Data Engineering as a beginner?,Cluelessjoint,dataengineering,"For context, I do not have a CS background (Stats major) but do have experience with Python & SQL and have used platforms like GCP & Databricks. Currently a Data Analyst intern, but super eager to learn more about the “background” processes that support downstream analytics.I apologize ahead of time if this is a silly question - but would really appreciate any advice or guidance within this field! I’ll try to narrow down my questions to a couple points (for now) :disguised_face:1. Would you ever recommend going to school/some program for Data Engineering? (Which ones if so?)2. What are some useful resources to build my skills “from the ground up” such that I’m learning the best practices (security, ethics, error handling) - I’ve begun to look into personal projects and online videos but realize many of these don’t dive into the “Why” of things which I’m always curious about.3. Share your experience about the field! (please) Would love to hear how you got started (Education, early career), what worked what didn’t, where you’re at now and what someone looking to break into the field should look out for now.Ik this is a lot so thank you for any time you put into responding!",82,0.95,40,https://www.reddit.com/r/dataengineering/comments/1mb6wqc/how_should_i_properly_learn_about_data/,2025-07-28 04:32:27,2025-08-02 01:48:14
1meupk9,DocStrange - Open Source Document Data Extractor,LostAmbassador6872,dataengineering,"Sharing **DocStrange**, an open-source Python library that makes document data extraction easy.* **Universal Input**: PDFs, Images, Word docs, PowerPoint, Excel* **Multiple Outputs**: Clean Markdown, structured JSON, CSV tables, formatted HTML* **Smart Extraction**: Specify exact fields you want (e.g., ""invoice\_number"", ""total\_amount"")* **Schema Support**: Define JSON schemas for consistent structured output**Data Processing Options*** **Cloud Mode**: Fast and free processing with minimal setup* **Local Mode**: Complete privacy - all processing happens on your machine, no data sent anywhere, works on both cpu and gpu**Quick start:** from docstrange import DocumentExtractor extractor = DocumentExtractor() result = extractor.extract(""research_paper.pdf"") # Get clean markdown for LLM training markdown = result.extract_markdown()**CLI** pip install docstrange docstrange document.pdf --output json --extract-fields title author date**Links:*** PyPI: [https://pypi.org/project/docstrange/](https://pypi.org/project/docstrange/)* Github: [https://github.com/NanoNets/docstrange](https://github.com/NanoNets/docstrange)",84,0.97,5,https://www.reddit.com/gallery/1meupk9,2025-08-01 12:07:00,2025-08-02 01:48:14
1macii2,Do you care about data architecture at all?,JasonMckin,dataengineering,"A long time ago, data engineers actually had to care about architecting systems to optimize the cost and speed of storage and processing.In a totally cloud-native world, do you care about any of this? I see vendors talking about how their new data service is built on open source, is parallel, scalable, indexed, etc and I can’t tell why you would care?Don’t you only care that your team/org has X data to be stored and Y latency requirements on processing it, and give the vendor with the cheapest price for X and Y? What are reasons that you still care about data architecture and all the debates about Lakehouse vs Warehouse, open indexes, etc? If you don’t work at one of those vendors, why as a consumer data engineer would you care?",63,0.88,48,https://www.reddit.com/r/dataengineering/comments/1macii2/do_you_care_about_data_architecture_at_all/,2025-07-27 03:45:45,2025-08-02 01:48:14
1maijoh,What's the future of DE(Data Engineer) as Compared to an SDE,LawfulnessMammoth822,dataengineering,"Hi everyone,I'm currently a Data Analyst intern at an International certification company(not an IT), but the role itself is pretty new here(as it is not an IT company) and they confused it to Data Engineering, so the project I have received are mostly designing ETL/ELT pipelines, Develop API's and experiment with Orchestration tools that is compactable with their servers(for prototyping)—so I'm often figuring things out on my own. I'm passionate about becoming a strong Data Engineer and want to shape my learning path properly.That said, I've noticed that the DE tech stack is very different from what most Software Engineers use. So I’d love some advice from experienced Data Engineers -Which tools or stacks should I prioritize learning now as I have just joined this field?What does the future of Data Engineering look like over the next 3–5 years?How to boost my Carrer?Thank You",61,0.89,27,https://www.reddit.com/r/dataengineering/comments/1maijoh/whats_the_future_of_dedata_engineer_as_compared/,2025-07-27 10:00:46,2025-08-02 01:48:14
1mab3ww,An open-source alternative to Yahoo Finance's market data python APIs with higher reliability.,Mammoth-Sorbet7889,dataengineering,Hey folks! :waving_hand:I've been working on this Python API called[ defeatbeta-api](https://github.com/defeat-beta/defeatbeta-api) that some of you might find useful. It's like yfinance but without rate limits and with some extra goodies:• Earnings call transcripts (super helpful for sentiment analysis) • Yahoo stock news contents • Granular revenue data (by segment/geography) • All the usual yahoo finance market data stuffI built it because I kept hitting yfinance's limits and needed more complete data. It's been working well for my own trading strategies - thought others might want to try it too.Happy to answer any questions or take feature requests!,52,0.94,10,https://www.reddit.com/r/dataengineering/comments/1mab3ww/an_opensource_alternative_to_yahoo_finances/,2025-07-27 02:30:15,2025-08-02 01:48:14
1mb6ar1,Boring Technology Club,Nekobul,dataengineering,"[https://boringtechnology.club/](https://boringtechnology.club/)Interesting web page. A quote from it:""software that’s been around longer tends to need less care and feeding than software that just came out.""",44,0.88,13,https://www.reddit.com/r/dataengineering/comments/1mb6ar1/boring_technology_club/,2025-07-28 03:59:27,2025-08-02 01:48:14
1md072b,Native Spark comes to Snowflake!,v0nm1ll3r,dataengineering,Quite big industry news industry news in my opinion. Thoughts?,50,0.92,18,https://www.snowflake.com/en/blog/snowpark-connect-apache-spark-preview/,2025-07-30 07:28:54,2025-08-02 01:48:14
1mc5pnc,"What's going on with these interviews nowadays? did what was supposed to be ""technical"" intervievv but appeared to be like a university exam with too much theory",HMZ_PBI,dataengineering,"Is it just me? Did a technical intervievv in which i was expecting to be given real case exercices to solve, to write some code, but at the end they just started to ask be about only theorical questions like if we are in a university exam, like what is Encapsulation based programming (instead of saying OOP they said a damn synonym like now we must know all the synonyms of the term OOP to be data engineers) Come one man take it easy, we can't remember the definition of every term in data engineering, let alone synonyms.",43,0.87,20,https://www.reddit.com/r/dataengineering/comments/1mc5pnc/whats_going_on_with_these_interviews_nowadays_did/,2025-07-29 08:11:41,2025-08-02 01:48:14
