id,title,author,subreddit,content,score,upvote_ratio,num_comments,url,created_utc,extracted_at
1mc96xi,"Unemployed since May 2023, desperately need advice!",DatEngGirl,cscareerquestions,"I graduated in May 2023 with a bachelor's degree in SWE and one QA internship. After graduation, I completed an unpaid full-stack internship, which was mainly frontend development. Since then, I’ve been actively applying to jobs across different types of companies including startups, large firms, remote, on-site and hybrid roles. Despite sending out around 50-70 applications a day, I rarely hear back. Ive even been reaching out to recruiters on LinkedIn, and barely anything.I’ve revised my resume countless times. I’ve learned Spring Boot and am currently working on a backend project to showcase that. I also practice LeetCode daily.Out of desperation, I joined mthree in June, which is supposed to be a training-to-placement program, but they haven’t started training me yet. Feels like a waste of my time.Atp I feel like im doomed and unemployable. I've applied for QA, support, SWE, data scientist, even HR and solutions engineer. I just dont get it.For context, I’m applying throughout the U.S. and a bit in Canada (dual citizen).What the hell do I even pivot into atp? Ive already tried applying for adjacent tech roles.Edit 1: Since people are commenting on the 50-70 jobs, I know 50-70 sounds intense but I apply to jobs in both Canada and USA. I have over 15 job board sites I use daily, so every one hour I'm able to find 8-10 relevant entry-level roles and apply. By the end of the day I have 50-70 jobs applied to. I also avoid easy apply and apply directly on sites.Edit 2: Here is my resume: https://drive.google.com/file/d/16adhrvKm0kb0D_pN9hHNyOuiS30Tti5w/view?usp=sharingSome comments regarding my resume:My resume is a simple Word document. I reduced my bullet points down from five to three to keep things concise and less cluttered, as I was advised. Some of the technologies and tools I listed aren’t part of my projects or internship, but I do know them, I might just be a little rusty since it’s been a while since I last used some.Edit 3: Figured since this is still getting traction that I will write down what are the new changes I've been told to make:1. Contribute to open-source projects2. Bold technologies in projects/internships3. Apply to less jobs, focus on adding cover letter & tailoring cv to roles (+ make a few different CVs depending on what sort of role im targeting such as front-end, back-end, etc)4. Get rid of mthree experience5. Reduce technical skills6. Remove GPA7. Stick to applying locally and not country-wide or cross country because they will filter you out.",91,0.89,82,https://www.reddit.com/r/cscareerquestions/comments/1mc96xi/unemployed_since_may_2023_desperately_need_advice/,2025-07-29 11:44:44,2025-08-02 01:48:16
1mdmbzg,Where do you get the energy for your side projects?,Weemstar,cscareerquestions,"CS grad (2023) here. Been working an IT job the last year and some change, but I don’t really like it. The whole reason I even got into IT in the first place is because I couldn’t get a job in software (I had *one* really good prospect in defense because graduates from my school are sought after by that sector, but I didn’t pursue it because of ethics). I keep trying to commit to a side project. I LOVE graphics programming. I took a couple of OpenGL-based classes in college and it completely reignited my love for computer science and turned around an otherwise unremarkable CS degree. The trouble is, I just don’t have the energy. I get home from work, take a shower, go to my computer, and just…can’t. Any advice from the professionals?",94,0.96,39,https://www.reddit.com/r/cscareerquestions/comments/1mdmbzg/where_do_you_get_the_energy_for_your_side_projects/,2025-07-30 23:45:26,2025-08-02 01:48:16
1mestuk,4 years in and still writing the same type of tickets- how do you brea-out of the mid level dev trap?,No-Emu-6641,cscareerquestions,"I’ve been a software engineer for 4 years now, and lately I’ve started to feel like I’m stuck in some kind of loop.I’m technically mid-level, but my day-to-day hasn’t changed in years. I’m still picking up the same kinds of tickets — bug fixes, basic features, occasional cleanup work. Nothing high-impact, nothing strategic. I rarely get asked for input in planning or architecture discussions. It’s like I’m just… there, floating.It’s not that I hate the work. I just thought by now I’d be doing more — maybe mentoring junior devs, leading small projects, or at least working on something that pushes me. But I feel invisible. I get decent performance reviews, but no real guidance on how to grow or get to the next level.What’s worse is, I don’t even know what to do differently. Speak up more? Build something on the side? Apply elsewhere? I keep waiting for some kind of sign that I’m ready, but I’m starting to realize that no one’s coming to hand me that next step.If you’ve been stuck in the “mid-level trap,” how did you break out of it? What helped you move forward?",88,0.95,23,https://www.reddit.com/r/cscareerquestions/comments/1mestuk/4_years_in_and_still_writing_the_same_type_of/,2025-08-01 10:24:38,2025-08-02 01:48:16
1mcqr3o,9 months unemployed 2.5YOE... What should I even do?,VanillaAble4188,cscareerquestions,"I'm at my wit's end and could really use a reality check from the community. Got laid off from my first SWE job 9 months ago. Since then, I've sent out thousands of applications and have gotten zero interviews. Not a single one. I'm applying to at least 10-20 jobs a day on LinkedIn, Indeed, etc. I've easily cleared 1,500+ applications at this point. Anything that seems like a fit. Software Engineer, Software Developer, Automation Engineer, Test Engineer, Embedded Software Engineer... if it involves code, and 60-80% of the keywords apply to my experience, I'm probably applying. I'm applying to both remote (preferred) and on-site roles, especially in major tech hubs. I live in NYC and mostly apply to NYC jobs because i likely get filtered out for a lot of other ones. Absolute nothing. Zero. No interviews. No screener calls from recruiters. I barely even get the automated ""thanks but no thanks"" emails anymore. It feels like my resume is going directly into a trash can.I'm 27 and feeling like my career is over before it really began. I'm open to any and all brutal feedback. Background:* Experience: 2.5 YOE at a hardware/software startup. I was unfortunately part of a layoff due to the company losing major government contracts.* What I Did: I wasn't just a cog in a wheel. I designed and built the company's core application framework from the ground up using Python and PyQt. This app controlled hardware in real-time, managed data, and visualized results. I have a very hands-on, end-to-end background.* Core Skills: * Python: Very strong. Built entire applications, GUIs, data analysis pipelines. * C/C++: Wrote the embedded firmware for all our custom-designed hardware. (which i custom designed PCBs and everything). * SQL (PostgreSQL): Designed and managed the database for all experiment data logging. * Hardware Integration: This is where I might be too ""niche."" I designed the PCBs (KiCad), synchronized hardware triggers (TTL), and worked with DAQs and many other electrical components. I have experience making software and hardware talk to each other.",84,0.94,67,https://www.reddit.com/r/cscareerquestions/comments/1mcqr3o/9_months_unemployed_25yoe_what_should_i_even_do/,2025-07-29 23:17:35,2025-08-02 01:48:16
1meprm4,How do you tell if someones github project was written entirely by chatgpt,TeletubbyFundManager,cscareerquestions,So alot of candidates have their github links in their profiles and I’m trying to identify if their projects are legit in the form that they’ve said they built it and not entire just produced by AI. What is an effective way to do this pre interview stage. Usually I can tell during an interview just asking about decisions made etc.,85,0.79,116,https://www.reddit.com/r/cscareerquestions/comments/1meprm4/how_do_you_tell_if_someones_github_project_was/,2025-08-01 07:09:50,2025-08-02 01:48:16
1mc5iav,Dealing with a bully that no one wants to acknowledge? A principal dev has it out for me and it is really weirding me out.,Frosty_Tie1227,cscareerquestions,"I have been at this job for barely 4 months now. While I only have a few years under my belt and this was my first job as a mid level dev. Since day one this person bob (not real name) has been very uhm negative and aggressive towards me. Bob is not really part of the team but he created and maintains one of our core APIs that I work heavily on. I have followed his code styles / testing strategy to the letter but it is never good enough. He will often just take my PR reject it then post a PR that is 95% the same. Like he will take my PR and make it more ""pythonic"" or better except half the time I don't even understand the point of the changes. Except it shows he did the work. Multiple times during our bi weekly demo meetings he is hyper critical of even the most simple things. He doesnt just do it to me but some others. Last week I demoed something I was proud of I fixed a number of major issues we had and people were impressed except Bob who raked me over the coals about everything before loudly saying what I did was useless as he was going to rewrite all that stuff anyways. Multiple times my manager and my skip have indirectly told him off. Even during meetings he will loudly try to interrupt me and others non stop and basically reframe what I am saying to imply he solved it. He won't talk to me directly, unless he wante something.My first week he basically demanded I do a ton of manual work for him. I had no idea who he was back then so I just said I have been given these other tasks by my manager. But offered to help when I get some free time. He told me I was useless and never responded to any of my questions after that. My manager knows about this, and told me it isn't the first time it has come up. But he cannot do anything about it. A few weeks ago we had our first two day long off-site. Ngl he acted like a high school bully to me and a number of other people. It got so bad that our VP of product told him he was being an asshole. On Wednesday I have been informed I will be having my first 1on1 with our VP of engineering. - should I bring up Bob or will it sound too whiney?- any tips?",77,0.93,40,https://www.reddit.com/r/cscareerquestions/comments/1mc5iav/dealing_with_a_bully_that_no_one_wants_to/,2025-07-29 07:58:16,2025-08-02 01:48:16
1mai8xh,Should I quit my masters,Rude-Vegetable1568,cscareerquestions,"I did my bachelors in CS at a pretty solid school but wasn’t able to secure any internships during my undergrad, and after 6 months of applying to full time, and not getting a single interview, I decided to apply to masters programs. Of my acceptances USC was the best so I decided to commit.I’m about to finish up my first semester here, but I’m one of the 5-10 domestic students in both of my classes of 200. Nothing against international students, but it seems like 95% of people are here for the visa, and the program itself doesn’t provide much value for jobs. I heard a lot about “omg the Trojan alumni network” but ngl it’s not any better than any other T50, if not worse cuz it’s so oversaturated. money isn’t an issue but I feel like I’m repeating undergrad and wasting 2 years..",78,0.85,29,https://www.reddit.com/r/cscareerquestions/comments/1mai8xh/should_i_quit_my_masters/,2025-07-27 09:41:08,2025-08-02 01:48:16
1matat4,HR thinks building a SAAS replacement is easy,Vegetable-Ad7097,cscareerquestions,"I have a computer science degree and couldn't find a job after my return offer from an internship was pulled because of funding. I found a job at a law firm, which I've been regretting ever since I started. There were a lot of red flags when I started. I found out on the first day that I was a contract worker and not a w-2 employee, this was not mentioned in the interview. I also found out a couple days after I started that the job title changed after I interviewed for a business analyst role, I only found out when I looked at an org chart.The attorney has barely said a few words to me and anytime she does it feels like she's just talking at me. I haven't gotten any feedback on anything other than random email replies with the word ""good"". I've had 1-on-1's scheduled but they always never show up or get busy. I always get conflicting instructions, one day she emails me that I need to automate things, the next day I have to justify why programming takes so long. The following day I'm told I need to only do my job title, then the next week she said I stopped programming and need to figure out how to do both.Last week, I was asked to meet with the new HR person who has been firing 2-3 people a week since she started. When I get to her office she told me she wanted to talk about my performance. She said I'm taking too long to finish my programming tasks. She said at her old company they were able to build an architecture, build complete features in 1-2 hours and an entire system in less than a year for all the departments that was even HIPAA compliant. I asked how many developers they had and what was their background. She said there were only 2 people and they weren't even developers but was able to ""just get it to work"". I've been there less than 3 months and already deployed an application that decreased their intake process time by over 75% since they did everything manually in word documents. They think I can develop a replacement for a SAAS they don't want to pay for, but want me to ""figure it out"" when I say it's impossible. I know I need to quit, but how bad does it look on my resume since I've only been working a few months?",70,0.83,34,https://www.reddit.com/r/cscareerquestions/comments/1matat4/hr_thinks_building_a_saas_replacement_is_easy/,2025-07-27 18:12:12,2025-08-02 01:48:16
1mbh9up,"Received offer about 20% higher for a similar role, should I ask for a raise?",alexmtl,cscareerquestions,"Just curious if it's appropriate to use linkedin job offers to ask for a raise. I am fairly confident in my abilities and I think I perform better than my peers. Never struggled to find a job (only had 3 software dev jobs in my 20 years career so far though).I have been at my current company for 10 years now. I asked for a significant raise once about 5 years ago because I realized I was paid less than a colleague even though I was the lead. Other than that I usually get the usual 3% salary bump every year, nothing significant.Ideally I would prefer to stay at my job. I like the job, my coworkers and the company. But it's always a challenge to know I could be making that much more (and they also offer 2 more weeks of vacation per year) elsewhere. Both jobs are 100% remote, so no change there.So basically my question is, what is the norm out there? Is it ""too much"" to ask for a significant salary raise again if I asked for one (and got it) 5 years ago?",69,0.85,66,https://www.reddit.com/r/cscareerquestions/comments/1mbh9up/received_offer_about_20_higher_for_a_similar_role/,2025-07-28 14:12:20,2025-08-02 01:48:16
1mdsaxw,Is it weird to bring in a pie to work?,cooltunes186,cscareerquestions,So I literally started a week ago and it’s a hybrid schedule. There is like 7-12 ppl in the office on my team each in person day and we have a daily meeting. I have some berries that are gonna go bad soon so I was thinking of making a pie and bringing it into work. Is that weird? Everyone else on the team is like minimum 4 years older than me.Edit: is it horrible that I’m actually trying to bribe my coworkers to like me with baked goods. Additional question: do you think it’s going to work?,58,0.86,77,https://www.reddit.com/r/cscareerquestions/comments/1mdsaxw/is_it_weird_to_bring_in_a_pie_to_work/,2025-07-31 04:36:41,2025-08-02 01:48:16
1mav9ti,Should I take the risk and get a new job or accept this is how software dev is?,GaslightingGreenbean,cscareerquestions,"one year experience. here's what's going on that I don't like:1. no breaks between sprints. No dedicated time for learning, or interval sprint for learning, yet there are hours of learning requirements that basically end up requiring overtime to get done.2. short ""technical onboarding program"" was not useful for what i'm doing on my team3. Don't like my team. mean tech lead, scrum master that blames people. asking questions gets uncomfortable. Tech lead gets very irritable very fast. I’d code and he’d giggle and be like “what are you doing.” Small team. This is the biggest problem. tech lead told me 6 months in “I don’t even know how to help you. Help me help you.” I do all my user stories, communicate blockers, never caused carry over or even a defect. Received multiple certifications. 4. Disorganized leadership. ""everyone in the department do the same amount of points""(7+). Told me I didn't have to do that since that's for seniors and up, then received bad feedback for not doing that amount of points.5. Seemingly little interest in growing me as a professional or if I even like it here. Getting 60 bucks for a bus ticket to a tech event required a whole written document. Not a lot of social opportunities and I have no time too anyways. Asked to be in specialized training programs for cloud skills and got ghosted as usual. Main focus is how I can use gen ai to do more of their work.6.Still have no goals in workday. Don't know if I'm doing well or not and am afraid to ask at this point. But bright side is I'm learning a LOT, do work with aws, and do code every day. Is this all just normal and should I kinda suck it up and stick with it or would I most likely just be better off somewhere else?I can’t switch teams or managers.EDIT:,oh yeah this is important but I never wanted to do software dev my entire life. I’m getting an mba. Technical leadership is my goal at the moment. I just want a tech basis first, that’s why I have certs in ai and the cloud. I just want to be able to grow in a place that is optimal for my growth and doesn’t like, burn me out.",50,0.85,46,https://www.reddit.com/r/cscareerquestions/comments/1mav9ti/should_i_take_the_risk_and_get_a_new_job_or/,2025-07-27 19:31:16,2025-08-02 01:48:16
1merg07,How many companies have actually replaced a significant number of roles with AI? I can only find seven.,WpgMBNews,cscareerquestions,"- (1) IBM replaced ~200 HR roles with AI agents as part of broader layoffs (~8,000 jobs), specifically citing automation as the reason - (2) The Commonwealth Bank of Australia (CBA) eliminated 45‑90 jobs tied to transitioning to AI voice systems <---**this one announced just three days ago**- (3) Atlassian announced 150 job cuts linked to AI improvements - (4) Klarna has discussed replacing equivalent of 700 customer‑service jobs via AI systems- (5) Duolingo phased out roughly 10% of its contractor workforce (over 10 individuals); full‑time staff were unaffected- (6) Dropbox (~500 jobs / ~16% workforce) - (7) Salesforce ( ~700 jobs )Chat Tool Whose Name Need Not Be Spoken says *""Broader surveys (e.g. Challenger, Gray & Christmas reported 3,900 U.S. jobs lost to AI in May 2025) suggest widespread impact across companies, but most individual companies didn’t break out count‑specific details publicly.""*How many existing and potential jobs do you think have really been lost?",53,0.91,58,https://www.reddit.com/r/cscareerquestions/comments/1merg07/how_many_companies_have_actually_replaced_a/,2025-08-01 08:59:34,2025-08-02 01:48:16
1mbcovz,Worst career move ever (did I cook myself)?,trashsadaccount,cscareerquestions,"Hi,I'm 25, based in EU, graduated in 2024 in computer engineering from high tier european unis. Got lucky enough to get an internship in Big Tech last year and received a full time offer to work in my home country (Southern Europe)In countries like mine there are no engineering hubs, only cloud sales hubs where the most tech-heavy role is cloud architect. I ended up working in technical presales (very strong focus on AI Platform) for 1.5 years and realized having a sales-oriented role is not really my thing, and I was risking building a career that could only lead to commercial roles, so I decided to look for software engineer openings internally and externally.Found an opening for A DIFFERENT big tech role in AI software engineering (based in EU, Eastern Europe) and decided to pursue that opportunity. I am quite happy with my choice, but most of the managers discussed this choice with are telling me that AI will come to replace many SWEs and I need to consider this, as if they're saying 'you messed up with this one'.I mean, they're people that do not really come from engineering and spent their life in salesy roles but these words combined with the gloomy outlook I'm seeing here online have me concerned that I should have just swallowed my dislike for business talks and stick to my already privileged position, even if it's not aligned to my liking and the career path I imagine myself pursuing.What do you think? Would you have done the same? Thx",42,0.76,30,https://www.reddit.com/r/cscareerquestions/comments/1mbcovz/worst_career_move_ever_did_i_cook_myself/,2025-07-28 10:36:00,2025-08-02 01:48:16
1mejm3z,Getting a job in Software,ItzDubzmeister,cscareerquestions,"I’d love to hear from people who have gotten a programming job in the last few years (in the states), and how you did it. I barely get any interviews, maybe 3-5 a year, and just have been struggling.A little bit about me, graduated with bachelors in 2022, interned out of college til 23, haven’t gotten a job offer since. Applying for anything 1-2 years experience or less (and at least some working knowledge of the technologies asked), made a portfolio, have worked on a lot of small projects (game jams, simple web apps) and now working on a larger one (full stack dashboard app, mainly finance tracker at the moment) to improve my skills and try to stand out. Attended online events, career fairs, and public conferences to try and network, but most people that I meet there are in the same boat. Modify resume/cover letters to the jobs, and have talked with many career counselors/HR members to go over my resume and cover letters. When talking with anyone in the industry I keep getting told “you’re doing everything right, just keep at it!” I’ve been “keeping at it” for 2 years now, just getting me down to have 0 success, and barely any to even get an interview. So, for all you successful individuals out there, please share your stories to help motivate me.Thanks :)",40,0.87,40,https://www.reddit.com/r/cscareerquestions/comments/1mejm3z/getting_a_job_in_software/,2025-08-01 01:33:44,2025-08-02 01:48:16
1mdgdxa,I'm enrolled majoring in CS. I'm scared that it's going to be useless in the future.,Automatic-Package-37,cscareerquestions,"I just enrolled in my college with CS. Ever since I did I've been seeing videos and reddit posts that CS is bad and it's a gateway to be homeless. I like coding, not because I get to use my pc all day but because I like the challenge it makes. I'm just worried about my future and whether I should switch into something like computer engineering or IT or going to mechanical engineering. I don't want to end up in minimum wage but beggars can't be choosers.",41,0.67,90,https://www.reddit.com/r/cscareerquestions/comments/1mdgdxa/im_enrolled_majoring_in_cs_im_scared_that_its/,2025-07-30 19:43:20,2025-08-02 01:48:16
